{"round": 94, "iter": "iter94", "bottleneck": "memory_bound", "idea": "config exploration iter94", "category": "tiling", "expected_gain": "+5 TFLOPS", "decision": "COMPILE_FAIL", "tflops": 0.0, "timestamp": "2026-04-21T11:55:34Z"}
{"round": 95, "iter": "iter95", "bottleneck": "memory_bound", "idea": "config exploration iter95", "category": "tiling", "expected_gain": "+5 TFLOPS", "decision": "COMPILE_FAIL", "tflops": 0.0, "timestamp": "2026-04-21T11:55:35Z"}
{"round": 96, "iter": "iter96", "bottleneck": "memory_bound", "idea": "config exploration iter96", "category": "tiling", "expected_gain": "+5 TFLOPS", "decision": "COMPILE_FAIL", "tflops": 0.0, "timestamp": "2026-04-21T11:55:35Z"}
{"round": 97, "iter": "iter97", "bottleneck": "memory_bound", "idea": "config exploration iter97", "category": "tiling", "expected_gain": "+5 TFLOPS", "decision": "COMPILE_FAIL", "tflops": 0.0, "timestamp": "2026-04-21T11:55:36Z"}
{"round": 98, "iter": "iter98", "bottleneck": "memory_bound", "idea": "config exploration iter98", "category": "tiling", "expected_gain": "+5 TFLOPS", "decision": "DISCARD", "tflops": 356.4, "timestamp": "2026-04-21T11:55:36Z"}
{"round": 99, "iter": "iter99", "bottleneck": "memory_bound", "idea": "config exploration iter99", "category": "tiling", "expected_gain": "+5 TFLOPS", "decision": "DISCARD", "tflops": 366.13, "timestamp": "2026-04-21T11:55:36Z"}
{"round": 100, "iter": "iter100", "bottleneck": "memory_bound", "idea": "config exploration iter100", "category": "tiling", "expected_gain": "+5 TFLOPS", "decision": "DISCARD", "tflops": 338.78, "timestamp": "2026-04-21T11:55:37Z"}
