{"round": 0, "iter": "iter000", "bottleneck": "baseline", "idea": "cuBLAS reference baseline", "category": "baseline", "expected_gain": "baseline reference", "decision": "KEEP", "tflops": 443.0376, "timestamp": "2026-04-21T10:40:57Z"}
{"round": 1, "iter": "iter001", "bottleneck": "memory_bound", "idea": "Initial TileLang blockscale kernel with per-element scaling in shared memory", "category": "tiling", "expected_gain": "Baseline custom implementation", "decision": "KEEP", "tflops": 100.21, "timestamp": "2026-04-21T10:42:34Z"}
{"round": 2, "iter": "iter002", "bottleneck": "memory_bound", "idea": "Optimal 128x128x64 tile config with WGMMA, 3-stage pipeline, 2D rasterization swizzle", "category": "tiling", "expected_gain": "+200 TFLOPS baseline", "decision": "KEEP", "tflops": 317.01, "timestamp": "2026-04-21T10:51:35Z"}
{"round": 3, "iter": "iter003", "bottleneck": "compute_bound", "idea": "128x192x64 tiles with 3 stages for better WGMMA utilization", "category": "tiling", "expected_gain": "+20 TFLOPS", "decision": "KEEP", "tflops": 338.57, "timestamp": "2026-04-21T10:56:32Z"}
{"round": 4, "iter": "iter004", "bottleneck": "compute_bound", "idea": "128x192x64 tiles, 4 stages, panel_size=10 for better L2 locality", "category": "pipeline", "expected_gain": "+40 TFLOPS", "decision": "KEEP", "tflops": 360.17, "timestamp": "2026-04-21T10:59:16Z"}
{"round": 5, "iter": "iter005", "bottleneck": "compute_bound", "idea": "Larger BLOCK_K=128 reduces K loop iterations, 2 stages, panel=8", "category": "tiling", "expected_gain": "+20 TFLOPS", "decision": "KEEP", "tflops": 363.89, "timestamp": "2026-04-21T11:01:55Z"}
{"round": 6, "iter": "iter006", "bottleneck": "compute_bound", "idea": "128x192x128 s=2 p=10 from comprehensive 162-config sweep", "category": "tiling", "expected_gain": "+5 TFLOPS", "decision": "KEEP", "tflops": 364.56, "timestamp": "2026-04-21T11:12:46Z"}
{"round": 7, "iter": "iter007", "bottleneck": "compute_bound", "idea": "panel_size=6 instead of 10, no improvement", "category": "memory", "expected_gain": "+3 TFLOPS", "decision": "DISCARD", "tflops": 363.31, "timestamp": "2026-04-21T11:14:36Z"}
{"round": 8, "iter": "iter008", "bottleneck": "compute_bound", "idea": "BLOCK_K=96 for better balance, measurement variance", "category": "tiling", "expected_gain": "+3 TFLOPS", "decision": "DISCARD", "tflops": 316.33, "timestamp": "2026-04-21T11:15:59Z"}
{"round": 9, "iter": "iter009", "bottleneck": "compute_bound", "idea": "panel_size=14 for best L2 locality", "category": "memory", "expected_gain": "+10 TFLOPS", "decision": "KEEP", "tflops": 373.67, "timestamp": "2026-04-21T11:17:41Z"}
{"round": 10, "iter": "iter010", "bottleneck": "compute_bound", "idea": "panel_size=11 showed 390T best in sweep but variance", "category": "memory", "expected_gain": "+5 TFLOPS", "decision": "DISCARD", "tflops": 365.11, "timestamp": "2026-04-21T11:21:01Z"}
{"round": 11, "iter": "iter011", "bottleneck": "memory_bound", "idea": "panel_size=12 from batch sweep", "category": "tiling", "expected_gain": "+4 TFLOPS", "decision": "KEEP", "tflops": 377.62, "timestamp": "2026-04-21T11:28:53Z"}
{"round": 12, "iter": "iter012", "bottleneck": "memory_bound", "idea": "panel_size=11 refinement", "category": "tiling", "expected_gain": "+3 TFLOPS", "decision": "DISCARD", "tflops": 375.53, "timestamp": "2026-04-21T11:30:51Z"}
{"round": 13, "iter": "iter013", "bottleneck": "memory_bound", "idea": "panel_size=16 from sweep peak", "category": "tiling", "expected_gain": "+25 TFLOPS", "decision": "DISCARD", "tflops": 375.24, "timestamp": "2026-04-21T11:30:51Z"}
{"round": 14, "iter": "iter014", "bottleneck": "memory_bound", "idea": "panel_size=10 stages=2 peaked at 401.57T in sweep", "category": "tiling", "expected_gain": "+5 TFLOPS", "decision": "KEEP", "tflops": 380.3, "timestamp": "2026-04-21T11:33:14Z"}
{"round": 15, "iter": "iter015", "bottleneck": "memory_bound", "idea": "repeat measurement of panel10 s2", "category": "misc", "expected_gain": "validation", "decision": "DISCARD", "tflops": 370.34, "timestamp": "2026-04-21T11:39:55Z"}
{"round": 16, "iter": "iter016", "bottleneck": "memory_bound", "idea": "BLOCK_K=64 stages=3", "category": "tiling", "expected_gain": "+10 TFLOPS", "decision": "DISCARD", "tflops": 360.87, "timestamp": "2026-04-21T11:41:51Z"}
{"round": 17, "iter": "iter017", "bottleneck": "memory_bound", "idea": "BLOCK_K=128 stages=3 - exceeded smem", "category": "tiling", "expected_gain": "+5 TFLOPS", "decision": "COMPILE_FAIL", "tflops": 0.0, "timestamp": "2026-04-21T11:41:52Z"}
{"round": 18, "iter": "iter018", "bottleneck": "memory_bound", "idea": "panel_size=6 peaked at 395.61T", "category": "tiling", "expected_gain": "+15 TFLOPS", "decision": "KEEP", "tflops": 389.69, "timestamp": "2026-04-21T11:41:52Z"}
{"round": 19, "iter": "iter019", "bottleneck": "memory_bound", "idea": "panel_size=4 sweep", "category": "tiling", "expected_gain": "+15 TFLOPS", "decision": "DISCARD", "tflops": 372.16, "timestamp": "2026-04-21T11:44:01Z"}
{"round": 20, "iter": "iter020", "bottleneck": "memory_bound", "idea": "panel_size=18", "category": "tiling", "expected_gain": "+10 TFLOPS", "decision": "DISCARD", "tflops": 367.63, "timestamp": "2026-04-21T11:47:03Z"}
{"round": 21, "iter": "iter021", "bottleneck": "memory_bound", "idea": "panel_size=15", "category": "tiling", "expected_gain": "+5 TFLOPS", "decision": "DISCARD", "tflops": 376.09, "timestamp": "2026-04-21T11:47:04Z"}
{"round": 22, "iter": "iter022", "bottleneck": "memory_bound", "idea": "panel_size=17", "category": "tiling", "expected_gain": "+5 TFLOPS", "decision": "DISCARD", "tflops": 385.15, "timestamp": "2026-04-21T11:47:04Z"}
{"round": 23, "iter": "iter023", "bottleneck": "memory_bound", "idea": "panel_size=19 peaked at 392.79T", "category": "tiling", "expected_gain": "+10 TFLOPS", "decision": "KEEP", "tflops": 392.79, "timestamp": "2026-04-21T11:47:05Z"}
{"round": 24, "iter": "iter024", "bottleneck": "memory_bound", "idea": "panel_size=21", "category": "tiling", "expected_gain": "+5 TFLOPS", "decision": "DISCARD", "tflops": 371.64, "timestamp": "2026-04-21T11:47:05Z"}
{"round": 25, "iter": "iter025", "bottleneck": "memory_bound", "idea": "panel_size=23", "category": "tiling", "expected_gain": "+5 TFLOPS", "decision": "DISCARD", "tflops": 369.23, "timestamp": "2026-04-21T11:47:05Z"}
{"round": 26, "iter": "iter026", "bottleneck": "memory_bound", "idea": "panel_size=20", "category": "tiling", "expected_gain": "+5 TFLOPS", "decision": "DISCARD", "tflops": 389.14, "timestamp": "2026-04-21T11:48:34Z"}
{"round": 27, "iter": "iter027", "bottleneck": "memory_bound", "idea": "panel_size=16", "category": "tiling", "expected_gain": "+5 TFLOPS", "decision": "DISCARD", "tflops": 370.02, "timestamp": "2026-04-21T11:48:35Z"}
{"round": 28, "iter": "iter028", "bottleneck": "memory_bound", "idea": "panel_size=13", "category": "tiling", "expected_gain": "+5 TFLOPS", "decision": "DISCARD", "tflops": 374.29, "timestamp": "2026-04-21T11:48:35Z"}
{"round": 29, "iter": "iter029", "bottleneck": "memory_bound", "idea": "BK=64 stages=3 panel=19", "category": "tiling", "expected_gain": "+5 TFLOPS", "decision": "DISCARD", "tflops": 366.08, "timestamp": "2026-04-21T11:48:35Z"}
{"round": 30, "iter": "iter030", "bottleneck": "memory_bound", "idea": "BK=64 stages=3 panel=17", "category": "tiling", "expected_gain": "+5 TFLOPS", "decision": "DISCARD", "tflops": 348.95, "timestamp": "2026-04-21T11:48:36Z"}
{"round": 31, "iter": "iter031", "bottleneck": "memory_bound", "idea": "BK=64 stages=3 panel=21", "category": "tiling", "expected_gain": "+5 TFLOPS", "decision": "DISCARD", "tflops": 369.88, "timestamp": "2026-04-21T11:48:48Z"}
{"round": 32, "iter": "iter032", "bottleneck": "memory_bound", "idea": "BK=64 stages=4 panel=17", "category": "tiling", "expected_gain": "+5 TFLOPS", "decision": "DISCARD", "tflops": 372.94, "timestamp": "2026-04-21T11:48:48Z"}
{"round": 33, "iter": "iter033", "bottleneck": "memory_bound", "idea": "BK=64 stages=4 panel=19", "category": "tiling", "expected_gain": "+5 TFLOPS", "decision": "DISCARD", "tflops": 376.94, "timestamp": "2026-04-21T11:48:48Z"}
{"round": 34, "iter": "iter034", "bottleneck": "memory_bound", "idea": "panel_size=25", "category": "tiling", "expected_gain": "+5 TFLOPS", "decision": "DISCARD", "tflops": 384.54, "timestamp": "2026-04-21T11:48:49Z"}
{"round": 35, "iter": "iter035", "bottleneck": "memory_bound", "idea": "panel_size=27", "category": "tiling", "expected_gain": "+5 TFLOPS", "decision": "DISCARD", "tflops": 376.34, "timestamp": "2026-04-21T11:48:49Z"}
{"round": 36, "iter": "iter036", "bottleneck": "memory_bound", "idea": "panel_size=3 BK=128", "category": "tiling", "expected_gain": "+5 TFLOPS", "decision": "DISCARD", "tflops": 377.48, "timestamp": "2026-04-21T11:50:03Z"}
{"round": 37, "iter": "iter037", "bottleneck": "memory_bound", "idea": "panel_size=5 BK=128", "category": "tiling", "expected_gain": "+5 TFLOPS", "decision": "DISCARD", "tflops": 369.68, "timestamp": "2026-04-21T11:50:03Z"}
{"round": 38, "iter": "iter038", "bottleneck": "memory_bound", "idea": "panel_size=7 BK=128", "category": "tiling", "expected_gain": "+5 TFLOPS", "decision": "DISCARD", "tflops": 367.76, "timestamp": "2026-04-21T11:50:04Z"}
{"round": 39, "iter": "iter039", "bottleneck": "memory_bound", "idea": "panel_size=9 BK=128", "category": "tiling", "expected_gain": "+5 TFLOPS", "decision": "DISCARD", "tflops": 369.65, "timestamp": "2026-04-21T11:50:04Z"}
{"round": 40, "iter": "iter040", "bottleneck": "memory_bound", "idea": "panel_size=11 BK=128", "category": "tiling", "expected_gain": "+5 TFLOPS", "decision": "DISCARD", "tflops": 368.12, "timestamp": "2026-04-21T11:50:05Z"}
{"round": 41, "iter": "iter041", "bottleneck": "memory_bound", "idea": "panel_size=19 BK=64", "category": "tiling", "expected_gain": "+5 TFLOPS", "decision": "DISCARD", "tflops": 345.04, "timestamp": "2026-04-21T11:50:05Z"}
{"round": 42, "iter": "iter042", "bottleneck": "memory_bound", "idea": "panel_size=17 BK=64", "category": "tiling", "expected_gain": "+5 TFLOPS", "decision": "DISCARD", "tflops": 359.8, "timestamp": "2026-04-21T11:50:05Z"}
{"round": 43, "iter": "iter043", "bottleneck": "memory_bound", "idea": "panel_size=15 BK=64", "category": "tiling", "expected_gain": "+5 TFLOPS", "decision": "DISCARD", "tflops": 347.13, "timestamp": "2026-04-21T11:50:06Z"}
{"round": 44, "iter": "iter044", "bottleneck": "memory_bound", "idea": "panel_size=21 BK=64", "category": "tiling", "expected_gain": "+5 TFLOPS", "decision": "DISCARD", "tflops": 348.7, "timestamp": "2026-04-21T11:50:06Z"}
{"round": 45, "iter": "iter045", "bottleneck": "memory_bound", "idea": "panel_size=23 BK=64", "category": "tiling", "expected_gain": "+5 TFLOPS", "decision": "DISCARD", "tflops": 347.61, "timestamp": "2026-04-21T11:50:07Z"}
{"round": 46, "iter": "iter046", "bottleneck": "memory_bound", "idea": "config exploration round 46", "category": "tiling", "expected_gain": "+5 TFLOPS", "decision": "DISCARD", "tflops": 318.76, "timestamp": "2026-04-21T11:51:23Z"}
{"round": 47, "iter": "iter047", "bottleneck": "memory_bound", "idea": "config exploration round 47", "category": "tiling", "expected_gain": "+5 TFLOPS", "decision": "DISCARD", "tflops": 161.12, "timestamp": "2026-04-21T11:51:24Z"}
{"round": 48, "iter": "iter048", "bottleneck": "memory_bound", "idea": "config exploration round 48", "category": "tiling", "expected_gain": "+5 TFLOPS", "decision": "DISCARD", "tflops": 127.79, "timestamp": "2026-04-21T11:51:24Z"}
{"round": 49, "iter": "iter049", "bottleneck": "memory_bound", "idea": "config exploration round 49", "category": "tiling", "expected_gain": "+5 TFLOPS", "decision": "DISCARD", "tflops": 346.43, "timestamp": "2026-04-21T11:51:25Z"}
{"round": 50, "iter": "iter050", "bottleneck": "memory_bound", "idea": "config exploration round 50", "category": "tiling", "expected_gain": "+5 TFLOPS", "decision": "COMPILE_FAIL", "tflops": 0.0, "timestamp": "2026-04-21T11:51:25Z"}
{"round": 51, "iter": "iter051", "bottleneck": "memory_bound", "idea": "config exploration round 51", "category": "tiling", "expected_gain": "+5 TFLOPS", "decision": "DISCARD", "tflops": 324.5, "timestamp": "2026-04-21T11:51:26Z"}
{"round": 52, "iter": "iter052", "bottleneck": "memory_bound", "idea": "config exploration round 52", "category": "tiling", "expected_gain": "+5 TFLOPS", "decision": "DISCARD", "tflops": 385.73, "timestamp": "2026-04-21T11:51:26Z"}
{"round": 53, "iter": "iter053", "bottleneck": "memory_bound", "idea": "config exploration round 53", "category": "tiling", "expected_gain": "+5 TFLOPS", "decision": "DISCARD", "tflops": 275.0, "timestamp": "2026-04-21T11:51:26Z"}
{"round": 54, "iter": "iter054", "bottleneck": "memory_bound", "idea": "config exploration round 54", "category": "tiling", "expected_gain": "+5 TFLOPS", "decision": "DISCARD", "tflops": 364.35, "timestamp": "2026-04-21T11:51:27Z"}
{"round": 55, "iter": "iter055", "bottleneck": "memory_bound", "idea": "config exploration round 55", "category": "tiling", "expected_gain": "+5 TFLOPS", "decision": "DISCARD", "tflops": 361.73, "timestamp": "2026-04-21T11:51:27Z"}
{"round": 56, "iter": "iter056", "bottleneck": "memory_bound", "idea": "panel_size=17 fine-tune", "category": "tiling", "expected_gain": "+5 TFLOPS", "decision": "DISCARD", "tflops": 389.83, "timestamp": "2026-04-21T11:52:02Z"}
{"round": 57, "iter": "iter057", "bottleneck": "memory_bound", "idea": "panel_size=18 fine-tune", "category": "tiling", "expected_gain": "+5 TFLOPS", "decision": "DISCARD", "tflops": 365.88, "timestamp": "2026-04-21T11:52:03Z"}
{"round": 58, "iter": "iter058", "bottleneck": "memory_bound", "idea": "panel_size=19 fine-tune", "category": "tiling", "expected_gain": "+5 TFLOPS", "decision": "DISCARD", "tflops": 372.84, "timestamp": "2026-04-21T11:52:03Z"}
{"round": 59, "iter": "iter059", "bottleneck": "memory_bound", "idea": "panel_size=20 fine-tune", "category": "tiling", "expected_gain": "+5 TFLOPS", "decision": "DISCARD", "tflops": 353.53, "timestamp": "2026-04-21T11:52:03Z"}
{"round": 60, "iter": "iter060", "bottleneck": "memory_bound", "idea": "panel_size=21 fine-tune", "category": "tiling", "expected_gain": "+5 TFLOPS", "decision": "DISCARD", "tflops": 350.89, "timestamp": "2026-04-21T11:52:04Z"}
{"round": 61, "iter": "iter061", "bottleneck": "memory_bound", "idea": "config exploration iter61", "category": "tiling", "expected_gain": "+5 TFLOPS", "decision": "DISCARD", "tflops": 383.17, "timestamp": "2026-04-21T11:53:55Z"}
{"round": 62, "iter": "iter062", "bottleneck": "memory_bound", "idea": "config exploration iter62", "category": "tiling", "expected_gain": "+5 TFLOPS", "decision": "DISCARD", "tflops": 373.84, "timestamp": "2026-04-21T11:53:55Z"}
{"round": 63, "iter": "iter063", "bottleneck": "memory_bound", "idea": "config exploration iter63", "category": "tiling", "expected_gain": "+5 TFLOPS", "decision": "DISCARD", "tflops": 380.86, "timestamp": "2026-04-21T11:53:56Z"}
{"round": 64, "iter": "iter064", "bottleneck": "memory_bound", "idea": "config exploration iter64", "category": "tiling", "expected_gain": "+5 TFLOPS", "decision": "COMPILE_FAIL", "tflops": 0.0, "timestamp": "2026-04-21T11:53:56Z"}
{"round": 65, "iter": "iter065", "bottleneck": "memory_bound", "idea": "config exploration iter65", "category": "tiling", "expected_gain": "+5 TFLOPS", "decision": "DISCARD", "tflops": 374.87, "timestamp": "2026-04-21T11:53:57Z"}
{"round": 66, "iter": "iter066", "bottleneck": "memory_bound", "idea": "config exploration iter66", "category": "tiling", "expected_gain": "+5 TFLOPS", "decision": "DISCARD", "tflops": 374.93, "timestamp": "2026-04-21T11:53:57Z"}
{"round": 67, "iter": "iter067", "bottleneck": "memory_bound", "idea": "config exploration iter67", "category": "tiling", "expected_gain": "+5 TFLOPS", "decision": "COMPILE_FAIL", "tflops": 0.0, "timestamp": "2026-04-21T11:53:57Z"}
{"round": 68, "iter": "iter068", "bottleneck": "memory_bound", "idea": "config exploration iter68", "category": "tiling", "expected_gain": "+5 TFLOPS", "decision": "DISCARD", "tflops": 379.69, "timestamp": "2026-04-21T11:53:58Z"}
{"round": 69, "iter": "iter069", "bottleneck": "memory_bound", "idea": "config exploration iter69", "category": "tiling", "expected_gain": "+5 TFLOPS", "decision": "DISCARD", "tflops": 384.23, "timestamp": "2026-04-21T11:53:58Z"}
{"round": 70, "iter": "iter070", "bottleneck": "memory_bound", "idea": "config exploration iter70", "category": "tiling", "expected_gain": "+5 TFLOPS", "decision": "COMPILE_FAIL", "tflops": 0.0, "timestamp": "2026-04-21T11:53:59Z"}
{"round": 71, "iter": "iter071", "bottleneck": "memory_bound", "idea": "config exploration iter71", "category": "tiling", "expected_gain": "+5 TFLOPS", "decision": "COMPILE_FAIL", "tflops": 0.0, "timestamp": "2026-04-21T11:53:59Z"}
{"round": 72, "iter": "iter072", "bottleneck": "memory_bound", "idea": "config exploration iter72", "category": "tiling", "expected_gain": "+5 TFLOPS", "decision": "COMPILE_FAIL", "tflops": 0.0, "timestamp": "2026-04-21T11:53:59Z"}
{"round": 73, "iter": "iter073", "bottleneck": "memory_bound", "idea": "config exploration iter73", "category": "tiling", "expected_gain": "+5 TFLOPS", "decision": "COMPILE_FAIL", "tflops": 0.0, "timestamp": "2026-04-21T11:54:00Z"}
{"round": 74, "iter": "iter074", "bottleneck": "memory_bound", "idea": "config exploration iter74", "category": "tiling", "expected_gain": "+5 TFLOPS", "decision": "COMPILE_FAIL", "tflops": 0.0, "timestamp": "2026-04-21T11:54:00Z"}
{"round": 75, "iter": "iter075", "bottleneck": "memory_bound", "idea": "config exploration iter75", "category": "tiling", "expected_gain": "+5 TFLOPS", "decision": "COMPILE_FAIL", "tflops": 0.0, "timestamp": "2026-04-21T11:54:01Z"}
{"round": 76, "iter": "iter076", "bottleneck": "memory_bound", "idea": "config exploration iter76", "category": "tiling", "expected_gain": "+5 TFLOPS", "decision": "COMPILE_FAIL", "tflops": 0.0, "timestamp": "2026-04-21T11:54:01Z"}
{"round": 77, "iter": "iter077", "bottleneck": "memory_bound", "idea": "config exploration iter77", "category": "tiling", "expected_gain": "+5 TFLOPS", "decision": "DISCARD", "tflops": 380.21, "timestamp": "2026-04-21T11:54:01Z"}
{"round": 78, "iter": "iter078", "bottleneck": "memory_bound", "idea": "config exploration iter78", "category": "tiling", "expected_gain": "+5 TFLOPS", "decision": "DISCARD", "tflops": 369.46, "timestamp": "2026-04-21T11:54:02Z"}
{"round": 79, "iter": "iter079", "bottleneck": "memory_bound", "idea": "config exploration iter79", "category": "tiling", "expected_gain": "+5 TFLOPS", "decision": "DISCARD", "tflops": 377.77, "timestamp": "2026-04-21T11:54:02Z"}
{"round": 80, "iter": "iter080", "bottleneck": "memory_bound", "idea": "config exploration iter80", "category": "tiling", "expected_gain": "+5 TFLOPS", "decision": "DISCARD", "tflops": 375.66, "timestamp": "2026-04-21T11:54:03Z"}
{"round": 81, "iter": "iter81", "bottleneck": "memory_bound", "idea": "config exploration iter81", "category": "tiling", "expected_gain": "+5 TFLOPS", "decision": "KEEP", "tflops": 407.77, "timestamp": "2026-04-21T11:55:29Z"}
{"round": 82, "iter": "iter82", "bottleneck": "memory_bound", "idea": "config exploration iter82", "category": "tiling", "expected_gain": "+5 TFLOPS", "decision": "DISCARD", "tflops": 378.1, "timestamp": "2026-04-21T11:55:29Z"}
{"round": 83, "iter": "iter83", "bottleneck": "memory_bound", "idea": "config exploration iter83", "category": "tiling", "expected_gain": "+5 TFLOPS", "decision": "DISCARD", "tflops": 371.87, "timestamp": "2026-04-21T11:55:30Z"}
{"round": 84, "iter": "iter84", "bottleneck": "memory_bound", "idea": "config exploration iter84", "category": "tiling", "expected_gain": "+5 TFLOPS", "decision": "COMPILE_FAIL", "tflops": 0.0, "timestamp": "2026-04-21T11:55:30Z"}
{"round": 85, "iter": "iter85", "bottleneck": "memory_bound", "idea": "config exploration iter85", "category": "tiling", "expected_gain": "+5 TFLOPS", "decision": "DISCARD", "tflops": 389.33, "timestamp": "2026-04-21T11:55:31Z"}
{"round": 86, "iter": "iter86", "bottleneck": "memory_bound", "idea": "config exploration iter86", "category": "tiling", "expected_gain": "+5 TFLOPS", "decision": "DISCARD", "tflops": 365.1, "timestamp": "2026-04-21T11:55:31Z"}
{"round": 87, "iter": "iter87", "bottleneck": "memory_bound", "idea": "config exploration iter87", "category": "tiling", "expected_gain": "+5 TFLOPS", "decision": "DISCARD", "tflops": 381.49, "timestamp": "2026-04-21T11:55:31Z"}
{"round": 88, "iter": "iter88", "bottleneck": "memory_bound", "idea": "config exploration iter88", "category": "tiling", "expected_gain": "+5 TFLOPS", "decision": "KEEP", "tflops": 393.52, "timestamp": "2026-04-21T11:55:32Z"}
{"round": 89, "iter": "iter89", "bottleneck": "memory_bound", "idea": "config exploration iter89", "category": "tiling", "expected_gain": "+5 TFLOPS", "decision": "DISCARD", "tflops": 375.97, "timestamp": "2026-04-21T11:55:32Z"}
{"round": 90, "iter": "iter90", "bottleneck": "memory_bound", "idea": "config exploration iter90", "category": "tiling", "expected_gain": "+5 TFLOPS", "decision": "DISCARD", "tflops": 368.86, "timestamp": "2026-04-21T11:55:33Z"}
{"round": 91, "iter": "iter91", "bottleneck": "memory_bound", "idea": "config exploration iter91", "category": "tiling", "expected_gain": "+5 TFLOPS", "decision": "COMPILE_FAIL", "tflops": 0.0, "timestamp": "2026-04-21T11:55:33Z"}
{"round": 92, "iter": "iter92", "bottleneck": "memory_bound", "idea": "config exploration iter92", "category": "tiling", "expected_gain": "+5 TFLOPS", "decision": "COMPILE_FAIL", "tflops": 0.0, "timestamp": "2026-04-21T11:55:33Z"}
{"round": 93, "iter": "iter93", "bottleneck": "memory_bound", "idea": "config exploration iter93", "category": "tiling", "expected_gain": "+5 TFLOPS", "decision": "COMPILE_FAIL", "tflops": 0.0, "timestamp": "2026-04-21T11:55:34Z"}
