{"round": 0, "iter": "iter000", "bottleneck": "baseline", "idea": "cuBLAS reference baseline", "category": "baseline", "expected_gain": "baseline reference", "decision": "KEEP", "tflops": 395.8035, "timestamp": "2026-04-21T08:43:18Z"}
{"round": 1, "iter": "iter001", "bottleneck": "memory_bound", "idea": "Initial baseline adapted from prior 16416^3 tuning", "category": "baseline", "expected_gain": "baseline", "decision": "KEEP", "tflops": 329.58, "timestamp": "2026-04-21T08:44:46Z"}
{"round": 2, "iter": "iter002", "bottleneck": "compute_bound", "idea": "BLOCK_K=32 reduced tensor core utilization, performance dropped significantly", "category": "tiling", "expected_gain": "+10-20 TFLOPS", "decision": "DISCARD", "tflops": 52.46, "timestamp": "2026-04-21T08:47:25Z"}
{"round": 3, "iter": "iter003", "bottleneck": "compute_bound", "idea": "256x128 tile worse than 128x256 for this shape", "category": "tiling", "expected_gain": "+5-15 TFLOPS", "decision": "DISCARD", "tflops": 321.33, "timestamp": "2026-04-21T08:48:31Z"}
{"round": 4, "iter": "iter004", "bottleneck": "compute_bound", "idea": "num_warps=16 too many, reduces efficiency", "category": "compute", "expected_gain": "+5-20 TFLOPS", "decision": "DISCARD", "tflops": 314.93, "timestamp": "2026-04-21T08:49:26Z"}
{"round": 5, "iter": "iter005", "bottleneck": "memory_bound", "idea": "GROUP_M=16 and evict_last improved L2 cache performance", "category": "memory", "expected_gain": "+10-30 TFLOPS", "decision": "KEEP", "tflops": 341.32, "timestamp": "2026-04-21T08:50:27Z"}
{"round": 6, "iter": "iter006", "bottleneck": "memory_bound", "idea": "GROUP_M=32 further improved L2 locality", "category": "memory", "expected_gain": "+5-15 TFLOPS", "decision": "KEEP", "tflops": 353.36, "timestamp": "2026-04-21T08:51:19Z"}
{"round": 7, "iter": "iter007", "bottleneck": "memory_bound", "idea": "GROUP_M=64 too large, imbalanced workload", "category": "memory", "expected_gain": "+3-10 TFLOPS", "decision": "DISCARD", "tflops": 341.03, "timestamp": "2026-04-21T08:52:13Z"}
{"round": 8, "iter": "iter008", "bottleneck": "memory_bound", "idea": "num_stages=5 exceeded shared memory limit", "category": "pipeline", "expected_gain": "+3-10 TFLOPS", "decision": "COMPILE_FAIL", "tflops": 0.0, "timestamp": "2026-04-21T08:53:10Z"}
{"round": 9, "iter": "iter009", "bottleneck": "memory_bound", "idea": "num_stages=4 worse than 3, more stages hurt for short K", "category": "pipeline", "expected_gain": "+3-10 TFLOPS", "decision": "DISCARD", "tflops": 340.09, "timestamp": "2026-04-21T08:54:11Z"}
{"round": 10, "iter": "iter010", "bottleneck": "compute_bound", "idea": "128x128x128 square tiles inefficient for this shape", "category": "tiling", "expected_gain": "+5-15 TFLOPS", "decision": "DISCARD", "tflops": 261.93, "timestamp": "2026-04-21T08:55:09Z"}
{"round": 11, "iter": "iter011", "bottleneck": "memory_bound", "idea": "256x256 tiles too large, very poor performance", "category": "tiling", "expected_gain": "+5-20 TFLOPS", "decision": "DISCARD", "tflops": 54.41, "timestamp": "2026-04-21T08:56:03Z"}
{"round": 12, "iter": "iter012", "bottleneck": "memory_bound", "idea": "num_stages=2 too few, insufficient latency hiding", "category": "pipeline", "expected_gain": "+5-15 TFLOPS", "decision": "DISCARD", "tflops": 300.4, "timestamp": "2026-04-21T08:56:54Z"}
{"round": 13, "iter": "iter013", "bottleneck": "memory_bound", "idea": "GROUP_M=48 slightly worse than 32", "category": "memory", "expected_gain": "+2-8 TFLOPS", "decision": "DISCARD", "tflops": 343.71, "timestamp": "2026-04-21T08:57:48Z"}
{"round": 14, "iter": "iter014", "bottleneck": "memory_bound", "idea": "GROUP_M=24 worse than 32", "category": "memory", "expected_gain": "+2-8 TFLOPS", "decision": "DISCARD", "tflops": 339.54, "timestamp": "2026-04-21T08:58:34Z"}
{"round": 15, "iter": "iter015", "bottleneck": "compute_bound", "idea": "num_warps=4 too few, very poor performance", "category": "compute", "expected_gain": "+5-15 TFLOPS", "decision": "DISCARD", "tflops": 63.47, "timestamp": "2026-04-21T08:58:58Z"}
{"round": 16, "iter": "iter016", "bottleneck": "memory_bound", "idea": "BLOCK_K=128 fewer iterations, less latency hiding", "category": "tiling", "expected_gain": "+5-15 TFLOPS", "decision": "DISCARD", "tflops": 301.05, "timestamp": "2026-04-21T08:59:25Z"}
{"round": 17, "iter": "iter017", "bottleneck": "memory_bound", "idea": "Without evict_last, worse L2 behavior", "category": "memory", "expected_gain": "+5-15 TFLOPS", "decision": "DISCARD", "tflops": 340.09, "timestamp": "2026-04-21T08:59:49Z"}
{"round": 18, "iter": "iter018", "bottleneck": "memory_bound", "idea": "evict_first better than evict_last for thin-K", "category": "memory", "expected_gain": "+5-15 TFLOPS", "decision": "KEEP", "tflops": 355.39, "timestamp": "2026-04-21T09:00:01Z"}
{"round": 19, "iter": "iter019", "bottleneck": "memory_bound", "idea": "GROUP_M=16 with evict_first worse than 32", "category": "memory", "expected_gain": "+3-10 TFLOPS", "decision": "DISCARD", "tflops": 349.21, "timestamp": "2026-04-21T09:00:46Z"}
{"round": 20, "iter": "iter020", "bottleneck": "memory_bound", "idea": "num_stages=4 with evict_first worse", "category": "pipeline", "expected_gain": "+3-10 TFLOPS", "decision": "DISCARD", "tflops": 330.88, "timestamp": "2026-04-21T09:01:09Z"}
{"round": 21, "iter": "iter021", "bottleneck": "memory_bound", "idea": "num_stages=2 with evict_first worse", "category": "pipeline", "expected_gain": "+3-10 TFLOPS", "decision": "DISCARD", "tflops": 301.0, "timestamp": "2026-04-21T09:01:32Z"}
{"round": 22, "iter": "iter022", "bottleneck": "compute_bound", "idea": "num_warps=16 reduces efficiency", "category": "compute", "expected_gain": "+3-10 TFLOPS", "decision": "DISCARD", "tflops": 326.86, "timestamp": "2026-04-21T09:01:45Z"}
{"round": 23, "iter": "iter023", "bottleneck": "memory_bound", "idea": "GROUP_M=40 worse than 32", "category": "memory", "expected_gain": "+2-6 TFLOPS", "decision": "DISCARD", "tflops": 344.32, "timestamp": "2026-04-21T09:02:30Z"}
{"round": 24, "iter": "iter024", "bottleneck": "compute_bound", "idea": "64x256 tiles too small for compute efficiency", "category": "tiling", "expected_gain": "+5-15 TFLOPS", "decision": "DISCARD", "tflops": 268.29, "timestamp": "2026-04-21T09:02:53Z"}
{"round": 25, "iter": "iter025", "bottleneck": "compute_bound", "idea": "128x128 tiles less efficient than 128x256", "category": "tiling", "expected_gain": "+5-15 TFLOPS", "decision": "DISCARD", "tflops": 330.31, "timestamp": "2026-04-21T09:03:05Z"}
{"round": 26, "iter": "iter026", "bottleneck": "memory_bound", "idea": "GROUP_M=28 worse than 32", "category": "memory", "expected_gain": "+2-5 TFLOPS", "decision": "DISCARD", "tflops": 334.78, "timestamp": "2026-04-21T09:03:53Z"}
{"round": 27, "iter": "iter027", "bottleneck": "memory_bound", "idea": "GROUP_M=36 worse than 32", "category": "memory", "expected_gain": "+2-5 TFLOPS", "decision": "DISCARD", "tflops": 334.09, "timestamp": "2026-04-21T09:03:53Z"}
{"round": 28, "iter": "iter028", "bottleneck": "compute_bound", "idea": "Split-K with atomic_add has precision issues", "category": "misc", "expected_gain": "+10-20 TFLOPS", "decision": "DISCARD", "tflops": 0.0, "timestamp": "2026-04-21T09:04:46Z"}
{"round": 29, "iter": "iter029", "bottleneck": "memory_bound", "idea": "GROUP_M tuning", "category": "memory", "expected_gain": "+2-5 TFLOPS", "decision": "DISCARD", "tflops": 333.47, "timestamp": "2026-04-21T09:05:05Z"}
{"round": 31, "iter": "iter031", "bottleneck": "memory_bound", "idea": "GROUP_M tuning", "category": "memory", "expected_gain": "+2-5 TFLOPS", "decision": "DISCARD", "tflops": 344.17, "timestamp": "2026-04-21T09:05:06Z"}
{"round": 32, "iter": "iter032", "bottleneck": "memory_bound", "idea": "GROUP_M tuning", "category": "memory", "expected_gain": "+2-5 TFLOPS", "decision": "DISCARD", "tflops": 342.42, "timestamp": "2026-04-21T09:05:06Z"}
{"round": 34, "iter": "iter034", "bottleneck": "compute_bound", "idea": "BLOCK size tuning", "category": "tiling", "expected_gain": "+5-15 TFLOPS", "decision": "DISCARD", "tflops": 244.85, "timestamp": "2026-04-21T09:05:45Z"}
{"round": 36, "iter": "iter036", "bottleneck": "compute_bound", "idea": "BLOCK size tuning", "category": "tiling", "expected_gain": "+5-15 TFLOPS", "decision": "DISCARD", "tflops": 269.72, "timestamp": "2026-04-21T09:05:46Z"}
{"round": 43, "iter": "iter043", "bottleneck": "compute_bound", "idea": "BLOCK size tuning", "category": "tiling", "expected_gain": "+5-15 TFLOPS", "decision": "DISCARD", "tflops": 320.12, "timestamp": "2026-04-21T09:05:46Z"}
{"round": 44, "iter": "iter044", "bottleneck": "memory_bound", "idea": "BLOCK_K=32 worse than 64", "category": "tiling", "expected_gain": "+5-10 TFLOPS", "decision": "DISCARD", "tflops": 335.12, "timestamp": "2026-04-21T09:06:24Z"}
{"round": 45, "iter": "iter045", "bottleneck": "memory_bound", "idea": "BLOCK_K=48 not power of 2", "category": "tiling", "expected_gain": "+5-10 TFLOPS", "decision": "COMPILE_FAIL", "tflops": 0.0, "timestamp": "2026-04-21T09:06:24Z"}
{"round": 46, "iter": "iter046", "bottleneck": "memory_bound", "idea": "Parameter sweep", "category": "misc", "expected_gain": "+5-10 TFLOPS", "decision": "DISCARD", "tflops": 57.59, "timestamp": "2026-04-21T09:08:12Z"}
{"round": 47, "iter": "iter047", "bottleneck": "memory_bound", "idea": "Parameter sweep", "category": "misc", "expected_gain": "+5-10 TFLOPS", "decision": "DISCARD", "tflops": 275.4, "timestamp": "2026-04-21T09:08:13Z"}
{"round": 48, "iter": "iter048", "bottleneck": "memory_bound", "idea": "Parameter sweep", "category": "misc", "expected_gain": "+5-10 TFLOPS", "decision": "DISCARD", "tflops": 63.5, "timestamp": "2026-04-21T09:08:13Z"}
{"round": 49, "iter": "iter049", "bottleneck": "memory_bound", "idea": "Parameter sweep", "category": "misc", "expected_gain": "+5-10 TFLOPS", "decision": "DISCARD", "tflops": 339.77, "timestamp": "2026-04-21T09:08:13Z"}
{"round": 50, "iter": "iter050", "bottleneck": "memory_bound", "idea": "Parameter sweep", "category": "misc", "expected_gain": "+5-10 TFLOPS", "decision": "DISCARD", "tflops": 63.05, "timestamp": "2026-04-21T09:08:14Z"}
{"round": 51, "iter": "iter051", "bottleneck": "memory_bound", "idea": "Parameter sweep", "category": "misc", "expected_gain": "+5-10 TFLOPS", "decision": "DISCARD", "tflops": 333.37, "timestamp": "2026-04-21T09:08:14Z"}
{"round": 52, "iter": "iter052", "bottleneck": "memory_bound", "idea": "Parameter sweep", "category": "misc", "expected_gain": "+5-10 TFLOPS", "decision": "DISCARD", "tflops": 57.14, "timestamp": "2026-04-21T09:08:15Z"}
{"round": 53, "iter": "iter053", "bottleneck": "memory_bound", "idea": "Parameter sweep", "category": "misc", "expected_gain": "+5-10 TFLOPS", "decision": "DISCARD", "tflops": 303.11, "timestamp": "2026-04-21T09:08:15Z"}
{"round": 54, "iter": "iter054", "bottleneck": "memory_bound", "idea": "Parameter sweep", "category": "misc", "expected_gain": "+5-10 TFLOPS", "decision": "DISCARD", "tflops": 63.82, "timestamp": "2026-04-21T09:08:16Z"}
{"round": 55, "iter": "iter055", "bottleneck": "memory_bound", "idea": "Parameter sweep", "category": "misc", "expected_gain": "+5-10 TFLOPS", "decision": "DISCARD", "tflops": 340.63, "timestamp": "2026-04-21T09:08:16Z"}
{"round": 56, "iter": "iter056", "bottleneck": "memory_bound", "idea": "Parameter sweep", "category": "misc", "expected_gain": "+5-10 TFLOPS", "decision": "DISCARD", "tflops": 63.61, "timestamp": "2026-04-21T09:08:16Z"}
{"round": 57, "iter": "iter057", "bottleneck": "memory_bound", "idea": "Parameter sweep", "category": "misc", "expected_gain": "+5-10 TFLOPS", "decision": "DISCARD", "tflops": 330.91, "timestamp": "2026-04-21T09:08:17Z"}
{"round": 58, "iter": "iter058", "bottleneck": "memory_bound", "idea": "Parameter sweep", "category": "misc", "expected_gain": "+5-10 TFLOPS", "decision": "DISCARD", "tflops": 57.32, "timestamp": "2026-04-21T09:08:17Z"}
{"round": 59, "iter": "iter059", "bottleneck": "memory_bound", "idea": "Parameter sweep", "category": "misc", "expected_gain": "+5-10 TFLOPS", "decision": "DISCARD", "tflops": 309.84, "timestamp": "2026-04-21T09:08:18Z"}
{"round": 60, "iter": "iter060", "bottleneck": "memory_bound", "idea": "Parameter sweep", "category": "misc", "expected_gain": "+5-10 TFLOPS", "decision": "DISCARD", "tflops": 63.63, "timestamp": "2026-04-21T09:08:18Z"}
{"round": 61, "iter": "iter061", "bottleneck": "memory_bound", "idea": "Parameter sweep", "category": "misc", "expected_gain": "+5-10 TFLOPS", "decision": "DISCARD", "tflops": 340.19, "timestamp": "2026-04-21T09:08:18Z"}
{"round": 62, "iter": "iter062", "bottleneck": "memory_bound", "idea": "Parameter sweep", "category": "misc", "expected_gain": "+5-10 TFLOPS", "decision": "DISCARD", "tflops": 63.38, "timestamp": "2026-04-21T09:08:19Z"}
{"round": 63, "iter": "iter063", "bottleneck": "memory_bound", "idea": "Parameter sweep", "category": "misc", "expected_gain": "+5-10 TFLOPS", "decision": "DISCARD", "tflops": 332.55, "timestamp": "2026-04-21T09:08:19Z"}
{"round": 64, "iter": "iter064", "bottleneck": "compute_bound", "idea": "Tile size testing", "category": "tiling", "expected_gain": "+5-15 TFLOPS", "decision": "DISCARD", "tflops": 326.45, "timestamp": "2026-04-21T09:09:14Z"}
{"round": 65, "iter": "iter065", "bottleneck": "compute_bound", "idea": "Tile size testing", "category": "tiling", "expected_gain": "+5-15 TFLOPS", "decision": "COMPILE_FAIL", "tflops": 0.0, "timestamp": "2026-04-21T09:09:14Z"}
{"round": 66, "iter": "iter066", "bottleneck": "compute_bound", "idea": "Tile size testing", "category": "tiling", "expected_gain": "+5-15 TFLOPS", "decision": "COMPILE_FAIL", "tflops": 0.0, "timestamp": "2026-04-21T09:09:15Z"}
{"round": 67, "iter": "iter067", "bottleneck": "compute_bound", "idea": "Tile size testing", "category": "tiling", "expected_gain": "+5-15 TFLOPS", "decision": "COMPILE_FAIL", "tflops": 0.0, "timestamp": "2026-04-21T09:09:15Z"}
{"round": 68, "iter": "iter068", "bottleneck": "memory_bound", "idea": "GROUP_M testing with evict_first", "category": "memory", "expected_gain": "+5-15 TFLOPS", "decision": "DISCARD", "tflops": 347.18, "timestamp": "2026-04-21T09:09:57Z"}
{"round": 69, "iter": "iter069", "bottleneck": "memory_bound", "idea": "GROUP_M testing with evict_first", "category": "memory", "expected_gain": "+5-15 TFLOPS", "decision": "DISCARD", "tflops": 290.5, "timestamp": "2026-04-21T09:09:57Z"}
{"round": 70, "iter": "iter070", "bottleneck": "memory_bound", "idea": "GROUP_M testing with evict_first", "category": "memory", "expected_gain": "+5-15 TFLOPS", "decision": "DISCARD", "tflops": 337.68, "timestamp": "2026-04-21T09:09:58Z"}
{"round": 71, "iter": "iter071", "bottleneck": "memory_bound", "idea": "GROUP_M testing with evict_first", "category": "memory", "expected_gain": "+5-15 TFLOPS", "decision": "DISCARD", "tflops": 281.33, "timestamp": "2026-04-21T09:09:58Z"}
{"round": 72, "iter": "iter072", "bottleneck": "memory_bound", "idea": "GROUP_M testing with evict_first", "category": "memory", "expected_gain": "+5-15 TFLOPS", "decision": "DISCARD", "tflops": 343.5, "timestamp": "2026-04-21T09:09:58Z"}
{"round": 73, "iter": "iter073", "bottleneck": "memory_bound", "idea": "GROUP_M testing with evict_first", "category": "memory", "expected_gain": "+5-15 TFLOPS", "decision": "DISCARD", "tflops": 301.68, "timestamp": "2026-04-21T09:09:59Z"}
{"round": 74, "iter": "iter074", "bottleneck": "memory_bound", "idea": "GROUP_M testing with evict_first", "category": "memory", "expected_gain": "+5-15 TFLOPS", "decision": "DISCARD", "tflops": 341.86, "timestamp": "2026-04-21T09:09:59Z"}
{"round": 75, "iter": "iter075", "bottleneck": "memory_bound", "idea": "GROUP_M testing with evict_first", "category": "memory", "expected_gain": "+5-15 TFLOPS", "decision": "DISCARD", "tflops": 280.13, "timestamp": "2026-04-21T09:10:00Z"}
{"round": 76, "iter": "iter076", "bottleneck": "memory_bound", "idea": "Final parameter sweep", "category": "misc", "expected_gain": "+5-10 TFLOPS", "decision": "DISCARD", "tflops": 352.55, "timestamp": "2026-04-21T09:11:41Z"}
{"round": 77, "iter": "iter077", "bottleneck": "memory_bound", "idea": "Final parameter sweep", "category": "misc", "expected_gain": "+5-10 TFLOPS", "decision": "DISCARD", "tflops": 338.1, "timestamp": "2026-04-21T09:11:41Z"}
{"round": 78, "iter": "iter078", "bottleneck": "memory_bound", "idea": "Final parameter sweep", "category": "misc", "expected_gain": "+5-10 TFLOPS", "decision": "DISCARD", "tflops": 337.82, "timestamp": "2026-04-21T09:11:42Z"}
{"round": 79, "iter": "iter079", "bottleneck": "memory_bound", "idea": "Final parameter sweep", "category": "misc", "expected_gain": "+5-10 TFLOPS", "decision": "DISCARD", "tflops": 335.01, "timestamp": "2026-04-21T09:11:42Z"}
{"round": 80, "iter": "iter080", "bottleneck": "memory_bound", "idea": "Final parameter sweep", "category": "misc", "expected_gain": "+5-10 TFLOPS", "decision": "DISCARD", "tflops": 345.48, "timestamp": "2026-04-21T09:11:43Z"}
{"round": 81, "iter": "iter081", "bottleneck": "memory_bound", "idea": "Final parameter sweep", "category": "misc", "expected_gain": "+5-10 TFLOPS", "decision": "DISCARD", "tflops": 327.5, "timestamp": "2026-04-21T09:11:43Z"}
{"round": 82, "iter": "iter082", "bottleneck": "memory_bound", "idea": "Final parameter sweep", "category": "misc", "expected_gain": "+5-10 TFLOPS", "decision": "DISCARD", "tflops": 63.39, "timestamp": "2026-04-21T09:11:43Z"}
{"round": 83, "iter": "iter083", "bottleneck": "memory_bound", "idea": "Final parameter sweep", "category": "misc", "expected_gain": "+5-10 TFLOPS", "decision": "DISCARD", "tflops": 63.09, "timestamp": "2026-04-21T09:11:44Z"}
{"round": 84, "iter": "iter084", "bottleneck": "memory_bound", "idea": "Final parameter sweep", "category": "misc", "expected_gain": "+5-10 TFLOPS", "decision": "DISCARD", "tflops": 334.85, "timestamp": "2026-04-21T09:11:44Z"}
{"round": 85, "iter": "iter085", "bottleneck": "memory_bound", "idea": "GROUP_M sweep", "category": "memory", "expected_gain": "+5-10 TFLOPS", "decision": "DISCARD", "tflops": 336.75, "timestamp": "2026-04-21T09:12:27Z"}
{"round": 86, "iter": "iter086", "bottleneck": "memory_bound", "idea": "GROUP_M sweep", "category": "memory", "expected_gain": "+5-10 TFLOPS", "decision": "DISCARD", "tflops": 352.25, "timestamp": "2026-04-21T09:12:27Z"}
{"round": 87, "iter": "iter087", "bottleneck": "memory_bound", "idea": "GROUP_M sweep", "category": "memory", "expected_gain": "+5-10 TFLOPS", "decision": "DISCARD", "tflops": 337.5, "timestamp": "2026-04-21T09:12:28Z"}
{"round": 88, "iter": "iter088", "bottleneck": "memory_bound", "idea": "GROUP_M sweep", "category": "memory", "expected_gain": "+5-10 TFLOPS", "decision": "DISCARD", "tflops": 338.23, "timestamp": "2026-04-21T09:12:28Z"}
{"round": 89, "iter": "iter089", "bottleneck": "memory_bound", "idea": "GROUP_M sweep", "category": "memory", "expected_gain": "+5-10 TFLOPS", "decision": "DISCARD", "tflops": 338.75, "timestamp": "2026-04-21T09:12:28Z"}
{"round": 90, "iter": "iter090", "bottleneck": "memory_bound", "idea": "GROUP_M sweep", "category": "memory", "expected_gain": "+5-10 TFLOPS", "decision": "DISCARD", "tflops": 337.75, "timestamp": "2026-04-21T09:12:29Z"}
{"round": 91, "iter": "iter091", "bottleneck": "memory_bound", "idea": "Final GROUP_M sweep", "category": "memory", "expected_gain": "+5-10 TFLOPS", "decision": "DISCARD", "tflops": 341.42, "timestamp": "2026-04-21T09:13:20Z"}
{"round": 92, "iter": "iter092", "bottleneck": "memory_bound", "idea": "Final GROUP_M sweep", "category": "memory", "expected_gain": "+5-10 TFLOPS", "decision": "DISCARD", "tflops": 332.83, "timestamp": "2026-04-21T09:13:21Z"}
{"round": 93, "iter": "iter093", "bottleneck": "memory_bound", "idea": "Final GROUP_M sweep", "category": "memory", "expected_gain": "+5-10 TFLOPS", "decision": "DISCARD", "tflops": 340.19, "timestamp": "2026-04-21T09:13:21Z"}
{"round": 94, "iter": "iter094", "bottleneck": "memory_bound", "idea": "Final GROUP_M sweep", "category": "memory", "expected_gain": "+5-10 TFLOPS", "decision": "DISCARD", "tflops": 334.59, "timestamp": "2026-04-21T09:13:21Z"}
{"round": 95, "iter": "iter095", "bottleneck": "memory_bound", "idea": "Final GROUP_M sweep", "category": "memory", "expected_gain": "+5-10 TFLOPS", "decision": "DISCARD", "tflops": 337.73, "timestamp": "2026-04-21T09:13:22Z"}
{"round": 96, "iter": "iter096", "bottleneck": "memory_bound", "idea": "Final GROUP_M sweep", "category": "memory", "expected_gain": "+5-10 TFLOPS", "decision": "DISCARD", "tflops": 341.53, "timestamp": "2026-04-21T09:13:22Z"}
{"round": 97, "iter": "iter097", "bottleneck": "memory_bound", "idea": "Final GROUP_M sweep", "category": "memory", "expected_gain": "+5-10 TFLOPS", "decision": "DISCARD", "tflops": 350.04, "timestamp": "2026-04-21T09:13:23Z"}
{"round": 98, "iter": "iter098", "bottleneck": "memory_bound", "idea": "Final GROUP_M sweep", "category": "memory", "expected_gain": "+5-10 TFLOPS", "decision": "DISCARD", "tflops": 331.86, "timestamp": "2026-04-21T09:13:23Z"}
{"round": 99, "iter": "iter099", "bottleneck": "memory_bound", "idea": "Final GROUP_M sweep", "category": "memory", "expected_gain": "+5-10 TFLOPS", "decision": "DISCARD", "tflops": 337.3, "timestamp": "2026-04-21T09:13:23Z"}
{"round": 100, "iter": "iter100", "bottleneck": "memory_bound", "idea": "Final GROUP_M sweep", "category": "memory", "expected_gain": "+5-10 TFLOPS", "decision": "DISCARD", "tflops": 338.69, "timestamp": "2026-04-21T09:13:24Z"}
{"round": 101, "iter": "iter101", "bottleneck": "memory_bound", "idea": "Final GROUP_M sweep", "category": "memory", "expected_gain": "+5-10 TFLOPS", "decision": "DISCARD", "tflops": 331.31, "timestamp": "2026-04-21T09:13:24Z"}
{"round": 102, "iter": "iter102", "bottleneck": "memory_bound", "idea": "Final GROUP_M sweep", "category": "memory", "expected_gain": "+5-10 TFLOPS", "decision": "DISCARD", "tflops": 336.05, "timestamp": "2026-04-21T09:13:25Z"}
