{"round": 103, "iter": "iter103", "bottleneck": "memory_bound", "idea": "Final GROUP_M sweep", "category": "memory", "expected_gain": "+5-10 TFLOPS", "decision": "DISCARD", "tflops": 325.04, "timestamp": "2026-04-21T09:13:25Z"}
