{"round": 0, "iter": "iter000", "bottleneck": "baseline", "idea": "cuBLAS reference baseline", "category": "baseline", "expected_gain": "baseline reference", "decision": "KEEP", "tflops": 409.8731, "timestamp": "2026-04-19T08:37:42Z"}
{"round": 1, "iter": "iter001", "bottleneck": "memory_bound", "idea": "Starting persistent 1p2c FP16->FP32 kernel adapted to K=16416; established first custom kernel baseline at 181.49T (44.3% of cuBLAS 409.87T)", "category": "tiling", "expected_gain": "baseline", "decision": "KEEP", "tflops": 181.49, "timestamp": "2026-04-19T08:43:14Z"}
{"round": 2, "iter": "iter002", "bottleneck": "memory_bound", "idea": "Switch 1p2c\u21921p1c WN=256 STAGES=2 TILE_M=64: reduces SMEM from 196KB to 144KB, fewer warp-groups, less register pressure \u2192 +15% to 209T", "category": "tiling", "expected_gain": "+27.5T actual", "decision": "KEEP", "tflops": 208.987, "timestamp": "2026-04-19T08:47:41Z"}
{"round": 3, "iter": "iter003", "bottleneck": "launch_bound", "idea": "Switch persistent 114-CTA \u2192 non-persistent 16705-CTA (TILE_M=64, WN=256, STAGES=3): full GPU parallelism instead of serialized tile scheduling \u2192 +27% to 266T (64.8% cuBLAS)", "category": "tiling", "expected_gain": "+57T actual", "decision": "KEEP", "tflops": 265.656, "timestamp": "2026-04-19T08:51:33Z"}
{"round": 4, "iter": "iter004", "bottleneck": "memory_bound", "idea": "STAGES=4 with WN=256 (224KB SMEM): slightly worse than STAGES=3 (184KB SMEM) \u2014 extra stage increases pressure without benefit at this shape", "category": "pipeline", "expected_gain": "+5T est, got -3T actual", "decision": "DISCARD", "tflops": 262.769, "timestamp": "2026-04-19T08:54:39Z"}
{"round": 5, "iter": "iter005", "bottleneck": "memory_bound", "idea": "Phase 2: move empty[stage].arrive() before warpgroup_commit_batch (early arrive): signals producer to preload next tile while WGMMA completes \u2192 barrier stall reduction \u2192 +4.2% to 277T (67.5% cuBLAS)", "category": "pipeline", "expected_gain": "+11T actual", "decision": "KEEP", "tflops": 276.88, "timestamp": "2026-04-19T08:58:17Z"}
{"round": 6, "iter": "iter006", "bottleneck": "memory_bound", "idea": "warpgroup_wait<1> with extra final wait<0>: slight regression 277T\u2192275T, extra drain overhead outweighs pipeline benefit at this configuration", "category": "pipeline", "expected_gain": "+10T est, got -1.5T actual", "decision": "DISCARD", "tflops": 275.366, "timestamp": "2026-04-19T09:01:03Z"}
{"round": 7, "iter": "iter007", "bottleneck": "memory_bound", "idea": "STRUCTURAL 1p2c split-out WN=128: 3 warpgroups (384 threads) slower than 1p1c WN=256 (256 threads) \u2014 narrower N-tile reduces compute per TMA load, overhead dominates at 186T", "category": "tiling", "expected_gain": "+30T est, got -91T actual", "decision": "DISCARD", "tflops": 185.627, "timestamp": "2026-04-19T09:03:59Z"}
{"round": 8, "iter": "iter008", "bottleneck": "compute_bound", "idea": "TILE_K=128 via 2 TMA loads/barrier with STAGES=2: doubles WGMMA per sync but 2x TMA overhead and fewer pipeline stages hurt latency hiding, -12T vs iter005", "category": "pipeline", "expected_gain": "+15-25T est, got -12T actual", "decision": "DISCARD", "tflops": 265.27, "timestamp": "2026-04-19T09:16:27Z"}
{"round": 9, "iter": "iter009", "bottleneck": "compute_bound", "idea": "Move warpgroup_arrive() before inner loop (1 call vs 4): compiler likely already hoists this \u2014 no gain at 275.7T vs 276.9T (-0.4%)", "category": "compute", "expected_gain": "+5-15T est, got -1T actual", "decision": "DISCARD", "tflops": 275.718, "timestamp": "2026-04-19T09:19:55Z"}
{"round": 10, "iter": "iter010", "bottleneck": "compute_bound", "idea": "TILE_K=32 STAGES=5 with B64 swizzle: B64 vs B128 swizzle causes WGMMA inefficiency and 2 WGMMAs/stage has worse compute density than 4, -46T vs iter005", "category": "pipeline", "expected_gain": "+20-40T est, got -46T actual", "decision": "DISCARD", "tflops": 230.691, "timestamp": "2026-04-19T09:29:56Z"}
{"round": 11, "iter": "iter011", "bottleneck": "latency_bound", "idea": "Asymmetric full barrier init(1): consumer PTX poll via mbarrier.test_wait.parity instead of arrive()+wait(). Intended to eliminate 128 redundant arrive() calls per K-step.", "category": "general", "expected_gain": "unknown", "decision": "DISCARD", "tflops": 272.315, "timestamp": "2026-04-19T09:42:37Z"}
{"round": 12, "iter": "iter012", "bottleneck": "compute_bound", "idea": "Persistent 114-CTA A-stationary kernel with atomic tile counter: per-tile barrier reinit serializes execution, tensor active drops to 20%, 98T vs 277T.", "category": "general", "expected_gain": "unknown", "decision": "DISCARD", "tflops": 98.35, "timestamp": "2026-04-19T10:04:24Z"}
{"round": 13, "iter": "iter013", "bottleneck": "compute_bound", "idea": "Swapped grid to (tiles_n=65, tiles_m=257) for A-stationary: consecutive CTAs share A row \u2192 3.7x WORSE DRAM (142GB vs 38GB). B-stationary behavior of original (257,65) grid was the correct design.", "category": "general", "expected_gain": "unknown", "decision": "DISCARD", "tflops": 97.97, "timestamp": "2026-04-19T10:24:41Z"}
{"round": 14, "iter": "iter014", "bottleneck": "compute_bound", "idea": "Persistent 114-CTA with overlapped output TMA: same 142GB DRAM as iter012, tensor active 20%. Barrier reinit overhead dominates, not output TMA.", "category": "general", "expected_gain": "unknown", "decision": "DISCARD", "tflops": 98.37, "timestamp": "2026-04-19T10:25:33Z"}
{"round": 15, "iter": "iter015", "bottleneck": "memory_bound", "idea": "L2 promotion L2_128B for A TMA: pollutes L2, evicts B cache, 252T vs 277T. PROMOTION_NONE was correct.", "category": "general", "expected_gain": "unknown", "decision": "DISCARD", "tflops": 252.4, "timestamp": "2026-04-19T10:31:38Z"}
{"round": 16, "iter": "iter016", "bottleneck": "compute_bound", "idea": "STAGES=4+early arrive: barrier stalls drop to 37.5%, but 255T vs 277T. More SMEM reduces L1 from 72KB to 32KB; STAGES=3 is the sweet spot.", "category": "general", "expected_gain": "unknown", "decision": "DISCARD", "tflops": 255.59, "timestamp": "2026-04-19T10:41:27Z"}
