{"round": 0, "iter": "iter000", "bottleneck": "baseline", "idea": "cuBLAS reference baseline", "category": "baseline", "expected_gain": "baseline reference", "decision": "KEEP", "tflops": 416.244, "timestamp": "2026-04-20T15:48:11Z"}
{"round": 1, "iter": "iter001", "bottleneck": "memory_bound", "idea": "Initial WMMA kernel with BM=64,BN=64,BK=16 - baseline for optimization", "category": "tiling", "expected_gain": "N/A - baseline", "decision": "KEEP", "tflops": 24.403, "timestamp": "2026-04-20T15:52:43Z"}
{"round": 2, "iter": "iter002", "bottleneck": "memory_bound", "idea": "Larger tiles BM=128,BN=128,BK=32 with 2x2 fragments - warp mapping issue caused slowdown", "category": "tiling", "expected_gain": "+50-100 TFLOPS", "decision": "DISCARD", "tflops": 12.766, "timestamp": "2026-04-20T15:57:57Z"}
{"round": 3, "iter": "iter003", "bottleneck": "memory_bound", "idea": "PTX mma.sync with ldmatrix - incorrect register mapping, kernel runs but produces wrong accumulator access", "category": "compute", "expected_gain": "+100 TFLOPS", "decision": "COMPILE_FAIL", "tflops": 0.0, "timestamp": "2026-04-20T16:02:49Z"}
{"round": 4, "iter": "iter004", "bottleneck": "memory_bound", "idea": "WMMA with BM=BN=128, BK=32, 8 warps each computing 16x128 output with 2 K-steps per block", "category": "tiling", "expected_gain": "+50 TFLOPS", "decision": "KEEP", "tflops": 47.315, "timestamp": "2026-04-20T16:04:30Z"}
{"round": 5, "iter": "iter005", "bottleneck": "compute_bound", "idea": "BM=256, BN=128, BK=32 with 8 warps each computing 32x128 - too many accumulators, low occupancy", "category": "tiling", "expected_gain": "+30 TFLOPS", "decision": "DISCARD", "tflops": 33.266, "timestamp": "2026-04-20T16:06:34Z"}
{"round": 6, "iter": "iter006", "bottleneck": "memory_bound", "idea": "Double buffering with synchronous loads - overhead exceeds latency hiding benefit", "category": "pipeline", "expected_gain": "+20 TFLOPS", "decision": "DISCARD", "tflops": 46.883, "timestamp": "2026-04-20T16:08:06Z"}
{"round": 7, "iter": "iter007", "bottleneck": "memory_bound", "idea": "cp.async per-element copies are inefficient, pipeline likely broken", "category": "pipeline", "expected_gain": "+30 TFLOPS", "decision": "COMPILE_FAIL", "tflops": 0.0, "timestamp": "2026-04-20T16:09:35Z"}
{"round": 8, "iter": "iter008", "bottleneck": "memory_bound", "idea": "Vectorized float4 loads for global memory - 2x speedup from coalesced 128-bit accesses", "category": "memory", "expected_gain": "+20 TFLOPS", "decision": "KEEP", "tflops": 89.349, "timestamp": "2026-04-20T16:11:05Z"}
{"round": 9, "iter": "iter009", "bottleneck": "memory_bound", "idea": "Swizzled shared memory - overhead exceeds bank conflict savings", "category": "memory", "expected_gain": "+15 TFLOPS", "decision": "DISCARD", "tflops": 73.208, "timestamp": "2026-04-20T16:12:38Z"}
{"round": 10, "iter": "iter010", "bottleneck": "compute_bound", "idea": "512 threads with incorrect warp-tile mapping caused verification failure", "category": "tiling", "expected_gain": "+20 TFLOPS", "decision": "COMPILE_FAIL", "tflops": 0.0, "timestamp": "2026-04-20T16:14:04Z"}
{"round": 11, "iter": "iter011", "bottleneck": "compute_bound", "idea": "BK=64 with BM=BN=64 - low occupancy from 4 warps hurts more than arithmetic intensity gain", "category": "tiling", "expected_gain": "+20 TFLOPS", "decision": "DISCARD", "tflops": 68.821, "timestamp": "2026-04-20T16:15:44Z"}
{"round": 12, "iter": "iter012", "bottleneck": "memory_bound", "idea": "BK=64 - marginal difference from BK=32, no improvement", "category": "tiling", "expected_gain": "+15 TFLOPS", "decision": "DISCARD", "tflops": 89.213, "timestamp": "2026-04-20T16:17:32Z"}
{"round": 13, "iter": "iter013", "bottleneck": "compute_bound", "idea": "Split-K with incorrect fragment store pattern - verification failed", "category": "pipeline", "expected_gain": "+30 TFLOPS", "decision": "COMPILE_FAIL", "tflops": 0.0, "timestamp": "2026-04-20T16:19:18Z"}
{"round": 14, "iter": "iter014", "bottleneck": "memory_bound", "idea": "__ldg intrinsics - no improvement on Hopper unified L1 cache", "category": "memory", "expected_gain": "+10 TFLOPS", "decision": "DISCARD", "tflops": 88.845, "timestamp": "2026-04-20T16:20:14Z"}
{"round": 15, "iter": "iter015", "bottleneck": "latency_bound", "idea": "Removed second __syncthreads() in K-loop - 3% speedup from reduced sync overhead", "category": "misc", "expected_gain": "+5 TFLOPS", "decision": "KEEP", "tflops": 91.994, "timestamp": "2026-04-20T16:21:10Z"}
{"round": 16, "iter": "iter016", "bottleneck": "compute_bound", "idea": "2x8 WMMA tiles with 4 warps - low occupancy and register pressure hurt performance", "category": "tiling", "expected_gain": "+10 TFLOPS", "decision": "DISCARD", "tflops": 60.877, "timestamp": "2026-04-20T16:22:43Z"}
{"round": 17, "iter": "iter017", "bottleneck": "compute_bound", "idea": "BN=64 broke load pattern, reported inf TFLOPS", "category": "tiling", "expected_gain": "+10 TFLOPS", "decision": "COMPILE_FAIL", "tflops": 0.0, "timestamp": "2026-04-20T16:23:47Z"}
{"round": 18, "iter": "iter018", "bottleneck": "latency_bound", "idea": "--maxrregcount=128 - no improvement, slight regression", "category": "compute", "expected_gain": "+5 TFLOPS", "decision": "DISCARD", "tflops": 91.158, "timestamp": "2026-04-20T16:24:58Z"}
{"round": 19, "iter": "iter019", "bottleneck": "launch_bound", "idea": "Persistent kernel with 132 blocks - insufficient parallelism for large grid", "category": "pipeline", "expected_gain": "+15 TFLOPS", "decision": "DISCARD", "tflops": 55.108, "timestamp": "2026-04-20T16:26:36Z"}
{"round": 20, "iter": "iter020", "bottleneck": "memory_bound", "idea": "Tile swizzling - overhead exceeds L2 locality benefit", "category": "memory", "expected_gain": "+10 TFLOPS", "decision": "DISCARD", "tflops": 90.572, "timestamp": "2026-04-20T16:27:32Z"}
{"round": 21, "iter": "iter021", "bottleneck": "memory_bound", "idea": "Double-buffered software pipelining - overhead exceeds benefit, increased SMEM pressure", "category": "pipeline", "expected_gain": "+5 TFLOPS", "decision": "DISCARD", "tflops": 84.64, "timestamp": "2026-04-20T16:29:17Z"}
{"round": 22, "iter": "iter022", "bottleneck": "compute_bound", "idea": "2x4 warp tile (8 warps in 4x2 layout) - 7% speedup from better A-fragment reuse", "category": "tiling", "expected_gain": "+5 TFLOPS", "decision": "KEEP", "tflops": 98.625, "timestamp": "2026-04-20T16:31:22Z"}
{"round": 23, "iter": "iter023", "bottleneck": "compute_bound", "idea": "4x4 warp tiles with 4 warps - register pressure kills occupancy", "category": "tiling", "expected_gain": "+5 TFLOPS", "decision": "DISCARD", "tflops": 61.163, "timestamp": "2026-04-20T16:33:02Z"}
{"round": 24, "iter": "iter024", "bottleneck": "memory_bound", "idea": "BM=256 with 16 warps (8x2) - 7.5% speedup from better A-matrix reuse", "category": "tiling", "expected_gain": "+5 TFLOPS", "decision": "KEEP", "tflops": 106.061, "timestamp": "2026-04-20T16:34:35Z"}
{"round": 25, "iter": "iter025", "bottleneck": "memory_bound", "idea": "BM=256 BN=256 with 32 warps - load pattern mapping failed", "category": "tiling", "expected_gain": "+10 TFLOPS", "decision": "COMPILE_FAIL", "tflops": 0.0, "timestamp": "2026-04-20T16:37:16Z"}
{"round": 26, "iter": "iter026", "bottleneck": "memory_bound", "idea": "BK=64 with BM=128 - had to reduce BM for SMEM, lost A-reuse benefit", "category": "tiling", "expected_gain": "+5 TFLOPS", "decision": "DISCARD", "tflops": 102.601, "timestamp": "2026-04-20T16:39:20Z"}
{"round": 27, "iter": "iter027", "bottleneck": "latency_bound", "idea": "Dynamic shared memory - high latency penalty, lower occupancy", "category": "memory", "expected_gain": "+10 TFLOPS", "decision": "DISCARD", "tflops": 56.888, "timestamp": "2026-04-20T16:41:04Z"}
{"round": 28, "iter": "iter028", "bottleneck": "memory_bound", "idea": "BM=384 - verification failed, 16384 not divisible by 384", "category": "tiling", "expected_gain": "+5 TFLOPS", "decision": "COMPILE_FAIL", "tflops": 0.0, "timestamp": "2026-04-20T16:42:45Z"}
{"round": 29, "iter": "iter029", "bottleneck": "memory_bound", "idea": "BM=512 with BK=16 - load pattern issue with 1024 threads", "category": "tiling", "expected_gain": "+5 TFLOPS", "decision": "COMPILE_FAIL", "tflops": 0.0, "timestamp": "2026-04-20T16:44:17Z"}
{"round": 30, "iter": "iter030", "bottleneck": "latency_bound", "idea": "Padding +4 causes inf TFLOPS - likely memory alignment issue", "category": "memory", "expected_gain": "+3 TFLOPS", "decision": "COMPILE_FAIL", "tflops": 0.0, "timestamp": "2026-04-20T16:47:13Z"}
{"round": 31, "iter": "iter031", "bottleneck": "compute_bound", "idea": "4x2 warp tiles (4Mx2N warps) - 2% slower than 2x4 layout", "category": "tiling", "expected_gain": "+5 TFLOPS", "decision": "DISCARD", "tflops": 104.074, "timestamp": "2026-04-20T16:48:18Z"}
{"round": 32, "iter": "iter032", "bottleneck": "compute_bound", "idea": "3x4 warp tiles - register pressure kills performance", "category": "tiling", "expected_gain": "+5 TFLOPS", "decision": "DISCARD", "tflops": 60.146, "timestamp": "2026-04-20T16:50:01Z"}
{"round": 33, "iter": "iter033", "bottleneck": "latency_bound", "idea": "Explicit unroll hint - no change, compiler already optimizes", "category": "misc", "expected_gain": "+3 TFLOPS", "decision": "DISCARD", "tflops": 106.076, "timestamp": "2026-04-20T16:51:26Z"}
{"round": 34, "iter": "iter034", "bottleneck": "memory_bound", "idea": "Restructured loop order - interleaving hurts more than helps", "category": "compute", "expected_gain": "+10 TFLOPS", "decision": "DISCARD", "tflops": 101.015, "timestamp": "2026-04-20T16:53:02Z"}
{"round": 35, "iter": "iter035", "bottleneck": "memory_bound", "idea": "BM=256 BN=256 BK=16 with 32 warps - B load pattern issue", "category": "tiling", "expected_gain": "+5 TFLOPS", "decision": "COMPILE_FAIL", "tflops": 0.0, "timestamp": "2026-04-20T16:54:50Z"}
{"round": 36, "iter": "iter036", "bottleneck": "compute_bound", "idea": "1x4 warp tiles with 32 warps - warp mapping error", "category": "tiling", "expected_gain": "+10 TFLOPS", "decision": "COMPILE_FAIL", "tflops": 0.0, "timestamp": "2026-04-20T16:58:01Z"}
{"round": 37, "iter": "iter037", "bottleneck": "compute_bound", "idea": "launch_bounds(512,2) causes register spilling and incorrect results", "category": "misc", "expected_gain": "+5 TFLOPS", "decision": "COMPILE_FAIL", "tflops": 0.0, "timestamp": "2026-04-20T16:59:43Z"}
{"round":38,"idea":"remove-bounds-checks","status":"COMPILE_FAIL","tflops":null,"notes":"Removing bounds checks increased register usage from 124 to 136. With 512 threads, this exceeds 65536 registers/SM limit causing cudaErrorLaunchOutOfResources. Adding launch_bounds to constrain registers caused verification failure due to spilling."}
{"round":39,"idea":"4x2-warp-tiles","status":"DISCARD","tflops":23.715,"notes":"Changed warp tiles from 2x4 to 4x2 (64x32 output per warp). Verification passes but severe performance regression from 106 to 24 TFLOPS. The 4x2 layout has worse memory access pattern for B matrix."}
{"round":40,"idea":"BM128-BN256-transpose-tiles","status":"BEST","tflops":109.413,"notes":"Swapped tile dimensions: BM=128, BN=256 (was 256x128). Warp layout changed to 4x4 with 2x4 tiles. Better B-matrix locality. NEW BEST: 109.4 TFLOPS (26.3% of cuBLAS), up from 106."}
{"round":41,"idea":"BM128-BN384","status":"COMPILE_FAIL","tflops":null,"notes":"BN=384 doesn't divide 16384 evenly (42.67), causing incomplete coverage. Also 24 warps may have load pattern issues."}
{"round":42,"idea":"BM64-BN256-small-block","status":"DISCARD","tflops":87.926,"notes":"Smaller BM=64 tile reduces arithmetic intensity. 88 TFLOPS is worse than current best 109."}
{"round":43,"idea":"BM128-BN512-large-block","status":"COMPILE_FAIL","tflops":null,"notes":"32 warps (1024 threads) with 119 registers = 121856 registers, exceeds 65536 per SM. Register overflow."}
{"round":44,"idea":"double-buffering-BM64-BN256","status":"DISCARD","tflops":82.968,"notes":"Double buffering with BM=64 (to fit 2x smem). Pipelining helps latency but smaller tile reduces arithmetic intensity. 83 TFLOPS vs 109 TFLOPS best."}
{"round":45,"idea":"BM192-BN256-3x4tiles","status":"COMPILE_FAIL","tflops":null,"notes":"BM=192 doesn't divide M=16384 evenly (85.33 blocks), causing incomplete coverage."}
{"round":46,"idea":"BM128-BN128-square-tile","status":"DISCARD","tflops":98.433,"notes":"Smaller square tile reduces arithmetic intensity. 98 TFLOPS vs 109 TFLOPS best."}
{"round":47,"idea":"2x2-warp-tiles-32warps","status":"COMPILE_FAIL","tflops":null,"notes":"72 regs x 1024 threads = 73728 > 65536 register limit"}
{"round":48,"idea":"tile-swizzling-L2","status":"DISCARD","tflops":109.282,"notes":"Tile swizzling for L2 cache locality. 109.3 TFLOPS same as iter040 (109.4). No improvement for large problem size."}
{"round":49,"idea":"BM64-BN512","status":"DISCARD","tflops":82.008,"notes":"BM=64 reduces A-matrix reuse too much. 82 TFLOPS vs 109 best."}
{"round":50,"idea":"ldcg-cache-hint","status":"DISCARD","tflops":107.345,"notes":"__ldcg cache hint for global loads. 107 TFLOPS slightly worse than 109 best."}
{"round":51,"idea":"BK16-more-K-iterations","status":"DISCARD","tflops":89.184,"notes":"BK=16 doubles K-loop iterations. 89 TFLOPS vs 109 best."}
{"round":52,"idea":"interleave-load-compute","status":"DISCARD","tflops":108.366,"notes":"Interleave fragment loads with mma. 108 TFLOPS vs 109 best."}
{"round":53,"idea":"padding-16","status":"DISCARD","tflops":91.185,"notes":"Increased padding from +8 to +16. 91 TFLOPS worse due to memory overhead."}
{"round":54,"idea":"smem-align-256","status":"DISCARD","tflops":108.299,"notes":"Added 256-byte alignment to shared memory. 108 TFLOPS same as 109 best."}
{"round":55,"idea":"mma-loop-n-first","status":"DISCARD","tflops":107.918,"notes":"Reversed mma loop order (N before M). 108 TFLOPS same as best."}
{"round":56,"idea":"BM256-BN64","status":"DISCARD","tflops":78.736,"notes":"BM=256 BN=64 - small BN reduces B-matrix reuse. 79 TFLOPS worse than 109 best."}
{"round":57,"idea":"cooperative-groups-sync","status":"DISCARD","tflops":108.651,"notes":"Used cg::thread_block.sync() instead of __syncthreads(). 109 TFLOPS same as best."}
{"round":58,"idea":"disable-k-unroll","status":"DISCARD","tflops":108.228,"notes":"pragma unroll 1 on K loop. 108 TFLOPS same as best."}
{"round":59,"idea":"1x2-warp-tiles-BM64-BN128","status":"DISCARD","tflops":79.198,"notes":"Smaller 1x2 warp tiles. 79 TFLOPS worse than best."}
{"round":60,"idea":"4x2-warp-tiles-8warps","status":"COMPILE_FAIL","tflops":null,"notes":"4x2 warp tiles with 8 warps - warp mapping broken"}
{"round":61,"idea":"threadfence-block","status":"DISCARD","tflops":107.482,"notes":"Added __threadfence_block before syncthreads. 107 TFLOPS same as best."}
{"round":62,"idea":"use-fast-math","status":"DISCARD","tflops":107.737,"notes":"Compiled with --use_fast_math. 108 TFLOPS same as best."}
{"round":63,"idea":"maxrregcount-64","status":"COMPILE_FAIL","tflops":null,"notes":"Register limit 64 caused spilling and verification failure."}
{"round":64,"idea":"BK64-BM64","status":"COMPILE_FAIL","tflops":null,"notes":"BK=64 with BM=64 - load pattern not updated for new dimensions"}
{"round":65,"idea":"O2-optimization","status":"DISCARD","tflops":107.818,"notes":"Compiled with -O2 instead of -O3. 108 TFLOPS same as best."}
{"round":66,"idea":"cache-all-loads","status":"DISCARD","tflops":107.713,"notes":"Compiled with -Xptxas -dlcm=ca. 108 TFLOPS same as best."}
{"round":67,"idea":"cache-global-only","status":"DISCARD","tflops":107.706,"notes":"Compiled with -Xptxas -dlcm=cg. 108 TFLOPS same as best."}
{"round": 68, "iter": "iter065", "bottleneck": "latency_bound", "idea": "Double buffering with BM=64 BN=256 - arithmetic intensity too low", "category": "pipeline", "expected_gain": "+20 TFLOPS", "decision": "DISCARD", "tflops": 80.836, "timestamp": "2026-04-21T00:55:47Z"}
{"round": 69, "iter": "iter066", "bottleneck": "latency_bound", "idea": "cp.async for async global-to-shared memory transfers - 35% improvement", "category": "memory", "expected_gain": "+15 TFLOPS", "decision": "KEEP", "tflops": 143.56, "timestamp": "2026-04-21T00:59:44Z"}
{"round": 70, "iter": "iter067", "bottleneck": "latency_bound", "idea": "cp.async + double buffer BK=16 - reduced arithmetic intensity hurts more than pipelining helps", "category": "pipeline", "expected_gain": "+20 TFLOPS", "decision": "DISCARD", "tflops": 122.579, "timestamp": "2026-04-21T01:02:15Z"}
{"round": 71, "iter": "iter068", "bottleneck": "latency_bound", "idea": "cp.async BM=128 BN=256 - BM=256 BN=128 config is better", "category": "tiling", "expected_gain": "+10 TFLOPS", "decision": "DISCARD", "tflops": 134.859, "timestamp": "2026-04-21T01:04:05Z"}
{"round": 72, "iter": "iter069", "bottleneck": "latency_bound", "idea": "BK=64 exceeds 48KB shared memory limit", "category": "tiling", "expected_gain": "+15 TFLOPS", "decision": "COMPILE_FAIL", "tflops": 0.0, "timestamp": "2026-04-21T01:05:21Z"}
{"round": 73, "iter": "iter070", "bottleneck": "latency_bound", "idea": "3x3 warp tiles with BM=BN=192 - slight regression", "category": "tiling", "expected_gain": "+10 TFLOPS", "decision": "DISCARD", "tflops": 142.229, "timestamp": "2026-04-21T01:07:07Z"}
{"round": 74, "iter": "iter071", "bottleneck": "latency_bound", "idea": "Removing bounds checks caused verification failure", "category": "misc", "expected_gain": "+5 TFLOPS", "decision": "COMPILE_FAIL", "tflops": 0.0, "timestamp": "2026-04-21T01:08:35Z"}
{"round": 75, "iter": "iter072", "bottleneck": "latency_bound", "idea": "4x4 warp layout with 1x1 tiles failed verification - warp mapping issue", "category": "tiling", "expected_gain": "+5 TFLOPS", "decision": "COMPILE_FAIL", "tflops": 0.0, "timestamp": "2026-04-21T01:10:06Z"}
{"round": 76, "iter": "iter073", "bottleneck": "latency_bound", "idea": "Padding +4 broke timing - likely alignment issue with WMMA stride", "category": "memory", "expected_gain": "+3 TFLOPS", "decision": "COMPILE_FAIL", "tflops": 0.0, "timestamp": "2026-04-21T01:13:04Z"}
{"round": 77, "iter": "iter074", "bottleneck": "latency_bound", "idea": "Padding +16 wastes smem bandwidth - regression from +8", "category": "memory", "expected_gain": "+3 TFLOPS", "decision": "DISCARD", "tflops": 129.243, "timestamp": "2026-04-21T01:13:59Z"}
{"round": 78, "iter": "iter075", "bottleneck": "latency_bound", "idea": "8 warps with 4x4 tiles - register pressure hurts more than reduced warp overhead helps", "category": "tiling", "expected_gain": "+5 TFLOPS", "decision": "DISCARD", "tflops": 138.522, "timestamp": "2026-04-21T01:15:37Z"}
{"round": 79, "iter": "iter076", "bottleneck": "compute_bound", "idea": "Smaller tiles BM=128 BN=128 BK=16 for higher occupancy - less compute per memory load hurts", "category": "tiling", "expected_gain": "+10 TFLOPS", "decision": "DISCARD", "tflops": 108.431, "timestamp": "2026-04-21T01:27:27Z"}
{"round": 80, "iter": "iter077", "bottleneck": "compute_bound", "idea": "2-stage pipeline with BK=16 - verification failed due to indexing bug", "category": "pipeline", "expected_gain": "+15 TFLOPS", "decision": "COMPILE_FAIL", "tflops": 0.0, "timestamp": "2026-04-21T01:32:09Z"}
{"round": 81, "iter": "iter078", "bottleneck": "compute_bound", "idea": "256x256 tile with BK=16 - verification failed, warp indexing bug", "category": "tiling", "expected_gain": "+5 TFLOPS", "decision": "COMPILE_FAIL", "tflops": 0.0, "timestamp": "2026-04-21T01:34:39Z"}
{"round": 82, "iter": "iter079", "bottleneck": "compute_bound", "idea": "XOR swizzle breaks WMMA load layout - inf TFLOPS timing error", "category": "memory", "expected_gain": "+5 TFLOPS", "decision": "COMPILE_FAIL", "tflops": 0.0, "timestamp": "2026-04-21T01:37:35Z"}
{"round": 83, "iter": "iter080", "bottleneck": "compute_bound", "idea": "maxrregcount=128 capped registers but didnt improve - register spilling hurts", "category": "compute", "expected_gain": "+5 TFLOPS", "decision": "DISCARD", "tflops": 142.357, "timestamp": "2026-04-21T01:38:27Z"}
{"round": 84, "iter": "iter081", "bottleneck": "compute_bound", "idea": "BK=48 BM=192 - reduced parallelism hurts more than larger K helps", "category": "tiling", "expected_gain": "+5 TFLOPS", "decision": "DISCARD", "tflops": 129.286, "timestamp": "2026-04-21T01:41:09Z"}
{"round": 85, "iter": "iter082", "bottleneck": "compute_bound", "idea": "Removing syncthreads broke correctness - need sync between K iterations", "category": "misc", "expected_gain": "+3 TFLOPS", "decision": "COMPILE_FAIL", "tflops": 0.0, "timestamp": "2026-04-21T01:42:00Z"}
{"round": 86, "iter": "iter083", "bottleneck": "compute_bound", "idea": "BM=128 BK=48 - load pattern bug with non-divisible thread distribution", "category": "tiling", "expected_gain": "+5 TFLOPS", "decision": "COMPILE_FAIL", "tflops": 0.0, "timestamp": "2026-04-21T01:46:19Z"}
{"round": 87, "iter": "iter084", "bottleneck": "compute_bound", "idea": "BM=128 BK=64 - larger K tile increases compute density, 4 WMMA_K ops per iteration", "category": "tiling", "expected_gain": "+10 TFLOPS", "decision": "KEEP", "tflops": 161.209, "timestamp": "2026-04-21T01:49:03Z"}
{"round": 88, "iter": "iter085", "bottleneck": "compute_bound", "idea": "BK=96 exceeds 48KB smem limit", "category": "tiling", "expected_gain": "+10 TFLOPS", "decision": "COMPILE_FAIL", "tflops": 0.0, "timestamp": "2026-04-21T01:52:39Z"}
{"round": 89, "iter": "iter086", "bottleneck": "compute_bound", "idea": "BK=80 load pattern indexing bug - non-divisible row distribution", "category": "tiling", "expected_gain": "+5 TFLOPS", "decision": "COMPILE_FAIL", "tflops": 0.0, "timestamp": "2026-04-21T01:56:02Z"}
{"round": 90, "iter": "iter087", "bottleneck": "compute_bound", "idea": "BM=64 BK=64 - too few warps per block reduces compute efficiency", "category": "tiling", "expected_gain": "+5 TFLOPS", "decision": "DISCARD", "tflops": 105.8, "timestamp": "2026-04-21T01:59:07Z"}
