{"round": 91, "iter": "iter088", "bottleneck": "compute_bound", "idea": "Warp tile 1x8 - worse than 2x4, more B-matrix loads per warp", "category": "tiling", "expected_gain": "+5 TFLOPS", "decision": "DISCARD", "tflops": 134.686, "timestamp": "2026-04-21T02:01:45Z"}
{"round": 92, "iter": "iter089", "bottleneck": "compute_bound", "idea": "Warp tile 4x2 - better A-matrix reuse per warp, 0.3 TFLOPS improvement", "category": "tiling", "expected_gain": "+5 TFLOPS", "decision": "KEEP", "tflops": 161.552, "timestamp": "2026-04-21T02:04:17Z"}
{"round": 93, "iter": "iter090", "bottleneck": "compute_bound", "idea": "Warp tile 3x3 with only 4 warps - insufficient parallelism hurts", "category": "tiling", "expected_gain": "+3 TFLOPS", "decision": "DISCARD", "tflops": 113.965, "timestamp": "2026-04-21T02:07:01Z"}
{"round": 94, "iter": "iter091", "bottleneck": "memory_bound", "idea": "Reduced register pressure with maxrregcount=64, smaller BM=64 - occupancy improved but compute/memory throughput dropped", "category": "compute", "expected_gain": "+30 TFLOPS", "decision": "DISCARD", "tflops": 105.612, "timestamp": "2026-04-22T00:39:13Z"}
{"round": 95, "iter": "iter092", "bottleneck": "memory_bound", "idea": "3-stage double-buffered pipeline - verification failed due to incorrect pipeline state management", "category": "pipeline", "expected_gain": "+20 TFLOPS", "decision": "COMPILE_FAIL", "tflops": 0.0, "timestamp": "2026-04-22T00:42:53Z"}
{"round": 96, "iter": "iter093", "bottleneck": "memory_bound", "idea": "BM=256 BN=64 for improved A matrix reuse - worse due to reduced parallelism in N dimension", "category": "tiling", "expected_gain": "+15 TFLOPS", "decision": "DISCARD", "tflops": 133.814, "timestamp": "2026-04-22T00:44:27Z"}
{"round": 97, "iter": "iter094", "bottleneck": "memory_bound", "idea": "BK=128 with dynamic shared memory - more compute per K iteration but higher smem pressure", "category": "tiling", "expected_gain": "+10 TFLOPS", "decision": "DISCARD", "tflops": 146.242, "timestamp": "2026-04-22T00:46:01Z"}
{"round": 98, "iter": "iter095", "bottleneck": "compute_bound", "idea": "WGMMA requires CUTLASS/CuTe headers and complex PTX - pivoting to choreo DSL for WGMMA access", "category": "compute", "expected_gain": "+100 TFLOPS", "decision": "COMPILE_FAIL", "tflops": 0.0, "timestamp": "2026-04-22T00:47:50Z"}
{"round": 99, "iter": "iter096", "bottleneck": "memory_bound", "idea": "Vectorized stores via shared memory staging - smem overflow (128KB needed)", "category": "memory", "expected_gain": "+5 TFLOPS", "decision": "COMPILE_FAIL", "tflops": 0.0, "timestamp": "2026-04-22T00:50:18Z"}
{"round": 100, "iter": "iter097", "bottleneck": "memory_bound", "idea": "BN=192 tile - verification failed due to load pattern bug", "category": "tiling", "expected_gain": "+8 TFLOPS", "decision": "COMPILE_FAIL", "tflops": 0.0, "timestamp": "2026-04-22T00:51:47Z"}
{"round": 101, "iter": "iter098", "bottleneck": "memory_bound", "idea": "BM=64 BN=256 - too wide N tile reduces M parallelism significantly", "category": "tiling", "expected_gain": "+10 TFLOPS", "decision": "DISCARD", "tflops": 85.37, "timestamp": "2026-04-22T00:53:41Z"}
