iter	kernel	tflops	decision	bottleneck	idea
iter000	iter000_baseline	452.40	KEEP	baseline	cuBLAS reference 452.40 TFLOPS
iter001	iter001_draft	24.50	KEEP	launch_bound	First WMMA bf16 draft kernel
iter002	iter002_vecload	5.36	DISCARD	launch_bound	Vectorize global-to-smem loads with float4, remove launch_bounds, BK=64
iter003	iter003_dbuf	2.60	DISCARD	launch_bound	Double-buffered smem with register-cached loads, BK=32
iter004	iter004_smalltile	1.38	DISCARD	launch_bound	Reduce tile to BM=64 BN=64 BK=32 for higher occupancy
iter005	iter005_mmasync	0.0	DISCARD	launch_bound	mma.sync PTX + manual B fragment loading - incorrect register layout
iter006	iter006_coalesced	8.60	DISCARD	launch_bound	128-bit coalesced loads into padded smem - padding broke alignment
iter007	iter007_nopad	1.78	DISCARD	launch_bound	Remove smem padding + maxrregcount=128 for higher occupancy
