{"round": 0, "iter": "iter000", "bottleneck": "baseline", "idea": "cuBLAS reference baseline", "category": "baseline", "expected_gain": "baseline reference", "decision": "KEEP", "tflops": 431.3489, "timestamp": "2026-04-18T15:52:56Z"}
{"round": 1, "iter": "iter001", "bottleneck": "compute_bound", "idea": "Adapted proven 64x128 1p1c wide-N starting kernel to the 2048x16384x2048 target; verified correctness and established the first custom baseline at 255.305 TFLOPS.", "category": "compute", "expected_gain": "initial custom baseline", "decision": "KEEP", "tflops": 255.305, "timestamp": "2026-04-18T16:00:52Z"}
{"round": 2, "iter": "iter002", "bottleneck": "compute_bound", "idea": "Tried a structural ws1p2c 128x128 tile to raise WGMMA issue on the compute-bound baseline, but the added shared-memory footprint and larger CTA reduced net performance to 221.098 TFLOPS, below iter001.", "category": "compute", "expected_gain": "+10 to +25 TFLOPS", "decision": "DISCARD", "tflops": 221.098, "timestamp": "2026-04-18T16:06:08Z"}
{"round": 3, "iter": "iter003", "bottleneck": "compute_bound", "idea": "Increased WARP_N from 128 to 160 on the 1p1c base to raise WGMMA work per producer load, but the wider tile reduced net throughput to 175.719 TFLOPS and underperformed the original iter001 baseline.", "category": "compute", "expected_gain": "+5 to +15 TFLOPS", "decision": "DISCARD", "tflops": 175.719, "timestamp": "2026-04-18T16:09:10Z"}
{"round": 4, "iter": "iter004", "bottleneck": "compute_bound", "idea": "Tried the stmatrix compiler flag on the 1p1c fp32-accumulator base after SASS comparison, but Choreo codegen fails because stmatrix store currently requires a 16-bit accumulator type and cannot materialize the fp32 output path.", "category": "compute", "expected_gain": "+5 to +20 TFLOPS", "decision": "COMPILE_FAIL", "tflops": 0.0, "timestamp": "2026-04-18T16:12:16Z"}
{"round": 5, "iter": "iter005", "bottleneck": "compute_bound", "idea": "Persistent 1p1c scheduling preserved the 64x128 microkernel but cut throughput to 115.8 TFLOPS, so keeping CTAs resident per SM did not improve this low-occupancy compute-bound shape.", "category": "pipeline", "expected_gain": "+5 to +15 TFLOPS", "decision": "DISCARD", "tflops": 115.792, "timestamp": "2026-04-18T16:17:36Z"}
{"round": 6, "iter": "iter006", "bottleneck": "compute_bound", "idea": "Adding __launch_bounds__(256, 2) to the proven 1p1c CUDA raised throughput to 261.055 TFLOPS, so explicitly steering Hopper toward two resident CTAs per SM helped this low-occupancy compute-bound kernel.", "category": "compute", "expected_gain": "+3 to +12 TFLOPS", "decision": "KEEP", "tflops": 261.055, "timestamp": "2026-04-18T16:20:22Z"}
{"round": 7, "iter": "iter007", "bottleneck": "compute_bound", "idea": "Adding nvcc --use_fast_math on top of the launch_bounds(256,2) best held performance at 260.805 TFLOPS but did not beat the 261.055 TFLOPS baseline, so fast math is neutral-to-slightly negative on this kernel.", "category": "compute", "expected_gain": "+2 to +10 TFLOPS", "decision": "DISCARD", "tflops": 260.805, "timestamp": "2026-04-18T16:30:10Z"}
{"round": 8, "iter": "iter008", "bottleneck": "compute_bound", "idea": "Explicitly unrolling the fixed 4-step WGMMA loop on top of launch_bounds(256,2) held performance at 260.853 TFLOPS but still missed the 261.055 TFLOPS best, so manual unrolling is neutral-to-slightly negative here.", "category": "compute", "expected_gain": "+2 to +8 TFLOPS", "decision": "DISCARD", "tflops": 260.853, "timestamp": "2026-04-18T16:32:17Z"}
{"round": 9, "iter": "iter009", "bottleneck": "compute_bound", "idea": "Moving warpgroup_arrive out of the 4-step WGMMA micro-loop raised throughput to 262.241 TFLOPS, showing that reducing per-stage synchronization overhead helps this compute-bound 1p1c kernel.", "category": "pipeline", "expected_gain": "+3 to +12 TFLOPS", "decision": "KEEP", "tflops": 262.241, "timestamp": "2026-04-18T16:34:46Z"}
{"round": 10, "iter": "iter010", "bottleneck": "compute_bound", "idea": "Adding explicit unroll on top of the iter009 arrive_once synchronization cleanup held performance at 262.212 TFLOPS, so the barrier fix helps but extra loop unrolling is neutral-to-slightly negative on this base.", "category": "compute", "expected_gain": "+1 to +6 TFLOPS", "decision": "DISCARD", "tflops": 262.212, "timestamp": "2026-04-18T16:38:31Z"}
{"round": 11, "iter": "iter011", "bottleneck": "compute_bound", "idea": "Adding nvcc --use_fast_math on top of the iter009 arrive_once synchronization cleanup nudged throughput up to 262.281 TFLOPS, so math contraction is slightly additive once the redundant warpgroup arrives are removed.", "category": "compute", "expected_gain": "+1 to +6 TFLOPS", "decision": "KEEP", "tflops": 262.281, "timestamp": "2026-04-18T16:41:21Z"}
{"round": 12, "iter": "iter012", "bottleneck": "compute_bound", "idea": "Remapping CTAs through a 4-way block swizzle on top of iter011 collapsed throughput to 232.022 TFLOPS, so this wide-N 32x128 tile grid prefers the original launch order over swizzled block scheduling.", "category": "pipeline", "expected_gain": "+1 to +8 TFLOPS", "decision": "DISCARD", "tflops": 232.022, "timestamp": "2026-04-18T19:38:04Z"}
{"round": 13, "iter": "iter013", "bottleneck": "compute_bound", "idea": "Promoting the two input TMA tensor maps to L2_256B on top of iter011 raised throughput to 263.300 TFLOPS, indicating that a small amount of input tile cache residency helps this wide-N kernel without changing its compute pipeline.", "category": "memory", "expected_gain": "+1 to +5 TFLOPS", "decision": "KEEP", "tflops": 263.3, "timestamp": "2026-04-18T19:40:53Z"}
{"round": 14, "iter": "iter014", "bottleneck": "compute_bound", "idea": "Forcing launch_bounds(256,3) on top of iter013 could not compile because ptxas had to target 80 registers while the kernel still required at least 90+, so the higher-residency direction is currently blocked by register pressure rather than runtime behavior.", "category": "compute", "expected_gain": "+1 to +6 TFLOPS", "decision": "COMPILE_FAIL", "tflops": 0.0, "timestamp": "2026-04-18T19:45:16Z"}
{"round": 15, "iter": "iter015", "bottleneck": "compute_bound", "idea": "Capping ptxas at 120 registers on top of iter013 did not change the compiled kernel because launch-bounds still forced an entry-specific 128-register target, and the measured result slipped to 263.127 TFLOPS, so this register-cap path is ineffective here.", "category": "compute", "expected_gain": "+1 to +4 TFLOPS", "decision": "DISCARD", "tflops": 263.127, "timestamp": "2026-04-18T19:48:40Z"}
{"round": 16, "iter": "iter016", "bottleneck": "compute_bound", "idea": "Adding Choreo hoist-offset and hoist-scale on top of iter013 preserved correctness but only reached 263.004 TFLOPS, so address-generation hoisting is neutral-to-slightly negative for this compute-bound wide-N kernel.", "category": "compute", "expected_gain": "+1 to +5 TFLOPS", "decision": "DISCARD", "tflops": 263.004, "timestamp": "2026-04-18T19:51:56Z"}
{"round": 17, "iter": "iter017", "bottleneck": "compute_bound", "idea": "Switching the iter013 base onto Choreo ptx-barrier preserved correctness and nearly matched the best result at 263.270 TFLOPS, but it still missed the 263.300 TFLOPS leader, so lighter PTX barriers are effectively neutral on this kernel.", "category": "compute", "expected_gain": "+1 to +6 TFLOPS", "decision": "DISCARD", "tflops": 263.27, "timestamp": "2026-04-18T19:54:36Z"}
{"round": 18, "iter": "iter018", "bottleneck": "compute_bound", "idea": "Moving WGMMA completion waiting to warpgroup_wait<1>() inside the K-loop and flushing with warpgroup_wait<0>() only after the loop raised throughput to 264.555 TFLOPS, confirming that overlap between tile K compute and tile K+1 TMA was being left on the table.", "category": "compute", "expected_gain": "+2 to +12 TFLOPS", "decision": "KEEP", "tflops": 264.555, "timestamp": "2026-04-18T19:57:28Z"}
{"round": 18, "iter": "iter018", "bottleneck": "compute_bound", "idea": "Moving WGMMA completion waiting to warpgroup_wait<1>() inside the K-loop and flushing with warpgroup_wait<0>() only after the loop raised throughput to 264.555 TFLOPS, confirming that overlap between tile K compute and tile K+1 TMA was being left on the table.", "category": "compute", "expected_gain": "+2 to +12 TFLOPS", "decision": "KEEP", "tflops": 264.555, "timestamp": "2026-04-18T19:59:27Z"}
{"round": 19, "iter": "iter019", "bottleneck": "compute_bound", "idea": "Keeping iter018s wait1 overlap but moving empty[stage].arrive() ahead of warpgroup_wait<1>() slightly regressed to 264.512 TFLOPS, so producer release was already early enough and this barrier split did not create additional useful overlap.", "category": "compute", "expected_gain": "+0.2 to +3 TFLOPS", "decision": "DISCARD", "tflops": 264.512, "timestamp": "2026-04-18T19:59:49Z"}
{"round": 20, "iter": "iter020", "bottleneck": "compute_bound", "idea": "Regenerating the iter018 wait1-overlap base with Choreo ptx-barrier and then restoring launch_bounds(256,2), arrive-once, input L2 promotion, and the in-loop warpgroup_wait<1>() path raised throughput to 264.980 TFLOPS, showing lighter CTA barrier codegen compounds with the existing producer-consumer overlap.", "category": "compute", "expected_gain": "+0.1 to +2 TFLOPS", "decision": "KEEP", "tflops": 264.98, "timestamp": "2026-04-18T20:03:36Z"}
{"round": 21, "iter": "iter021", "bottleneck": "compute_bound", "idea": "Keeping the iter020 wait1+ptxbar pipeline intact but splitting the 64x128 epilogue shared store into two 64x64 store_fragment_d calls over the same 128-stride tile raised throughput to 265.073 TFLOPS, confirming that shared-store bank conflicts in the epilogue were still costing a measurable amount.", "category": "compute", "expected_gain": "+0.1 to +3 TFLOPS", "decision": "KEEP", "tflops": 265.073, "timestamp": "2026-04-18T20:10:46Z"}
{"round": 25, "iter": "iter022", "bottleneck": "compute_bound", "idea": "Keeping iter021 wait1+ptxbar intact but replacing the shared 64x128 output tile with two independent 64x64 output buffers and two 64-wide TMA shared-to-global stores cut residual shared-store conflicts structurally, yet the added epilogue store path overhead dropped throughput to 264.012 TFLOPS, so the dual-TMA epilogue is not a win on this shape.", "category": "memory", "expected_gain": "+0.1 to +3 TFLOPS", "decision": "DISCARD", "tflops": 264.012, "timestamp": "2026-04-18T23:02:11Z"}
{"round": 26, "iter": "iter023", "bottleneck": "compute_bound", "idea": "Keeping iter021 split-epilogue best path intact but deepening the main-loop overlap from warpgroup_wait<1>() to warpgroup_wait<2>() improved throughput to 265.218 TFLOPS, indicating the three-stage pipeline still had a small amount of usable producer-consumer overlap left in the barrier-limited steady state.", "category": "compute", "expected_gain": "+0.1 to +3 TFLOPS", "decision": "KEEP", "tflops": 265.218, "timestamp": "2026-04-18T23:04:32Z"}
{"round": 27, "iter": "iter024", "bottleneck": "compute_bound", "idea": "Keeping iter023 wait2 split-epilogue best path intact but pre-arriving the next full barrier before its TMA completion regressed to 262.508 TFLOPS, showing that more aggressive consumer-side barrier registration reduced effective overlap instead of improving eligible-warps.", "category": "pipeline", "expected_gain": "+0.2 to +3 TFLOPS", "decision": "DISCARD", "tflops": 262.508, "timestamp": "2026-04-18T23:08:23Z"}
{"round": 28, "iter": "iter025", "bottleneck": "compute_bound", "idea": "Keeping iter023 wait2 split-epilogue best path intact but explicitly unrolling the 32-step outer K loop regressed to 262.060 TFLOPS, showing that a larger nvcc scheduling window alone did not improve this shape steady-state issue efficiency.", "category": "compute", "expected_gain": "+0.1 to +3 TFLOPS", "decision": "DISCARD", "tflops": 262.06, "timestamp": "2026-04-18T23:10:18Z"}
{"round": 29, "iter": "iter026", "bottleneck": "compute_bound", "idea": "Keeping iter023 wait2 split-epilogue best path intact but writing the two 64x64 output fragments into padded 64x65 shared tiles and then repacking them back into the single 64x128 output tile regressed to 243.621 TFLOPS, showing that the added shared repack work outweighed any reduction in epilogue bank conflicts.", "category": "memory", "expected_gain": "+0.1 to +3 TFLOPS", "decision": "DISCARD", "tflops": 243.621, "timestamp": "2026-04-19T03:28:56Z"}
{"round": 30, "iter": "iter027", "bottleneck": "compute_bound", "idea": "Keeping iter023 wait2 split-epilogue intact but switching to launch_bounds(256,1) plus setmaxnreg register trading hung with no timing output after more than two minutes of full utilization, indicating this regctrl pattern deadlocks or starves forward progress on this shape.", "category": "compute", "expected_gain": "+0.1 to +3 TFLOPS", "decision": "HANG", "tflops": 0.0, "timestamp": "2026-04-19T03:37:14Z"}
{"round": 31, "iter": "iter028", "bottleneck": "compute_bound", "idea": "Keeping iter023 wait2 split-epilogue intact and changing only launch_bounds from (256,2) to (256,1) nearly matched the best result at 265.205 TFLOPS but still lost by 0.013 TFLOPS, showing that a larger compiler register budget alone does not justify giving up the second resident CTA.", "category": "compute", "expected_gain": "+0.1 to +2 TFLOPS", "decision": "DISCARD", "tflops": 265.205, "timestamp": "2026-04-19T03:38:38Z"}
{"round": 32, "iter": "iter029", "bottleneck": "compute_bound", "idea": "Keeping the iter023 wait2 split-epilogue best path but reducing pipeline depth to 2 stages and using an in-loop wait1 drain regressed sharply to 244.323 TFLOPS, showing that the reduced staging depth collapses overlap more than it saves in barrier/shared overhead.", "category": "pipeline", "expected_gain": "+0.1 to +2 TFLOPS", "decision": "DISCARD", "tflops": 244.323, "timestamp": "2026-04-19T04:37:05Z"}
