{"round": 0, "iter": "iter000", "bottleneck": "baseline", "idea": "cuBLAS reference baseline", "category": "baseline", "expected_gain": "baseline reference", "decision": "KEEP", "tflops": 415.6494, "timestamp": "2026-04-21T12:12:53Z"}
{"round": 1, "iter": "iter001", "bottleneck": "memory_bound", "idea": "Baseline TileLang matmul with tensor cores: 128x128x64 tiles, 3 stages, panel_size=8", "category": "tiling", "expected_gain": "baseline", "decision": "KEEP", "tflops": 316.84, "timestamp": "2026-04-21T12:14:08Z"}
{"round": 2, "iter": "iter002", "bottleneck": "compute_bound", "idea": "Increase BLOCK_N to 192 for better compute intensity", "category": "tiling", "expected_gain": "+10-20 TFLOPS", "decision": "KEEP", "tflops": 335.55, "timestamp": "2026-04-21T12:16:04Z"}
{"round": 3, "iter": "iter003", "bottleneck": "compute_bound", "idea": "BLOCK_K=128 exceeded shared memory limit", "category": "tiling", "expected_gain": "+10-15 TFLOPS", "decision": "COMPILE_FAIL", "tflops": 0.0, "timestamp": "2026-04-21T12:18:00Z"}
{"round": 4, "iter": "iter004", "bottleneck": "compute_bound", "idea": "BLOCK_K=128 with stages=2 to fit shared memory", "category": "tiling", "expected_gain": "+10-15 TFLOPS", "decision": "KEEP", "tflops": 343.47, "timestamp": "2026-04-21T12:18:00Z"}
{"round": 5, "iter": "iter005", "bottleneck": "compute_bound", "idea": "Increase panel_size to 10 for L2 locality", "category": "memory", "expected_gain": "+5-10 TFLOPS", "decision": "DISCARD", "tflops": 341.19, "timestamp": "2026-04-21T12:19:23Z"}
{"round": 6, "iter": "iter006", "bottleneck": "compute_bound", "idea": "panel_size=6 for different L2 pattern", "category": "memory", "expected_gain": "+5-10 TFLOPS", "decision": "DISCARD", "tflops": 342.46, "timestamp": "2026-04-21T12:20:10Z"}
{"round": 7, "iter": "iter007", "bottleneck": "compute_bound", "idea": "BLOCK_M=256 caused severe occupancy drop", "category": "tiling", "expected_gain": "+5-10 TFLOPS", "decision": "DISCARD", "tflops": 89.13, "timestamp": "2026-04-21T12:20:50Z"}
{"round": 8, "iter": "iter008", "bottleneck": "compute_bound", "idea": "64x256x64 too small BLOCK_M hurts perf", "category": "tiling", "expected_gain": "+5-10 TFLOPS", "decision": "DISCARD", "tflops": 259.41, "timestamp": "2026-04-21T12:21:27Z"}
{"round": 9, "iter": "iter009", "bottleneck": "compute_bound", "idea": "threads=256 caused register pressure", "category": "compute", "expected_gain": "+5-10 TFLOPS", "decision": "DISCARD", "tflops": 267.91, "timestamp": "2026-04-21T12:22:05Z"}
{"round": 10, "iter": "iter010", "bottleneck": "compute_bound", "idea": "stages=4 with BLOCK_K=64 increases overhead", "category": "pipeline", "expected_gain": "+5-10 TFLOPS", "decision": "DISCARD", "tflops": 312.44, "timestamp": "2026-04-21T12:23:00Z"}
{"round": 11, "iter": "iter011", "bottleneck": "compute_bound", "idea": "128x256 severe occupancy drop", "category": "tiling", "expected_gain": "+5-10 TFLOPS", "decision": "DISCARD", "tflops": 54.92, "timestamp": "2026-04-21T12:23:53Z"}
{"round": 12, "iter": "iter012", "bottleneck": "compute_bound", "idea": "BLOCK_K=96 less efficient than 128", "category": "tiling", "expected_gain": "+5-10 TFLOPS", "decision": "DISCARD", "tflops": 338.11, "timestamp": "2026-04-21T12:24:30Z"}
{"round": 13, "iter": "iter013", "bottleneck": "compute_bound", "idea": "BLOCK_M=96 not divisible by 16 for WGMMA", "category": "tiling", "expected_gain": "+5-10 TFLOPS", "decision": "COMPILE_FAIL", "tflops": 0.0, "timestamp": "2026-04-21T12:25:01Z"}
{"round": 14, "iter": "iter014", "bottleneck": "compute_bound", "idea": "64x192x128 insufficient compute density", "category": "tiling", "expected_gain": "+5-10 TFLOPS", "decision": "DISCARD", "tflops": 232.92, "timestamp": "2026-04-21T12:25:37Z"}
{"round": 15, "iter": "iter015", "bottleneck": "compute_bound", "idea": "BLOCK_N=160 causes grid inefficiency", "category": "tiling", "expected_gain": "+5-10 TFLOPS", "decision": "DISCARD", "tflops": 274.24, "timestamp": "2026-04-21T12:26:19Z"}
{"round": 16, "iter": "iter016", "bottleneck": "compute_bound", "idea": "128x224 severe occupancy drop", "category": "tiling", "expected_gain": "+5-10 TFLOPS", "decision": "DISCARD", "tflops": 154.46, "timestamp": "2026-04-21T12:27:04Z"}
{"round": 17, "iter": "iter017", "bottleneck": "compute_bound", "idea": "panel_size=4 reduces L2 locality", "category": "memory", "expected_gain": "+5-10 TFLOPS", "decision": "DISCARD", "tflops": 318.85, "timestamp": "2026-04-21T12:27:39Z"}
{"round": 18, "iter": "iter018", "bottleneck": "compute_bound", "idea": "128x128 square tiles less efficient", "category": "tiling", "expected_gain": "+5-10 TFLOPS", "decision": "DISCARD", "tflops": 226.82, "timestamp": "2026-04-21T12:28:54Z"}
{"round": 19, "iter": "iter019", "bottleneck": "memory_bound", "idea": "No swizzle hurts L2 locality badly", "category": "memory", "expected_gain": "+5-10 TFLOPS", "decision": "DISCARD", "tflops": 141.76, "timestamp": "2026-04-21T12:29:32Z"}
{"round": 20, "iter": "iter020", "bottleneck": "compute_bound", "idea": "64x192 with stages=4 insufficient compute density", "category": "tiling", "expected_gain": "+5-10 TFLOPS", "decision": "DISCARD", "tflops": 252.47, "timestamp": "2026-04-21T12:30:37Z"}
{"round": 21, "iter": "iter021", "bottleneck": "memory_bound", "idea": "panel_size=9 worsens L2 locality", "category": "memory", "expected_gain": "+5-10 TFLOPS", "decision": "DISCARD", "tflops": 211.38, "timestamp": "2026-04-21T12:31:14Z"}
{"round": 22, "iter": "iter022", "bottleneck": "compute_bound", "idea": "192x192 severe occupancy drop", "category": "tiling", "expected_gain": "+5-10 TFLOPS", "decision": "DISCARD", "tflops": 131.52, "timestamp": "2026-04-21T12:32:16Z"}
{"round": 23, "iter": "iter023", "bottleneck": "compute_bound", "idea": "BLOCK_K=64 stages=3 close but lower than k128s2", "category": "pipeline", "expected_gain": "+5-10 TFLOPS", "decision": "DISCARD", "tflops": 336.37, "timestamp": "2026-04-21T12:32:48Z"}
{"round": 24, "iter": "iter024", "bottleneck": "compute_bound", "idea": "threads=192 causes work imbalance", "category": "compute", "expected_gain": "+5-10 TFLOPS", "decision": "DISCARD", "tflops": 239.11, "timestamp": "2026-04-21T12:33:27Z"}
{"round": 25, "iter": "iter025", "bottleneck": "compute_bound", "idea": "BLOCK_K=32 too many inner loop iterations", "category": "pipeline", "expected_gain": "+5-10 TFLOPS", "decision": "DISCARD", "tflops": 259.91, "timestamp": "2026-04-21T12:34:04Z"}
{"round": 26, "iter": "iter026", "bottleneck": "memory_bound", "idea": "BLOCK_N=144 causes TMA fallback warning", "category": "tiling", "expected_gain": "+5-10 TFLOPS", "decision": "DISCARD", "tflops": 164.17, "timestamp": "2026-04-21T12:35:12Z"}
{"round": 27, "iter": "iter027", "bottleneck": "compute_bound", "idea": "panel_size=7 less efficient than 8", "category": "memory", "expected_gain": "+5-10 TFLOPS", "decision": "DISCARD", "tflops": 331.52, "timestamp": "2026-04-21T12:35:55Z"}
{"round": 28, "iter": "iter028", "bottleneck": "latency_bound", "idea": "64x64 tiles too small causing launch overhead", "category": "tiling", "expected_gain": "+5-10 TFLOPS", "decision": "DISCARD", "tflops": 185.31, "timestamp": "2026-04-21T12:36:41Z"}
{"round": 29, "iter": "iter029", "bottleneck": "memory_bound", "idea": "BLOCK_N=176 causes TMA fallback", "category": "tiling", "expected_gain": "+5-10 TFLOPS", "decision": "DISCARD", "tflops": 146.74, "timestamp": "2026-04-21T12:37:29Z"}
{"round": 30, "iter": "iter030", "bottleneck": "compute_bound", "idea": "panel_size=12 close but less than panel_size=8", "category": "memory", "expected_gain": "+5-10 TFLOPS", "decision": "DISCARD", "tflops": 340.48, "timestamp": "2026-04-21T12:38:08Z"}
{"round": 31, "iter": "iter031", "bottleneck": "compute_bound", "idea": "panel_size=16 slightly worse than 8", "category": "memory", "expected_gain": "+5-10 TFLOPS", "decision": "DISCARD", "tflops": 341.77, "timestamp": "2026-04-21T12:39:08Z"}
{"round": 32, "iter": "iter032", "bottleneck": "memory_bound", "idea": "stages=1 no pipelining hurts perf significantly", "category": "pipeline", "expected_gain": "+5-10 TFLOPS", "decision": "DISCARD", "tflops": 232.96, "timestamp": "2026-04-21T12:39:56Z"}
{"round": 33, "iter": "iter033", "bottleneck": "compute_bound", "idea": "192x128 transposed tiles less efficient than 128x192", "category": "tiling", "expected_gain": "+5-10 TFLOPS", "decision": "DISCARD", "tflops": 321.66, "timestamp": "2026-04-21T12:40:38Z"}
{"round": 34, "iter": "iter034", "bottleneck": "memory_bound", "idea": "BLOCK_K=80 triggers TMA fallback", "category": "tiling", "expected_gain": "+5-10 TFLOPS", "decision": "DISCARD", "tflops": 212.57, "timestamp": "2026-04-21T12:41:57Z"}
{"round": 35, "iter": "iter035", "bottleneck": "memory_bound", "idea": "panel_size=2 too aggressive L2 thrashing", "category": "memory", "expected_gain": "+5-10 TFLOPS", "decision": "DISCARD", "tflops": 288.24, "timestamp": "2026-04-21T12:42:33Z"}
{"round": 36, "iter": "iter036", "bottleneck": "compute_bound", "idea": "64x128 small tiles high pipeline depth not enough compute density", "category": "tiling", "expected_gain": "+5-10 TFLOPS", "decision": "DISCARD", "tflops": 233.05, "timestamp": "2026-04-21T12:43:19Z"}
{"round": 37, "iter": "iter037", "bottleneck": "latency_bound", "idea": "128x256 tiles too large causing register pressure", "category": "tiling", "expected_gain": "+5-10 TFLOPS", "decision": "DISCARD", "tflops": 81.82, "timestamp": "2026-04-21T12:44:08Z"}
{"round": 38, "iter": "iter038", "bottleneck": "latency_bound", "idea": "192x192 square tiles reduced register locality", "category": "tiling", "expected_gain": "+5-10 TFLOPS", "decision": "DISCARD", "tflops": 77.45, "timestamp": "2026-04-21T12:44:44Z"}
{"round": 39, "iter": "iter039", "bottleneck": "compute_bound", "idea": "128x128 with K=32 not enough GEMM ops per tile", "category": "tiling", "expected_gain": "+5-10 TFLOPS", "decision": "DISCARD", "tflops": 274.7, "timestamp": "2026-04-21T12:45:20Z"}
{"round": 40, "iter": "iter040", "bottleneck": "memory_bound", "idea": "K=64 with stages=3 insufficient compute hiding", "category": "pipeline", "expected_gain": "+5-10 TFLOPS", "decision": "DISCARD", "tflops": 239.02, "timestamp": "2026-04-21T12:45:57Z"}
{"round": 41, "iter": "iter041", "bottleneck": "compute_bound", "idea": "64x256 wide tiles imbalanced warp utilization", "category": "tiling", "expected_gain": "+10 TFLOPS", "decision": "DISCARD", "tflops": 278.42, "timestamp": "2026-04-21T12:46:32Z"}
{"round": 42, "iter": "iter042", "bottleneck": "memory_bound", "idea": "256x128 tall tiles hurt B matrix reuse", "category": "tiling", "expected_gain": "+10 TFLOPS", "decision": "DISCARD", "tflops": 164.34, "timestamp": "2026-04-21T12:47:12Z"}
{"round": 43, "iter": "iter043", "bottleneck": "compute_bound", "idea": "K=64 stages=4 shared memory overhead vs iter004", "category": "pipeline", "expected_gain": "+10 TFLOPS", "decision": "DISCARD", "tflops": 307.31, "timestamp": "2026-04-21T12:47:52Z"}
{"round": 44, "iter": "iter044", "bottleneck": "compute_bound", "idea": "K=96 approaching optimal but still below K=128", "category": "tiling", "expected_gain": "+10 TFLOPS", "decision": "DISCARD", "tflops": 330.41, "timestamp": "2026-04-21T12:48:25Z"}
{"round": 45, "iter": "iter045", "bottleneck": "memory_bound", "idea": "K=112 triggers TMA fallback losing efficiency", "category": "tiling", "expected_gain": "+10 TFLOPS", "decision": "DISCARD", "tflops": 207.2, "timestamp": "2026-04-21T12:49:09Z"}
{"round": 46, "iter": "iter046", "bottleneck": "latency_bound", "idea": "256 N-tile causes severe occupancy drop", "category": "tiling", "expected_gain": "+10 TFLOPS", "decision": "DISCARD", "tflops": 34.95, "timestamp": "2026-04-21T12:50:03Z"}
{"round": 47, "iter": "iter047", "bottleneck": "memory_bound", "idea": "64x192 small M-tile poor A matrix reuse", "category": "tiling", "expected_gain": "+10 TFLOPS", "decision": "DISCARD", "tflops": 120.58, "timestamp": "2026-04-21T12:50:41Z"}
{"round": 48, "iter": "iter048", "bottleneck": "latency_bound", "idea": "panel_size=4 worse L2 locality than 8", "category": "memory", "expected_gain": "+10 TFLOPS", "decision": "DISCARD", "tflops": 179.95, "timestamp": "2026-04-21T12:51:17Z"}
{"round": 49, "iter": "iter049", "bottleneck": "latency_bound", "idea": "128x128x128 stages=3 excessive shared memory", "category": "pipeline", "expected_gain": "+10 TFLOPS", "decision": "DISCARD", "tflops": 166.07, "timestamp": "2026-04-21T12:51:54Z"}
{"round": 50, "iter": "iter050", "bottleneck": "latency_bound", "idea": "192x192 square tiles high register pressure", "category": "tiling", "expected_gain": "+10 TFLOPS", "decision": "DISCARD", "tflops": 81.88, "timestamp": "2026-04-21T12:52:41Z"}
{"round": 51, "iter": "iter051", "bottleneck": "latency_bound", "idea": "256 threads causes register spilling and occupancy drop", "category": "compute", "expected_gain": "+10 TFLOPS", "decision": "DISCARD", "tflops": 98.87, "timestamp": "2026-04-21T12:53:31Z"}
{"round": 52, "iter": "iter052", "bottleneck": "latency_bound", "idea": "64 threads insufficient parallelism for large tiles", "category": "compute", "expected_gain": "+10 TFLOPS", "decision": "DISCARD", "tflops": 18.31, "timestamp": "2026-04-21T12:54:35Z"}
{"round": 53, "iter": "iter053", "bottleneck": "compute_bound", "idea": "128x128 square tiles lower B matrix reuse than 128x192", "category": "tiling", "expected_gain": "+10 TFLOPS", "decision": "DISCARD", "tflops": 177.6, "timestamp": "2026-04-21T12:55:09Z"}
{"round": 54, "iter": "iter054", "bottleneck": "latency_bound", "idea": "N=224 causes TMA inefficiency and grid imbalance", "category": "tiling", "expected_gain": "+10 TFLOPS", "decision": "DISCARD", "tflops": 67.5, "timestamp": "2026-04-21T12:55:47Z"}
{"round": 55, "iter": "iter055", "bottleneck": "compute_bound", "idea": "N=160 grid imbalance vs 192", "category": "tiling", "expected_gain": "+10 TFLOPS", "decision": "DISCARD", "tflops": 137.14, "timestamp": "2026-04-21T12:56:23Z"}
{"round": 56, "iter": "iter056", "bottleneck": "compute_bound", "idea": "192x128 worse B reuse pattern than 128x192", "category": "tiling", "expected_gain": "+10 TFLOPS", "decision": "DISCARD", "tflops": 162.39, "timestamp": "2026-04-21T12:57:02Z"}
{"round": 57, "iter": "iter057", "bottleneck": "memory_bound", "idea": "K=64 stages=2 lower compute intensity per tile", "category": "pipeline", "expected_gain": "+10 TFLOPS", "decision": "DISCARD", "tflops": 173.9, "timestamp": "2026-04-21T12:57:45Z"}
{"round": 58, "iter": "iter058", "bottleneck": "memory_bound", "idea": "K=64 stages=5 shared memory overhead too high", "category": "pipeline", "expected_gain": "+10 TFLOPS", "decision": "DISCARD", "tflops": 166.87, "timestamp": "2026-04-21T12:58:26Z"}
{"round": 59, "iter": "iter059", "bottleneck": "memory_bound", "idea": "K=256 shared memory too large", "category": "tiling", "expected_gain": "+10 TFLOPS", "decision": "DISCARD", "tflops": 92.36, "timestamp": "2026-04-21T12:59:30Z"}
{"round": 60, "iter": "iter060", "bottleneck": "unknown", "idea": "M=96 fails WGMMA divisibility check", "category": "tiling", "expected_gain": "+10 TFLOPS", "decision": "COMPILE_FAIL", "tflops": 0.0, "timestamp": "2026-04-21T13:00:04Z"}
{"round": 61, "iter": "iter061", "bottleneck": "compute_bound", "idea": "M=64 tiles too small for compute density", "category": "tiling", "expected_gain": "+10 TFLOPS", "decision": "DISCARD", "tflops": 136.47, "timestamp": "2026-04-21T13:00:40Z"}
{"round": 62, "iter": "iter062", "bottleneck": "memory_bound", "idea": "stages=1 no pipelining much worse than stages=2", "category": "pipeline", "expected_gain": "+10 TFLOPS", "decision": "DISCARD", "tflops": 128.84, "timestamp": "2026-04-21T13:01:16Z"}
{"round": 63, "iter": "iter063", "bottleneck": "compute_bound", "idea": "Reproduced best config - measurement lower than recorded 343.47", "category": "misc", "expected_gain": "0 TFLOPS", "decision": "DISCARD", "tflops": 176.72, "timestamp": "2026-04-21T13:02:23Z"}
{"round": 64, "iter": "iter064", "bottleneck": "memory_bound", "idea": "panel_size=12 worse L2 locality than 8", "category": "memory", "expected_gain": "+5 TFLOPS", "decision": "DISCARD", "tflops": 122.32, "timestamp": "2026-04-21T13:03:31Z"}
{"round": 65, "iter": "iter065", "bottleneck": "memory_bound", "idea": "K=256 stages=1 no pipelining bad", "category": "tiling", "expected_gain": "+10 TFLOPS", "decision": "DISCARD", "tflops": 90.2, "timestamp": "2026-04-21T13:04:38Z"}
{"round": 66, "iter": "iter066", "bottleneck": "unknown", "idea": "BLOCK_M not divisible by 64 fails WGMMA", "category": "tiling", "expected_gain": "+10 TFLOPS", "decision": "COMPILE_FAIL", "tflops": 0.0, "timestamp": "2026-04-21T13:05:09Z"}
{"round": 67, "iter": "iter067", "bottleneck": "unknown", "idea": "BLOCK_M not divisible by 64 fails WGMMA", "category": "tiling", "expected_gain": "+10 TFLOPS", "decision": "COMPILE_FAIL", "tflops": 0.0, "timestamp": "2026-04-21T13:05:10Z"}
{"round": 68, "iter": "iter068", "bottleneck": "unknown", "idea": "BLOCK_M not divisible by 64 fails WGMMA", "category": "tiling", "expected_gain": "+10 TFLOPS", "decision": "COMPILE_FAIL", "tflops": 0.0, "timestamp": "2026-04-21T13:05:10Z"}
{"round": 69, "iter": "iter069", "bottleneck": "memory_bound", "idea": "192x192 square tiles poor register efficiency", "category": "tiling", "expected_gain": "+10 TFLOPS", "decision": "DISCARD", "tflops": 66.39, "timestamp": "2026-04-21T13:06:12Z"}
{"round": 70, "iter": "iter070", "bottleneck": "memory_bound", "idea": "256x128 tall tiles poor B reuse", "category": "tiling", "expected_gain": "+10 TFLOPS", "decision": "DISCARD", "tflops": 65.8, "timestamp": "2026-04-21T13:07:06Z"}
{"round": 71, "iter": "iter071", "bottleneck": "compute_bound", "idea": "64x256 wide tiles small M poor A reuse", "category": "tiling", "expected_gain": "+10 TFLOPS", "decision": "DISCARD", "tflops": 137.58, "timestamp": "2026-04-21T13:07:06Z"}
{"round": 72, "iter": "iter072", "bottleneck": "compute_bound", "idea": "K=32 stages=4 too many loop iterations", "category": "pipeline", "expected_gain": "+10 TFLOPS", "decision": "DISCARD", "tflops": 142.36, "timestamp": "2026-04-21T13:08:34Z"}
{"round": 73, "iter": "iter073", "bottleneck": "memory_bound", "idea": "K=48 stages=3 TMA fallback", "category": "tiling", "expected_gain": "+10 TFLOPS", "decision": "DISCARD", "tflops": 97.54, "timestamp": "2026-04-21T13:08:34Z"}
{"round": 74, "iter": "iter074", "bottleneck": "compute_bound", "idea": "K=64 stages=3 lower than K=128 stages=2", "category": "pipeline", "expected_gain": "+10 TFLOPS", "decision": "DISCARD", "tflops": 166.48, "timestamp": "2026-04-21T13:08:34Z"}
{"round": 75, "iter": "iter075", "bottleneck": "unknown", "idea": "K=128 stages=3 exceeds shared memory", "category": "pipeline", "expected_gain": "+10 TFLOPS", "decision": "COMPILE_FAIL", "tflops": 0.0, "timestamp": "2026-04-21T13:09:24Z"}
{"round": 76, "iter": "iter076", "bottleneck": "unknown", "idea": "K=256 exceeds shared memory", "category": "tiling", "expected_gain": "+10 TFLOPS", "decision": "COMPILE_FAIL", "tflops": 0.0, "timestamp": "2026-04-21T13:09:25Z"}
{"round": 77, "iter": "iter077", "bottleneck": "latency_bound", "idea": "N=256 causes severe occupancy drop", "category": "tiling", "expected_gain": "+10 TFLOPS", "decision": "DISCARD", "tflops": 42.24, "timestamp": "2026-04-21T13:09:25Z"}
{"round": 78, "iter": "iter078", "bottleneck": "compute_bound", "idea": "Tiling variation", "category": "tiling", "expected_gain": "+10 TFLOPS", "decision": "DISCARD", "tflops": 125.62, "timestamp": "2026-04-21T13:11:08Z"}
{"round": 79, "iter": "iter079", "bottleneck": "compute_bound", "idea": "Tiling variation", "category": "tiling", "expected_gain": "+10 TFLOPS", "decision": "DISCARD", "tflops": 129.57, "timestamp": "2026-04-21T13:11:09Z"}
{"round": 80, "iter": "iter080", "bottleneck": "compute_bound", "idea": "Tiling variation", "category": "tiling", "expected_gain": "+10 TFLOPS", "decision": "DISCARD", "tflops": 160.78, "timestamp": "2026-04-21T13:11:09Z"}
{"round": 81, "iter": "iter081", "bottleneck": "compute_bound", "idea": "Tiling variation", "category": "tiling", "expected_gain": "+10 TFLOPS", "decision": "DISCARD", "tflops": 160.44, "timestamp": "2026-04-21T13:11:09Z"}
{"round": 82, "iter": "iter082", "bottleneck": "compute_bound", "idea": "Tiling variation", "category": "tiling", "expected_gain": "+10 TFLOPS", "decision": "DISCARD", "tflops": 52.42, "timestamp": "2026-04-21T13:11:10Z"}
{"round": 83, "iter": "iter083", "bottleneck": "compute_bound", "idea": "Parameter exploration", "category": "tiling", "expected_gain": "+10 TFLOPS", "decision": "DISCARD", "tflops": 144.11, "timestamp": "2026-04-21T13:13:11Z"}
{"round": 84, "iter": "iter084", "bottleneck": "compute_bound", "idea": "Parameter exploration", "category": "tiling", "expected_gain": "+10 TFLOPS", "decision": "DISCARD", "tflops": 134.02, "timestamp": "2026-04-21T13:13:12Z"}
{"round": 85, "iter": "iter085", "bottleneck": "compute_bound", "idea": "Parameter exploration", "category": "tiling", "expected_gain": "+10 TFLOPS", "decision": "DISCARD", "tflops": 89.2, "timestamp": "2026-04-21T13:13:12Z"}
{"round": 86, "iter": "iter086", "bottleneck": "compute_bound", "idea": "Parameter exploration", "category": "tiling", "expected_gain": "+10 TFLOPS", "decision": "DISCARD", "tflops": 118.32, "timestamp": "2026-04-21T13:13:13Z"}
{"round": 87, "iter": "iter087", "bottleneck": "compute_bound", "idea": "Parameter exploration", "category": "tiling", "expected_gain": "+10 TFLOPS", "decision": "DISCARD", "tflops": 64.16, "timestamp": "2026-04-21T13:13:13Z"}
{"round": 88, "iter": "iter088", "bottleneck": "compute_bound", "idea": "Parameter exploration", "category": "tiling", "expected_gain": "+10 TFLOPS", "decision": "DISCARD", "tflops": 109.33, "timestamp": "2026-04-21T13:13:14Z"}
