{"round": 89, "iter": "iter089", "bottleneck": "compute_bound", "idea": "Parameter exploration", "category": "tiling", "expected_gain": "+10 TFLOPS", "decision": "DISCARD", "tflops": 171.43, "timestamp": "2026-04-21T13:13:14Z"}
{"round": 90, "iter": "iter090", "bottleneck": "compute_bound", "idea": "Final exploration batch", "category": "tiling", "expected_gain": "+10 TFLOPS", "decision": "DISCARD", "tflops": 178.17, "timestamp": "2026-04-21T13:15:59Z"}
{"round": 91, "iter": "iter091", "bottleneck": "compute_bound", "idea": "Final exploration batch", "category": "tiling", "expected_gain": "+10 TFLOPS", "decision": "DISCARD", "tflops": 59.9, "timestamp": "2026-04-21T13:15:59Z"}
{"round": 92, "iter": "iter092", "bottleneck": "compute_bound", "idea": "Final exploration batch", "category": "tiling", "expected_gain": "+10 TFLOPS", "decision": "DISCARD", "tflops": 160.18, "timestamp": "2026-04-21T13:15:59Z"}
{"round": 93, "iter": "iter093", "bottleneck": "compute_bound", "idea": "Final exploration batch", "category": "tiling", "expected_gain": "+10 TFLOPS", "decision": "DISCARD", "tflops": 166.22, "timestamp": "2026-04-21T13:16:00Z"}
{"round": 94, "iter": "iter094", "bottleneck": "compute_bound", "idea": "Final exploration batch", "category": "tiling", "expected_gain": "+10 TFLOPS", "decision": "DISCARD", "tflops": 120.77, "timestamp": "2026-04-21T13:16:00Z"}
{"round": 95, "iter": "iter095", "bottleneck": "compute_bound", "idea": "Final exploration batch", "category": "tiling", "expected_gain": "+10 TFLOPS", "decision": "DISCARD", "tflops": 48.67, "timestamp": "2026-04-21T13:16:01Z"}
{"round": 96, "iter": "iter096", "bottleneck": "compute_bound", "idea": "Final exploration batch", "category": "tiling", "expected_gain": "+10 TFLOPS", "decision": "DISCARD", "tflops": 11.73, "timestamp": "2026-04-21T13:16:01Z"}
{"round": 97, "iter": "iter97", "bottleneck": "compute_bound", "idea": "Final batch", "category": "tiling", "expected_gain": "+10 TFLOPS", "decision": "DISCARD", "tflops": 171.15, "timestamp": "2026-04-21T13:17:08Z"}
{"round": 98, "iter": "iter98", "bottleneck": "compute_bound", "idea": "Final batch", "category": "tiling", "expected_gain": "+10 TFLOPS", "decision": "DISCARD", "tflops": 140.58, "timestamp": "2026-04-21T13:17:08Z"}
{"round": 99, "iter": "iter99", "bottleneck": "compute_bound", "idea": "Final batch", "category": "tiling", "expected_gain": "+10 TFLOPS", "decision": "DISCARD", "tflops": 54.84, "timestamp": "2026-04-21T13:17:09Z"}
{"round": 100, "iter": "iter100", "bottleneck": "compute_bound", "idea": "Final batch", "category": "tiling", "expected_gain": "+10 TFLOPS", "decision": "DISCARD", "tflops": 113.14, "timestamp": "2026-04-21T13:17:09Z"}
