iter	kernel	tflops	decision	bottleneck	idea_summary
iter000	iter000_cublas	415.6494	KEEP	baseline	cuBLAS reference baseline
iter001	iter001_baseline_tcore	316.84	KEEP	memory_bound	Baseline TileLang matmul with tensor cores: 128x128x64 tiles, 3 stages, panel_si
iter002	iter002_blockn192	335.55	KEEP	compute_bound	Increase BLOCK_N to 192 for better compute intensity
iter003	iter003_blockk128	0	COMPILE_FAIL	compute_bound	BLOCK_K=128 exceeded shared memory limit
iter004	iter004_blockk128_s2	343.47	KEEP	compute_bound	BLOCK_K=128 with stages=2 to fit shared memory
iter005	iter005_panel10	341.19	DISCARD	compute_bound	Increase panel_size to 10 for L2 locality
iter006	iter006_panel6	342.46	DISCARD	compute_bound	panel_size=6 for different L2 pattern
iter007	iter007_blockm256	89.13	DISCARD	compute_bound	BLOCK_M=256 caused severe occupancy drop
iter008	iter008_blockn256	259.41	DISCARD	compute_bound	64x256x64 too small BLOCK_M hurts perf
iter009	iter009_threads256	267.91	DISCARD	compute_bound	threads=256 caused register pressure
iter010	iter010_stages4	312.44	DISCARD	compute_bound	stages=4 with BLOCK_K=64 increases overhead
iter011	iter011_b128x256	54.92	DISCARD	compute_bound	128x256 severe occupancy drop
iter012	iter012_blockk96	338.11	DISCARD	compute_bound	BLOCK_K=96 less efficient than 128
iter013	iter013_b96x192	0	COMPILE_FAIL	compute_bound	BLOCK_M=96 not divisible by 16 for WGMMA
iter014	iter014_b64x192k128	232.92	DISCARD	compute_bound	64x192x128 insufficient compute density
iter015	iter015_b128x160	274.24	DISCARD	compute_bound	BLOCK_N=160 causes grid inefficiency
iter016	iter016_b128x224	154.46	DISCARD	compute_bound	128x224 severe occupancy drop
iter017	iter017_panel4	318.85	DISCARD	compute_bound	panel_size=4 reduces L2 locality
iter018	iter018_b128x128k128	226.82	DISCARD	compute_bound	128x128 square tiles less efficient
iter019	iter019_noswizzle	141.76	DISCARD	memory_bound	No swizzle hurts L2 locality badly
iter020	iter020_b64x192s4	252.47	DISCARD	compute_bound	64x192 with stages=4 insufficient compute density
iter021	iter021_panel9	211.38	DISCARD	memory_bound	panel_size=9 worsens L2 locality
iter022	iter022_b192x192	131.52	DISCARD	compute_bound	192x192 severe occupancy drop
iter023	iter023_k64s3	336.37	DISCARD	compute_bound	BLOCK_K=64 stages=3 close but lower than k128s2
iter024	iter024_threads192	239.11	DISCARD	compute_bound	threads=192 causes work imbalance
iter025	iter025_k32s5	259.91	DISCARD	compute_bound	BLOCK_K=32 too many inner loop iterations
iter026	iter026_b128x144	164.17	DISCARD	memory_bound	BLOCK_N=144 causes TMA fallback warning
iter027	iter027_panel7	331.52	DISCARD	compute_bound	panel_size=7 less efficient than 8
iter028	iter028_b64x64s4	185.31	DISCARD	latency_bound	64x64 tiles too small causing launch overhead
iter029	iter029_b128x176	146.74	DISCARD	memory_bound	BLOCK_N=176 causes TMA fallback
iter030	iter030_panel12	340.48	DISCARD	compute_bound	panel_size=12 close but less than panel_size=8
iter031	iter031_panel16	341.77	DISCARD	compute_bound	panel_size=16 slightly worse than 8
iter032	iter032_s1	232.96	DISCARD	memory_bound	stages=1 no pipelining hurts perf significantly
iter033	iter033_bm192	321.66	DISCARD	compute_bound	192x128 transposed tiles less efficient than 128x192
iter034	iter034_k80	212.57	DISCARD	memory_bound	BLOCK_K=80 triggers TMA fallback
iter035	iter035_panel2	288.24	DISCARD	memory_bound	panel_size=2 too aggressive L2 thrashing
iter036	iter036_b64x128k64s5	233.05	DISCARD	compute_bound	64x128 small tiles high pipeline depth not enough compute density
iter037	iter037_b128x256k64	81.82	DISCARD	latency_bound	128x256 tiles too large causing register pressure
iter038	iter038_b192x192k64	77.45	DISCARD	latency_bound	192x192 square tiles reduced register locality
iter039	iter039_b128x128k32s4	274.70	DISCARD	compute_bound	128x128 with K=32 not enough GEMM ops per tile
iter040	iter040_b128x192k64s3	239.02	DISCARD	memory_bound	K=64 with stages=3 insufficient compute hiding
iter041	iter041_b64x256k128	278.42	DISCARD	compute_bound	64x256 wide tiles imbalanced warp utilization
iter042	iter042_b256x128k128	164.34	DISCARD	memory_bound	256x128 tall tiles hurt B matrix reuse
iter043	iter043_b128x192k64s4	307.31	DISCARD	compute_bound	K=64 stages=4 shared memory overhead vs iter004
iter044	iter044_b128x192k96	330.41	DISCARD	compute_bound	K=96 approaching optimal but still below K=128
iter045	iter045_b128x192k112	207.20	DISCARD	memory_bound	K=112 triggers TMA fallback losing efficiency
iter046	iter046_b128x256k64s3	34.95	DISCARD	latency_bound	256 N-tile causes severe occupancy drop
iter047	iter047_b64x192k64s2	120.58	DISCARD	memory_bound	64x192 small M-tile poor A matrix reuse
iter048	iter048_panel4_v2	179.95	DISCARD	latency_bound	panel_size=4 worse L2 locality than 8
iter049	iter049_s3_k128	166.07	DISCARD	latency_bound	128x128x128 stages=3 excessive shared memory
iter050	iter050_b192x192k128s2	81.88	DISCARD	latency_bound	192x192 square tiles high register pressure
iter051	iter051_t256_v2	98.87	DISCARD	latency_bound	256 threads causes register spilling and occupancy drop
iter052	iter052_t64	18.31	DISCARD	latency_bound	64 threads insufficient parallelism for large tiles
iter053	iter053_b128x128k128s2	177.60	DISCARD	compute_bound	128x128 square tiles lower B matrix reuse than 128x192
iter054	iter054_b128x224k128	67.50	DISCARD	latency_bound	N=224 causes TMA inefficiency and grid imbalance
iter055	iter055_b128x160k128	137.14	DISCARD	compute_bound	N=160 grid imbalance vs 192
iter056	iter056_b192x128k128s2	162.39	DISCARD	compute_bound	192x128 worse B reuse pattern than 128x192
iter057	iter057_b128x192k64s2	173.90	DISCARD	memory_bound	K=64 stages=2 lower compute intensity per tile
iter058	iter058_b128x192k64s5	166.87	DISCARD	memory_bound	K=64 stages=5 shared memory overhead too high
iter059	iter059_b64x128k256s2	92.36	DISCARD	memory_bound	K=256 shared memory too large
iter060	iter060_b96x192k128s2	0	COMPILE_FAIL	unknown	M=96 fails WGMMA divisibility check
iter061	iter061_b64x192k128s3	136.47	DISCARD	compute_bound	M=64 tiles too small for compute density
iter062	iter062_s1_verify	128.84	DISCARD	memory_bound	stages=1 no pipelining much worse than stages=2
iter063	iter063_best_repro	176.72	DISCARD	compute_bound	Reproduced best config - measurement lower than recorded 343.47
iter064	iter064_panel12	122.32	DISCARD	memory_bound	panel_size=12 worse L2 locality than 8
iter065	iter065_b128x192k256s1	90.20	DISCARD	memory_bound	K=256 stages=1 no pipelining bad
iter066	iter066_b144x192k128	0	COMPILE_FAIL	unknown	BLOCK_M not divisible by 64 fails WGMMA
iter067	iter067_b160x192k128	0	COMPILE_FAIL	unknown	BLOCK_M not divisible by 64 fails WGMMA
iter068	iter068_b176x192k128	0	COMPILE_FAIL	unknown	BLOCK_M not divisible by 64 fails WGMMA
iter069	iter069_b192x192k64s3	66.39	DISCARD	memory_bound	192x192 square tiles poor register efficiency
iter070	iter070_b256x128k64	65.80	DISCARD	memory_bound	256x128 tall tiles poor B reuse
iter071	iter071_b64x256k64	137.58	DISCARD	compute_bound	64x256 wide tiles small M poor A reuse
iter072	iter072_k32s4	142.36	DISCARD	compute_bound	K=32 stages=4 too many loop iterations
iter073	iter073_k48s3	97.54	DISCARD	memory_bound	K=48 stages=3 TMA fallback
iter074	iter074_k64s3	166.48	DISCARD	compute_bound	K=64 stages=3 lower than K=128 stages=2
iter075	iter075_b128x192k128s3	0	COMPILE_FAIL	unknown	K=128 stages=3 exceeds shared memory
iter076	iter076_b128x192k256s2	0	COMPILE_FAIL	unknown	K=256 exceeds shared memory
iter077	iter077_b128x256k64s2	42.24	DISCARD	latency_bound	N=256 causes severe occupancy drop
iter078	iter078_b64x128k64s3	125.62	DISCARD	compute_bound	Tiling variation
iter079	iter079_b64x128k128s2	129.57	DISCARD	compute_bound	Tiling variation
iter080	iter080_b128x128k64s3	160.78	DISCARD	compute_bound	Tiling variation
iter081	iter081_b128x128k64s4	160.44	DISCARD	compute_bound	Tiling variation
iter082	iter082_b256x192k64s2	52.42	DISCARD	compute_bound	Tiling variation
iter083	iter083_b64x192k64s3	144.11	DISCARD	compute_bound	Parameter exploration
iter084	iter084_b64x192k128s2	134.02	DISCARD	compute_bound	Parameter exploration
iter085	iter085_b128x64k64s3	89.20	DISCARD	compute_bound	Parameter exploration
iter086	iter086_b128x64k128s2	118.32	DISCARD	compute_bound	Parameter exploration
iter087	iter087_b64x64k64s4	64.16	DISCARD	compute_bound	Parameter exploration
iter088	iter088_b64x64k128s3	109.33	DISCARD	compute_bound	Parameter exploration
iter089	iter089_b128x192k64s2	171.43	DISCARD	compute_bound	Parameter exploration
iter090	iter090_b128x192k128s2_v2	178.17	DISCARD	compute_bound	Final exploration batch
iter091	iter091_b256x128k128s2_v2	59.90	DISCARD	compute_bound	Final exploration batch
iter092	iter092_b64x256k128s2_v2	160.18	DISCARD	compute_bound	Final exploration batch
iter093	iter093_b192x128k64s3_v2	166.22	DISCARD	compute_bound	Final exploration batch
iter094	iter094_b192x128k128s2_v2	120.77	DISCARD	compute_bound	Final exploration batch
iter095	iter095_b128x256k128s2_v2	48.67	DISCARD	compute_bound	Final exploration batch
iter096	iter096_b256x256k64s2_v2	11.73	DISCARD	compute_bound	Final exploration batch
iter97	iter097_b128x128k128s2_final	171.15	DISCARD	compute_bound	Final batch
iter98	iter098_b64x128k128s3_final	140.58	DISCARD	compute_bound	Final batch
iter99	iter099_b192x192k128s2_final	54.84	DISCARD	compute_bound	Final batch
iter100	iter100_b128x192k64s4_final	113.14	DISCARD	compute_bound	Final batch
