{"round": 114, "iter": "iter114", "bottleneck": "compute_bound", "idea": "iter106 without use_fast_math 598 TFLOPS", "category": "compute", "expected_gain": "unknown", "decision": "DISCARD", "tflops": 598.4, "timestamp": "2026-04-20T14:58:14Z"}
{"round": 115, "iter": "iter115", "bottleneck": "compute_bound", "idea": "iter106 ptxO3 SWIZ_GROUP 14 587 TFLOPS", "category": "memory", "expected_gain": "unknown", "decision": "DISCARD", "tflops": 587.0, "timestamp": "2026-04-20T14:58:24Z"}
{"round": 112, "iter": "iter112", "bottleneck": "compute_bound", "idea": "iter106 nvcc host O2 with ptxas O3 598 TFLOPS", "category": "compute", "expected_gain": "unknown", "decision": "DISCARD", "tflops": 598.5, "timestamp": "2026-04-20T14:58:24Z"}
{"round": 116, "iter": "iter116", "bottleneck": "compute_bound", "idea": "iter106 ptxO3 SWIZ_GROUP 12 588 TFLOPS", "category": "memory", "expected_gain": "unknown", "decision": "DISCARD", "tflops": 588.1, "timestamp": "2026-04-20T14:58:25Z"}
{"round": 117, "iter": "iter117", "bottleneck": "compute_bound", "idea": "iter106 ptxO3 SWIZ_GROUP 20 594 TFLOPS", "category": "memory", "expected_gain": "unknown", "decision": "DISCARD", "tflops": 594.1, "timestamp": "2026-04-20T14:58:26Z"}
{"round": 118, "iter": "iter118", "bottleneck": "compute_bound", "idea": "Independent remeasure iter106 ptxas_o3 binary 606 TFLOPS confirms best", "category": "compute", "expected_gain": "unknown", "decision": "KEEP", "tflops": 606.0, "timestamp": "2026-04-20T14:58:27Z"}
{"round": 119, "iter": "iter119", "bottleneck": "compute_bound", "idea": "Replace cde cp_async TMA with choreo tma_load_2d_shared_cta_global_mbarrier; SASS SYNCS.EXCH count unchanged vs iter106; slight regression ~596 TFLOPS", "category": "memory", "expected_gain": "unknown", "decision": "DISCARD", "tflops": 595.3, "timestamp": "2026-04-20T15:11:57Z"}
{"round": 120, "iter": "iter120", "bottleneck": "compute_bound", "idea": "iter106 nvcc host O2 with Xptxas O3 592 TFLOPS", "category": "compute", "expected_gain": "unknown", "decision": "DISCARD", "tflops": 591.8, "timestamp": "2026-04-20T15:11:57Z"}
{"round": 121, "iter": "iter121", "bottleneck": "compute_bound", "idea": "iter106 with Xptxas O2 only high variance vs O3 no sustained win", "category": "compute", "expected_gain": "unknown", "decision": "DISCARD", "tflops": 605.0, "timestamp": "2026-04-20T15:11:58Z"}
{"round": 122, "iter": "iter122", "bottleneck": "compute_bound", "idea": "maxrregcount 168 on iter106", "category": "compute", "expected_gain": "unknown", "decision": "DISCARD", "tflops": 598.0, "timestamp": "2026-04-20T15:11:59Z"}
{"round": 123, "iter": "iter123", "bottleneck": "memory_bound", "idea": "iter106 ptxas O3 Xptxas dlcm ca", "category": "memory", "expected_gain": "unknown", "decision": "DISCARD", "tflops": 598.7, "timestamp": "2026-04-20T15:12:06Z"}
{"round": 124, "iter": "iter124", "bottleneck": "compute_bound", "idea": "nvcc Xfatbin compress-all regression", "category": "misc", "expected_gain": "unknown", "decision": "DISCARD", "tflops": 595.4, "timestamp": "2026-04-20T15:12:06Z"}
{"round": 125, "iter": "iter125", "bottleneck": "memory_bound", "idea": "Xptxas dlcm cs slower", "category": "memory", "expected_gain": "unknown", "decision": "DISCARD", "tflops": 584.3, "timestamp": "2026-04-20T15:12:07Z"}
{"round": 126, "iter": "iter126", "bottleneck": "compute_bound", "idea": "ncu profile iter119_tma_intrinsic same compute_bound as iter106; barrier density 0.027 in sass_compare unchanged", "category": "compute", "expected_gain": "unknown", "decision": "DISCARD", "tflops": 595.3, "timestamp": "2026-04-20T15:12:08Z"}
{"round": 127, "iter": "iter127", "bottleneck": "compute_bound", "idea": "CHOREO_PTX_BARRIER_MAX Spins define before choreo.h no semantic change high variance", "category": "misc", "expected_gain": "unknown", "decision": "DISCARD", "tflops": 609.7, "timestamp": "2026-04-20T15:12:09Z"}
{"round": 128, "iter": "iter128", "bottleneck": "compute_bound", "idea": "Producer-only PTX empty wait attempted: must keep cuda wait arrive token semantics deadlocks with naive parity; barrier reduction needs full cuda-barrier decode or raw mbars with explicit per-role arrive", "category": "misc", "expected_gain": "unknown", "decision": "DISCARD", "tflops": 606.0, "timestamp": "2026-04-20T15:12:10Z"}
{"round": 129, "iter": "iter129", "bottleneck": "compute_bound", "idea": "full pipeline: uint64_t full_mbar init1 tma_load_2d x2 expect_tx 32KB tma_mbarrier_wait_parity q=iv_k/4; empty cuda barrier", "category": "memory", "expected_gain": "unknown", "decision": "KEEP", "tflops": 608.6, "timestamp": "2026-04-20T15:25:07Z"}
{"round": 130, "iter": "iter130", "bottleneck": "compute_bound", "idea": "iter129 plus proxy fence after expect_tx", "category": "memory", "expected_gain": "unknown", "decision": "DISCARD", "tflops": 608.4, "timestamp": "2026-04-20T15:25:08Z"}
{"round": 131, "iter": "iter131", "bottleneck": "compute_bound", "idea": "iter129 without unroll inner WGMMA", "category": "compute", "expected_gain": "unknown", "decision": "DISCARD", "tflops": 594.0, "timestamp": "2026-04-20T15:25:08Z"}
{"round": 132, "iter": "iter132", "bottleneck": "compute_bound", "idea": "iter129 source nvcc maxrregcount 200", "category": "compute", "expected_gain": "unknown", "decision": "DISCARD", "tflops": 591.0, "timestamp": "2026-04-20T15:25:16Z"}
{"round": 133, "iter": "iter133", "bottleneck": "memory_bound", "idea": "iter129 Xptxas dlcm ca", "category": "memory", "expected_gain": "unknown", "decision": "DISCARD", "tflops": 591.4, "timestamp": "2026-04-20T15:25:17Z"}
{"round": 134, "iter": "iter134", "bottleneck": "compute_bound", "idea": "iter129 nvcc host O2", "category": "compute", "expected_gain": "unknown", "decision": "DISCARD", "tflops": 593.6, "timestamp": "2026-04-20T15:25:18Z"}
{"round": 135, "iter": "iter135", "bottleneck": "compute_bound", "idea": "iter129 Xptxas O2", "category": "compute", "expected_gain": "unknown", "decision": "DISCARD", "tflops": 590.3, "timestamp": "2026-04-20T15:25:19Z"}
{"round": 136, "iter": "iter136", "bottleneck": "compute_bound", "idea": "iter129 lineinfo", "category": "misc", "expected_gain": "unknown", "decision": "DISCARD", "tflops": 592.0, "timestamp": "2026-04-20T15:25:19Z"}
{"round": 137, "iter": "iter137", "bottleneck": "compute_bound", "idea": "iter129 maxrregcount 232", "category": "compute", "expected_gain": "unknown", "decision": "DISCARD", "tflops": 581.3, "timestamp": "2026-04-20T15:25:20Z"}
{"round": 138, "iter": "iter138", "bottleneck": "compute_bound", "idea": "iter129 prec sqrt false", "category": "compute", "expected_gain": "unknown", "decision": "DISCARD", "tflops": 587.7, "timestamp": "2026-04-20T15:25:21Z"}
{"round": 139, "iter": "iter139", "bottleneck": "compute_bound", "idea": "Empty pipeline: uint64_t empty_mbar[4] init 257; producer tma_mbarrier_arrive then tma_mbarrier_wait_parity (qe=iv_k/4); consumers tma_mbarrier_arrive x256. Matches cuda wait(arrive) order. SYNCS.EXCH static count unchanged vs iter129 (9). Mean ~595 TFLOPS vs iter129 ref 608.6", "category": "barrier", "expected_gain": "unknown", "decision": "DISCARD", "tflops": 595.5, "timestamp": "2026-04-20T15:32:01Z"}
{"round": 140, "iter": "iter140", "bottleneck": "compute_bound", "idea": "iter139 + cde::fence_proxy_async_shared_cta after consumer empty-mbar bootstrap arrives", "category": "barrier", "expected_gain": "unknown", "decision": "DISCARD", "tflops": 602.3, "timestamp": "2026-04-20T15:35:39Z"}
{"round": 141, "iter": "iter141", "bottleneck": "compute_bound", "idea": "iter139_both_mbar.cu + nvcc -maxrregcount=200", "category": "compiler", "expected_gain": "unknown", "decision": "DISCARD", "tflops": 585.0, "timestamp": "2026-04-20T15:35:39Z"}
{"round": 142, "iter": "iter142", "bottleneck": "compute_bound", "idea": "iter139 + replace -Xptxas O3 with O2 only severe regression", "category": "compiler", "expected_gain": "unknown", "decision": "DISCARD", "tflops": 366.8, "timestamp": "2026-04-20T15:35:40Z"}
{"round": 143, "iter": "iter143", "bottleneck": "compute_bound", "idea": "iter139 build without --use_fast_math", "category": "compiler", "expected_gain": "unknown", "decision": "DISCARD", "tflops": 595.9, "timestamp": "2026-04-20T15:35:40Z"}
{"round": 144, "iter": "iter144", "bottleneck": "compute_bound", "idea": "iter139 + -Xcompiler -O2", "category": "compiler", "expected_gain": "unknown", "decision": "DISCARD", "tflops": 597.7, "timestamp": "2026-04-20T15:35:41Z"}
{"round": 145, "iter": "iter145", "bottleneck": "compute_bound", "idea": "iter139 + -lineinfo", "category": "compiler", "expected_gain": "unknown", "decision": "DISCARD", "tflops": 592.7, "timestamp": "2026-04-20T15:35:41Z"}
{"round": 146, "iter": "iter146", "bottleneck": "compute_bound", "idea": "iter139 + -maxrregcount=232", "category": "compiler", "expected_gain": "unknown", "decision": "DISCARD", "tflops": 588.6, "timestamp": "2026-04-20T15:35:42Z"}
{"round": 147, "iter": "iter147", "bottleneck": "compute_bound", "idea": "iter139 + -DNDEBUG", "category": "compiler", "expected_gain": "unknown", "decision": "DISCARD", "tflops": 594.9, "timestamp": "2026-04-20T15:35:42Z"}
{"round": 148, "iter": "iter148", "bottleneck": "compute_bound", "idea": "iter140_empty_fence + -maxrregcount=200", "category": "compiler", "expected_gain": "unknown", "decision": "DISCARD", "tflops": 589.0, "timestamp": "2026-04-20T15:35:42Z"}
{"round": 149, "iter": "iter149", "bottleneck": "compute_bound", "idea": "Remove explicit warpgroup_arrive before QGMMA quad", "category": "warpgroup_sync", "expected_gain": "unknown", "decision": "DISCARD", "tflops": 593.4, "timestamp": "2026-04-20T15:45:36Z"}
{"round": 150, "iter": "iter150", "bottleneck": "compute_bound", "idea": "warpgroup_wait<1> after single commit", "category": "warpgroup_sync", "expected_gain": "unknown", "decision": "DISCARD", "tflops": 599.1, "timestamp": "2026-04-20T15:45:45Z"}
{"round": 151, "iter": "iter151", "bottleneck": "compute_bound", "idea": "#pragma unroll removed inner WGMMA first run peak 605TFLOPS high var", "category": "warpgroup_sync", "expected_gain": "unknown", "decision": "DISCARD", "tflops": 604.96, "timestamp": "2026-04-20T15:45:45Z"}
{"round": 152, "iter": "iter152", "bottleneck": "compute_bound", "idea": "two consecutive warpgroup_arrive", "category": "warpgroup_sync", "expected_gain": "unknown", "decision": "DISCARD", "tflops": 593.3, "timestamp": "2026-04-20T15:45:46Z"}
{"round": 153, "iter": "iter153", "bottleneck": "compute_bound", "idea": "mc_scale_frag[64]{} zero init no memset", "category": "warpgroup_sync", "expected_gain": "unknown", "decision": "DISCARD", "tflops": 598.4, "timestamp": "2026-04-20T15:45:46Z"}
{"round": 154, "iter": "iter154", "bottleneck": "compute_bound", "idea": "no arrive plus wait1", "category": "warpgroup_sync", "expected_gain": "unknown", "decision": "DISCARD", "tflops": 591.3, "timestamp": "2026-04-20T15:45:47Z"}
{"round": 155, "iter": "iter155", "bottleneck": "compute_bound", "idea": "drop proxy fence before store syncthreads", "category": "warpgroup_sync", "expected_gain": "unknown", "decision": "DISCARD", "tflops": 595.3, "timestamp": "2026-04-20T15:45:47Z"}
{"round": 156, "iter": "iter156", "bottleneck": "compute_bound", "idea": "arrive inside loop once per MMA", "category": "warpgroup_sync", "expected_gain": "unknown", "decision": "DISCARD", "tflops": 593.1, "timestamp": "2026-04-20T15:45:47Z"}
{"round": 157, "iter": "iter157", "bottleneck": "compute_bound", "idea": "pragma unroll 2 regression", "category": "warpgroup_sync", "expected_gain": "unknown", "decision": "DISCARD", "tflops": 487.4, "timestamp": "2026-04-20T15:45:48Z"}
{"round": 158, "iter": "iter158", "bottleneck": "compute_bound", "idea": "identical to iter139 control", "category": "warpgroup_sync", "expected_gain": "unknown", "decision": "DISCARD", "tflops": 599.0, "timestamp": "2026-04-20T15:45:48Z"}
{"round": 159, "iter": "iter159", "bottleneck": "structural_variant", "idea": "114 persistent grid-stride tiles cuda barriers (iter102) waves fewer CTAs not faster", "category": "structural", "expected_gain": "unknown", "decision": "DISCARD", "tflops": 578.3, "timestamp": "2026-04-20T16:56:08Z"}
{"round": 160, "iter": "iter160", "bottleneck": "structural_variant", "idea": "persistent + cluster 2x1 launch iter105", "category": "structural", "expected_gain": "unknown", "decision": "DISCARD", "tflops": 576.7, "timestamp": "2026-04-20T16:56:08Z"}
{"round": 161, "iter": "iter161", "bottleneck": "structural_variant", "idea": "cluster cudaLaunchKernelExC only iter103 best-of-batch still below 608.6 mbar129", "category": "structural", "expected_gain": "unknown", "decision": "DISCARD", "tflops": 603.5, "timestamp": "2026-04-20T16:56:08Z"}
{"round": 162, "iter": "iter162", "bottleneck": "structural_variant", "idea": "6 pipeline stages iter104 regression vs 4", "category": "structural", "expected_gain": "unknown", "decision": "DISCARD", "tflops": 545.4, "timestamp": "2026-04-20T16:56:09Z"}
{"round": 163, "iter": "iter163", "bottleneck": "structural_variant", "idea": "64x64x32 WGMMA TILE_N 64 iter019 structural smaller tile hurts blockscale", "category": "structural", "expected_gain": "unknown", "decision": "DISCARD", "tflops": 383.8, "timestamp": "2026-04-20T16:56:09Z"}
{"round": 164, "iter": "iter164", "bottleneck": "structural_variant", "idea": "persistent query SM count iter101", "category": "structural", "expected_gain": "unknown", "decision": "DISCARD", "tflops": 575.8, "timestamp": "2026-04-20T16:56:10Z"}
{"round": 165, "iter": "iter165", "bottleneck": "structural_variant", "idea": "legacy iter080 combined best regression vs current tuned kernels", "category": "structural", "expected_gain": "unknown", "decision": "DISCARD", "tflops": 364.7, "timestamp": "2026-04-20T16:56:10Z"}
{"round": 166, "iter": "iter166", "bottleneck": "structural_variant", "idea": "iter106 ptxas O3 no mbar", "category": "structural", "expected_gain": "unknown", "decision": "DISCARD", "tflops": 599.2, "timestamp": "2026-04-20T16:56:11Z"}
{"round": 167, "iter": "iter167", "bottleneck": "structural_variant", "idea": "copy iter129 control same session variance", "category": "structural", "expected_gain": "unknown", "decision": "DISCARD", "tflops": 594.9, "timestamp": "2026-04-20T16:56:11Z"}
{"round": 168, "iter": "iter168", "bottleneck": "structural_variant", "idea": "ptxas O3 + cluster iter107", "category": "structural", "expected_gain": "unknown", "decision": "DISCARD", "tflops": 595.2, "timestamp": "2026-04-20T16:56:11Z"}
{"round": 169, "iter": "iter169", "bottleneck": "persistent_mbar", "idea": "iter129 full_mbar + 114 CTA persistent grid-stride; re-init between tiles", "category": "persistent", "expected_gain": "none", "decision": "DISCARD", "tflops": 586.7, "timestamp": "2026-04-20T20:30:00Z"}
{"round": 170, "iter": "iter170", "bottleneck": "persistent_mbar", "idea": "mbarrier.inval + tma_mbarrier_init between tiles", "category": "persistent", "expected_gain": "none", "decision": "DISCARD", "tflops": 574.2, "timestamp": "2026-04-20T20:30:00Z"}
{"round": 171, "iter": "iter171", "bottleneck": "persistent_mbar", "idea": "MATMUL_STAGES-scaled phase for try_wait parity", "category": "persistent", "expected_gain": "none", "decision": "DISCARD", "tflops": 583.6, "timestamp": "2026-04-20T20:30:00Z"}
{"round": 172, "iter": "iter172", "bottleneck": "persistent_mbar", "idea": "skip redundant __syncthreads before first tile in persistent loop", "category": "persistent", "expected_gain": "none", "decision": "DISCARD", "tflops": 586.1, "timestamp": "2026-04-20T20:30:00Z"}
{"round": 173, "iter": "iter173", "bottleneck": "persistent_mbar", "idea": "vary inval frequency: k_tile even => inval before init", "category": "persistent", "expected_gain": "none", "decision": "DISCARD", "tflops": 585.5, "timestamp": "2026-04-20T20:30:00Z"}
{"round": 174, "iter": "iter174", "bottleneck": "persistent_mbar", "idea": "iter170+172 amalgam + -lineinfo build", "category": "persistent", "expected_gain": "none", "decision": "DISCARD", "tflops": 577.3, "timestamp": "2026-04-20T20:30:00Z"}
