{"round": 0, "iter": "iter000", "bottleneck": "baseline", "idea": "cuBLAS/scaled_mm FP8 reference baseline", "category": "baseline", "expected_gain": "baseline reference", "decision": "KEEP", "tflops": 914.2985, "timestamp": "2026-04-20T09:10:16Z"}
{"round": 1, "iter": "iter001", "bottleneck": "memory_bound", "idea": "Warp-specialized 1p1c blockscale GEMM adapted from prior 16K tuning session", "category": "baseline", "expected_gain": "initial baseline", "decision": "KEEP", "tflops": 328.511, "timestamp": "2026-04-20T09:13:56Z"}
{"round": 2, "iter": "iter002", "bottleneck": "launch_bound", "idea": "Add launch_bounds(256,2) to force 2 blocks/SM, reduce register pressure from 153 to ~128", "category": "compute", "expected_gain": "+50-100 TFLOPS", "decision": "KEEP", "tflops": 435.097, "timestamp": "2026-04-20T09:16:52Z"}
{"round": 3, "iter": "iter003", "bottleneck": "memory_bound", "idea": "Block ID swizzle with group_size=4 for L2 cache reuse", "category": "memory", "expected_gain": "+50-100 TFLOPS", "decision": "DISCARD", "tflops": 420.053, "timestamp": "2026-04-20T09:20:19Z"}
{"round": 4, "iter": "iter004", "bottleneck": "memory_bound", "idea": "Increase pipeline stages from 2 to 3", "category": "pipeline", "expected_gain": "+30-60 TFLOPS", "decision": "DISCARD", "tflops": 418.373, "timestamp": "2026-04-20T09:21:55Z"}
{"round": 5, "iter": "iter005", "bottleneck": "memory_bound", "idea": "WARP_N=192 causes bounds error - 8192 not divisible by 192", "category": "tiling", "expected_gain": "+40-80 TFLOPS", "decision": "DISCARD", "tflops": 0.0, "timestamp": "2026-04-20T09:23:08Z"}
{"round": 6, "iter": "iter006", "bottleneck": "memory_bound", "idea": "WARP_N=256 needs more registers, only 1 block/SM", "category": "tiling", "expected_gain": "+40-80 TFLOPS", "decision": "DISCARD", "tflops": 418.823, "timestamp": "2026-04-20T09:24:25Z"}
{"round": 7, "iter": "iter007", "bottleneck": "compute_bound", "idea": "1p2c warp specialization: 1 producer + 2 consumer warpgroups, each consumer handles 64xN slice", "category": "warp_specialization", "expected_gain": "+16 TFLOPS", "decision": "KEEP", "tflops": 442.16, "timestamp": "2026-04-20T09:27:11Z"}
{"round": 8, "iter": "iter008", "bottleneck": "memory_bound", "idea": "1p2c warp spec + 3-stage pipeline: increased pipeline depth from 2 to 3 to hide memory latency", "category": "pipeline", "expected_gain": "+25 TFLOPS", "decision": "KEEP", "tflops": 513.95, "timestamp": "2026-04-20T09:30:22Z"}
{"round": 9, "iter": "iter009", "bottleneck": "memory_bound", "idea": "Increased TILE_N/WARP_N to 256 - caused wgmma serialization due to divergent paths", "category": "tiling", "expected_gain": "+40 TFLOPS", "decision": "DISCARD", "tflops": 193.55, "timestamp": "2026-04-20T09:32:25Z"}
{"round": 10, "iter": "iter010", "bottleneck": "memory_bound", "idea": "1p2c warp spec + 4-stage pipeline: deeper pipelining to further hide memory latency", "category": "pipeline", "expected_gain": "+30 TFLOPS", "decision": "KEEP", "tflops": 537.57, "timestamp": "2026-04-20T09:33:45Z"}
{"round": 11, "iter": "iter011", "bottleneck": "memory_bound", "idea": "5-stage pipeline - too many stages may increase register pressure", "category": "pipeline", "expected_gain": "+20 TFLOPS", "decision": "DISCARD", "tflops": 523.5, "timestamp": "2026-04-20T09:35:25Z"}
{"round": 12, "iter": "iter012", "bottleneck": "memory_bound", "idea": "Block ID swizzling (group=4) with 1p2c 4-stage pipeline: improves L2 cache locality for rhs tiles", "category": "memory", "expected_gain": "+30 TFLOPS", "decision": "KEEP", "tflops": 546.23, "timestamp": "2026-04-20T09:40:35Z"}
{"round": 13, "iter": "iter013", "bottleneck": "compute_bound", "idea": "3-stage with swizzle - severe regression, possibly resource conflict", "category": "pipeline", "expected_gain": "+20 TFLOPS", "decision": "DISCARD", "tflops": 157.81, "timestamp": "2026-04-20T09:42:39Z"}
{"round": 14, "iter": "iter014", "bottleneck": "compute_bound", "idea": "Swizzle group 8 with 1p2c 4-stage: larger group improves L2 data reuse across CTAs", "category": "memory", "expected_gain": "+15 TFLOPS", "decision": "KEEP", "tflops": 573.57, "timestamp": "2026-04-20T09:43:45Z"}
{"round": 15, "iter": "iter015", "bottleneck": "compute_bound", "idea": "Swizzle group 16: larger group continues L2 improvement trend", "category": "memory", "expected_gain": "+15 TFLOPS", "decision": "KEEP", "tflops": 580.02, "timestamp": "2026-04-20T09:44:45Z"}
{"round": 16, "iter": "iter016", "bottleneck": "compute_bound", "idea": "Swizzle group 32 - slightly worse than group 16, sweet spot exceeded", "category": "memory", "expected_gain": "+10 TFLOPS", "decision": "DISCARD", "tflops": 576.92, "timestamp": "2026-04-20T09:45:43Z"}
{"round": 17, "iter": "iter017", "bottleneck": "compute_bound", "idea": "launch_bounds(384,2) - compiler cannot fit kernel in 80 registers", "category": "register", "expected_gain": "+50 TFLOPS", "decision": "COMPILE_FAIL", "tflops": 0.0, "timestamp": "2026-04-20T09:47:18Z"}
{"round": 18, "iter": "iter018", "bottleneck": "compute_bound", "idea": "1p1c with swizzle - much slower than 1p2c, insufficient compute parallelism", "category": "warp_specialization", "expected_gain": "+20 TFLOPS", "decision": "DISCARD", "tflops": 393.75, "timestamp": "2026-04-20T09:49:39Z"}
{"round": 19, "iter": "iter019", "bottleneck": "compute_bound", "idea": "TILE_N=64 with swizzle - smaller tile size reduces parallelism too much", "category": "tiling", "expected_gain": "+15 TFLOPS", "decision": "DISCARD", "tflops": 383.77, "timestamp": "2026-04-20T09:51:17Z"}
{"round": 20, "iter": "iter020", "bottleneck": "compute_bound", "idea": "Swizzle group 12 - confirms group 16 is optimal", "category": "memory", "expected_gain": "+5 TFLOPS", "decision": "DISCARD", "tflops": 574.99, "timestamp": "2026-04-20T09:52:20Z"}
{"round": 21, "iter": "iter021", "bottleneck": "compute_bound", "idea": "2 stages with swizzle - 4 stages still optimal even with good L2 locality", "category": "pipeline", "expected_gain": "+10 TFLOPS", "decision": "DISCARD", "tflops": 569.17, "timestamp": "2026-04-20T09:53:49Z"}
{"round": 22, "iter": "iter022", "bottleneck": "compute_bound", "idea": "Swizzle group 20 - confirms group 16 is optimal", "category": "memory", "expected_gain": "+3 TFLOPS", "decision": "DISCARD", "tflops": 574.62, "timestamp": "2026-04-20T09:54:54Z"}
{"round": 23, "iter": "iter023", "bottleneck": "compute_bound", "idea": "SASS analysis: custom has 15x higher barrier density than cuBLAS. FFMA usage much lower. Address computation overhead (IMAD) higher.", "category": "analysis", "expected_gain": "+0 TFLOPS", "decision": "DISCARD", "tflops": 0.0, "timestamp": "2026-04-20T09:56:11Z"}
{"round": 24, "iter": "iter024", "bottleneck": "compute_bound", "idea": "Non-warp-spec kernel: all warps do load+compute. Lower barrier density but worse performance - confirms 1p2c is beneficial", "category": "warp_specialization", "expected_gain": "+30 TFLOPS", "decision": "DISCARD", "tflops": 442.02, "timestamp": "2026-04-20T10:02:55Z"}
{"round": 25, "iter": "iter025", "bottleneck": "compute_bound", "idea": "Add pragma unroll to iv_warp loop. FAILED - compiler serializes WGMMA due to divergent path dependency.", "category": "loop_unroll", "expected_gain": "+10 TFLOPS", "decision": "DISCARD", "tflops": 156.07, "timestamp": "2026-04-20T11:20:17Z"}
{"round": 26, "iter": "iter026", "bottleneck": "compute_bound", "idea": "1p3c warp spec (TILE_M=192, 3 consumers). WGMMA serialization warning, larger SMEM footprint 212KB.", "category": "warp_specialization", "expected_gain": "+20 TFLOPS", "decision": "DISCARD", "tflops": 361.02, "timestamp": "2026-04-20T11:23:45Z"}
{"round": 27, "iter": "iter027", "bottleneck": "memory_bound", "idea": "Swizzle group 14 - finer search between 12 and 16", "category": "swizzle_group", "expected_gain": "+3 TFLOPS", "decision": "DISCARD", "tflops": 569.98, "timestamp": "2026-04-20T11:24:38Z"}
{"round": 28, "iter": "iter028", "bottleneck": "memory_bound", "idea": "Swizzle group 18 - still worse than group 16 (580.02)", "category": "swizzle_group", "expected_gain": "+2 TFLOPS", "decision": "DISCARD", "tflops": 576.73, "timestamp": "2026-04-20T11:25:17Z"}
{"round": 29, "iter": "iter029", "bottleneck": "compute_bound", "idea": "--use_fast_math nvcc flag - no improvement over baseline 580.02", "category": "nvcc_flags", "expected_gain": "+5 TFLOPS", "decision": "DISCARD", "tflops": 578.39, "timestamp": "2026-04-20T11:26:08Z"}
{"round": 30, "iter": "iter030", "bottleneck": "compute_bound", "idea": "-maxrregcount=120 forces spilling but increases occupancy. NEW BEST!", "category": "register_allocation", "expected_gain": "+10 TFLOPS", "decision": "KEEP", "tflops": 585.81, "timestamp": "2026-04-20T11:27:21Z"}
{"round": 31, "iter": "iter031", "bottleneck": "compute_bound", "idea": "-maxrregcount=110 too aggressive - spill overhead too high", "category": "register_allocation", "expected_gain": "+5 TFLOPS", "decision": "DISCARD", "tflops": 164.58, "timestamp": "2026-04-20T11:28:10Z"}
{"round": 32, "iter": "iter032", "bottleneck": "compute_bound", "idea": "-maxrregcount=130 same as 120", "category": "register_allocation", "expected_gain": "+3 TFLOPS", "decision": "DISCARD", "tflops": 585.79, "timestamp": "2026-04-20T11:28:50Z"}
{"round": 33, "iter": "iter033", "bottleneck": "compute_bound", "idea": "-maxrregcount=115 still too aggressive", "category": "register_allocation", "expected_gain": "+2 TFLOPS", "decision": "DISCARD", "tflops": 165.03, "timestamp": "2026-04-20T11:29:32Z"}
{"round": 34, "iter": "iter034", "bottleneck": "compute_bound", "idea": "-maxrregcount=120 + fast_math: INTERFERES, causes performance regression", "category": "nvcc_flags_combined", "expected_gain": "+5 TFLOPS", "decision": "DISCARD", "tflops": 165.92, "timestamp": "2026-04-20T11:30:24Z"}
{"round": 35, "iter": "iter035", "bottleneck": "compute_bound", "idea": "-maxrregcount=118 still fails - boundary is at 120", "category": "register_allocation", "expected_gain": "+2 TFLOPS", "decision": "DISCARD", "tflops": 164.96, "timestamp": "2026-04-20T11:31:17Z"}
{"round": 36, "iter": "iter036", "bottleneck": "compute_bound", "idea": "-maxrregcount=119 fails - EXACT boundary is 120 registers", "category": "register_allocation", "expected_gain": "+0 TFLOPS", "decision": "DISCARD", "tflops": 164.96, "timestamp": "2026-04-20T11:31:58Z"}
{"round": 37, "iter": "iter037", "bottleneck": "memory_bound", "idea": "Skipped - complex to regenerate 5-stage with swizzle", "category": "pipeline_stages_combined", "expected_gain": "+5 TFLOPS", "decision": "DISCARD", "tflops": 0.0, "timestamp": "2026-04-20T11:32:43Z"}
{"round": 38, "iter": "iter038", "bottleneck": "memory_bound", "idea": "-Xptxas -dlcm=ca with maxreg=120 interferes - causes regression", "category": "nvcc_cache_flags", "expected_gain": "+5 TFLOPS", "decision": "DISCARD", "tflops": 165.13, "timestamp": "2026-04-20T11:33:25Z"}
{"round": 39, "iter": "iter039", "bottleneck": "compute_bound", "idea": "swiz24+maxreg120 - GPU perf regression detected, all kernels showing ~165 TFLOPS now", "category": "swizzle_group_combined", "expected_gain": "+3 TFLOPS", "decision": "DISCARD", "tflops": 164.21, "timestamp": "2026-04-20T11:35:02Z"}
{"round": 40, "iter": "iter040", "bottleneck": "latency_bound:barrier_stall", "idea": "3 pipeline stages with attempted maxreg=120 (ignored by compiler)", "category": "pipeline", "expected_gain": "+10-30 TFLOPS", "decision": "DISCARD", "tflops": 576.81, "timestamp": "2026-04-20T12:02:39Z"}
{"round": 41, "iter": "iter041", "bottleneck": "memory_bound:uncoalesced_global", "idea": "Use -O2 instead of -O3 to reduce register pressure", "category": "misc", "expected_gain": "+20-40 TFLOPS", "decision": "DISCARD", "tflops": 153.31, "timestamp": "2026-04-20T12:06:08Z"}
{"round": 42, "iter": "iter042", "bottleneck": "latency_bound:barrier_stall", "idea": "Baseline check before warpgroup_arrive optimization (same as iter030 within noise)", "category": "misc", "expected_gain": "+10-30 TFLOPS", "decision": "DISCARD", "tflops": 573.35, "timestamp": "2026-04-20T12:08:21Z"}
{"round": 43, "iter": "iter043", "bottleneck": "memory_bound", "idea": "L2 prefetch for scale factors - median 576 TFLOPS", "category": "memory", "expected_gain": "+2% TFLOPS", "decision": "DISCARD", "tflops": 576.0, "timestamp": "2026-04-20T12:11:10Z"}
{"round": 44, "iter": "iter044", "bottleneck": "latency_bound", "idea": "Move warpgroup_arrive outside inner loop - no improvement (compiler still serializes)", "category": "compute", "expected_gain": "+5-10% TFLOPS", "decision": "DISCARD", "tflops": 577.0, "timestamp": "2026-04-20T12:17:37Z"}
{"round": 45, "iter": "iter045", "bottleneck": "latency_bound", "idea": "Move warpgroup_wait before scale - WORSE (eliminates latency hiding)", "category": "synchronization", "expected_gain": "+10-50 TFLOPS", "decision": "DISCARD", "tflops": 167.0, "timestamp": "2026-04-20T12:21:39Z"}
{"round": 46, "iter": "iter046", "bottleneck": "compute_bound", "idea": "TILE_M=256 1p4c: skipped - requires .co rewrite, Round 26 showed 1p3c worse", "category": "misc", "expected_gain": "+30-50 TFLOPS", "decision": "DISCARD", "tflops": 0.0, "timestamp": "2026-04-20T12:23:38Z"}
{"round": 47, "iter": "iter047", "bottleneck": "latency_bound", "idea": "ESCALATION: 7-DISCARD analysis - kernel at 580T beats scaled_mm 470T but gap to CUTLASS 688T is structural", "category": "misc", "expected_gain": "0 TFLOPS", "decision": "DISCARD", "tflops": 580.0, "timestamp": "2026-04-20T12:25:59Z"}
{"round":48,"idea":"STRUCTURAL RESET: Move warpgroup_arrive() outside inner iv_warp loop (1x instead of 4x per K-tile), move commit/wait before scale_accumulator","impl":"iter048_deferred_scale.cu","status":"KEEP","median_tflops":596.26,"baseline":688.6,"pct_of_baseline":86.6,"improvement_from_prev":10.45,"note":"NEW BEST! 1.8% improvement from 585.81"}
{"round":49,"idea":"Try 5-stage pipeline with barrier optimization from R48","impl":"iter049_5stages.cu","status":"DISCARD","median_tflops":0,"note":"LAUNCH_FAIL - shared memory overflow or incorrect calculations"}
{"round":"49b","idea":"Try -maxrregcount=120 on iter048 barrier structure","impl":"iter049_maxreg.cu","status":"DISCARD","median_tflops":587.94,"note":"Slightly worse than iter048 (596.26), register limiting hurts new structure"}
{"round":"49c","idea":"Try 3-stage pipeline with barrier optimization","impl":"iter049_3stages.cu","status":"DISCARD","median_tflops":0,"note":"LAUNCH_FAIL - likely shared memory calculation error"}
{"round":50,"idea":"SASS analysis of iter048 - found 4 QGMMA + 12 BAR instructions, 8.3 cycles/instruction latency","impl":"iter048_deferred_scale (analysis only)","status":"ANALYSIS","median_tflops":596.26,"note":"Current best remains at 596.26 TFLOPS"}
{"round":51,"idea":"2-stage pipeline for higher occupancy (reduce SMEM 163KB->82KB)","impl":"iter051_2stages_highoccup.cu","status":"DISCARD","median_tflops":0,"note":"LAUNCH_FAIL - shared memory layout error in manual stage reduction"}
{"round":"51b","idea":"Swizzle group 8 with iter048 barrier structure","impl":"iter051_swiz8.cu","status":"DISCARD","median_tflops":593,"note":"~593 TFLOPS median - similar to iter048 (600), no improvement"}
{"round":"51c","idea":"Swizzle group 24 with iter048 barrier structure","impl":"iter051_swiz24.cu","status":"DISCARD","median_tflops":600,"note":"~600 TFLOPS median - same as iter048, no improvement"}
{"round":52,"idea":"--use_fast_math for aggressive FP optimizations","impl":"iter052_fastmath.cu","status":"DISCARD","median_tflops":598.76,"note":"Same as iter048 (600 TFLOPS), no improvement"}
{"round":"52b","idea":"WARP_N=256 larger compute tile","impl":"iter052_warpn256.cu","status":"DISCARD","median_tflops":0,"note":"Runtime error - scale factor bounds check failed, needs thorough .co rewrite"}
{"round":"52c","idea":"__launch_bounds__(384,2) for 2 blocks per SM","impl":"iter053_launch_bounds.cu","status":"DISCARD","median_tflops":0,"note":"COMPILE_FAIL - insufficient registers (80) to fit 2 blocks per SM"}
{"round":"53a","idea":"-ftz=true -prec-div=false flush-to-zero for faster FP","impl":"iter053_ftz.cu","status":"DISCARD","median_tflops":182.76,"note":"Severe regression from 600 to 183 TFLOPS - FTZ breaks scaling precision"}
{"round":"53b","idea":"Aggressive nvcc optimizations with -Xptxas verbose","impl":"iter053_aggressive_opts.cu","status":"DISCARD","median_tflops":600,"note":"Same as iter048, 160 registers unchanged"}
{"round":"54a","idea":"L2 prefetch for scale factors before they're needed","impl":"iter054_prefetch_scale.cu","status":"DISCARD","median_tflops":540.93,"note":"Worse (540 vs 600 TFLOPS) - extra branches hurt"}
{"round":"54b","idea":"Replace %4 with &3 for faster modulo","impl":"iter054_opt_modulo.cu","status":"DISCARD","median_tflops":592.79,"note":"Same as iter048 within noise, compiler likely already optimized this"}
{"round":"55","idea":"GPU CONTENTION DETECTED - Megatron-LM training using 51GB VRAM","impl":"N/A","status":"BLOCKED","median_tflops":0,"note":"GPU at 96-97% util by root-owned Megatron processes. Cannot get valid benchmark results. Previous measurements (51-54) may be invalid."}
{"round":"55b","idea":"Release barrier before scale_accumulator to overlap producer load","impl":"iter055_defer_release.cu","status":"DISCARD","median_tflops":573.6,"note":"Worse (573 vs 600 TFLOPS) - may cause data hazards or producer latency"}
{"round":"56","idea":"Use __ldg intrinsic for cached scale_b global load","impl":"iter056_ldg_scale.cu","status":"DISCARD","median_tflops":593.5,"note":"Same as iter048 within noise (593 vs 600 TFLOPS)"}
{"round":"57","idea":"Add __restrict__ qualifiers to kernel pointer parameters","impl":"iter057_restrict.cu","status":"DISCARD","median_tflops":598.16,"note":"Same as iter048 (598 vs 600 TFLOPS), __restrict__ didn't help"}
{"round":"58a","idea":"Combined: __restrict__ + aggressive PTX opts","impl":"iter058_combined.cu","status":"DISCARD","median_tflops":595.5,"note":"Same as iter048"}
{"round":"58b","idea":"-Xptxas -dlcm=cg cache policy (L2 only)","impl":"iter058_dlcm_cg.cu","status":"DISCARD","median_tflops":572,"note":"Worse (572 vs 600 TFLOPS)"}
{"round":"59","idea":"-Xptxas -dscm=wt write-through cache policy","impl":"iter059_dscm_wt.cu","status":"DISCARD","median_tflops":594.4,"note":"Same as iter048"}
{"round":"60","idea":"--preserve-relocs compiler flag","impl":"iter060_inline.cu","status":"DISCARD","median_tflops":594,"note":"Same as iter048"}
{"round": 101, "iter": "iter101", "bottleneck": "compute_bound", "idea": "Persistent kernel: 1 CTA per SM (gridStride=multiProcessorCount), strided tile loop with SWIZ_GROUP=16 mapping; cuda::barrier re-init between tiles; VERIFY passes; 586.8 TFLOPS vs ~601 best (extra sync/re-init overhead)", "category": "misc", "expected_gain": "-15 TFLOPS vs non-persistent; need cheaper tile handoff", "decision": "DISCARD", "tflops": 586.8, "timestamp": "2026-04-20T14:41:48Z"}
{"round": 102, "iter": "iter102", "bottleneck": "compute_bound", "idea": "Persistent grid fixed to 114 CTAs (nvJet count); same barrier re-init between tiles as iter101; 587.35 TFLOPS (~same as full-SM count)", "category": "misc", "expected_gain": "match nvJet SM occupation", "decision": "DISCARD", "tflops": 587.35, "timestamp": "2026-04-20T14:45:00Z"}
{"round": 103, "iter": "iter103", "bottleneck": "compute_bound", "idea": "Non-persistent iter082 + __cluster_dims__(2,1,1) + cudaLaunchKernelExC + NonPortableClusterSizeAllowed; TMA/WGMMA unchanged; ~595 TFLOPS vs ~601 best", "category": "memory", "expected_gain": "L2 sharing between paired CTAs", "decision": "DISCARD", "tflops": 595.0, "timestamp": "2026-04-20T14:48:29Z"}
{"round": 104, "iter": "iter104", "bottleneck": "memory_bound", "idea": "MATMUL_STAGES 6 co2cu 229KB SMEM scale_accum fix 545 TFLOPS vs 601", "category": "pipeline", "expected_gain": "unknown", "decision": "DISCARD", "tflops": 545.0, "timestamp": "2026-04-20T14:53:25Z"}
{"round": 105, "iter": "iter105", "bottleneck": "compute_bound", "idea": "Persistent 114 CTAs cluster 2x1 cudaLaunchKernelExC 583 TFLOPS", "category": "misc", "expected_gain": "unknown", "decision": "DISCARD", "tflops": 583.5, "timestamp": "2026-04-20T14:53:25Z"}
{"round": 106, "iter": "iter106", "bottleneck": "compute_bound", "idea": "iter062 duplicate plus nvcc -Xptxas -O3 605.7 TFLOPS new best", "category": "compute", "expected_gain": "unknown", "decision": "KEEP", "tflops": 605.7, "timestamp": "2026-04-20T14:53:26Z"}
{"round": 107, "iter": "iter107", "bottleneck": "compute_bound", "idea": "iter106 ptxO3 plus cluster 2x1 LaunchExC 594 TFLOPS below 605", "category": "misc", "expected_gain": "unknown", "decision": "DISCARD", "tflops": 594.1, "timestamp": "2026-04-20T14:58:01Z"}
{"round": 108, "iter": "iter108", "bottleneck": "memory_bound", "idea": "iter106 ptxO3 plus Xptxas dlcm ca 598 TFLOPS", "category": "memory", "expected_gain": "unknown", "decision": "DISCARD", "tflops": 597.8, "timestamp": "2026-04-20T14:58:01Z"}
{"round": 109, "iter": "iter109", "bottleneck": "compute_bound", "idea": "iter106 ptxO3 dscm wt 594 TFLOPS", "category": "memory", "expected_gain": "unknown", "decision": "DISCARD", "tflops": 594.3, "timestamp": "2026-04-20T14:58:02Z"}
{"round": 110, "iter": "iter110", "bottleneck": "compute_bound", "idea": "iter106 ptxO3 restrict pointers 596 TFLOPS", "category": "misc", "expected_gain": "unknown", "decision": "DISCARD", "tflops": 595.8, "timestamp": "2026-04-20T14:58:03Z"}
{"round": 111, "iter": "iter111", "bottleneck": "compute_bound", "idea": "iter106 ptxO3 maxrregcount 200 592 TFLOPS", "category": "compute", "expected_gain": "unknown", "decision": "DISCARD", "tflops": 592.4, "timestamp": "2026-04-20T14:58:11Z"}
{"round": 113, "iter": "iter113", "bottleneck": "compute_bound", "idea": "iter106 ablation without Xptxas O3 595 confirms ptxas helps", "category": "compute", "expected_gain": "unknown", "decision": "DISCARD", "tflops": 595.3, "timestamp": "2026-04-20T14:58:13Z"}
