{"round": 0, "iter": "iter000", "bottleneck": "baseline", "idea": "cuBLAS reference baseline", "category": "baseline", "expected_gain": "baseline reference", "decision": "KEEP", "tflops": 411.852, "timestamp": "2026-04-22T00:31:43Z"}
{"round": 1, "iter": "iter001", "bottleneck": "compute_bound", "idea": "Initial baseline from prior tuning session, adapted for 16416\u00b3 with power-of-2 block sizes [64,256,64]", "category": "tiling", "expected_gain": "baseline", "decision": "KEEP", "tflops": 228.88, "timestamp": "2026-04-22T00:32:47Z"}
{"round": 2, "iter": "iter002", "bottleneck": "compute_bound", "idea": "block_sizes=[128,256,64], indexing=block_ptr, pid_type=persistent_blocked - performance regression", "category": "tiling", "expected_gain": "+50-100 TFLOPS", "decision": "DISCARD", "tflops": 119.23, "timestamp": "2026-04-22T00:35:32Z"}
{"round": 3, "iter": "iter003", "bottleneck": "compute_bound", "idea": "block_sizes=[128,128,64] num_stages=4 - square tiles worse", "category": "tiling", "expected_gain": "+20-50 TFLOPS", "decision": "DISCARD", "tflops": 193.15, "timestamp": "2026-04-22T00:36:24Z"}
{"round": 4, "iter": "iter004", "bottleneck": "compute_bound", "idea": "block_sizes=[64,512,64] num_warps=16 - wider N tile with more warps", "category": "tiling", "expected_gain": "+20 TFLOPS", "decision": "KEEP", "tflops": 252.3, "timestamp": "2026-04-22T00:37:13Z"}
{"round": 5, "iter": "iter005", "bottleneck": "compute_bound", "idea": "block_sizes=[128,512,64] num_stages=5 - register pressure exceeded", "category": "tiling", "expected_gain": "+30 TFLOPS", "decision": "COMPILE_FAIL", "tflops": 0.0, "timestamp": "2026-04-22T00:38:49Z"}
{"round": 6, "iter": "iter006", "bottleneck": "compute_bound", "idea": "block_sizes=[64,256,128] num_stages=4 - shared memory exceeded", "category": "tiling", "expected_gain": "+20 TFLOPS", "decision": "COMPILE_FAIL", "tflops": 0.0, "timestamp": "2026-04-22T00:38:49Z"}
{"round": 7, "iter": "iter007", "bottleneck": "compute_bound", "idea": "block_sizes=[64,256,128] num_stages=2 - worse performance", "category": "tiling", "expected_gain": "+20 TFLOPS", "decision": "DISCARD", "tflops": 180.06, "timestamp": "2026-04-22T00:38:49Z"}
{"round": 8, "iter": "iter008", "bottleneck": "compute_bound", "idea": "block_sizes=[64,512,64] num_stages=4 - shared mem exceeded", "category": "tiling", "expected_gain": "+10 TFLOPS", "decision": "COMPILE_FAIL", "tflops": 0.0, "timestamp": "2026-04-22T00:41:16Z"}
{"round": 10, "iter": "iter010", "bottleneck": "compute_bound", "idea": "block_sizes=[64,512,64] num_warps=32 - too many warps", "category": "tiling", "expected_gain": "+10 TFLOPS", "decision": "DISCARD", "tflops": 238.23, "timestamp": "2026-04-22T00:41:17Z"}
{"round": 11, "iter": "iter011", "bottleneck": "compute_bound", "idea": "block_sizes=[32,1024,64] - shared mem exceeded", "category": "tiling", "expected_gain": "+20 TFLOPS", "decision": "COMPILE_FAIL", "tflops": 0.0, "timestamp": "2026-04-22T00:41:17Z"}
{"round": 12, "iter": "iter012", "bottleneck": "compute_bound", "idea": "block_sizes=[32,1024,64] num_stages=2 - too wide N tile", "category": "tiling", "expected_gain": "+20 TFLOPS", "decision": "DISCARD", "tflops": 128.21, "timestamp": "2026-04-22T00:41:17Z"}
{"round": 13, "iter": "iter013", "bottleneck": "compute_bound", "idea": "block_sizes=[128,256,32] - balanced but not better", "category": "tiling", "expected_gain": "+10 TFLOPS", "decision": "DISCARD", "tflops": 241.49, "timestamp": "2026-04-22T00:41:18Z"}
{"round": 16, "iter": "iter016", "bottleneck": "compute_bound", "idea": "block_sizes=[64,512,32] 8 warps worse", "category": "tiling", "expected_gain": "+5 TFLOPS", "decision": "DISCARD", "tflops": 197.76, "timestamp": "2026-04-22T00:44:02Z"}
{"round": 18, "iter": "iter018", "bottleneck": "compute_bound", "idea": "block_sizes=[32,512,64] M=32 too small", "category": "tiling", "expected_gain": "+5 TFLOPS", "decision": "DISCARD", "tflops": 110.71, "timestamp": "2026-04-22T00:44:03Z"}
{"round": 20, "iter": "iter020", "bottleneck": "compute_bound", "idea": "block_sizes=[128,256,64] 8 warps same", "category": "tiling", "expected_gain": "+5 TFLOPS", "decision": "DISCARD", "tflops": 248.46, "timestamp": "2026-04-22T00:44:03Z"}
{"round": 27, "iter": "iter027", "bottleneck": "compute_bound", "idea": "block_sizes=[128,256,64] num_warps=16 num_stages=4 - new best", "category": "tiling", "expected_gain": "+15 TFLOPS", "decision": "KEEP", "tflops": 267.98, "timestamp": "2026-04-22T00:47:01Z"}
{"round": 34, "iter": "iter034", "bottleneck": "compute_bound", "idea": "block_sizes=[128,256,64] num_warps=8 num_stages=4 - new best! 8 warps better than 16", "category": "tiling", "expected_gain": "+9 TFLOPS", "decision": "KEEP", "tflops": 276.82, "timestamp": "2026-04-22T00:49:42Z"}
{"round": 39, "iter": "iter039", "bottleneck": "compute_bound", "idea": "block_sizes=[128,256,64] num_warps=8 num_stages=3 - stages=3 slightly better", "category": "tiling", "expected_gain": "+0.66 TFLOPS", "decision": "KEEP", "tflops": 277.48, "timestamp": "2026-04-22T00:52:03Z"}
{"round": 44, "iter": "iter044", "bottleneck": "compute_bound", "idea": "block_sizes=[128,256,64] num_warps=8 num_stages=3 indexing=block_ptr - TMA indexing helps", "category": "memory", "expected_gain": "+0.2 TFLOPS", "decision": "KEEP", "tflops": 277.65, "timestamp": "2026-04-22T00:53:23Z"}
{"round": 45, "iter": "iter121", "bottleneck": "compute_bound", "idea": "Add l2_groupings=[8] for L2 cache reuse", "category": "memory", "expected_gain": "+5-15 TFLOPS", "decision": "KEEP", "tflops": 317.43, "timestamp": "2026-04-22T02:50:35Z"}
{"round": 46, "iter": "iter122", "bottleneck": "compute_bound", "idea": "l2_groupings=[16] - larger grouping worse", "category": "memory", "expected_gain": "+5-10 TFLOPS", "decision": "DISCARD", "tflops": 312.41, "timestamp": "2026-04-22T02:51:53Z"}
{"round": 47, "iter": "iter123", "bottleneck": "compute_bound", "idea": "num_warps=16 + l2_groupings=[8] - better parallelism", "category": "tiling", "expected_gain": "+10-20 TFLOPS", "decision": "KEEP", "tflops": 330.03, "timestamp": "2026-04-22T02:52:39Z"}
