{"round": 95, "iter": "iter095", "bottleneck": "compute_bound", "idea": "gm24", "category": "general", "expected_gain": "unknown", "decision": "DISCARD", "tflops": 127.44, "timestamp": "2026-04-21T11:39:15Z"}
{"round": 96, "iter": "iter096", "bottleneck": "compute_bound", "idea": "gm6_redo", "category": "general", "expected_gain": "unknown", "decision": "DISCARD", "tflops": 126.55, "timestamp": "2026-04-21T11:39:16Z"}
{"round": 100, "iter": "iter100", "bottleneck": "compute_bound", "idea": "128x128_128_tile", "category": "general", "expected_gain": "unknown", "decision": "DISCARD", "tflops": 57.3, "timestamp": "2026-04-21T11:39:23Z"}
{"round": 101, "iter": "iter101", "bottleneck": "compute_bound", "idea": "gm2", "category": "general", "expected_gain": "unknown", "decision": "DISCARD", "tflops": 126.32, "timestamp": "2026-04-21T11:39:36Z"}
{"round": 102, "iter": "iter102", "bottleneck": "compute_bound", "idea": "w4_s2", "category": "general", "expected_gain": "unknown", "decision": "DISCARD", "tflops": 101.93, "timestamp": "2026-04-21T11:39:36Z"}
{"round": 103, "iter": "iter103", "bottleneck": "compute_bound", "idea": "gm8_w16_s2", "category": "general", "expected_gain": "unknown", "decision": "DISCARD", "tflops": 112.86, "timestamp": "2026-04-21T11:39:37Z"}
{"round": 104, "iter": "iter104", "bottleneck": "compute_bound", "idea": "small_bk128", "category": "general", "expected_gain": "unknown", "decision": "DISCARD", "tflops": 93.73, "timestamp": "2026-04-21T11:39:37Z"}
{"round": 105, "iter": "iter105", "bottleneck": "compute_bound", "idea": "bk64_s8", "category": "general", "expected_gain": "unknown", "decision": "DISCARD", "tflops": 85.26, "timestamp": "2026-04-21T11:39:38Z"}
{"round": 106, "iter": "iter106", "bottleneck": "compute_bound", "idea": "best_eight_w", "category": "general", "expected_gain": "unknown", "decision": "DISCARD", "tflops": 113.09, "timestamp": "2026-04-21T11:39:38Z"}
{"round": 107, "iter": "iter107", "bottleneck": "compute_bound", "idea": "gm8_s2", "category": "general", "expected_gain": "unknown", "decision": "DISCARD", "tflops": 113.26, "timestamp": "2026-04-21T11:39:38Z"}
{"round": 108, "iter": "iter108", "bottleneck": "compute_bound", "idea": "gm16_s2", "category": "general", "expected_gain": "unknown", "decision": "DISCARD", "tflops": 106.16, "timestamp": "2026-04-21T11:39:39Z"}
{"round": 109, "iter": "iter109", "bottleneck": "compute_bound", "idea": "gm3", "category": "general", "expected_gain": "unknown", "decision": "DISCARD", "tflops": 127.73, "timestamp": "2026-04-21T11:39:39Z"}
{"round": 110, "iter": "iter110", "bottleneck": "compute_bound", "idea": "gm5_s2", "category": "general", "expected_gain": "unknown", "decision": "DISCARD", "tflops": 114.14, "timestamp": "2026-04-21T11:39:40Z"}
