{"round": 0, "iter": "iter000", "bottleneck": "baseline", "idea": "cuBLAS reference baseline", "category": "baseline", "expected_gain": "baseline reference", "decision": "KEEP", "tflops": 460.2319, "timestamp": "2026-04-21T10:36:13Z"}
{"round": 1, "iter": "iter001", "bottleneck": "memory_bound", "idea": "Initial naive blockscale with per-subblock loads", "category": "tiling", "expected_gain": "baseline", "decision": "DISCARD", "tflops": 138.49, "timestamp": "2026-04-21T10:43:31Z"}
{"round": 2, "iter": "iter002", "bottleneck": "memory_bound", "idea": "Fused scale application single load per tile", "category": "memory", "expected_gain": "+26%", "decision": "DISCARD", "tflops": 174.91, "timestamp": "2026-04-21T10:43:38Z"}
{"round": 8, "iter": "iter008", "bottleneck": "memory_bound", "idea": "Large 256x128x64 tiles with row/col scale", "category": "tiling", "expected_gain": "+9%", "decision": "KEEP", "tflops": 190.89, "timestamp": "2026-04-21T10:43:44Z"}
{"round": 9, "iter": "iter012", "bottleneck": "compute_bound", "idea": "256x128 tiles with 4 stages and 16 warps", "category": "tiling", "expected_gain": "+3%", "decision": "KEEP", "tflops": 196.63, "timestamp": "2026-04-21T10:50:42Z"}
{"round": 10, "iter": "iter014", "bottleneck": "compute_bound", "idea": "256x128 with BLOCK_K=128 for larger K-tile", "category": "tiling", "expected_gain": "+18%", "decision": "KEEP", "tflops": 232.88, "timestamp": "2026-04-21T10:50:49Z"}
{"round": 11, "iter": "iter015", "bottleneck": "compute_bound", "idea": "256x128 bk128 with 8 warps 3 stages", "category": "tiling", "expected_gain": "-2%", "decision": "DISCARD", "tflops": 228.02, "timestamp": "2026-04-21T10:55:55Z"}
{"round": 12, "iter": "iter016", "bottleneck": "compute_bound", "idea": "GROUP_M=4 variant", "category": "memory", "expected_gain": "-1%", "decision": "DISCARD", "tflops": 230.23, "timestamp": "2026-04-21T10:55:55Z"}
{"round": 13, "iter": "iter017", "bottleneck": "compute_bound", "idea": "evict_first policy causes FP8 verification failure", "category": "memory", "expected_gain": "+5%", "decision": "COMPILE_FAIL", "tflops": 0.0, "timestamp": "2026-04-21T10:55:56Z"}
{"round": 14, "iter": "iter018", "bottleneck": "compute_bound", "idea": "evict_last policy causes FP8 verification failure", "category": "memory", "expected_gain": "+5%", "decision": "COMPILE_FAIL", "tflops": 0.0, "timestamp": "2026-04-21T10:59:23Z"}
{"round": 15, "iter": "iter019", "bottleneck": "compute_bound", "idea": "no-mask version fails verification", "category": "memory", "expected_gain": "+10%", "decision": "COMPILE_FAIL", "tflops": 0.0, "timestamp": "2026-04-21T10:59:24Z"}
{"round": 16, "iter": "iter020", "bottleneck": "compute_bound", "idea": "num_ctas parameter causes verification failure", "category": "pipeline", "expected_gain": "+15%", "decision": "COMPILE_FAIL", "tflops": 0.0, "timestamp": "2026-04-21T10:59:24Z"}
{"round": 17, "iter": "iter021", "bottleneck": "compute_bound", "idea": "split-K has scaling correctness issue", "category": "pipeline", "expected_gain": "+20%", "decision": "COMPILE_FAIL", "tflops": 0.0, "timestamp": "2026-04-21T10:59:24Z"}
{"round": 24, "iter": "iter024", "bottleneck": "pipeline_bound", "idea": "2-stage pipeline variant vs 3-stage baseline", "category": "pipeline", "expected_gain": "+0%", "decision": "DISCARD", "tflops": 208.08, "timestamp": "2026-04-21T11:01:24Z"}
{"round": 25, "iter": "iter025", "bottleneck": "memory_bound", "idea": "swapped 128x256 tile dimension", "category": "tiling", "expected_gain": "+0%", "decision": "DISCARD", "tflops": 71.26, "timestamp": "2026-04-21T11:03:28Z"}
{"round": 26, "iter": "iter026", "bottleneck": "unknown", "idea": "256x256 tile too big - register spill", "category": "tiling", "expected_gain": "+0%", "decision": "COMPILE_FAIL", "tflops": 0.0, "timestamp": "2026-04-21T11:03:29Z"}
{"round": 27, "iter": "iter027", "bottleneck": "compute_bound", "idea": "smaller BLOCK_K=64 with 4 stages", "category": "pipeline", "expected_gain": "+0%", "decision": "DISCARD", "tflops": 196.61, "timestamp": "2026-04-21T11:03:29Z"}
{"round": 28, "iter": "iter028", "bottleneck": "compute_bound", "idea": "128x128 tile for more CTAs", "category": "tiling", "expected_gain": "+0%", "decision": "DISCARD", "tflops": 104.67, "timestamp": "2026-04-21T11:03:30Z"}
{"round": 29, "iter": "iter029", "bottleneck": "compute_bound", "idea": "GROUP_M=16 for larger swizzle", "category": "memory", "expected_gain": "+0%", "decision": "DISCARD", "tflops": 228.09, "timestamp": "2026-04-21T11:05:33Z"}
{"round": 30, "iter": "iter030", "bottleneck": "compute_bound", "idea": "5 stages for deeper pipeline", "category": "pipeline", "expected_gain": "+0%", "decision": "DISCARD", "tflops": 230.69, "timestamp": "2026-04-21T11:05:33Z"}
{"round": 31, "iter": "iter031", "bottleneck": "compute_bound", "idea": "32 warps for more parallelism", "category": "compute", "expected_gain": "+0%", "decision": "DISCARD", "tflops": 217.58, "timestamp": "2026-04-21T11:05:34Z"}
{"round": 32, "iter": "iter032", "bottleneck": "compute_bound", "idea": "BLOCK_K=256 for larger K-tile", "category": "tiling", "expected_gain": "+0.5%", "decision": "KEEP", "tflops": 233.28, "timestamp": "2026-04-21T11:05:34Z"}
{"round": 33, "iter": "iter033", "bottleneck": "compute_bound", "idea": "BLOCK_K=256 with 3 stages", "category": "pipeline", "expected_gain": "+4%", "decision": "KEEP", "tflops": 242.2, "timestamp": "2026-04-21T11:07:52Z"}
{"round": 34, "iter": "iter034", "bottleneck": "compute_bound", "idea": "BLOCK_K=256 with 8 warps", "category": "compute", "expected_gain": "+0%", "decision": "DISCARD", "tflops": 236.56, "timestamp": "2026-04-21T11:07:52Z"}
{"round": 35, "iter": "iter035", "bottleneck": "compute_bound", "idea": "128x128 tile with BLOCK_K=256", "category": "tiling", "expected_gain": "+0%", "decision": "DISCARD", "tflops": 143.48, "timestamp": "2026-04-21T11:07:52Z"}
{"round": 36, "iter": "iter036", "bottleneck": "memory_bound", "idea": "128x256 tile with BLOCK_K=256", "category": "tiling", "expected_gain": "+0%", "decision": "DISCARD", "tflops": 82.17, "timestamp": "2026-04-21T11:07:53Z"}
{"round": 37, "iter": "iter037", "bottleneck": "unknown", "idea": "BLOCK_K=256 with 4 stages exceeds smem", "category": "pipeline", "expected_gain": "+0%", "decision": "COMPILE_FAIL", "tflops": 0.0, "timestamp": "2026-04-21T11:10:11Z"}
{"round": 38, "iter": "iter038", "bottleneck": "compute_bound", "idea": "BLOCK_K=256 GROUP_M=4", "category": "memory", "expected_gain": "+1%", "decision": "KEEP", "tflops": 243.99, "timestamp": "2026-04-21T11:10:12Z"}
{"round": 39, "iter": "iter039", "bottleneck": "compute_bound", "idea": "BLOCK_K=256 8 warps 3 stages", "category": "compute", "expected_gain": "+1%", "decision": "KEEP", "tflops": 244.29, "timestamp": "2026-04-21T11:10:12Z"}
{"round": 40, "iter": "iter040", "bottleneck": "memory_bound", "idea": "BLOCK_K=256 GROUP_M=16", "category": "memory", "expected_gain": "+0%", "decision": "DISCARD", "tflops": 229.9, "timestamp": "2026-04-21T11:10:13Z"}
{"round": 41, "iter": "iter041", "bottleneck": "compute_bound", "idea": "8 warps + GROUP_M=4", "category": "memory", "expected_gain": "+0%", "decision": "DISCARD", "tflops": 244.38, "timestamp": "2026-04-21T11:12:19Z"}
{"round": 42, "iter": "iter042", "bottleneck": "compute_bound", "idea": "4 warps too few", "category": "compute", "expected_gain": "+0%", "decision": "DISCARD", "tflops": 156.52, "timestamp": "2026-04-21T11:12:20Z"}
{"round": 44, "iter": "iter044", "bottleneck": "unknown", "idea": "12 warps compilation error", "category": "compute", "expected_gain": "+0%", "decision": "COMPILE_FAIL", "tflops": 0.0, "timestamp": "2026-04-21T11:12:20Z"}
{"round": 43, "iter": "iter043", "bottleneck": "compute_bound", "idea": "256x64 tile with BLOCK_K=256", "category": "tiling", "expected_gain": "+21%", "decision": "KEEP", "tflops": 295.84, "timestamp": "2026-04-21T11:12:27Z"}
{"round": 45, "iter": "iter045", "bottleneck": "unknown", "idea": "4 stages exceeded smem limit", "category": "pipeline", "expected_gain": "+0%", "decision": "COMPILE_FAIL", "tflops": 0.0, "timestamp": "2026-04-21T11:14:34Z"}
{"round": 46, "iter": "iter046", "bottleneck": "compute_bound", "idea": "16 warps on narrow tile", "category": "compute", "expected_gain": "+0%", "decision": "DISCARD", "tflops": 294.05, "timestamp": "2026-04-21T11:14:34Z"}
{"round": 47, "iter": "iter047", "bottleneck": "compute_bound", "idea": "256x64 with GROUP_M=4", "category": "memory", "expected_gain": "+1%", "decision": "KEEP", "tflops": 297.26, "timestamp": "2026-04-21T11:14:35Z"}
{"round": 48, "iter": "iter048", "bottleneck": "compute_bound", "idea": "128x64 tile too small", "category": "tiling", "expected_gain": "+0%", "decision": "DISCARD", "tflops": 189.58, "timestamp": "2026-04-21T11:14:35Z"}
{"round": 49, "iter": "iter049", "bottleneck": "compute_bound", "idea": "GROUP_M=2 too small", "category": "memory", "expected_gain": "+0%", "decision": "DISCARD", "tflops": 281.06, "timestamp": "2026-04-21T11:16:00Z"}
{"round": 50, "iter": "iter050", "bottleneck": "compute_bound", "idea": "4 warps too few for 256x64", "category": "compute", "expected_gain": "+0%", "decision": "DISCARD", "tflops": 237.96, "timestamp": "2026-04-21T11:16:01Z"}
{"round": 51, "iter": "iter051", "bottleneck": "memory_bound", "idea": "transposed 64x256 tile poor perf", "category": "tiling", "expected_gain": "+0%", "decision": "DISCARD", "tflops": 45.42, "timestamp": "2026-04-21T11:17:28Z"}
{"round": 52, "iter": "iter052", "bottleneck": "compute_bound", "idea": "256x64 BLOCK_K=128 4stages", "category": "pipeline", "expected_gain": "+0%", "decision": "DISCARD", "tflops": 258.25, "timestamp": "2026-04-21T11:17:28Z"}
{"round": 53, "iter": "iter053", "bottleneck": "compute_bound", "idea": "GROUP_M=1 no swizzle worse", "category": "memory", "expected_gain": "+0%", "decision": "DISCARD", "tflops": 285.75, "timestamp": "2026-04-21T11:18:41Z"}
{"round": 54, "iter": "iter054", "bottleneck": "unknown", "idea": "6 warps invalid - must be power of 2", "category": "compute", "expected_gain": "+0%", "decision": "COMPILE_FAIL", "tflops": 0.0, "timestamp": "2026-04-21T11:18:41Z"}
{"round": 55, "iter": "iter055", "bottleneck": "unknown", "idea": "192 not power of 2", "category": "tiling", "expected_gain": "+0%", "decision": "COMPILE_FAIL", "tflops": 0.0, "timestamp": "2026-04-21T11:20:49Z"}
{"round": 56, "iter": "iter056", "bottleneck": "compute_bound", "idea": "256x32 too narrow", "category": "tiling", "expected_gain": "+0%", "decision": "DISCARD", "tflops": 186.86, "timestamp": "2026-04-21T11:20:50Z"}
{"round": 57, "iter": "iter057", "bottleneck": "compute_bound", "idea": "128x64 tile decent but not best", "category": "tiling", "expected_gain": "+0%", "decision": "DISCARD", "tflops": 227.86, "timestamp": "2026-04-21T11:20:50Z"}
{"round": 58, "iter": "iter058", "bottleneck": "unknown", "idea": "512x32 exceeded smem", "category": "tiling", "expected_gain": "+0%", "decision": "COMPILE_FAIL", "tflops": 0.0, "timestamp": "2026-04-21T11:20:51Z"}
{"round": 59, "iter": "iter059", "bottleneck": "compute_bound", "idea": "2 stages not enough pipelining", "category": "pipeline", "expected_gain": "+0%", "decision": "DISCARD", "tflops": 256.3, "timestamp": "2026-04-21T11:22:04Z"}
{"round": 60, "iter": "iter060", "bottleneck": "compute_bound", "idea": "GROUP_M=8 nearly tied with gm4", "category": "memory", "expected_gain": "+0%", "decision": "DISCARD", "tflops": 296.56, "timestamp": "2026-04-21T11:22:04Z"}
{"round": 61, "iter": "iter061", "bottleneck": "compute_bound", "idea": "GROUP_M=6 swizzle pattern", "category": "general", "expected_gain": "unknown", "decision": "DISCARD", "tflops": 247.08, "timestamp": "2026-04-21T11:24:49Z"}
{"round": 62, "iter": "iter062", "bottleneck": "compute_bound", "idea": "BLOCK_K=128", "category": "general", "expected_gain": "unknown", "decision": "DISCARD", "tflops": 261.73, "timestamp": "2026-04-21T11:25:05Z"}
{"round": 63, "iter": "iter063", "bottleneck": "resource_limit", "idea": "BLOCK_K=512", "category": "general", "expected_gain": "unknown", "decision": "COMPILE_FAIL", "tflops": 0.0, "timestamp": "2026-04-21T11:25:05Z"}
{"round": 64, "iter": "iter064", "bottleneck": "compute_bound", "idea": "16warps_3stages", "category": "general", "expected_gain": "unknown", "decision": "DISCARD", "tflops": 293.8, "timestamp": "2026-04-21T11:25:06Z"}
{"round": 65, "iter": "iter065", "bottleneck": "resource_limit", "idea": "BLOCK_M=384_nonpow2", "category": "general", "expected_gain": "unknown", "decision": "COMPILE_FAIL", "tflops": 0.0, "timestamp": "2026-04-21T11:27:23Z"}
{"round": 66, "iter": "iter066", "bottleneck": "resource_limit", "idea": "BLOCK_M=512_nonpow2", "category": "general", "expected_gain": "unknown", "decision": "COMPILE_FAIL", "tflops": 0.0, "timestamp": "2026-04-21T11:27:23Z"}
{"round": 67, "iter": "iter067", "bottleneck": "compute_bound", "idea": "GROUP_M=3", "category": "general", "expected_gain": "unknown", "decision": "DISCARD", "tflops": 285.34, "timestamp": "2026-04-21T11:27:24Z"}
{"round": 68, "iter": "iter068", "bottleneck": "compute_bound", "idea": "GROUP_M=5", "category": "general", "expected_gain": "unknown", "decision": "DISCARD", "tflops": 297.12, "timestamp": "2026-04-21T11:27:24Z"}
{"round": 69, "iter": "iter069", "bottleneck": "compute_bound", "idea": "BLOCK_K=128_s5", "category": "general", "expected_gain": "unknown", "decision": "DISCARD", "tflops": 260.69, "timestamp": "2026-04-21T11:27:24Z"}
{"round": 70, "iter": "iter070", "bottleneck": "compute_bound", "idea": "BLOCK_K=64", "category": "general", "expected_gain": "unknown", "decision": "DISCARD", "tflops": 295.37, "timestamp": "2026-04-21T11:27:25Z"}
{"round": 71, "iter": "iter071", "bottleneck": "compute_bound", "idea": "32_warps", "category": "general", "expected_gain": "unknown", "decision": "DISCARD", "tflops": 261.52, "timestamp": "2026-04-21T11:30:28Z"}
{"round": 74, "iter": "iter074", "bottleneck": "compute_bound", "idea": "8w_2s", "category": "general", "expected_gain": "unknown", "decision": "DISCARD", "tflops": 258.19, "timestamp": "2026-04-21T11:30:29Z"}
{"round": 75, "iter": "iter075", "bottleneck": "compute_bound", "idea": "GROUP_M=12", "category": "general", "expected_gain": "unknown", "decision": "DISCARD", "tflops": 291.84, "timestamp": "2026-04-21T11:30:30Z"}
{"round": 76, "iter": "iter076", "bottleneck": "compute_bound", "idea": "GROUP_M=32", "category": "general", "expected_gain": "unknown", "decision": "DISCARD", "tflops": 278.52, "timestamp": "2026-04-21T11:30:30Z"}
{"round": 80, "iter": "iter080", "bottleneck": "compute_bound", "idea": "16w_2s", "category": "general", "expected_gain": "unknown", "decision": "DISCARD", "tflops": 258.39, "timestamp": "2026-04-21T11:30:32Z"}
{"round": 72, "iter": "iter072", "bottleneck": "compute_bound", "idea": "256x128_bk256", "category": "general", "expected_gain": "unknown", "decision": "DISCARD", "tflops": 246.92, "timestamp": "2026-04-21T11:30:42Z"}
{"round": 73, "iter": "iter073", "bottleneck": "compute_bound", "idea": "128x64_gm8", "category": "general", "expected_gain": "unknown", "decision": "DISCARD", "tflops": 230.6, "timestamp": "2026-04-21T11:30:42Z"}
{"round": 77, "iter": "iter077", "bottleneck": "compute_bound", "idea": "256x32_narrow", "category": "general", "expected_gain": "unknown", "decision": "DISCARD", "tflops": 185.79, "timestamp": "2026-04-21T11:30:43Z"}
{"round": 78, "iter": "iter078", "bottleneck": "compute_bound", "idea": "128x128_tile", "category": "general", "expected_gain": "unknown", "decision": "DISCARD", "tflops": 140.03, "timestamp": "2026-04-21T11:30:43Z"}
{"round": 79, "iter": "iter079", "bottleneck": "compute_bound", "idea": "64x64_small", "category": "general", "expected_gain": "unknown", "decision": "DISCARD", "tflops": 124.44, "timestamp": "2026-04-21T11:30:43Z"}
{"round": 81, "iter": "iter081", "bottleneck": "compute_bound", "idea": "GROUP_M=7_variance", "category": "general", "expected_gain": "unknown", "decision": "DISCARD", "tflops": 297.52, "timestamp": "2026-04-21T11:35:13Z"}
{"round": 82, "iter": "iter082", "bottleneck": "compute_bound", "idea": "GROUP_M=10", "category": "general", "expected_gain": "unknown", "decision": "DISCARD", "tflops": 292.43, "timestamp": "2026-04-21T11:35:14Z"}
{"round": 83, "iter": "iter083", "bottleneck": "compute_bound", "idea": "bk128_gm8", "category": "general", "expected_gain": "unknown", "decision": "DISCARD", "tflops": 255.69, "timestamp": "2026-04-21T11:35:14Z"}
{"round": 84, "iter": "iter084", "bottleneck": "compute_bound", "idea": "bk64_s6", "category": "general", "expected_gain": "unknown", "decision": "DISCARD", "tflops": 295.34, "timestamp": "2026-04-21T11:35:15Z"}
{"round": 85, "iter": "iter085", "bottleneck": "compute_bound", "idea": "GROUP_M=9", "category": "general", "expected_gain": "unknown", "decision": "DISCARD", "tflops": 293.96, "timestamp": "2026-04-21T11:35:15Z"}
{"round": 86, "iter": "iter086", "bottleneck": "compute_bound", "idea": "4w_3s", "category": "general", "expected_gain": "unknown", "decision": "DISCARD", "tflops": 244.48, "timestamp": "2026-04-21T11:35:15Z"}
{"round": 87, "iter": "iter087", "bottleneck": "resource_limit", "idea": "bn96_nonpow2", "category": "general", "expected_gain": "unknown", "decision": "COMPILE_FAIL", "tflops": 0.0, "timestamp": "2026-04-21T11:35:16Z"}
{"round": 88, "iter": "iter088", "bottleneck": "compute_bound", "idea": "GROUP_M=14", "category": "general", "expected_gain": "unknown", "decision": "DISCARD", "tflops": 289.72, "timestamp": "2026-04-21T11:35:16Z"}
{"round": 89, "iter": "iter089", "bottleneck": "resource_limit", "idea": "8w_4s_smem", "category": "general", "expected_gain": "unknown", "decision": "COMPILE_FAIL", "tflops": 0.0, "timestamp": "2026-04-21T11:35:17Z"}
{"round": 90, "iter": "iter090", "bottleneck": "compute_bound", "idea": "bk128_w16", "category": "general", "expected_gain": "unknown", "decision": "DISCARD", "tflops": 261.19, "timestamp": "2026-04-21T11:35:17Z"}
{"round": 97, "iter": "iter097", "bottleneck": "compute_bound", "idea": "revisit128x128", "category": "general", "expected_gain": "unknown", "decision": "DISCARD", "tflops": 100.78, "timestamp": "2026-04-21T11:38:20Z"}
{"round": 98, "iter": "iter098", "bottleneck": "compute_bound", "idea": "onestage", "category": "general", "expected_gain": "unknown", "decision": "DISCARD", "tflops": 105.52, "timestamp": "2026-04-21T11:38:23Z"}
{"round": 99, "iter": "iter099", "bottleneck": "compute_bound", "idea": "bk128w16s3", "category": "general", "expected_gain": "unknown", "decision": "DISCARD", "tflops": 115.52, "timestamp": "2026-04-21T11:38:27Z"}
{"round": 100, "iter": "iter100", "bottleneck": "compute_bound", "idea": "smalltile", "category": "general", "expected_gain": "unknown", "decision": "DISCARD", "tflops": 57.37, "timestamp": "2026-04-21T11:38:30Z"}
{"round": 101, "iter": "iter101", "bottleneck": "compute_bound", "idea": "gmtwo", "category": "general", "expected_gain": "unknown", "decision": "DISCARD", "tflops": 88.46, "timestamp": "2026-04-21T11:38:34Z"}
{"round": 102, "iter": "iter102", "bottleneck": "compute_bound", "idea": "w4s2", "category": "general", "expected_gain": "unknown", "decision": "DISCARD", "tflops": 101.91, "timestamp": "2026-04-21T11:38:37Z"}
{"round": 103, "iter": "iter103", "bottleneck": "compute_bound", "idea": "gm8w16s2", "category": "general", "expected_gain": "unknown", "decision": "DISCARD", "tflops": 113.09, "timestamp": "2026-04-21T11:38:41Z"}
{"round": 104, "iter": "iter104", "bottleneck": "compute_bound", "idea": "smallbk128", "category": "general", "expected_gain": "unknown", "decision": "DISCARD", "tflops": 93.85, "timestamp": "2026-04-21T11:38:44Z"}
{"round": 105, "iter": "iter105", "bottleneck": "compute_bound", "idea": "bk64s8", "category": "general", "expected_gain": "unknown", "decision": "DISCARD", "tflops": 84.87, "timestamp": "2026-04-21T11:38:48Z"}
{"round": 106, "iter": "iter106", "bottleneck": "compute_bound", "idea": "besteightw", "category": "general", "expected_gain": "unknown", "decision": "DISCARD", "tflops": 113.26, "timestamp": "2026-04-21T11:38:51Z"}
{"round": 107, "iter": "iter107", "bottleneck": "compute_bound", "idea": "gm8s2", "category": "general", "expected_gain": "unknown", "decision": "DISCARD", "tflops": 113.11, "timestamp": "2026-04-21T11:38:54Z"}
{"round": 108, "iter": "iter108", "bottleneck": "compute_bound", "idea": "gm16s2", "category": "general", "expected_gain": "unknown", "decision": "DISCARD", "tflops": 106.31, "timestamp": "2026-04-21T11:38:57Z"}
{"round": 109, "iter": "iter109", "bottleneck": "compute_bound", "idea": "gmthree", "category": "general", "expected_gain": "unknown", "decision": "DISCARD", "tflops": 127.46, "timestamp": "2026-04-21T11:39:00Z"}
{"round": 110, "iter": "iter110", "bottleneck": "compute_bound", "idea": "gmfives2", "category": "general", "expected_gain": "unknown", "decision": "DISCARD", "tflops": 257.51, "timestamp": "2026-04-21T11:39:03Z"}
{"round": 91, "iter": "iter091", "bottleneck": "compute_bound", "idea": "gm11", "category": "general", "expected_gain": "unknown", "decision": "DISCARD", "tflops": 128.65, "timestamp": "2026-04-21T11:39:14Z"}
{"round": 92, "iter": "iter092", "bottleneck": "compute_bound", "idea": "gm13", "category": "general", "expected_gain": "unknown", "decision": "DISCARD", "tflops": 127.69, "timestamp": "2026-04-21T11:39:14Z"}
{"round": 93, "iter": "iter093", "bottleneck": "compute_bound", "idea": "gm15", "category": "general", "expected_gain": "unknown", "decision": "DISCARD", "tflops": 127.88, "timestamp": "2026-04-21T11:39:14Z"}
{"round": 94, "iter": "iter094", "bottleneck": "compute_bound", "idea": "gm20", "category": "general", "expected_gain": "unknown", "decision": "DISCARD", "tflops": 127.93, "timestamp": "2026-04-21T11:39:15Z"}
