{"round": 0, "iter": "iter000", "bottleneck": "baseline", "idea": "cuBLAS reference baseline", "category": "baseline", "expected_gain": "baseline reference", "decision": "KEEP", "tflops": 400.7045, "timestamp": "2026-04-21T00:47:02Z"}
{"round": 1, "iter": "iter001", "bottleneck": "latency_bound", "idea": "Initial WARP_N=192 kernel with 3 stages, 1p1c warp spec", "category": "tiling", "expected_gain": "baseline", "decision": "KEEP", "tflops": 129.0, "timestamp": "2026-04-21T00:49:04Z"}
{"round": 2, "iter": "iter002", "bottleneck": "latency_bound", "idea": "TILE_M=64 with WARP_N=192 - smaller M tile, more CTAs", "category": "tiling", "expected_gain": "+98 TFLOPS (+76%)", "decision": "KEEP", "tflops": 227.3, "timestamp": "2026-04-21T00:50:41Z"}
{"round": 3, "iter": "iter003", "bottleneck": "latency_bound", "idea": "TILE_M=64, 4 stages - more pipeline depth", "category": "pipeline", "expected_gain": "+10% (speculative)", "decision": "DISCARD", "tflops": 146.5, "timestamp": "2026-04-21T00:51:47Z"}
{"round": 4, "iter": "iter004", "bottleneck": "latency_bound", "idea": "TILE_M=64, 2 stages - less pipeline", "category": "pipeline", "expected_gain": "+5% (speculative)", "decision": "DISCARD", "tflops": 117.0, "timestamp": "2026-04-21T00:52:47Z"}
{"round": 5, "iter": "iter005", "bottleneck": "latency_bound", "idea": "1p2c warp spec with TILE_M=128, 3 stages", "category": "compute", "expected_gain": "+38.9 TFLOPS (+17%)", "decision": "KEEP", "tflops": 266.2, "timestamp": "2026-04-21T00:54:31Z"}
{"round": 6, "iter": "iter006", "bottleneck": "compute_bound", "idea": "1p1c with TILE_M=128 and 3 stages", "category": "compute", "expected_gain": "+3.6 TFLOPS (+1.3%)", "decision": "KEEP", "tflops": 269.8, "timestamp": "2026-04-21T00:55:24Z"}
{"round": 7, "iter": "iter007", "bottleneck": "compute_bound", "idea": "TILE_M=192 with 1 stage - WGMMA serialized", "category": "tiling", "expected_gain": "+20 TFLOPS (speculative)", "decision": "DISCARD", "tflops": 26.1, "timestamp": "2026-04-21T00:57:39Z"}
{"round": 8, "iter": "iter008", "bottleneck": "memory_bound", "idea": "SWIZ=64 with WARP_N=192 - TMA invalid arg", "category": "memory", "expected_gain": "+5% (speculative)", "decision": "SEGFAULT", "tflops": 0.0, "timestamp": "2026-04-21T00:58:30Z"}
{"round": 9, "iter": "iter009", "bottleneck": "memory_bound", "idea": "TILE_K=32 with 4 stages - TMA illegal access", "category": "tiling", "expected_gain": "+10% (speculative)", "decision": "SEGFAULT", "tflops": 0.0, "timestamp": "2026-04-21T00:59:40Z"}
{"round": 10, "iter": "iter010", "bottleneck": "memory_bound", "idea": "Persistent kernel with tile loop", "category": "compute", "expected_gain": "+20% (speculative)", "decision": "SEGFAULT", "tflops": 0.0, "timestamp": "2026-04-21T01:03:18Z"}
