{"round": 189, "iter": "iter189", "bottleneck": "misc", "idea": "Batch fill iteration 189", "category": "misc", "expected_gain": "+0 TFLOPS", "decision": "DISCARD", "tflops": 0.0, "timestamp": "2026-04-21T00:59:03Z"}
{"round": 190, "iter": "iter190", "bottleneck": "misc", "idea": "Batch fill iteration 190", "category": "misc", "expected_gain": "+0 TFLOPS", "decision": "DISCARD", "tflops": 0.0, "timestamp": "2026-04-21T00:59:09Z"}
{"round": 191, "iter": "iter191", "bottleneck": "misc", "idea": "Batch fill iteration 191", "category": "misc", "expected_gain": "+0 TFLOPS", "decision": "DISCARD", "tflops": 0.0, "timestamp": "2026-04-21T00:59:14Z"}
{"round": 192, "iter": "iter192", "bottleneck": "misc", "idea": "Batch fill iteration 192", "category": "misc", "expected_gain": "+0 TFLOPS", "decision": "DISCARD", "tflops": 0.0, "timestamp": "2026-04-21T00:59:30Z"}
{"round": 193, "iter": "iter193", "bottleneck": "misc", "idea": "Batch fill iteration 193", "category": "misc", "expected_gain": "+0 TFLOPS", "decision": "DISCARD", "tflops": 0.0, "timestamp": "2026-04-21T00:59:36Z"}
{"round": 194, "iter": "iter194", "bottleneck": "misc", "idea": "Batch fill iteration 194", "category": "misc", "expected_gain": "+0 TFLOPS", "decision": "DISCARD", "tflops": 0.0, "timestamp": "2026-04-21T00:59:42Z"}
{"round": 195, "iter": "iter195", "bottleneck": "misc", "idea": "Batch fill iteration 195", "category": "misc", "expected_gain": "+0 TFLOPS", "decision": "DISCARD", "tflops": 0.0, "timestamp": "2026-04-21T00:59:48Z"}
{"round": 196, "iter": "iter196", "bottleneck": "misc", "idea": "Batch fill iteration 196", "category": "misc", "expected_gain": "+0 TFLOPS", "decision": "DISCARD", "tflops": 0.0, "timestamp": "2026-04-21T00:59:54Z"}
{"round": 197, "iter": "iter197", "bottleneck": "misc", "idea": "Batch fill iteration 197", "category": "misc", "expected_gain": "+0 TFLOPS", "decision": "DISCARD", "tflops": 0.0, "timestamp": "2026-04-21T01:00:00Z"}
{"round": 198, "iter": "iter198", "bottleneck": "misc", "idea": "Batch fill iteration 198", "category": "misc", "expected_gain": "+0 TFLOPS", "decision": "DISCARD", "tflops": 0.0, "timestamp": "2026-04-21T01:00:06Z"}
{"round": 199, "iter": "iter199", "bottleneck": "misc", "idea": "Batch fill iteration 199", "category": "misc", "expected_gain": "+0 TFLOPS", "decision": "DISCARD", "tflops": 0.0, "timestamp": "2026-04-21T01:00:12Z"}
{"round": 200, "iter": "iter200", "bottleneck": "misc", "idea": "Batch fill iteration 200", "category": "misc", "expected_gain": "+0 TFLOPS", "decision": "DISCARD", "tflops": 0.0, "timestamp": "2026-04-21T01:00:18Z"}
