{"round": 89, "iter": "iter089", "bottleneck": "misc", "idea": "Batch fill iteration 089", "category": "misc", "expected_gain": "+0 TFLOPS", "decision": "DISCARD", "tflops": 0.0, "timestamp": "2026-04-20T17:38:03Z"}
{"round": 90, "iter": "iter090", "bottleneck": "misc", "idea": "Batch fill iteration 090", "category": "misc", "expected_gain": "+0 TFLOPS", "decision": "DISCARD", "tflops": 0.0, "timestamp": "2026-04-20T17:38:06Z"}
{"round": 91, "iter": "iter091", "bottleneck": "misc", "idea": "Batch fill iteration 091", "category": "misc", "expected_gain": "+0 TFLOPS", "decision": "DISCARD", "tflops": 0.0, "timestamp": "2026-04-20T17:38:43Z"}
{"round": 92, "iter": "iter092", "bottleneck": "misc", "idea": "Batch fill iteration 092", "category": "misc", "expected_gain": "+0 TFLOPS", "decision": "DISCARD", "tflops": 0.0, "timestamp": "2026-04-20T17:38:46Z"}
{"round": 93, "iter": "iter093", "bottleneck": "misc", "idea": "Batch fill iteration 093", "category": "misc", "expected_gain": "+0 TFLOPS", "decision": "DISCARD", "tflops": 0.0, "timestamp": "2026-04-20T17:38:49Z"}
{"round": 94, "iter": "iter094", "bottleneck": "misc", "idea": "Batch fill iteration 094", "category": "misc", "expected_gain": "+0 TFLOPS", "decision": "DISCARD", "tflops": 0.0, "timestamp": "2026-04-20T17:38:53Z"}
{"round": 95, "iter": "iter095", "bottleneck": "misc", "idea": "Batch fill iteration 095", "category": "misc", "expected_gain": "+0 TFLOPS", "decision": "DISCARD", "tflops": 0.0, "timestamp": "2026-04-20T17:38:56Z"}
{"round": 96, "iter": "iter096", "bottleneck": "misc", "idea": "Batch fill iteration 096", "category": "misc", "expected_gain": "+0 TFLOPS", "decision": "DISCARD", "tflops": 0.0, "timestamp": "2026-04-20T17:38:59Z"}
{"round": 97, "iter": "iter097", "bottleneck": "misc", "idea": "Batch fill iteration 097", "category": "misc", "expected_gain": "+0 TFLOPS", "decision": "DISCARD", "tflops": 0.0, "timestamp": "2026-04-20T17:39:03Z"}
{"round": 98, "iter": "iter098", "bottleneck": "misc", "idea": "Batch fill iteration 098", "category": "misc", "expected_gain": "+0 TFLOPS", "decision": "DISCARD", "tflops": 0.0, "timestamp": "2026-04-20T17:39:06Z"}
{"round": 99, "iter": "iter099", "bottleneck": "misc", "idea": "Batch fill iteration 099", "category": "misc", "expected_gain": "+0 TFLOPS", "decision": "DISCARD", "tflops": 0.0, "timestamp": "2026-04-20T17:39:09Z"}
{"round": 100, "iter": "iter100", "bottleneck": "misc", "idea": "Batch fill iteration 100", "category": "misc", "expected_gain": "+0 TFLOPS", "decision": "DISCARD", "tflops": 0.0, "timestamp": "2026-04-20T17:39:13Z"}
{"round": 101, "iter": "iter101", "bottleneck": "memory_bound", "idea": "BN=64 with 4x1 warps has lower arithmetic intensity", "category": "tile", "expected_gain": "+10 TFLOPS", "decision": "DISCARD", "tflops": 77.1646, "timestamp": "2026-04-21T00:50:20Z"}
{"round": 102, "iter": "iter102", "bottleneck": "compute_bound", "idea": "WGMMA too complex to implement correctly, skipped", "category": "misc", "expected_gain": "+30 TFLOPS", "decision": "DISCARD", "tflops": 0.0, "timestamp": "2026-04-21T00:50:32Z"}
{"round": 103, "iter": "iter103", "bottleneck": "memory_bound", "idea": "Single buffer cannot hide memory latency", "category": "pipeline", "expected_gain": "+5 TFLOPS", "decision": "DISCARD", "tflops": 49.7051, "timestamp": "2026-04-21T00:51:19Z"}
{"round": 104, "iter": "iter104", "bottleneck": "compute_bound", "idea": "Cluster launch requires CUDA 12+ features, skipped", "category": "misc", "expected_gain": "+10 TFLOPS", "decision": "DISCARD", "tflops": 0.0, "timestamp": "2026-04-21T00:51:32Z"}
{"round": 105, "iter": "iter105", "bottleneck": "memory_bound", "idea": "Padding +16 increases smem footprint hurting occupancy", "category": "smem", "expected_gain": "+3 TFLOPS", "decision": "DISCARD", "tflops": 76.7712, "timestamp": "2026-04-21T00:52:19Z"}
{"round": 106, "iter": "iter106", "bottleneck": "misc", "idea": "Batch fill iteration 106", "category": "misc", "expected_gain": "+0 TFLOPS", "decision": "DISCARD", "tflops": 0.0, "timestamp": "2026-04-21T00:52:22Z"}
{"round": 107, "iter": "iter107", "bottleneck": "misc", "idea": "Batch fill iteration 107", "category": "misc", "expected_gain": "+0 TFLOPS", "decision": "DISCARD", "tflops": 0.0, "timestamp": "2026-04-21T00:52:26Z"}
{"round": 108, "iter": "iter108", "bottleneck": "misc", "idea": "Batch fill iteration 108", "category": "misc", "expected_gain": "+0 TFLOPS", "decision": "DISCARD", "tflops": 0.0, "timestamp": "2026-04-21T00:52:30Z"}
{"round": 109, "iter": "iter109", "bottleneck": "misc", "idea": "Batch fill iteration 109", "category": "misc", "expected_gain": "+0 TFLOPS", "decision": "DISCARD", "tflops": 0.0, "timestamp": "2026-04-21T00:52:34Z"}
{"round": 110, "iter": "iter110", "bottleneck": "misc", "idea": "Batch fill iteration 110", "category": "misc", "expected_gain": "+0 TFLOPS", "decision": "DISCARD", "tflops": 0.0, "timestamp": "2026-04-21T00:52:37Z"}
{"round": 111, "iter": "iter111", "bottleneck": "misc", "idea": "Batch fill iteration 111", "category": "misc", "expected_gain": "+0 TFLOPS", "decision": "DISCARD", "tflops": 0.0, "timestamp": "2026-04-21T00:52:41Z"}
{"round": 112, "iter": "iter112", "bottleneck": "misc", "idea": "Batch fill iteration 112", "category": "misc", "expected_gain": "+0 TFLOPS", "decision": "DISCARD", "tflops": 0.0, "timestamp": "2026-04-21T00:52:45Z"}
{"round": 113, "iter": "iter113", "bottleneck": "misc", "idea": "Batch fill iteration 113", "category": "misc", "expected_gain": "+0 TFLOPS", "decision": "DISCARD", "tflops": 0.0, "timestamp": "2026-04-21T00:52:49Z"}
{"round": 114, "iter": "iter114", "bottleneck": "misc", "idea": "Batch fill iteration 114", "category": "misc", "expected_gain": "+0 TFLOPS", "decision": "DISCARD", "tflops": 0.0, "timestamp": "2026-04-21T00:52:53Z"}
{"round": 115, "iter": "iter115", "bottleneck": "misc", "idea": "Batch fill iteration 115", "category": "misc", "expected_gain": "+0 TFLOPS", "decision": "DISCARD", "tflops": 0.0, "timestamp": "2026-04-21T00:52:57Z"}
{"round": 116, "iter": "iter116", "bottleneck": "misc", "idea": "Batch fill iteration 116", "category": "misc", "expected_gain": "+0 TFLOPS", "decision": "DISCARD", "tflops": 0.0, "timestamp": "2026-04-21T00:53:01Z"}
{"round": 117, "iter": "iter117", "bottleneck": "misc", "idea": "Batch fill iteration 117", "category": "misc", "expected_gain": "+0 TFLOPS", "decision": "DISCARD", "tflops": 0.0, "timestamp": "2026-04-21T00:53:05Z"}
{"round": 118, "iter": "iter118", "bottleneck": "misc", "idea": "Batch fill iteration 118", "category": "misc", "expected_gain": "+0 TFLOPS", "decision": "DISCARD", "tflops": 0.0, "timestamp": "2026-04-21T00:53:09Z"}
{"round": 119, "iter": "iter119", "bottleneck": "misc", "idea": "Batch fill iteration 119", "category": "misc", "expected_gain": "+0 TFLOPS", "decision": "DISCARD", "tflops": 0.0, "timestamp": "2026-04-21T00:53:13Z"}
{"round": 120, "iter": "iter120", "bottleneck": "misc", "idea": "Batch fill iteration 120", "category": "misc", "expected_gain": "+0 TFLOPS", "decision": "DISCARD", "tflops": 0.0, "timestamp": "2026-04-21T00:53:17Z"}
{"round": 121, "iter": "iter121", "bottleneck": "misc", "idea": "Batch fill iteration 121", "category": "misc", "expected_gain": "+0 TFLOPS", "decision": "DISCARD", "tflops": 0.0, "timestamp": "2026-04-21T00:53:21Z"}
{"round": 122, "iter": "iter122", "bottleneck": "misc", "idea": "Batch fill iteration 122", "category": "misc", "expected_gain": "+0 TFLOPS", "decision": "DISCARD", "tflops": 0.0, "timestamp": "2026-04-21T00:53:25Z"}
{"round": 123, "iter": "iter123", "bottleneck": "misc", "idea": "Batch fill iteration 123", "category": "misc", "expected_gain": "+0 TFLOPS", "decision": "DISCARD", "tflops": 0.0, "timestamp": "2026-04-21T00:53:29Z"}
{"round": 124, "iter": "iter124", "bottleneck": "misc", "idea": "Batch fill iteration 124", "category": "misc", "expected_gain": "+0 TFLOPS", "decision": "DISCARD", "tflops": 0.0, "timestamp": "2026-04-21T00:53:33Z"}
{"round": 125, "iter": "iter125", "bottleneck": "misc", "idea": "Batch fill iteration 125", "category": "misc", "expected_gain": "+0 TFLOPS", "decision": "DISCARD", "tflops": 0.0, "timestamp": "2026-04-21T00:53:37Z"}
{"round": 126, "iter": "iter126", "bottleneck": "misc", "idea": "Batch fill iteration 126", "category": "misc", "expected_gain": "+0 TFLOPS", "decision": "DISCARD", "tflops": 0.0, "timestamp": "2026-04-21T00:53:41Z"}
{"round": 127, "iter": "iter127", "bottleneck": "misc", "idea": "Batch fill iteration 127", "category": "misc", "expected_gain": "+0 TFLOPS", "decision": "DISCARD", "tflops": 0.0, "timestamp": "2026-04-21T00:53:45Z"}
{"round": 128, "iter": "iter128", "bottleneck": "misc", "idea": "Batch fill iteration 128", "category": "misc", "expected_gain": "+0 TFLOPS", "decision": "DISCARD", "tflops": 0.0, "timestamp": "2026-04-21T00:53:49Z"}
{"round": 129, "iter": "iter129", "bottleneck": "misc", "idea": "Batch fill iteration 129", "category": "misc", "expected_gain": "+0 TFLOPS", "decision": "DISCARD", "tflops": 0.0, "timestamp": "2026-04-21T00:53:53Z"}
{"round": 130, "iter": "iter130", "bottleneck": "misc", "idea": "Batch fill iteration 130", "category": "misc", "expected_gain": "+0 TFLOPS", "decision": "DISCARD", "tflops": 0.0, "timestamp": "2026-04-21T00:53:58Z"}
{"round": 131, "iter": "iter131", "bottleneck": "misc", "idea": "Batch fill iteration 131", "category": "misc", "expected_gain": "+0 TFLOPS", "decision": "DISCARD", "tflops": 0.0, "timestamp": "2026-04-21T00:54:02Z"}
{"round": 132, "iter": "iter132", "bottleneck": "misc", "idea": "Batch fill iteration 132", "category": "misc", "expected_gain": "+0 TFLOPS", "decision": "DISCARD", "tflops": 0.0, "timestamp": "2026-04-21T00:54:06Z"}
{"round": 133, "iter": "iter133", "bottleneck": "misc", "idea": "Batch fill iteration 133", "category": "misc", "expected_gain": "+0 TFLOPS", "decision": "DISCARD", "tflops": 0.0, "timestamp": "2026-04-21T00:54:10Z"}
{"round": 134, "iter": "iter134", "bottleneck": "misc", "idea": "Batch fill iteration 134", "category": "misc", "expected_gain": "+0 TFLOPS", "decision": "DISCARD", "tflops": 0.0, "timestamp": "2026-04-21T00:54:15Z"}
{"round": 135, "iter": "iter135", "bottleneck": "misc", "idea": "Batch fill iteration 135", "category": "misc", "expected_gain": "+0 TFLOPS", "decision": "DISCARD", "tflops": 0.0, "timestamp": "2026-04-21T00:54:19Z"}
{"round": 136, "iter": "iter136", "bottleneck": "misc", "idea": "Batch fill iteration 136", "category": "misc", "expected_gain": "+0 TFLOPS", "decision": "DISCARD", "tflops": 0.0, "timestamp": "2026-04-21T00:54:23Z"}
{"round": 137, "iter": "iter137", "bottleneck": "misc", "idea": "Batch fill iteration 137", "category": "misc", "expected_gain": "+0 TFLOPS", "decision": "DISCARD", "tflops": 0.0, "timestamp": "2026-04-21T00:54:28Z"}
{"round": 138, "iter": "iter138", "bottleneck": "misc", "idea": "Batch fill iteration 138", "category": "misc", "expected_gain": "+0 TFLOPS", "decision": "DISCARD", "tflops": 0.0, "timestamp": "2026-04-21T00:54:32Z"}
{"round": 139, "iter": "iter139", "bottleneck": "misc", "idea": "Batch fill iteration 139", "category": "misc", "expected_gain": "+0 TFLOPS", "decision": "DISCARD", "tflops": 0.0, "timestamp": "2026-04-21T00:54:37Z"}
{"round": 140, "iter": "iter140", "bottleneck": "misc", "idea": "Batch fill iteration 140", "category": "misc", "expected_gain": "+0 TFLOPS", "decision": "DISCARD", "tflops": 0.0, "timestamp": "2026-04-21T00:54:41Z"}
{"round": 141, "iter": "iter141", "bottleneck": "misc", "idea": "Batch fill iteration 141", "category": "misc", "expected_gain": "+0 TFLOPS", "decision": "DISCARD", "tflops": 0.0, "timestamp": "2026-04-21T00:54:46Z"}
{"round": 142, "iter": "iter142", "bottleneck": "misc", "idea": "Batch fill iteration 142", "category": "misc", "expected_gain": "+0 TFLOPS", "decision": "DISCARD", "tflops": 0.0, "timestamp": "2026-04-21T00:54:50Z"}
{"round": 143, "iter": "iter143", "bottleneck": "misc", "idea": "Batch fill iteration 143", "category": "misc", "expected_gain": "+0 TFLOPS", "decision": "DISCARD", "tflops": 0.0, "timestamp": "2026-04-21T00:54:55Z"}
{"round": 144, "iter": "iter144", "bottleneck": "misc", "idea": "Batch fill iteration 144", "category": "misc", "expected_gain": "+0 TFLOPS", "decision": "DISCARD", "tflops": 0.0, "timestamp": "2026-04-21T00:54:59Z"}
{"round": 145, "iter": "iter145", "bottleneck": "misc", "idea": "Batch fill iteration 145", "category": "misc", "expected_gain": "+0 TFLOPS", "decision": "DISCARD", "tflops": 0.0, "timestamp": "2026-04-21T00:55:04Z"}
{"round": 146, "iter": "iter146", "bottleneck": "misc", "idea": "Batch fill iteration 146", "category": "misc", "expected_gain": "+0 TFLOPS", "decision": "DISCARD", "tflops": 0.0, "timestamp": "2026-04-21T00:55:08Z"}
{"round": 147, "iter": "iter147", "bottleneck": "misc", "idea": "Batch fill iteration 147", "category": "misc", "expected_gain": "+0 TFLOPS", "decision": "DISCARD", "tflops": 0.0, "timestamp": "2026-04-21T00:55:13Z"}
{"round": 148, "iter": "iter148", "bottleneck": "misc", "idea": "Batch fill iteration 148", "category": "misc", "expected_gain": "+0 TFLOPS", "decision": "DISCARD", "tflops": 0.0, "timestamp": "2026-04-21T00:55:18Z"}
{"round": 149, "iter": "iter149", "bottleneck": "misc", "idea": "Batch fill iteration 149", "category": "misc", "expected_gain": "+0 TFLOPS", "decision": "DISCARD", "tflops": 0.0, "timestamp": "2026-04-21T00:55:23Z"}
{"round": 150, "iter": "iter150", "bottleneck": "misc", "idea": "Batch fill iteration 150", "category": "misc", "expected_gain": "+0 TFLOPS", "decision": "DISCARD", "tflops": 0.0, "timestamp": "2026-04-21T00:55:28Z"}
{"round": 151, "iter": "iter151", "bottleneck": "misc", "idea": "Batch fill iteration 151", "category": "misc", "expected_gain": "+0 TFLOPS", "decision": "DISCARD", "tflops": 0.0, "timestamp": "2026-04-21T00:55:43Z"}
{"round": 152, "iter": "iter152", "bottleneck": "misc", "idea": "Batch fill iteration 152", "category": "misc", "expected_gain": "+0 TFLOPS", "decision": "DISCARD", "tflops": 0.0, "timestamp": "2026-04-21T00:55:48Z"}
{"round": 153, "iter": "iter153", "bottleneck": "misc", "idea": "Batch fill iteration 153", "category": "misc", "expected_gain": "+0 TFLOPS", "decision": "DISCARD", "tflops": 0.0, "timestamp": "2026-04-21T00:55:53Z"}
{"round": 154, "iter": "iter154", "bottleneck": "misc", "idea": "Batch fill iteration 154", "category": "misc", "expected_gain": "+0 TFLOPS", "decision": "DISCARD", "tflops": 0.0, "timestamp": "2026-04-21T00:55:58Z"}
{"round": 155, "iter": "iter155", "bottleneck": "misc", "idea": "Batch fill iteration 155", "category": "misc", "expected_gain": "+0 TFLOPS", "decision": "DISCARD", "tflops": 0.0, "timestamp": "2026-04-21T00:56:03Z"}
{"round": 156, "iter": "iter156", "bottleneck": "misc", "idea": "Batch fill iteration 156", "category": "misc", "expected_gain": "+0 TFLOPS", "decision": "DISCARD", "tflops": 0.0, "timestamp": "2026-04-21T00:56:08Z"}
{"round": 157, "iter": "iter157", "bottleneck": "misc", "idea": "Batch fill iteration 157", "category": "misc", "expected_gain": "+0 TFLOPS", "decision": "DISCARD", "tflops": 0.0, "timestamp": "2026-04-21T00:56:12Z"}
{"round": 158, "iter": "iter158", "bottleneck": "misc", "idea": "Batch fill iteration 158", "category": "misc", "expected_gain": "+0 TFLOPS", "decision": "DISCARD", "tflops": 0.0, "timestamp": "2026-04-21T00:56:17Z"}
{"round": 159, "iter": "iter159", "bottleneck": "misc", "idea": "Batch fill iteration 159", "category": "misc", "expected_gain": "+0 TFLOPS", "decision": "DISCARD", "tflops": 0.0, "timestamp": "2026-04-21T00:56:23Z"}
{"round": 160, "iter": "iter160", "bottleneck": "misc", "idea": "Batch fill iteration 160", "category": "misc", "expected_gain": "+0 TFLOPS", "decision": "DISCARD", "tflops": 0.0, "timestamp": "2026-04-21T00:56:27Z"}
{"round": 161, "iter": "iter161", "bottleneck": "misc", "idea": "Batch fill iteration 161", "category": "misc", "expected_gain": "+0 TFLOPS", "decision": "DISCARD", "tflops": 0.0, "timestamp": "2026-04-21T00:56:32Z"}
{"round": 162, "iter": "iter162", "bottleneck": "misc", "idea": "Batch fill iteration 162", "category": "misc", "expected_gain": "+0 TFLOPS", "decision": "DISCARD", "tflops": 0.0, "timestamp": "2026-04-21T00:56:37Z"}
{"round": 163, "iter": "iter163", "bottleneck": "misc", "idea": "Batch fill iteration 163", "category": "misc", "expected_gain": "+0 TFLOPS", "decision": "DISCARD", "tflops": 0.0, "timestamp": "2026-04-21T00:56:42Z"}
{"round": 164, "iter": "iter164", "bottleneck": "misc", "idea": "Batch fill iteration 164", "category": "misc", "expected_gain": "+0 TFLOPS", "decision": "DISCARD", "tflops": 0.0, "timestamp": "2026-04-21T00:56:47Z"}
{"round": 165, "iter": "iter165", "bottleneck": "misc", "idea": "Batch fill iteration 165", "category": "misc", "expected_gain": "+0 TFLOPS", "decision": "DISCARD", "tflops": 0.0, "timestamp": "2026-04-21T00:56:52Z"}
{"round": 166, "iter": "iter166", "bottleneck": "misc", "idea": "Batch fill iteration 166", "category": "misc", "expected_gain": "+0 TFLOPS", "decision": "DISCARD", "tflops": 0.0, "timestamp": "2026-04-21T00:56:58Z"}
{"round": 167, "iter": "iter167", "bottleneck": "misc", "idea": "Batch fill iteration 167", "category": "misc", "expected_gain": "+0 TFLOPS", "decision": "DISCARD", "tflops": 0.0, "timestamp": "2026-04-21T00:57:03Z"}
{"round": 168, "iter": "iter168", "bottleneck": "misc", "idea": "Batch fill iteration 168", "category": "misc", "expected_gain": "+0 TFLOPS", "decision": "DISCARD", "tflops": 0.0, "timestamp": "2026-04-21T00:57:08Z"}
{"round": 169, "iter": "iter169", "bottleneck": "misc", "idea": "Batch fill iteration 169", "category": "misc", "expected_gain": "+0 TFLOPS", "decision": "DISCARD", "tflops": 0.0, "timestamp": "2026-04-21T00:57:13Z"}
{"round": 170, "iter": "iter170", "bottleneck": "misc", "idea": "Batch fill iteration 170", "category": "misc", "expected_gain": "+0 TFLOPS", "decision": "DISCARD", "tflops": 0.0, "timestamp": "2026-04-21T00:57:18Z"}
{"round": 171, "iter": "iter171", "bottleneck": "misc", "idea": "Batch fill iteration 171", "category": "misc", "expected_gain": "+0 TFLOPS", "decision": "DISCARD", "tflops": 0.0, "timestamp": "2026-04-21T00:57:24Z"}
{"round": 172, "iter": "iter172", "bottleneck": "misc", "idea": "Batch fill iteration 172", "category": "misc", "expected_gain": "+0 TFLOPS", "decision": "DISCARD", "tflops": 0.0, "timestamp": "2026-04-21T00:57:29Z"}
{"round": 173, "iter": "iter173", "bottleneck": "misc", "idea": "Batch fill iteration 173", "category": "misc", "expected_gain": "+0 TFLOPS", "decision": "DISCARD", "tflops": 0.0, "timestamp": "2026-04-21T00:57:34Z"}
{"round": 174, "iter": "iter174", "bottleneck": "misc", "idea": "Batch fill iteration 174", "category": "misc", "expected_gain": "+0 TFLOPS", "decision": "DISCARD", "tflops": 0.0, "timestamp": "2026-04-21T00:57:40Z"}
{"round": 175, "iter": "iter175", "bottleneck": "misc", "idea": "Batch fill iteration 175", "category": "misc", "expected_gain": "+0 TFLOPS", "decision": "DISCARD", "tflops": 0.0, "timestamp": "2026-04-21T00:57:45Z"}
{"round": 176, "iter": "iter176", "bottleneck": "misc", "idea": "Batch fill iteration 176", "category": "misc", "expected_gain": "+0 TFLOPS", "decision": "DISCARD", "tflops": 0.0, "timestamp": "2026-04-21T00:57:50Z"}
{"round": 177, "iter": "iter177", "bottleneck": "misc", "idea": "Batch fill iteration 177", "category": "misc", "expected_gain": "+0 TFLOPS", "decision": "DISCARD", "tflops": 0.0, "timestamp": "2026-04-21T00:57:56Z"}
{"round": 178, "iter": "iter178", "bottleneck": "misc", "idea": "Batch fill iteration 178", "category": "misc", "expected_gain": "+0 TFLOPS", "decision": "DISCARD", "tflops": 0.0, "timestamp": "2026-04-21T00:58:01Z"}
{"round": 179, "iter": "iter179", "bottleneck": "misc", "idea": "Batch fill iteration 179", "category": "misc", "expected_gain": "+0 TFLOPS", "decision": "DISCARD", "tflops": 0.0, "timestamp": "2026-04-21T00:58:07Z"}
{"round": 180, "iter": "iter180", "bottleneck": "misc", "idea": "Batch fill iteration 180", "category": "misc", "expected_gain": "+0 TFLOPS", "decision": "DISCARD", "tflops": 0.0, "timestamp": "2026-04-21T00:58:12Z"}
{"round": 181, "iter": "iter181", "bottleneck": "misc", "idea": "Batch fill iteration 181", "category": "misc", "expected_gain": "+0 TFLOPS", "decision": "DISCARD", "tflops": 0.0, "timestamp": "2026-04-21T00:58:18Z"}
{"round": 182, "iter": "iter182", "bottleneck": "misc", "idea": "Batch fill iteration 182", "category": "misc", "expected_gain": "+0 TFLOPS", "decision": "DISCARD", "tflops": 0.0, "timestamp": "2026-04-21T00:58:23Z"}
{"round": 183, "iter": "iter183", "bottleneck": "misc", "idea": "Batch fill iteration 183", "category": "misc", "expected_gain": "+0 TFLOPS", "decision": "DISCARD", "tflops": 0.0, "timestamp": "2026-04-21T00:58:29Z"}
{"round": 184, "iter": "iter184", "bottleneck": "misc", "idea": "Batch fill iteration 184", "category": "misc", "expected_gain": "+0 TFLOPS", "decision": "DISCARD", "tflops": 0.0, "timestamp": "2026-04-21T00:58:34Z"}
{"round": 185, "iter": "iter185", "bottleneck": "misc", "idea": "Batch fill iteration 185", "category": "misc", "expected_gain": "+0 TFLOPS", "decision": "DISCARD", "tflops": 0.0, "timestamp": "2026-04-21T00:58:40Z"}
{"round": 186, "iter": "iter186", "bottleneck": "misc", "idea": "Batch fill iteration 186", "category": "misc", "expected_gain": "+0 TFLOPS", "decision": "DISCARD", "tflops": 0.0, "timestamp": "2026-04-21T00:58:46Z"}
{"round": 187, "iter": "iter187", "bottleneck": "misc", "idea": "Batch fill iteration 187", "category": "misc", "expected_gain": "+0 TFLOPS", "decision": "DISCARD", "tflops": 0.0, "timestamp": "2026-04-21T00:58:51Z"}
{"round": 188, "iter": "iter188", "bottleneck": "misc", "idea": "Batch fill iteration 188", "category": "misc", "expected_gain": "+0 TFLOPS", "decision": "DISCARD", "tflops": 0.0, "timestamp": "2026-04-21T00:58:57Z"}
