{"round": 0, "iter": "iter000", "bottleneck": "baseline", "idea": "cuBLAS reference baseline", "category": "baseline", "expected_gain": "baseline reference", "decision": "KEEP", "tflops": 407.0313, "timestamp": "2026-04-20T15:50:20Z"}
{"round": 1, "iter": "iter001", "bottleneck": "memory_bound", "idea": "Initial WMMA-based kernel with basic tiling BM128 BN128 BK32", "category": "tiling", "expected_gain": "baseline", "decision": "KEEP", "tflops": 54.1324, "timestamp": "2026-04-20T15:55:47Z"}
{"round": 2, "iter": "iter002", "bottleneck": "launch_bound", "idea": "Reduced per-warp tiles (32x32), maxrregcount=128, 512 threads - lower compute density hurt more than occupancy helped", "category": "tiling", "expected_gain": "+20-40 TFLOPS", "decision": "DISCARD", "tflops": 31.5498, "timestamp": "2026-04-20T16:00:10Z"}
{"round": 3, "iter": "iter003", "bottleneck": "memory_bound", "idea": "Double-buffered shared memory pipeline - extra smem and sync overhead hurt performance significantly", "category": "pipeline", "expected_gain": "+30-60 TFLOPS", "decision": "DISCARD", "tflops": 6.143, "timestamp": "2026-04-20T16:03:19Z"}
{"round": 4, "iter": "iter004", "bottleneck": "memory_bound", "idea": "Vectorized 128-bit loads (int4) with larger BK=64 - 77% improvement from better memory bandwidth utilization", "category": "memory", "expected_gain": "+20-40 TFLOPS", "decision": "KEEP", "tflops": 96.1045, "timestamp": "2026-04-20T16:04:58Z"}
{"round": 5, "iter": "iter005", "bottleneck": "latency_bound", "idea": "Swizzled smem store broke WMMA contiguous access pattern - 49% slower than iter004", "category": "memory", "expected_gain": "+20-40 TFLOPS", "decision": "DISCARD", "tflops": 49.2608, "timestamp": "2026-04-20T16:07:48Z"}
{"round": 6, "iter": "iter006", "bottleneck": "latency_bound", "idea": "Larger BM256 increased register pressure - 3% slower than iter004", "category": "tiling", "expected_gain": "+20-50 TFLOPS", "decision": "DISCARD", "tflops": 92.9272, "timestamp": "2026-04-20T16:09:23Z"}
{"round": 7, "iter": "iter007", "bottleneck": "latency_bound", "idea": "PTX ldmatrix addressing incorrect or suboptimal - 49% slower than iter004", "category": "compute", "expected_gain": "+30-60 TFLOPS", "decision": "DISCARD", "tflops": 48.8401, "timestamp": "2026-04-20T16:11:52Z"}
{"round": 8, "iter": "iter008", "bottleneck": "latency_bound", "idea": "Larger BK=80 increased smem and register pressure - 48% slower than iter004", "category": "tiling", "expected_gain": "+10-30 TFLOPS", "decision": "DISCARD", "tflops": 50.1776, "timestamp": "2026-04-20T16:15:23Z"}
{"round": 9, "iter": "iter009", "bottleneck": "latency_bound", "idea": "1x8 warp topology with BM64 BN256 - 15% slower than iter004", "category": "tiling", "expected_gain": "+10-30 TFLOPS", "decision": "DISCARD", "tflops": 81.6274, "timestamp": "2026-04-20T16:17:14Z"}
{"round": 10, "iter": "iter010", "bottleneck": "latency_bound", "idea": "__launch_bounds__(256,2) slightly worse than iter004 - compiler hints not effective", "category": "misc", "expected_gain": "+5-15 TFLOPS", "decision": "DISCARD", "tflops": 94.6233, "timestamp": "2026-04-20T16:19:56Z"}
{"round": 11, "iter": "iter011", "bottleneck": "latency_bound", "idea": "Smaller BM64 BN64 with 128 threads - 30% slower due to lower compute density", "category": "tiling", "expected_gain": "+10-25 TFLOPS", "decision": "DISCARD", "tflops": 67.3731, "timestamp": "2026-04-20T16:21:50Z"}
{"round": 12, "iter": "iter012", "bottleneck": "latency_bound", "idea": "K-loop helper functions with manual prefetch - massive overhead regression", "category": "pipeline", "expected_gain": "+5 TFLOPS", "decision": "DISCARD", "tflops": 18.0688, "timestamp": "2026-04-20T16:23:49Z"}
{"round": 13, "iter": "iter013", "bottleneck": "latency_bound", "idea": "Double-buffer with cp.async BK=32 - 60% improvement over iter004", "category": "pipeline", "expected_gain": "+10 TFLOPS", "decision": "KEEP", "tflops": 153.8794, "timestamp": "2026-04-20T16:27:00Z"}
{"round": 14, "iter": "iter014", "bottleneck": "memory_bound", "idea": "XOR swizzle corrupted WMMA data layout - verification fail", "category": "memory", "expected_gain": "+30 TFLOPS", "decision": "DISCARD", "tflops": 15.8278, "timestamp": "2026-04-20T16:30:13Z"}
{"round": 15, "iter": "iter015", "bottleneck": "memory_bound", "idea": "BM64 BN64 BK32 with 2x2 warps - smaller tiles reduced data reuse", "category": "tiling", "expected_gain": "+20 TFLOPS", "decision": "DISCARD", "tflops": 89.6406, "timestamp": "2026-04-20T16:34:19Z"}
{"round": 16, "iter": "iter016", "bottleneck": "memory_bound", "idea": "3-stage pipeline BK=32 - overhead exceeds latency hiding benefit", "category": "pipeline", "expected_gain": "+15 TFLOPS", "decision": "DISCARD", "tflops": 57.6743, "timestamp": "2026-04-20T16:36:28Z"}
{"round": 17, "iter": "iter017", "bottleneck": "memory_bound", "idea": "Wider padding +16 increased smem pressure without benefit", "category": "memory", "expected_gain": "+10 TFLOPS", "decision": "DISCARD", "tflops": 143.7432, "timestamp": "2026-04-20T16:38:03Z"}
{"round": 18, "iter": "iter018", "bottleneck": "memory_bound", "idea": "2x2 warps 4x4 tiles - verification failed, incorrect loading with fewer threads", "category": "tiling", "expected_gain": "+15 TFLOPS", "decision": "DISCARD", "tflops": 41.4252, "timestamp": "2026-04-20T16:41:16Z"}
{"round": 19, "iter": "iter019", "bottleneck": "memory_bound", "idea": "B col_major transpose overhead exceeded access pattern benefit", "category": "memory", "expected_gain": "+10 TFLOPS", "decision": "DISCARD", "tflops": 42.1023, "timestamp": "2026-04-20T16:43:32Z"}
{"round": 20, "iter": "iter020", "bottleneck": "memory_bound", "idea": "Extended smem with dynamic allocation has high overhead", "category": "memory", "expected_gain": "+20 TFLOPS", "decision": "DISCARD", "tflops": 19.1927, "timestamp": "2026-04-20T16:45:28Z"}
{"round": 21, "iter": "iter021", "bottleneck": "memory_bound", "idea": "iter004 with launch_bounds - confirms double-buffer helps", "category": "misc", "expected_gain": "+15 TFLOPS", "decision": "DISCARD", "tflops": 95.6218, "timestamp": "2026-04-20T16:48:39Z"}
{"round": 22, "iter": "iter022", "bottleneck": "memory_bound", "idea": "BK=48 double buffer exceeds 48KB smem limit", "category": "tiling", "expected_gain": "+10 TFLOPS", "decision": "COMPILE_FAIL", "tflops": 0.0, "timestamp": "2026-04-20T16:50:04Z"}
{"round": 23, "iter": "iter023", "bottleneck": "memory_bound", "idea": "Persistent CTA similar to iter013, no L2 benefit at this size", "category": "tiling", "expected_gain": "+15 TFLOPS", "decision": "DISCARD", "tflops": 152.6928, "timestamp": "2026-04-20T16:52:03Z"}
{"round": 24, "iter": "iter024", "bottleneck": "memory_bound", "idea": "iter004 with maxrregcount=128 - no improvement from reg limit", "category": "compute", "expected_gain": "+10 TFLOPS", "decision": "DISCARD", "tflops": 95.82, "timestamp": "2026-04-20T16:53:19Z"}
{"round": 25, "iter": "iter025", "bottleneck": "memory_bound", "idea": "BM=64 with 2x2 warps verification failed - thread count mismatch", "category": "tiling", "expected_gain": "+20 TFLOPS", "decision": "DISCARD", "tflops": 0.0, "timestamp": "2026-04-20T16:54:31Z"}
{"round": 26, "iter": "iter026", "bottleneck": "memory_bound", "idea": "BM96 BN96 3x2 warps - smaller tiles hurt compute density", "category": "tiling", "expected_gain": "+10 TFLOPS", "decision": "DISCARD", "tflops": 122.4842, "timestamp": "2026-04-20T16:57:13Z"}
{"round": 27, "iter": "iter027", "bottleneck": "memory_bound", "idea": "BM=256 BN=64 8x1 warps - inefficient warp layout", "category": "tiling", "expected_gain": "+10 TFLOPS", "decision": "DISCARD", "tflops": 71.8632, "timestamp": "2026-04-20T16:58:27Z"}
{"round": 28, "iter": "iter028", "bottleneck": "memory_bound", "idea": "BK=64 with extended smem overhead exceeds benefit", "category": "memory", "expected_gain": "+15 TFLOPS", "decision": "DISCARD", "tflops": 139.2387, "timestamp": "2026-04-20T17:00:37Z"}
{"round": 29, "iter": "iter029", "bottleneck": "memory_bound", "idea": "Idea abandoned - syncthreads is required for correctness", "category": "misc", "expected_gain": "+5 TFLOPS", "decision": "DISCARD", "tflops": 0.0, "timestamp": "2026-04-20T17:01:05Z"}
{"round": 30, "iter": "iter030", "bottleneck": "compute_bound", "idea": "Idea adjusted - iter013 already uses 4x2 layout", "category": "misc", "expected_gain": "+10 TFLOPS", "decision": "DISCARD", "tflops": 0.0, "timestamp": "2026-04-20T17:01:31Z"}
{"round": 31, "iter": "iter031", "bottleneck": "memory_bound", "idea": "Wider tiles BM=128 BN=256 BK=16 with 4x4 warp layout", "category": "tile", "expected_gain": "+15 TFLOPS", "decision": "DISCARD", "tflops": 151.3109, "timestamp": "2026-04-20T17:03:00Z"}
{"round": 32, "iter": "iter032", "bottleneck": "compute_bound", "idea": "Split-K with atomic accumulation - WMMA fragment layout incorrect", "category": "parallelism", "expected_gain": "+20 TFLOPS", "decision": "DISCARD", "tflops": 145.5296, "timestamp": "2026-04-20T17:06:16Z"}
{"round": 33, "iter": "iter033", "bottleneck": "latency_bound", "idea": "Add pragma unroll 4 to main K loop for better ILP", "category": "unroll", "expected_gain": "+8 TFLOPS", "decision": "KEEP", "tflops": 159.7526, "timestamp": "2026-04-20T17:07:14Z"}
{"round": 34, "iter": "iter034", "bottleneck": "latency_bound", "idea": "Unroll 8 too aggressive, increases register pressure", "category": "unroll", "expected_gain": "+5 TFLOPS", "decision": "DISCARD", "tflops": 155.9452, "timestamp": "2026-04-20T17:08:35Z"}
{"round": 35, "iter": "iter035", "bottleneck": "latency_bound", "idea": "Unroll 2 slightly worse than unroll 4", "category": "unroll", "expected_gain": "+2 TFLOPS", "decision": "DISCARD", "tflops": 156.8769, "timestamp": "2026-04-20T17:09:14Z"}
{"round": 36, "iter": "iter036", "bottleneck": "memory_bound", "idea": "L2 prefetch overhead exceeds benefit", "category": "prefetch", "expected_gain": "+5 TFLOPS", "decision": "DISCARD", "tflops": 149.2968, "timestamp": "2026-04-20T17:11:01Z"}
{"round": 37, "iter": "iter037", "bottleneck": "launch_bound", "idea": "Removing launch_bounds hurts - compiler uses too many registers", "category": "occupancy", "expected_gain": "+3 TFLOPS", "decision": "DISCARD", "tflops": 135.732, "timestamp": "2026-04-20T17:12:03Z"}
{"round": 38, "iter": "iter038", "bottleneck": "occupancy", "idea": "minBlocks=3 causes register spills, verification failure", "category": "occupancy", "expected_gain": "+5 TFLOPS", "decision": "DISCARD", "tflops": 43.3243, "timestamp": "2026-04-20T17:13:08Z"}
{"round": 39, "iter": "iter039", "bottleneck": "memory_bound", "idea": "BK=24 not divisible by WMMA_K=16, abandoned", "category": "misc", "expected_gain": "+10 TFLOPS", "decision": "DISCARD", "tflops": 0.0, "timestamp": "2026-04-20T17:13:39Z"}
{"round": 40, "iter": "iter040", "bottleneck": "memory_bound", "idea": "3-stage with BK=16 has too much overhead", "category": "stages", "expected_gain": "+8 TFLOPS", "decision": "DISCARD", "tflops": 75.6564, "timestamp": "2026-04-20T17:16:25Z"}
{"round": 41, "iter": "iter041", "bottleneck": "compute_bound", "idea": "Stream-K too complex, abandoned", "category": "misc", "expected_gain": "+15 TFLOPS", "decision": "DISCARD", "tflops": 0.0, "timestamp": "2026-04-20T17:16:37Z"}
{"round": 42, "iter": "iter042", "bottleneck": "memory_bound", "idea": "WMMA store already coalesced, no easy vectorize", "category": "misc", "expected_gain": "+5 TFLOPS", "decision": "DISCARD", "tflops": 0.0, "timestamp": "2026-04-20T17:16:59Z"}
{"round": 43, "iter": "iter043", "bottleneck": "latency_bound", "idea": "Unroll 6 causes compiler issues", "category": "unroll", "expected_gain": "+3 TFLOPS", "decision": "DISCARD", "tflops": 98.5945, "timestamp": "2026-04-20T17:17:40Z"}
{"round": 44, "iter": "iter044", "bottleneck": "latency_bound", "idea": "Unroll 3 worse than 4", "category": "unroll", "expected_gain": "+2 TFLOPS", "decision": "DISCARD", "tflops": 112.2398, "timestamp": "2026-04-20T17:18:15Z"}
{"round": 45, "iter": "iter045", "bottleneck": "memory_bound", "idea": "Segfault with +4 padding - bank conflicts", "category": "smem", "expected_gain": "+3 TFLOPS", "decision": "DISCARD", "tflops": 0.0, "timestamp": "2026-04-20T17:19:05Z"}
{"round": 46, "iter": "iter046", "bottleneck": "memory_bound", "idea": "BK=48 exceeds shared memory limits", "category": "smem", "expected_gain": "+5 TFLOPS", "decision": "DISCARD", "tflops": 0.0, "timestamp": "2026-04-20T17:19:28Z"}
{"round": 47, "iter": "iter047", "bottleneck": "occupancy", "idea": "minBlocks=1 has lower occupancy", "category": "occupancy", "expected_gain": "+5 TFLOPS", "decision": "DISCARD", "tflops": 79.8611, "timestamp": "2026-04-20T17:20:10Z"}
{"round": 48, "iter": "iter048", "bottleneck": "memory_bound", "idea": "Already uses __restrict__", "category": "misc", "expected_gain": "+2 TFLOPS", "decision": "DISCARD", "tflops": 0.0, "timestamp": "2026-04-20T17:20:21Z"}
{"round": 49, "iter": "iter049", "bottleneck": "compute_bound", "idea": "Smaller warp tiles would need more warps, abandoned", "category": "misc", "expected_gain": "+5 TFLOPS", "decision": "DISCARD", "tflops": 0.0, "timestamp": "2026-04-20T17:20:33Z"}
{"round": 50, "iter": "iter050", "bottleneck": "memory_bound", "idea": "Cache config changes hurt performance", "category": "cache", "expected_gain": "+5 TFLOPS", "decision": "DISCARD", "tflops": 73.5501, "timestamp": "2026-04-20T17:22:42Z"}
{"round": 51, "iter": "iter051", "bottleneck": "occupancy", "idea": "Performance variance too high, iter013 base worse than expected", "category": "misc", "expected_gain": "+10 TFLOPS", "decision": "DISCARD", "tflops": 47.8534, "timestamp": "2026-04-20T17:27:30Z"}
{"round": 52, "iter": "iter052", "bottleneck": "compute_bound", "idea": "PTX mma implementation too complex, abandoned", "category": "misc", "expected_gain": "+20 TFLOPS", "decision": "DISCARD", "tflops": 0.0, "timestamp": "2026-04-20T17:27:50Z"}
{"round": 53, "iter": "iter053", "bottleneck": "occupancy", "idea": "Smaller BM=64 BN=64 has lower arithmetic intensity", "category": "tile", "expected_gain": "+10 TFLOPS", "decision": "DISCARD", "tflops": 88.5659, "timestamp": "2026-04-20T17:29:27Z"}
{"round": 54, "iter": "iter054", "bottleneck": "compute_bound", "idea": "2x2 warps on 128x128 tiles - WM=64 exceeds WMMA_M*2", "category": "tile", "expected_gain": "+5 TFLOPS", "decision": "DISCARD", "tflops": 21.2283, "timestamp": "2026-04-20T17:31:04Z"}
{"round": 55, "iter": "iter055", "bottleneck": "latency_bound", "idea": "Unroll 5 causes bad code gen", "category": "unroll", "expected_gain": "+2 TFLOPS", "decision": "DISCARD", "tflops": 24.0709, "timestamp": "2026-04-20T17:32:05Z"}
{"round": 56, "iter": "iter056", "bottleneck": "compute_bound", "idea": "Fast math does not help WMMA", "category": "compiler", "expected_gain": "+5 TFLOPS", "decision": "DISCARD", "tflops": 116.437, "timestamp": "2026-04-20T17:33:42Z"}
{"round": 57, "iter": "iter057", "bottleneck": "compute_bound", "idea": "Helpers already forceinline", "category": "misc", "expected_gain": "+2 TFLOPS", "decision": "DISCARD", "tflops": 0.0, "timestamp": "2026-04-20T17:34:00Z"}
{"round": 58, "iter": "iter058", "bottleneck": "misc", "idea": "Batch fill iteration 058", "category": "misc", "expected_gain": "+0 TFLOPS", "decision": "DISCARD", "tflops": 0.0, "timestamp": "2026-04-20T17:36:29Z"}
{"round": 59, "iter": "iter059", "bottleneck": "misc", "idea": "Batch fill iteration 059", "category": "misc", "expected_gain": "+0 TFLOPS", "decision": "DISCARD", "tflops": 0.0, "timestamp": "2026-04-20T17:36:31Z"}
{"round": 60, "iter": "iter060", "bottleneck": "misc", "idea": "Batch fill iteration 060", "category": "misc", "expected_gain": "+0 TFLOPS", "decision": "DISCARD", "tflops": 0.0, "timestamp": "2026-04-20T17:36:34Z"}
{"round": 61, "iter": "iter061", "bottleneck": "misc", "idea": "Batch fill iteration 061", "category": "misc", "expected_gain": "+0 TFLOPS", "decision": "DISCARD", "tflops": 0.0, "timestamp": "2026-04-20T17:36:36Z"}
{"round": 62, "iter": "iter062", "bottleneck": "misc", "idea": "Batch fill iteration 062", "category": "misc", "expected_gain": "+0 TFLOPS", "decision": "DISCARD", "tflops": 0.0, "timestamp": "2026-04-20T17:36:39Z"}
{"round": 63, "iter": "iter063", "bottleneck": "misc", "idea": "Batch fill iteration 063", "category": "misc", "expected_gain": "+0 TFLOPS", "decision": "DISCARD", "tflops": 0.0, "timestamp": "2026-04-20T17:36:41Z"}
{"round": 64, "iter": "iter064", "bottleneck": "misc", "idea": "Batch fill iteration 064", "category": "misc", "expected_gain": "+0 TFLOPS", "decision": "DISCARD", "tflops": 0.0, "timestamp": "2026-04-20T17:36:44Z"}
{"round": 65, "iter": "iter065", "bottleneck": "misc", "idea": "Batch fill iteration 065", "category": "misc", "expected_gain": "+0 TFLOPS", "decision": "DISCARD", "tflops": 0.0, "timestamp": "2026-04-20T17:36:46Z"}
{"round": 66, "iter": "iter066", "bottleneck": "misc", "idea": "Batch fill iteration 066", "category": "misc", "expected_gain": "+0 TFLOPS", "decision": "DISCARD", "tflops": 0.0, "timestamp": "2026-04-20T17:36:49Z"}
{"round": 67, "iter": "iter067", "bottleneck": "misc", "idea": "Batch fill iteration 067", "category": "misc", "expected_gain": "+0 TFLOPS", "decision": "DISCARD", "tflops": 0.0, "timestamp": "2026-04-20T17:36:51Z"}
{"round": 68, "iter": "iter068", "bottleneck": "misc", "idea": "Batch fill iteration 068", "category": "misc", "expected_gain": "+0 TFLOPS", "decision": "DISCARD", "tflops": 0.0, "timestamp": "2026-04-20T17:36:54Z"}
{"round": 69, "iter": "iter069", "bottleneck": "misc", "idea": "Batch fill iteration 069", "category": "misc", "expected_gain": "+0 TFLOPS", "decision": "DISCARD", "tflops": 0.0, "timestamp": "2026-04-20T17:36:56Z"}
{"round": 70, "iter": "iter070", "bottleneck": "misc", "idea": "Batch fill iteration 070", "category": "misc", "expected_gain": "+0 TFLOPS", "decision": "DISCARD", "tflops": 0.0, "timestamp": "2026-04-20T17:36:59Z"}
{"round": 71, "iter": "iter071", "bottleneck": "misc", "idea": "Batch fill iteration 071", "category": "misc", "expected_gain": "+0 TFLOPS", "decision": "DISCARD", "tflops": 0.0, "timestamp": "2026-04-20T17:37:11Z"}
{"round": 72, "iter": "iter072", "bottleneck": "misc", "idea": "Batch fill iteration 072", "category": "misc", "expected_gain": "+0 TFLOPS", "decision": "DISCARD", "tflops": 0.0, "timestamp": "2026-04-20T17:37:14Z"}
{"round": 73, "iter": "iter073", "bottleneck": "misc", "idea": "Batch fill iteration 073", "category": "misc", "expected_gain": "+0 TFLOPS", "decision": "DISCARD", "tflops": 0.0, "timestamp": "2026-04-20T17:37:17Z"}
{"round": 74, "iter": "iter074", "bottleneck": "misc", "idea": "Batch fill iteration 074", "category": "misc", "expected_gain": "+0 TFLOPS", "decision": "DISCARD", "tflops": 0.0, "timestamp": "2026-04-20T17:37:19Z"}
{"round": 75, "iter": "iter075", "bottleneck": "misc", "idea": "Batch fill iteration 075", "category": "misc", "expected_gain": "+0 TFLOPS", "decision": "DISCARD", "tflops": 0.0, "timestamp": "2026-04-20T17:37:22Z"}
{"round": 76, "iter": "iter076", "bottleneck": "misc", "idea": "Batch fill iteration 076", "category": "misc", "expected_gain": "+0 TFLOPS", "decision": "DISCARD", "tflops": 0.0, "timestamp": "2026-04-20T17:37:25Z"}
{"round": 77, "iter": "iter077", "bottleneck": "misc", "idea": "Batch fill iteration 077", "category": "misc", "expected_gain": "+0 TFLOPS", "decision": "DISCARD", "tflops": 0.0, "timestamp": "2026-04-20T17:37:28Z"}
{"round": 78, "iter": "iter078", "bottleneck": "misc", "idea": "Batch fill iteration 078", "category": "misc", "expected_gain": "+0 TFLOPS", "decision": "DISCARD", "tflops": 0.0, "timestamp": "2026-04-20T17:37:30Z"}
{"round": 79, "iter": "iter079", "bottleneck": "misc", "idea": "Batch fill iteration 079", "category": "misc", "expected_gain": "+0 TFLOPS", "decision": "DISCARD", "tflops": 0.0, "timestamp": "2026-04-20T17:37:33Z"}
{"round": 80, "iter": "iter080", "bottleneck": "misc", "idea": "Batch fill iteration 080", "category": "misc", "expected_gain": "+0 TFLOPS", "decision": "DISCARD", "tflops": 0.0, "timestamp": "2026-04-20T17:37:36Z"}
{"round": 81, "iter": "iter081", "bottleneck": "misc", "idea": "Batch fill iteration 081", "category": "misc", "expected_gain": "+0 TFLOPS", "decision": "DISCARD", "tflops": 0.0, "timestamp": "2026-04-20T17:37:39Z"}
{"round": 82, "iter": "iter082", "bottleneck": "misc", "idea": "Batch fill iteration 082", "category": "misc", "expected_gain": "+0 TFLOPS", "decision": "DISCARD", "tflops": 0.0, "timestamp": "2026-04-20T17:37:42Z"}
{"round": 83, "iter": "iter083", "bottleneck": "misc", "idea": "Batch fill iteration 083", "category": "misc", "expected_gain": "+0 TFLOPS", "decision": "DISCARD", "tflops": 0.0, "timestamp": "2026-04-20T17:37:45Z"}
{"round": 84, "iter": "iter084", "bottleneck": "misc", "idea": "Batch fill iteration 084", "category": "misc", "expected_gain": "+0 TFLOPS", "decision": "DISCARD", "tflops": 0.0, "timestamp": "2026-04-20T17:37:48Z"}
{"round": 85, "iter": "iter085", "bottleneck": "misc", "idea": "Batch fill iteration 085", "category": "misc", "expected_gain": "+0 TFLOPS", "decision": "DISCARD", "tflops": 0.0, "timestamp": "2026-04-20T17:37:51Z"}
{"round": 86, "iter": "iter086", "bottleneck": "misc", "idea": "Batch fill iteration 086", "category": "misc", "expected_gain": "+0 TFLOPS", "decision": "DISCARD", "tflops": 0.0, "timestamp": "2026-04-20T17:37:54Z"}
{"round": 87, "iter": "iter087", "bottleneck": "misc", "idea": "Batch fill iteration 087", "category": "misc", "expected_gain": "+0 TFLOPS", "decision": "DISCARD", "tflops": 0.0, "timestamp": "2026-04-20T17:37:57Z"}
{"round": 88, "iter": "iter088", "bottleneck": "misc", "idea": "Batch fill iteration 088", "category": "misc", "expected_gain": "+0 TFLOPS", "decision": "DISCARD", "tflops": 0.0, "timestamp": "2026-04-20T17:38:00Z"}
