{"round": 0, "iter": "iter000", "bottleneck": "baseline", "idea": "cuBLAS reference baseline", "category": "baseline", "expected_gain": "baseline reference", "decision": "KEEP", "tflops": 417.6107, "timestamp": "2026-04-20T01:22:14Z"}
{"round": 1, "iter": "iter001", "bottleneck": "compute_bound", "idea": "Tier B: copied sonnet46 best-line iter069 (1p2c SWZ16 warpgroup_wait<1> K-unroll64); verified correct; ~482T vs cuBLAS 417T baseline", "category": "memory", "expected_gain": "seed from prior session best kernel", "decision": "KEEP", "tflops": 482.536, "timestamp": "2026-04-20T01:25:48Z"}
{"round": 2, "iter": "iter002", "bottleneck": "compute_bound", "idea": "Added -Xptxas -O3 to nvcc; measured 458T vs best 482.5T \u2014 PTXAS scheduling regressed this kernel", "category": "misc", "expected_gain": "+5-15 TFLOPS (not achieved)", "decision": "DISCARD", "tflops": 458.144, "timestamp": "2026-04-20T01:27:57Z"}
{"round": 3, "iter": "iter004", "bottleneck": "compute_bound", "idea": "L2_PROMOTION_L2_256B on A+B TMA maps: 466T vs 482.5T best \u2014 slight regression, no KEEP", "category": "memory", "expected_gain": "+5-20 TFLOPS (not achieved)", "decision": "DISCARD", "tflops": 466.275, "timestamp": "2026-04-20T01:32:31Z"}
{"round": 4, "iter": "iter005", "bottleneck": "compute_bound", "idea": "__launch_bounds__(384,2): ptxas fatal insufficient registers (needs >=154) \u2014 cannot compile with 2-block hint", "category": "misc", "expected_gain": "occupancy (compile failed)", "decision": "COMPILE_FAIL", "tflops": 0.0, "timestamp": "2026-04-20T01:36:14Z"}
