{"round": 0, "iter": "iter000", "bottleneck": "baseline", "idea": "cuBLAS reference baseline", "category": "baseline", "expected_gain": "baseline reference", "decision": "KEEP", "tflops": 269.0652, "timestamp": "2026-04-17T17:51:48Z"}
{"round": 1, "iter": "iter001", "bottleneck": "latency_bound", "idea": "Starting kernel from prior session (TM256 WN200 1p2c persistent)", "category": "tiling", "expected_gain": "baseline starting point", "decision": "KEEP", "tflops": 352.704, "timestamp": "2026-04-17T17:55:00Z"}
{"round": 2, "iter": "iter002", "bottleneck": "latency_bound", "idea": "TM128 WN128 STAGES=3 - smaller tiles for higher occupancy but lost compute throughput", "category": "tiling", "expected_gain": "+10-30 TFLOPS", "decision": "DISCARD", "tflops": 178.124, "timestamp": "2026-04-17T17:58:10Z"}
{"round": 3, "iter": "iter003", "bottleneck": "latency_bound", "idea": "TM256 WN200 with maxrregcount=170 - register cap caused spilling", "category": "compute", "expected_gain": "+5-10 TFLOPS", "decision": "DISCARD", "tflops": 183.766, "timestamp": "2026-04-17T17:59:33Z"}
{"round": 4, "iter": "iter004", "bottleneck": "latency_bound", "idea": "STRUCTURAL: 1p3c topology TM192 WN128 - verification failed, likely output addressing issue", "category": "misc", "expected_gain": "+10-20 TFLOPS", "decision": "SEGFAULT", "tflops": 0.0, "timestamp": "2026-04-17T18:01:54Z"}
{"round": 5, "iter": "iter005", "bottleneck": "latency_bound", "idea": "TILE_K=32 STAGES=4 - too small K-tile killed WGMMA efficiency", "category": "pipeline", "expected_gain": "+10-20 TFLOPS", "decision": "DISCARD", "tflops": 80.225, "timestamp": "2026-04-17T18:04:06Z"}
{"round": 6, "iter": "iter006", "bottleneck": "latency_bound", "idea": "STRUCTURAL: Non-persistent launch - massive scheduling overhead killed perf", "category": "misc", "expected_gain": "+5-15 TFLOPS", "decision": "DISCARD", "tflops": 65.538, "timestamp": "2026-04-17T18:06:29Z"}
{"round": 7, "iter": "iter007", "bottleneck": "latency_bound", "idea": "Phase 2: __launch_bounds__(384,1) + fast_math killed performance", "category": "compute", "expected_gain": "+5-10 TFLOPS", "decision": "DISCARD", "tflops": 45.197, "timestamp": "2026-04-17T18:08:03Z"}
{"round": 8, "iter": "iter008", "bottleneck": "latency_bound", "idea": "Prior session .cu - equivalent to iter001, no improvement", "category": "misc", "expected_gain": "+5 TFLOPS", "decision": "DISCARD", "tflops": 355.695, "timestamp": "2026-04-17T18:10:06Z"}
{"round": 9, "iter": "iter009", "bottleneck": "latency_bound", "idea": "TM256 WN216 - verification failed, N not cleanly divisible", "category": "tiling", "expected_gain": "+3-8 TFLOPS", "decision": "SEGFAULT", "tflops": 0.0, "timestamp": "2026-04-17T18:11:56Z"}
{"round": 10, "iter": "iter010", "bottleneck": "latency_bound", "idea": "TM256 WN192 - narrower N-tile reduces compute density vs WN200", "category": "tiling", "expected_gain": "+3-10 TFLOPS", "decision": "DISCARD", "tflops": 328.816, "timestamp": "2026-04-17T18:13:25Z"}
{"round": 11, "iter": "iter011", "bottleneck": "latency_bound", "idea": "Phase 2: pragma unroll on warp-loop in consumer path", "category": "phase2_cu_unroll", "expected_gain": "unknown", "decision": "KEEP", "tflops": 360.12, "timestamp": "2026-04-17T18:16:09Z"}
{"round": 12, "iter": "iter012", "bottleneck": "latency_bound", "idea": "Phase 2: use_fast_math on unrolled kernel", "category": "phase2_cu_fastmath", "expected_gain": "unknown", "decision": "DISCARD", "tflops": 360.2, "timestamp": "2026-04-17T18:19:07Z"}
{"round": 14, "iter": "iter014", "bottleneck": "latency_bound", "idea": "Phase 1: WARP_N=256 for perfect power-of-2 tiling - SMEM overflow 262KB > 233KB", "category": "phase1_wn256", "expected_gain": "unknown", "decision": "COMPILE_FAIL", "tflops": 0.0, "timestamp": "2026-04-17T18:21:53Z"}
{"round": 15, "iter": "iter015", "bottleneck": "latency_bound", "idea": "Phase 1: TM=128 WN=200 for lower SMEM - too many tiles, poor persistent efficiency", "category": "phase1_tm128", "expected_gain": "unknown", "decision": "DISCARD", "tflops": 65.54, "timestamp": "2026-04-17T18:23:20Z"}
{"round": 16, "iter": "iter016", "bottleneck": "latency_bound", "idea": "Phase 2: Row-major tile ordering - terrible L2 locality for A matrix", "category": "phase2_tile_order", "expected_gain": "unknown", "decision": "DISCARD", "tflops": 37.45, "timestamp": "2026-04-17T18:25:56Z"}
{"round": 17, "iter": "iter017", "bottleneck": "latency_bound", "idea": "Phase 2: launch_bounds(384,1) - caused heavy register spilling", "category": "phase2_launch_bounds", "expected_gain": "unknown", "decision": "DISCARD", "tflops": 37.45, "timestamp": "2026-04-17T18:27:29Z"}
{"round": 18, "iter": "iter018", "bottleneck": "latency_bound", "idea": "Phase 2: maxrregcount=160 + unroll - massive spilling from unrolled loop", "category": "phase2_reg160", "expected_gain": "unknown", "decision": "DISCARD", "tflops": 29.13, "timestamp": "2026-04-17T18:29:19Z"}
{"round": 19, "iter": "iter019", "bottleneck": "latency_bound", "idea": "Phase 1: NUM_SMS=132 - worse tile distribution and tail waste", "category": "phase1_132sms", "expected_gain": "unknown", "decision": "DISCARD", "tflops": 230.06, "timestamp": "2026-04-17T18:31:42Z"}
{"round": 20, "iter": "iter020", "bottleneck": "latency_bound", "idea": "Phase 1: NUM_SMS=128 - unstable perf, no improvement over 114", "category": "phase1_128sms", "expected_gain": "unknown", "decision": "DISCARD", "tflops": 217.81, "timestamp": "2026-04-17T18:33:24Z"}
{"round": 21, "iter": "iter021", "bottleneck": "latency_bound", "idea": "Phase 1+2: TILE_M=128 (correct coverage) + pragma unroll - first correct kernel", "category": "phase1_correct_tm128", "expected_gain": "unknown", "decision": "KEEP", "tflops": 192.0, "timestamp": "2026-04-17T18:38:42Z"}
{"round": 22, "iter": "iter022", "bottleneck": "latency_bound", "idea": "Phase 1: TM=256 WN=128 1P4C - verification failed, wrong output", "category": "phase1_1p4c", "expected_gain": "unknown", "decision": "SEGFAULT", "tflops": 0.0, "timestamp": "2026-04-17T18:41:08Z"}
{"round": 23, "iter": "iter023", "bottleneck": "latency_bound", "idea": "Phase 1: TM=128 WN=248 correct kernel with larger WGMMA output", "category": "phase1_correct_tm128_wn248", "expected_gain": "unknown", "decision": "KEEP", "tflops": 199.0, "timestamp": "2026-04-17T18:44:23Z"}
{"round": 24, "iter": "iter024", "bottleneck": "latency_bound", "idea": "Phase 1: TM=128 WN=200 S3 correct kernel - 3 stages better pipeline overlap", "category": "phase1_correct_3stages", "expected_gain": "unknown", "decision": "KEEP", "tflops": 201.5, "timestamp": "2026-04-17T18:47:13Z"}
{"round": 25, "iter": "iter025", "bottleneck": "latency_bound", "idea": "Phase 1: TM=128 WN=160 S4 - verification failed, likely N boundary issue", "category": "phase1_wn160_s4", "expected_gain": "unknown", "decision": "SEGFAULT", "tflops": 0.0, "timestamp": "2026-04-17T18:49:43Z"}
