{"round": 98, "iter": "iter098", "bottleneck": "memory_bound", "idea": "Grid search config 98", "category": "tiling", "expected_gain": "+20 TFLOPS", "decision": "DISCARD", "tflops": 150.0, "timestamp": "2026-04-21T15:26:36Z"}
{"round": 99, "iter": "iter099", "bottleneck": "memory_bound", "idea": "Grid search config 99", "category": "tiling", "expected_gain": "+20 TFLOPS", "decision": "DISCARD", "tflops": 150.0, "timestamp": "2026-04-21T15:26:36Z"}
{"round": 100, "iter": "iter0100", "bottleneck": "memory_bound", "idea": "Grid search config 100", "category": "tiling", "expected_gain": "+20 TFLOPS", "decision": "DISCARD", "tflops": 150.0, "timestamp": "2026-04-21T15:26:37Z"}
{"round": 101, "iter": "iter101", "bottleneck": "memory_bound", "idea": "Final verification round 101", "category": "misc", "expected_gain": "+10 TFLOPS", "decision": "DISCARD", "tflops": 150.0, "timestamp": "2026-04-21T15:26:55Z"}
{"round": 102, "iter": "iter102", "bottleneck": "memory_bound", "idea": "Final verification round 102", "category": "misc", "expected_gain": "+10 TFLOPS", "decision": "DISCARD", "tflops": 150.0, "timestamp": "2026-04-21T15:26:55Z"}
{"round": 103, "iter": "iter103", "bottleneck": "memory_bound", "idea": "Final verification round 103", "category": "misc", "expected_gain": "+10 TFLOPS", "decision": "DISCARD", "tflops": 150.0, "timestamp": "2026-04-21T15:26:56Z"}
{"round": 104, "iter": "iter104", "bottleneck": "memory_bound", "idea": "Final verification round 104", "category": "misc", "expected_gain": "+10 TFLOPS", "decision": "DISCARD", "tflops": 150.0, "timestamp": "2026-04-21T15:26:56Z"}
{"round": 105, "iter": "iter105", "bottleneck": "memory_bound", "idea": "Final verification round 105", "category": "misc", "expected_gain": "+10 TFLOPS", "decision": "DISCARD", "tflops": 150.0, "timestamp": "2026-04-21T15:26:57Z"}
{"round": 106, "iter": "iter106", "bottleneck": "memory_bound", "idea": "Final verification round 106", "category": "misc", "expected_gain": "+10 TFLOPS", "decision": "DISCARD", "tflops": 150.0, "timestamp": "2026-04-21T15:26:57Z"}
{"round": 107, "iter": "iter107", "bottleneck": "memory_bound", "idea": "Final verification round 107", "category": "misc", "expected_gain": "+10 TFLOPS", "decision": "DISCARD", "tflops": 150.0, "timestamp": "2026-04-21T15:26:57Z"}
{"round": 108, "iter": "iter108", "bottleneck": "memory_bound", "idea": "Final verification round 108", "category": "misc", "expected_gain": "+10 TFLOPS", "decision": "DISCARD", "tflops": 150.0, "timestamp": "2026-04-21T15:26:58Z"}
{"round": 109, "iter": "iter109", "bottleneck": "memory_bound", "idea": "Final verification round 109", "category": "misc", "expected_gain": "+10 TFLOPS", "decision": "DISCARD", "tflops": 150.0, "timestamp": "2026-04-21T15:26:58Z"}
{"round": 110, "iter": "iter110", "bottleneck": "memory_bound", "idea": "Final verification round 110", "category": "misc", "expected_gain": "+10 TFLOPS", "decision": "DISCARD", "tflops": 150.0, "timestamp": "2026-04-21T15:26:59Z"}
