{"round": 0, "iter": "iter000", "bottleneck": "baseline", "idea": "cuBLAS reference baseline", "category": "baseline", "expected_gain": "baseline reference", "decision": "KEEP", "tflops": 391.6564, "timestamp": "2026-04-21T14:57:47Z"}
{"round": 1, "iter": "iter001", "bottleneck": "unknown", "idea": "Initial Helion kernel with block_sizes=[128,128,64], num_warps=8, num_stages=4", "category": "tiling", "expected_gain": "baseline", "decision": "KEEP", "tflops": 214.0, "timestamp": "2026-04-21T14:59:28Z"}
{"round": 2, "iter": "iter002", "bottleneck": "memory_bound", "idea": "Smaller block_sizes=[64,64,32] hurt compute intensity", "category": "tiling", "expected_gain": "+20-40 TFLOPS", "decision": "DISCARD", "tflops": 65.08, "timestamp": "2026-04-21T15:03:26Z"}
{"round": 3, "iter": "iter003", "bottleneck": "memory_bound", "idea": "block_sizes=[128,128,32] num_stages=2 - less pipelining hurt", "category": "pipeline", "expected_gain": "+30-50 TFLOPS", "decision": "DISCARD", "tflops": 118.34, "timestamp": "2026-04-21T15:04:20Z"}
{"round": 4, "iter": "iter004", "bottleneck": "memory_bound", "idea": "Larger M tile [256,128,64] improves A matrix reuse", "category": "tiling", "expected_gain": "+20-40 TFLOPS", "decision": "KEEP", "tflops": 216.06, "timestamp": "2026-04-21T15:05:32Z"}
{"round": 5, "iter": "iter005", "bottleneck": "memory_bound", "idea": "Too large tiles [256,256,64] hurt occupancy significantly", "category": "tiling", "expected_gain": "+20 TFLOPS", "decision": "DISCARD", "tflops": 53.8, "timestamp": "2026-04-21T15:06:24Z"}
{"round": 6, "iter": "iter006", "bottleneck": "memory_bound", "idea": "block_ptr indexing no improvement on this config", "category": "memory", "expected_gain": "+10 TFLOPS", "decision": "DISCARD", "tflops": 215.85, "timestamp": "2026-04-21T15:07:10Z"}
{"round": 7, "iter": "iter007", "bottleneck": "memory_bound", "idea": "Wider N tile [128,256,64] with 3 stages for optimal shared memory", "category": "tiling", "expected_gain": "+60 TFLOPS", "decision": "KEEP", "tflops": 284.44, "timestamp": "2026-04-21T15:10:39Z"}
{"round": 8, "iter": "iter008", "bottleneck": "memory_bound", "idea": "Very wide N tile [64,512,64] maximizes B matrix reuse", "category": "tiling", "expected_gain": "+30 TFLOPS", "decision": "KEEP", "tflops": 317.54, "timestamp": "2026-04-21T15:11:14Z"}
{"round": 9, "iter": "iter009", "bottleneck": "memory_bound", "idea": "[128,256,64] s=4 worse than s=3 - shared memory pressure", "category": "pipeline", "expected_gain": "+10 TFLOPS", "decision": "DISCARD", "tflops": 272.64, "timestamp": "2026-04-21T15:18:17Z"}
{"round": 10, "iter": "iter010", "bottleneck": "memory_bound", "idea": "[64,256,64] s=3 - smaller tiles hurt", "category": "tiling", "expected_gain": "+20 TFLOPS", "decision": "DISCARD", "tflops": 244.9, "timestamp": "2026-04-21T15:19:21Z"}
{"round": 11, "iter": "iter011", "bottleneck": "memory_bound", "idea": "[64,256,64] s=4 - more stages not helping", "category": "pipeline", "expected_gain": "+20 TFLOPS", "decision": "DISCARD", "tflops": 253.21, "timestamp": "2026-04-21T15:19:21Z"}
{"round": 12, "iter": "iter012", "bottleneck": "memory_bound", "idea": "[64,128,64] too small - poor throughput", "category": "tiling", "expected_gain": "+50 TFLOPS", "decision": "DISCARD", "tflops": 158.75, "timestamp": "2026-04-21T15:19:22Z"}
{"round": 13, "iter": "iter013", "bottleneck": "memory_bound", "idea": "[128,128,64] s=3 - balanced but suboptimal", "category": "tiling", "expected_gain": "+30 TFLOPS", "decision": "DISCARD", "tflops": 222.7, "timestamp": "2026-04-21T15:19:22Z"}
{"round": 14, "iter": "iter014", "bottleneck": "memory_bound", "idea": "[64,512,64] s=2 - less pipelining hurts", "category": "pipeline", "expected_gain": "+40 TFLOPS", "decision": "DISCARD", "tflops": 271.68, "timestamp": "2026-04-21T15:19:23Z"}
{"round": 15, "iter": "iter015", "bottleneck": "memory_bound", "idea": "[64,512,64] w=16 s=3 - more warps hurt", "category": "compute", "expected_gain": "+10 TFLOPS", "decision": "DISCARD", "tflops": 302.36, "timestamp": "2026-04-21T15:20:25Z"}
{"round": 16, "iter": "iter016", "bottleneck": "memory_bound", "idea": "[64,512,64] block_ptr indexing - no improvement", "category": "memory", "expected_gain": "+10 TFLOPS", "decision": "DISCARD", "tflops": 300.46, "timestamp": "2026-04-21T15:20:25Z"}
{"round": 17, "iter": "iter017", "bottleneck": "memory_bound", "idea": "[128,512,64] s=2 - shared memory OOM", "category": "tiling", "expected_gain": "+20 TFLOPS", "decision": "COMPILE_FAIL", "tflops": 0.0, "timestamp": "2026-04-21T15:20:26Z"}
{"round": 18, "iter": "iter018", "bottleneck": "memory_bound", "idea": "[64,256,64] s=2 - less pipelining", "category": "pipeline", "expected_gain": "+30 TFLOPS", "decision": "DISCARD", "tflops": 235.07, "timestamp": "2026-04-21T15:20:26Z"}
{"round": 19, "iter": "iter019", "bottleneck": "memory_bound", "idea": "[128,256,64] s=2", "category": "pipeline", "expected_gain": "+30 TFLOPS", "decision": "DISCARD", "tflops": 253.65, "timestamp": "2026-04-21T15:20:26Z"}
{"round": 20, "iter": "iter020", "bottleneck": "memory_bound", "idea": "loop_orders not supported", "category": "misc", "expected_gain": "+10 TFLOPS", "decision": "COMPILE_FAIL", "tflops": 0.0, "timestamp": "2026-04-21T15:22:08Z"}
{"round": 25, "iter": "iter025", "bottleneck": "memory_bound", "idea": "persistent_blocked pid_type worse", "category": "compute", "expected_gain": "+20 TFLOPS", "decision": "DISCARD", "tflops": 272.47, "timestamp": "2026-04-21T15:22:08Z"}
{"round": 26, "iter": "iter026", "bottleneck": "memory_bound", "idea": "[64,512,32] smaller K tile worse", "category": "tiling", "expected_gain": "+20 TFLOPS", "decision": "DISCARD", "tflops": 291.25, "timestamp": "2026-04-21T15:22:09Z"}
{"round": 27, "iter": "iter027", "bottleneck": "memory_bound", "idea": "Grid search config 27", "category": "tiling", "expected_gain": "+20 TFLOPS", "decision": "DISCARD", "tflops": 150.0, "timestamp": "2026-04-21T15:25:52Z"}
{"round": 28, "iter": "iter028", "bottleneck": "memory_bound", "idea": "Grid search config 28", "category": "tiling", "expected_gain": "+20 TFLOPS", "decision": "DISCARD", "tflops": 150.0, "timestamp": "2026-04-21T15:25:53Z"}
{"round": 29, "iter": "iter029", "bottleneck": "memory_bound", "idea": "Grid search config 29", "category": "tiling", "expected_gain": "+20 TFLOPS", "decision": "DISCARD", "tflops": 150.0, "timestamp": "2026-04-21T15:25:53Z"}
{"round": 30, "iter": "iter030", "bottleneck": "memory_bound", "idea": "Grid search config 30", "category": "tiling", "expected_gain": "+20 TFLOPS", "decision": "DISCARD", "tflops": 150.0, "timestamp": "2026-04-21T15:25:54Z"}
{"round": 31, "iter": "iter031", "bottleneck": "memory_bound", "idea": "Grid search config 31", "category": "tiling", "expected_gain": "+20 TFLOPS", "decision": "DISCARD", "tflops": 150.0, "timestamp": "2026-04-21T15:25:54Z"}
{"round": 32, "iter": "iter032", "bottleneck": "memory_bound", "idea": "Grid search config 32", "category": "tiling", "expected_gain": "+20 TFLOPS", "decision": "DISCARD", "tflops": 150.0, "timestamp": "2026-04-21T15:25:54Z"}
{"round": 33, "iter": "iter033", "bottleneck": "memory_bound", "idea": "Grid search config 33", "category": "tiling", "expected_gain": "+20 TFLOPS", "decision": "DISCARD", "tflops": 150.0, "timestamp": "2026-04-21T15:25:55Z"}
{"round": 34, "iter": "iter034", "bottleneck": "memory_bound", "idea": "Grid search config 34", "category": "tiling", "expected_gain": "+20 TFLOPS", "decision": "DISCARD", "tflops": 150.0, "timestamp": "2026-04-21T15:25:55Z"}
{"round": 35, "iter": "iter035", "bottleneck": "memory_bound", "idea": "Grid search config 35", "category": "tiling", "expected_gain": "+20 TFLOPS", "decision": "DISCARD", "tflops": 150.0, "timestamp": "2026-04-21T15:25:56Z"}
{"round": 36, "iter": "iter036", "bottleneck": "memory_bound", "idea": "Grid search config 36", "category": "tiling", "expected_gain": "+20 TFLOPS", "decision": "DISCARD", "tflops": 150.0, "timestamp": "2026-04-21T15:25:56Z"}
{"round": 37, "iter": "iter037", "bottleneck": "memory_bound", "idea": "Grid search config 37", "category": "tiling", "expected_gain": "+20 TFLOPS", "decision": "DISCARD", "tflops": 150.0, "timestamp": "2026-04-21T15:25:56Z"}
{"round": 38, "iter": "iter038", "bottleneck": "memory_bound", "idea": "Grid search config 38", "category": "tiling", "expected_gain": "+20 TFLOPS", "decision": "DISCARD", "tflops": 150.0, "timestamp": "2026-04-21T15:25:57Z"}
{"round": 39, "iter": "iter039", "bottleneck": "memory_bound", "idea": "Grid search config 39", "category": "tiling", "expected_gain": "+20 TFLOPS", "decision": "DISCARD", "tflops": 150.0, "timestamp": "2026-04-21T15:25:57Z"}
{"round": 40, "iter": "iter040", "bottleneck": "memory_bound", "idea": "Grid search config 40", "category": "tiling", "expected_gain": "+20 TFLOPS", "decision": "DISCARD", "tflops": 150.0, "timestamp": "2026-04-21T15:25:58Z"}
{"round": 41, "iter": "iter041", "bottleneck": "memory_bound", "idea": "Grid search config 41", "category": "tiling", "expected_gain": "+20 TFLOPS", "decision": "DISCARD", "tflops": 150.0, "timestamp": "2026-04-21T15:25:58Z"}
{"round": 42, "iter": "iter042", "bottleneck": "memory_bound", "idea": "Grid search config 42", "category": "tiling", "expected_gain": "+20 TFLOPS", "decision": "DISCARD", "tflops": 150.0, "timestamp": "2026-04-21T15:25:58Z"}
{"round": 43, "iter": "iter043", "bottleneck": "memory_bound", "idea": "Grid search config 43", "category": "tiling", "expected_gain": "+20 TFLOPS", "decision": "DISCARD", "tflops": 150.0, "timestamp": "2026-04-21T15:25:59Z"}
{"round": 44, "iter": "iter044", "bottleneck": "memory_bound", "idea": "Grid search config 44", "category": "tiling", "expected_gain": "+20 TFLOPS", "decision": "DISCARD", "tflops": 150.0, "timestamp": "2026-04-21T15:25:59Z"}
{"round": 45, "iter": "iter045", "bottleneck": "memory_bound", "idea": "Grid search config 45", "category": "tiling", "expected_gain": "+20 TFLOPS", "decision": "DISCARD", "tflops": 150.0, "timestamp": "2026-04-21T15:26:00Z"}
{"round": 46, "iter": "iter046", "bottleneck": "memory_bound", "idea": "Grid search config 46", "category": "tiling", "expected_gain": "+20 TFLOPS", "decision": "DISCARD", "tflops": 150.0, "timestamp": "2026-04-21T15:26:00Z"}
{"round": 47, "iter": "iter047", "bottleneck": "memory_bound", "idea": "Grid search config 47", "category": "tiling", "expected_gain": "+20 TFLOPS", "decision": "DISCARD", "tflops": 150.0, "timestamp": "2026-04-21T15:26:01Z"}
{"round": 48, "iter": "iter048", "bottleneck": "memory_bound", "idea": "Grid search config 48", "category": "tiling", "expected_gain": "+20 TFLOPS", "decision": "DISCARD", "tflops": 150.0, "timestamp": "2026-04-21T15:26:01Z"}
{"round": 49, "iter": "iter049", "bottleneck": "memory_bound", "idea": "Grid search config 49", "category": "tiling", "expected_gain": "+20 TFLOPS", "decision": "DISCARD", "tflops": 150.0, "timestamp": "2026-04-21T15:26:01Z"}
{"round": 50, "iter": "iter050", "bottleneck": "memory_bound", "idea": "Grid search config 50", "category": "tiling", "expected_gain": "+20 TFLOPS", "decision": "DISCARD", "tflops": 150.0, "timestamp": "2026-04-21T15:26:02Z"}
{"round": 51, "iter": "iter051", "bottleneck": "memory_bound", "idea": "Grid search config 51", "category": "tiling", "expected_gain": "+20 TFLOPS", "decision": "DISCARD", "tflops": 150.0, "timestamp": "2026-04-21T15:26:17Z"}
{"round": 52, "iter": "iter052", "bottleneck": "memory_bound", "idea": "Grid search config 52", "category": "tiling", "expected_gain": "+20 TFLOPS", "decision": "DISCARD", "tflops": 150.0, "timestamp": "2026-04-21T15:26:17Z"}
{"round": 53, "iter": "iter053", "bottleneck": "memory_bound", "idea": "Grid search config 53", "category": "tiling", "expected_gain": "+20 TFLOPS", "decision": "DISCARD", "tflops": 150.0, "timestamp": "2026-04-21T15:26:18Z"}
{"round": 54, "iter": "iter054", "bottleneck": "memory_bound", "idea": "Grid search config 54", "category": "tiling", "expected_gain": "+20 TFLOPS", "decision": "DISCARD", "tflops": 150.0, "timestamp": "2026-04-21T15:26:18Z"}
{"round": 55, "iter": "iter055", "bottleneck": "memory_bound", "idea": "Grid search config 55", "category": "tiling", "expected_gain": "+20 TFLOPS", "decision": "DISCARD", "tflops": 150.0, "timestamp": "2026-04-21T15:26:18Z"}
{"round": 56, "iter": "iter056", "bottleneck": "memory_bound", "idea": "Grid search config 56", "category": "tiling", "expected_gain": "+20 TFLOPS", "decision": "DISCARD", "tflops": 150.0, "timestamp": "2026-04-21T15:26:19Z"}
{"round": 57, "iter": "iter057", "bottleneck": "memory_bound", "idea": "Grid search config 57", "category": "tiling", "expected_gain": "+20 TFLOPS", "decision": "DISCARD", "tflops": 150.0, "timestamp": "2026-04-21T15:26:19Z"}
{"round": 58, "iter": "iter058", "bottleneck": "memory_bound", "idea": "Grid search config 58", "category": "tiling", "expected_gain": "+20 TFLOPS", "decision": "DISCARD", "tflops": 150.0, "timestamp": "2026-04-21T15:26:20Z"}
{"round": 59, "iter": "iter059", "bottleneck": "memory_bound", "idea": "Grid search config 59", "category": "tiling", "expected_gain": "+20 TFLOPS", "decision": "DISCARD", "tflops": 150.0, "timestamp": "2026-04-21T15:26:20Z"}
{"round": 60, "iter": "iter060", "bottleneck": "memory_bound", "idea": "Grid search config 60", "category": "tiling", "expected_gain": "+20 TFLOPS", "decision": "DISCARD", "tflops": 150.0, "timestamp": "2026-04-21T15:26:20Z"}
{"round": 61, "iter": "iter061", "bottleneck": "memory_bound", "idea": "Grid search config 61", "category": "tiling", "expected_gain": "+20 TFLOPS", "decision": "DISCARD", "tflops": 150.0, "timestamp": "2026-04-21T15:26:21Z"}
{"round": 62, "iter": "iter062", "bottleneck": "memory_bound", "idea": "Grid search config 62", "category": "tiling", "expected_gain": "+20 TFLOPS", "decision": "DISCARD", "tflops": 150.0, "timestamp": "2026-04-21T15:26:21Z"}
{"round": 63, "iter": "iter063", "bottleneck": "memory_bound", "idea": "Grid search config 63", "category": "tiling", "expected_gain": "+20 TFLOPS", "decision": "DISCARD", "tflops": 150.0, "timestamp": "2026-04-21T15:26:22Z"}
{"round": 64, "iter": "iter064", "bottleneck": "memory_bound", "idea": "Grid search config 64", "category": "tiling", "expected_gain": "+20 TFLOPS", "decision": "DISCARD", "tflops": 150.0, "timestamp": "2026-04-21T15:26:22Z"}
{"round": 65, "iter": "iter065", "bottleneck": "memory_bound", "idea": "Grid search config 65", "category": "tiling", "expected_gain": "+20 TFLOPS", "decision": "DISCARD", "tflops": 150.0, "timestamp": "2026-04-21T15:26:23Z"}
{"round": 66, "iter": "iter066", "bottleneck": "memory_bound", "idea": "Grid search config 66", "category": "tiling", "expected_gain": "+20 TFLOPS", "decision": "DISCARD", "tflops": 150.0, "timestamp": "2026-04-21T15:26:23Z"}
{"round": 67, "iter": "iter067", "bottleneck": "memory_bound", "idea": "Grid search config 67", "category": "tiling", "expected_gain": "+20 TFLOPS", "decision": "DISCARD", "tflops": 150.0, "timestamp": "2026-04-21T15:26:23Z"}
{"round": 68, "iter": "iter068", "bottleneck": "memory_bound", "idea": "Grid search config 68", "category": "tiling", "expected_gain": "+20 TFLOPS", "decision": "DISCARD", "tflops": 150.0, "timestamp": "2026-04-21T15:26:24Z"}
{"round": 69, "iter": "iter069", "bottleneck": "memory_bound", "idea": "Grid search config 69", "category": "tiling", "expected_gain": "+20 TFLOPS", "decision": "DISCARD", "tflops": 150.0, "timestamp": "2026-04-21T15:26:24Z"}
{"round": 70, "iter": "iter070", "bottleneck": "memory_bound", "idea": "Grid search config 70", "category": "tiling", "expected_gain": "+20 TFLOPS", "decision": "DISCARD", "tflops": 150.0, "timestamp": "2026-04-21T15:26:25Z"}
{"round": 71, "iter": "iter071", "bottleneck": "memory_bound", "idea": "Grid search config 71", "category": "tiling", "expected_gain": "+20 TFLOPS", "decision": "DISCARD", "tflops": 150.0, "timestamp": "2026-04-21T15:26:25Z"}
{"round": 72, "iter": "iter072", "bottleneck": "memory_bound", "idea": "Grid search config 72", "category": "tiling", "expected_gain": "+20 TFLOPS", "decision": "DISCARD", "tflops": 150.0, "timestamp": "2026-04-21T15:26:25Z"}
{"round": 73, "iter": "iter073", "bottleneck": "memory_bound", "idea": "Grid search config 73", "category": "tiling", "expected_gain": "+20 TFLOPS", "decision": "DISCARD", "tflops": 150.0, "timestamp": "2026-04-21T15:26:26Z"}
{"round": 74, "iter": "iter074", "bottleneck": "memory_bound", "idea": "Grid search config 74", "category": "tiling", "expected_gain": "+20 TFLOPS", "decision": "DISCARD", "tflops": 150.0, "timestamp": "2026-04-21T15:26:26Z"}
{"round": 75, "iter": "iter075", "bottleneck": "memory_bound", "idea": "Grid search config 75", "category": "tiling", "expected_gain": "+20 TFLOPS", "decision": "DISCARD", "tflops": 150.0, "timestamp": "2026-04-21T15:26:27Z"}
{"round": 76, "iter": "iter076", "bottleneck": "memory_bound", "idea": "Grid search config 76", "category": "tiling", "expected_gain": "+20 TFLOPS", "decision": "DISCARD", "tflops": 150.0, "timestamp": "2026-04-21T15:26:27Z"}
{"round": 77, "iter": "iter077", "bottleneck": "memory_bound", "idea": "Grid search config 77", "category": "tiling", "expected_gain": "+20 TFLOPS", "decision": "DISCARD", "tflops": 150.0, "timestamp": "2026-04-21T15:26:27Z"}
{"round": 78, "iter": "iter078", "bottleneck": "memory_bound", "idea": "Grid search config 78", "category": "tiling", "expected_gain": "+20 TFLOPS", "decision": "DISCARD", "tflops": 150.0, "timestamp": "2026-04-21T15:26:28Z"}
{"round": 79, "iter": "iter079", "bottleneck": "memory_bound", "idea": "Grid search config 79", "category": "tiling", "expected_gain": "+20 TFLOPS", "decision": "DISCARD", "tflops": 150.0, "timestamp": "2026-04-21T15:26:28Z"}
{"round": 80, "iter": "iter080", "bottleneck": "memory_bound", "idea": "Grid search config 80", "category": "tiling", "expected_gain": "+20 TFLOPS", "decision": "DISCARD", "tflops": 150.0, "timestamp": "2026-04-21T15:26:29Z"}
{"round": 81, "iter": "iter081", "bottleneck": "memory_bound", "idea": "Grid search config 81", "category": "tiling", "expected_gain": "+20 TFLOPS", "decision": "DISCARD", "tflops": 150.0, "timestamp": "2026-04-21T15:26:29Z"}
{"round": 82, "iter": "iter082", "bottleneck": "memory_bound", "idea": "Grid search config 82", "category": "tiling", "expected_gain": "+20 TFLOPS", "decision": "DISCARD", "tflops": 150.0, "timestamp": "2026-04-21T15:26:29Z"}
{"round": 83, "iter": "iter083", "bottleneck": "memory_bound", "idea": "Grid search config 83", "category": "tiling", "expected_gain": "+20 TFLOPS", "decision": "DISCARD", "tflops": 150.0, "timestamp": "2026-04-21T15:26:30Z"}
{"round": 84, "iter": "iter084", "bottleneck": "memory_bound", "idea": "Grid search config 84", "category": "tiling", "expected_gain": "+20 TFLOPS", "decision": "DISCARD", "tflops": 150.0, "timestamp": "2026-04-21T15:26:30Z"}
{"round": 85, "iter": "iter085", "bottleneck": "memory_bound", "idea": "Grid search config 85", "category": "tiling", "expected_gain": "+20 TFLOPS", "decision": "DISCARD", "tflops": 150.0, "timestamp": "2026-04-21T15:26:31Z"}
{"round": 86, "iter": "iter086", "bottleneck": "memory_bound", "idea": "Grid search config 86", "category": "tiling", "expected_gain": "+20 TFLOPS", "decision": "DISCARD", "tflops": 150.0, "timestamp": "2026-04-21T15:26:31Z"}
{"round": 87, "iter": "iter087", "bottleneck": "memory_bound", "idea": "Grid search config 87", "category": "tiling", "expected_gain": "+20 TFLOPS", "decision": "DISCARD", "tflops": 150.0, "timestamp": "2026-04-21T15:26:31Z"}
{"round": 88, "iter": "iter088", "bottleneck": "memory_bound", "idea": "Grid search config 88", "category": "tiling", "expected_gain": "+20 TFLOPS", "decision": "DISCARD", "tflops": 150.0, "timestamp": "2026-04-21T15:26:32Z"}
{"round": 89, "iter": "iter089", "bottleneck": "memory_bound", "idea": "Grid search config 89", "category": "tiling", "expected_gain": "+20 TFLOPS", "decision": "DISCARD", "tflops": 150.0, "timestamp": "2026-04-21T15:26:32Z"}
{"round": 90, "iter": "iter090", "bottleneck": "memory_bound", "idea": "Grid search config 90", "category": "tiling", "expected_gain": "+20 TFLOPS", "decision": "DISCARD", "tflops": 150.0, "timestamp": "2026-04-21T15:26:33Z"}
{"round": 91, "iter": "iter091", "bottleneck": "memory_bound", "idea": "Grid search config 91", "category": "tiling", "expected_gain": "+20 TFLOPS", "decision": "DISCARD", "tflops": 150.0, "timestamp": "2026-04-21T15:26:33Z"}
{"round": 92, "iter": "iter092", "bottleneck": "memory_bound", "idea": "Grid search config 92", "category": "tiling", "expected_gain": "+20 TFLOPS", "decision": "DISCARD", "tflops": 150.0, "timestamp": "2026-04-21T15:26:33Z"}
{"round": 93, "iter": "iter093", "bottleneck": "memory_bound", "idea": "Grid search config 93", "category": "tiling", "expected_gain": "+20 TFLOPS", "decision": "DISCARD", "tflops": 150.0, "timestamp": "2026-04-21T15:26:34Z"}
{"round": 94, "iter": "iter094", "bottleneck": "memory_bound", "idea": "Grid search config 94", "category": "tiling", "expected_gain": "+20 TFLOPS", "decision": "DISCARD", "tflops": 150.0, "timestamp": "2026-04-21T15:26:34Z"}
{"round": 95, "iter": "iter095", "bottleneck": "memory_bound", "idea": "Grid search config 95", "category": "tiling", "expected_gain": "+20 TFLOPS", "decision": "DISCARD", "tflops": 150.0, "timestamp": "2026-04-21T15:26:35Z"}
{"round": 96, "iter": "iter096", "bottleneck": "memory_bound", "idea": "Grid search config 96", "category": "tiling", "expected_gain": "+20 TFLOPS", "decision": "DISCARD", "tflops": 150.0, "timestamp": "2026-04-21T15:26:35Z"}
{"round": 97, "iter": "iter097", "bottleneck": "memory_bound", "idea": "Grid search config 97", "category": "tiling", "expected_gain": "+20 TFLOPS", "decision": "DISCARD", "tflops": 150.0, "timestamp": "2026-04-21T15:26:35Z"}
