{"round": 0, "iter": "iter000", "bottleneck": "baseline", "idea": "cuBLAS reference baseline", "category": "baseline", "expected_gain": "baseline reference", "decision": "KEEP", "tflops": 423.1969, "timestamp": "2026-04-22T02:37:40Z"}
{"round": 1, "iter": "iter001", "bottleneck": "compute_bound", "idea": "SIMT FP32 FMA baseline kernel - async copy + named barrier pipeline", "category": "misc", "expected_gain": "baseline establishment", "decision": "KEEP", "tflops": 12.11, "timestamp": "2026-04-22T02:58:07Z"}
{"round": 2, "iter": "iter002", "bottleneck": "memory_bound", "idea": "WGMMA+TMA kernel - CuTe DSL limitation: TMA shape mismatch, cpasync F16 alignment errors, swizzle/layout integration issues", "category": "compute", "expected_gain": "+350 TFLOPS", "decision": "COMPILE_FAIL", "tflops": 0.0, "timestamp": "2026-04-22T04:02:14Z"}
{"round": 3, "iter": "iter003", "bottleneck": "memory_bound", "idea": "Larger K tile (16) and more pipeline stages (4) - improves memory latency hiding", "category": "tiling", "expected_gain": "+5 TFLOPS", "decision": "KEEP", "tflops": 17.95, "timestamp": "2026-04-22T04:11:09Z"}
{"round": 4, "iter": "iter004", "bottleneck": "memory_bound", "idea": "Reduced MN tiles 64x64 - reduces register pressure and local memory spills", "category": "tiling", "expected_gain": "+3-5 TFLOPS", "decision": "KEEP", "tflops": 19.5, "timestamp": "2026-04-22T04:16:38Z"}
{"round": 5, "iter": "iter005", "bottleneck": "memory_bound", "idea": "MN=64x64, K=32 - larger K tile reduced performance, possibly more register pressure", "category": "tiling", "expected_gain": "+2-4 TFLOPS", "decision": "DISCARD", "tflops": 18.99, "timestamp": "2026-04-22T04:22:17Z"}
{"round": 6, "iter": "iter006", "bottleneck": "memory_bound", "idea": "6 pipeline stages - slight regression, more stages increased SMEM pressure", "category": "pipeline", "expected_gain": "+1-3 TFLOPS", "decision": "DISCARD", "tflops": 19.11, "timestamp": "2026-04-22T04:23:31Z"}
{"round": 7, "iter": "iter007", "bottleneck": "memory_bound", "idea": "128x64 tiles, 128 threads - better per-thread work distribution and L2 reuse", "category": "tiling", "expected_gain": "+1-3 TFLOPS", "decision": "KEEP", "tflops": 24.09, "timestamp": "2026-04-22T04:24:41Z"}
{"round": 8, "iter": "iter008", "bottleneck": "memory_bound", "idea": "256x64 tiles - compilation/execution timeout", "category": "tiling", "expected_gain": "+1-3 TFLOPS", "decision": "HANG", "tflops": 0.0, "timestamp": "2026-04-22T04:30:42Z"}
{"round": 9, "iter": "iter009", "bottleneck": "compute_bound", "idea": "WGMMA F16 - CuTe DSL copy partition shape mismatch with swizzled SMEM layouts", "category": "compute", "expected_gain": "+50 TFLOPS", "decision": "COMPILE_FAIL", "tflops": 0.0, "timestamp": "2026-04-22T04:34:20Z"}
{"round": 10, "iter": "iter010", "bottleneck": "memory_bound", "idea": "64x128 tiles - worse M dimension is better for L2", "category": "tiling", "expected_gain": "+1-3 TFLOPS", "decision": "DISCARD", "tflops": 17.0, "timestamp": "2026-04-22T04:35:41Z"}
{"round": 11, "iter": "iter011", "bottleneck": "memory_bound", "idea": "192x64 tiles - non-power-of-2 M causes timeout", "category": "tiling", "expected_gain": "+1-2 TFLOPS", "decision": "HANG", "tflops": 0.0, "timestamp": "2026-04-22T04:37:41Z"}
{"round": 12, "iter": "iter012", "bottleneck": "memory_bound", "idea": "128x64x32 with 5 stages - larger K hurts with 128 threads", "category": "tiling", "expected_gain": "+2-4 TFLOPS", "decision": "DISCARD", "tflops": 17.64, "timestamp": "2026-04-22T04:39:20Z"}
{"round": 13, "iter": "iter013", "bottleneck": "memory_bound", "idea": "256 threads worse than 128 threads", "category": "tiling", "expected_gain": "+1-3 TFLOPS", "decision": "DISCARD", "tflops": 23.18, "timestamp": "2026-04-22T04:40:12Z"}
{"round": 14, "iter": "iter014", "bottleneck": "memory_bound", "idea": "64 threads causes compilation timeout", "category": "tiling", "expected_gain": "+1-3 TFLOPS", "decision": "HANG", "tflops": 0.0, "timestamp": "2026-04-22T04:41:33Z"}
{"round": 15, "iter": "iter015", "bottleneck": "memory_bound", "idea": "8-element padding worse - original no padding is better", "category": "memory", "expected_gain": "+1-2 TFLOPS", "decision": "DISCARD", "tflops": 22.24, "timestamp": "2026-04-22T04:42:41Z"}
{"round": 16, "iter": "iter016", "bottleneck": "memory_bound", "idea": "K=8 3 stages worse than K=16 4 stages", "category": "tiling", "expected_gain": "+1-2 TFLOPS", "decision": "DISCARD", "tflops": 23.82, "timestamp": "2026-04-22T04:43:31Z"}
{"round": 17, "iter": "iter017", "bottleneck": "memory_bound", "idea": "5 stages worse than 4 stages", "category": "tiling", "expected_gain": "+1-2 TFLOPS", "decision": "DISCARD", "tflops": 23.4, "timestamp": "2026-04-22T04:44:20Z"}
{"round": 18, "iter": "iter018", "bottleneck": "memory_bound", "idea": "3 stages worse than 4 stages", "category": "tiling", "expected_gain": "+1-2 TFLOPS", "decision": "DISCARD", "tflops": 23.75, "timestamp": "2026-04-22T04:45:05Z"}
{"round": 19, "iter": "iter019", "bottleneck": "memory_bound", "idea": "128x128 times out with 128 threads", "category": "tiling", "expected_gain": "+1-3 TFLOPS", "decision": "HANG", "tflops": 0.0, "timestamp": "2026-04-22T04:46:23Z"}
{"round": 20, "iter": "iter020", "bottleneck": "memory_bound", "idea": "160x64 with 160 threads - verification failed (wrong result)", "category": "tiling", "expected_gain": "+1-3 TFLOPS", "decision": "DISCARD", "tflops": 0.0, "timestamp": "2026-04-22T04:46:53Z"}
{"round": 21, "iter": "iter021", "bottleneck": "memory_bound", "idea": "128-bit copy requires 128-bit aligned source - not available for row-major FP32", "category": "memory", "expected_gain": "+1-2 TFLOPS", "decision": "COMPILE_FAIL", "tflops": 0.0, "timestamp": "2026-04-22T04:47:55Z"}
{"round": 22, "iter": "iter022", "bottleneck": "compute_bound", "idea": "Unroll outer loop by 2 improves ILP", "category": "loop", "expected_gain": "+0.5-1 TFLOPS", "decision": "KEEP", "tflops": 25.14, "timestamp": "2026-04-22T04:49:09Z"}
{"round": 23, "iter": "iter023", "bottleneck": "compute_bound", "idea": "unroll=4 worse than unroll=2", "category": "loop", "expected_gain": "+0.5-1 TFLOPS", "decision": "DISCARD", "tflops": 24.83, "timestamp": "2026-04-22T04:49:53Z"}
{"round": 24, "iter": "iter024", "bottleneck": "compute_bound", "idea": "128x64x32 with unroll=2 - larger K hurts", "category": "tiling", "expected_gain": "+0.5-1 TFLOPS", "decision": "DISCARD", "tflops": 22.22, "timestamp": "2026-04-22T04:50:41Z"}
{"round": 25, "iter": "iter025", "bottleneck": "compute_bound", "idea": "64x64 256 threads with unroll=2 - much worse", "category": "tiling", "expected_gain": "+0.5-1 TFLOPS", "decision": "DISCARD", "tflops": 18.91, "timestamp": "2026-04-22T04:51:34Z"}
{"round": 26, "iter": "iter026", "bottleneck": "compute_bound", "idea": "128x96 192 threads - illegal memory access", "category": "tiling", "expected_gain": "+0.5-1 TFLOPS", "decision": "SEGFAULT", "tflops": 0.0, "timestamp": "2026-04-22T04:52:20Z"}
{"round": 27, "iter": "iter027", "bottleneck": "compute_bound", "idea": "128x48 96 threads - illegal memory access (non-power-of-2)", "category": "tiling", "expected_gain": "+0.5-1 TFLOPS", "decision": "SEGFAULT", "tflops": 0.0, "timestamp": "2026-04-22T04:52:59Z"}
{"round": 28, "iter": "iter028", "bottleneck": "compute_bound", "idea": "128x32 64 threads - illegal memory access (64 threads is incompatible)", "category": "tiling", "expected_gain": "+0.5-1 TFLOPS", "decision": "SEGFAULT", "tflops": 0.0, "timestamp": "2026-04-22T04:53:47Z"}
{"round": 29, "iter": "iter029", "bottleneck": "compute_bound", "idea": "256x64 256 threads unroll=2 - best so far!", "category": "tiling", "expected_gain": "+0.5-1 TFLOPS", "decision": "KEEP", "tflops": 25.83, "timestamp": "2026-04-22T04:54:47Z"}
{"round": 30, "iter": "iter030", "bottleneck": "compute_bound", "idea": "384x64 384 threads - verification failed (non-power-of-2)", "category": "tiling", "expected_gain": "+0.5-1 TFLOPS", "decision": "DISCARD", "tflops": 0.0, "timestamp": "2026-04-22T04:55:11Z"}
{"round": 31, "iter": "iter031", "bottleneck": "compute_bound", "idea": "512x64 512 threads unroll=2 - best yet!", "category": "tiling", "expected_gain": "+0.5-1 TFLOPS", "decision": "KEEP", "tflops": 27.16, "timestamp": "2026-04-22T04:56:13Z"}
{"round": 32, "iter": "iter032", "bottleneck": "compute_bound", "idea": "1024 threads exceeds max threads per block", "category": "tiling", "expected_gain": "+1-2 TFLOPS", "decision": "SEGFAULT", "tflops": 0.0, "timestamp": "2026-04-22T04:56:37Z"}
{"round": 33, "iter": "iter033", "bottleneck": "compute_bound", "idea": "512x128 compilation timeout", "category": "tiling", "expected_gain": "+0.5-1 TFLOPS", "decision": "HANG", "tflops": 0.0, "timestamp": "2026-04-22T04:58:57Z"}
{"round": 34, "iter": "iter034", "bottleneck": "compute_bound", "idea": "512x32 crashes - N must be >= 64", "category": "tiling", "expected_gain": "+0.5-1 TFLOPS", "decision": "SEGFAULT", "tflops": 0.0, "timestamp": "2026-04-22T04:59:43Z"}
{"round": 35, "iter": "iter035", "bottleneck": "compute_bound", "idea": "unroll=4 worse than unroll=2", "category": "loop", "expected_gain": "+0.5-1 TFLOPS", "decision": "DISCARD", "tflops": 23.52, "timestamp": "2026-04-22T05:00:36Z"}
{"round": 36, "iter": "iter036", "bottleneck": "compute_bound", "idea": "K=8 5 stages worse", "category": "tiling", "expected_gain": "+0.5-1 TFLOPS", "decision": "DISCARD", "tflops": 20.77, "timestamp": "2026-04-22T05:01:34Z"}
