{"round": 212, "iter": "iter212", "bottleneck": "compute_bound", "idea": "iter212_autogrid: BM=128 BN=128 warps=16 stages=4 indexing=block_ptr Ktile=32 ncol=1", "category": "grid", "expected_gain": "unknown", "decision": "DISCARD", "tflops": 14.8, "timestamp": "2026-04-21T12:52:58Z"}
{"round": 213, "iter": "iter213", "bottleneck": "compute_bound", "idea": "iter213_autogrid: BM=128 BN=128 warps=4 stages=3 indexing=pointer Ktile=64 ncol=2", "category": "grid", "expected_gain": "unknown", "decision": "DISCARD", "tflops": 73.73, "timestamp": "2026-04-21T12:53:04Z"}
{"round": 214, "iter": "iter214", "bottleneck": "compute_bound", "idea": "iter214_autogrid: BM=128 BN=128 warps=4 stages=3 indexing=block_ptr Ktile=64 ncol=2", "category": "grid", "expected_gain": "unknown", "decision": "DISCARD", "tflops": 47.83, "timestamp": "2026-04-21T12:53:10Z"}
{"round": 215, "iter": "iter215", "bottleneck": "compute_bound", "idea": "iter215_autogrid: BM=128 BN=128 warps=8 stages=3 indexing=pointer Ktile=64 ncol=2", "category": "grid", "expected_gain": "unknown", "decision": "DISCARD", "tflops": 58.68, "timestamp": "2026-04-21T12:53:16Z"}
{"round": 216, "iter": "iter216", "bottleneck": "compute_bound", "idea": "iter216_autogrid: BM=128 BN=128 warps=8 stages=3 indexing=block_ptr Ktile=64 ncol=2", "category": "grid", "expected_gain": "unknown", "decision": "DISCARD", "tflops": 24.67, "timestamp": "2026-04-21T12:53:23Z"}
{"round": 217, "iter": "iter217", "bottleneck": "compute_bound", "idea": "iter217_autogrid: BM=128 BN=128 warps=16 stages=3 indexing=pointer Ktile=64 ncol=2", "category": "grid", "expected_gain": "unknown", "decision": "DISCARD", "tflops": 33.62, "timestamp": "2026-04-21T12:53:29Z"}
{"round": 218, "iter": "iter218", "bottleneck": "compute_bound", "idea": "iter218_autogrid: BM=128 BN=128 warps=16 stages=3 indexing=block_ptr Ktile=64 ncol=2", "category": "grid", "expected_gain": "unknown", "decision": "DISCARD", "tflops": 32.84, "timestamp": "2026-04-21T12:53:35Z"}
{"round": 219, "iter": "iter219", "bottleneck": "compute_bound", "idea": "iter219_autogrid: BM=128 BN=128 warps=4 stages=4 indexing=pointer Ktile=64 ncol=2", "category": "grid", "expected_gain": "unknown", "decision": "DISCARD", "tflops": 70.49, "timestamp": "2026-04-21T12:53:41Z"}
{"round": 220, "iter": "iter220", "bottleneck": "compute_bound", "idea": "iter220_autogrid: BM=128 BN=128 warps=4 stages=4 indexing=block_ptr Ktile=64 ncol=2", "category": "grid", "expected_gain": "unknown", "decision": "DISCARD", "tflops": 68.8, "timestamp": "2026-04-21T12:53:47Z"}
{"round": 221, "iter": "iter221", "bottleneck": "compute_bound", "idea": "iter221_autogrid: BM=128 BN=128 warps=8 stages=4 indexing=pointer Ktile=64 ncol=2", "category": "grid", "expected_gain": "unknown", "decision": "DISCARD", "tflops": 47.13, "timestamp": "2026-04-21T12:53:53Z"}
{"round": 222, "iter": "iter222", "bottleneck": "compute_bound", "idea": "iter222_autogrid: BM=128 BN=128 warps=8 stages=4 indexing=block_ptr Ktile=64 ncol=2", "category": "grid", "expected_gain": "unknown", "decision": "DISCARD", "tflops": 46.49, "timestamp": "2026-04-21T12:53:58Z"}
{"round": 223, "iter": "iter223", "bottleneck": "compute_bound", "idea": "iter223_autogrid: BM=128 BN=128 warps=16 stages=4 indexing=pointer Ktile=64 ncol=2", "category": "grid", "expected_gain": "unknown", "decision": "DISCARD", "tflops": 20.1, "timestamp": "2026-04-21T12:54:05Z"}
{"round": 224, "iter": "iter224", "bottleneck": "compute_bound", "idea": "iter224_autogrid: BM=128 BN=128 warps=16 stages=4 indexing=block_ptr Ktile=64 ncol=2", "category": "grid", "expected_gain": "unknown", "decision": "DISCARD", "tflops": 19.64, "timestamp": "2026-04-21T12:54:11Z"}
{"round": 225, "iter": "iter225", "bottleneck": "compute_bound", "idea": "iter225_autogrid: BM=128 BN=128 warps=4 stages=3 indexing=pointer Ktile=128 ncol=4", "category": "grid", "expected_gain": "unknown", "decision": "DISCARD", "tflops": 39.29, "timestamp": "2026-04-21T12:54:19Z"}
{"round": 226, "iter": "iter226", "bottleneck": "compute_bound", "idea": "iter226_autogrid: BM=128 BN=128 warps=4 stages=3 indexing=block_ptr Ktile=128 ncol=4", "category": "grid", "expected_gain": "unknown", "decision": "DISCARD", "tflops": 38.32, "timestamp": "2026-04-21T12:54:26Z"}
{"round": 227, "iter": "iter227", "bottleneck": "compute_bound", "idea": "iter227_autogrid: BM=128 BN=128 warps=8 stages=3 indexing=pointer Ktile=128 ncol=4", "category": "grid", "expected_gain": "unknown", "decision": "DISCARD", "tflops": 58.95, "timestamp": "2026-04-21T12:54:32Z"}
{"round": 228, "iter": "iter228", "bottleneck": "compute_bound", "idea": "iter228_autogrid: BM=128 BN=128 warps=8 stages=3 indexing=block_ptr Ktile=128 ncol=4", "category": "grid", "expected_gain": "unknown", "decision": "DISCARD", "tflops": 57.64, "timestamp": "2026-04-21T12:54:38Z"}
{"round": 229, "iter": "iter229", "bottleneck": "compute_bound", "idea": "iter229_autogrid: BM=128 BN=128 warps=16 stages=3 indexing=pointer Ktile=128 ncol=4", "category": "grid", "expected_gain": "unknown", "decision": "DISCARD", "tflops": 44.42, "timestamp": "2026-04-21T12:54:44Z"}
{"round": 230, "iter": "iter230", "bottleneck": "compute_bound", "idea": "iter230_autogrid: BM=128 BN=128 warps=16 stages=3 indexing=block_ptr Ktile=128 ncol=4", "category": "grid", "expected_gain": "unknown", "decision": "DISCARD", "tflops": 47.17, "timestamp": "2026-04-21T12:54:50Z"}
{"round": 231, "iter": "iter231", "bottleneck": "compute_bound", "idea": "iter231_autogrid: BM=128 BN=128 warps=4 stages=4 indexing=pointer Ktile=128 ncol=4", "category": "grid", "expected_gain": "unknown", "decision": "DISCARD", "tflops": 37.96, "timestamp": "2026-04-21T12:54:57Z"}
{"round": 232, "iter": "iter232", "bottleneck": "compute_bound", "idea": "iter232_autogrid: BM=128 BN=128 warps=4 stages=4 indexing=block_ptr Ktile=128 ncol=4", "category": "grid", "expected_gain": "unknown", "decision": "DISCARD", "tflops": 32.88, "timestamp": "2026-04-21T12:55:05Z"}
{"round": 233, "iter": "iter233", "bottleneck": "compute_bound", "idea": "iter233_autogrid: BM=128 BN=128 warps=8 stages=4 indexing=pointer Ktile=128 ncol=4", "category": "grid", "expected_gain": "unknown", "decision": "DISCARD", "tflops": 58.92, "timestamp": "2026-04-21T12:55:12Z"}
{"round": 234, "iter": "iter234", "bottleneck": "compute_bound", "idea": "iter234_autogrid: BM=128 BN=128 warps=8 stages=4 indexing=block_ptr Ktile=128 ncol=4", "category": "grid", "expected_gain": "unknown", "decision": "DISCARD", "tflops": 37.54, "timestamp": "2026-04-21T12:55:18Z"}
{"round": 235, "iter": "iter235", "bottleneck": "compute_bound", "idea": "iter235_autogrid: BM=128 BN=128 warps=16 stages=4 indexing=pointer Ktile=128 ncol=4", "category": "grid", "expected_gain": "unknown", "decision": "DISCARD", "tflops": 44.39, "timestamp": "2026-04-21T12:55:24Z"}
{"round": 236, "iter": "iter236", "bottleneck": "compute_bound", "idea": "iter236_autogrid: BM=128 BN=128 warps=16 stages=4 indexing=block_ptr Ktile=128 ncol=4", "category": "grid", "expected_gain": "unknown", "decision": "DISCARD", "tflops": 46.56, "timestamp": "2026-04-21T12:55:30Z"}
{"round": 237, "iter": "iter237", "bottleneck": "compute_bound", "idea": "iter237_autogrid: BM=64 BN=256 warps=4 stages=3 indexing=pointer Ktile=64 ncol=2", "category": "grid", "expected_gain": "unknown", "decision": "DISCARD", "tflops": 43.55, "timestamp": "2026-04-21T12:55:36Z"}
{"round": 238, "iter": "iter238", "bottleneck": "compute_bound", "idea": "iter238_autogrid: BM=64 BN=256 warps=4 stages=2 indexing=pointer Ktile=64 ncol=2", "category": "grid", "expected_gain": "unknown", "decision": "DISCARD", "tflops": 62.68, "timestamp": "2026-04-21T12:55:43Z"}
{"round": 239, "iter": "iter239", "bottleneck": "compute_bound", "idea": "iter239_autogrid: BM=64 BN=256 warps=4 stages=3 indexing=block_ptr Ktile=64 ncol=2", "category": "grid", "expected_gain": "unknown", "decision": "DISCARD", "tflops": 66.68, "timestamp": "2026-04-21T12:55:49Z"}
{"round": 240, "iter": "iter240", "bottleneck": "compute_bound", "idea": "iter240_autogrid: BM=64 BN=256 warps=4 stages=2 indexing=block_ptr Ktile=64 ncol=2", "category": "grid", "expected_gain": "unknown", "decision": "DISCARD", "tflops": 39.95, "timestamp": "2026-04-21T12:55:56Z"}
{"round": 241, "iter": "iter241", "bottleneck": "compute_bound", "idea": "iter241_autogrid: BM=64 BN=256 warps=8 stages=3 indexing=pointer Ktile=64 ncol=2", "category": "grid", "expected_gain": "unknown", "decision": "DISCARD", "tflops": 38.41, "timestamp": "2026-04-21T12:56:02Z"}
{"round": 242, "iter": "iter242", "bottleneck": "compute_bound", "idea": "iter242_autogrid: BM=64 BN=256 warps=8 stages=2 indexing=pointer Ktile=64 ncol=2", "category": "grid", "expected_gain": "unknown", "decision": "DISCARD", "tflops": 33.65, "timestamp": "2026-04-21T12:56:09Z"}
{"round": 243, "iter": "iter243", "bottleneck": "compute_bound", "idea": "iter243_autogrid: BM=64 BN=256 warps=8 stages=3 indexing=block_ptr Ktile=64 ncol=2", "category": "grid", "expected_gain": "unknown", "decision": "DISCARD", "tflops": 26.49, "timestamp": "2026-04-21T12:56:16Z"}
{"round": 244, "iter": "iter244", "bottleneck": "compute_bound", "idea": "iter244_autogrid: BM=64 BN=256 warps=8 stages=2 indexing=block_ptr Ktile=64 ncol=2", "category": "grid", "expected_gain": "unknown", "decision": "DISCARD", "tflops": 33.27, "timestamp": "2026-04-21T12:56:22Z"}
{"round": 245, "iter": "iter245", "bottleneck": "compute_bound", "idea": "iter245_autogrid: BM=64 BN=256 warps=16 stages=3 indexing=pointer Ktile=64 ncol=2", "category": "grid", "expected_gain": "unknown", "decision": "DISCARD", "tflops": 33.95, "timestamp": "2026-04-21T12:56:28Z"}
{"round": 246, "iter": "iter246", "bottleneck": "compute_bound", "idea": "iter246_autogrid: BM=64 BN=256 warps=16 stages=2 indexing=pointer Ktile=64 ncol=2", "category": "grid", "expected_gain": "unknown", "decision": "DISCARD", "tflops": 29.4, "timestamp": "2026-04-21T12:56:34Z"}
{"round": 247, "iter": "iter247", "bottleneck": "compute_bound", "idea": "iter247_autogrid: BM=64 BN=256 warps=16 stages=3 indexing=block_ptr Ktile=64 ncol=2", "category": "grid", "expected_gain": "unknown", "decision": "DISCARD", "tflops": 33.2, "timestamp": "2026-04-21T12:56:40Z"}
{"round": 248, "iter": "iter248", "bottleneck": "compute_bound", "idea": "iter248_autogrid: BM=64 BN=256 warps=16 stages=2 indexing=block_ptr Ktile=64 ncol=2", "category": "grid", "expected_gain": "unknown", "decision": "DISCARD", "tflops": 29.39, "timestamp": "2026-04-21T12:56:47Z"}
{"round": 249, "iter": "iter249", "bottleneck": "compute_bound", "idea": "iter249_autogrid: BM=256 BN=64 warps=4 stages=3 indexing=pointer Ktile=64 ncol=2", "category": "grid", "expected_gain": "unknown", "decision": "DISCARD", "tflops": 39.76, "timestamp": "2026-04-21T12:56:54Z"}
{"round": 250, "iter": "iter250", "bottleneck": "compute_bound", "idea": "iter250_autogrid: BM=256 BN=64 warps=4 stages=2 indexing=pointer Ktile=64 ncol=2", "category": "grid", "expected_gain": "unknown", "decision": "DISCARD", "tflops": 56.51, "timestamp": "2026-04-21T12:57:01Z"}
{"round": 251, "iter": "iter251", "bottleneck": "compute_bound", "idea": "iter251_autogrid: BM=128 BN=128 warps=4 stages=4 indexing=pointer Ktile=64 ncol=2", "category": "grid", "expected_gain": "unknown", "decision": "DISCARD", "tflops": 70.42, "timestamp": "2026-04-21T12:58:26Z"}
{"round": 252, "iter": "iter252", "bottleneck": "compute_bound", "idea": "iter252_autogrid: BM=128 BN=128 warps=4 stages=4 indexing=block_ptr Ktile=64 ncol=2", "category": "grid", "expected_gain": "unknown", "decision": "DISCARD", "tflops": 68.76, "timestamp": "2026-04-21T12:58:33Z"}
{"round": 253, "iter": "iter253", "bottleneck": "compute_bound", "idea": "iter253_autogrid: BM=128 BN=128 warps=8 stages=4 indexing=pointer Ktile=64 ncol=2", "category": "grid", "expected_gain": "unknown", "decision": "DISCARD", "tflops": 47.2, "timestamp": "2026-04-21T12:58:39Z"}
{"round": 254, "iter": "iter254", "bottleneck": "compute_bound", "idea": "iter254_autogrid: BM=128 BN=128 warps=8 stages=4 indexing=block_ptr Ktile=64 ncol=2", "category": "grid", "expected_gain": "unknown", "decision": "DISCARD", "tflops": 46.57, "timestamp": "2026-04-21T12:58:45Z"}
{"round": 255, "iter": "iter255", "bottleneck": "compute_bound", "idea": "iter255_autogrid: BM=128 BN=128 warps=4 stages=3 indexing=pointer Ktile=128 ncol=4", "category": "grid", "expected_gain": "unknown", "decision": "DISCARD", "tflops": 39.02, "timestamp": "2026-04-21T12:58:52Z"}
{"round": 256, "iter": "iter256", "bottleneck": "compute_bound", "idea": "iter256_autogrid: BM=128 BN=128 warps=4 stages=3 indexing=block_ptr Ktile=128 ncol=4", "category": "grid", "expected_gain": "unknown", "decision": "DISCARD", "tflops": 56.24, "timestamp": "2026-04-21T12:58:58Z"}
{"round": 257, "iter": "iter257", "bottleneck": "compute_bound", "idea": "iter257_autogrid: BM=128 BN=128 warps=8 stages=3 indexing=pointer Ktile=128 ncol=4", "category": "grid", "expected_gain": "unknown", "decision": "DISCARD", "tflops": 39.27, "timestamp": "2026-04-21T12:59:05Z"}
{"round": 258, "iter": "iter258", "bottleneck": "compute_bound", "idea": "iter258_autogrid: BM=128 BN=128 warps=8 stages=3 indexing=block_ptr Ktile=128 ncol=4", "category": "grid", "expected_gain": "unknown", "decision": "DISCARD", "tflops": 36.87, "timestamp": "2026-04-21T12:59:12Z"}
{"round": 259, "iter": "iter259", "bottleneck": "compute_bound", "idea": "iter259_autogrid: BM=128 BN=128 warps=8 stages=3 indexing=pointer Ktile=64 ncol=2", "category": "grid", "expected_gain": "unknown", "decision": "DISCARD", "tflops": 24.62, "timestamp": "2026-04-21T12:59:18Z"}
{"round": 260, "iter": "iter260", "bottleneck": "compute_bound", "idea": "iter260_autogrid: BM=128 BN=128 warps=8 stages=3 indexing=block_ptr Ktile=64 ncol=2", "category": "grid", "expected_gain": "unknown", "decision": "DISCARD", "tflops": 36.14, "timestamp": "2026-04-21T12:59:25Z"}
{"round": 261, "iter": "iter261", "bottleneck": "compute_bound", "idea": "iter261_autogrid: BM=64 BN=128 warps=4 stages=3 indexing=pointer Ktile=64 ncol=2", "category": "grid", "expected_gain": "unknown", "decision": "DISCARD", "tflops": 40.19, "timestamp": "2026-04-21T12:59:31Z"}
{"round": 262, "iter": "iter262", "bottleneck": "compute_bound", "idea": "iter262_autogrid: BM=64 BN=128 warps=4 stages=3 indexing=block_ptr Ktile=64 ncol=2", "category": "grid", "expected_gain": "unknown", "decision": "DISCARD", "tflops": 58.78, "timestamp": "2026-04-21T12:59:37Z"}
{"round": 263, "iter": "iter263", "bottleneck": "compute_bound", "idea": "iter263_autogrid: BM=128 BN=64 warps=4 stages=3 indexing=pointer Ktile=64 ncol=2", "category": "grid", "expected_gain": "unknown", "decision": "DISCARD", "tflops": 36.91, "timestamp": "2026-04-21T12:59:43Z"}
{"round": 264, "iter": "iter264", "bottleneck": "compute_bound", "idea": "iter264_autogrid: BM=128 BN=64 warps=4 stages=3 indexing=block_ptr Ktile=64 ncol=2", "category": "grid", "expected_gain": "unknown", "decision": "DISCARD", "tflops": 37.7, "timestamp": "2026-04-21T12:59:50Z"}
{"round": 265, "iter": "iter265", "bottleneck": "compile", "idea": "iter265_autogrid: BM=128 BN=128 warps=4 stages=3 indexing=pointer Ktile=96 ncol=3", "category": "grid", "expected_gain": "unknown", "decision": "COMPILE_FAIL", "tflops": 0.0, "timestamp": "2026-04-21T12:59:55Z"}
{"round": 266, "iter": "iter266", "bottleneck": "compile", "idea": "iter266_autogrid: BM=128 BN=128 warps=4 stages=3 indexing=block_ptr Ktile=96 ncol=3", "category": "grid", "expected_gain": "unknown", "decision": "COMPILE_FAIL", "tflops": 0.0, "timestamp": "2026-04-21T13:00:00Z"}
{"round": 267, "iter": "iter267", "bottleneck": "compile", "idea": "iter267_autogrid: BM=128 BN=128 warps=4 stages=4 indexing=pointer Ktile=96 ncol=3", "category": "grid", "expected_gain": "unknown", "decision": "COMPILE_FAIL", "tflops": 0.0, "timestamp": "2026-04-21T13:00:05Z"}
{"round": 268, "iter": "iter268", "bottleneck": "compile", "idea": "iter268_autogrid: BM=128 BN=128 warps=4 stages=4 indexing=block_ptr Ktile=96 ncol=3", "category": "grid", "expected_gain": "unknown", "decision": "COMPILE_FAIL", "tflops": 0.0, "timestamp": "2026-04-21T13:00:10Z"}
{"round": 269, "iter": "iter269", "bottleneck": "compile", "idea": "iter269_autogrid: BM=128 BN=128 warps=8 stages=3 indexing=pointer Ktile=96 ncol=3", "category": "grid", "expected_gain": "unknown", "decision": "COMPILE_FAIL", "tflops": 0.0, "timestamp": "2026-04-21T13:00:15Z"}
{"round": 270, "iter": "iter270", "bottleneck": "compile", "idea": "iter270_autogrid: BM=128 BN=128 warps=8 stages=3 indexing=block_ptr Ktile=96 ncol=3", "category": "grid", "expected_gain": "unknown", "decision": "COMPILE_FAIL", "tflops": 0.0, "timestamp": "2026-04-21T13:00:19Z"}
{"round": 271, "iter": "iter271", "bottleneck": "compute_bound", "idea": "iter271_autogrid: BM=128 BN=128 warps=4 stages=3 indexing=pointer Ktile=64 ncol=2", "category": "grid", "expected_gain": "unknown", "decision": "DISCARD", "tflops": 73.46, "timestamp": "2026-04-21T13:00:25Z"}
{"round": 272, "iter": "iter272", "bottleneck": "compute_bound", "idea": "iter272_autogrid: BM=128 BN=128 warps=4 stages=3 indexing=block_ptr Ktile=64 ncol=2", "category": "grid", "expected_gain": "unknown", "decision": "DISCARD", "tflops": 44.28, "timestamp": "2026-04-21T13:00:32Z"}
{"round": 273, "iter": "iter273", "bottleneck": "compute_bound", "idea": "iter273_autogrid: BM=128 BN=128 warps=4 stages=4 indexing=pointer Ktile=128 ncol=4", "category": "grid", "expected_gain": "unknown", "decision": "DISCARD", "tflops": 37.97, "timestamp": "2026-04-21T13:00:39Z"}
{"round": 274, "iter": "iter274", "bottleneck": "compute_bound", "idea": "iter274_autogrid: BM=128 BN=128 warps=4 stages=4 indexing=block_ptr Ktile=128 ncol=4", "category": "grid", "expected_gain": "unknown", "decision": "DISCARD", "tflops": 33.66, "timestamp": "2026-04-21T13:00:46Z"}
{"round": 275, "iter": "iter275", "bottleneck": "compile", "idea": "iter275_autogrid: BM=128 BN=128 warps=8 stages=4 indexing=pointer Ktile=96 ncol=3", "category": "grid", "expected_gain": "unknown", "decision": "COMPILE_FAIL", "tflops": 0.0, "timestamp": "2026-04-21T13:00:51Z"}
{"round": 276, "iter": "iter276", "bottleneck": "compute_bound", "idea": "iter276_autogrid: BM=128 BN=128 warps=8 stages=4 indexing=pointer Ktile=128 ncol=4", "category": "grid", "expected_gain": "unknown", "decision": "DISCARD", "tflops": 58.7, "timestamp": "2026-04-21T13:00:58Z"}
{"round": 277, "iter": "iter277", "bottleneck": "compile", "idea": "iter277_autogrid: BM=128 BN=128 warps=8 stages=4 indexing=block_ptr Ktile=96 ncol=3", "category": "grid", "expected_gain": "unknown", "decision": "COMPILE_FAIL", "tflops": 0.0, "timestamp": "2026-04-21T13:01:03Z"}
{"round": 278, "iter": "iter278", "bottleneck": "compute_bound", "idea": "iter278_autogrid: BM=128 BN=128 warps=8 stages=4 indexing=block_ptr Ktile=128 ncol=4", "category": "grid", "expected_gain": "unknown", "decision": "DISCARD", "tflops": 52.18, "timestamp": "2026-04-21T13:01:09Z"}
{"round": 279, "iter": "iter279", "bottleneck": "compute_bound", "idea": "iter279_autogrid: BM=128 BN=128 warps=16 stages=3 indexing=pointer Ktile=64 ncol=2", "category": "grid", "expected_gain": "unknown", "decision": "DISCARD", "tflops": 33.58, "timestamp": "2026-04-21T13:01:15Z"}
{"round": 280, "iter": "iter280", "bottleneck": "compile", "idea": "iter280_autogrid: BM=128 BN=128 warps=16 stages=3 indexing=pointer Ktile=96 ncol=3", "category": "grid", "expected_gain": "unknown", "decision": "COMPILE_FAIL", "tflops": 0.0, "timestamp": "2026-04-21T13:01:21Z"}
{"round": 281, "iter": "iter281", "bottleneck": "compute_bound", "idea": "iter281_autogrid: BM=128 BN=128 warps=16 stages=3 indexing=pointer Ktile=128 ncol=4", "category": "grid", "expected_gain": "unknown", "decision": "DISCARD", "tflops": 44.9, "timestamp": "2026-04-21T13:01:27Z"}
{"round": 282, "iter": "iter282", "bottleneck": "compute_bound", "idea": "iter282_autogrid: BM=128 BN=128 warps=16 stages=3 indexing=block_ptr Ktile=64 ncol=2", "category": "grid", "expected_gain": "unknown", "decision": "DISCARD", "tflops": 32.77, "timestamp": "2026-04-21T13:01:33Z"}
{"round": 283, "iter": "iter283", "bottleneck": "compile", "idea": "iter283_autogrid: BM=128 BN=128 warps=16 stages=3 indexing=block_ptr Ktile=96 ncol=3", "category": "grid", "expected_gain": "unknown", "decision": "COMPILE_FAIL", "tflops": 0.0, "timestamp": "2026-04-21T13:01:38Z"}
{"round": 284, "iter": "iter284", "bottleneck": "compute_bound", "idea": "iter284_autogrid: BM=128 BN=128 warps=16 stages=3 indexing=block_ptr Ktile=128 ncol=4", "category": "grid", "expected_gain": "unknown", "decision": "DISCARD", "tflops": 29.5, "timestamp": "2026-04-21T13:01:45Z"}
{"round": 285, "iter": "iter285", "bottleneck": "compute_bound", "idea": "iter285_autogrid: BM=128 BN=128 warps=16 stages=4 indexing=pointer Ktile=64 ncol=2", "category": "grid", "expected_gain": "unknown", "decision": "DISCARD", "tflops": 29.75, "timestamp": "2026-04-21T13:01:51Z"}
{"round": 286, "iter": "iter286", "bottleneck": "compile", "idea": "iter286_autogrid: BM=128 BN=128 warps=16 stages=4 indexing=pointer Ktile=96 ncol=3", "category": "grid", "expected_gain": "unknown", "decision": "COMPILE_FAIL", "tflops": 0.0, "timestamp": "2026-04-21T13:01:56Z"}
{"round": 287, "iter": "iter287", "bottleneck": "compute_bound", "idea": "iter287_autogrid: BM=128 BN=128 warps=16 stages=4 indexing=pointer Ktile=128 ncol=4", "category": "grid", "expected_gain": "unknown", "decision": "DISCARD", "tflops": 44.17, "timestamp": "2026-04-21T13:02:02Z"}
{"round": 288, "iter": "iter288", "bottleneck": "compute_bound", "idea": "iter288_autogrid: BM=128 BN=128 warps=16 stages=4 indexing=block_ptr Ktile=64 ncol=2", "category": "grid", "expected_gain": "unknown", "decision": "DISCARD", "tflops": 29.42, "timestamp": "2026-04-21T13:02:09Z"}
