{"round": 514, "iter": "iter514", "bottleneck": "compute_bound", "idea": "iter514_autogrid: BM=128 BN=128 warps=8 stages=3 indexing=block_ptr Ktile=128 ncol=4 layout=mnk", "category": "grid", "expected_gain": "unknown", "decision": "DISCARD", "tflops": 57.68, "timestamp": "2026-04-21T13:41:08Z"}
{"round": 515, "iter": "iter515", "bottleneck": "compute_bound", "idea": "iter515_autogrid: BM=128 BN=128 warps=8 stages=3 indexing=block_ptr Ktile=128 ncol=4 layout=lo1", "category": "grid", "expected_gain": "unknown", "decision": "DISCARD", "tflops": 58.66, "timestamp": "2026-04-21T13:41:14Z"}
{"round": 516, "iter": "iter516", "bottleneck": "compile", "idea": "iter516_autogrid: BM=128 BN=128 warps=8 stages=3 indexing=block_ptr Ktile=128 ncol=4 layout=kmn", "category": "grid", "expected_gain": "unknown", "decision": "COMPILE_FAIL", "tflops": 0.0, "timestamp": "2026-04-21T13:41:19Z"}
{"round": 517, "iter": "iter517", "bottleneck": "compute_bound", "idea": "iter517_autogrid: BM=128 BN=128 warps=8 stages=4 indexing=pointer Ktile=32 ncol=1 layout=mnk", "category": "grid", "expected_gain": "unknown", "decision": "DISCARD", "tflops": 38.91, "timestamp": "2026-04-21T13:41:24Z"}
{"round": 518, "iter": "iter518", "bottleneck": "compute_bound", "idea": "iter518_autogrid: BM=128 BN=128 warps=8 stages=4 indexing=pointer Ktile=32 ncol=1 layout=lo1", "category": "grid", "expected_gain": "unknown", "decision": "DISCARD", "tflops": 39.39, "timestamp": "2026-04-21T13:41:30Z"}
{"round": 519, "iter": "iter519", "bottleneck": "compile", "idea": "iter519_autogrid: BM=128 BN=128 warps=8 stages=4 indexing=pointer Ktile=32 ncol=1 layout=kmn", "category": "grid", "expected_gain": "unknown", "decision": "COMPILE_FAIL", "tflops": 0.0, "timestamp": "2026-04-21T13:41:35Z"}
{"round": 520, "iter": "iter520", "bottleneck": "compute_bound", "idea": "iter520_autogrid: BM=128 BN=128 warps=8 stages=4 indexing=pointer Ktile=64 ncol=2 layout=mnk", "category": "grid", "expected_gain": "unknown", "decision": "DISCARD", "tflops": 47.21, "timestamp": "2026-04-21T13:41:40Z"}
{"round": 521, "iter": "iter521", "bottleneck": "compute_bound", "idea": "iter521_autogrid: BM=128 BN=128 warps=8 stages=4 indexing=pointer Ktile=64 ncol=2 layout=lo1", "category": "grid", "expected_gain": "unknown", "decision": "DISCARD", "tflops": 49.84, "timestamp": "2026-04-21T13:41:46Z"}
{"round": 522, "iter": "iter522", "bottleneck": "compile", "idea": "iter522_autogrid: BM=128 BN=128 warps=8 stages=4 indexing=pointer Ktile=64 ncol=2 layout=kmn", "category": "grid", "expected_gain": "unknown", "decision": "COMPILE_FAIL", "tflops": 0.0, "timestamp": "2026-04-21T13:41:51Z"}
{"round": 523, "iter": "iter523", "bottleneck": "compute_bound", "idea": "iter523_autogrid: BM=128 BN=128 warps=8 stages=4 indexing=pointer Ktile=128 ncol=4 layout=mnk", "category": "grid", "expected_gain": "unknown", "decision": "DISCARD", "tflops": 58.97, "timestamp": "2026-04-21T13:41:57Z"}
{"round": 524, "iter": "iter524", "bottleneck": "compute_bound", "idea": "iter524_autogrid: BM=128 BN=128 warps=8 stages=4 indexing=pointer Ktile=128 ncol=4 layout=lo1", "category": "grid", "expected_gain": "unknown", "decision": "DISCARD", "tflops": 55.61, "timestamp": "2026-04-21T13:42:03Z"}
{"round": 525, "iter": "iter525", "bottleneck": "compile", "idea": "iter525_autogrid: BM=128 BN=128 warps=8 stages=4 indexing=pointer Ktile=128 ncol=4 layout=kmn", "category": "grid", "expected_gain": "unknown", "decision": "COMPILE_FAIL", "tflops": 0.0, "timestamp": "2026-04-21T13:42:08Z"}
{"round": 526, "iter": "iter526", "bottleneck": "compute_bound", "idea": "iter526_autogrid: BM=128 BN=128 warps=8 stages=4 indexing=block_ptr Ktile=32 ncol=1 layout=mnk", "category": "grid", "expected_gain": "unknown", "decision": "DISCARD", "tflops": 38.43, "timestamp": "2026-04-21T13:42:14Z"}
{"round": 527, "iter": "iter527", "bottleneck": "compute_bound", "idea": "iter527_autogrid: BM=128 BN=128 warps=8 stages=4 indexing=block_ptr Ktile=32 ncol=1 layout=lo1", "category": "grid", "expected_gain": "unknown", "decision": "DISCARD", "tflops": 38.41, "timestamp": "2026-04-21T13:42:20Z"}
{"round": 528, "iter": "iter528", "bottleneck": "compile", "idea": "iter528_autogrid: BM=128 BN=128 warps=8 stages=4 indexing=block_ptr Ktile=32 ncol=1 layout=kmn", "category": "grid", "expected_gain": "unknown", "decision": "COMPILE_FAIL", "tflops": 0.0, "timestamp": "2026-04-21T13:42:24Z"}
{"round": 529, "iter": "iter529", "bottleneck": "compute_bound", "idea": "iter529_autogrid: BM=128 BN=128 warps=8 stages=4 indexing=block_ptr Ktile=64 ncol=2 layout=mnk", "category": "grid", "expected_gain": "unknown", "decision": "DISCARD", "tflops": 46.63, "timestamp": "2026-04-21T13:42:30Z"}
{"round": 530, "iter": "iter530", "bottleneck": "compute_bound", "idea": "iter530_autogrid: BM=128 BN=128 warps=8 stages=4 indexing=block_ptr Ktile=64 ncol=2 layout=lo1", "category": "grid", "expected_gain": "unknown", "decision": "DISCARD", "tflops": 47.26, "timestamp": "2026-04-21T13:42:35Z"}
{"round": 531, "iter": "iter531", "bottleneck": "compile", "idea": "iter531_autogrid: BM=128 BN=128 warps=8 stages=4 indexing=block_ptr Ktile=64 ncol=2 layout=kmn", "category": "grid", "expected_gain": "unknown", "decision": "COMPILE_FAIL", "tflops": 0.0, "timestamp": "2026-04-21T13:42:40Z"}
{"round": 532, "iter": "iter532", "bottleneck": "compute_bound", "idea": "iter532_autogrid: BM=128 BN=128 warps=8 stages=4 indexing=block_ptr Ktile=128 ncol=4 layout=mnk", "category": "grid", "expected_gain": "unknown", "decision": "DISCARD", "tflops": 57.34, "timestamp": "2026-04-21T13:42:46Z"}
{"round": 533, "iter": "iter533", "bottleneck": "compute_bound", "idea": "iter533_autogrid: BM=128 BN=128 warps=8 stages=4 indexing=block_ptr Ktile=128 ncol=4 layout=lo1", "category": "grid", "expected_gain": "unknown", "decision": "DISCARD", "tflops": 58.52, "timestamp": "2026-04-21T13:42:52Z"}
{"round": 534, "iter": "iter534", "bottleneck": "compile", "idea": "iter534_autogrid: BM=128 BN=128 warps=8 stages=4 indexing=block_ptr Ktile=128 ncol=4 layout=kmn", "category": "grid", "expected_gain": "unknown", "decision": "COMPILE_FAIL", "tflops": 0.0, "timestamp": "2026-04-21T13:42:56Z"}
{"round": 535, "iter": "iter535", "bottleneck": "compute_bound", "idea": "iter535_autogrid: BM=128 BN=128 warps=8 stages=5 indexing=pointer Ktile=32 ncol=1 layout=mnk", "category": "grid", "expected_gain": "unknown", "decision": "DISCARD", "tflops": 38.52, "timestamp": "2026-04-21T13:43:02Z"}
{"round": 536, "iter": "iter536", "bottleneck": "compute_bound", "idea": "iter536_autogrid: BM=128 BN=128 warps=8 stages=5 indexing=pointer Ktile=32 ncol=1 layout=lo1", "category": "grid", "expected_gain": "unknown", "decision": "DISCARD", "tflops": 39.53, "timestamp": "2026-04-21T13:43:08Z"}
{"round": 537, "iter": "iter537", "bottleneck": "compile", "idea": "iter537_autogrid: BM=128 BN=128 warps=8 stages=5 indexing=pointer Ktile=32 ncol=1 layout=kmn", "category": "grid", "expected_gain": "unknown", "decision": "COMPILE_FAIL", "tflops": 0.0, "timestamp": "2026-04-21T13:43:12Z"}
{"round": 538, "iter": "iter538", "bottleneck": "compute_bound", "idea": "iter538_autogrid: BM=128 BN=128 warps=8 stages=5 indexing=pointer Ktile=64 ncol=2 layout=mnk", "category": "grid", "expected_gain": "unknown", "decision": "DISCARD", "tflops": 46.66, "timestamp": "2026-04-21T13:43:18Z"}
{"round": 539, "iter": "iter539", "bottleneck": "compute_bound", "idea": "iter539_autogrid: BM=128 BN=128 warps=8 stages=5 indexing=pointer Ktile=64 ncol=2 layout=lo1", "category": "grid", "expected_gain": "unknown", "decision": "DISCARD", "tflops": 49.81, "timestamp": "2026-04-21T13:43:24Z"}
{"round": 540, "iter": "iter540", "bottleneck": "compile", "idea": "iter540_autogrid: BM=128 BN=128 warps=8 stages=5 indexing=pointer Ktile=64 ncol=2 layout=kmn", "category": "grid", "expected_gain": "unknown", "decision": "COMPILE_FAIL", "tflops": 0.0, "timestamp": "2026-04-21T13:43:29Z"}
{"round": 541, "iter": "iter541", "bottleneck": "compute_bound", "idea": "iter541_autogrid: BM=128 BN=128 warps=8 stages=5 indexing=pointer Ktile=128 ncol=4 layout=mnk", "category": "grid", "expected_gain": "unknown", "decision": "DISCARD", "tflops": 58.88, "timestamp": "2026-04-21T13:43:35Z"}
{"round": 542, "iter": "iter542", "bottleneck": "compute_bound", "idea": "iter542_autogrid: BM=128 BN=128 warps=8 stages=5 indexing=pointer Ktile=128 ncol=4 layout=lo1", "category": "grid", "expected_gain": "unknown", "decision": "DISCARD", "tflops": 59.68, "timestamp": "2026-04-21T13:43:41Z"}
{"round": 543, "iter": "iter543", "bottleneck": "compile", "idea": "iter543_autogrid: BM=128 BN=128 warps=8 stages=5 indexing=pointer Ktile=128 ncol=4 layout=kmn", "category": "grid", "expected_gain": "unknown", "decision": "COMPILE_FAIL", "tflops": 0.0, "timestamp": "2026-04-21T13:43:46Z"}
{"round": 544, "iter": "iter544", "bottleneck": "compute_bound", "idea": "iter544_autogrid: BM=128 BN=128 warps=8 stages=5 indexing=block_ptr Ktile=32 ncol=1 layout=mnk", "category": "grid", "expected_gain": "unknown", "decision": "DISCARD", "tflops": 38.98, "timestamp": "2026-04-21T13:43:52Z"}
{"round": 545, "iter": "iter545", "bottleneck": "compute_bound", "idea": "iter545_autogrid: BM=128 BN=128 warps=8 stages=5 indexing=block_ptr Ktile=32 ncol=1 layout=lo1", "category": "grid", "expected_gain": "unknown", "decision": "DISCARD", "tflops": 38.35, "timestamp": "2026-04-21T13:43:58Z"}
{"round": 546, "iter": "iter546", "bottleneck": "compile", "idea": "iter546_autogrid: BM=128 BN=128 warps=8 stages=5 indexing=block_ptr Ktile=32 ncol=1 layout=kmn", "category": "grid", "expected_gain": "unknown", "decision": "COMPILE_FAIL", "tflops": 0.0, "timestamp": "2026-04-21T13:44:02Z"}
{"round": 547, "iter": "iter547", "bottleneck": "compute_bound", "idea": "iter547_autogrid: BM=128 BN=128 warps=8 stages=5 indexing=block_ptr Ktile=64 ncol=2 layout=mnk", "category": "grid", "expected_gain": "unknown", "decision": "DISCARD", "tflops": 46.62, "timestamp": "2026-04-21T13:44:08Z"}
{"round": 548, "iter": "iter548", "bottleneck": "compute_bound", "idea": "iter548_autogrid: BM=128 BN=128 warps=8 stages=5 indexing=block_ptr Ktile=64 ncol=2 layout=lo1", "category": "grid", "expected_gain": "unknown", "decision": "DISCARD", "tflops": 47.25, "timestamp": "2026-04-21T13:44:14Z"}
{"round": 549, "iter": "iter549", "bottleneck": "compile", "idea": "iter549_autogrid: BM=128 BN=128 warps=8 stages=5 indexing=block_ptr Ktile=64 ncol=2 layout=kmn", "category": "grid", "expected_gain": "unknown", "decision": "COMPILE_FAIL", "tflops": 0.0, "timestamp": "2026-04-21T13:44:19Z"}
{"round": 550, "iter": "iter550", "bottleneck": "compute_bound", "idea": "iter550_autogrid: BM=128 BN=128 warps=8 stages=5 indexing=block_ptr Ktile=128 ncol=4 layout=mnk", "category": "grid", "expected_gain": "unknown", "decision": "DISCARD", "tflops": 57.35, "timestamp": "2026-04-21T13:44:25Z"}
{"round": 551, "iter": "iter551", "bottleneck": "compute_bound", "idea": "iter551_autogrid: BM=128 BN=128 warps=8 stages=5 indexing=block_ptr Ktile=128 ncol=4 layout=lo1", "category": "grid", "expected_gain": "unknown", "decision": "DISCARD", "tflops": 57.66, "timestamp": "2026-04-21T13:44:31Z"}
{"round": 552, "iter": "iter552", "bottleneck": "compile", "idea": "iter552_autogrid: BM=128 BN=128 warps=8 stages=5 indexing=block_ptr Ktile=128 ncol=4 layout=kmn", "category": "grid", "expected_gain": "unknown", "decision": "COMPILE_FAIL", "tflops": 0.0, "timestamp": "2026-04-21T13:44:36Z"}
{"round": 553, "iter": "iter553", "bottleneck": "compute_bound", "idea": "iter553_autogrid: BM=128 BN=128 warps=8 stages=6 indexing=pointer Ktile=32 ncol=1 layout=mnk", "category": "grid", "expected_gain": "unknown", "decision": "DISCARD", "tflops": 38.52, "timestamp": "2026-04-21T13:44:42Z"}
{"round": 554, "iter": "iter554", "bottleneck": "compute_bound", "idea": "iter554_autogrid: BM=128 BN=128 warps=8 stages=6 indexing=pointer Ktile=32 ncol=1 layout=lo1", "category": "grid", "expected_gain": "unknown", "decision": "DISCARD", "tflops": 39.51, "timestamp": "2026-04-21T13:44:48Z"}
{"round": 555, "iter": "iter555", "bottleneck": "compile", "idea": "iter555_autogrid: BM=128 BN=128 warps=8 stages=6 indexing=pointer Ktile=32 ncol=1 layout=kmn", "category": "grid", "expected_gain": "unknown", "decision": "COMPILE_FAIL", "tflops": 0.0, "timestamp": "2026-04-21T13:44:53Z"}
{"round": 556, "iter": "iter556", "bottleneck": "compute_bound", "idea": "iter556_autogrid: BM=128 BN=128 warps=8 stages=6 indexing=pointer Ktile=64 ncol=2 layout=mnk", "category": "grid", "expected_gain": "unknown", "decision": "DISCARD", "tflops": 47.13, "timestamp": "2026-04-21T13:44:59Z"}
{"round": 557, "iter": "iter557", "bottleneck": "compute_bound", "idea": "iter557_autogrid: BM=128 BN=128 warps=8 stages=6 indexing=pointer Ktile=64 ncol=2 layout=lo1", "category": "grid", "expected_gain": "unknown", "decision": "DISCARD", "tflops": 49.78, "timestamp": "2026-04-21T13:45:05Z"}
{"round": 558, "iter": "iter558", "bottleneck": "compile", "idea": "iter558_autogrid: BM=128 BN=128 warps=8 stages=6 indexing=pointer Ktile=64 ncol=2 layout=kmn", "category": "grid", "expected_gain": "unknown", "decision": "COMPILE_FAIL", "tflops": 0.0, "timestamp": "2026-04-21T13:45:09Z"}
{"round": 559, "iter": "iter559", "bottleneck": "compute_bound", "idea": "iter559_autogrid: BM=128 BN=128 warps=8 stages=6 indexing=pointer Ktile=128 ncol=4 layout=mnk", "category": "grid", "expected_gain": "unknown", "decision": "DISCARD", "tflops": 58.64, "timestamp": "2026-04-21T13:45:16Z"}
{"round": 560, "iter": "iter560", "bottleneck": "compute_bound", "idea": "iter560_autogrid: BM=128 BN=128 warps=8 stages=6 indexing=pointer Ktile=128 ncol=4 layout=lo1", "category": "grid", "expected_gain": "unknown", "decision": "DISCARD", "tflops": 58.84, "timestamp": "2026-04-21T13:45:22Z"}
{"round": 561, "iter": "iter561", "bottleneck": "compile", "idea": "iter561_autogrid: BM=128 BN=128 warps=8 stages=6 indexing=pointer Ktile=128 ncol=4 layout=kmn", "category": "grid", "expected_gain": "unknown", "decision": "COMPILE_FAIL", "tflops": 0.0, "timestamp": "2026-04-21T13:45:26Z"}
{"round": 562, "iter": "iter562", "bottleneck": "compute_bound", "idea": "iter562_autogrid: BM=128 BN=128 warps=8 stages=6 indexing=block_ptr Ktile=32 ncol=1 layout=mnk", "category": "grid", "expected_gain": "unknown", "decision": "DISCARD", "tflops": 38.4, "timestamp": "2026-04-21T13:45:32Z"}
{"round": 563, "iter": "iter563", "bottleneck": "compute_bound", "idea": "iter563_autogrid: BM=128 BN=128 warps=8 stages=6 indexing=block_ptr Ktile=32 ncol=1 layout=lo1", "category": "grid", "expected_gain": "unknown", "decision": "DISCARD", "tflops": 38.42, "timestamp": "2026-04-21T13:45:38Z"}
{"round": 564, "iter": "iter564", "bottleneck": "compile", "idea": "iter564_autogrid: BM=128 BN=128 warps=8 stages=6 indexing=block_ptr Ktile=32 ncol=1 layout=kmn", "category": "grid", "expected_gain": "unknown", "decision": "COMPILE_FAIL", "tflops": 0.0, "timestamp": "2026-04-21T13:45:42Z"}
{"round": 565, "iter": "iter565", "bottleneck": "compute_bound", "idea": "iter565_autogrid: BM=128 BN=128 warps=8 stages=6 indexing=block_ptr Ktile=64 ncol=2 layout=mnk", "category": "grid", "expected_gain": "unknown", "decision": "DISCARD", "tflops": 46.55, "timestamp": "2026-04-21T13:45:48Z"}
{"round": 566, "iter": "iter566", "bottleneck": "compute_bound", "idea": "iter566_autogrid: BM=128 BN=128 warps=8 stages=6 indexing=block_ptr Ktile=64 ncol=2 layout=lo1", "category": "grid", "expected_gain": "unknown", "decision": "DISCARD", "tflops": 46.6, "timestamp": "2026-04-21T13:45:54Z"}
{"round": 567, "iter": "iter567", "bottleneck": "compile", "idea": "iter567_autogrid: BM=128 BN=128 warps=8 stages=6 indexing=block_ptr Ktile=64 ncol=2 layout=kmn", "category": "grid", "expected_gain": "unknown", "decision": "COMPILE_FAIL", "tflops": 0.0, "timestamp": "2026-04-21T13:45:59Z"}
{"round": 568, "iter": "iter568", "bottleneck": "compute_bound", "idea": "iter568_autogrid: BM=128 BN=128 warps=8 stages=6 indexing=block_ptr Ktile=128 ncol=4 layout=mnk", "category": "grid", "expected_gain": "unknown", "decision": "DISCARD", "tflops": 56.34, "timestamp": "2026-04-21T13:46:05Z"}
{"round": 569, "iter": "iter569", "bottleneck": "compute_bound", "idea": "iter569_autogrid: BM=128 BN=128 warps=8 stages=6 indexing=block_ptr Ktile=128 ncol=4 layout=lo1", "category": "grid", "expected_gain": "unknown", "decision": "DISCARD", "tflops": 57.63, "timestamp": "2026-04-21T13:46:11Z"}
{"round": 570, "iter": "iter570", "bottleneck": "compile", "idea": "iter570_autogrid: BM=128 BN=128 warps=8 stages=6 indexing=block_ptr Ktile=128 ncol=4 layout=kmn", "category": "grid", "expected_gain": "unknown", "decision": "COMPILE_FAIL", "tflops": 0.0, "timestamp": "2026-04-21T13:46:15Z"}
{"round": 571, "iter": "iter571", "bottleneck": "compile", "idea": "iter571_autogrid: BM=96 BN=96 warps=2 stages=3 indexing=pointer Ktile=32 ncol=1 layout=mnk", "category": "grid", "expected_gain": "unknown", "decision": "COMPILE_FAIL", "tflops": 0.0, "timestamp": "2026-04-21T13:46:20Z"}
{"round": 572, "iter": "iter572", "bottleneck": "compile", "idea": "iter572_autogrid: BM=96 BN=96 warps=2 stages=3 indexing=pointer Ktile=32 ncol=1 layout=lo1", "category": "grid", "expected_gain": "unknown", "decision": "COMPILE_FAIL", "tflops": 0.0, "timestamp": "2026-04-21T13:46:24Z"}
{"round": 573, "iter": "iter573", "bottleneck": "compile", "idea": "iter573_autogrid: BM=96 BN=96 warps=2 stages=3 indexing=pointer Ktile=32 ncol=1 layout=kmn", "category": "grid", "expected_gain": "unknown", "decision": "COMPILE_FAIL", "tflops": 0.0, "timestamp": "2026-04-21T13:46:29Z"}
{"round": 574, "iter": "iter574", "bottleneck": "compile", "idea": "iter574_autogrid: BM=96 BN=96 warps=2 stages=3 indexing=pointer Ktile=64 ncol=2 layout=mnk", "category": "grid", "expected_gain": "unknown", "decision": "COMPILE_FAIL", "tflops": 0.0, "timestamp": "2026-04-21T13:46:33Z"}
{"round": 575, "iter": "iter575", "bottleneck": "compile", "idea": "iter575_autogrid: BM=96 BN=96 warps=2 stages=3 indexing=pointer Ktile=64 ncol=2 layout=lo1", "category": "grid", "expected_gain": "unknown", "decision": "COMPILE_FAIL", "tflops": 0.0, "timestamp": "2026-04-21T13:46:37Z"}
{"round": 576, "iter": "iter576", "bottleneck": "compile", "idea": "iter576_autogrid: BM=96 BN=96 warps=2 stages=3 indexing=pointer Ktile=64 ncol=2 layout=kmn", "category": "grid", "expected_gain": "unknown", "decision": "COMPILE_FAIL", "tflops": 0.0, "timestamp": "2026-04-21T13:46:42Z"}
{"round": 577, "iter": "iter577", "bottleneck": "compile", "idea": "iter577_autogrid: BM=96 BN=96 warps=2 stages=3 indexing=pointer Ktile=128 ncol=4 layout=mnk", "category": "grid", "expected_gain": "unknown", "decision": "COMPILE_FAIL", "tflops": 0.0, "timestamp": "2026-04-21T13:46:47Z"}
{"round": 578, "iter": "iter578", "bottleneck": "compile", "idea": "iter578_autogrid: BM=96 BN=96 warps=2 stages=3 indexing=pointer Ktile=128 ncol=4 layout=lo1", "category": "grid", "expected_gain": "unknown", "decision": "COMPILE_FAIL", "tflops": 0.0, "timestamp": "2026-04-21T13:46:51Z"}
{"round": 579, "iter": "iter579", "bottleneck": "compile", "idea": "iter579_autogrid: BM=96 BN=96 warps=2 stages=3 indexing=pointer Ktile=128 ncol=4 layout=kmn", "category": "grid", "expected_gain": "unknown", "decision": "COMPILE_FAIL", "tflops": 0.0, "timestamp": "2026-04-21T13:46:55Z"}
{"round": 580, "iter": "iter580", "bottleneck": "compile", "idea": "iter580_autogrid: BM=96 BN=96 warps=2 stages=3 indexing=block_ptr Ktile=32 ncol=1 layout=mnk", "category": "grid", "expected_gain": "unknown", "decision": "COMPILE_FAIL", "tflops": 0.0, "timestamp": "2026-04-21T13:47:00Z"}
{"round": 581, "iter": "iter581", "bottleneck": "compile", "idea": "iter581_autogrid: BM=96 BN=96 warps=2 stages=3 indexing=block_ptr Ktile=32 ncol=1 layout=lo1", "category": "grid", "expected_gain": "unknown", "decision": "COMPILE_FAIL", "tflops": 0.0, "timestamp": "2026-04-21T13:47:04Z"}
{"round": 582, "iter": "iter582", "bottleneck": "compile", "idea": "iter582_autogrid: BM=96 BN=96 warps=2 stages=3 indexing=block_ptr Ktile=32 ncol=1 layout=kmn", "category": "grid", "expected_gain": "unknown", "decision": "COMPILE_FAIL", "tflops": 0.0, "timestamp": "2026-04-21T13:47:08Z"}
{"round": 583, "iter": "iter583", "bottleneck": "compile", "idea": "iter583_autogrid: BM=96 BN=96 warps=2 stages=3 indexing=block_ptr Ktile=64 ncol=2 layout=mnk", "category": "grid", "expected_gain": "unknown", "decision": "COMPILE_FAIL", "tflops": 0.0, "timestamp": "2026-04-21T13:47:13Z"}
{"round": 584, "iter": "iter584", "bottleneck": "compile", "idea": "iter584_autogrid: BM=96 BN=96 warps=2 stages=3 indexing=block_ptr Ktile=64 ncol=2 layout=lo1", "category": "grid", "expected_gain": "unknown", "decision": "COMPILE_FAIL", "tflops": 0.0, "timestamp": "2026-04-21T13:47:17Z"}
{"round": 585, "iter": "iter585", "bottleneck": "compile", "idea": "iter585_autogrid: BM=96 BN=96 warps=2 stages=3 indexing=block_ptr Ktile=64 ncol=2 layout=kmn", "category": "grid", "expected_gain": "unknown", "decision": "COMPILE_FAIL", "tflops": 0.0, "timestamp": "2026-04-21T13:47:21Z"}
{"round": 586, "iter": "iter586", "bottleneck": "compile", "idea": "iter586_autogrid: BM=96 BN=96 warps=2 stages=3 indexing=block_ptr Ktile=128 ncol=4 layout=mnk", "category": "grid", "expected_gain": "unknown", "decision": "COMPILE_FAIL", "tflops": 0.0, "timestamp": "2026-04-21T13:47:26Z"}
{"round": 587, "iter": "iter587", "bottleneck": "compile", "idea": "iter587_autogrid: BM=96 BN=96 warps=2 stages=3 indexing=block_ptr Ktile=128 ncol=4 layout=lo1", "category": "grid", "expected_gain": "unknown", "decision": "COMPILE_FAIL", "tflops": 0.0, "timestamp": "2026-04-21T13:47:31Z"}
