{"round": 588, "iter": "iter588", "bottleneck": "compile", "idea": "iter588_autogrid: BM=96 BN=96 warps=2 stages=3 indexing=block_ptr Ktile=128 ncol=4 layout=kmn", "category": "grid", "expected_gain": "unknown", "decision": "COMPILE_FAIL", "tflops": 0.0, "timestamp": "2026-04-21T13:47:35Z"}
{"round": 589, "iter": "iter589", "bottleneck": "compile", "idea": "iter589_autogrid: BM=96 BN=96 warps=2 stages=4 indexing=pointer Ktile=32 ncol=1 layout=mnk", "category": "grid", "expected_gain": "unknown", "decision": "COMPILE_FAIL", "tflops": 0.0, "timestamp": "2026-04-21T13:47:39Z"}
{"round": 590, "iter": "iter590", "bottleneck": "compile", "idea": "iter590_autogrid: BM=96 BN=96 warps=2 stages=4 indexing=pointer Ktile=32 ncol=1 layout=lo1", "category": "grid", "expected_gain": "unknown", "decision": "COMPILE_FAIL", "tflops": 0.0, "timestamp": "2026-04-21T13:47:44Z"}
{"round": 591, "iter": "iter591", "bottleneck": "compile", "idea": "iter591_autogrid: BM=96 BN=96 warps=2 stages=4 indexing=pointer Ktile=32 ncol=1 layout=kmn", "category": "grid", "expected_gain": "unknown", "decision": "COMPILE_FAIL", "tflops": 0.0, "timestamp": "2026-04-21T13:47:48Z"}
{"round": 592, "iter": "iter592", "bottleneck": "compile", "idea": "iter592_autogrid: BM=96 BN=96 warps=2 stages=4 indexing=pointer Ktile=64 ncol=2 layout=mnk", "category": "grid", "expected_gain": "unknown", "decision": "COMPILE_FAIL", "tflops": 0.0, "timestamp": "2026-04-21T13:47:53Z"}
{"round": 593, "iter": "iter593", "bottleneck": "compile", "idea": "iter593_autogrid: BM=96 BN=96 warps=2 stages=4 indexing=pointer Ktile=64 ncol=2 layout=lo1", "category": "grid", "expected_gain": "unknown", "decision": "COMPILE_FAIL", "tflops": 0.0, "timestamp": "2026-04-21T13:47:57Z"}
{"round": 594, "iter": "iter594", "bottleneck": "compile", "idea": "iter594_autogrid: BM=96 BN=96 warps=2 stages=4 indexing=pointer Ktile=64 ncol=2 layout=kmn", "category": "grid", "expected_gain": "unknown", "decision": "COMPILE_FAIL", "tflops": 0.0, "timestamp": "2026-04-21T13:48:02Z"}
{"round": 595, "iter": "iter595", "bottleneck": "compile", "idea": "iter595_autogrid: BM=96 BN=96 warps=2 stages=4 indexing=pointer Ktile=128 ncol=4 layout=mnk", "category": "grid", "expected_gain": "unknown", "decision": "COMPILE_FAIL", "tflops": 0.0, "timestamp": "2026-04-21T13:48:06Z"}
{"round": 596, "iter": "iter596", "bottleneck": "compile", "idea": "iter596_autogrid: BM=96 BN=96 warps=2 stages=4 indexing=pointer Ktile=128 ncol=4 layout=lo1", "category": "grid", "expected_gain": "unknown", "decision": "COMPILE_FAIL", "tflops": 0.0, "timestamp": "2026-04-21T13:48:11Z"}
{"round": 597, "iter": "iter597", "bottleneck": "compile", "idea": "iter597_autogrid: BM=96 BN=96 warps=2 stages=4 indexing=pointer Ktile=128 ncol=4 layout=kmn", "category": "grid", "expected_gain": "unknown", "decision": "COMPILE_FAIL", "tflops": 0.0, "timestamp": "2026-04-21T13:48:15Z"}
{"round": 598, "iter": "iter598", "bottleneck": "compile", "idea": "iter598_autogrid: BM=96 BN=96 warps=2 stages=4 indexing=block_ptr Ktile=32 ncol=1 layout=mnk", "category": "grid", "expected_gain": "unknown", "decision": "COMPILE_FAIL", "tflops": 0.0, "timestamp": "2026-04-21T13:48:20Z"}
{"round": 599, "iter": "iter599", "bottleneck": "compile", "idea": "iter599_autogrid: BM=96 BN=96 warps=2 stages=4 indexing=block_ptr Ktile=32 ncol=1 layout=lo1", "category": "grid", "expected_gain": "unknown", "decision": "COMPILE_FAIL", "tflops": 0.0, "timestamp": "2026-04-21T13:48:25Z"}
{"round": 600, "iter": "iter600", "bottleneck": "compile", "idea": "iter600_autogrid: BM=96 BN=96 warps=2 stages=4 indexing=block_ptr Ktile=32 ncol=1 layout=kmn", "category": "grid", "expected_gain": "unknown", "decision": "COMPILE_FAIL", "tflops": 0.0, "timestamp": "2026-04-21T13:48:30Z"}
{"round": 601, "iter": "iter601", "bottleneck": "compile", "idea": "iter601_autogrid: BM=96 BN=96 warps=2 stages=4 indexing=block_ptr Ktile=64 ncol=2 layout=mnk", "category": "grid", "expected_gain": "unknown", "decision": "COMPILE_FAIL", "tflops": 0.0, "timestamp": "2026-04-21T13:48:35Z"}
{"round": 602, "iter": "iter602", "bottleneck": "compile", "idea": "iter602_autogrid: BM=96 BN=96 warps=2 stages=4 indexing=block_ptr Ktile=64 ncol=2 layout=lo1", "category": "grid", "expected_gain": "unknown", "decision": "COMPILE_FAIL", "tflops": 0.0, "timestamp": "2026-04-21T13:48:39Z"}
{"round": 603, "iter": "iter603", "bottleneck": "compile", "idea": "iter603_autogrid: BM=96 BN=96 warps=2 stages=4 indexing=block_ptr Ktile=64 ncol=2 layout=kmn", "category": "grid", "expected_gain": "unknown", "decision": "COMPILE_FAIL", "tflops": 0.0, "timestamp": "2026-04-21T13:48:44Z"}
{"round": 604, "iter": "iter604", "bottleneck": "compile", "idea": "iter604_autogrid: BM=96 BN=96 warps=2 stages=4 indexing=block_ptr Ktile=128 ncol=4 layout=mnk", "category": "grid", "expected_gain": "unknown", "decision": "COMPILE_FAIL", "tflops": 0.0, "timestamp": "2026-04-21T13:48:48Z"}
{"round": 605, "iter": "iter605", "bottleneck": "compile", "idea": "iter605_autogrid: BM=96 BN=96 warps=2 stages=4 indexing=block_ptr Ktile=128 ncol=4 layout=lo1", "category": "grid", "expected_gain": "unknown", "decision": "COMPILE_FAIL", "tflops": 0.0, "timestamp": "2026-04-21T13:48:53Z"}
{"round": 606, "iter": "iter606", "bottleneck": "compile", "idea": "iter606_autogrid: BM=96 BN=96 warps=2 stages=4 indexing=block_ptr Ktile=128 ncol=4 layout=kmn", "category": "grid", "expected_gain": "unknown", "decision": "COMPILE_FAIL", "tflops": 0.0, "timestamp": "2026-04-21T13:48:58Z"}
{"round": 607, "iter": "iter607", "bottleneck": "compile", "idea": "iter607_autogrid: BM=96 BN=96 warps=2 stages=5 indexing=pointer Ktile=32 ncol=1 layout=mnk", "category": "grid", "expected_gain": "unknown", "decision": "COMPILE_FAIL", "tflops": 0.0, "timestamp": "2026-04-21T13:49:02Z"}
{"round": 608, "iter": "iter608", "bottleneck": "compile", "idea": "iter608_autogrid: BM=96 BN=96 warps=2 stages=5 indexing=pointer Ktile=32 ncol=1 layout=lo1", "category": "grid", "expected_gain": "unknown", "decision": "COMPILE_FAIL", "tflops": 0.0, "timestamp": "2026-04-21T13:49:06Z"}
{"round": 609, "iter": "iter609", "bottleneck": "compile", "idea": "iter609_autogrid: BM=96 BN=96 warps=2 stages=5 indexing=pointer Ktile=32 ncol=1 layout=kmn", "category": "grid", "expected_gain": "unknown", "decision": "COMPILE_FAIL", "tflops": 0.0, "timestamp": "2026-04-21T13:49:11Z"}
{"round": 610, "iter": "iter610", "bottleneck": "compile", "idea": "iter610_autogrid: BM=96 BN=96 warps=2 stages=5 indexing=pointer Ktile=64 ncol=2 layout=mnk", "category": "grid", "expected_gain": "unknown", "decision": "COMPILE_FAIL", "tflops": 0.0, "timestamp": "2026-04-21T13:49:15Z"}
{"round": 611, "iter": "iter611", "bottleneck": "compile", "idea": "iter611_autogrid: BM=96 BN=96 warps=2 stages=5 indexing=pointer Ktile=64 ncol=2 layout=lo1", "category": "grid", "expected_gain": "unknown", "decision": "COMPILE_FAIL", "tflops": 0.0, "timestamp": "2026-04-21T13:49:20Z"}
{"round": 612, "iter": "iter612", "bottleneck": "compile", "idea": "iter612_autogrid: BM=96 BN=96 warps=2 stages=5 indexing=pointer Ktile=64 ncol=2 layout=kmn", "category": "grid", "expected_gain": "unknown", "decision": "COMPILE_FAIL", "tflops": 0.0, "timestamp": "2026-04-21T13:49:24Z"}
{"round": 613, "iter": "iter613", "bottleneck": "compile", "idea": "iter613_autogrid: BM=96 BN=96 warps=2 stages=5 indexing=pointer Ktile=128 ncol=4 layout=mnk", "category": "grid", "expected_gain": "unknown", "decision": "COMPILE_FAIL", "tflops": 0.0, "timestamp": "2026-04-21T13:49:29Z"}
{"round": 614, "iter": "iter614", "bottleneck": "compile", "idea": "iter614_autogrid: BM=96 BN=96 warps=2 stages=5 indexing=pointer Ktile=128 ncol=4 layout=lo1", "category": "grid", "expected_gain": "unknown", "decision": "COMPILE_FAIL", "tflops": 0.0, "timestamp": "2026-04-21T13:49:33Z"}
{"round": 615, "iter": "iter615", "bottleneck": "compile", "idea": "iter615_autogrid: BM=96 BN=96 warps=2 stages=5 indexing=pointer Ktile=128 ncol=4 layout=kmn", "category": "grid", "expected_gain": "unknown", "decision": "COMPILE_FAIL", "tflops": 0.0, "timestamp": "2026-04-21T13:49:38Z"}
{"round": 616, "iter": "iter616", "bottleneck": "compile", "idea": "iter616_autogrid: BM=96 BN=96 warps=2 stages=5 indexing=block_ptr Ktile=32 ncol=1 layout=mnk", "category": "grid", "expected_gain": "unknown", "decision": "COMPILE_FAIL", "tflops": 0.0, "timestamp": "2026-04-21T13:49:43Z"}
{"round": 617, "iter": "iter617", "bottleneck": "compile", "idea": "iter617_autogrid: BM=96 BN=96 warps=2 stages=5 indexing=block_ptr Ktile=32 ncol=1 layout=lo1", "category": "grid", "expected_gain": "unknown", "decision": "COMPILE_FAIL", "tflops": 0.0, "timestamp": "2026-04-21T13:49:47Z"}
{"round": 618, "iter": "iter618", "bottleneck": "compile", "idea": "iter618_autogrid: BM=96 BN=96 warps=2 stages=5 indexing=block_ptr Ktile=32 ncol=1 layout=kmn", "category": "grid", "expected_gain": "unknown", "decision": "COMPILE_FAIL", "tflops": 0.0, "timestamp": "2026-04-21T13:49:52Z"}
{"round": 619, "iter": "iter619", "bottleneck": "compile", "idea": "iter619_autogrid: BM=96 BN=96 warps=2 stages=5 indexing=block_ptr Ktile=64 ncol=2 layout=mnk", "category": "grid", "expected_gain": "unknown", "decision": "COMPILE_FAIL", "tflops": 0.0, "timestamp": "2026-04-21T13:49:56Z"}
{"round": 620, "iter": "iter620", "bottleneck": "compile", "idea": "iter620_autogrid: BM=96 BN=96 warps=2 stages=5 indexing=block_ptr Ktile=64 ncol=2 layout=lo1", "category": "grid", "expected_gain": "unknown", "decision": "COMPILE_FAIL", "tflops": 0.0, "timestamp": "2026-04-21T13:50:01Z"}
{"round": 621, "iter": "iter621", "bottleneck": "compile", "idea": "iter621_autogrid: BM=96 BN=96 warps=2 stages=5 indexing=block_ptr Ktile=64 ncol=2 layout=kmn", "category": "grid", "expected_gain": "unknown", "decision": "COMPILE_FAIL", "tflops": 0.0, "timestamp": "2026-04-21T13:50:05Z"}
{"round": 622, "iter": "iter622", "bottleneck": "compile", "idea": "iter622_autogrid: BM=96 BN=96 warps=2 stages=5 indexing=block_ptr Ktile=128 ncol=4 layout=mnk", "category": "grid", "expected_gain": "unknown", "decision": "COMPILE_FAIL", "tflops": 0.0, "timestamp": "2026-04-21T13:50:10Z"}
{"round": 623, "iter": "iter623", "bottleneck": "compile", "idea": "iter623_autogrid: BM=96 BN=96 warps=2 stages=5 indexing=block_ptr Ktile=128 ncol=4 layout=lo1", "category": "grid", "expected_gain": "unknown", "decision": "COMPILE_FAIL", "tflops": 0.0, "timestamp": "2026-04-21T13:50:14Z"}
{"round": 624, "iter": "iter624", "bottleneck": "compile", "idea": "iter624_autogrid: BM=96 BN=96 warps=2 stages=5 indexing=block_ptr Ktile=128 ncol=4 layout=kmn", "category": "grid", "expected_gain": "unknown", "decision": "COMPILE_FAIL", "tflops": 0.0, "timestamp": "2026-04-21T13:50:19Z"}
{"round": 625, "iter": "iter625", "bottleneck": "compile", "idea": "iter625_autogrid: BM=96 BN=96 warps=2 stages=6 indexing=pointer Ktile=32 ncol=1 layout=mnk", "category": "grid", "expected_gain": "unknown", "decision": "COMPILE_FAIL", "tflops": 0.0, "timestamp": "2026-04-21T13:50:23Z"}
{"round": 626, "iter": "iter626", "bottleneck": "compile", "idea": "iter626_autogrid: BM=96 BN=96 warps=2 stages=6 indexing=pointer Ktile=32 ncol=1 layout=lo1", "category": "grid", "expected_gain": "unknown", "decision": "COMPILE_FAIL", "tflops": 0.0, "timestamp": "2026-04-21T13:50:28Z"}
{"round": 627, "iter": "iter627", "bottleneck": "compile", "idea": "iter627_autogrid: BM=96 BN=96 warps=2 stages=6 indexing=pointer Ktile=32 ncol=1 layout=kmn", "category": "grid", "expected_gain": "unknown", "decision": "COMPILE_FAIL", "tflops": 0.0, "timestamp": "2026-04-21T13:50:32Z"}
{"round": 628, "iter": "iter628", "bottleneck": "compile", "idea": "iter628_autogrid: BM=96 BN=96 warps=2 stages=6 indexing=pointer Ktile=64 ncol=2 layout=mnk", "category": "grid", "expected_gain": "unknown", "decision": "COMPILE_FAIL", "tflops": 0.0, "timestamp": "2026-04-21T13:50:36Z"}
{"round": 629, "iter": "iter629", "bottleneck": "compile", "idea": "iter629_autogrid: BM=96 BN=96 warps=2 stages=6 indexing=pointer Ktile=64 ncol=2 layout=lo1", "category": "grid", "expected_gain": "unknown", "decision": "COMPILE_FAIL", "tflops": 0.0, "timestamp": "2026-04-21T13:50:41Z"}
{"round": 630, "iter": "iter630", "bottleneck": "compile", "idea": "iter630_autogrid: BM=96 BN=96 warps=2 stages=6 indexing=pointer Ktile=64 ncol=2 layout=kmn", "category": "grid", "expected_gain": "unknown", "decision": "COMPILE_FAIL", "tflops": 0.0, "timestamp": "2026-04-21T13:50:45Z"}
{"round": 631, "iter": "iter631", "bottleneck": "compile", "idea": "iter631_autogrid: BM=96 BN=96 warps=2 stages=6 indexing=pointer Ktile=128 ncol=4 layout=mnk", "category": "grid", "expected_gain": "unknown", "decision": "COMPILE_FAIL", "tflops": 0.0, "timestamp": "2026-04-21T13:50:50Z"}
{"round": 632, "iter": "iter632", "bottleneck": "compile", "idea": "iter632_autogrid: BM=96 BN=96 warps=2 stages=6 indexing=pointer Ktile=128 ncol=4 layout=lo1", "category": "grid", "expected_gain": "unknown", "decision": "COMPILE_FAIL", "tflops": 0.0, "timestamp": "2026-04-21T13:50:54Z"}
{"round": 633, "iter": "iter633", "bottleneck": "compile", "idea": "iter633_autogrid: BM=96 BN=96 warps=2 stages=6 indexing=pointer Ktile=128 ncol=4 layout=kmn", "category": "grid", "expected_gain": "unknown", "decision": "COMPILE_FAIL", "tflops": 0.0, "timestamp": "2026-04-21T13:50:59Z"}
{"round": 634, "iter": "iter634", "bottleneck": "compile", "idea": "iter634_autogrid: BM=96 BN=96 warps=2 stages=6 indexing=block_ptr Ktile=32 ncol=1 layout=mnk", "category": "grid", "expected_gain": "unknown", "decision": "COMPILE_FAIL", "tflops": 0.0, "timestamp": "2026-04-21T13:51:03Z"}
{"round": 635, "iter": "iter635", "bottleneck": "compile", "idea": "iter635_autogrid: BM=96 BN=96 warps=2 stages=6 indexing=block_ptr Ktile=32 ncol=1 layout=lo1", "category": "grid", "expected_gain": "unknown", "decision": "COMPILE_FAIL", "tflops": 0.0, "timestamp": "2026-04-21T13:51:07Z"}
{"round": 636, "iter": "iter636", "bottleneck": "compile", "idea": "iter636_autogrid: BM=96 BN=96 warps=2 stages=6 indexing=block_ptr Ktile=32 ncol=1 layout=kmn", "category": "grid", "expected_gain": "unknown", "decision": "COMPILE_FAIL", "tflops": 0.0, "timestamp": "2026-04-21T13:51:12Z"}
{"round": 637, "iter": "iter637", "bottleneck": "compile", "idea": "iter637_autogrid: BM=96 BN=96 warps=2 stages=6 indexing=block_ptr Ktile=64 ncol=2 layout=mnk", "category": "grid", "expected_gain": "unknown", "decision": "COMPILE_FAIL", "tflops": 0.0, "timestamp": "2026-04-21T13:51:16Z"}
{"round": 638, "iter": "iter638", "bottleneck": "compile", "idea": "iter638_autogrid: BM=96 BN=96 warps=2 stages=6 indexing=block_ptr Ktile=64 ncol=2 layout=lo1", "category": "grid", "expected_gain": "unknown", "decision": "COMPILE_FAIL", "tflops": 0.0, "timestamp": "2026-04-21T13:51:21Z"}
{"round": 639, "iter": "iter639", "bottleneck": "compile", "idea": "iter639_autogrid: BM=96 BN=96 warps=2 stages=6 indexing=block_ptr Ktile=64 ncol=2 layout=kmn", "category": "grid", "expected_gain": "unknown", "decision": "COMPILE_FAIL", "tflops": 0.0, "timestamp": "2026-04-21T13:51:25Z"}
{"round": 640, "iter": "iter640", "bottleneck": "compile", "idea": "iter640_autogrid: BM=96 BN=96 warps=2 stages=6 indexing=block_ptr Ktile=128 ncol=4 layout=mnk", "category": "grid", "expected_gain": "unknown", "decision": "COMPILE_FAIL", "tflops": 0.0, "timestamp": "2026-04-21T13:51:30Z"}
{"round": 641, "iter": "iter641", "bottleneck": "compile", "idea": "iter641_autogrid: BM=96 BN=96 warps=2 stages=6 indexing=block_ptr Ktile=128 ncol=4 layout=lo1", "category": "grid", "expected_gain": "unknown", "decision": "COMPILE_FAIL", "tflops": 0.0, "timestamp": "2026-04-21T13:51:35Z"}
{"round": 642, "iter": "iter642", "bottleneck": "compile", "idea": "iter642_autogrid: BM=96 BN=96 warps=2 stages=6 indexing=block_ptr Ktile=128 ncol=4 layout=kmn", "category": "grid", "expected_gain": "unknown", "decision": "COMPILE_FAIL", "tflops": 0.0, "timestamp": "2026-04-21T13:51:40Z"}
{"round": 643, "iter": "iter643", "bottleneck": "compile", "idea": "iter643_autogrid: BM=96 BN=96 warps=4 stages=3 indexing=pointer Ktile=32 ncol=1 layout=mnk", "category": "grid", "expected_gain": "unknown", "decision": "COMPILE_FAIL", "tflops": 0.0, "timestamp": "2026-04-21T13:51:44Z"}
{"round": 644, "iter": "iter644", "bottleneck": "compile", "idea": "iter644_autogrid: BM=96 BN=96 warps=4 stages=3 indexing=pointer Ktile=32 ncol=1 layout=lo1", "category": "grid", "expected_gain": "unknown", "decision": "COMPILE_FAIL", "tflops": 0.0, "timestamp": "2026-04-21T13:51:48Z"}
{"round": 645, "iter": "iter645", "bottleneck": "compile", "idea": "iter645_autogrid: BM=96 BN=96 warps=4 stages=3 indexing=pointer Ktile=32 ncol=1 layout=kmn", "category": "grid", "expected_gain": "unknown", "decision": "COMPILE_FAIL", "tflops": 0.0, "timestamp": "2026-04-21T13:51:53Z"}
{"round": 646, "iter": "iter646", "bottleneck": "compile", "idea": "iter646_autogrid: BM=96 BN=96 warps=4 stages=3 indexing=pointer Ktile=64 ncol=2 layout=kmn", "category": "grid", "expected_gain": "unknown", "decision": "COMPILE_FAIL", "tflops": 0.0, "timestamp": "2026-04-21T13:51:57Z"}
{"round": 647, "iter": "iter647", "bottleneck": "compile", "idea": "iter647_autogrid: BM=96 BN=96 warps=4 stages=3 indexing=pointer Ktile=128 ncol=4 layout=mnk", "category": "grid", "expected_gain": "unknown", "decision": "COMPILE_FAIL", "tflops": 0.0, "timestamp": "2026-04-21T13:52:01Z"}
{"round": 648, "iter": "iter648", "bottleneck": "compile", "idea": "iter648_autogrid: BM=96 BN=96 warps=4 stages=3 indexing=pointer Ktile=128 ncol=4 layout=lo1", "category": "grid", "expected_gain": "unknown", "decision": "COMPILE_FAIL", "tflops": 0.0, "timestamp": "2026-04-21T13:52:06Z"}
{"round": 649, "iter": "iter649", "bottleneck": "compile", "idea": "iter649_autogrid: BM=96 BN=96 warps=4 stages=3 indexing=pointer Ktile=128 ncol=4 layout=kmn", "category": "grid", "expected_gain": "unknown", "decision": "COMPILE_FAIL", "tflops": 0.0, "timestamp": "2026-04-21T13:52:10Z"}
{"round": 650, "iter": "iter650", "bottleneck": "compile", "idea": "iter650_autogrid: BM=96 BN=96 warps=4 stages=3 indexing=block_ptr Ktile=32 ncol=1 layout=mnk", "category": "grid", "expected_gain": "unknown", "decision": "COMPILE_FAIL", "tflops": 0.0, "timestamp": "2026-04-21T13:52:14Z"}
{"round": 651, "iter": "iter651", "bottleneck": "compile", "idea": "iter651_autogrid: BM=96 BN=96 warps=4 stages=3 indexing=block_ptr Ktile=32 ncol=1 layout=lo1", "category": "grid", "expected_gain": "unknown", "decision": "COMPILE_FAIL", "tflops": 0.0, "timestamp": "2026-04-21T13:52:19Z"}
{"round": 652, "iter": "iter652", "bottleneck": "compile", "idea": "iter652_autogrid: BM=96 BN=96 warps=4 stages=3 indexing=block_ptr Ktile=32 ncol=1 layout=kmn", "category": "grid", "expected_gain": "unknown", "decision": "COMPILE_FAIL", "tflops": 0.0, "timestamp": "2026-04-21T13:52:24Z"}
{"round": 653, "iter": "iter653", "bottleneck": "compile", "idea": "iter653_autogrid: BM=96 BN=96 warps=4 stages=3 indexing=block_ptr Ktile=64 ncol=2 layout=mnk", "category": "grid", "expected_gain": "unknown", "decision": "COMPILE_FAIL", "tflops": 0.0, "timestamp": "2026-04-21T13:52:28Z"}
{"round": 654, "iter": "iter654", "bottleneck": "compile", "idea": "iter654_autogrid: BM=96 BN=96 warps=4 stages=3 indexing=block_ptr Ktile=64 ncol=2 layout=lo1", "category": "grid", "expected_gain": "unknown", "decision": "COMPILE_FAIL", "tflops": 0.0, "timestamp": "2026-04-21T13:52:32Z"}
{"round": 655, "iter": "iter655", "bottleneck": "compile", "idea": "iter655_autogrid: BM=96 BN=96 warps=4 stages=3 indexing=block_ptr Ktile=64 ncol=2 layout=kmn", "category": "grid", "expected_gain": "unknown", "decision": "COMPILE_FAIL", "tflops": 0.0, "timestamp": "2026-04-21T13:52:36Z"}
{"round": 656, "iter": "iter656", "bottleneck": "compile", "idea": "iter656_autogrid: BM=96 BN=96 warps=4 stages=3 indexing=block_ptr Ktile=128 ncol=4 layout=mnk", "category": "grid", "expected_gain": "unknown", "decision": "COMPILE_FAIL", "tflops": 0.0, "timestamp": "2026-04-21T13:52:41Z"}
{"round": 657, "iter": "iter657", "bottleneck": "compile", "idea": "iter657_autogrid: BM=96 BN=96 warps=4 stages=3 indexing=block_ptr Ktile=128 ncol=4 layout=lo1", "category": "grid", "expected_gain": "unknown", "decision": "COMPILE_FAIL", "tflops": 0.0, "timestamp": "2026-04-21T13:52:45Z"}
{"round": 658, "iter": "iter658", "bottleneck": "compile", "idea": "iter658_autogrid: BM=96 BN=96 warps=4 stages=3 indexing=block_ptr Ktile=128 ncol=4 layout=kmn", "category": "grid", "expected_gain": "unknown", "decision": "COMPILE_FAIL", "tflops": 0.0, "timestamp": "2026-04-21T13:52:50Z"}
{"round": 659, "iter": "iter659", "bottleneck": "compile", "idea": "iter659_autogrid: BM=96 BN=96 warps=4 stages=4 indexing=pointer Ktile=32 ncol=1 layout=mnk", "category": "grid", "expected_gain": "unknown", "decision": "COMPILE_FAIL", "tflops": 0.0, "timestamp": "2026-04-21T13:52:54Z"}
{"round": 660, "iter": "iter660", "bottleneck": "compile", "idea": "iter660_autogrid: BM=96 BN=96 warps=4 stages=4 indexing=pointer Ktile=32 ncol=1 layout=lo1", "category": "grid", "expected_gain": "unknown", "decision": "COMPILE_FAIL", "tflops": 0.0, "timestamp": "2026-04-21T13:52:59Z"}
{"round": 661, "iter": "iter661", "bottleneck": "compile", "idea": "iter661_autogrid: BM=96 BN=96 warps=4 stages=4 indexing=pointer Ktile=32 ncol=1 layout=kmn", "category": "grid", "expected_gain": "unknown", "decision": "COMPILE_FAIL", "tflops": 0.0, "timestamp": "2026-04-21T13:53:03Z"}
{"round": 662, "iter": "iter662", "bottleneck": "compile", "idea": "iter662_autogrid: BM=96 BN=96 warps=4 stages=4 indexing=pointer Ktile=64 ncol=2 layout=mnk", "category": "grid", "expected_gain": "unknown", "decision": "COMPILE_FAIL", "tflops": 0.0, "timestamp": "2026-04-21T13:53:07Z"}
