{"round": 366, "iter": "iter366", "bottleneck": "compile", "idea": "iter366_autogrid: BM=128 BN=128 warps=2 stages=3 indexing=pointer Ktile=32 ncol=1 layout=kmn", "category": "grid", "expected_gain": "unknown", "decision": "COMPILE_FAIL", "tflops": 0.0, "timestamp": "2026-04-21T13:13:40Z"}
{"round": 367, "iter": "iter367", "bottleneck": "compute_bound", "idea": "iter367_autogrid: BM=128 BN=128 warps=2 stages=3 indexing=pointer Ktile=64 ncol=2 layout=lo1", "category": "grid", "expected_gain": "unknown", "decision": "DISCARD", "tflops": 1.04, "timestamp": "2026-04-21T13:14:03Z"}
{"round": 368, "iter": "iter368", "bottleneck": "compile", "idea": "iter368_autogrid: BM=128 BN=128 warps=2 stages=3 indexing=pointer Ktile=64 ncol=2 layout=kmn", "category": "grid", "expected_gain": "unknown", "decision": "COMPILE_FAIL", "tflops": 0.0, "timestamp": "2026-04-21T13:14:08Z"}
{"round": 369, "iter": "iter369", "bottleneck": "compute_bound", "idea": "iter369_autogrid: BM=128 BN=128 warps=2 stages=3 indexing=pointer Ktile=128 ncol=4 layout=mnk", "category": "grid", "expected_gain": "unknown", "decision": "DISCARD", "tflops": 0.74, "timestamp": "2026-04-21T13:14:41Z"}
{"round": 370, "iter": "iter370", "bottleneck": "compute_bound", "idea": "iter370_autogrid: BM=128 BN=128 warps=2 stages=3 indexing=pointer Ktile=128 ncol=4 layout=lo1", "category": "grid", "expected_gain": "unknown", "decision": "DISCARD", "tflops": 0.62, "timestamp": "2026-04-21T13:15:18Z"}
{"round": 371, "iter": "iter371", "bottleneck": "compile", "idea": "iter371_autogrid: BM=128 BN=128 warps=2 stages=3 indexing=pointer Ktile=128 ncol=4 layout=kmn", "category": "grid", "expected_gain": "unknown", "decision": "COMPILE_FAIL", "tflops": 0.0, "timestamp": "2026-04-21T13:15:23Z"}
{"round": 372, "iter": "iter372", "bottleneck": "compute_bound", "idea": "iter372_autogrid: BM=128 BN=128 warps=2 stages=3 indexing=block_ptr Ktile=32 ncol=1 layout=mnk", "category": "grid", "expected_gain": "unknown", "decision": "DISCARD", "tflops": 1.08, "timestamp": "2026-04-21T13:15:46Z"}
{"round": 373, "iter": "iter373", "bottleneck": "compute_bound", "idea": "iter373_autogrid: BM=128 BN=128 warps=2 stages=3 indexing=block_ptr Ktile=32 ncol=1 layout=lo1", "category": "grid", "expected_gain": "unknown", "decision": "DISCARD", "tflops": 1.45, "timestamp": "2026-04-21T13:16:04Z"}
{"round": 374, "iter": "iter374", "bottleneck": "compile", "idea": "iter374_autogrid: BM=128 BN=128 warps=2 stages=3 indexing=block_ptr Ktile=32 ncol=1 layout=kmn", "category": "grid", "expected_gain": "unknown", "decision": "COMPILE_FAIL", "tflops": 0.0, "timestamp": "2026-04-21T13:16:09Z"}
{"round": 375, "iter": "iter375", "bottleneck": "compute_bound", "idea": "iter375_autogrid: BM=128 BN=128 warps=2 stages=3 indexing=block_ptr Ktile=64 ncol=2 layout=lo1", "category": "grid", "expected_gain": "unknown", "decision": "DISCARD", "tflops": 9.02, "timestamp": "2026-04-21T13:16:18Z"}
{"round": 376, "iter": "iter376", "bottleneck": "compile", "idea": "iter376_autogrid: BM=128 BN=128 warps=2 stages=3 indexing=block_ptr Ktile=64 ncol=2 layout=kmn", "category": "grid", "expected_gain": "unknown", "decision": "COMPILE_FAIL", "tflops": 0.0, "timestamp": "2026-04-21T13:16:23Z"}
{"round": 377, "iter": "iter377", "bottleneck": "compute_bound", "idea": "iter377_autogrid: BM=128 BN=128 warps=2 stages=3 indexing=block_ptr Ktile=128 ncol=4 layout=mnk", "category": "grid", "expected_gain": "unknown", "decision": "DISCARD", "tflops": 0.7, "timestamp": "2026-04-21T13:16:57Z"}
{"round": 378, "iter": "iter378", "bottleneck": "compute_bound", "idea": "iter378_autogrid: BM=128 BN=128 warps=2 stages=3 indexing=block_ptr Ktile=128 ncol=4 layout=lo1", "category": "grid", "expected_gain": "unknown", "decision": "DISCARD", "tflops": 0.95, "timestamp": "2026-04-21T13:17:25Z"}
{"round": 379, "iter": "iter379", "bottleneck": "compile", "idea": "iter379_autogrid: BM=128 BN=128 warps=2 stages=3 indexing=block_ptr Ktile=128 ncol=4 layout=kmn", "category": "grid", "expected_gain": "unknown", "decision": "COMPILE_FAIL", "tflops": 0.0, "timestamp": "2026-04-21T13:17:30Z"}
{"round": 380, "iter": "iter380", "bottleneck": "compute_bound", "idea": "iter380_autogrid: BM=128 BN=128 warps=2 stages=4 indexing=pointer Ktile=32 ncol=1 layout=mnk", "category": "grid", "expected_gain": "unknown", "decision": "DISCARD", "tflops": 1.52, "timestamp": "2026-04-21T13:17:48Z"}
{"round": 381, "iter": "iter381", "bottleneck": "compute_bound", "idea": "iter381_autogrid: BM=128 BN=128 warps=2 stages=4 indexing=pointer Ktile=32 ncol=1 layout=lo1", "category": "grid", "expected_gain": "unknown", "decision": "DISCARD", "tflops": 1.55, "timestamp": "2026-04-21T13:18:05Z"}
{"round": 382, "iter": "iter382", "bottleneck": "compile", "idea": "iter382_autogrid: BM=128 BN=128 warps=2 stages=4 indexing=pointer Ktile=32 ncol=1 layout=kmn", "category": "grid", "expected_gain": "unknown", "decision": "COMPILE_FAIL", "tflops": 0.0, "timestamp": "2026-04-21T13:18:10Z"}
{"round": 383, "iter": "iter383", "bottleneck": "compute_bound", "idea": "iter383_autogrid: BM=128 BN=128 warps=2 stages=4 indexing=pointer Ktile=64 ncol=2 layout=lo1", "category": "grid", "expected_gain": "unknown", "decision": "DISCARD", "tflops": 1.45, "timestamp": "2026-04-21T13:18:29Z"}
{"round": 384, "iter": "iter384", "bottleneck": "compile", "idea": "iter384_autogrid: BM=128 BN=128 warps=2 stages=4 indexing=pointer Ktile=64 ncol=2 layout=kmn", "category": "grid", "expected_gain": "unknown", "decision": "COMPILE_FAIL", "tflops": 0.0, "timestamp": "2026-04-21T13:18:33Z"}
{"round": 385, "iter": "iter385", "bottleneck": "compute_bound", "idea": "iter385_autogrid: BM=128 BN=128 warps=2 stages=4 indexing=pointer Ktile=128 ncol=4 layout=mnk", "category": "grid", "expected_gain": "unknown", "decision": "DISCARD", "tflops": 0.83, "timestamp": "2026-04-21T13:19:04Z"}
{"round": 386, "iter": "iter386", "bottleneck": "compute_bound", "idea": "iter386_autogrid: BM=128 BN=128 warps=2 stages=4 indexing=pointer Ktile=128 ncol=4 layout=lo1", "category": "grid", "expected_gain": "unknown", "decision": "DISCARD", "tflops": 0.83, "timestamp": "2026-04-21T13:19:35Z"}
{"round": 387, "iter": "iter387", "bottleneck": "compile", "idea": "iter387_autogrid: BM=128 BN=128 warps=2 stages=4 indexing=pointer Ktile=128 ncol=4 layout=kmn", "category": "grid", "expected_gain": "unknown", "decision": "COMPILE_FAIL", "tflops": 0.0, "timestamp": "2026-04-21T13:19:39Z"}
{"round": 388, "iter": "iter388", "bottleneck": "compute_bound", "idea": "iter388_autogrid: BM=128 BN=128 warps=2 stages=4 indexing=block_ptr Ktile=32 ncol=1 layout=mnk", "category": "grid", "expected_gain": "unknown", "decision": "DISCARD", "tflops": 1.47, "timestamp": "2026-04-21T13:19:57Z"}
{"round": 389, "iter": "iter389", "bottleneck": "compute_bound", "idea": "iter389_autogrid: BM=128 BN=128 warps=2 stages=4 indexing=block_ptr Ktile=32 ncol=1 layout=lo1", "category": "grid", "expected_gain": "unknown", "decision": "DISCARD", "tflops": 1.48, "timestamp": "2026-04-21T13:20:15Z"}
{"round": 390, "iter": "iter390", "bottleneck": "compile", "idea": "iter390_autogrid: BM=128 BN=128 warps=2 stages=4 indexing=block_ptr Ktile=32 ncol=1 layout=kmn", "category": "grid", "expected_gain": "unknown", "decision": "COMPILE_FAIL", "tflops": 0.0, "timestamp": "2026-04-21T13:20:19Z"}
{"round": 391, "iter": "iter391", "bottleneck": "compute_bound", "idea": "iter391_autogrid: BM=128 BN=128 warps=2 stages=4 indexing=block_ptr Ktile=64 ncol=2 layout=mnk", "category": "grid", "expected_gain": "unknown", "decision": "DISCARD", "tflops": 10.32, "timestamp": "2026-04-21T13:20:28Z"}
{"round": 392, "iter": "iter392", "bottleneck": "compute_bound", "idea": "iter392_autogrid: BM=128 BN=128 warps=2 stages=4 indexing=block_ptr Ktile=64 ncol=2 layout=lo1", "category": "grid", "expected_gain": "unknown", "decision": "DISCARD", "tflops": 10.95, "timestamp": "2026-04-21T13:20:36Z"}
{"round": 393, "iter": "iter393", "bottleneck": "compile", "idea": "iter393_autogrid: BM=128 BN=128 warps=2 stages=4 indexing=block_ptr Ktile=64 ncol=2 layout=kmn", "category": "grid", "expected_gain": "unknown", "decision": "COMPILE_FAIL", "tflops": 0.0, "timestamp": "2026-04-21T13:20:41Z"}
{"round": 394, "iter": "iter394", "bottleneck": "compute_bound", "idea": "iter394_autogrid: BM=128 BN=128 warps=2 stages=4 indexing=block_ptr Ktile=128 ncol=4 layout=mnk", "category": "grid", "expected_gain": "unknown", "decision": "DISCARD", "tflops": 0.84, "timestamp": "2026-04-21T13:21:12Z"}
{"round": 395, "iter": "iter395", "bottleneck": "compute_bound", "idea": "iter395_autogrid: BM=128 BN=128 warps=2 stages=4 indexing=block_ptr Ktile=128 ncol=4 layout=lo1", "category": "grid", "expected_gain": "unknown", "decision": "DISCARD", "tflops": 0.84, "timestamp": "2026-04-21T13:21:43Z"}
{"round": 396, "iter": "iter396", "bottleneck": "compile", "idea": "iter396_autogrid: BM=128 BN=128 warps=2 stages=4 indexing=block_ptr Ktile=128 ncol=4 layout=kmn", "category": "grid", "expected_gain": "unknown", "decision": "COMPILE_FAIL", "tflops": 0.0, "timestamp": "2026-04-21T13:21:48Z"}
{"round": 397, "iter": "iter397", "bottleneck": "compute_bound", "idea": "iter397_autogrid: BM=128 BN=128 warps=2 stages=5 indexing=pointer Ktile=32 ncol=1 layout=mnk", "category": "grid", "expected_gain": "unknown", "decision": "DISCARD", "tflops": 1.44, "timestamp": "2026-04-21T13:22:06Z"}
{"round": 398, "iter": "iter398", "bottleneck": "compute_bound", "idea": "iter398_autogrid: BM=128 BN=128 warps=2 stages=5 indexing=pointer Ktile=32 ncol=1 layout=lo1", "category": "grid", "expected_gain": "unknown", "decision": "DISCARD", "tflops": 1.48, "timestamp": "2026-04-21T13:22:23Z"}
{"round": 399, "iter": "iter399", "bottleneck": "compile", "idea": "iter399_autogrid: BM=128 BN=128 warps=2 stages=5 indexing=pointer Ktile=32 ncol=1 layout=kmn", "category": "grid", "expected_gain": "unknown", "decision": "COMPILE_FAIL", "tflops": 0.0, "timestamp": "2026-04-21T13:22:28Z"}
{"round": 400, "iter": "iter400", "bottleneck": "compute_bound", "idea": "iter400_autogrid: BM=128 BN=128 warps=2 stages=5 indexing=pointer Ktile=64 ncol=2 layout=mnk", "category": "grid", "expected_gain": "unknown", "decision": "DISCARD", "tflops": 1.42, "timestamp": "2026-04-21T13:22:47Z"}
{"round": 401, "iter": "iter401", "bottleneck": "compute_bound", "idea": "iter401_autogrid: BM=128 BN=128 warps=2 stages=5 indexing=pointer Ktile=64 ncol=2 layout=lo1", "category": "grid", "expected_gain": "unknown", "decision": "DISCARD", "tflops": 1.41, "timestamp": "2026-04-21T13:23:06Z"}
{"round": 402, "iter": "iter402", "bottleneck": "compile", "idea": "iter402_autogrid: BM=128 BN=128 warps=2 stages=5 indexing=pointer Ktile=64 ncol=2 layout=kmn", "category": "grid", "expected_gain": "unknown", "decision": "COMPILE_FAIL", "tflops": 0.0, "timestamp": "2026-04-21T13:23:11Z"}
{"round": 403, "iter": "iter403", "bottleneck": "compute_bound", "idea": "iter403_autogrid: BM=128 BN=128 warps=2 stages=5 indexing=pointer Ktile=128 ncol=4 layout=mnk", "category": "grid", "expected_gain": "unknown", "decision": "DISCARD", "tflops": 0.56, "timestamp": "2026-04-21T13:23:51Z"}
{"round": 404, "iter": "iter404", "bottleneck": "compute_bound", "idea": "iter404_autogrid: BM=128 BN=128 warps=2 stages=5 indexing=pointer Ktile=128 ncol=4 layout=lo1", "category": "grid", "expected_gain": "unknown", "decision": "DISCARD", "tflops": 0.57, "timestamp": "2026-04-21T13:24:32Z"}
{"round": 405, "iter": "iter405", "bottleneck": "compile", "idea": "iter405_autogrid: BM=128 BN=128 warps=2 stages=5 indexing=pointer Ktile=128 ncol=4 layout=kmn", "category": "grid", "expected_gain": "unknown", "decision": "COMPILE_FAIL", "tflops": 0.0, "timestamp": "2026-04-21T13:24:36Z"}
{"round": 406, "iter": "iter406", "bottleneck": "compute_bound", "idea": "iter406_autogrid: BM=128 BN=128 warps=2 stages=5 indexing=block_ptr Ktile=32 ncol=1 layout=mnk", "category": "grid", "expected_gain": "unknown", "decision": "DISCARD", "tflops": 1.42, "timestamp": "2026-04-21T13:24:54Z"}
{"round": 407, "iter": "iter407", "bottleneck": "compute_bound", "idea": "iter407_autogrid: BM=128 BN=128 warps=2 stages=5 indexing=block_ptr Ktile=32 ncol=1 layout=lo1", "category": "grid", "expected_gain": "unknown", "decision": "DISCARD", "tflops": 1.44, "timestamp": "2026-04-21T13:25:12Z"}
{"round": 408, "iter": "iter408", "bottleneck": "compile", "idea": "iter408_autogrid: BM=128 BN=128 warps=2 stages=5 indexing=block_ptr Ktile=32 ncol=1 layout=kmn", "category": "grid", "expected_gain": "unknown", "decision": "COMPILE_FAIL", "tflops": 0.0, "timestamp": "2026-04-21T13:25:17Z"}
{"round": 409, "iter": "iter409", "bottleneck": "compute_bound", "idea": "iter409_autogrid: BM=128 BN=128 warps=2 stages=5 indexing=block_ptr Ktile=64 ncol=2 layout=mnk", "category": "grid", "expected_gain": "unknown", "decision": "DISCARD", "tflops": 12.69, "timestamp": "2026-04-21T13:25:25Z"}
{"round": 410, "iter": "iter410", "bottleneck": "compute_bound", "idea": "iter410_autogrid: BM=128 BN=128 warps=2 stages=5 indexing=block_ptr Ktile=64 ncol=2 layout=lo1", "category": "grid", "expected_gain": "unknown", "decision": "DISCARD", "tflops": 13.99, "timestamp": "2026-04-21T13:25:34Z"}
{"round": 411, "iter": "iter411", "bottleneck": "compile", "idea": "iter411_autogrid: BM=128 BN=128 warps=2 stages=5 indexing=block_ptr Ktile=64 ncol=2 layout=kmn", "category": "grid", "expected_gain": "unknown", "decision": "COMPILE_FAIL", "tflops": 0.0, "timestamp": "2026-04-21T13:25:38Z"}
{"round": 412, "iter": "iter412", "bottleneck": "compute_bound", "idea": "iter412_autogrid: BM=128 BN=128 warps=2 stages=5 indexing=block_ptr Ktile=128 ncol=4 layout=mnk", "category": "grid", "expected_gain": "unknown", "decision": "DISCARD", "tflops": 0.58, "timestamp": "2026-04-21T13:26:18Z"}
{"round": 413, "iter": "iter413", "bottleneck": "compute_bound", "idea": "iter413_autogrid: BM=128 BN=128 warps=2 stages=5 indexing=block_ptr Ktile=128 ncol=4 layout=lo1", "category": "grid", "expected_gain": "unknown", "decision": "DISCARD", "tflops": 0.58, "timestamp": "2026-04-21T13:26:58Z"}
{"round": 414, "iter": "iter414", "bottleneck": "compile", "idea": "iter414_autogrid: BM=128 BN=128 warps=2 stages=5 indexing=block_ptr Ktile=128 ncol=4 layout=kmn", "category": "grid", "expected_gain": "unknown", "decision": "COMPILE_FAIL", "tflops": 0.0, "timestamp": "2026-04-21T13:27:02Z"}
{"round": 415, "iter": "iter415", "bottleneck": "compute_bound", "idea": "iter415_autogrid: BM=128 BN=128 warps=2 stages=6 indexing=pointer Ktile=32 ncol=1 layout=mnk", "category": "grid", "expected_gain": "unknown", "decision": "DISCARD", "tflops": 1.39, "timestamp": "2026-04-21T13:27:20Z"}
{"round": 416, "iter": "iter416", "bottleneck": "compute_bound", "idea": "iter416_autogrid: BM=128 BN=128 warps=2 stages=6 indexing=pointer Ktile=32 ncol=1 layout=lo1", "category": "grid", "expected_gain": "unknown", "decision": "DISCARD", "tflops": 1.44, "timestamp": "2026-04-21T13:27:38Z"}
{"round": 417, "iter": "iter417", "bottleneck": "compile", "idea": "iter417_autogrid: BM=128 BN=128 warps=2 stages=6 indexing=pointer Ktile=32 ncol=1 layout=kmn", "category": "grid", "expected_gain": "unknown", "decision": "COMPILE_FAIL", "tflops": 0.0, "timestamp": "2026-04-21T13:27:43Z"}
{"round": 418, "iter": "iter418", "bottleneck": "compute_bound", "idea": "iter418_autogrid: BM=128 BN=128 warps=2 stages=6 indexing=pointer Ktile=64 ncol=2 layout=mnk", "category": "grid", "expected_gain": "unknown", "decision": "DISCARD", "tflops": 1.27, "timestamp": "2026-04-21T13:28:03Z"}
{"round": 419, "iter": "iter419", "bottleneck": "compute_bound", "idea": "iter419_autogrid: BM=128 BN=128 warps=2 stages=6 indexing=pointer Ktile=64 ncol=2 layout=lo1", "category": "grid", "expected_gain": "unknown", "decision": "DISCARD", "tflops": 1.25, "timestamp": "2026-04-21T13:28:24Z"}
{"round": 420, "iter": "iter420", "bottleneck": "compile", "idea": "iter420_autogrid: BM=128 BN=128 warps=2 stages=6 indexing=pointer Ktile=64 ncol=2 layout=kmn", "category": "grid", "expected_gain": "unknown", "decision": "COMPILE_FAIL", "tflops": 0.0, "timestamp": "2026-04-21T13:28:29Z"}
{"round": 421, "iter": "iter421", "bottleneck": "compute_bound", "idea": "iter421_autogrid: BM=128 BN=128 warps=2 stages=6 indexing=pointer Ktile=128 ncol=4 layout=mnk", "category": "grid", "expected_gain": "unknown", "decision": "DISCARD", "tflops": 0.57, "timestamp": "2026-04-21T13:29:09Z"}
{"round": 422, "iter": "iter422", "bottleneck": "compute_bound", "idea": "iter422_autogrid: BM=128 BN=128 warps=2 stages=6 indexing=pointer Ktile=128 ncol=4 layout=lo1", "category": "grid", "expected_gain": "unknown", "decision": "DISCARD", "tflops": 0.56, "timestamp": "2026-04-21T13:29:50Z"}
{"round": 423, "iter": "iter423", "bottleneck": "compile", "idea": "iter423_autogrid: BM=128 BN=128 warps=2 stages=6 indexing=pointer Ktile=128 ncol=4 layout=kmn", "category": "grid", "expected_gain": "unknown", "decision": "COMPILE_FAIL", "tflops": 0.0, "timestamp": "2026-04-21T13:29:55Z"}
{"round": 424, "iter": "iter424", "bottleneck": "compute_bound", "idea": "iter424_autogrid: BM=128 BN=128 warps=2 stages=6 indexing=block_ptr Ktile=32 ncol=1 layout=mnk", "category": "grid", "expected_gain": "unknown", "decision": "DISCARD", "tflops": 1.38, "timestamp": "2026-04-21T13:30:14Z"}
{"round": 425, "iter": "iter425", "bottleneck": "compute_bound", "idea": "iter425_autogrid: BM=128 BN=128 warps=2 stages=6 indexing=block_ptr Ktile=32 ncol=1 layout=lo1", "category": "grid", "expected_gain": "unknown", "decision": "DISCARD", "tflops": 1.41, "timestamp": "2026-04-21T13:30:32Z"}
{"round": 426, "iter": "iter426", "bottleneck": "compile", "idea": "iter426_autogrid: BM=128 BN=128 warps=2 stages=6 indexing=block_ptr Ktile=32 ncol=1 layout=kmn", "category": "grid", "expected_gain": "unknown", "decision": "COMPILE_FAIL", "tflops": 0.0, "timestamp": "2026-04-21T13:30:37Z"}
{"round": 427, "iter": "iter427", "bottleneck": "compute_bound", "idea": "iter427_autogrid: BM=128 BN=128 warps=2 stages=6 indexing=block_ptr Ktile=64 ncol=2 layout=mnk", "category": "grid", "expected_gain": "unknown", "decision": "DISCARD", "tflops": 16.49, "timestamp": "2026-04-21T13:30:45Z"}
{"round": 428, "iter": "iter428", "bottleneck": "compute_bound", "idea": "iter428_autogrid: BM=128 BN=128 warps=2 stages=6 indexing=block_ptr Ktile=64 ncol=2 layout=lo1", "category": "grid", "expected_gain": "unknown", "decision": "DISCARD", "tflops": 17.18, "timestamp": "2026-04-21T13:30:53Z"}
{"round": 429, "iter": "iter429", "bottleneck": "compile", "idea": "iter429_autogrid: BM=128 BN=128 warps=2 stages=6 indexing=block_ptr Ktile=64 ncol=2 layout=kmn", "category": "grid", "expected_gain": "unknown", "decision": "COMPILE_FAIL", "tflops": 0.0, "timestamp": "2026-04-21T13:30:58Z"}
{"round": 430, "iter": "iter430", "bottleneck": "compute_bound", "idea": "iter430_autogrid: BM=128 BN=128 warps=2 stages=6 indexing=block_ptr Ktile=128 ncol=4 layout=mnk", "category": "grid", "expected_gain": "unknown", "decision": "DISCARD", "tflops": 0.57, "timestamp": "2026-04-21T13:31:37Z"}
{"round": 431, "iter": "iter431", "bottleneck": "compute_bound", "idea": "iter431_autogrid: BM=128 BN=128 warps=2 stages=6 indexing=block_ptr Ktile=128 ncol=4 layout=lo1", "category": "grid", "expected_gain": "unknown", "decision": "DISCARD", "tflops": 0.57, "timestamp": "2026-04-21T13:32:17Z"}
{"round": 432, "iter": "iter432", "bottleneck": "compile", "idea": "iter432_autogrid: BM=128 BN=128 warps=2 stages=6 indexing=block_ptr Ktile=128 ncol=4 layout=kmn", "category": "grid", "expected_gain": "unknown", "decision": "COMPILE_FAIL", "tflops": 0.0, "timestamp": "2026-04-21T13:32:22Z"}
{"round": 433, "iter": "iter433", "bottleneck": "compute_bound", "idea": "iter433_autogrid: BM=128 BN=128 warps=4 stages=3 indexing=pointer Ktile=32 ncol=1 layout=mnk", "category": "grid", "expected_gain": "unknown", "decision": "DISCARD", "tflops": 59.11, "timestamp": "2026-04-21T13:32:28Z"}
{"round": 434, "iter": "iter434", "bottleneck": "compute_bound", "idea": "iter434_autogrid: BM=128 BN=128 warps=4 stages=3 indexing=pointer Ktile=32 ncol=1 layout=lo1", "category": "grid", "expected_gain": "unknown", "decision": "DISCARD", "tflops": 57.79, "timestamp": "2026-04-21T13:32:34Z"}
{"round": 435, "iter": "iter435", "bottleneck": "compile", "idea": "iter435_autogrid: BM=128 BN=128 warps=4 stages=3 indexing=pointer Ktile=32 ncol=1 layout=kmn", "category": "grid", "expected_gain": "unknown", "decision": "COMPILE_FAIL", "tflops": 0.0, "timestamp": "2026-04-21T13:32:39Z"}
{"round": 436, "iter": "iter436", "bottleneck": "compute_bound", "idea": "iter436_autogrid: BM=128 BN=128 warps=4 stages=3 indexing=pointer Ktile=64 ncol=2 layout=mnk", "category": "grid", "expected_gain": "unknown", "decision": "DISCARD", "tflops": 73.74, "timestamp": "2026-04-21T13:32:45Z"}
{"round": 437, "iter": "iter437", "bottleneck": "compute_bound", "idea": "iter437_autogrid: BM=128 BN=128 warps=4 stages=3 indexing=pointer Ktile=64 ncol=2 layout=lo1", "category": "grid", "expected_gain": "unknown", "decision": "DISCARD", "tflops": 70.12, "timestamp": "2026-04-21T13:32:51Z"}
{"round": 438, "iter": "iter438", "bottleneck": "compute_bound", "idea": "iter438_autogrid: BM=128 BN=128 warps=4 stages=3 indexing=pointer Ktile=128 ncol=4 layout=mnk", "category": "grid", "expected_gain": "unknown", "decision": "DISCARD", "tflops": 59.62, "timestamp": "2026-04-21T13:32:58Z"}
{"round": 439, "iter": "iter439", "bottleneck": "compute_bound", "idea": "iter439_autogrid: BM=128 BN=128 warps=4 stages=3 indexing=pointer Ktile=128 ncol=4 layout=lo1", "category": "grid", "expected_gain": "unknown", "decision": "DISCARD", "tflops": 58.72, "timestamp": "2026-04-21T13:33:05Z"}
