{"round": 158, "iter": "iter158", "bottleneck": "compute_bound", "idea": "iter158_autogrid: BM=128 BN=128 warps=16 stages=2 indexing=pointer Ktile=32 ncol=1", "category": "grid", "expected_gain": "unknown", "decision": "DISCARD", "tflops": 46.12, "timestamp": "2026-04-21T12:36:24Z"}
{"round": 159, "iter": "iter159", "bottleneck": "compute_bound", "idea": "iter159_autogrid: BM=128 BN=128 warps=16 stages=2 indexing=pointer Ktile=64 ncol=2", "category": "grid", "expected_gain": "unknown", "decision": "DISCARD", "tflops": 67.17, "timestamp": "2026-04-21T12:36:30Z"}
{"round": 160, "iter": "iter160", "bottleneck": "compute_bound", "idea": "iter160_autogrid: BM=128 BN=128 warps=16 stages=2 indexing=pointer Ktile=128 ncol=4", "category": "grid", "expected_gain": "unknown", "decision": "DISCARD", "tflops": 95.66, "timestamp": "2026-04-21T12:36:36Z"}
{"round": 161, "iter": "iter161", "bottleneck": "compute_bound", "idea": "iter161_autogrid: BM=128 BN=128 warps=16 stages=3 indexing=block_ptr Ktile=32 ncol=1", "category": "grid", "expected_gain": "unknown", "decision": "DISCARD", "tflops": 50.52, "timestamp": "2026-04-21T12:36:41Z"}
{"round": 162, "iter": "iter162", "bottleneck": "compute_bound", "idea": "iter162_autogrid: BM=128 BN=128 warps=16 stages=3 indexing=block_ptr Ktile=64 ncol=2", "category": "grid", "expected_gain": "unknown", "decision": "DISCARD", "tflops": 73.96, "timestamp": "2026-04-21T12:36:47Z"}
{"round": 163, "iter": "iter163", "bottleneck": "compute_bound", "idea": "iter163_autogrid: BM=128 BN=128 warps=16 stages=3 indexing=block_ptr Ktile=128 ncol=4", "category": "grid", "expected_gain": "unknown", "decision": "DISCARD", "tflops": 106.38, "timestamp": "2026-04-21T12:36:52Z"}
{"round": 164, "iter": "iter164", "bottleneck": "compute_bound", "idea": "iter164_autogrid: BM=128 BN=128 warps=16 stages=3 indexing=pointer Ktile=32 ncol=1", "category": "grid", "expected_gain": "unknown", "decision": "DISCARD", "tflops": 52.49, "timestamp": "2026-04-21T12:36:58Z"}
{"round": 165, "iter": "iter165", "bottleneck": "compute_bound", "idea": "iter165_autogrid: BM=128 BN=128 warps=16 stages=3 indexing=pointer Ktile=64 ncol=2", "category": "grid", "expected_gain": "unknown", "decision": "DISCARD", "tflops": 75.84, "timestamp": "2026-04-21T12:37:04Z"}
{"round": 166, "iter": "iter166", "bottleneck": "compute_bound", "idea": "iter166_autogrid: BM=128 BN=128 warps=16 stages=3 indexing=pointer Ktile=128 ncol=4", "category": "grid", "expected_gain": "unknown", "decision": "DISCARD", "tflops": 100.22, "timestamp": "2026-04-21T12:37:09Z"}
{"round": 167, "iter": "iter167", "bottleneck": "compute_bound", "idea": "iter167_autogrid: BM=128 BN=128 warps=16 stages=4 indexing=block_ptr Ktile=32 ncol=1", "category": "grid", "expected_gain": "unknown", "decision": "DISCARD", "tflops": 50.16, "timestamp": "2026-04-21T12:37:15Z"}
{"round": 168, "iter": "iter168", "bottleneck": "compute_bound", "idea": "iter168_autogrid: BM=128 BN=128 warps=16 stages=4 indexing=block_ptr Ktile=64 ncol=2", "category": "grid", "expected_gain": "unknown", "decision": "DISCARD", "tflops": 29.14, "timestamp": "2026-04-21T12:37:21Z"}
{"round": 169, "iter": "iter169", "bottleneck": "compute_bound", "idea": "iter169_autogrid: BM=128 BN=128 warps=16 stages=4 indexing=block_ptr Ktile=128 ncol=4", "category": "grid", "expected_gain": "unknown", "decision": "DISCARD", "tflops": 106.35, "timestamp": "2026-04-21T12:37:26Z"}
{"round": 170, "iter": "iter170", "bottleneck": "compute_bound", "idea": "iter170_autogrid: BM=128 BN=128 warps=16 stages=4 indexing=pointer Ktile=32 ncol=1", "category": "grid", "expected_gain": "unknown", "decision": "DISCARD", "tflops": 52.43, "timestamp": "2026-04-21T12:37:32Z"}
{"round": 171, "iter": "iter171", "bottleneck": "compute_bound", "idea": "iter171_autogrid: BM=128 BN=128 warps=16 stages=4 indexing=pointer Ktile=64 ncol=2", "category": "grid", "expected_gain": "unknown", "decision": "DISCARD", "tflops": 67.37, "timestamp": "2026-04-21T12:37:37Z"}
{"round": 172, "iter": "iter172", "bottleneck": "compute_bound", "idea": "iter172_autogrid: BM=128 BN=128 warps=16 stages=4 indexing=pointer Ktile=128 ncol=4", "category": "grid", "expected_gain": "unknown", "decision": "DISCARD", "tflops": 101.07, "timestamp": "2026-04-21T12:37:43Z"}
{"round": 173, "iter": "iter173", "bottleneck": "compute_bound", "idea": "iter173_autogrid: BM=64 BN=256 warps=4 stages=1 indexing=block_ptr Ktile=32 ncol=1", "category": "grid", "expected_gain": "unknown", "decision": "DISCARD", "tflops": 109.16, "timestamp": "2026-04-21T12:37:49Z"}
{"round": 174, "iter": "iter174", "bottleneck": "compute_bound", "idea": "iter174_autogrid: BM=64 BN=256 warps=4 stages=1 indexing=block_ptr Ktile=64 ncol=2", "category": "grid", "expected_gain": "unknown", "decision": "DISCARD", "tflops": 137.28, "timestamp": "2026-04-21T12:37:55Z"}
{"round": 175, "iter": "iter175", "bottleneck": "compute_bound", "idea": "iter175_autogrid: BM=64 BN=256 warps=4 stages=1 indexing=block_ptr Ktile=128 ncol=4", "category": "grid", "expected_gain": "unknown", "decision": "DISCARD", "tflops": 114.02, "timestamp": "2026-04-21T12:38:01Z"}
{"round": 176, "iter": "iter176", "bottleneck": "compute_bound", "idea": "iter176_autogrid: BM=64 BN=256 warps=4 stages=1 indexing=pointer Ktile=32 ncol=1", "category": "grid", "expected_gain": "unknown", "decision": "DISCARD", "tflops": 109.72, "timestamp": "2026-04-21T12:38:07Z"}
{"round": 177, "iter": "iter177", "bottleneck": "compute_bound", "idea": "iter177_autogrid: BM=64 BN=256 warps=4 stages=1 indexing=pointer Ktile=64 ncol=2", "category": "grid", "expected_gain": "unknown", "decision": "DISCARD", "tflops": 134.26, "timestamp": "2026-04-21T12:38:13Z"}
{"round": 178, "iter": "iter178", "bottleneck": "compute_bound", "idea": "iter178_autogrid: BM=64 BN=256 warps=4 stages=1 indexing=pointer Ktile=128 ncol=4", "category": "grid", "expected_gain": "unknown", "decision": "DISCARD", "tflops": 118.72, "timestamp": "2026-04-21T12:38:20Z"}
{"round": 179, "iter": "iter179", "bottleneck": "compute_bound", "idea": "iter179_autogrid: BM=64 BN=256 warps=4 stages=2 indexing=block_ptr Ktile=32 ncol=1", "category": "grid", "expected_gain": "unknown", "decision": "DISCARD", "tflops": 111.34, "timestamp": "2026-04-21T12:38:25Z"}
{"round": 180, "iter": "iter180", "bottleneck": "compute_bound", "idea": "iter180_autogrid: BM=64 BN=256 warps=4 stages=2 indexing=block_ptr Ktile=64 ncol=2", "category": "grid", "expected_gain": "unknown", "decision": "DISCARD", "tflops": 140.08, "timestamp": "2026-04-21T12:38:31Z"}
{"round": 181, "iter": "iter181", "bottleneck": "compute_bound", "idea": "iter181_autogrid: BM=64 BN=256 warps=4 stages=2 indexing=block_ptr Ktile=128 ncol=4", "category": "grid", "expected_gain": "unknown", "decision": "DISCARD", "tflops": 117.02, "timestamp": "2026-04-21T12:38:38Z"}
{"round": 182, "iter": "iter182", "bottleneck": "compute_bound", "idea": "iter182_autogrid: BM=64 BN=256 warps=4 stages=2 indexing=pointer Ktile=32 ncol=1", "category": "grid", "expected_gain": "unknown", "decision": "DISCARD", "tflops": 116.57, "timestamp": "2026-04-21T12:38:44Z"}
{"round": 183, "iter": "iter183", "bottleneck": "compute_bound", "idea": "iter183_autogrid: BM=64 BN=256 warps=4 stages=2 indexing=pointer Ktile=64 ncol=2", "category": "grid", "expected_gain": "unknown", "decision": "DISCARD", "tflops": 139.55, "timestamp": "2026-04-21T12:38:50Z"}
{"round": 184, "iter": "iter184", "bottleneck": "compute_bound", "idea": "iter184_autogrid: BM=64 BN=256 warps=4 stages=2 indexing=pointer Ktile=128 ncol=4", "category": "grid", "expected_gain": "unknown", "decision": "DISCARD", "tflops": 116.74, "timestamp": "2026-04-21T12:38:57Z"}
{"round": 185, "iter": "iter185", "bottleneck": "compute_bound", "idea": "iter185_autogrid: BM=64 BN=256 warps=4 stages=3 indexing=block_ptr Ktile=32 ncol=1", "category": "grid", "expected_gain": "unknown", "decision": "DISCARD", "tflops": 136.29, "timestamp": "2026-04-21T12:39:02Z"}
{"round": 186, "iter": "iter186", "bottleneck": "compute_bound", "idea": "iter186_autogrid: BM=64 BN=256 warps=4 stages=3 indexing=block_ptr Ktile=64 ncol=2", "category": "grid", "expected_gain": "unknown", "decision": "DISCARD", "tflops": 145.77, "timestamp": "2026-04-21T12:39:09Z"}
{"round": 187, "iter": "iter187", "bottleneck": "compute_bound", "idea": "iter187_autogrid: BM=64 BN=256 warps=4 stages=3 indexing=block_ptr Ktile=128 ncol=4", "category": "grid", "expected_gain": "unknown", "decision": "DISCARD", "tflops": 73.47, "timestamp": "2026-04-21T12:39:16Z"}
{"round": 188, "iter": "iter188", "bottleneck": "compute_bound", "idea": "iter188_autogrid: BM=64 BN=256 warps=4 stages=3 indexing=pointer Ktile=32 ncol=1", "category": "grid", "expected_gain": "unknown", "decision": "DISCARD", "tflops": 121.38, "timestamp": "2026-04-21T12:39:21Z"}
{"round": 189, "iter": "iter189", "bottleneck": "compute_bound", "idea": "iter189_autogrid: BM=64 BN=256 warps=4 stages=3 indexing=pointer Ktile=64 ncol=2", "category": "grid", "expected_gain": "unknown", "decision": "DISCARD", "tflops": 143.82, "timestamp": "2026-04-21T12:39:27Z"}
{"round": 190, "iter": "iter190", "bottleneck": "compute_bound", "idea": "iter190_autogrid: BM=64 BN=256 warps=4 stages=3 indexing=pointer Ktile=128 ncol=4", "category": "grid", "expected_gain": "unknown", "decision": "DISCARD", "tflops": 77.78, "timestamp": "2026-04-21T12:39:34Z"}
{"round": 191, "iter": "iter191", "bottleneck": "compute_bound", "idea": "iter191_autogrid: BM=64 BN=256 warps=4 stages=4 indexing=block_ptr Ktile=32 ncol=1", "category": "grid", "expected_gain": "unknown", "decision": "DISCARD", "tflops": 135.71, "timestamp": "2026-04-21T12:39:40Z"}
{"round": 192, "iter": "iter192", "bottleneck": "compute_bound", "idea": "iter192_autogrid: BM=64 BN=256 warps=4 stages=4 indexing=block_ptr Ktile=64 ncol=2", "category": "grid", "expected_gain": "unknown", "decision": "DISCARD", "tflops": 60.85, "timestamp": "2026-04-21T12:39:46Z"}
{"round": 193, "iter": "iter193", "bottleneck": "compute_bound", "idea": "iter193_autogrid: BM=64 BN=256 warps=4 stages=4 indexing=block_ptr Ktile=128 ncol=4", "category": "grid", "expected_gain": "unknown", "decision": "DISCARD", "tflops": 26.67, "timestamp": "2026-04-21T12:39:53Z"}
{"round": 194, "iter": "iter194", "bottleneck": "compute_bound", "idea": "iter194_autogrid: BM=64 BN=256 warps=4 stages=4 indexing=pointer Ktile=32 ncol=1", "category": "grid", "expected_gain": "unknown", "decision": "DISCARD", "tflops": 119.41, "timestamp": "2026-04-21T12:39:59Z"}
{"round": 195, "iter": "iter195", "bottleneck": "compute_bound", "idea": "iter195_autogrid: BM=64 BN=256 warps=4 stages=4 indexing=pointer Ktile=64 ncol=2", "category": "grid", "expected_gain": "unknown", "decision": "DISCARD", "tflops": 144.03, "timestamp": "2026-04-21T12:40:05Z"}
{"round": 196, "iter": "iter196", "bottleneck": "compute_bound", "idea": "iter196_autogrid: BM=64 BN=256 warps=4 stages=4 indexing=pointer Ktile=128 ncol=4", "category": "grid", "expected_gain": "unknown", "decision": "DISCARD", "tflops": 78.14, "timestamp": "2026-04-21T12:40:12Z"}
{"round": 197, "iter": "iter197", "bottleneck": "compute_bound", "idea": "iter197_autogrid: BM=64 BN=256 warps=8 stages=1 indexing=block_ptr Ktile=32 ncol=1", "category": "grid", "expected_gain": "unknown", "decision": "DISCARD", "tflops": 106.39, "timestamp": "2026-04-21T12:40:18Z"}
{"round": 198, "iter": "iter198", "bottleneck": "compute_bound", "idea": "iter198_autogrid: BM=64 BN=256 warps=8 stages=1 indexing=block_ptr Ktile=64 ncol=2", "category": "grid", "expected_gain": "unknown", "decision": "DISCARD", "tflops": 27.54, "timestamp": "2026-04-21T12:40:24Z"}
{"round": 199, "iter": "iter199", "bottleneck": "compute_bound", "idea": "iter199_autogrid: BM=64 BN=256 warps=8 stages=1 indexing=block_ptr Ktile=128 ncol=4", "category": "grid", "expected_gain": "unknown", "decision": "DISCARD", "tflops": 36.29, "timestamp": "2026-04-21T12:40:30Z"}
{"round": 200, "iter": "iter200", "bottleneck": "compute_bound", "idea": "iter200_autogrid: BM=64 BN=256 warps=8 stages=1 indexing=pointer Ktile=32 ncol=1", "category": "grid", "expected_gain": "unknown", "decision": "DISCARD", "tflops": 107.48, "timestamp": "2026-04-21T12:40:36Z"}
{"round": 101, "iter": "iter101", "bottleneck": "compute_bound", "idea": "iter101_autogrid: BM=128 BN=128 warps=4 stages=1 indexing=block_ptr Ktile=32 ncol=1", "category": "grid", "expected_gain": "unknown", "decision": "DISCARD", "tflops": 114.07, "timestamp": "2026-04-21T12:42:13Z"}
{"round": 102, "iter": "iter102", "bottleneck": "compute_bound", "idea": "iter102_autogrid: BM=128 BN=128 warps=4 stages=1 indexing=block_ptr Ktile=64 ncol=2", "category": "grid", "expected_gain": "unknown", "decision": "DISCARD", "tflops": 143.96, "timestamp": "2026-04-21T12:42:18Z"}
{"round": 103, "iter": "iter103", "bottleneck": "compute_bound", "idea": "iter103_autogrid: BM=128 BN=128 warps=4 stages=1 indexing=block_ptr Ktile=128 ncol=4", "category": "grid", "expected_gain": "unknown", "decision": "DISCARD", "tflops": 118.76, "timestamp": "2026-04-21T12:42:23Z"}
{"round": 104, "iter": "iter104", "bottleneck": "compute_bound", "idea": "iter104_autogrid: BM=128 BN=128 warps=4 stages=1 indexing=pointer Ktile=32 ncol=1", "category": "grid", "expected_gain": "unknown", "decision": "DISCARD", "tflops": 111.8, "timestamp": "2026-04-21T12:42:38Z"}
{"round": 105, "iter": "iter105", "bottleneck": "compute_bound", "idea": "iter105_autogrid: BM=128 BN=128 warps=4 stages=1 indexing=pointer Ktile=64 ncol=2", "category": "grid", "expected_gain": "unknown", "decision": "DISCARD", "tflops": 146.98, "timestamp": "2026-04-21T12:42:43Z"}
{"round": 106, "iter": "iter106", "bottleneck": "compute_bound", "idea": "iter106_autogrid: BM=128 BN=128 warps=4 stages=1 indexing=pointer Ktile=128 ncol=4", "category": "grid", "expected_gain": "unknown", "decision": "DISCARD", "tflops": 105.46, "timestamp": "2026-04-21T12:42:48Z"}
{"round": 107, "iter": "iter107", "bottleneck": "compute_bound", "idea": "iter107_autogrid: BM=128 BN=128 warps=4 stages=2 indexing=block_ptr Ktile=32 ncol=1", "category": "grid", "expected_gain": "unknown", "decision": "DISCARD", "tflops": 122.79, "timestamp": "2026-04-21T12:42:53Z"}
{"round": 108, "iter": "iter108", "bottleneck": "compute_bound", "idea": "iter108_autogrid: BM=128 BN=128 warps=4 stages=2 indexing=block_ptr Ktile=64 ncol=2", "category": "grid", "expected_gain": "unknown", "decision": "DISCARD", "tflops": 160.15, "timestamp": "2026-04-21T12:42:58Z"}
{"round": 109, "iter": "iter109", "bottleneck": "compute_bound", "idea": "iter109_autogrid: BM=128 BN=128 warps=4 stages=2 indexing=block_ptr Ktile=128 ncol=4", "category": "grid", "expected_gain": "unknown", "decision": "DISCARD", "tflops": 118.42, "timestamp": "2026-04-21T12:43:03Z"}
{"round": 110, "iter": "iter110", "bottleneck": "compute_bound", "idea": "iter110_autogrid: BM=128 BN=128 warps=4 stages=2 indexing=pointer Ktile=32 ncol=1", "category": "grid", "expected_gain": "unknown", "decision": "DISCARD", "tflops": 124.21, "timestamp": "2026-04-21T12:43:08Z"}
{"round": 111, "iter": "iter111", "bottleneck": "compute_bound", "idea": "iter111_autogrid: BM=128 BN=128 warps=4 stages=2 indexing=pointer Ktile=64 ncol=2", "category": "grid", "expected_gain": "unknown", "decision": "DISCARD", "tflops": 156.96, "timestamp": "2026-04-21T12:43:13Z"}
{"round": 112, "iter": "iter112", "bottleneck": "compute_bound", "idea": "iter112_autogrid: BM=128 BN=128 warps=4 stages=2 indexing=pointer Ktile=128 ncol=4", "category": "grid", "expected_gain": "unknown", "decision": "DISCARD", "tflops": 122.94, "timestamp": "2026-04-21T12:43:18Z"}
{"round": 113, "iter": "iter113", "bottleneck": "compute_bound", "idea": "iter113_autogrid: BM=128 BN=128 warps=4 stages=3 indexing=block_ptr Ktile=32 ncol=1", "category": "grid", "expected_gain": "unknown", "decision": "DISCARD", "tflops": 131.88, "timestamp": "2026-04-21T12:43:24Z"}
{"round": 114, "iter": "iter114", "bottleneck": "compute_bound", "idea": "iter114_autogrid: BM=128 BN=128 warps=4 stages=3 indexing=block_ptr Ktile=64 ncol=2", "category": "grid", "expected_gain": "unknown", "decision": "DISCARD", "tflops": 161.27, "timestamp": "2026-04-21T12:43:29Z"}
{"round": 115, "iter": "iter115", "bottleneck": "compute_bound", "idea": "iter115_autogrid: BM=128 BN=128 warps=4 stages=3 indexing=block_ptr Ktile=128 ncol=4", "category": "grid", "expected_gain": "unknown", "decision": "DISCARD", "tflops": 55.13, "timestamp": "2026-04-21T12:43:35Z"}
{"round": 116, "iter": "iter116", "bottleneck": "compute_bound", "idea": "iter116_autogrid: BM=128 BN=128 warps=4 stages=3 indexing=pointer Ktile=32 ncol=1", "category": "grid", "expected_gain": "unknown", "decision": "DISCARD", "tflops": 59.98, "timestamp": "2026-04-21T12:43:40Z"}
{"round": 117, "iter": "iter117", "bottleneck": "compute_bound", "idea": "iter117_autogrid: BM=128 BN=128 warps=4 stages=3 indexing=pointer Ktile=64 ncol=2", "category": "grid", "expected_gain": "unknown", "decision": "KEEP", "tflops": 162.12, "timestamp": "2026-04-21T12:43:45Z"}
{"round": 118, "iter": "iter118", "bottleneck": "compute_bound", "idea": "iter118_autogrid: BM=128 BN=128 warps=4 stages=3 indexing=pointer Ktile=128 ncol=4", "category": "grid", "expected_gain": "unknown", "decision": "DISCARD", "tflops": 127.63, "timestamp": "2026-04-21T12:43:50Z"}
{"round": 119, "iter": "iter119", "bottleneck": "compute_bound", "idea": "iter119_autogrid: BM=128 BN=128 warps=4 stages=4 indexing=block_ptr Ktile=32 ncol=1", "category": "grid", "expected_gain": "unknown", "decision": "DISCARD", "tflops": 56.67, "timestamp": "2026-04-21T12:43:56Z"}
{"round": 120, "iter": "iter120", "bottleneck": "compute_bound", "idea": "iter120_autogrid: BM=128 BN=128 warps=4 stages=4 indexing=block_ptr Ktile=64 ncol=2", "category": "grid", "expected_gain": "unknown", "decision": "DISCARD", "tflops": 152.23, "timestamp": "2026-04-21T12:44:00Z"}
{"round": 121, "iter": "iter121", "bottleneck": "compute_bound", "idea": "iter121_autogrid: BM=128 BN=128 warps=4 stages=4 indexing=block_ptr Ktile=128 ncol=4", "category": "grid", "expected_gain": "unknown", "decision": "DISCARD", "tflops": 78.13, "timestamp": "2026-04-21T12:44:06Z"}
{"round": 122, "iter": "iter122", "bottleneck": "compute_bound", "idea": "iter122_autogrid: BM=128 BN=128 warps=4 stages=4 indexing=pointer Ktile=32 ncol=1", "category": "grid", "expected_gain": "unknown", "decision": "DISCARD", "tflops": 130.99, "timestamp": "2026-04-21T12:44:11Z"}
{"round": 123, "iter": "iter123", "bottleneck": "compute_bound", "idea": "iter123_autogrid: BM=128 BN=128 warps=4 stages=4 indexing=pointer Ktile=64 ncol=2", "category": "grid", "expected_gain": "unknown", "decision": "DISCARD", "tflops": 156.35, "timestamp": "2026-04-21T12:44:16Z"}
{"round": 124, "iter": "iter124", "bottleneck": "compute_bound", "idea": "iter124_autogrid: BM=128 BN=128 warps=4 stages=4 indexing=pointer Ktile=128 ncol=4", "category": "grid", "expected_gain": "unknown", "decision": "DISCARD", "tflops": 86.51, "timestamp": "2026-04-21T12:44:21Z"}
{"round": 125, "iter": "iter125", "bottleneck": "compute_bound", "idea": "iter125_autogrid: BM=128 BN=128 warps=8 stages=1 indexing=block_ptr Ktile=32 ncol=1", "category": "grid", "expected_gain": "unknown", "decision": "DISCARD", "tflops": 87.71, "timestamp": "2026-04-21T12:44:27Z"}
{"round": 126, "iter": "iter126", "bottleneck": "compute_bound", "idea": "iter126_autogrid: BM=128 BN=128 warps=8 stages=1 indexing=block_ptr Ktile=64 ncol=2", "category": "grid", "expected_gain": "unknown", "decision": "DISCARD", "tflops": 38.97, "timestamp": "2026-04-21T12:44:32Z"}
{"round": 127, "iter": "iter127", "bottleneck": "compute_bound", "idea": "iter127_autogrid: BM=128 BN=128 warps=8 stages=1 indexing=block_ptr Ktile=128 ncol=4", "category": "grid", "expected_gain": "unknown", "decision": "DISCARD", "tflops": 106.69, "timestamp": "2026-04-21T12:44:38Z"}
{"round": 128, "iter": "iter128", "bottleneck": "compute_bound", "idea": "iter128_autogrid: BM=128 BN=128 warps=8 stages=1 indexing=pointer Ktile=32 ncol=1", "category": "grid", "expected_gain": "unknown", "decision": "DISCARD", "tflops": 88.42, "timestamp": "2026-04-21T12:44:43Z"}
{"round": 129, "iter": "iter129", "bottleneck": "compute_bound", "idea": "iter129_autogrid: BM=128 BN=128 warps=8 stages=1 indexing=pointer Ktile=64 ncol=2", "category": "grid", "expected_gain": "unknown", "decision": "DISCARD", "tflops": 90.06, "timestamp": "2026-04-21T12:44:48Z"}
{"round": 130, "iter": "iter130", "bottleneck": "compute_bound", "idea": "iter130_autogrid: BM=128 BN=128 warps=8 stages=1 indexing=pointer Ktile=128 ncol=4", "category": "grid", "expected_gain": "unknown", "decision": "DISCARD", "tflops": 109.79, "timestamp": "2026-04-21T12:44:53Z"}
{"round": 131, "iter": "iter131", "bottleneck": "compute_bound", "idea": "iter131_autogrid: BM=128 BN=128 warps=8 stages=2 indexing=block_ptr Ktile=32 ncol=1", "category": "grid", "expected_gain": "unknown", "decision": "DISCARD", "tflops": 88.76, "timestamp": "2026-04-21T12:44:59Z"}
{"round": 132, "iter": "iter132", "bottleneck": "compute_bound", "idea": "iter132_autogrid: BM=128 BN=128 warps=8 stages=2 indexing=block_ptr Ktile=64 ncol=2", "category": "grid", "expected_gain": "unknown", "decision": "DISCARD", "tflops": 101.35, "timestamp": "2026-04-21T12:45:04Z"}
{"round": 133, "iter": "iter133", "bottleneck": "compute_bound", "idea": "iter133_autogrid: BM=128 BN=128 warps=8 stages=2 indexing=block_ptr Ktile=128 ncol=4", "category": "grid", "expected_gain": "unknown", "decision": "DISCARD", "tflops": 43.25, "timestamp": "2026-04-21T12:45:10Z"}
{"round": 134, "iter": "iter134", "bottleneck": "compute_bound", "idea": "iter134_autogrid: BM=128 BN=128 warps=8 stages=2 indexing=pointer Ktile=32 ncol=1", "category": "grid", "expected_gain": "unknown", "decision": "DISCARD", "tflops": 86.19, "timestamp": "2026-04-21T12:45:15Z"}
