{"round": 135, "iter": "iter135", "bottleneck": "compute_bound", "idea": "iter135_autogrid: BM=128 BN=128 warps=8 stages=2 indexing=pointer Ktile=64 ncol=2", "category": "grid", "expected_gain": "unknown", "decision": "DISCARD", "tflops": 100.36, "timestamp": "2026-04-21T12:45:20Z"}
{"round": 136, "iter": "iter136", "bottleneck": "compute_bound", "idea": "iter136_autogrid: BM=128 BN=128 warps=8 stages=2 indexing=pointer Ktile=128 ncol=4", "category": "grid", "expected_gain": "unknown", "decision": "DISCARD", "tflops": 119.29, "timestamp": "2026-04-21T12:45:25Z"}
{"round": 137, "iter": "iter137", "bottleneck": "compute_bound", "idea": "iter137_autogrid: BM=128 BN=128 warps=8 stages=3 indexing=block_ptr Ktile=32 ncol=1", "category": "grid", "expected_gain": "unknown", "decision": "DISCARD", "tflops": 88.32, "timestamp": "2026-04-21T12:45:30Z"}
{"round": 138, "iter": "iter138", "bottleneck": "compute_bound", "idea": "iter138_autogrid: BM=128 BN=128 warps=8 stages=3 indexing=block_ptr Ktile=64 ncol=2", "category": "grid", "expected_gain": "unknown", "decision": "DISCARD", "tflops": 129.14, "timestamp": "2026-04-21T12:45:35Z"}
{"round": 139, "iter": "iter139", "bottleneck": "compute_bound", "idea": "iter139_autogrid: BM=128 BN=128 warps=8 stages=3 indexing=block_ptr Ktile=128 ncol=4", "category": "grid", "expected_gain": "unknown", "decision": "DISCARD", "tflops": 129.24, "timestamp": "2026-04-21T12:45:40Z"}
{"round": 140, "iter": "iter140", "bottleneck": "compute_bound", "idea": "iter140_autogrid: BM=128 BN=128 warps=8 stages=3 indexing=pointer Ktile=32 ncol=1", "category": "grid", "expected_gain": "unknown", "decision": "DISCARD", "tflops": 79.15, "timestamp": "2026-04-21T12:45:46Z"}
{"round": 141, "iter": "iter141", "bottleneck": "compute_bound", "idea": "iter141_autogrid: BM=128 BN=128 warps=8 stages=3 indexing=pointer Ktile=64 ncol=2", "category": "grid", "expected_gain": "unknown", "decision": "DISCARD", "tflops": 130.09, "timestamp": "2026-04-21T12:45:51Z"}
{"round": 142, "iter": "iter142", "bottleneck": "compute_bound", "idea": "iter142_autogrid: BM=128 BN=128 warps=8 stages=3 indexing=pointer Ktile=128 ncol=4", "category": "grid", "expected_gain": "unknown", "decision": "DISCARD", "tflops": 133.17, "timestamp": "2026-04-21T12:45:56Z"}
{"round": 143, "iter": "iter143", "bottleneck": "compute_bound", "idea": "iter143_autogrid: BM=128 BN=128 warps=8 stages=4 indexing=block_ptr Ktile=32 ncol=1", "category": "grid", "expected_gain": "unknown", "decision": "DISCARD", "tflops": 87.38, "timestamp": "2026-04-21T12:46:01Z"}
{"round": 144, "iter": "iter144", "bottleneck": "compute_bound", "idea": "iter144_autogrid: BM=128 BN=128 warps=8 stages=4 indexing=block_ptr Ktile=64 ncol=2", "category": "grid", "expected_gain": "unknown", "decision": "DISCARD", "tflops": 103.14, "timestamp": "2026-04-21T12:46:07Z"}
{"round": 145, "iter": "iter145", "bottleneck": "compute_bound", "idea": "iter145_autogrid: BM=128 BN=128 warps=8 stages=4 indexing=block_ptr Ktile=128 ncol=4", "category": "grid", "expected_gain": "unknown", "decision": "DISCARD", "tflops": 128.44, "timestamp": "2026-04-21T12:46:12Z"}
{"round": 146, "iter": "iter146", "bottleneck": "compute_bound", "idea": "iter146_autogrid: BM=128 BN=128 warps=8 stages=4 indexing=pointer Ktile=32 ncol=1", "category": "grid", "expected_gain": "unknown", "decision": "DISCARD", "tflops": 87.24, "timestamp": "2026-04-21T12:46:17Z"}
{"round": 147, "iter": "iter147", "bottleneck": "compute_bound", "idea": "iter147_autogrid: BM=128 BN=128 warps=8 stages=4 indexing=pointer Ktile=64 ncol=2", "category": "grid", "expected_gain": "unknown", "decision": "DISCARD", "tflops": 105.19, "timestamp": "2026-04-21T12:46:23Z"}
{"round": 148, "iter": "iter148", "bottleneck": "compute_bound", "idea": "iter148_autogrid: BM=128 BN=128 warps=8 stages=4 indexing=pointer Ktile=128 ncol=4", "category": "grid", "expected_gain": "unknown", "decision": "DISCARD", "tflops": 132.89, "timestamp": "2026-04-21T12:46:28Z"}
{"round": 149, "iter": "iter149", "bottleneck": "compute_bound", "idea": "iter149_autogrid: BM=128 BN=128 warps=16 stages=1 indexing=block_ptr Ktile=32 ncol=1", "category": "grid", "expected_gain": "unknown", "decision": "DISCARD", "tflops": 48.91, "timestamp": "2026-04-21T12:46:33Z"}
{"round": 150, "iter": "iter150", "bottleneck": "compute_bound", "idea": "iter150_autogrid: BM=128 BN=128 warps=16 stages=1 indexing=block_ptr Ktile=64 ncol=2", "category": "grid", "expected_gain": "unknown", "decision": "DISCARD", "tflops": 26.49, "timestamp": "2026-04-21T12:46:39Z"}
{"round": 151, "iter": "iter151", "bottleneck": "compute_bound", "idea": "iter151_autogrid: BM=128 BN=128 warps=16 stages=1 indexing=block_ptr Ktile=128 ncol=4", "category": "grid", "expected_gain": "unknown", "decision": "DISCARD", "tflops": 89.91, "timestamp": "2026-04-21T12:46:44Z"}
{"round": 152, "iter": "iter152", "bottleneck": "compute_bound", "idea": "iter152_autogrid: BM=128 BN=128 warps=16 stages=1 indexing=pointer Ktile=32 ncol=1", "category": "grid", "expected_gain": "unknown", "decision": "DISCARD", "tflops": 22.99, "timestamp": "2026-04-21T12:46:50Z"}
{"round": 153, "iter": "iter153", "bottleneck": "compute_bound", "idea": "iter153_autogrid: BM=128 BN=128 warps=16 stages=1 indexing=pointer Ktile=64 ncol=2", "category": "grid", "expected_gain": "unknown", "decision": "DISCARD", "tflops": 27.41, "timestamp": "2026-04-21T12:46:56Z"}
{"round": 154, "iter": "iter154", "bottleneck": "compute_bound", "idea": "iter154_autogrid: BM=128 BN=128 warps=16 stages=1 indexing=pointer Ktile=128 ncol=4", "category": "grid", "expected_gain": "unknown", "decision": "DISCARD", "tflops": 91.69, "timestamp": "2026-04-21T12:47:01Z"}
{"round": 155, "iter": "iter155", "bottleneck": "compute_bound", "idea": "iter155_autogrid: BM=128 BN=128 warps=16 stages=2 indexing=block_ptr Ktile=32 ncol=1", "category": "grid", "expected_gain": "unknown", "decision": "DISCARD", "tflops": 46.29, "timestamp": "2026-04-21T12:47:07Z"}
{"round": 156, "iter": "iter156", "bottleneck": "compute_bound", "idea": "iter156_autogrid: BM=128 BN=128 warps=16 stages=2 indexing=block_ptr Ktile=64 ncol=2", "category": "grid", "expected_gain": "unknown", "decision": "DISCARD", "tflops": 67.57, "timestamp": "2026-04-21T12:47:12Z"}
{"round": 157, "iter": "iter157", "bottleneck": "compute_bound", "idea": "iter157_autogrid: BM=128 BN=128 warps=16 stages=2 indexing=block_ptr Ktile=128 ncol=4", "category": "grid", "expected_gain": "unknown", "decision": "DISCARD", "tflops": 93.76, "timestamp": "2026-04-21T12:47:17Z"}
{"round": 158, "iter": "iter158", "bottleneck": "compute_bound", "idea": "iter158_autogrid: BM=128 BN=128 warps=16 stages=2 indexing=pointer Ktile=32 ncol=1", "category": "grid", "expected_gain": "unknown", "decision": "DISCARD", "tflops": 46.09, "timestamp": "2026-04-21T12:47:22Z"}
{"round": 159, "iter": "iter159", "bottleneck": "compute_bound", "idea": "iter159_autogrid: BM=128 BN=128 warps=16 stages=2 indexing=pointer Ktile=64 ncol=2", "category": "grid", "expected_gain": "unknown", "decision": "DISCARD", "tflops": 67.14, "timestamp": "2026-04-21T12:47:27Z"}
{"round": 160, "iter": "iter160", "bottleneck": "compute_bound", "idea": "iter160_autogrid: BM=128 BN=128 warps=16 stages=2 indexing=pointer Ktile=128 ncol=4", "category": "grid", "expected_gain": "unknown", "decision": "DISCARD", "tflops": 96.15, "timestamp": "2026-04-21T12:47:33Z"}
{"round": 161, "iter": "iter161", "bottleneck": "compute_bound", "idea": "iter161_autogrid: BM=128 BN=128 warps=16 stages=3 indexing=block_ptr Ktile=32 ncol=1", "category": "grid", "expected_gain": "unknown", "decision": "DISCARD", "tflops": 49.93, "timestamp": "2026-04-21T12:47:38Z"}
{"round": 162, "iter": "iter162", "bottleneck": "compute_bound", "idea": "iter162_autogrid: BM=128 BN=128 warps=16 stages=3 indexing=block_ptr Ktile=64 ncol=2", "category": "grid", "expected_gain": "unknown", "decision": "DISCARD", "tflops": 74.21, "timestamp": "2026-04-21T12:47:44Z"}
{"round": 163, "iter": "iter163", "bottleneck": "compute_bound", "idea": "iter163_autogrid: BM=128 BN=128 warps=16 stages=3 indexing=block_ptr Ktile=128 ncol=4", "category": "grid", "expected_gain": "unknown", "decision": "DISCARD", "tflops": 46.16, "timestamp": "2026-04-21T12:47:49Z"}
{"round": 164, "iter": "iter164", "bottleneck": "compute_bound", "idea": "iter164_autogrid: BM=128 BN=128 warps=16 stages=3 indexing=pointer Ktile=32 ncol=1", "category": "grid", "expected_gain": "unknown", "decision": "DISCARD", "tflops": 22.88, "timestamp": "2026-04-21T12:47:55Z"}
{"round": 165, "iter": "iter165", "bottleneck": "compute_bound", "idea": "iter165_autogrid: BM=128 BN=128 warps=16 stages=3 indexing=pointer Ktile=64 ncol=2", "category": "grid", "expected_gain": "unknown", "decision": "DISCARD", "tflops": 33.16, "timestamp": "2026-04-21T12:48:00Z"}
{"round": 166, "iter": "iter166", "bottleneck": "compute_bound", "idea": "iter166_autogrid: BM=128 BN=128 warps=16 stages=3 indexing=pointer Ktile=128 ncol=4", "category": "grid", "expected_gain": "unknown", "decision": "DISCARD", "tflops": 101.51, "timestamp": "2026-04-21T12:48:05Z"}
{"round": 167, "iter": "iter167", "bottleneck": "compute_bound", "idea": "iter167_autogrid: BM=128 BN=128 warps=16 stages=4 indexing=block_ptr Ktile=32 ncol=1", "category": "grid", "expected_gain": "unknown", "decision": "DISCARD", "tflops": 49.88, "timestamp": "2026-04-21T12:48:11Z"}
{"round": 168, "iter": "iter168", "bottleneck": "compute_bound", "idea": "iter168_autogrid: BM=128 BN=128 warps=16 stages=4 indexing=block_ptr Ktile=64 ncol=2", "category": "grid", "expected_gain": "unknown", "decision": "DISCARD", "tflops": 66.02, "timestamp": "2026-04-21T12:48:16Z"}
{"round": 169, "iter": "iter169", "bottleneck": "compute_bound", "idea": "iter169_autogrid: BM=128 BN=128 warps=16 stages=4 indexing=block_ptr Ktile=128 ncol=4", "category": "grid", "expected_gain": "unknown", "decision": "DISCARD", "tflops": 106.09, "timestamp": "2026-04-21T12:48:21Z"}
{"round": 170, "iter": "iter170", "bottleneck": "compute_bound", "idea": "iter170_autogrid: BM=128 BN=128 warps=16 stages=4 indexing=pointer Ktile=32 ncol=1", "category": "grid", "expected_gain": "unknown", "decision": "DISCARD", "tflops": 52.13, "timestamp": "2026-04-21T12:48:26Z"}
{"round": 171, "iter": "iter171", "bottleneck": "compute_bound", "idea": "iter171_autogrid: BM=128 BN=128 warps=16 stages=4 indexing=pointer Ktile=64 ncol=2", "category": "grid", "expected_gain": "unknown", "decision": "DISCARD", "tflops": 66.9, "timestamp": "2026-04-21T12:48:32Z"}
{"round": 172, "iter": "iter172", "bottleneck": "compute_bound", "idea": "iter172_autogrid: BM=128 BN=128 warps=16 stages=4 indexing=pointer Ktile=128 ncol=4", "category": "grid", "expected_gain": "unknown", "decision": "DISCARD", "tflops": 100.74, "timestamp": "2026-04-21T12:48:37Z"}
{"round": 173, "iter": "iter173", "bottleneck": "compute_bound", "idea": "iter173_autogrid: BM=64 BN=256 warps=4 stages=1 indexing=block_ptr Ktile=32 ncol=1", "category": "grid", "expected_gain": "unknown", "decision": "DISCARD", "tflops": 109.33, "timestamp": "2026-04-21T12:48:42Z"}
{"round": 174, "iter": "iter174", "bottleneck": "compute_bound", "idea": "iter174_autogrid: BM=64 BN=256 warps=4 stages=1 indexing=block_ptr Ktile=64 ncol=2", "category": "grid", "expected_gain": "unknown", "decision": "DISCARD", "tflops": 136.63, "timestamp": "2026-04-21T12:48:47Z"}
{"round": 175, "iter": "iter175", "bottleneck": "compute_bound", "idea": "iter175_autogrid: BM=64 BN=256 warps=4 stages=1 indexing=block_ptr Ktile=128 ncol=4", "category": "grid", "expected_gain": "unknown", "decision": "DISCARD", "tflops": 112.8, "timestamp": "2026-04-21T12:48:52Z"}
{"round": 176, "iter": "iter176", "bottleneck": "compute_bound", "idea": "iter176_autogrid: BM=64 BN=256 warps=4 stages=1 indexing=pointer Ktile=32 ncol=1", "category": "grid", "expected_gain": "unknown", "decision": "DISCARD", "tflops": 109.92, "timestamp": "2026-04-21T12:48:57Z"}
{"round": 177, "iter": "iter177", "bottleneck": "compute_bound", "idea": "iter177_autogrid: BM=64 BN=256 warps=4 stages=1 indexing=pointer Ktile=64 ncol=2", "category": "grid", "expected_gain": "unknown", "decision": "DISCARD", "tflops": 133.75, "timestamp": "2026-04-21T12:49:03Z"}
{"round": 178, "iter": "iter178", "bottleneck": "compute_bound", "idea": "iter178_autogrid: BM=64 BN=256 warps=4 stages=1 indexing=pointer Ktile=128 ncol=4", "category": "grid", "expected_gain": "unknown", "decision": "DISCARD", "tflops": 118.59, "timestamp": "2026-04-21T12:49:08Z"}
{"round": 179, "iter": "iter179", "bottleneck": "compute_bound", "idea": "iter179_autogrid: BM=64 BN=256 warps=4 stages=2 indexing=block_ptr Ktile=32 ncol=1", "category": "grid", "expected_gain": "unknown", "decision": "DISCARD", "tflops": 110.55, "timestamp": "2026-04-21T12:49:13Z"}
{"round": 180, "iter": "iter180", "bottleneck": "compute_bound", "idea": "iter180_autogrid: BM=64 BN=256 warps=4 stages=2 indexing=block_ptr Ktile=64 ncol=2", "category": "grid", "expected_gain": "unknown", "decision": "DISCARD", "tflops": 138.58, "timestamp": "2026-04-21T12:49:18Z"}
{"round": 181, "iter": "iter181", "bottleneck": "compute_bound", "idea": "iter181_autogrid: BM=64 BN=256 warps=4 stages=2 indexing=block_ptr Ktile=128 ncol=4", "category": "grid", "expected_gain": "unknown", "decision": "DISCARD", "tflops": 52.33, "timestamp": "2026-04-21T12:49:23Z"}
{"round": 182, "iter": "iter182", "bottleneck": "compute_bound", "idea": "iter182_autogrid: BM=64 BN=256 warps=4 stages=2 indexing=pointer Ktile=32 ncol=1", "category": "grid", "expected_gain": "unknown", "decision": "DISCARD", "tflops": 52.37, "timestamp": "2026-04-21T12:49:28Z"}
{"round": 183, "iter": "iter183", "bottleneck": "compute_bound", "idea": "iter183_autogrid: BM=64 BN=256 warps=4 stages=2 indexing=pointer Ktile=64 ncol=2", "category": "grid", "expected_gain": "unknown", "decision": "DISCARD", "tflops": 62.85, "timestamp": "2026-04-21T12:49:34Z"}
{"round": 184, "iter": "iter184", "bottleneck": "compute_bound", "idea": "iter184_autogrid: BM=64 BN=256 warps=4 stages=2 indexing=pointer Ktile=128 ncol=4", "category": "grid", "expected_gain": "unknown", "decision": "DISCARD", "tflops": 36.19, "timestamp": "2026-04-21T12:49:39Z"}
{"round": 185, "iter": "iter185", "bottleneck": "compute_bound", "idea": "iter185_autogrid: BM=64 BN=256 warps=4 stages=3 indexing=block_ptr Ktile=32 ncol=1", "category": "grid", "expected_gain": "unknown", "decision": "DISCARD", "tflops": 40.77, "timestamp": "2026-04-21T12:49:45Z"}
{"round": 186, "iter": "iter186", "bottleneck": "compute_bound", "idea": "iter186_autogrid: BM=64 BN=256 warps=4 stages=3 indexing=block_ptr Ktile=64 ncol=2", "category": "grid", "expected_gain": "unknown", "decision": "DISCARD", "tflops": 43.69, "timestamp": "2026-04-21T12:49:50Z"}
{"round": 187, "iter": "iter187", "bottleneck": "compute_bound", "idea": "iter187_autogrid: BM=64 BN=256 warps=4 stages=3 indexing=block_ptr Ktile=128 ncol=4", "category": "grid", "expected_gain": "unknown", "decision": "DISCARD", "tflops": 31.74, "timestamp": "2026-04-21T12:49:56Z"}
{"round": 188, "iter": "iter188", "bottleneck": "compute_bound", "idea": "iter188_autogrid: BM=64 BN=256 warps=4 stages=3 indexing=pointer Ktile=32 ncol=1", "category": "grid", "expected_gain": "unknown", "decision": "DISCARD", "tflops": 54.19, "timestamp": "2026-04-21T12:50:01Z"}
{"round": 189, "iter": "iter189", "bottleneck": "compute_bound", "idea": "iter189_autogrid: BM=64 BN=256 warps=4 stages=3 indexing=pointer Ktile=64 ncol=2", "category": "grid", "expected_gain": "unknown", "decision": "DISCARD", "tflops": 65.21, "timestamp": "2026-04-21T12:50:07Z"}
{"round": 190, "iter": "iter190", "bottleneck": "compute_bound", "idea": "iter190_autogrid: BM=64 BN=256 warps=4 stages=3 indexing=pointer Ktile=128 ncol=4", "category": "grid", "expected_gain": "unknown", "decision": "DISCARD", "tflops": 33.66, "timestamp": "2026-04-21T12:50:13Z"}
{"round": 191, "iter": "iter191", "bottleneck": "compute_bound", "idea": "iter191_autogrid: BM=64 BN=256 warps=4 stages=4 indexing=block_ptr Ktile=32 ncol=1", "category": "grid", "expected_gain": "unknown", "decision": "DISCARD", "tflops": 61.02, "timestamp": "2026-04-21T12:50:18Z"}
{"round": 192, "iter": "iter192", "bottleneck": "compute_bound", "idea": "iter192_autogrid: BM=64 BN=256 warps=4 stages=4 indexing=block_ptr Ktile=64 ncol=2", "category": "grid", "expected_gain": "unknown", "decision": "DISCARD", "tflops": 66.5, "timestamp": "2026-04-21T12:50:24Z"}
{"round": 193, "iter": "iter193", "bottleneck": "compute_bound", "idea": "iter193_autogrid: BM=64 BN=256 warps=4 stages=4 indexing=block_ptr Ktile=128 ncol=4", "category": "grid", "expected_gain": "unknown", "decision": "DISCARD", "tflops": 31.58, "timestamp": "2026-04-21T12:50:29Z"}
{"round": 194, "iter": "iter194", "bottleneck": "compute_bound", "idea": "iter194_autogrid: BM=64 BN=256 warps=4 stages=4 indexing=pointer Ktile=32 ncol=1", "category": "grid", "expected_gain": "unknown", "decision": "DISCARD", "tflops": 48.37, "timestamp": "2026-04-21T12:50:35Z"}
{"round": 195, "iter": "iter195", "bottleneck": "compute_bound", "idea": "iter195_autogrid: BM=64 BN=256 warps=4 stages=4 indexing=pointer Ktile=64 ncol=2", "category": "grid", "expected_gain": "unknown", "decision": "DISCARD", "tflops": 65.28, "timestamp": "2026-04-21T12:50:40Z"}
{"round": 196, "iter": "iter196", "bottleneck": "compute_bound", "idea": "iter196_autogrid: BM=64 BN=256 warps=4 stages=4 indexing=pointer Ktile=128 ncol=4", "category": "grid", "expected_gain": "unknown", "decision": "DISCARD", "tflops": 33.53, "timestamp": "2026-04-21T12:50:46Z"}
{"round": 197, "iter": "iter197", "bottleneck": "compute_bound", "idea": "iter197_autogrid: BM=64 BN=256 warps=8 stages=1 indexing=block_ptr Ktile=32 ncol=1", "category": "grid", "expected_gain": "unknown", "decision": "DISCARD", "tflops": 47.32, "timestamp": "2026-04-21T12:50:51Z"}
{"round": 198, "iter": "iter198", "bottleneck": "compute_bound", "idea": "iter198_autogrid: BM=64 BN=256 warps=8 stages=1 indexing=block_ptr Ktile=64 ncol=2", "category": "grid", "expected_gain": "unknown", "decision": "DISCARD", "tflops": 31.78, "timestamp": "2026-04-21T12:50:57Z"}
{"round": 199, "iter": "iter199", "bottleneck": "compute_bound", "idea": "iter199_autogrid: BM=64 BN=256 warps=8 stages=1 indexing=block_ptr Ktile=128 ncol=4", "category": "grid", "expected_gain": "unknown", "decision": "DISCARD", "tflops": 39.51, "timestamp": "2026-04-21T12:51:02Z"}
{"round": 200, "iter": "iter200", "bottleneck": "compute_bound", "idea": "iter200_autogrid: BM=64 BN=256 warps=8 stages=1 indexing=pointer Ktile=32 ncol=1", "category": "grid", "expected_gain": "unknown", "decision": "DISCARD", "tflops": 47.87, "timestamp": "2026-04-21T12:51:08Z"}
{"round": 201, "iter": "iter201", "bottleneck": "compute_bound", "idea": "iter201_autogrid: BM=128 BN=128 warps=4 stages=3 indexing=pointer Ktile=32 ncol=1", "category": "grid", "expected_gain": "unknown", "decision": "DISCARD", "tflops": 59.05, "timestamp": "2026-04-21T12:51:52Z"}
{"round": 202, "iter": "iter202", "bottleneck": "compute_bound", "idea": "iter202_autogrid: BM=128 BN=128 warps=4 stages=3 indexing=block_ptr Ktile=32 ncol=1", "category": "grid", "expected_gain": "unknown", "decision": "DISCARD", "tflops": 59.94, "timestamp": "2026-04-21T12:51:58Z"}
{"round": 203, "iter": "iter203", "bottleneck": "compute_bound", "idea": "iter203_autogrid: BM=128 BN=128 warps=8 stages=3 indexing=pointer Ktile=32 ncol=1", "category": "grid", "expected_gain": "unknown", "decision": "DISCARD", "tflops": 38.5, "timestamp": "2026-04-21T12:52:04Z"}
{"round": 204, "iter": "iter204", "bottleneck": "compute_bound", "idea": "iter204_autogrid: BM=128 BN=128 warps=8 stages=3 indexing=block_ptr Ktile=32 ncol=1", "category": "grid", "expected_gain": "unknown", "decision": "DISCARD", "tflops": 38.95, "timestamp": "2026-04-21T12:52:09Z"}
{"round": 205, "iter": "iter205", "bottleneck": "compute_bound", "idea": "iter205_autogrid: BM=128 BN=128 warps=16 stages=3 indexing=pointer Ktile=32 ncol=1", "category": "grid", "expected_gain": "unknown", "decision": "DISCARD", "tflops": 23.12, "timestamp": "2026-04-21T12:52:16Z"}
{"round": 206, "iter": "iter206", "bottleneck": "compute_bound", "idea": "iter206_autogrid: BM=128 BN=128 warps=16 stages=3 indexing=block_ptr Ktile=32 ncol=1", "category": "grid", "expected_gain": "unknown", "decision": "DISCARD", "tflops": 22.56, "timestamp": "2026-04-21T12:52:22Z"}
{"round": 207, "iter": "iter207", "bottleneck": "compute_bound", "idea": "iter207_autogrid: BM=128 BN=128 warps=4 stages=4 indexing=pointer Ktile=32 ncol=1", "category": "grid", "expected_gain": "unknown", "decision": "DISCARD", "tflops": 38.56, "timestamp": "2026-04-21T12:52:28Z"}
{"round": 208, "iter": "iter208", "bottleneck": "compute_bound", "idea": "iter208_autogrid: BM=128 BN=128 warps=4 stages=4 indexing=block_ptr Ktile=32 ncol=1", "category": "grid", "expected_gain": "unknown", "decision": "DISCARD", "tflops": 58.65, "timestamp": "2026-04-21T12:52:34Z"}
{"round": 209, "iter": "iter209", "bottleneck": "compute_bound", "idea": "iter209_autogrid: BM=128 BN=128 warps=8 stages=4 indexing=pointer Ktile=32 ncol=1", "category": "grid", "expected_gain": "unknown", "decision": "DISCARD", "tflops": 38.87, "timestamp": "2026-04-21T12:52:40Z"}
{"round": 210, "iter": "iter210", "bottleneck": "compute_bound", "idea": "iter210_autogrid: BM=128 BN=128 warps=8 stages=4 indexing=block_ptr Ktile=32 ncol=1", "category": "grid", "expected_gain": "unknown", "decision": "DISCARD", "tflops": 38.53, "timestamp": "2026-04-21T12:52:46Z"}
{"round": 211, "iter": "iter211", "bottleneck": "compute_bound", "idea": "iter211_autogrid: BM=128 BN=128 warps=16 stages=4 indexing=pointer Ktile=32 ncol=1", "category": "grid", "expected_gain": "unknown", "decision": "DISCARD", "tflops": 22.96, "timestamp": "2026-04-21T12:52:52Z"}
