{"round": 660, "iter": "iter660", "bottleneck": "compute_bound", "idea": "iter660_autogrid: BM=128 BN=64 warps=2 stages=4 indexing=block_ptr Ktile=32 ncol=1 layout=lo1", "category": "grid", "expected_gain": "unknown", "decision": "DISCARD", "tflops": 28.59, "timestamp": "2026-04-21T15:14:04Z"}
{"round": 661, "iter": "iter661", "bottleneck": "compute_bound", "idea": "iter661_autogrid: BM=128 BN=64 warps=2 stages=4 indexing=block_ptr Ktile=64 ncol=2 layout=mnk", "category": "grid", "expected_gain": "unknown", "decision": "DISCARD", "tflops": 23.67, "timestamp": "2026-04-21T15:14:11Z"}
{"round": 662, "iter": "iter662", "bottleneck": "compute_bound", "idea": "iter662_autogrid: BM=128 BN=64 warps=2 stages=4 indexing=block_ptr Ktile=64 ncol=2 layout=lo1", "category": "grid", "expected_gain": "unknown", "decision": "DISCARD", "tflops": 24.42, "timestamp": "2026-04-21T15:14:19Z"}
{"round": 663, "iter": "iter663", "bottleneck": "compute_bound", "idea": "iter663_autogrid: BM=128 BN=64 warps=2 stages=4 indexing=block_ptr Ktile=128 ncol=4 layout=mnk", "category": "grid", "expected_gain": "unknown", "decision": "DISCARD", "tflops": 12.29, "timestamp": "2026-04-21T15:14:28Z"}
{"round": 664, "iter": "iter664", "bottleneck": "compute_bound", "idea": "iter664_autogrid: BM=128 BN=64 warps=2 stages=4 indexing=block_ptr Ktile=128 ncol=4 layout=lo1", "category": "grid", "expected_gain": "unknown", "decision": "DISCARD", "tflops": 14.01, "timestamp": "2026-04-21T15:14:37Z"}
{"round": 665, "iter": "iter665", "bottleneck": "compute_bound", "idea": "iter665_autogrid: BM=128 BN=64 warps=2 stages=5 indexing=pointer Ktile=32 ncol=1 layout=mnk", "category": "grid", "expected_gain": "unknown", "decision": "DISCARD", "tflops": 29.58, "timestamp": "2026-04-21T15:14:44Z"}
{"round": 666, "iter": "iter666", "bottleneck": "compute_bound", "idea": "iter666_autogrid: BM=128 BN=64 warps=2 stages=5 indexing=pointer Ktile=32 ncol=1 layout=lo1", "category": "grid", "expected_gain": "unknown", "decision": "DISCARD", "tflops": 13.53, "timestamp": "2026-04-21T15:14:52Z"}
{"round": 667, "iter": "iter667", "bottleneck": "compute_bound", "idea": "iter667_autogrid: BM=128 BN=64 warps=2 stages=5 indexing=pointer Ktile=64 ncol=2 layout=mnk", "category": "grid", "expected_gain": "unknown", "decision": "DISCARD", "tflops": 13.11, "timestamp": "2026-04-21T15:15:00Z"}
{"round": 668, "iter": "iter668", "bottleneck": "compute_bound", "idea": "iter668_autogrid: BM=128 BN=64 warps=2 stages=5 indexing=pointer Ktile=64 ncol=2 layout=lo1", "category": "grid", "expected_gain": "unknown", "decision": "DISCARD", "tflops": 6.71, "timestamp": "2026-04-21T15:15:09Z"}
{"round": 669, "iter": "iter669", "bottleneck": "compute_bound", "idea": "iter669_autogrid: BM=128 BN=64 warps=2 stages=5 indexing=pointer Ktile=128 ncol=4 layout=mnk", "category": "grid", "expected_gain": "unknown", "decision": "DISCARD", "tflops": 3.26, "timestamp": "2026-04-21T15:15:23Z"}
{"round": 670, "iter": "iter670", "bottleneck": "compute_bound", "idea": "iter670_autogrid: BM=128 BN=64 warps=2 stages=5 indexing=pointer Ktile=128 ncol=4 layout=lo1", "category": "grid", "expected_gain": "unknown", "decision": "DISCARD", "tflops": 6.68, "timestamp": "2026-04-21T15:15:35Z"}
{"round": 671, "iter": "iter671", "bottleneck": "compute_bound", "idea": "iter671_autogrid: BM=128 BN=64 warps=2 stages=5 indexing=block_ptr Ktile=32 ncol=1 layout=mnk", "category": "grid", "expected_gain": "unknown", "decision": "DISCARD", "tflops": 13.54, "timestamp": "2026-04-21T15:15:43Z"}
{"round": 672, "iter": "iter672", "bottleneck": "compute_bound", "idea": "iter672_autogrid: BM=128 BN=64 warps=2 stages=5 indexing=block_ptr Ktile=32 ncol=1 layout=lo1", "category": "grid", "expected_gain": "unknown", "decision": "DISCARD", "tflops": 10.02, "timestamp": "2026-04-21T15:15:52Z"}
{"round": 673, "iter": "iter673", "bottleneck": "compute_bound", "idea": "iter673_autogrid: BM=128 BN=64 warps=2 stages=5 indexing=block_ptr Ktile=64 ncol=2 layout=mnk", "category": "grid", "expected_gain": "unknown", "decision": "DISCARD", "tflops": 23.88, "timestamp": "2026-04-21T15:15:59Z"}
{"round": 674, "iter": "iter674", "bottleneck": "compute_bound", "idea": "iter674_autogrid: BM=128 BN=64 warps=2 stages=5 indexing=block_ptr Ktile=64 ncol=2 layout=lo1", "category": "grid", "expected_gain": "unknown", "decision": "DISCARD", "tflops": 19.05, "timestamp": "2026-04-21T15:16:07Z"}
{"round": 675, "iter": "iter675", "bottleneck": "compute_bound", "idea": "iter675_autogrid: BM=128 BN=64 warps=2 stages=5 indexing=block_ptr Ktile=128 ncol=4 layout=mnk", "category": "grid", "expected_gain": "unknown", "decision": "DISCARD", "tflops": 8.0, "timestamp": "2026-04-21T15:16:18Z"}
{"round": 676, "iter": "iter676", "bottleneck": "compute_bound", "idea": "iter676_autogrid: BM=128 BN=64 warps=2 stages=5 indexing=block_ptr Ktile=128 ncol=4 layout=lo1", "category": "grid", "expected_gain": "unknown", "decision": "DISCARD", "tflops": 4.32, "timestamp": "2026-04-21T15:16:31Z"}
{"round": 677, "iter": "iter677", "bottleneck": "compute_bound", "idea": "iter677_autogrid: BM=128 BN=64 warps=2 stages=6 indexing=pointer Ktile=32 ncol=1 layout=mnk", "category": "grid", "expected_gain": "unknown", "decision": "DISCARD", "tflops": 8.73, "timestamp": "2026-04-21T15:16:39Z"}
{"round": 678, "iter": "iter678", "bottleneck": "compute_bound", "idea": "iter678_autogrid: BM=128 BN=64 warps=2 stages=6 indexing=pointer Ktile=32 ncol=1 layout=lo1", "category": "grid", "expected_gain": "unknown", "decision": "DISCARD", "tflops": 49.63, "timestamp": "2026-04-21T15:16:45Z"}
{"round": 679, "iter": "iter679", "bottleneck": "compute_bound", "idea": "iter679_autogrid: BM=128 BN=64 warps=2 stages=6 indexing=pointer Ktile=64 ncol=2 layout=mnk", "category": "grid", "expected_gain": "unknown", "decision": "DISCARD", "tflops": 13.34, "timestamp": "2026-04-21T15:16:54Z"}
{"round": 680, "iter": "iter680", "bottleneck": "compute_bound", "idea": "iter680_autogrid: BM=128 BN=64 warps=2 stages=6 indexing=pointer Ktile=64 ncol=2 layout=lo1", "category": "grid", "expected_gain": "unknown", "decision": "DISCARD", "tflops": 7.53, "timestamp": "2026-04-21T15:17:05Z"}
{"round": 681, "iter": "iter681", "bottleneck": "compute_bound", "idea": "iter681_autogrid: BM=128 BN=64 warps=2 stages=6 indexing=pointer Ktile=128 ncol=4 layout=mnk", "category": "grid", "expected_gain": "unknown", "decision": "DISCARD", "tflops": 4.02, "timestamp": "2026-04-21T15:17:18Z"}
{"round": 682, "iter": "iter682", "bottleneck": "compute_bound", "idea": "iter682_autogrid: BM=128 BN=64 warps=2 stages=6 indexing=pointer Ktile=128 ncol=4 layout=lo1", "category": "grid", "expected_gain": "unknown", "decision": "DISCARD", "tflops": 19.2, "timestamp": "2026-04-21T15:17:27Z"}
{"round": 683, "iter": "iter683", "bottleneck": "compute_bound", "idea": "iter683_autogrid: BM=128 BN=64 warps=2 stages=6 indexing=block_ptr Ktile=32 ncol=1 layout=mnk", "category": "grid", "expected_gain": "unknown", "decision": "DISCARD", "tflops": 95.99, "timestamp": "2026-04-21T15:17:34Z"}
{"round": 684, "iter": "iter684", "bottleneck": "compute_bound", "idea": "iter684_autogrid: BM=128 BN=64 warps=2 stages=6 indexing=block_ptr Ktile=32 ncol=1 layout=lo1", "category": "grid", "expected_gain": "unknown", "decision": "DISCARD", "tflops": 96.11, "timestamp": "2026-04-21T15:17:40Z"}
{"round": 685, "iter": "iter685", "bottleneck": "compute_bound", "idea": "iter685_autogrid: BM=128 BN=64 warps=2 stages=6 indexing=block_ptr Ktile=64 ncol=2 layout=mnk", "category": "grid", "expected_gain": "unknown", "decision": "DISCARD", "tflops": 63.33, "timestamp": "2026-04-21T15:17:47Z"}
{"round": 686, "iter": "iter686", "bottleneck": "compute_bound", "idea": "iter686_autogrid: BM=128 BN=64 warps=2 stages=6 indexing=block_ptr Ktile=64 ncol=2 layout=lo1", "category": "grid", "expected_gain": "unknown", "decision": "DISCARD", "tflops": 67.32, "timestamp": "2026-04-21T15:17:54Z"}
{"round": 687, "iter": "iter687", "bottleneck": "compute_bound", "idea": "iter687_autogrid: BM=128 BN=64 warps=2 stages=6 indexing=block_ptr Ktile=128 ncol=4 layout=mnk", "category": "grid", "expected_gain": "unknown", "decision": "DISCARD", "tflops": 20.13, "timestamp": "2026-04-21T15:18:02Z"}
{"round": 688, "iter": "iter688", "bottleneck": "compute_bound", "idea": "iter688_autogrid: BM=128 BN=64 warps=2 stages=6 indexing=block_ptr Ktile=128 ncol=4 layout=lo1", "category": "grid", "expected_gain": "unknown", "decision": "DISCARD", "tflops": 20.85, "timestamp": "2026-04-21T15:18:12Z"}
{"round": 689, "iter": "iter689", "bottleneck": "compute_bound", "idea": "iter689_autogrid: BM=128 BN=64 warps=4 stages=3 indexing=pointer Ktile=32 ncol=1 layout=mnk", "category": "grid", "expected_gain": "unknown", "decision": "DISCARD", "tflops": 94.95, "timestamp": "2026-04-21T15:18:17Z"}
{"round": 690, "iter": "iter690", "bottleneck": "compute_bound", "idea": "iter690_autogrid: BM=128 BN=64 warps=4 stages=3 indexing=pointer Ktile=32 ncol=1 layout=lo1", "category": "grid", "expected_gain": "unknown", "decision": "DISCARD", "tflops": 96.95, "timestamp": "2026-04-21T15:18:23Z"}
{"round": 691, "iter": "iter691", "bottleneck": "compute_bound", "idea": "iter691_autogrid: BM=128 BN=64 warps=4 stages=3 indexing=pointer Ktile=64 ncol=2 layout=mnk", "category": "grid", "expected_gain": "unknown", "decision": "DISCARD", "tflops": 114.92, "timestamp": "2026-04-21T15:18:29Z"}
{"round": 692, "iter": "iter692", "bottleneck": "compute_bound", "idea": "iter692_autogrid: BM=128 BN=64 warps=4 stages=3 indexing=pointer Ktile=64 ncol=2 layout=lo1", "category": "grid", "expected_gain": "unknown", "decision": "DISCARD", "tflops": 115.48, "timestamp": "2026-04-21T15:18:35Z"}
{"round": 693, "iter": "iter693", "bottleneck": "compute_bound", "idea": "iter693_autogrid: BM=128 BN=64 warps=4 stages=3 indexing=pointer Ktile=128 ncol=4 layout=mnk", "category": "grid", "expected_gain": "unknown", "decision": "DISCARD", "tflops": 106.38, "timestamp": "2026-04-21T15:18:41Z"}
{"round": 694, "iter": "iter694", "bottleneck": "compute_bound", "idea": "iter694_autogrid: BM=128 BN=64 warps=4 stages=3 indexing=pointer Ktile=128 ncol=4 layout=lo1", "category": "grid", "expected_gain": "unknown", "decision": "DISCARD", "tflops": 84.48, "timestamp": "2026-04-21T15:18:48Z"}
{"round": 695, "iter": "iter695", "bottleneck": "compute_bound", "idea": "iter695_autogrid: BM=128 BN=64 warps=4 stages=3 indexing=block_ptr Ktile=32 ncol=1 layout=mnk", "category": "grid", "expected_gain": "unknown", "decision": "DISCARD", "tflops": 36.54, "timestamp": "2026-04-21T15:18:54Z"}
{"round": 696, "iter": "iter696", "bottleneck": "compute_bound", "idea": "iter696_autogrid: BM=128 BN=64 warps=4 stages=3 indexing=block_ptr Ktile=32 ncol=1 layout=lo1", "category": "grid", "expected_gain": "unknown", "decision": "DISCARD", "tflops": 52.18, "timestamp": "2026-04-21T15:19:00Z"}
{"round": 697, "iter": "iter697", "bottleneck": "compute_bound", "idea": "iter697_autogrid: BM=128 BN=64 warps=4 stages=3 indexing=block_ptr Ktile=64 ncol=2 layout=mnk", "category": "grid", "expected_gain": "unknown", "decision": "DISCARD", "tflops": 118.2, "timestamp": "2026-04-21T15:19:06Z"}
{"round": 698, "iter": "iter698", "bottleneck": "compute_bound", "idea": "iter698_autogrid: BM=128 BN=64 warps=4 stages=3 indexing=block_ptr Ktile=64 ncol=2 layout=lo1", "category": "grid", "expected_gain": "unknown", "decision": "DISCARD", "tflops": 108.54, "timestamp": "2026-04-21T15:19:12Z"}
{"round": 699, "iter": "iter699", "bottleneck": "compute_bound", "idea": "iter699_autogrid: BM=128 BN=64 warps=4 stages=3 indexing=block_ptr Ktile=128 ncol=4 layout=mnk", "category": "grid", "expected_gain": "unknown", "decision": "DISCARD", "tflops": 106.94, "timestamp": "2026-04-21T15:19:19Z"}
{"round": 700, "iter": "iter700", "bottleneck": "compute_bound", "idea": "iter700_autogrid: BM=128 BN=64 warps=4 stages=3 indexing=block_ptr Ktile=128 ncol=4 layout=lo1", "category": "grid", "expected_gain": "unknown", "decision": "DISCARD", "tflops": 113.29, "timestamp": "2026-04-21T15:19:25Z"}
{"round": 501, "iter": "iter501", "bottleneck": "compute_bound", "idea": "iter501_autogrid: BM=64 BN=128 warps=2 stages=3 indexing=pointer Ktile=128 ncol=4 layout=mnk", "category": "grid", "expected_gain": "unknown", "decision": "DISCARD", "tflops": 40.09, "timestamp": "2026-04-21T16:51:47Z"}
{"round": 502, "iter": "iter502", "bottleneck": "compute_bound", "idea": "iter502_autogrid: BM=64 BN=128 warps=2 stages=3 indexing=pointer Ktile=128 ncol=4 layout=lo1", "category": "grid", "expected_gain": "unknown", "decision": "DISCARD", "tflops": 36.41, "timestamp": "2026-04-21T16:51:53Z"}
{"round": 503, "iter": "iter503", "bottleneck": "compute_bound", "idea": "iter503_autogrid: BM=64 BN=128 warps=2 stages=3 indexing=block_ptr Ktile=32 ncol=1 layout=mnk", "category": "grid", "expected_gain": "unknown", "decision": "DISCARD", "tflops": 102.96, "timestamp": "2026-04-21T16:51:58Z"}
{"round": 504, "iter": "iter504", "bottleneck": "compute_bound", "idea": "iter504_autogrid: BM=64 BN=128 warps=2 stages=3 indexing=block_ptr Ktile=32 ncol=1 layout=lo1", "category": "grid", "expected_gain": "unknown", "decision": "DISCARD", "tflops": 103.43, "timestamp": "2026-04-21T16:52:03Z"}
{"round": 505, "iter": "iter505", "bottleneck": "compute_bound", "idea": "iter505_autogrid: BM=64 BN=128 warps=2 stages=3 indexing=block_ptr Ktile=64 ncol=2 layout=mnk", "category": "grid", "expected_gain": "unknown", "decision": "DISCARD", "tflops": 87.21, "timestamp": "2026-04-21T16:52:09Z"}
{"round": 506, "iter": "iter506", "bottleneck": "compute_bound", "idea": "iter506_autogrid: BM=64 BN=128 warps=2 stages=3 indexing=block_ptr Ktile=64 ncol=2 layout=lo1", "category": "grid", "expected_gain": "unknown", "decision": "DISCARD", "tflops": 85.26, "timestamp": "2026-04-21T16:52:15Z"}
{"round": 507, "iter": "iter507", "bottleneck": "compute_bound", "idea": "iter507_autogrid: BM=64 BN=128 warps=2 stages=3 indexing=block_ptr Ktile=128 ncol=4 layout=mnk", "category": "grid", "expected_gain": "unknown", "decision": "DISCARD", "tflops": 40.22, "timestamp": "2026-04-21T16:52:20Z"}
{"round": 508, "iter": "iter508", "bottleneck": "compute_bound", "idea": "iter508_autogrid: BM=64 BN=128 warps=2 stages=3 indexing=block_ptr Ktile=128 ncol=4 layout=lo1", "category": "grid", "expected_gain": "unknown", "decision": "DISCARD", "tflops": 35.3, "timestamp": "2026-04-21T16:52:26Z"}
{"round": 509, "iter": "iter509", "bottleneck": "compute_bound", "idea": "iter509_autogrid: BM=64 BN=128 warps=2 stages=4 indexing=pointer Ktile=32 ncol=1 layout=mnk", "category": "grid", "expected_gain": "unknown", "decision": "DISCARD", "tflops": 101.6, "timestamp": "2026-04-21T16:52:31Z"}
{"round": 510, "iter": "iter510", "bottleneck": "compute_bound", "idea": "iter510_autogrid: BM=64 BN=128 warps=2 stages=4 indexing=pointer Ktile=32 ncol=1 layout=lo1", "category": "grid", "expected_gain": "unknown", "decision": "DISCARD", "tflops": 102.33, "timestamp": "2026-04-21T16:52:36Z"}
{"round": 511, "iter": "iter511", "bottleneck": "compute_bound", "idea": "iter511_autogrid: BM=64 BN=128 warps=2 stages=4 indexing=pointer Ktile=64 ncol=2 layout=mnk", "category": "grid", "expected_gain": "unknown", "decision": "DISCARD", "tflops": 85.84, "timestamp": "2026-04-21T16:52:41Z"}
{"round": 512, "iter": "iter512", "bottleneck": "compute_bound", "idea": "iter512_autogrid: BM=64 BN=128 warps=2 stages=4 indexing=pointer Ktile=64 ncol=2 layout=lo1", "category": "grid", "expected_gain": "unknown", "decision": "DISCARD", "tflops": 85.95, "timestamp": "2026-04-21T16:52:47Z"}
{"round": 513, "iter": "iter513", "bottleneck": "compute_bound", "idea": "iter513_autogrid: BM=64 BN=128 warps=2 stages=4 indexing=pointer Ktile=128 ncol=4 layout=mnk", "category": "grid", "expected_gain": "unknown", "decision": "DISCARD", "tflops": 42.3, "timestamp": "2026-04-21T16:52:53Z"}
{"round": 514, "iter": "iter514", "bottleneck": "compute_bound", "idea": "iter514_autogrid: BM=64 BN=128 warps=2 stages=4 indexing=pointer Ktile=128 ncol=4 layout=lo1", "category": "grid", "expected_gain": "unknown", "decision": "DISCARD", "tflops": 39.0, "timestamp": "2026-04-21T16:52:58Z"}
{"round": 515, "iter": "iter515", "bottleneck": "compute_bound", "idea": "iter515_autogrid: BM=64 BN=128 warps=2 stages=4 indexing=block_ptr Ktile=32 ncol=1 layout=mnk", "category": "grid", "expected_gain": "unknown", "decision": "DISCARD", "tflops": 104.81, "timestamp": "2026-04-21T16:53:03Z"}
{"round": 516, "iter": "iter516", "bottleneck": "compute_bound", "idea": "iter516_autogrid: BM=64 BN=128 warps=2 stages=4 indexing=block_ptr Ktile=32 ncol=1 layout=lo1", "category": "grid", "expected_gain": "unknown", "decision": "DISCARD", "tflops": 104.26, "timestamp": "2026-04-21T16:53:09Z"}
{"round": 517, "iter": "iter517", "bottleneck": "compute_bound", "idea": "iter517_autogrid: BM=64 BN=128 warps=2 stages=4 indexing=block_ptr Ktile=64 ncol=2 layout=mnk", "category": "grid", "expected_gain": "unknown", "decision": "DISCARD", "tflops": 84.89, "timestamp": "2026-04-21T16:53:14Z"}
{"round": 518, "iter": "iter518", "bottleneck": "compute_bound", "idea": "iter518_autogrid: BM=64 BN=128 warps=2 stages=4 indexing=block_ptr Ktile=64 ncol=2 layout=lo1", "category": "grid", "expected_gain": "unknown", "decision": "DISCARD", "tflops": 83.54, "timestamp": "2026-04-21T16:53:19Z"}
{"round": 519, "iter": "iter519", "bottleneck": "compute_bound", "idea": "iter519_autogrid: BM=64 BN=128 warps=2 stages=4 indexing=block_ptr Ktile=128 ncol=4 layout=mnk", "category": "grid", "expected_gain": "unknown", "decision": "DISCARD", "tflops": 42.62, "timestamp": "2026-04-21T16:53:25Z"}
{"round": 520, "iter": "iter520", "bottleneck": "compute_bound", "idea": "iter520_autogrid: BM=64 BN=128 warps=2 stages=4 indexing=block_ptr Ktile=128 ncol=4 layout=lo1", "category": "grid", "expected_gain": "unknown", "decision": "DISCARD", "tflops": 39.51, "timestamp": "2026-04-21T16:53:31Z"}
{"round": 521, "iter": "iter521", "bottleneck": "compute_bound", "idea": "iter521_autogrid: BM=64 BN=128 warps=2 stages=5 indexing=pointer Ktile=32 ncol=1 layout=mnk", "category": "grid", "expected_gain": "unknown", "decision": "DISCARD", "tflops": 104.37, "timestamp": "2026-04-21T16:53:36Z"}
{"round": 522, "iter": "iter522", "bottleneck": "compute_bound", "idea": "iter522_autogrid: BM=64 BN=128 warps=2 stages=5 indexing=pointer Ktile=32 ncol=1 layout=lo1", "category": "grid", "expected_gain": "unknown", "decision": "DISCARD", "tflops": 104.79, "timestamp": "2026-04-21T16:53:41Z"}
{"round": 523, "iter": "iter523", "bottleneck": "compute_bound", "idea": "iter523_autogrid: BM=64 BN=128 warps=2 stages=5 indexing=pointer Ktile=64 ncol=2 layout=mnk", "category": "grid", "expected_gain": "unknown", "decision": "DISCARD", "tflops": 84.28, "timestamp": "2026-04-21T16:53:46Z"}
{"round": 524, "iter": "iter524", "bottleneck": "compute_bound", "idea": "iter524_autogrid: BM=64 BN=128 warps=2 stages=5 indexing=pointer Ktile=64 ncol=2 layout=lo1", "category": "grid", "expected_gain": "unknown", "decision": "DISCARD", "tflops": 82.55, "timestamp": "2026-04-21T16:53:52Z"}
{"round": 525, "iter": "iter525", "bottleneck": "compute_bound", "idea": "iter525_autogrid: BM=64 BN=128 warps=2 stages=5 indexing=pointer Ktile=128 ncol=4 layout=mnk", "category": "grid", "expected_gain": "unknown", "decision": "DISCARD", "tflops": 37.77, "timestamp": "2026-04-21T16:53:57Z"}
{"round": 526, "iter": "iter526", "bottleneck": "compute_bound", "idea": "iter526_autogrid: BM=64 BN=128 warps=2 stages=5 indexing=pointer Ktile=128 ncol=4 layout=lo1", "category": "grid", "expected_gain": "unknown", "decision": "DISCARD", "tflops": 37.19, "timestamp": "2026-04-21T16:54:03Z"}
{"round": 527, "iter": "iter527", "bottleneck": "compute_bound", "idea": "iter527_autogrid: BM=64 BN=128 warps=2 stages=5 indexing=block_ptr Ktile=32 ncol=1 layout=mnk", "category": "grid", "expected_gain": "unknown", "decision": "DISCARD", "tflops": 104.37, "timestamp": "2026-04-21T16:54:08Z"}
{"round": 528, "iter": "iter528", "bottleneck": "compute_bound", "idea": "iter528_autogrid: BM=64 BN=128 warps=2 stages=5 indexing=block_ptr Ktile=32 ncol=1 layout=lo1", "category": "grid", "expected_gain": "unknown", "decision": "DISCARD", "tflops": 104.82, "timestamp": "2026-04-21T16:54:13Z"}
{"round": 529, "iter": "iter529", "bottleneck": "compute_bound", "idea": "iter529_autogrid: BM=64 BN=128 warps=2 stages=5 indexing=block_ptr Ktile=64 ncol=2 layout=mnk", "category": "grid", "expected_gain": "unknown", "decision": "DISCARD", "tflops": 80.29, "timestamp": "2026-04-21T16:54:18Z"}
{"round": 530, "iter": "iter530", "bottleneck": "compute_bound", "idea": "iter530_autogrid: BM=64 BN=128 warps=2 stages=5 indexing=block_ptr Ktile=64 ncol=2 layout=lo1", "category": "grid", "expected_gain": "unknown", "decision": "DISCARD", "tflops": 80.89, "timestamp": "2026-04-21T16:54:23Z"}
{"round": 531, "iter": "iter531", "bottleneck": "compute_bound", "idea": "iter531_autogrid: BM=64 BN=128 warps=2 stages=5 indexing=block_ptr Ktile=128 ncol=4 layout=mnk", "category": "grid", "expected_gain": "unknown", "decision": "DISCARD", "tflops": 38.24, "timestamp": "2026-04-21T16:54:29Z"}
{"round": 532, "iter": "iter532", "bottleneck": "compute_bound", "idea": "iter532_autogrid: BM=64 BN=128 warps=2 stages=5 indexing=block_ptr Ktile=128 ncol=4 layout=lo1", "category": "grid", "expected_gain": "unknown", "decision": "DISCARD", "tflops": 36.84, "timestamp": "2026-04-21T16:54:34Z"}
{"round": 533, "iter": "iter533", "bottleneck": "compute_bound", "idea": "iter533_autogrid: BM=64 BN=128 warps=2 stages=6 indexing=pointer Ktile=32 ncol=1 layout=mnk", "category": "grid", "expected_gain": "unknown", "decision": "DISCARD", "tflops": 103.51, "timestamp": "2026-04-21T16:54:40Z"}
