{"round": 512, "iter": "iter512", "bottleneck": "compute_bound", "idea": "iter512_autogrid: BM=64 BN=128 warps=2 stages=4 indexing=pointer Ktile=64 ncol=2 layout=lo1", "category": "grid", "expected_gain": "unknown", "decision": "DISCARD", "tflops": 85.17, "timestamp": "2026-04-21T14:57:49Z"}
{"round": 513, "iter": "iter513", "bottleneck": "compute_bound", "idea": "iter513_autogrid: BM=64 BN=128 warps=2 stages=4 indexing=pointer Ktile=128 ncol=4 layout=mnk", "category": "grid", "expected_gain": "unknown", "decision": "DISCARD", "tflops": 42.88, "timestamp": "2026-04-21T14:57:57Z"}
{"round": 514, "iter": "iter514", "bottleneck": "compute_bound", "idea": "iter514_autogrid: BM=64 BN=128 warps=2 stages=4 indexing=pointer Ktile=128 ncol=4 layout=lo1", "category": "grid", "expected_gain": "unknown", "decision": "DISCARD", "tflops": 39.7, "timestamp": "2026-04-21T14:58:06Z"}
{"round": 515, "iter": "iter515", "bottleneck": "compute_bound", "idea": "iter515_autogrid: BM=64 BN=128 warps=2 stages=4 indexing=block_ptr Ktile=32 ncol=1 layout=mnk", "category": "grid", "expected_gain": "unknown", "decision": "DISCARD", "tflops": 105.2, "timestamp": "2026-04-21T14:58:12Z"}
{"round": 516, "iter": "iter516", "bottleneck": "compute_bound", "idea": "iter516_autogrid: BM=64 BN=128 warps=2 stages=4 indexing=block_ptr Ktile=32 ncol=1 layout=lo1", "category": "grid", "expected_gain": "unknown", "decision": "DISCARD", "tflops": 104.11, "timestamp": "2026-04-21T14:58:18Z"}
{"round": 517, "iter": "iter517", "bottleneck": "compute_bound", "idea": "iter517_autogrid: BM=64 BN=128 warps=2 stages=4 indexing=block_ptr Ktile=64 ncol=2 layout=mnk", "category": "grid", "expected_gain": "unknown", "decision": "DISCARD", "tflops": 85.3, "timestamp": "2026-04-21T14:58:25Z"}
{"round": 518, "iter": "iter518", "bottleneck": "compute_bound", "idea": "iter518_autogrid: BM=64 BN=128 warps=2 stages=4 indexing=block_ptr Ktile=64 ncol=2 layout=lo1", "category": "grid", "expected_gain": "unknown", "decision": "DISCARD", "tflops": 83.2, "timestamp": "2026-04-21T14:58:31Z"}
{"round": 519, "iter": "iter519", "bottleneck": "compute_bound", "idea": "iter519_autogrid: BM=64 BN=128 warps=2 stages=4 indexing=block_ptr Ktile=128 ncol=4 layout=mnk", "category": "grid", "expected_gain": "unknown", "decision": "DISCARD", "tflops": 42.26, "timestamp": "2026-04-21T14:58:40Z"}
{"round": 520, "iter": "iter520", "bottleneck": "compute_bound", "idea": "iter520_autogrid: BM=64 BN=128 warps=2 stages=4 indexing=block_ptr Ktile=128 ncol=4 layout=lo1", "category": "grid", "expected_gain": "unknown", "decision": "DISCARD", "tflops": 39.14, "timestamp": "2026-04-21T14:58:49Z"}
{"round": 521, "iter": "iter521", "bottleneck": "compute_bound", "idea": "iter521_autogrid: BM=64 BN=128 warps=2 stages=5 indexing=pointer Ktile=32 ncol=1 layout=mnk", "category": "grid", "expected_gain": "unknown", "decision": "DISCARD", "tflops": 103.74, "timestamp": "2026-04-21T14:58:55Z"}
{"round": 522, "iter": "iter522", "bottleneck": "compute_bound", "idea": "iter522_autogrid: BM=64 BN=128 warps=2 stages=5 indexing=pointer Ktile=32 ncol=1 layout=lo1", "category": "grid", "expected_gain": "unknown", "decision": "DISCARD", "tflops": 106.19, "timestamp": "2026-04-21T14:59:01Z"}
{"round": 523, "iter": "iter523", "bottleneck": "compute_bound", "idea": "iter523_autogrid: BM=64 BN=128 warps=2 stages=5 indexing=pointer Ktile=64 ncol=2 layout=mnk", "category": "grid", "expected_gain": "unknown", "decision": "DISCARD", "tflops": 84.58, "timestamp": "2026-04-21T14:59:08Z"}
{"round": 524, "iter": "iter524", "bottleneck": "compute_bound", "idea": "iter524_autogrid: BM=64 BN=128 warps=2 stages=5 indexing=pointer Ktile=64 ncol=2 layout=lo1", "category": "grid", "expected_gain": "unknown", "decision": "DISCARD", "tflops": 82.71, "timestamp": "2026-04-21T14:59:15Z"}
{"round": 525, "iter": "iter525", "bottleneck": "compute_bound", "idea": "iter525_autogrid: BM=64 BN=128 warps=2 stages=5 indexing=pointer Ktile=128 ncol=4 layout=mnk", "category": "grid", "expected_gain": "unknown", "decision": "DISCARD", "tflops": 37.31, "timestamp": "2026-04-21T14:59:23Z"}
{"round": 526, "iter": "iter526", "bottleneck": "compute_bound", "idea": "iter526_autogrid: BM=64 BN=128 warps=2 stages=5 indexing=pointer Ktile=128 ncol=4 layout=lo1", "category": "grid", "expected_gain": "unknown", "decision": "DISCARD", "tflops": 37.09, "timestamp": "2026-04-21T14:59:32Z"}
{"round": 527, "iter": "iter527", "bottleneck": "compute_bound", "idea": "iter527_autogrid: BM=64 BN=128 warps=2 stages=5 indexing=block_ptr Ktile=32 ncol=1 layout=mnk", "category": "grid", "expected_gain": "unknown", "decision": "DISCARD", "tflops": 103.72, "timestamp": "2026-04-21T14:59:38Z"}
{"round": 528, "iter": "iter528", "bottleneck": "compute_bound", "idea": "iter528_autogrid: BM=64 BN=128 warps=2 stages=5 indexing=block_ptr Ktile=32 ncol=1 layout=lo1", "category": "grid", "expected_gain": "unknown", "decision": "DISCARD", "tflops": 105.18, "timestamp": "2026-04-21T14:59:44Z"}
{"round": 529, "iter": "iter529", "bottleneck": "compute_bound", "idea": "iter529_autogrid: BM=64 BN=128 warps=2 stages=5 indexing=block_ptr Ktile=64 ncol=2 layout=mnk", "category": "grid", "expected_gain": "unknown", "decision": "DISCARD", "tflops": 80.03, "timestamp": "2026-04-21T14:59:51Z"}
{"round": 530, "iter": "iter530", "bottleneck": "compute_bound", "idea": "iter530_autogrid: BM=64 BN=128 warps=2 stages=5 indexing=block_ptr Ktile=64 ncol=2 layout=lo1", "category": "grid", "expected_gain": "unknown", "decision": "DISCARD", "tflops": 81.21, "timestamp": "2026-04-21T14:59:58Z"}
{"round": 531, "iter": "iter531", "bottleneck": "compute_bound", "idea": "iter531_autogrid: BM=64 BN=128 warps=2 stages=5 indexing=block_ptr Ktile=128 ncol=4 layout=mnk", "category": "grid", "expected_gain": "unknown", "decision": "DISCARD", "tflops": 21.86, "timestamp": "2026-04-21T15:00:07Z"}
{"round": 532, "iter": "iter532", "bottleneck": "compute_bound", "idea": "iter532_autogrid: BM=64 BN=128 warps=2 stages=5 indexing=block_ptr Ktile=128 ncol=4 layout=lo1", "category": "grid", "expected_gain": "unknown", "decision": "DISCARD", "tflops": 36.91, "timestamp": "2026-04-21T15:00:16Z"}
{"round": 533, "iter": "iter533", "bottleneck": "compute_bound", "idea": "iter533_autogrid: BM=64 BN=128 warps=2 stages=6 indexing=pointer Ktile=32 ncol=1 layout=mnk", "category": "grid", "expected_gain": "unknown", "decision": "DISCARD", "tflops": 103.7, "timestamp": "2026-04-21T15:00:22Z"}
{"round": 534, "iter": "iter534", "bottleneck": "compute_bound", "idea": "iter534_autogrid: BM=64 BN=128 warps=2 stages=6 indexing=pointer Ktile=32 ncol=1 layout=lo1", "category": "grid", "expected_gain": "unknown", "decision": "DISCARD", "tflops": 103.65, "timestamp": "2026-04-21T15:00:28Z"}
{"round": 535, "iter": "iter535", "bottleneck": "compute_bound", "idea": "iter535_autogrid: BM=64 BN=128 warps=2 stages=6 indexing=pointer Ktile=64 ncol=2 layout=mnk", "category": "grid", "expected_gain": "unknown", "decision": "DISCARD", "tflops": 68.79, "timestamp": "2026-04-21T15:00:34Z"}
{"round": 536, "iter": "iter536", "bottleneck": "compute_bound", "idea": "iter536_autogrid: BM=64 BN=128 warps=2 stages=6 indexing=pointer Ktile=64 ncol=2 layout=lo1", "category": "grid", "expected_gain": "unknown", "decision": "DISCARD", "tflops": 68.77, "timestamp": "2026-04-21T15:00:41Z"}
{"round": 537, "iter": "iter537", "bottleneck": "compute_bound", "idea": "iter537_autogrid: BM=64 BN=128 warps=2 stages=6 indexing=pointer Ktile=128 ncol=4 layout=mnk", "category": "grid", "expected_gain": "unknown", "decision": "DISCARD", "tflops": 20.42, "timestamp": "2026-04-21T15:00:50Z"}
{"round": 538, "iter": "iter538", "bottleneck": "compute_bound", "idea": "iter538_autogrid: BM=64 BN=128 warps=2 stages=6 indexing=pointer Ktile=128 ncol=4 layout=lo1", "category": "grid", "expected_gain": "unknown", "decision": "DISCARD", "tflops": 20.39, "timestamp": "2026-04-21T15:00:59Z"}
{"round": 539, "iter": "iter539", "bottleneck": "compute_bound", "idea": "iter539_autogrid: BM=64 BN=128 warps=2 stages=6 indexing=block_ptr Ktile=32 ncol=1 layout=mnk", "category": "grid", "expected_gain": "unknown", "decision": "DISCARD", "tflops": 103.74, "timestamp": "2026-04-21T15:01:06Z"}
{"round": 540, "iter": "iter540", "bottleneck": "compute_bound", "idea": "iter540_autogrid: BM=64 BN=128 warps=2 stages=6 indexing=block_ptr Ktile=32 ncol=1 layout=lo1", "category": "grid", "expected_gain": "unknown", "decision": "DISCARD", "tflops": 104.91, "timestamp": "2026-04-21T15:01:12Z"}
{"round": 541, "iter": "iter541", "bottleneck": "compute_bound", "idea": "iter541_autogrid: BM=64 BN=128 warps=2 stages=6 indexing=block_ptr Ktile=64 ncol=2 layout=mnk", "category": "grid", "expected_gain": "unknown", "decision": "DISCARD", "tflops": 64.57, "timestamp": "2026-04-21T15:01:19Z"}
{"round": 542, "iter": "iter542", "bottleneck": "compute_bound", "idea": "iter542_autogrid: BM=64 BN=128 warps=2 stages=6 indexing=block_ptr Ktile=64 ncol=2 layout=lo1", "category": "grid", "expected_gain": "unknown", "decision": "DISCARD", "tflops": 33.25, "timestamp": "2026-04-21T15:01:27Z"}
{"round": 543, "iter": "iter543", "bottleneck": "compute_bound", "idea": "iter543_autogrid: BM=64 BN=128 warps=2 stages=6 indexing=block_ptr Ktile=128 ncol=4 layout=mnk", "category": "grid", "expected_gain": "unknown", "decision": "DISCARD", "tflops": 20.75, "timestamp": "2026-04-21T15:01:38Z"}
{"round": 544, "iter": "iter544", "bottleneck": "compute_bound", "idea": "iter544_autogrid: BM=64 BN=128 warps=2 stages=6 indexing=block_ptr Ktile=128 ncol=4 layout=lo1", "category": "grid", "expected_gain": "unknown", "decision": "DISCARD", "tflops": 20.1, "timestamp": "2026-04-21T15:01:47Z"}
{"round": 545, "iter": "iter545", "bottleneck": "compute_bound", "idea": "iter545_autogrid: BM=64 BN=128 warps=4 stages=3 indexing=pointer Ktile=32 ncol=1 layout=mnk", "category": "grid", "expected_gain": "unknown", "decision": "DISCARD", "tflops": 118.7, "timestamp": "2026-04-21T15:01:53Z"}
{"round": 546, "iter": "iter546", "bottleneck": "compute_bound", "idea": "iter546_autogrid: BM=64 BN=128 warps=4 stages=3 indexing=pointer Ktile=32 ncol=1 layout=lo1", "category": "grid", "expected_gain": "unknown", "decision": "DISCARD", "tflops": 114.59, "timestamp": "2026-04-21T15:01:59Z"}
{"round": 547, "iter": "iter547", "bottleneck": "compute_bound", "idea": "iter547_autogrid: BM=64 BN=128 warps=4 stages=3 indexing=pointer Ktile=64 ncol=2 layout=mnk", "category": "grid", "expected_gain": "unknown", "decision": "DISCARD", "tflops": 111.87, "timestamp": "2026-04-21T15:02:05Z"}
{"round": 548, "iter": "iter548", "bottleneck": "compute_bound", "idea": "iter548_autogrid: BM=64 BN=128 warps=4 stages=3 indexing=pointer Ktile=64 ncol=2 layout=lo1", "category": "grid", "expected_gain": "unknown", "decision": "DISCARD", "tflops": 126.42, "timestamp": "2026-04-21T15:02:11Z"}
{"round": 549, "iter": "iter549", "bottleneck": "compute_bound", "idea": "iter549_autogrid: BM=64 BN=128 warps=4 stages=3 indexing=pointer Ktile=128 ncol=4 layout=mnk", "category": "grid", "expected_gain": "unknown", "decision": "DISCARD", "tflops": 125.38, "timestamp": "2026-04-21T15:02:17Z"}
{"round": 550, "iter": "iter550", "bottleneck": "compute_bound", "idea": "iter550_autogrid: BM=64 BN=128 warps=4 stages=3 indexing=pointer Ktile=128 ncol=4 layout=lo1", "category": "grid", "expected_gain": "unknown", "decision": "DISCARD", "tflops": 122.14, "timestamp": "2026-04-21T15:02:23Z"}
{"round": 551, "iter": "iter551", "bottleneck": "compute_bound", "idea": "iter551_autogrid: BM=64 BN=128 warps=4 stages=3 indexing=block_ptr Ktile=32 ncol=1 layout=mnk", "category": "grid", "expected_gain": "unknown", "decision": "DISCARD", "tflops": 117.06, "timestamp": "2026-04-21T15:02:29Z"}
{"round": 552, "iter": "iter552", "bottleneck": "compute_bound", "idea": "iter552_autogrid: BM=64 BN=128 warps=4 stages=3 indexing=block_ptr Ktile=32 ncol=1 layout=lo1", "category": "grid", "expected_gain": "unknown", "decision": "DISCARD", "tflops": 115.51, "timestamp": "2026-04-21T15:02:35Z"}
{"round": 553, "iter": "iter553", "bottleneck": "compute_bound", "idea": "iter553_autogrid: BM=64 BN=128 warps=4 stages=3 indexing=block_ptr Ktile=64 ncol=2 layout=mnk", "category": "grid", "expected_gain": "unknown", "decision": "DISCARD", "tflops": 126.84, "timestamp": "2026-04-21T15:02:42Z"}
{"round": 554, "iter": "iter554", "bottleneck": "compute_bound", "idea": "iter554_autogrid: BM=64 BN=128 warps=4 stages=3 indexing=block_ptr Ktile=64 ncol=2 layout=lo1", "category": "grid", "expected_gain": "unknown", "decision": "DISCARD", "tflops": 126.65, "timestamp": "2026-04-21T15:02:48Z"}
{"round": 555, "iter": "iter555", "bottleneck": "compute_bound", "idea": "iter555_autogrid: BM=64 BN=128 warps=4 stages=3 indexing=block_ptr Ktile=128 ncol=4 layout=mnk", "category": "grid", "expected_gain": "unknown", "decision": "DISCARD", "tflops": 128.14, "timestamp": "2026-04-21T15:02:54Z"}
{"round": 556, "iter": "iter556", "bottleneck": "compute_bound", "idea": "iter556_autogrid: BM=64 BN=128 warps=4 stages=3 indexing=block_ptr Ktile=128 ncol=4 layout=lo1", "category": "grid", "expected_gain": "unknown", "decision": "DISCARD", "tflops": 122.32, "timestamp": "2026-04-21T15:03:01Z"}
{"round": 557, "iter": "iter557", "bottleneck": "compute_bound", "idea": "iter557_autogrid: BM=64 BN=128 warps=4 stages=4 indexing=pointer Ktile=32 ncol=1 layout=mnk", "category": "grid", "expected_gain": "unknown", "decision": "DISCARD", "tflops": 118.62, "timestamp": "2026-04-21T15:03:06Z"}
{"round": 558, "iter": "iter558", "bottleneck": "compute_bound", "idea": "iter558_autogrid: BM=64 BN=128 warps=4 stages=4 indexing=pointer Ktile=32 ncol=1 layout=lo1", "category": "grid", "expected_gain": "unknown", "decision": "DISCARD", "tflops": 51.02, "timestamp": "2026-04-21T15:03:13Z"}
{"round": 559, "iter": "iter559", "bottleneck": "compute_bound", "idea": "iter559_autogrid: BM=64 BN=128 warps=4 stages=4 indexing=pointer Ktile=64 ncol=2 layout=mnk", "category": "grid", "expected_gain": "unknown", "decision": "DISCARD", "tflops": 124.33, "timestamp": "2026-04-21T15:03:19Z"}
{"round": 560, "iter": "iter560", "bottleneck": "compute_bound", "idea": "iter560_autogrid: BM=64 BN=128 warps=4 stages=4 indexing=pointer Ktile=64 ncol=2 layout=lo1", "category": "grid", "expected_gain": "unknown", "decision": "DISCARD", "tflops": 122.41, "timestamp": "2026-04-21T15:03:25Z"}
{"round": 561, "iter": "iter561", "bottleneck": "compute_bound", "idea": "iter561_autogrid: BM=64 BN=128 warps=4 stages=4 indexing=pointer Ktile=128 ncol=4 layout=mnk", "category": "grid", "expected_gain": "unknown", "decision": "DISCARD", "tflops": 126.96, "timestamp": "2026-04-21T15:03:31Z"}
{"round": 562, "iter": "iter562", "bottleneck": "compute_bound", "idea": "iter562_autogrid: BM=64 BN=128 warps=4 stages=4 indexing=pointer Ktile=128 ncol=4 layout=lo1", "category": "grid", "expected_gain": "unknown", "decision": "DISCARD", "tflops": 121.81, "timestamp": "2026-04-21T15:03:38Z"}
{"round": 563, "iter": "iter563", "bottleneck": "compute_bound", "idea": "iter563_autogrid: BM=64 BN=128 warps=4 stages=4 indexing=block_ptr Ktile=32 ncol=1 layout=mnk", "category": "grid", "expected_gain": "unknown", "decision": "DISCARD", "tflops": 117.73, "timestamp": "2026-04-21T15:03:43Z"}
{"round": 564, "iter": "iter564", "bottleneck": "compute_bound", "idea": "iter564_autogrid: BM=64 BN=128 warps=4 stages=4 indexing=block_ptr Ktile=32 ncol=1 layout=lo1", "category": "grid", "expected_gain": "unknown", "decision": "DISCARD", "tflops": 115.53, "timestamp": "2026-04-21T15:03:49Z"}
{"round": 565, "iter": "iter565", "bottleneck": "compute_bound", "idea": "iter565_autogrid: BM=64 BN=128 warps=4 stages=4 indexing=block_ptr Ktile=64 ncol=2 layout=mnk", "category": "grid", "expected_gain": "unknown", "decision": "DISCARD", "tflops": 124.23, "timestamp": "2026-04-21T15:03:56Z"}
{"round": 566, "iter": "iter566", "bottleneck": "compute_bound", "idea": "iter566_autogrid: BM=64 BN=128 warps=4 stages=4 indexing=block_ptr Ktile=64 ncol=2 layout=lo1", "category": "grid", "expected_gain": "unknown", "decision": "DISCARD", "tflops": 123.14, "timestamp": "2026-04-21T15:04:02Z"}
{"round": 567, "iter": "iter567", "bottleneck": "compute_bound", "idea": "iter567_autogrid: BM=64 BN=128 warps=4 stages=4 indexing=block_ptr Ktile=128 ncol=4 layout=mnk", "category": "grid", "expected_gain": "unknown", "decision": "DISCARD", "tflops": 60.09, "timestamp": "2026-04-21T15:04:08Z"}
{"round": 568, "iter": "iter568", "bottleneck": "compute_bound", "idea": "iter568_autogrid: BM=64 BN=128 warps=4 stages=4 indexing=block_ptr Ktile=128 ncol=4 layout=lo1", "category": "grid", "expected_gain": "unknown", "decision": "DISCARD", "tflops": 123.12, "timestamp": "2026-04-21T15:04:15Z"}
{"round": 569, "iter": "iter569", "bottleneck": "compute_bound", "idea": "iter569_autogrid: BM=64 BN=128 warps=4 stages=5 indexing=pointer Ktile=32 ncol=1 layout=mnk", "category": "grid", "expected_gain": "unknown", "decision": "DISCARD", "tflops": 118.21, "timestamp": "2026-04-21T15:04:21Z"}
{"round": 570, "iter": "iter570", "bottleneck": "compute_bound", "idea": "iter570_autogrid: BM=64 BN=128 warps=4 stages=5 indexing=pointer Ktile=32 ncol=1 layout=lo1", "category": "grid", "expected_gain": "unknown", "decision": "DISCARD", "tflops": 116.09, "timestamp": "2026-04-21T15:04:27Z"}
{"round": 571, "iter": "iter571", "bottleneck": "compute_bound", "idea": "iter571_autogrid: BM=64 BN=128 warps=4 stages=5 indexing=pointer Ktile=64 ncol=2 layout=mnk", "category": "grid", "expected_gain": "unknown", "decision": "DISCARD", "tflops": 123.89, "timestamp": "2026-04-21T15:04:33Z"}
{"round": 572, "iter": "iter572", "bottleneck": "compute_bound", "idea": "iter572_autogrid: BM=64 BN=128 warps=4 stages=5 indexing=pointer Ktile=64 ncol=2 layout=lo1", "category": "grid", "expected_gain": "unknown", "decision": "DISCARD", "tflops": 121.98, "timestamp": "2026-04-21T15:04:38Z"}
{"round": 573, "iter": "iter573", "bottleneck": "compute_bound", "idea": "iter573_autogrid: BM=64 BN=128 warps=4 stages=5 indexing=pointer Ktile=128 ncol=4 layout=mnk", "category": "grid", "expected_gain": "unknown", "decision": "DISCARD", "tflops": 84.89, "timestamp": "2026-04-21T15:04:45Z"}
{"round": 574, "iter": "iter574", "bottleneck": "compute_bound", "idea": "iter574_autogrid: BM=64 BN=128 warps=4 stages=5 indexing=pointer Ktile=128 ncol=4 layout=lo1", "category": "grid", "expected_gain": "unknown", "decision": "DISCARD", "tflops": 81.35, "timestamp": "2026-04-21T15:04:52Z"}
{"round": 575, "iter": "iter575", "bottleneck": "compute_bound", "idea": "iter575_autogrid: BM=64 BN=128 warps=4 stages=5 indexing=block_ptr Ktile=32 ncol=1 layout=mnk", "category": "grid", "expected_gain": "unknown", "decision": "DISCARD", "tflops": 117.07, "timestamp": "2026-04-21T15:04:58Z"}
{"round": 576, "iter": "iter576", "bottleneck": "compute_bound", "idea": "iter576_autogrid: BM=64 BN=128 warps=4 stages=5 indexing=block_ptr Ktile=32 ncol=1 layout=lo1", "category": "grid", "expected_gain": "unknown", "decision": "DISCARD", "tflops": 114.86, "timestamp": "2026-04-21T15:05:04Z"}
{"round": 577, "iter": "iter577", "bottleneck": "compute_bound", "idea": "iter577_autogrid: BM=64 BN=128 warps=4 stages=5 indexing=block_ptr Ktile=64 ncol=2 layout=mnk", "category": "grid", "expected_gain": "unknown", "decision": "DISCARD", "tflops": 122.86, "timestamp": "2026-04-21T15:05:10Z"}
{"round": 578, "iter": "iter578", "bottleneck": "compute_bound", "idea": "iter578_autogrid: BM=64 BN=128 warps=4 stages=5 indexing=block_ptr Ktile=64 ncol=2 layout=lo1", "category": "grid", "expected_gain": "unknown", "decision": "DISCARD", "tflops": 122.07, "timestamp": "2026-04-21T15:05:16Z"}
{"round": 579, "iter": "iter579", "bottleneck": "compute_bound", "idea": "iter579_autogrid: BM=64 BN=128 warps=4 stages=5 indexing=block_ptr Ktile=128 ncol=4 layout=mnk", "category": "grid", "expected_gain": "unknown", "decision": "DISCARD", "tflops": 38.38, "timestamp": "2026-04-21T15:05:23Z"}
{"round": 580, "iter": "iter580", "bottleneck": "compute_bound", "idea": "iter580_autogrid: BM=64 BN=128 warps=4 stages=5 indexing=block_ptr Ktile=128 ncol=4 layout=lo1", "category": "grid", "expected_gain": "unknown", "decision": "DISCARD", "tflops": 80.14, "timestamp": "2026-04-21T15:05:30Z"}
{"round": 581, "iter": "iter581", "bottleneck": "compute_bound", "idea": "iter581_autogrid: BM=64 BN=128 warps=4 stages=6 indexing=pointer Ktile=32 ncol=1 layout=mnk", "category": "grid", "expected_gain": "unknown", "decision": "DISCARD", "tflops": 112.27, "timestamp": "2026-04-21T15:05:35Z"}
{"round": 582, "iter": "iter582", "bottleneck": "compute_bound", "idea": "iter582_autogrid: BM=64 BN=128 warps=4 stages=6 indexing=pointer Ktile=32 ncol=1 layout=lo1", "category": "grid", "expected_gain": "unknown", "decision": "DISCARD", "tflops": 112.05, "timestamp": "2026-04-21T15:05:41Z"}
{"round": 583, "iter": "iter583", "bottleneck": "compute_bound", "idea": "iter583_autogrid: BM=64 BN=128 warps=4 stages=6 indexing=pointer Ktile=64 ncol=2 layout=mnk", "category": "grid", "expected_gain": "unknown", "decision": "DISCARD", "tflops": 100.97, "timestamp": "2026-04-21T15:05:47Z"}
{"round": 584, "iter": "iter584", "bottleneck": "compute_bound", "idea": "iter584_autogrid: BM=64 BN=128 warps=4 stages=6 indexing=pointer Ktile=64 ncol=2 layout=lo1", "category": "grid", "expected_gain": "unknown", "decision": "DISCARD", "tflops": 103.17, "timestamp": "2026-04-21T15:05:53Z"}
{"round": 585, "iter": "iter585", "bottleneck": "compute_bound", "idea": "iter585_autogrid: BM=64 BN=128 warps=4 stages=6 indexing=pointer Ktile=128 ncol=4 layout=mnk", "category": "grid", "expected_gain": "unknown", "decision": "DISCARD", "tflops": 85.16, "timestamp": "2026-04-21T15:06:00Z"}
