{"round": 534, "iter": "iter534", "bottleneck": "compute_bound", "idea": "iter534_autogrid: BM=64 BN=128 warps=2 stages=6 indexing=pointer Ktile=32 ncol=1 layout=lo1", "category": "grid", "expected_gain": "unknown", "decision": "DISCARD", "tflops": 104.7, "timestamp": "2026-04-21T16:54:45Z"}
{"round": 535, "iter": "iter535", "bottleneck": "compute_bound", "idea": "iter535_autogrid: BM=64 BN=128 warps=2 stages=6 indexing=pointer Ktile=64 ncol=2 layout=mnk", "category": "grid", "expected_gain": "unknown", "decision": "DISCARD", "tflops": 68.86, "timestamp": "2026-04-21T16:54:50Z"}
{"round": 536, "iter": "iter536", "bottleneck": "compute_bound", "idea": "iter536_autogrid: BM=64 BN=128 warps=2 stages=6 indexing=pointer Ktile=64 ncol=2 layout=lo1", "category": "grid", "expected_gain": "unknown", "decision": "DISCARD", "tflops": 68.06, "timestamp": "2026-04-21T16:54:56Z"}
{"round": 537, "iter": "iter537", "bottleneck": "compute_bound", "idea": "iter537_autogrid: BM=64 BN=128 warps=2 stages=6 indexing=pointer Ktile=128 ncol=4 layout=mnk", "category": "grid", "expected_gain": "unknown", "decision": "DISCARD", "tflops": 20.41, "timestamp": "2026-04-21T16:55:02Z"}
{"round": 538, "iter": "iter538", "bottleneck": "compute_bound", "idea": "iter538_autogrid: BM=64 BN=128 warps=2 stages=6 indexing=pointer Ktile=128 ncol=4 layout=lo1", "category": "grid", "expected_gain": "unknown", "decision": "DISCARD", "tflops": 20.47, "timestamp": "2026-04-21T16:55:07Z"}
{"round": 539, "iter": "iter539", "bottleneck": "compute_bound", "idea": "iter539_autogrid: BM=64 BN=128 warps=2 stages=6 indexing=block_ptr Ktile=32 ncol=1 layout=mnk", "category": "grid", "expected_gain": "unknown", "decision": "DISCARD", "tflops": 105.26, "timestamp": "2026-04-21T16:55:13Z"}
{"round": 540, "iter": "iter540", "bottleneck": "compute_bound", "idea": "iter540_autogrid: BM=64 BN=128 warps=2 stages=6 indexing=block_ptr Ktile=32 ncol=1 layout=lo1", "category": "grid", "expected_gain": "unknown", "decision": "DISCARD", "tflops": 104.39, "timestamp": "2026-04-21T16:55:18Z"}
{"round": 541, "iter": "iter541", "bottleneck": "compute_bound", "idea": "iter541_autogrid: BM=64 BN=128 warps=2 stages=6 indexing=block_ptr Ktile=64 ncol=2 layout=mnk", "category": "grid", "expected_gain": "unknown", "decision": "DISCARD", "tflops": 66.08, "timestamp": "2026-04-21T16:55:24Z"}
{"round": 542, "iter": "iter542", "bottleneck": "compute_bound", "idea": "iter542_autogrid: BM=64 BN=128 warps=2 stages=6 indexing=block_ptr Ktile=64 ncol=2 layout=lo1", "category": "grid", "expected_gain": "unknown", "decision": "DISCARD", "tflops": 66.1, "timestamp": "2026-04-21T16:55:29Z"}
{"round": 543, "iter": "iter543", "bottleneck": "compute_bound", "idea": "iter543_autogrid: BM=64 BN=128 warps=2 stages=6 indexing=block_ptr Ktile=128 ncol=4 layout=mnk", "category": "grid", "expected_gain": "unknown", "decision": "DISCARD", "tflops": 20.89, "timestamp": "2026-04-21T16:55:35Z"}
{"round": 544, "iter": "iter544", "bottleneck": "compute_bound", "idea": "iter544_autogrid: BM=64 BN=128 warps=2 stages=6 indexing=block_ptr Ktile=128 ncol=4 layout=lo1", "category": "grid", "expected_gain": "unknown", "decision": "DISCARD", "tflops": 20.12, "timestamp": "2026-04-21T16:55:41Z"}
{"round": 545, "iter": "iter545", "bottleneck": "compute_bound", "idea": "iter545_autogrid: BM=64 BN=128 warps=4 stages=3 indexing=pointer Ktile=32 ncol=1 layout=mnk", "category": "grid", "expected_gain": "unknown", "decision": "DISCARD", "tflops": 118.87, "timestamp": "2026-04-21T16:55:46Z"}
{"round": 546, "iter": "iter546", "bottleneck": "compute_bound", "idea": "iter546_autogrid: BM=64 BN=128 warps=4 stages=3 indexing=pointer Ktile=32 ncol=1 layout=lo1", "category": "grid", "expected_gain": "unknown", "decision": "DISCARD", "tflops": 115.59, "timestamp": "2026-04-21T16:55:52Z"}
{"round": 547, "iter": "iter547", "bottleneck": "compute_bound", "idea": "iter547_autogrid: BM=64 BN=128 warps=4 stages=3 indexing=pointer Ktile=64 ncol=2 layout=mnk", "category": "grid", "expected_gain": "unknown", "decision": "DISCARD", "tflops": 126.89, "timestamp": "2026-04-21T16:55:57Z"}
{"round": 548, "iter": "iter548", "bottleneck": "compute_bound", "idea": "iter548_autogrid: BM=64 BN=128 warps=4 stages=3 indexing=pointer Ktile=64 ncol=2 layout=lo1", "category": "grid", "expected_gain": "unknown", "decision": "DISCARD", "tflops": 126.76, "timestamp": "2026-04-21T16:56:02Z"}
{"round": 549, "iter": "iter549", "bottleneck": "compute_bound", "idea": "iter549_autogrid: BM=64 BN=128 warps=4 stages=3 indexing=pointer Ktile=128 ncol=4 layout=mnk", "category": "grid", "expected_gain": "unknown", "decision": "DISCARD", "tflops": 126.54, "timestamp": "2026-04-21T16:56:07Z"}
{"round": 550, "iter": "iter550", "bottleneck": "compute_bound", "idea": "iter550_autogrid: BM=64 BN=128 warps=4 stages=3 indexing=pointer Ktile=128 ncol=4 layout=lo1", "category": "grid", "expected_gain": "unknown", "decision": "DISCARD", "tflops": 121.3, "timestamp": "2026-04-21T16:56:12Z"}
{"round": 551, "iter": "iter551", "bottleneck": "compute_bound", "idea": "iter551_autogrid: BM=64 BN=128 warps=4 stages=3 indexing=block_ptr Ktile=32 ncol=1 layout=mnk", "category": "grid", "expected_gain": "unknown", "decision": "DISCARD", "tflops": 117.21, "timestamp": "2026-04-21T16:56:18Z"}
{"round": 552, "iter": "iter552", "bottleneck": "compute_bound", "idea": "iter552_autogrid: BM=64 BN=128 warps=4 stages=3 indexing=block_ptr Ktile=32 ncol=1 layout=lo1", "category": "grid", "expected_gain": "unknown", "decision": "DISCARD", "tflops": 116.59, "timestamp": "2026-04-21T16:56:23Z"}
{"round": 553, "iter": "iter553", "bottleneck": "compute_bound", "idea": "iter553_autogrid: BM=64 BN=128 warps=4 stages=3 indexing=block_ptr Ktile=64 ncol=2 layout=mnk", "category": "grid", "expected_gain": "unknown", "decision": "DISCARD", "tflops": 125.97, "timestamp": "2026-04-21T16:56:28Z"}
{"round": 554, "iter": "iter554", "bottleneck": "compute_bound", "idea": "iter554_autogrid: BM=64 BN=128 warps=4 stages=3 indexing=block_ptr Ktile=64 ncol=2 layout=lo1", "category": "grid", "expected_gain": "unknown", "decision": "DISCARD", "tflops": 126.22, "timestamp": "2026-04-21T16:56:33Z"}
{"round": 555, "iter": "iter555", "bottleneck": "compute_bound", "idea": "iter555_autogrid: BM=64 BN=128 warps=4 stages=3 indexing=block_ptr Ktile=128 ncol=4 layout=mnk", "category": "grid", "expected_gain": "unknown", "decision": "DISCARD", "tflops": 125.62, "timestamp": "2026-04-21T16:56:38Z"}
{"round": 556, "iter": "iter556", "bottleneck": "compute_bound", "idea": "iter556_autogrid: BM=64 BN=128 warps=4 stages=3 indexing=block_ptr Ktile=128 ncol=4 layout=lo1", "category": "grid", "expected_gain": "unknown", "decision": "DISCARD", "tflops": 123.4, "timestamp": "2026-04-21T16:56:43Z"}
{"round": 557, "iter": "iter557", "bottleneck": "compute_bound", "idea": "iter557_autogrid: BM=64 BN=128 warps=4 stages=4 indexing=pointer Ktile=32 ncol=1 layout=mnk", "category": "grid", "expected_gain": "unknown", "decision": "DISCARD", "tflops": 119.09, "timestamp": "2026-04-21T16:56:48Z"}
{"round": 558, "iter": "iter558", "bottleneck": "compute_bound", "idea": "iter558_autogrid: BM=64 BN=128 warps=4 stages=4 indexing=pointer Ktile=32 ncol=1 layout=lo1", "category": "grid", "expected_gain": "unknown", "decision": "DISCARD", "tflops": 115.29, "timestamp": "2026-04-21T16:56:54Z"}
{"round": 559, "iter": "iter559", "bottleneck": "compute_bound", "idea": "iter559_autogrid: BM=64 BN=128 warps=4 stages=4 indexing=pointer Ktile=64 ncol=2 layout=mnk", "category": "grid", "expected_gain": "unknown", "decision": "DISCARD", "tflops": 124.0, "timestamp": "2026-04-21T16:56:59Z"}
{"round": 560, "iter": "iter560", "bottleneck": "compute_bound", "idea": "iter560_autogrid: BM=64 BN=128 warps=4 stages=4 indexing=pointer Ktile=64 ncol=2 layout=lo1", "category": "grid", "expected_gain": "unknown", "decision": "DISCARD", "tflops": 123.31, "timestamp": "2026-04-21T16:57:04Z"}
{"round": 561, "iter": "iter561", "bottleneck": "compute_bound", "idea": "iter561_autogrid: BM=64 BN=128 warps=4 stages=4 indexing=pointer Ktile=128 ncol=4 layout=mnk", "category": "grid", "expected_gain": "unknown", "decision": "DISCARD", "tflops": 126.95, "timestamp": "2026-04-21T16:57:09Z"}
{"round": 562, "iter": "iter562", "bottleneck": "compute_bound", "idea": "iter562_autogrid: BM=64 BN=128 warps=4 stages=4 indexing=pointer Ktile=128 ncol=4 layout=lo1", "category": "grid", "expected_gain": "unknown", "decision": "DISCARD", "tflops": 121.8, "timestamp": "2026-04-21T16:57:14Z"}
{"round": 563, "iter": "iter563", "bottleneck": "compute_bound", "idea": "iter563_autogrid: BM=64 BN=128 warps=4 stages=4 indexing=block_ptr Ktile=32 ncol=1 layout=mnk", "category": "grid", "expected_gain": "unknown", "decision": "DISCARD", "tflops": 117.76, "timestamp": "2026-04-21T16:57:20Z"}
{"round": 564, "iter": "iter564", "bottleneck": "compute_bound", "idea": "iter564_autogrid: BM=64 BN=128 warps=4 stages=4 indexing=block_ptr Ktile=32 ncol=1 layout=lo1", "category": "grid", "expected_gain": "unknown", "decision": "DISCARD", "tflops": 115.9, "timestamp": "2026-04-21T16:57:25Z"}
{"round": 565, "iter": "iter565", "bottleneck": "compute_bound", "idea": "iter565_autogrid: BM=64 BN=128 warps=4 stages=4 indexing=block_ptr Ktile=64 ncol=2 layout=mnk", "category": "grid", "expected_gain": "unknown", "decision": "DISCARD", "tflops": 123.6, "timestamp": "2026-04-21T16:57:30Z"}
{"round": 566, "iter": "iter566", "bottleneck": "compute_bound", "idea": "iter566_autogrid: BM=64 BN=128 warps=4 stages=4 indexing=block_ptr Ktile=64 ncol=2 layout=lo1", "category": "grid", "expected_gain": "unknown", "decision": "DISCARD", "tflops": 122.14, "timestamp": "2026-04-21T16:57:35Z"}
{"round": 567, "iter": "iter567", "bottleneck": "compute_bound", "idea": "iter567_autogrid: BM=64 BN=128 warps=4 stages=4 indexing=block_ptr Ktile=128 ncol=4 layout=mnk", "category": "grid", "expected_gain": "unknown", "decision": "DISCARD", "tflops": 128.07, "timestamp": "2026-04-21T16:57:40Z"}
{"round": 568, "iter": "iter568", "bottleneck": "compute_bound", "idea": "iter568_autogrid: BM=64 BN=128 warps=4 stages=4 indexing=block_ptr Ktile=128 ncol=4 layout=lo1", "category": "grid", "expected_gain": "unknown", "decision": "DISCARD", "tflops": 123.42, "timestamp": "2026-04-21T16:57:45Z"}
{"round": 569, "iter": "iter569", "bottleneck": "compute_bound", "idea": "iter569_autogrid: BM=64 BN=128 warps=4 stages=5 indexing=pointer Ktile=32 ncol=1 layout=mnk", "category": "grid", "expected_gain": "unknown", "decision": "DISCARD", "tflops": 117.71, "timestamp": "2026-04-21T16:57:50Z"}
{"round": 570, "iter": "iter570", "bottleneck": "compute_bound", "idea": "iter570_autogrid: BM=64 BN=128 warps=4 stages=5 indexing=pointer Ktile=32 ncol=1 layout=lo1", "category": "grid", "expected_gain": "unknown", "decision": "DISCARD", "tflops": 115.14, "timestamp": "2026-04-21T16:57:55Z"}
{"round": 571, "iter": "iter571", "bottleneck": "compute_bound", "idea": "iter571_autogrid: BM=64 BN=128 warps=4 stages=5 indexing=pointer Ktile=64 ncol=2 layout=mnk", "category": "grid", "expected_gain": "unknown", "decision": "DISCARD", "tflops": 124.1, "timestamp": "2026-04-21T16:58:00Z"}
{"round": 572, "iter": "iter572", "bottleneck": "compute_bound", "idea": "iter572_autogrid: BM=64 BN=128 warps=4 stages=5 indexing=pointer Ktile=64 ncol=2 layout=lo1", "category": "grid", "expected_gain": "unknown", "decision": "DISCARD", "tflops": 122.84, "timestamp": "2026-04-21T16:58:05Z"}
{"round": 573, "iter": "iter573", "bottleneck": "compute_bound", "idea": "iter573_autogrid: BM=64 BN=128 warps=4 stages=5 indexing=pointer Ktile=128 ncol=4 layout=mnk", "category": "grid", "expected_gain": "unknown", "decision": "DISCARD", "tflops": 85.07, "timestamp": "2026-04-21T16:58:10Z"}
{"round": 574, "iter": "iter574", "bottleneck": "compute_bound", "idea": "iter574_autogrid: BM=64 BN=128 warps=4 stages=5 indexing=pointer Ktile=128 ncol=4 layout=lo1", "category": "grid", "expected_gain": "unknown", "decision": "DISCARD", "tflops": 80.97, "timestamp": "2026-04-21T16:58:15Z"}
{"round": 575, "iter": "iter575", "bottleneck": "compute_bound", "idea": "iter575_autogrid: BM=64 BN=128 warps=4 stages=5 indexing=block_ptr Ktile=32 ncol=1 layout=mnk", "category": "grid", "expected_gain": "unknown", "decision": "DISCARD", "tflops": 117.88, "timestamp": "2026-04-21T16:58:20Z"}
{"round": 576, "iter": "iter576", "bottleneck": "compute_bound", "idea": "iter576_autogrid: BM=64 BN=128 warps=4 stages=5 indexing=block_ptr Ktile=32 ncol=1 layout=lo1", "category": "grid", "expected_gain": "unknown", "decision": "DISCARD", "tflops": 114.71, "timestamp": "2026-04-21T16:58:25Z"}
{"round": 577, "iter": "iter577", "bottleneck": "compute_bound", "idea": "iter577_autogrid: BM=64 BN=128 warps=4 stages=5 indexing=block_ptr Ktile=64 ncol=2 layout=mnk", "category": "grid", "expected_gain": "unknown", "decision": "DISCARD", "tflops": 124.02, "timestamp": "2026-04-21T16:58:30Z"}
{"round": 578, "iter": "iter578", "bottleneck": "compute_bound", "idea": "iter578_autogrid: BM=64 BN=128 warps=4 stages=5 indexing=block_ptr Ktile=64 ncol=2 layout=lo1", "category": "grid", "expected_gain": "unknown", "decision": "DISCARD", "tflops": 122.01, "timestamp": "2026-04-21T16:58:36Z"}
{"round": 579, "iter": "iter579", "bottleneck": "compute_bound", "idea": "iter579_autogrid: BM=64 BN=128 warps=4 stages=5 indexing=block_ptr Ktile=128 ncol=4 layout=mnk", "category": "grid", "expected_gain": "unknown", "decision": "DISCARD", "tflops": 84.97, "timestamp": "2026-04-21T16:58:41Z"}
{"round": 580, "iter": "iter580", "bottleneck": "compute_bound", "idea": "iter580_autogrid: BM=64 BN=128 warps=4 stages=5 indexing=block_ptr Ktile=128 ncol=4 layout=lo1", "category": "grid", "expected_gain": "unknown", "decision": "DISCARD", "tflops": 79.87, "timestamp": "2026-04-21T16:58:46Z"}
{"round": 581, "iter": "iter581", "bottleneck": "compute_bound", "idea": "iter581_autogrid: BM=64 BN=128 warps=4 stages=6 indexing=pointer Ktile=32 ncol=1 layout=mnk", "category": "grid", "expected_gain": "unknown", "decision": "DISCARD", "tflops": 115.25, "timestamp": "2026-04-21T16:58:51Z"}
{"round": 582, "iter": "iter582", "bottleneck": "compute_bound", "idea": "iter582_autogrid: BM=64 BN=128 warps=4 stages=6 indexing=pointer Ktile=32 ncol=1 layout=lo1", "category": "grid", "expected_gain": "unknown", "decision": "DISCARD", "tflops": 112.55, "timestamp": "2026-04-21T16:58:56Z"}
{"round": 583, "iter": "iter583", "bottleneck": "compute_bound", "idea": "iter583_autogrid: BM=64 BN=128 warps=4 stages=6 indexing=pointer Ktile=64 ncol=2 layout=mnk", "category": "grid", "expected_gain": "unknown", "decision": "DISCARD", "tflops": 100.88, "timestamp": "2026-04-21T16:59:02Z"}
{"round": 584, "iter": "iter584", "bottleneck": "compute_bound", "idea": "iter584_autogrid: BM=64 BN=128 warps=4 stages=6 indexing=pointer Ktile=64 ncol=2 layout=lo1", "category": "grid", "expected_gain": "unknown", "decision": "DISCARD", "tflops": 103.02, "timestamp": "2026-04-21T16:59:07Z"}
{"round": 585, "iter": "iter585", "bottleneck": "compute_bound", "idea": "iter585_autogrid: BM=64 BN=128 warps=4 stages=6 indexing=pointer Ktile=128 ncol=4 layout=mnk", "category": "grid", "expected_gain": "unknown", "decision": "DISCARD", "tflops": 84.88, "timestamp": "2026-04-21T16:59:12Z"}
{"round": 586, "iter": "iter586", "bottleneck": "compute_bound", "idea": "iter586_autogrid: BM=64 BN=128 warps=4 stages=6 indexing=pointer Ktile=128 ncol=4 layout=lo1", "category": "grid", "expected_gain": "unknown", "decision": "DISCARD", "tflops": 81.04, "timestamp": "2026-04-21T16:59:18Z"}
{"round": 587, "iter": "iter587", "bottleneck": "compute_bound", "idea": "iter587_autogrid: BM=64 BN=128 warps=4 stages=6 indexing=block_ptr Ktile=32 ncol=1 layout=mnk", "category": "grid", "expected_gain": "unknown", "decision": "DISCARD", "tflops": 113.56, "timestamp": "2026-04-21T16:59:23Z"}
{"round": 588, "iter": "iter588", "bottleneck": "compute_bound", "idea": "iter588_autogrid: BM=64 BN=128 warps=4 stages=6 indexing=block_ptr Ktile=32 ncol=1 layout=lo1", "category": "grid", "expected_gain": "unknown", "decision": "DISCARD", "tflops": 111.54, "timestamp": "2026-04-21T16:59:28Z"}
{"round": 589, "iter": "iter589", "bottleneck": "compute_bound", "idea": "iter589_autogrid: BM=64 BN=128 warps=4 stages=6 indexing=block_ptr Ktile=64 ncol=2 layout=mnk", "category": "grid", "expected_gain": "unknown", "decision": "DISCARD", "tflops": 103.38, "timestamp": "2026-04-21T16:59:34Z"}
{"round": 590, "iter": "iter590", "bottleneck": "compute_bound", "idea": "iter590_autogrid: BM=64 BN=128 warps=4 stages=6 indexing=block_ptr Ktile=64 ncol=2 layout=lo1", "category": "grid", "expected_gain": "unknown", "decision": "DISCARD", "tflops": 103.95, "timestamp": "2026-04-21T16:59:39Z"}
{"round": 591, "iter": "iter591", "bottleneck": "compute_bound", "idea": "iter591_autogrid: BM=64 BN=128 warps=4 stages=6 indexing=block_ptr Ktile=128 ncol=4 layout=mnk", "category": "grid", "expected_gain": "unknown", "decision": "DISCARD", "tflops": 84.85, "timestamp": "2026-04-21T16:59:44Z"}
{"round": 592, "iter": "iter592", "bottleneck": "compute_bound", "idea": "iter592_autogrid: BM=64 BN=128 warps=4 stages=6 indexing=block_ptr Ktile=128 ncol=4 layout=lo1", "category": "grid", "expected_gain": "unknown", "decision": "DISCARD", "tflops": 79.98, "timestamp": "2026-04-21T16:59:49Z"}
{"round": 593, "iter": "iter593", "bottleneck": "compute_bound", "idea": "iter593_autogrid: BM=64 BN=128 warps=8 stages=3 indexing=pointer Ktile=32 ncol=1 layout=mnk", "category": "grid", "expected_gain": "unknown", "decision": "DISCARD", "tflops": 53.52, "timestamp": "2026-04-21T16:59:55Z"}
{"round": 594, "iter": "iter594", "bottleneck": "compute_bound", "idea": "iter594_autogrid: BM=64 BN=128 warps=8 stages=3 indexing=pointer Ktile=32 ncol=1 layout=lo1", "category": "grid", "expected_gain": "unknown", "decision": "DISCARD", "tflops": 53.32, "timestamp": "2026-04-21T17:00:00Z"}
{"round": 595, "iter": "iter595", "bottleneck": "compute_bound", "idea": "iter595_autogrid: BM=64 BN=128 warps=8 stages=3 indexing=pointer Ktile=64 ncol=2 layout=mnk", "category": "grid", "expected_gain": "unknown", "decision": "DISCARD", "tflops": 93.48, "timestamp": "2026-04-21T17:00:05Z"}
{"round": 596, "iter": "iter596", "bottleneck": "compute_bound", "idea": "iter596_autogrid: BM=64 BN=128 warps=8 stages=3 indexing=pointer Ktile=64 ncol=2 layout=lo1", "category": "grid", "expected_gain": "unknown", "decision": "DISCARD", "tflops": 94.64, "timestamp": "2026-04-21T17:00:10Z"}
{"round": 597, "iter": "iter597", "bottleneck": "compute_bound", "idea": "iter597_autogrid: BM=64 BN=128 warps=8 stages=3 indexing=pointer Ktile=128 ncol=4 layout=mnk", "category": "grid", "expected_gain": "unknown", "decision": "DISCARD", "tflops": 74.91, "timestamp": "2026-04-21T17:00:16Z"}
{"round": 598, "iter": "iter598", "bottleneck": "compute_bound", "idea": "iter598_autogrid: BM=64 BN=128 warps=8 stages=3 indexing=pointer Ktile=128 ncol=4 layout=lo1", "category": "grid", "expected_gain": "unknown", "decision": "DISCARD", "tflops": 73.83, "timestamp": "2026-04-21T17:00:21Z"}
{"round": 599, "iter": "iter599", "bottleneck": "compute_bound", "idea": "iter599_autogrid: BM=64 BN=128 warps=8 stages=3 indexing=block_ptr Ktile=32 ncol=1 layout=mnk", "category": "grid", "expected_gain": "unknown", "decision": "DISCARD", "tflops": 54.75, "timestamp": "2026-04-21T17:00:27Z"}
{"round": 600, "iter": "iter600", "bottleneck": "compute_bound", "idea": "iter600_autogrid: BM=64 BN=128 warps=8 stages=3 indexing=block_ptr Ktile=32 ncol=1 layout=lo1", "category": "grid", "expected_gain": "unknown", "decision": "DISCARD", "tflops": 54.45, "timestamp": "2026-04-21T17:00:32Z"}
{"round": 601, "iter": "iter601", "bottleneck": "compute_bound", "idea": "iter601_autogrid: BM=64 BN=128 warps=8 stages=3 indexing=block_ptr Ktile=64 ncol=2 layout=mnk", "category": "grid", "expected_gain": "unknown", "decision": "DISCARD", "tflops": 92.52, "timestamp": "2026-04-21T17:00:37Z"}
{"round": 602, "iter": "iter602", "bottleneck": "compute_bound", "idea": "iter602_autogrid: BM=64 BN=128 warps=8 stages=3 indexing=block_ptr Ktile=64 ncol=2 layout=lo1", "category": "grid", "expected_gain": "unknown", "decision": "DISCARD", "tflops": 92.56, "timestamp": "2026-04-21T17:00:42Z"}
{"round": 603, "iter": "iter603", "bottleneck": "compute_bound", "idea": "iter603_autogrid: BM=64 BN=128 warps=8 stages=3 indexing=block_ptr Ktile=128 ncol=4 layout=mnk", "category": "grid", "expected_gain": "unknown", "decision": "DISCARD", "tflops": 75.37, "timestamp": "2026-04-21T17:00:47Z"}
{"round": 604, "iter": "iter604", "bottleneck": "compute_bound", "idea": "iter604_autogrid: BM=64 BN=128 warps=8 stages=3 indexing=block_ptr Ktile=128 ncol=4 layout=lo1", "category": "grid", "expected_gain": "unknown", "decision": "DISCARD", "tflops": 69.86, "timestamp": "2026-04-21T17:00:52Z"}
{"round": 605, "iter": "iter605", "bottleneck": "compute_bound", "idea": "iter605_autogrid: BM=64 BN=128 warps=8 stages=4 indexing=pointer Ktile=32 ncol=1 layout=mnk", "category": "grid", "expected_gain": "unknown", "decision": "DISCARD", "tflops": 53.65, "timestamp": "2026-04-21T17:00:57Z"}
{"round": 606, "iter": "iter606", "bottleneck": "compute_bound", "idea": "iter606_autogrid: BM=64 BN=128 warps=8 stages=4 indexing=pointer Ktile=32 ncol=1 layout=lo1", "category": "grid", "expected_gain": "unknown", "decision": "DISCARD", "tflops": 52.51, "timestamp": "2026-04-21T17:01:03Z"}
{"round": 607, "iter": "iter607", "bottleneck": "compute_bound", "idea": "iter607_autogrid: BM=64 BN=128 warps=8 stages=4 indexing=pointer Ktile=64 ncol=2 layout=mnk", "category": "grid", "expected_gain": "unknown", "decision": "DISCARD", "tflops": 88.07, "timestamp": "2026-04-21T17:01:08Z"}
