{"round": 289, "iter": "iter289", "bottleneck": "compile", "idea": "iter289_autogrid: BM=128 BN=128 warps=16 stages=4 indexing=block_ptr Ktile=96 ncol=3", "category": "grid", "expected_gain": "unknown", "decision": "COMPILE_FAIL", "tflops": 0.0, "timestamp": "2026-04-21T13:02:14Z"}
{"round": 290, "iter": "iter290", "bottleneck": "compute_bound", "idea": "iter290_autogrid: BM=128 BN=128 warps=16 stages=4 indexing=block_ptr Ktile=128 ncol=4", "category": "grid", "expected_gain": "unknown", "decision": "DISCARD", "tflops": 46.34, "timestamp": "2026-04-21T13:02:20Z"}
{"round": 291, "iter": "iter291", "bottleneck": "compile", "idea": "iter291_autogrid: BM=64 BN=128 warps=4 stages=3 indexing=pointer Ktile=96 ncol=3", "category": "grid", "expected_gain": "unknown", "decision": "COMPILE_FAIL", "tflops": 0.0, "timestamp": "2026-04-21T13:02:25Z"}
{"round": 292, "iter": "iter292", "bottleneck": "compute_bound", "idea": "iter292_autogrid: BM=64 BN=128 warps=4 stages=3 indexing=pointer Ktile=128 ncol=4", "category": "grid", "expected_gain": "unknown", "decision": "DISCARD", "tflops": 57.42, "timestamp": "2026-04-21T13:02:32Z"}
{"round": 293, "iter": "iter293", "bottleneck": "compile", "idea": "iter293_autogrid: BM=64 BN=128 warps=4 stages=3 indexing=block_ptr Ktile=96 ncol=3", "category": "grid", "expected_gain": "unknown", "decision": "COMPILE_FAIL", "tflops": 0.0, "timestamp": "2026-04-21T13:02:37Z"}
{"round": 294, "iter": "iter294", "bottleneck": "compute_bound", "idea": "iter294_autogrid: BM=64 BN=128 warps=4 stages=3 indexing=block_ptr Ktile=128 ncol=4", "category": "grid", "expected_gain": "unknown", "decision": "DISCARD", "tflops": 58.87, "timestamp": "2026-04-21T13:02:43Z"}
{"round": 295, "iter": "iter295", "bottleneck": "compute_bound", "idea": "iter295_autogrid: BM=64 BN=128 warps=4 stages=4 indexing=pointer Ktile=64 ncol=2", "category": "grid", "expected_gain": "unknown", "decision": "DISCARD", "tflops": 37.66, "timestamp": "2026-04-21T13:02:50Z"}
{"round": 296, "iter": "iter296", "bottleneck": "compile", "idea": "iter296_autogrid: BM=64 BN=128 warps=4 stages=4 indexing=pointer Ktile=96 ncol=3", "category": "grid", "expected_gain": "unknown", "decision": "COMPILE_FAIL", "tflops": 0.0, "timestamp": "2026-04-21T13:02:55Z"}
{"round": 297, "iter": "iter297", "bottleneck": "compute_bound", "idea": "iter297_autogrid: BM=64 BN=128 warps=4 stages=4 indexing=pointer Ktile=128 ncol=4", "category": "grid", "expected_gain": "unknown", "decision": "DISCARD", "tflops": 57.26, "timestamp": "2026-04-21T13:03:01Z"}
{"round": 298, "iter": "iter298", "bottleneck": "compute_bound", "idea": "iter298_autogrid: BM=64 BN=128 warps=4 stages=4 indexing=block_ptr Ktile=64 ncol=2", "category": "grid", "expected_gain": "unknown", "decision": "DISCARD", "tflops": 35.44, "timestamp": "2026-04-21T13:03:08Z"}
{"round": 299, "iter": "iter299", "bottleneck": "compile", "idea": "iter299_autogrid: BM=64 BN=128 warps=4 stages=4 indexing=block_ptr Ktile=96 ncol=3", "category": "grid", "expected_gain": "unknown", "decision": "COMPILE_FAIL", "tflops": 0.0, "timestamp": "2026-04-21T13:03:13Z"}
{"round": 300, "iter": "iter300", "bottleneck": "compute_bound", "idea": "iter300_autogrid: BM=64 BN=128 warps=4 stages=4 indexing=block_ptr Ktile=128 ncol=4", "category": "grid", "expected_gain": "unknown", "decision": "DISCARD", "tflops": 35.99, "timestamp": "2026-04-21T13:03:20Z"}
{"round": 301, "iter": "iter301", "bottleneck": "compute_bound", "idea": "iter301_autogrid: BM=64 BN=128 warps=8 stages=3 indexing=pointer Ktile=64 ncol=2", "category": "grid", "expected_gain": "unknown", "decision": "DISCARD", "tflops": 25.54, "timestamp": "2026-04-21T13:03:26Z"}
{"round": 302, "iter": "iter302", "bottleneck": "compile", "idea": "iter302_autogrid: BM=64 BN=128 warps=8 stages=3 indexing=pointer Ktile=96 ncol=3", "category": "grid", "expected_gain": "unknown", "decision": "COMPILE_FAIL", "tflops": 0.0, "timestamp": "2026-04-21T13:03:31Z"}
{"round": 303, "iter": "iter303", "bottleneck": "compute_bound", "idea": "iter303_autogrid: BM=64 BN=128 warps=8 stages=3 indexing=pointer Ktile=128 ncol=4", "category": "grid", "expected_gain": "unknown", "decision": "DISCARD", "tflops": 32.83, "timestamp": "2026-04-21T13:03:37Z"}
{"round": 304, "iter": "iter304", "bottleneck": "compute_bound", "idea": "iter304_autogrid: BM=64 BN=128 warps=8 stages=3 indexing=block_ptr Ktile=64 ncol=2", "category": "grid", "expected_gain": "unknown", "decision": "DISCARD", "tflops": 25.95, "timestamp": "2026-04-21T13:03:43Z"}
{"round": 305, "iter": "iter305", "bottleneck": "compile", "idea": "iter305_autogrid: BM=64 BN=128 warps=8 stages=3 indexing=block_ptr Ktile=96 ncol=3", "category": "grid", "expected_gain": "unknown", "decision": "COMPILE_FAIL", "tflops": 0.0, "timestamp": "2026-04-21T13:03:48Z"}
{"round": 306, "iter": "iter306", "bottleneck": "compute_bound", "idea": "iter306_autogrid: BM=64 BN=128 warps=8 stages=3 indexing=block_ptr Ktile=128 ncol=4", "category": "grid", "expected_gain": "unknown", "decision": "DISCARD", "tflops": 22.11, "timestamp": "2026-04-21T13:03:54Z"}
{"round": 307, "iter": "iter307", "bottleneck": "compute_bound", "idea": "iter307_autogrid: BM=64 BN=128 warps=8 stages=4 indexing=pointer Ktile=64 ncol=2", "category": "grid", "expected_gain": "unknown", "decision": "DISCARD", "tflops": 38.91, "timestamp": "2026-04-21T13:04:01Z"}
{"round": 308, "iter": "iter308", "bottleneck": "compile", "idea": "iter308_autogrid: BM=64 BN=128 warps=8 stages=4 indexing=pointer Ktile=96 ncol=3", "category": "grid", "expected_gain": "unknown", "decision": "COMPILE_FAIL", "tflops": 0.0, "timestamp": "2026-04-21T13:04:06Z"}
{"round": 309, "iter": "iter309", "bottleneck": "compute_bound", "idea": "iter309_autogrid: BM=64 BN=128 warps=8 stages=4 indexing=pointer Ktile=128 ncol=4", "category": "grid", "expected_gain": "unknown", "decision": "DISCARD", "tflops": 33.1, "timestamp": "2026-04-21T13:04:12Z"}
{"round": 310, "iter": "iter310", "bottleneck": "compute_bound", "idea": "iter310_autogrid: BM=64 BN=128 warps=8 stages=4 indexing=block_ptr Ktile=64 ncol=2", "category": "grid", "expected_gain": "unknown", "decision": "DISCARD", "tflops": 17.68, "timestamp": "2026-04-21T13:04:18Z"}
{"round": 311, "iter": "iter311", "bottleneck": "compile", "idea": "iter311_autogrid: BM=64 BN=128 warps=8 stages=4 indexing=block_ptr Ktile=96 ncol=3", "category": "grid", "expected_gain": "unknown", "decision": "COMPILE_FAIL", "tflops": 0.0, "timestamp": "2026-04-21T13:04:23Z"}
{"round": 312, "iter": "iter312", "bottleneck": "compute_bound", "idea": "iter312_autogrid: BM=64 BN=128 warps=8 stages=4 indexing=block_ptr Ktile=128 ncol=4", "category": "grid", "expected_gain": "unknown", "decision": "DISCARD", "tflops": 33.09, "timestamp": "2026-04-21T13:04:29Z"}
{"round": 313, "iter": "iter313", "bottleneck": "compute_bound", "idea": "iter313_autogrid: BM=64 BN=128 warps=16 stages=3 indexing=pointer Ktile=64 ncol=2", "category": "grid", "expected_gain": "unknown", "decision": "DISCARD", "tflops": 17.19, "timestamp": "2026-04-21T13:04:36Z"}
{"round": 314, "iter": "iter314", "bottleneck": "compile", "idea": "iter314_autogrid: BM=64 BN=128 warps=16 stages=3 indexing=pointer Ktile=96 ncol=3", "category": "grid", "expected_gain": "unknown", "decision": "COMPILE_FAIL", "tflops": 0.0, "timestamp": "2026-04-21T13:04:41Z"}
{"round": 315, "iter": "iter315", "bottleneck": "compute_bound", "idea": "iter315_autogrid: BM=64 BN=128 warps=16 stages=3 indexing=pointer Ktile=128 ncol=4", "category": "grid", "expected_gain": "unknown", "decision": "DISCARD", "tflops": 25.29, "timestamp": "2026-04-21T13:04:47Z"}
{"round": 316, "iter": "iter316", "bottleneck": "compute_bound", "idea": "iter316_autogrid: BM=64 BN=128 warps=16 stages=3 indexing=block_ptr Ktile=64 ncol=2", "category": "grid", "expected_gain": "unknown", "decision": "DISCARD", "tflops": 11.31, "timestamp": "2026-04-21T13:04:54Z"}
{"round": 317, "iter": "iter317", "bottleneck": "compile", "idea": "iter317_autogrid: BM=64 BN=128 warps=16 stages=3 indexing=block_ptr Ktile=96 ncol=3", "category": "grid", "expected_gain": "unknown", "decision": "COMPILE_FAIL", "tflops": 0.0, "timestamp": "2026-04-21T13:04:59Z"}
{"round": 318, "iter": "iter318", "bottleneck": "compute_bound", "idea": "iter318_autogrid: BM=64 BN=128 warps=16 stages=3 indexing=block_ptr Ktile=128 ncol=4", "category": "grid", "expected_gain": "unknown", "decision": "DISCARD", "tflops": 18.65, "timestamp": "2026-04-21T13:05:05Z"}
{"round": 319, "iter": "iter319", "bottleneck": "compute_bound", "idea": "iter319_autogrid: BM=64 BN=128 warps=16 stages=4 indexing=pointer Ktile=64 ncol=2", "category": "grid", "expected_gain": "unknown", "decision": "DISCARD", "tflops": 16.53, "timestamp": "2026-04-21T13:05:12Z"}
{"round": 320, "iter": "iter320", "bottleneck": "compile", "idea": "iter320_autogrid: BM=64 BN=128 warps=16 stages=4 indexing=pointer Ktile=96 ncol=3", "category": "grid", "expected_gain": "unknown", "decision": "COMPILE_FAIL", "tflops": 0.0, "timestamp": "2026-04-21T13:05:16Z"}
{"round": 321, "iter": "iter321", "bottleneck": "compute_bound", "idea": "iter321_autogrid: BM=64 BN=128 warps=16 stages=4 indexing=pointer Ktile=128 ncol=4", "category": "grid", "expected_gain": "unknown", "decision": "DISCARD", "tflops": 25.27, "timestamp": "2026-04-21T13:05:23Z"}
{"round": 322, "iter": "iter322", "bottleneck": "compute_bound", "idea": "iter322_autogrid: BM=64 BN=128 warps=16 stages=4 indexing=block_ptr Ktile=64 ncol=2", "category": "grid", "expected_gain": "unknown", "decision": "DISCARD", "tflops": 16.15, "timestamp": "2026-04-21T13:05:29Z"}
{"round": 323, "iter": "iter323", "bottleneck": "compile", "idea": "iter323_autogrid: BM=64 BN=128 warps=16 stages=4 indexing=block_ptr Ktile=96 ncol=3", "category": "grid", "expected_gain": "unknown", "decision": "COMPILE_FAIL", "tflops": 0.0, "timestamp": "2026-04-21T13:05:34Z"}
{"round": 324, "iter": "iter324", "bottleneck": "compute_bound", "idea": "iter324_autogrid: BM=64 BN=128 warps=16 stages=4 indexing=block_ptr Ktile=128 ncol=4", "category": "grid", "expected_gain": "unknown", "decision": "DISCARD", "tflops": 24.65, "timestamp": "2026-04-21T13:05:40Z"}
{"round": 325, "iter": "iter325", "bottleneck": "compile", "idea": "iter325_autogrid: BM=128 BN=64 warps=4 stages=3 indexing=pointer Ktile=96 ncol=3", "category": "grid", "expected_gain": "unknown", "decision": "COMPILE_FAIL", "tflops": 0.0, "timestamp": "2026-04-21T13:05:45Z"}
{"round": 326, "iter": "iter326", "bottleneck": "compute_bound", "idea": "iter326_autogrid: BM=128 BN=64 warps=4 stages=3 indexing=pointer Ktile=128 ncol=4", "category": "grid", "expected_gain": "unknown", "decision": "DISCARD", "tflops": 34.02, "timestamp": "2026-04-21T13:05:52Z"}
{"round": 327, "iter": "iter327", "bottleneck": "compile", "idea": "iter327_autogrid: BM=128 BN=64 warps=4 stages=3 indexing=block_ptr Ktile=96 ncol=3", "category": "grid", "expected_gain": "unknown", "decision": "COMPILE_FAIL", "tflops": 0.0, "timestamp": "2026-04-21T13:05:57Z"}
{"round": 328, "iter": "iter328", "bottleneck": "compute_bound", "idea": "iter328_autogrid: BM=128 BN=64 warps=4 stages=3 indexing=block_ptr Ktile=128 ncol=4", "category": "grid", "expected_gain": "unknown", "decision": "DISCARD", "tflops": 48.13, "timestamp": "2026-04-21T13:06:03Z"}
{"round": 329, "iter": "iter329", "bottleneck": "compute_bound", "idea": "iter329_autogrid: BM=128 BN=64 warps=4 stages=4 indexing=pointer Ktile=64 ncol=2", "category": "grid", "expected_gain": "unknown", "decision": "DISCARD", "tflops": 54.4, "timestamp": "2026-04-21T13:06:09Z"}
{"round": 330, "iter": "iter330", "bottleneck": "compile", "idea": "iter330_autogrid: BM=128 BN=64 warps=4 stages=4 indexing=pointer Ktile=96 ncol=3", "category": "grid", "expected_gain": "unknown", "decision": "COMPILE_FAIL", "tflops": 0.0, "timestamp": "2026-04-21T13:06:14Z"}
{"round": 331, "iter": "iter331", "bottleneck": "compute_bound", "idea": "iter331_autogrid: BM=128 BN=64 warps=4 stages=4 indexing=pointer Ktile=128 ncol=4", "category": "grid", "expected_gain": "unknown", "decision": "DISCARD", "tflops": 48.59, "timestamp": "2026-04-21T13:06:20Z"}
{"round": 332, "iter": "iter332", "bottleneck": "compute_bound", "idea": "iter332_autogrid: BM=128 BN=64 warps=4 stages=4 indexing=block_ptr Ktile=64 ncol=2", "category": "grid", "expected_gain": "unknown", "decision": "DISCARD", "tflops": 57.39, "timestamp": "2026-04-21T13:06:26Z"}
{"round": 333, "iter": "iter333", "bottleneck": "compile", "idea": "iter333_autogrid: BM=128 BN=64 warps=4 stages=4 indexing=block_ptr Ktile=96 ncol=3", "category": "grid", "expected_gain": "unknown", "decision": "COMPILE_FAIL", "tflops": 0.0, "timestamp": "2026-04-21T13:06:31Z"}
{"round": 334, "iter": "iter334", "bottleneck": "compute_bound", "idea": "iter334_autogrid: BM=128 BN=64 warps=4 stages=4 indexing=block_ptr Ktile=128 ncol=4", "category": "grid", "expected_gain": "unknown", "decision": "DISCARD", "tflops": 31.54, "timestamp": "2026-04-21T13:06:38Z"}
{"round": 335, "iter": "iter335", "bottleneck": "compute_bound", "idea": "iter335_autogrid: BM=128 BN=64 warps=8 stages=3 indexing=pointer Ktile=64 ncol=2", "category": "grid", "expected_gain": "unknown", "decision": "DISCARD", "tflops": 44.95, "timestamp": "2026-04-21T13:06:44Z"}
{"round": 336, "iter": "iter336", "bottleneck": "compile", "idea": "iter336_autogrid: BM=128 BN=64 warps=8 stages=3 indexing=pointer Ktile=96 ncol=3", "category": "grid", "expected_gain": "unknown", "decision": "COMPILE_FAIL", "tflops": 0.0, "timestamp": "2026-04-21T13:06:49Z"}
{"round": 337, "iter": "iter337", "bottleneck": "compute_bound", "idea": "iter337_autogrid: BM=128 BN=64 warps=8 stages=3 indexing=pointer Ktile=128 ncol=4", "category": "grid", "expected_gain": "unknown", "decision": "DISCARD", "tflops": 37.04, "timestamp": "2026-04-21T13:06:56Z"}
{"round": 338, "iter": "iter338", "bottleneck": "compute_bound", "idea": "iter338_autogrid: BM=128 BN=64 warps=8 stages=3 indexing=block_ptr Ktile=64 ncol=2", "category": "grid", "expected_gain": "unknown", "decision": "DISCARD", "tflops": 44.99, "timestamp": "2026-04-21T13:07:01Z"}
{"round": 339, "iter": "iter339", "bottleneck": "compile", "idea": "iter339_autogrid: BM=128 BN=64 warps=8 stages=3 indexing=block_ptr Ktile=96 ncol=3", "category": "grid", "expected_gain": "unknown", "decision": "COMPILE_FAIL", "tflops": 0.0, "timestamp": "2026-04-21T13:07:06Z"}
{"round": 340, "iter": "iter340", "bottleneck": "compute_bound", "idea": "iter340_autogrid: BM=128 BN=64 warps=8 stages=3 indexing=block_ptr Ktile=128 ncol=4", "category": "grid", "expected_gain": "unknown", "decision": "DISCARD", "tflops": 37.99, "timestamp": "2026-04-21T13:07:13Z"}
{"round": 341, "iter": "iter341", "bottleneck": "compute_bound", "idea": "iter341_autogrid: BM=128 BN=64 warps=8 stages=4 indexing=pointer Ktile=64 ncol=2", "category": "grid", "expected_gain": "unknown", "decision": "DISCARD", "tflops": 45.12, "timestamp": "2026-04-21T13:07:18Z"}
{"round": 342, "iter": "iter342", "bottleneck": "compile", "idea": "iter342_autogrid: BM=128 BN=64 warps=8 stages=4 indexing=pointer Ktile=96 ncol=3", "category": "grid", "expected_gain": "unknown", "decision": "COMPILE_FAIL", "tflops": 0.0, "timestamp": "2026-04-21T13:07:24Z"}
{"round": 343, "iter": "iter343", "bottleneck": "compute_bound", "idea": "iter343_autogrid: BM=128 BN=64 warps=8 stages=4 indexing=pointer Ktile=128 ncol=4", "category": "grid", "expected_gain": "unknown", "decision": "DISCARD", "tflops": 24.39, "timestamp": "2026-04-21T13:07:30Z"}
{"round": 344, "iter": "iter344", "bottleneck": "compute_bound", "idea": "iter344_autogrid: BM=128 BN=64 warps=8 stages=4 indexing=block_ptr Ktile=64 ncol=2", "category": "grid", "expected_gain": "unknown", "decision": "DISCARD", "tflops": 45.19, "timestamp": "2026-04-21T13:07:36Z"}
{"round": 345, "iter": "iter345", "bottleneck": "compile", "idea": "iter345_autogrid: BM=128 BN=64 warps=8 stages=4 indexing=block_ptr Ktile=96 ncol=3", "category": "grid", "expected_gain": "unknown", "decision": "COMPILE_FAIL", "tflops": 0.0, "timestamp": "2026-04-21T13:07:41Z"}
{"round": 346, "iter": "iter346", "bottleneck": "compute_bound", "idea": "iter346_autogrid: BM=128 BN=64 warps=8 stages=4 indexing=block_ptr Ktile=128 ncol=4", "category": "grid", "expected_gain": "unknown", "decision": "DISCARD", "tflops": 29.94, "timestamp": "2026-04-21T13:07:47Z"}
{"round": 347, "iter": "iter347", "bottleneck": "compute_bound", "idea": "iter347_autogrid: BM=128 BN=64 warps=16 stages=3 indexing=pointer Ktile=64 ncol=2", "category": "grid", "expected_gain": "unknown", "decision": "DISCARD", "tflops": 20.21, "timestamp": "2026-04-21T13:07:54Z"}
{"round": 348, "iter": "iter348", "bottleneck": "compile", "idea": "iter348_autogrid: BM=128 BN=64 warps=16 stages=3 indexing=pointer Ktile=96 ncol=3", "category": "grid", "expected_gain": "unknown", "decision": "COMPILE_FAIL", "tflops": 0.0, "timestamp": "2026-04-21T13:07:59Z"}
{"round": 349, "iter": "iter349", "bottleneck": "compute_bound", "idea": "iter349_autogrid: BM=128 BN=64 warps=16 stages=3 indexing=pointer Ktile=128 ncol=4", "category": "grid", "expected_gain": "unknown", "decision": "DISCARD", "tflops": 23.66, "timestamp": "2026-04-21T13:08:05Z"}
{"round": 350, "iter": "iter350", "bottleneck": "compute_bound", "idea": "iter350_autogrid: BM=128 BN=64 warps=16 stages=3 indexing=block_ptr Ktile=64 ncol=2", "category": "grid", "expected_gain": "unknown", "decision": "DISCARD", "tflops": 20.49, "timestamp": "2026-04-21T13:08:11Z"}
{"round": 351, "iter": "iter351", "bottleneck": "compute_bound", "idea": "iter351_autogrid: BM=128 BN=128 warps=4 stages=4 indexing=pointer Ktile=64 ncol=2 layout=mnk", "category": "grid", "expected_gain": "unknown", "decision": "DISCARD", "tflops": 70.33, "timestamp": "2026-04-21T13:11:08Z"}
{"round": 352, "iter": "iter352", "bottleneck": "compute_bound", "idea": "iter352_autogrid: BM=128 BN=128 warps=4 stages=5 indexing=pointer Ktile=64 ncol=2 layout=mnk", "category": "grid", "expected_gain": "unknown", "decision": "DISCARD", "tflops": 70.28, "timestamp": "2026-04-21T13:11:14Z"}
{"round": 353, "iter": "iter353", "bottleneck": "compute_bound", "idea": "iter353_autogrid: BM=128 BN=128 warps=4 stages=6 indexing=pointer Ktile=64 ncol=2 layout=mnk", "category": "grid", "expected_gain": "unknown", "decision": "DISCARD", "tflops": 69.87, "timestamp": "2026-04-21T13:11:33Z"}
{"round": 354, "iter": "iter354", "bottleneck": "compute_bound", "idea": "iter354_autogrid: BM=128 BN=128 warps=4 stages=4 indexing=pointer Ktile=64 ncol=2 layout=lo1", "category": "grid", "expected_gain": "unknown", "decision": "DISCARD", "tflops": 70.05, "timestamp": "2026-04-21T13:11:39Z"}
{"round": 355, "iter": "iter355", "bottleneck": "compile", "idea": "iter355_autogrid: BM=128 BN=128 warps=4 stages=4 indexing=pointer Ktile=64 ncol=2 layout=kmn", "category": "grid", "expected_gain": "unknown", "decision": "COMPILE_FAIL", "tflops": 0.0, "timestamp": "2026-04-21T13:11:44Z"}
{"round": 356, "iter": "iter356", "bottleneck": "compile", "idea": "iter356_autogrid: BM=128 BN=128 warps=4 stages=3 indexing=pointer Ktile=64 ncol=2 layout=kmn", "category": "grid", "expected_gain": "unknown", "decision": "COMPILE_FAIL", "tflops": 0.0, "timestamp": "2026-04-21T13:11:48Z"}
{"round": 357, "iter": "iter357", "bottleneck": "compute_bound", "idea": "iter357_autogrid: BM=128 BN=128 warps=2 stages=3 indexing=pointer Ktile=64 ncol=2 layout=mnk", "category": "grid", "expected_gain": "unknown", "decision": "DISCARD", "tflops": 1.14, "timestamp": "2026-04-21T13:12:10Z"}
{"round": 358, "iter": "iter358", "bottleneck": "compute_bound", "idea": "iter358_autogrid: BM=128 BN=128 warps=2 stages=3 indexing=block_ptr Ktile=64 ncol=2 layout=mnk", "category": "grid", "expected_gain": "unknown", "decision": "DISCARD", "tflops": 7.14, "timestamp": "2026-04-21T13:12:20Z"}
{"round": 359, "iter": "iter359", "bottleneck": "compute_bound", "idea": "iter359_autogrid: BM=128 BN=128 warps=2 stages=4 indexing=pointer Ktile=64 ncol=2 layout=mnk", "category": "grid", "expected_gain": "unknown", "decision": "DISCARD", "tflops": 1.29, "timestamp": "2026-04-21T13:12:42Z"}
{"round": 360, "iter": "iter360", "bottleneck": "compile", "idea": "iter360_autogrid: BM=96 BN=96 warps=4 stages=3 indexing=pointer Ktile=64 ncol=2 layout=mnk", "category": "grid", "expected_gain": "unknown", "decision": "COMPILE_FAIL", "tflops": 0.0, "timestamp": "2026-04-21T13:12:46Z"}
{"round": 361, "iter": "iter361", "bottleneck": "compile", "idea": "iter361_autogrid: BM=96 BN=96 warps=4 stages=3 indexing=pointer Ktile=64 ncol=2 layout=lo1", "category": "grid", "expected_gain": "unknown", "decision": "COMPILE_FAIL", "tflops": 0.0, "timestamp": "2026-04-21T13:12:51Z"}
{"round": 362, "iter": "iter362", "bottleneck": "compile", "idea": "iter362_autogrid: BM=160 BN=160 warps=4 stages=3 indexing=pointer Ktile=64 ncol=2 layout=mnk", "category": "grid", "expected_gain": "unknown", "decision": "COMPILE_FAIL", "tflops": 0.0, "timestamp": "2026-04-21T13:12:56Z"}
{"round": 363, "iter": "iter363", "bottleneck": "compile", "idea": "iter363_autogrid: BM=160 BN=160 warps=4 stages=3 indexing=block_ptr Ktile=64 ncol=2 layout=mnk", "category": "grid", "expected_gain": "unknown", "decision": "COMPILE_FAIL", "tflops": 0.0, "timestamp": "2026-04-21T13:13:00Z"}
{"round": 364, "iter": "iter364", "bottleneck": "compute_bound", "idea": "iter364_autogrid: BM=128 BN=128 warps=2 stages=3 indexing=pointer Ktile=32 ncol=1 layout=mnk", "category": "grid", "expected_gain": "unknown", "decision": "DISCARD", "tflops": 1.47, "timestamp": "2026-04-21T13:13:18Z"}
{"round": 365, "iter": "iter365", "bottleneck": "compute_bound", "idea": "iter365_autogrid: BM=128 BN=128 warps=2 stages=3 indexing=pointer Ktile=32 ncol=1 layout=lo1", "category": "grid", "expected_gain": "unknown", "decision": "DISCARD", "tflops": 1.51, "timestamp": "2026-04-21T13:13:36Z"}
