{"round": 812, "iter": "iter812", "bottleneck": "compute_bound", "idea": "iter812_autogrid: BM=256 BN=128 warps=2 stages=5 indexing=pointer Ktile=64 ncol=2 layout=lo1", "category": "grid", "expected_gain": "unknown", "decision": "DISCARD", "tflops": 1.16, "timestamp": "2026-04-21T14:18:28Z"}
{"round": 813, "iter": "iter813", "bottleneck": "compute_bound", "idea": "iter813_autogrid: BM=256 BN=128 warps=2 stages=5 indexing=pointer Ktile=128 ncol=4 layout=mnk", "category": "grid", "expected_gain": "unknown", "decision": "DISCARD", "tflops": 0.69, "timestamp": "2026-04-21T14:19:09Z"}
{"round": 814, "iter": "iter814", "bottleneck": "compute_bound", "idea": "iter814_autogrid: BM=256 BN=128 warps=2 stages=5 indexing=pointer Ktile=128 ncol=4 layout=lo1", "category": "grid", "expected_gain": "unknown", "decision": "DISCARD", "tflops": 0.71, "timestamp": "2026-04-21T14:19:50Z"}
{"round": 815, "iter": "iter815", "bottleneck": "compute_bound", "idea": "iter815_autogrid: BM=256 BN=128 warps=2 stages=5 indexing=block_ptr Ktile=32 ncol=1 layout=mnk", "category": "grid", "expected_gain": "unknown", "decision": "DISCARD", "tflops": 1.29, "timestamp": "2026-04-21T14:20:10Z"}
{"round": 816, "iter": "iter816", "bottleneck": "compute_bound", "idea": "iter816_autogrid: BM=256 BN=128 warps=2 stages=5 indexing=block_ptr Ktile=32 ncol=1 layout=lo1", "category": "grid", "expected_gain": "unknown", "decision": "DISCARD", "tflops": 1.33, "timestamp": "2026-04-21T14:20:31Z"}
{"round": 817, "iter": "iter817", "bottleneck": "compute_bound", "idea": "iter817_autogrid: BM=256 BN=128 warps=2 stages=5 indexing=block_ptr Ktile=64 ncol=2 layout=mnk", "category": "grid", "expected_gain": "unknown", "decision": "DISCARD", "tflops": 1.13, "timestamp": "2026-04-21T14:20:56Z"}
{"round": 818, "iter": "iter818", "bottleneck": "compute_bound", "idea": "iter818_autogrid: BM=256 BN=128 warps=2 stages=5 indexing=block_ptr Ktile=64 ncol=2 layout=lo1", "category": "grid", "expected_gain": "unknown", "decision": "DISCARD", "tflops": 1.12, "timestamp": "2026-04-21T14:21:22Z"}
{"round": 819, "iter": "iter819", "bottleneck": "compute_bound", "idea": "iter819_autogrid: BM=256 BN=128 warps=2 stages=5 indexing=block_ptr Ktile=128 ncol=4 layout=mnk", "category": "grid", "expected_gain": "unknown", "decision": "DISCARD", "tflops": 0.69, "timestamp": "2026-04-21T14:22:04Z"}
{"round": 820, "iter": "iter820", "bottleneck": "compute_bound", "idea": "iter820_autogrid: BM=256 BN=128 warps=2 stages=5 indexing=block_ptr Ktile=128 ncol=4 layout=lo1", "category": "grid", "expected_gain": "unknown", "decision": "DISCARD", "tflops": 0.7, "timestamp": "2026-04-21T14:22:45Z"}
{"round": 821, "iter": "iter821", "bottleneck": "compute_bound", "idea": "iter821_autogrid: BM=256 BN=128 warps=2 stages=6 indexing=pointer Ktile=32 ncol=1 layout=mnk", "category": "grid", "expected_gain": "unknown", "decision": "DISCARD", "tflops": 1.15, "timestamp": "2026-04-21T14:23:08Z"}
{"round": 822, "iter": "iter822", "bottleneck": "compute_bound", "idea": "iter822_autogrid: BM=256 BN=128 warps=2 stages=6 indexing=pointer Ktile=32 ncol=1 layout=lo1", "category": "grid", "expected_gain": "unknown", "decision": "DISCARD", "tflops": 1.18, "timestamp": "2026-04-21T14:23:30Z"}
{"round": 823, "iter": "iter823", "bottleneck": "compute_bound", "idea": "iter823_autogrid: BM=256 BN=128 warps=2 stages=6 indexing=pointer Ktile=64 ncol=2 layout=mnk", "category": "grid", "expected_gain": "unknown", "decision": "DISCARD", "tflops": 0.81, "timestamp": "2026-04-21T14:24:02Z"}
{"round": 824, "iter": "iter824", "bottleneck": "compute_bound", "idea": "iter824_autogrid: BM=256 BN=128 warps=2 stages=6 indexing=pointer Ktile=64 ncol=2 layout=lo1", "category": "grid", "expected_gain": "unknown", "decision": "DISCARD", "tflops": 0.83, "timestamp": "2026-04-21T14:24:32Z"}
{"round": 825, "iter": "iter825", "bottleneck": "compile", "idea": "iter825_autogrid: BM=256 BN=128 warps=2 stages=6 indexing=pointer Ktile=128 ncol=4 layout=mnk", "category": "grid", "expected_gain": "unknown", "decision": "COMPILE_FAIL", "tflops": 0.0, "timestamp": "2026-04-21T14:24:43Z"}
{"round": 826, "iter": "iter826", "bottleneck": "compile", "idea": "iter826_autogrid: BM=256 BN=128 warps=2 stages=6 indexing=pointer Ktile=128 ncol=4 layout=lo1", "category": "grid", "expected_gain": "unknown", "decision": "COMPILE_FAIL", "tflops": 0.0, "timestamp": "2026-04-21T14:24:55Z"}
{"round": 827, "iter": "iter827", "bottleneck": "compute_bound", "idea": "iter827_autogrid: BM=256 BN=128 warps=2 stages=6 indexing=block_ptr Ktile=32 ncol=1 layout=mnk", "category": "grid", "expected_gain": "unknown", "decision": "DISCARD", "tflops": 1.23, "timestamp": "2026-04-21T14:25:16Z"}
{"round": 828, "iter": "iter828", "bottleneck": "compute_bound", "idea": "iter828_autogrid: BM=256 BN=128 warps=2 stages=6 indexing=block_ptr Ktile=32 ncol=1 layout=lo1", "category": "grid", "expected_gain": "unknown", "decision": "DISCARD", "tflops": 1.28, "timestamp": "2026-04-21T14:25:37Z"}
{"round": 829, "iter": "iter829", "bottleneck": "compute_bound", "idea": "iter829_autogrid: BM=256 BN=128 warps=2 stages=6 indexing=block_ptr Ktile=64 ncol=2 layout=mnk", "category": "grid", "expected_gain": "unknown", "decision": "DISCARD", "tflops": 0.79, "timestamp": "2026-04-21T14:26:09Z"}
{"round": 830, "iter": "iter830", "bottleneck": "compute_bound", "idea": "iter830_autogrid: BM=256 BN=128 warps=2 stages=6 indexing=block_ptr Ktile=64 ncol=2 layout=lo1", "category": "grid", "expected_gain": "unknown", "decision": "DISCARD", "tflops": 0.79, "timestamp": "2026-04-21T14:26:42Z"}
{"round": 831, "iter": "iter831", "bottleneck": "compile", "idea": "iter831_autogrid: BM=256 BN=128 warps=2 stages=6 indexing=block_ptr Ktile=128 ncol=4 layout=mnk", "category": "grid", "expected_gain": "unknown", "decision": "COMPILE_FAIL", "tflops": 0.0, "timestamp": "2026-04-21T14:26:53Z"}
{"round": 832, "iter": "iter832", "bottleneck": "compile", "idea": "iter832_autogrid: BM=256 BN=128 warps=2 stages=6 indexing=block_ptr Ktile=128 ncol=4 layout=lo1", "category": "grid", "expected_gain": "unknown", "decision": "COMPILE_FAIL", "tflops": 0.0, "timestamp": "2026-04-21T14:27:05Z"}
{"round": 833, "iter": "iter833", "bottleneck": "compute_bound", "idea": "iter833_autogrid: BM=256 BN=128 warps=4 stages=3 indexing=pointer Ktile=32 ncol=1 layout=mnk", "category": "grid", "expected_gain": "unknown", "decision": "DISCARD", "tflops": 32.44, "timestamp": "2026-04-21T14:27:12Z"}
{"round": 834, "iter": "iter834", "bottleneck": "compute_bound", "idea": "iter834_autogrid: BM=256 BN=128 warps=4 stages=3 indexing=pointer Ktile=32 ncol=1 layout=lo1", "category": "grid", "expected_gain": "unknown", "decision": "DISCARD", "tflops": 32.75, "timestamp": "2026-04-21T14:27:18Z"}
{"round": 835, "iter": "iter835", "bottleneck": "compute_bound", "idea": "iter835_autogrid: BM=256 BN=128 warps=4 stages=3 indexing=pointer Ktile=64 ncol=2 layout=mnk", "category": "grid", "expected_gain": "unknown", "decision": "DISCARD", "tflops": 26.25, "timestamp": "2026-04-21T14:27:26Z"}
{"round": 836, "iter": "iter836", "bottleneck": "compute_bound", "idea": "iter836_autogrid: BM=256 BN=128 warps=4 stages=3 indexing=pointer Ktile=64 ncol=2 layout=lo1", "category": "grid", "expected_gain": "unknown", "decision": "DISCARD", "tflops": 37.45, "timestamp": "2026-04-21T14:27:33Z"}
{"round": 837, "iter": "iter837", "bottleneck": "compute_bound", "idea": "iter837_autogrid: BM=256 BN=128 warps=4 stages=3 indexing=pointer Ktile=128 ncol=4 layout=mnk", "category": "grid", "expected_gain": "unknown", "decision": "DISCARD", "tflops": 37.98, "timestamp": "2026-04-21T14:27:41Z"}
{"round": 838, "iter": "iter838", "bottleneck": "compute_bound", "idea": "iter838_autogrid: BM=256 BN=128 warps=4 stages=3 indexing=pointer Ktile=128 ncol=4 layout=lo1", "category": "grid", "expected_gain": "unknown", "decision": "DISCARD", "tflops": 33.95, "timestamp": "2026-04-21T14:27:49Z"}
{"round": 839, "iter": "iter839", "bottleneck": "compute_bound", "idea": "iter839_autogrid: BM=256 BN=128 warps=4 stages=3 indexing=block_ptr Ktile=32 ncol=1 layout=mnk", "category": "grid", "expected_gain": "unknown", "decision": "DISCARD", "tflops": 31.05, "timestamp": "2026-04-21T14:27:56Z"}
{"round": 840, "iter": "iter840", "bottleneck": "compute_bound", "idea": "iter840_autogrid: BM=256 BN=128 warps=4 stages=3 indexing=block_ptr Ktile=32 ncol=1 layout=lo1", "category": "grid", "expected_gain": "unknown", "decision": "DISCARD", "tflops": 31.67, "timestamp": "2026-04-21T14:28:02Z"}
{"round": 841, "iter": "iter841", "bottleneck": "compute_bound", "idea": "iter841_autogrid: BM=256 BN=128 warps=4 stages=3 indexing=block_ptr Ktile=64 ncol=2 layout=mnk", "category": "grid", "expected_gain": "unknown", "decision": "DISCARD", "tflops": 31.97, "timestamp": "2026-04-21T14:28:09Z"}
{"round": 842, "iter": "iter842", "bottleneck": "compute_bound", "idea": "iter842_autogrid: BM=256 BN=128 warps=4 stages=3 indexing=block_ptr Ktile=64 ncol=2 layout=lo1", "category": "grid", "expected_gain": "unknown", "decision": "DISCARD", "tflops": 23.27, "timestamp": "2026-04-21T14:28:17Z"}
{"round": 843, "iter": "iter843", "bottleneck": "compute_bound", "idea": "iter843_autogrid: BM=256 BN=128 warps=4 stages=3 indexing=block_ptr Ktile=128 ncol=4 layout=mnk", "category": "grid", "expected_gain": "unknown", "decision": "DISCARD", "tflops": 33.5, "timestamp": "2026-04-21T14:28:26Z"}
{"round": 844, "iter": "iter844", "bottleneck": "compute_bound", "idea": "iter844_autogrid: BM=256 BN=128 warps=4 stages=3 indexing=block_ptr Ktile=128 ncol=4 layout=lo1", "category": "grid", "expected_gain": "unknown", "decision": "DISCARD", "tflops": 36.93, "timestamp": "2026-04-21T14:28:34Z"}
{"round": 845, "iter": "iter845", "bottleneck": "compute_bound", "idea": "iter845_autogrid: BM=256 BN=128 warps=4 stages=4 indexing=pointer Ktile=32 ncol=1 layout=mnk", "category": "grid", "expected_gain": "unknown", "decision": "DISCARD", "tflops": 32.81, "timestamp": "2026-04-21T14:28:41Z"}
{"round": 846, "iter": "iter846", "bottleneck": "compute_bound", "idea": "iter846_autogrid: BM=256 BN=128 warps=4 stages=4 indexing=pointer Ktile=32 ncol=1 layout=lo1", "category": "grid", "expected_gain": "unknown", "decision": "DISCARD", "tflops": 32.45, "timestamp": "2026-04-21T14:28:48Z"}
{"round": 847, "iter": "iter847", "bottleneck": "compute_bound", "idea": "iter847_autogrid: BM=256 BN=128 warps=4 stages=4 indexing=pointer Ktile=64 ncol=2 layout=mnk", "category": "grid", "expected_gain": "unknown", "decision": "DISCARD", "tflops": 30.65, "timestamp": "2026-04-21T14:28:55Z"}
{"round": 848, "iter": "iter848", "bottleneck": "compute_bound", "idea": "iter848_autogrid: BM=256 BN=128 warps=4 stages=4 indexing=pointer Ktile=64 ncol=2 layout=lo1", "category": "grid", "expected_gain": "unknown", "decision": "DISCARD", "tflops": 37.77, "timestamp": "2026-04-21T14:29:02Z"}
{"round": 849, "iter": "iter849", "bottleneck": "compute_bound", "idea": "iter849_autogrid: BM=256 BN=128 warps=4 stages=4 indexing=pointer Ktile=128 ncol=4 layout=mnk", "category": "grid", "expected_gain": "unknown", "decision": "DISCARD", "tflops": 37.06, "timestamp": "2026-04-21T14:29:11Z"}
{"round": 850, "iter": "iter850", "bottleneck": "compute_bound", "idea": "iter850_autogrid: BM=256 BN=128 warps=4 stages=4 indexing=pointer Ktile=128 ncol=4 layout=lo1", "category": "grid", "expected_gain": "unknown", "decision": "DISCARD", "tflops": 33.56, "timestamp": "2026-04-21T14:29:20Z"}
{"round": 851, "iter": "iter851", "bottleneck": "compute_bound", "idea": "iter851_autogrid: BM=256 BN=128 warps=4 stages=4 indexing=block_ptr Ktile=32 ncol=1 layout=mnk", "category": "grid", "expected_gain": "unknown", "decision": "DISCARD", "tflops": 31.0, "timestamp": "2026-04-21T14:29:26Z"}
{"round": 852, "iter": "iter852", "bottleneck": "compute_bound", "idea": "iter852_autogrid: BM=256 BN=128 warps=4 stages=4 indexing=block_ptr Ktile=32 ncol=1 layout=lo1", "category": "grid", "expected_gain": "unknown", "decision": "DISCARD", "tflops": 31.41, "timestamp": "2026-04-21T14:29:33Z"}
{"round": 853, "iter": "iter853", "bottleneck": "compute_bound", "idea": "iter853_autogrid: BM=256 BN=128 warps=4 stages=4 indexing=block_ptr Ktile=64 ncol=2 layout=mnk", "category": "grid", "expected_gain": "unknown", "decision": "DISCARD", "tflops": 31.01, "timestamp": "2026-04-21T14:29:40Z"}
{"round": 854, "iter": "iter854", "bottleneck": "compute_bound", "idea": "iter854_autogrid: BM=256 BN=128 warps=4 stages=4 indexing=block_ptr Ktile=64 ncol=2 layout=lo1", "category": "grid", "expected_gain": "unknown", "decision": "DISCARD", "tflops": 38.95, "timestamp": "2026-04-21T14:29:48Z"}
{"round": 855, "iter": "iter855", "bottleneck": "compute_bound", "idea": "iter855_autogrid: BM=256 BN=128 warps=4 stages=4 indexing=block_ptr Ktile=128 ncol=4 layout=mnk", "category": "grid", "expected_gain": "unknown", "decision": "DISCARD", "tflops": 33.16, "timestamp": "2026-04-21T14:29:56Z"}
{"round": 856, "iter": "iter856", "bottleneck": "compute_bound", "idea": "iter856_autogrid: BM=256 BN=128 warps=4 stages=4 indexing=block_ptr Ktile=128 ncol=4 layout=lo1", "category": "grid", "expected_gain": "unknown", "decision": "DISCARD", "tflops": 36.55, "timestamp": "2026-04-21T14:30:05Z"}
{"round": 857, "iter": "iter857", "bottleneck": "compute_bound", "idea": "iter857_autogrid: BM=256 BN=128 warps=4 stages=5 indexing=pointer Ktile=32 ncol=1 layout=mnk", "category": "grid", "expected_gain": "unknown", "decision": "DISCARD", "tflops": 28.25, "timestamp": "2026-04-21T14:30:11Z"}
{"round": 858, "iter": "iter858", "bottleneck": "compute_bound", "idea": "iter858_autogrid: BM=256 BN=128 warps=4 stages=5 indexing=pointer Ktile=32 ncol=1 layout=lo1", "category": "grid", "expected_gain": "unknown", "decision": "DISCARD", "tflops": 28.83, "timestamp": "2026-04-21T14:30:18Z"}
{"round": 859, "iter": "iter859", "bottleneck": "compute_bound", "idea": "iter859_autogrid: BM=256 BN=128 warps=4 stages=5 indexing=pointer Ktile=64 ncol=2 layout=mnk", "category": "grid", "expected_gain": "unknown", "decision": "DISCARD", "tflops": 30.56, "timestamp": "2026-04-21T14:30:25Z"}
{"round": 860, "iter": "iter860", "bottleneck": "compute_bound", "idea": "iter860_autogrid: BM=256 BN=128 warps=4 stages=5 indexing=pointer Ktile=64 ncol=2 layout=lo1", "category": "grid", "expected_gain": "unknown", "decision": "DISCARD", "tflops": 37.44, "timestamp": "2026-04-21T14:30:32Z"}
{"round": 861, "iter": "iter861", "bottleneck": "compute_bound", "idea": "iter861_autogrid: BM=256 BN=128 warps=4 stages=5 indexing=pointer Ktile=128 ncol=4 layout=mnk", "category": "grid", "expected_gain": "unknown", "decision": "DISCARD", "tflops": 36.89, "timestamp": "2026-04-21T14:30:41Z"}
{"round": 862, "iter": "iter862", "bottleneck": "compute_bound", "idea": "iter862_autogrid: BM=256 BN=128 warps=4 stages=5 indexing=pointer Ktile=128 ncol=4 layout=lo1", "category": "grid", "expected_gain": "unknown", "decision": "DISCARD", "tflops": 33.14, "timestamp": "2026-04-21T14:30:49Z"}
{"round": 863, "iter": "iter863", "bottleneck": "compute_bound", "idea": "iter863_autogrid: BM=256 BN=128 warps=4 stages=5 indexing=block_ptr Ktile=32 ncol=1 layout=mnk", "category": "grid", "expected_gain": "unknown", "decision": "DISCARD", "tflops": 26.75, "timestamp": "2026-04-21T14:30:56Z"}
{"round": 864, "iter": "iter864", "bottleneck": "compute_bound", "idea": "iter864_autogrid: BM=256 BN=128 warps=4 stages=5 indexing=block_ptr Ktile=32 ncol=1 layout=lo1", "category": "grid", "expected_gain": "unknown", "decision": "DISCARD", "tflops": 29.45, "timestamp": "2026-04-21T14:31:03Z"}
{"round": 865, "iter": "iter865", "bottleneck": "compute_bound", "idea": "iter865_autogrid: BM=256 BN=128 warps=4 stages=5 indexing=block_ptr Ktile=64 ncol=2 layout=mnk", "category": "grid", "expected_gain": "unknown", "decision": "DISCARD", "tflops": 30.97, "timestamp": "2026-04-21T14:31:10Z"}
{"round": 866, "iter": "iter866", "bottleneck": "compute_bound", "idea": "iter866_autogrid: BM=256 BN=128 warps=4 stages=5 indexing=block_ptr Ktile=64 ncol=2 layout=lo1", "category": "grid", "expected_gain": "unknown", "decision": "DISCARD", "tflops": 38.27, "timestamp": "2026-04-21T14:31:18Z"}
{"round": 867, "iter": "iter867", "bottleneck": "compute_bound", "idea": "iter867_autogrid: BM=256 BN=128 warps=4 stages=5 indexing=block_ptr Ktile=128 ncol=4 layout=mnk", "category": "grid", "expected_gain": "unknown", "decision": "DISCARD", "tflops": 33.06, "timestamp": "2026-04-21T14:31:27Z"}
{"round": 868, "iter": "iter868", "bottleneck": "compute_bound", "idea": "iter868_autogrid: BM=256 BN=128 warps=4 stages=5 indexing=block_ptr Ktile=128 ncol=4 layout=lo1", "category": "grid", "expected_gain": "unknown", "decision": "DISCARD", "tflops": 36.42, "timestamp": "2026-04-21T14:31:35Z"}
{"round": 869, "iter": "iter869", "bottleneck": "compute_bound", "idea": "iter869_autogrid: BM=256 BN=128 warps=4 stages=6 indexing=pointer Ktile=32 ncol=1 layout=mnk", "category": "grid", "expected_gain": "unknown", "decision": "DISCARD", "tflops": 28.03, "timestamp": "2026-04-21T14:31:41Z"}
{"round": 870, "iter": "iter870", "bottleneck": "compute_bound", "idea": "iter870_autogrid: BM=256 BN=128 warps=4 stages=6 indexing=pointer Ktile=32 ncol=1 layout=lo1", "category": "grid", "expected_gain": "unknown", "decision": "DISCARD", "tflops": 30.28, "timestamp": "2026-04-21T14:31:48Z"}
{"round": 871, "iter": "iter871", "bottleneck": "compute_bound", "idea": "iter871_autogrid: BM=256 BN=128 warps=4 stages=6 indexing=pointer Ktile=64 ncol=2 layout=mnk", "category": "grid", "expected_gain": "unknown", "decision": "DISCARD", "tflops": 29.19, "timestamp": "2026-04-21T14:31:56Z"}
{"round": 872, "iter": "iter872", "bottleneck": "compute_bound", "idea": "iter872_autogrid: BM=256 BN=128 warps=4 stages=6 indexing=pointer Ktile=64 ncol=2 layout=lo1", "category": "grid", "expected_gain": "unknown", "decision": "DISCARD", "tflops": 28.59, "timestamp": "2026-04-21T14:32:03Z"}
{"round": 873, "iter": "iter873", "bottleneck": "compile", "idea": "iter873_autogrid: BM=256 BN=128 warps=4 stages=6 indexing=pointer Ktile=128 ncol=4 layout=mnk", "category": "grid", "expected_gain": "unknown", "decision": "COMPILE_FAIL", "tflops": 0.0, "timestamp": "2026-04-21T14:32:09Z"}
{"round": 874, "iter": "iter874", "bottleneck": "compile", "idea": "iter874_autogrid: BM=256 BN=128 warps=4 stages=6 indexing=pointer Ktile=128 ncol=4 layout=lo1", "category": "grid", "expected_gain": "unknown", "decision": "COMPILE_FAIL", "tflops": 0.0, "timestamp": "2026-04-21T14:32:15Z"}
{"round": 875, "iter": "iter875", "bottleneck": "compute_bound", "idea": "iter875_autogrid: BM=256 BN=128 warps=4 stages=6 indexing=block_ptr Ktile=32 ncol=1 layout=mnk", "category": "grid", "expected_gain": "unknown", "decision": "DISCARD", "tflops": 26.89, "timestamp": "2026-04-21T14:32:22Z"}
{"round": 876, "iter": "iter876", "bottleneck": "compute_bound", "idea": "iter876_autogrid: BM=256 BN=128 warps=4 stages=6 indexing=block_ptr Ktile=32 ncol=1 layout=lo1", "category": "grid", "expected_gain": "unknown", "decision": "DISCARD", "tflops": 29.16, "timestamp": "2026-04-21T14:32:29Z"}
{"round": 877, "iter": "iter877", "bottleneck": "compute_bound", "idea": "iter877_autogrid: BM=256 BN=128 warps=4 stages=6 indexing=block_ptr Ktile=64 ncol=2 layout=mnk", "category": "grid", "expected_gain": "unknown", "decision": "DISCARD", "tflops": 29.15, "timestamp": "2026-04-21T14:32:37Z"}
{"round": 878, "iter": "iter878", "bottleneck": "compute_bound", "idea": "iter878_autogrid: BM=256 BN=128 warps=4 stages=6 indexing=block_ptr Ktile=64 ncol=2 layout=lo1", "category": "grid", "expected_gain": "unknown", "decision": "DISCARD", "tflops": 28.9, "timestamp": "2026-04-21T14:32:44Z"}
{"round": 879, "iter": "iter879", "bottleneck": "compile", "idea": "iter879_autogrid: BM=256 BN=128 warps=4 stages=6 indexing=block_ptr Ktile=128 ncol=4 layout=mnk", "category": "grid", "expected_gain": "unknown", "decision": "COMPILE_FAIL", "tflops": 0.0, "timestamp": "2026-04-21T14:32:50Z"}
{"round": 880, "iter": "iter880", "bottleneck": "compile", "idea": "iter880_autogrid: BM=256 BN=128 warps=4 stages=6 indexing=block_ptr Ktile=128 ncol=4 layout=lo1", "category": "grid", "expected_gain": "unknown", "decision": "COMPILE_FAIL", "tflops": 0.0, "timestamp": "2026-04-21T14:32:57Z"}
{"round": 881, "iter": "iter881", "bottleneck": "compute_bound", "idea": "iter881_autogrid: BM=256 BN=128 warps=8 stages=3 indexing=pointer Ktile=32 ncol=1 layout=mnk", "category": "grid", "expected_gain": "unknown", "decision": "DISCARD", "tflops": 47.3, "timestamp": "2026-04-21T14:33:02Z"}
{"round": 882, "iter": "iter882", "bottleneck": "compute_bound", "idea": "iter882_autogrid: BM=256 BN=128 warps=8 stages=3 indexing=pointer Ktile=32 ncol=1 layout=lo1", "category": "grid", "expected_gain": "unknown", "decision": "DISCARD", "tflops": 46.44, "timestamp": "2026-04-21T14:33:09Z"}
{"round": 883, "iter": "iter883", "bottleneck": "compute_bound", "idea": "iter883_autogrid: BM=256 BN=128 warps=8 stages=3 indexing=pointer Ktile=64 ncol=2 layout=mnk", "category": "grid", "expected_gain": "unknown", "decision": "DISCARD", "tflops": 37.39, "timestamp": "2026-04-21T14:33:16Z"}
{"round": 885, "iter": "iter885", "bottleneck": "compile", "idea": "iter885_autogrid: BM=256 BN=128 warps=8 stages=3 indexing=pointer Ktile=128 ncol=4 layout=mnk", "category": "grid", "expected_gain": "unknown", "decision": "COMPILE_FAIL", "tflops": 0.0, "timestamp": "2026-04-21T14:39:17Z"}
{"round": 886, "iter": "iter886", "bottleneck": "compile", "idea": "iter886_autogrid: BM=256 BN=128 warps=8 stages=3 indexing=pointer Ktile=128 ncol=4 layout=lo1", "category": "grid", "expected_gain": "unknown", "decision": "COMPILE_FAIL", "tflops": 0.0, "timestamp": "2026-04-21T14:39:21Z"}
