{"round": 756, "iter": "iter756", "bottleneck": "compute_bound", "idea": "iter756_autogrid: BM=128 BN=64 warps=8 stages=4 indexing=block_ptr Ktile=32 ncol=1 layout=lo1", "category": "grid", "expected_gain": "unknown", "decision": "DISCARD", "tflops": 76.95, "timestamp": "2026-04-21T17:14:15Z"}
{"round": 757, "iter": "iter757", "bottleneck": "compute_bound", "idea": "iter757_autogrid: BM=128 BN=64 warps=8 stages=4 indexing=block_ptr Ktile=64 ncol=2 layout=mnk", "category": "grid", "expected_gain": "unknown", "decision": "DISCARD", "tflops": 98.62, "timestamp": "2026-04-21T17:14:20Z"}
{"round": 758, "iter": "iter758", "bottleneck": "compute_bound", "idea": "iter758_autogrid: BM=128 BN=64 warps=8 stages=4 indexing=block_ptr Ktile=64 ncol=2 layout=lo1", "category": "grid", "expected_gain": "unknown", "decision": "DISCARD", "tflops": 95.04, "timestamp": "2026-04-21T17:14:25Z"}
{"round": 759, "iter": "iter759", "bottleneck": "compute_bound", "idea": "iter759_autogrid: BM=128 BN=64 warps=8 stages=4 indexing=block_ptr Ktile=128 ncol=4 layout=mnk", "category": "grid", "expected_gain": "unknown", "decision": "DISCARD", "tflops": 84.48, "timestamp": "2026-04-21T17:14:30Z"}
{"round": 760, "iter": "iter760", "bottleneck": "compute_bound", "idea": "iter760_autogrid: BM=128 BN=64 warps=8 stages=4 indexing=block_ptr Ktile=128 ncol=4 layout=lo1", "category": "grid", "expected_gain": "unknown", "decision": "DISCARD", "tflops": 89.79, "timestamp": "2026-04-21T17:14:35Z"}
{"round": 761, "iter": "iter761", "bottleneck": "compute_bound", "idea": "iter761_autogrid: BM=128 BN=64 warps=8 stages=5 indexing=pointer Ktile=32 ncol=1 layout=mnk", "category": "grid", "expected_gain": "unknown", "decision": "DISCARD", "tflops": 75.83, "timestamp": "2026-04-21T17:14:41Z"}
{"round": 762, "iter": "iter762", "bottleneck": "compute_bound", "idea": "iter762_autogrid: BM=128 BN=64 warps=8 stages=5 indexing=pointer Ktile=32 ncol=1 layout=lo1", "category": "grid", "expected_gain": "unknown", "decision": "DISCARD", "tflops": 75.44, "timestamp": "2026-04-21T17:14:46Z"}
{"round": 763, "iter": "iter763", "bottleneck": "compute_bound", "idea": "iter763_autogrid: BM=128 BN=64 warps=8 stages=5 indexing=pointer Ktile=64 ncol=2 layout=mnk", "category": "grid", "expected_gain": "unknown", "decision": "DISCARD", "tflops": 98.49, "timestamp": "2026-04-21T17:14:50Z"}
{"round": 764, "iter": "iter764", "bottleneck": "compute_bound", "idea": "iter764_autogrid: BM=128 BN=64 warps=8 stages=5 indexing=pointer Ktile=64 ncol=2 layout=lo1", "category": "grid", "expected_gain": "unknown", "decision": "DISCARD", "tflops": 103.1, "timestamp": "2026-04-21T17:14:55Z"}
{"round": 765, "iter": "iter765", "bottleneck": "compute_bound", "idea": "iter765_autogrid: BM=128 BN=64 warps=8 stages=5 indexing=pointer Ktile=128 ncol=4 layout=mnk", "category": "grid", "expected_gain": "unknown", "decision": "DISCARD", "tflops": 83.86, "timestamp": "2026-04-21T17:15:01Z"}
{"round": 766, "iter": "iter766", "bottleneck": "compute_bound", "idea": "iter766_autogrid: BM=128 BN=64 warps=8 stages=5 indexing=pointer Ktile=128 ncol=4 layout=lo1", "category": "grid", "expected_gain": "unknown", "decision": "DISCARD", "tflops": 84.31, "timestamp": "2026-04-21T17:15:06Z"}
{"round": 767, "iter": "iter767", "bottleneck": "compute_bound", "idea": "iter767_autogrid: BM=128 BN=64 warps=8 stages=5 indexing=block_ptr Ktile=32 ncol=1 layout=mnk", "category": "grid", "expected_gain": "unknown", "decision": "DISCARD", "tflops": 75.02, "timestamp": "2026-04-21T17:15:11Z"}
{"round": 768, "iter": "iter768", "bottleneck": "compute_bound", "idea": "iter768_autogrid: BM=128 BN=64 warps=8 stages=5 indexing=block_ptr Ktile=32 ncol=1 layout=lo1", "category": "grid", "expected_gain": "unknown", "decision": "DISCARD", "tflops": 76.41, "timestamp": "2026-04-21T17:15:16Z"}
{"round": 769, "iter": "iter769", "bottleneck": "compute_bound", "idea": "iter769_autogrid: BM=128 BN=64 warps=8 stages=5 indexing=block_ptr Ktile=64 ncol=2 layout=mnk", "category": "grid", "expected_gain": "unknown", "decision": "DISCARD", "tflops": 100.0, "timestamp": "2026-04-21T17:15:21Z"}
{"round": 770, "iter": "iter770", "bottleneck": "compute_bound", "idea": "iter770_autogrid: BM=128 BN=64 warps=8 stages=5 indexing=block_ptr Ktile=64 ncol=2 layout=lo1", "category": "grid", "expected_gain": "unknown", "decision": "DISCARD", "tflops": 92.8, "timestamp": "2026-04-21T17:15:26Z"}
{"round": 771, "iter": "iter771", "bottleneck": "compute_bound", "idea": "iter771_autogrid: BM=128 BN=64 warps=8 stages=5 indexing=block_ptr Ktile=128 ncol=4 layout=mnk", "category": "grid", "expected_gain": "unknown", "decision": "DISCARD", "tflops": 84.38, "timestamp": "2026-04-21T17:15:32Z"}
{"round": 772, "iter": "iter772", "bottleneck": "compute_bound", "idea": "iter772_autogrid: BM=128 BN=64 warps=8 stages=5 indexing=block_ptr Ktile=128 ncol=4 layout=lo1", "category": "grid", "expected_gain": "unknown", "decision": "DISCARD", "tflops": 90.27, "timestamp": "2026-04-21T17:15:37Z"}
{"round": 773, "iter": "iter773", "bottleneck": "compute_bound", "idea": "iter773_autogrid: BM=128 BN=64 warps=8 stages=6 indexing=pointer Ktile=32 ncol=1 layout=mnk", "category": "grid", "expected_gain": "unknown", "decision": "DISCARD", "tflops": 75.5, "timestamp": "2026-04-21T17:15:42Z"}
{"round": 774, "iter": "iter774", "bottleneck": "compute_bound", "idea": "iter774_autogrid: BM=128 BN=64 warps=8 stages=6 indexing=pointer Ktile=32 ncol=1 layout=lo1", "category": "grid", "expected_gain": "unknown", "decision": "DISCARD", "tflops": 73.48, "timestamp": "2026-04-21T17:15:47Z"}
{"round": 775, "iter": "iter775", "bottleneck": "compute_bound", "idea": "iter775_autogrid: BM=128 BN=64 warps=8 stages=6 indexing=pointer Ktile=64 ncol=2 layout=mnk", "category": "grid", "expected_gain": "unknown", "decision": "DISCARD", "tflops": 100.0, "timestamp": "2026-04-21T17:15:52Z"}
{"round": 776, "iter": "iter776", "bottleneck": "compute_bound", "idea": "iter776_autogrid: BM=128 BN=64 warps=8 stages=6 indexing=pointer Ktile=64 ncol=2 layout=lo1", "category": "grid", "expected_gain": "unknown", "decision": "DISCARD", "tflops": 104.72, "timestamp": "2026-04-21T17:15:57Z"}
{"round": 777, "iter": "iter777", "bottleneck": "compute_bound", "idea": "iter777_autogrid: BM=128 BN=64 warps=8 stages=6 indexing=pointer Ktile=128 ncol=4 layout=mnk", "category": "grid", "expected_gain": "unknown", "decision": "DISCARD", "tflops": 83.27, "timestamp": "2026-04-21T17:16:03Z"}
{"round": 778, "iter": "iter778", "bottleneck": "compute_bound", "idea": "iter778_autogrid: BM=128 BN=64 warps=8 stages=6 indexing=pointer Ktile=128 ncol=4 layout=lo1", "category": "grid", "expected_gain": "unknown", "decision": "DISCARD", "tflops": 84.64, "timestamp": "2026-04-21T17:16:08Z"}
{"round": 779, "iter": "iter779", "bottleneck": "compute_bound", "idea": "iter779_autogrid: BM=128 BN=64 warps=8 stages=6 indexing=block_ptr Ktile=32 ncol=1 layout=mnk", "category": "grid", "expected_gain": "unknown", "decision": "DISCARD", "tflops": 73.83, "timestamp": "2026-04-21T17:16:13Z"}
{"round": 780, "iter": "iter780", "bottleneck": "compute_bound", "idea": "iter780_autogrid: BM=128 BN=64 warps=8 stages=6 indexing=block_ptr Ktile=32 ncol=1 layout=lo1", "category": "grid", "expected_gain": "unknown", "decision": "DISCARD", "tflops": 76.83, "timestamp": "2026-04-21T17:16:19Z"}
{"round": 781, "iter": "iter781", "bottleneck": "compute_bound", "idea": "iter781_autogrid: BM=128 BN=64 warps=8 stages=6 indexing=block_ptr Ktile=64 ncol=2 layout=mnk", "category": "grid", "expected_gain": "unknown", "decision": "DISCARD", "tflops": 99.79, "timestamp": "2026-04-21T17:16:24Z"}
{"round": 782, "iter": "iter782", "bottleneck": "compute_bound", "idea": "iter782_autogrid: BM=128 BN=64 warps=8 stages=6 indexing=block_ptr Ktile=64 ncol=2 layout=lo1", "category": "grid", "expected_gain": "unknown", "decision": "DISCARD", "tflops": 92.48, "timestamp": "2026-04-21T17:16:29Z"}
{"round": 783, "iter": "iter783", "bottleneck": "compute_bound", "idea": "iter783_autogrid: BM=128 BN=64 warps=8 stages=6 indexing=block_ptr Ktile=128 ncol=4 layout=mnk", "category": "grid", "expected_gain": "unknown", "decision": "DISCARD", "tflops": 84.31, "timestamp": "2026-04-21T17:16:34Z"}
{"round": 784, "iter": "iter784", "bottleneck": "compute_bound", "idea": "iter784_autogrid: BM=128 BN=64 warps=8 stages=6 indexing=block_ptr Ktile=128 ncol=4 layout=lo1", "category": "grid", "expected_gain": "unknown", "decision": "DISCARD", "tflops": 89.65, "timestamp": "2026-04-21T17:16:39Z"}
{"round": 785, "iter": "iter785", "bottleneck": "compute_bound", "idea": "iter785_autogrid: BM=256 BN=128 warps=2 stages=3 indexing=pointer Ktile=32 ncol=1 layout=mnk", "category": "grid", "expected_gain": "unknown", "decision": "DISCARD", "tflops": 3.0, "timestamp": "2026-04-21T17:16:50Z"}
{"round": 786, "iter": "iter786", "bottleneck": "compute_bound", "idea": "iter786_autogrid: BM=256 BN=128 warps=2 stages=3 indexing=pointer Ktile=32 ncol=1 layout=lo1", "category": "grid", "expected_gain": "unknown", "decision": "DISCARD", "tflops": 2.99, "timestamp": "2026-04-21T17:17:00Z"}
{"round": 787, "iter": "iter787", "bottleneck": "compute_bound", "idea": "iter787_autogrid: BM=256 BN=128 warps=2 stages=3 indexing=pointer Ktile=64 ncol=2 layout=mnk", "category": "grid", "expected_gain": "unknown", "decision": "DISCARD", "tflops": 2.83, "timestamp": "2026-04-21T17:17:11Z"}
{"round": 788, "iter": "iter788", "bottleneck": "compute_bound", "idea": "iter788_autogrid: BM=256 BN=128 warps=2 stages=3 indexing=pointer Ktile=64 ncol=2 layout=lo1", "category": "grid", "expected_gain": "unknown", "decision": "DISCARD", "tflops": 2.84, "timestamp": "2026-04-21T17:17:22Z"}
{"round": 789, "iter": "iter789", "bottleneck": "compute_bound", "idea": "iter789_autogrid: BM=256 BN=128 warps=2 stages=3 indexing=pointer Ktile=128 ncol=4 layout=mnk", "category": "grid", "expected_gain": "unknown", "decision": "DISCARD", "tflops": 2.27, "timestamp": "2026-04-21T17:17:34Z"}
{"round": 790, "iter": "iter790", "bottleneck": "compute_bound", "idea": "iter790_autogrid: BM=256 BN=128 warps=2 stages=3 indexing=pointer Ktile=128 ncol=4 layout=lo1", "category": "grid", "expected_gain": "unknown", "decision": "DISCARD", "tflops": 2.34, "timestamp": "2026-04-21T17:17:46Z"}
{"round": 791, "iter": "iter791", "bottleneck": "compute_bound", "idea": "iter791_autogrid: BM=256 BN=128 warps=2 stages=3 indexing=block_ptr Ktile=32 ncol=1 layout=mnk", "category": "grid", "expected_gain": "unknown", "decision": "DISCARD", "tflops": 3.17, "timestamp": "2026-04-21T17:17:56Z"}
{"round": 792, "iter": "iter792", "bottleneck": "compute_bound", "idea": "iter792_autogrid: BM=256 BN=128 warps=2 stages=3 indexing=block_ptr Ktile=32 ncol=1 layout=lo1", "category": "grid", "expected_gain": "unknown", "decision": "DISCARD", "tflops": 3.22, "timestamp": "2026-04-21T17:18:06Z"}
{"round": 793, "iter": "iter793", "bottleneck": "compute_bound", "idea": "iter793_autogrid: BM=256 BN=128 warps=2 stages=3 indexing=block_ptr Ktile=64 ncol=2 layout=mnk", "category": "grid", "expected_gain": "unknown", "decision": "DISCARD", "tflops": 2.74, "timestamp": "2026-04-21T17:18:17Z"}
{"round": 794, "iter": "iter794", "bottleneck": "compute_bound", "idea": "iter794_autogrid: BM=256 BN=128 warps=2 stages=3 indexing=block_ptr Ktile=64 ncol=2 layout=lo1", "category": "grid", "expected_gain": "unknown", "decision": "DISCARD", "tflops": 2.75, "timestamp": "2026-04-21T17:18:28Z"}
{"round": 795, "iter": "iter795", "bottleneck": "compute_bound", "idea": "iter795_autogrid: BM=256 BN=128 warps=2 stages=3 indexing=block_ptr Ktile=128 ncol=4 layout=mnk", "category": "grid", "expected_gain": "unknown", "decision": "DISCARD", "tflops": 2.27, "timestamp": "2026-04-21T17:18:40Z"}
{"round": 796, "iter": "iter796", "bottleneck": "compute_bound", "idea": "iter796_autogrid: BM=256 BN=128 warps=2 stages=3 indexing=block_ptr Ktile=128 ncol=4 layout=lo1", "category": "grid", "expected_gain": "unknown", "decision": "DISCARD", "tflops": 2.32, "timestamp": "2026-04-21T17:18:52Z"}
{"round": 797, "iter": "iter797", "bottleneck": "compute_bound", "idea": "iter797_autogrid: BM=256 BN=128 warps=2 stages=4 indexing=pointer Ktile=32 ncol=1 layout=mnk", "category": "grid", "expected_gain": "unknown", "decision": "DISCARD", "tflops": 2.94, "timestamp": "2026-04-21T17:19:02Z"}
{"round": 798, "iter": "iter798", "bottleneck": "compute_bound", "idea": "iter798_autogrid: BM=256 BN=128 warps=2 stages=4 indexing=pointer Ktile=32 ncol=1 layout=lo1", "category": "grid", "expected_gain": "unknown", "decision": "DISCARD", "tflops": 2.96, "timestamp": "2026-04-21T17:19:13Z"}
{"round": 799, "iter": "iter799", "bottleneck": "compute_bound", "idea": "iter799_autogrid: BM=256 BN=128 warps=2 stages=4 indexing=pointer Ktile=64 ncol=2 layout=mnk", "category": "grid", "expected_gain": "unknown", "decision": "DISCARD", "tflops": 2.82, "timestamp": "2026-04-21T17:19:24Z"}
{"round": 800, "iter": "iter800", "bottleneck": "compute_bound", "idea": "iter800_autogrid: BM=256 BN=128 warps=2 stages=4 indexing=pointer Ktile=64 ncol=2 layout=lo1", "category": "grid", "expected_gain": "unknown", "decision": "DISCARD", "tflops": 2.81, "timestamp": "2026-04-21T17:19:34Z"}
{"round": 801, "iter": "iter801", "bottleneck": "compute_bound", "idea": "iter801_autogrid: BM=256 BN=128 warps=2 stages=4 indexing=pointer Ktile=128 ncol=4 layout=mnk", "category": "grid", "expected_gain": "unknown", "decision": "DISCARD", "tflops": 1.58, "timestamp": "2026-04-21T17:19:50Z"}
{"round": 802, "iter": "iter802", "bottleneck": "compute_bound", "idea": "iter802_autogrid: BM=256 BN=128 warps=2 stages=4 indexing=pointer Ktile=128 ncol=4 layout=lo1", "category": "grid", "expected_gain": "unknown", "decision": "DISCARD", "tflops": 1.63, "timestamp": "2026-04-21T17:20:05Z"}
{"round": 803, "iter": "iter803", "bottleneck": "compute_bound", "idea": "iter803_autogrid: BM=256 BN=128 warps=2 stages=4 indexing=block_ptr Ktile=32 ncol=1 layout=mnk", "category": "grid", "expected_gain": "unknown", "decision": "DISCARD", "tflops": 3.17, "timestamp": "2026-04-21T17:20:15Z"}
{"round": 804, "iter": "iter804", "bottleneck": "compute_bound", "idea": "iter804_autogrid: BM=256 BN=128 warps=2 stages=4 indexing=block_ptr Ktile=32 ncol=1 layout=lo1", "category": "grid", "expected_gain": "unknown", "decision": "DISCARD", "tflops": 3.26, "timestamp": "2026-04-21T17:20:25Z"}
{"round": 805, "iter": "iter805", "bottleneck": "compute_bound", "idea": "iter805_autogrid: BM=256 BN=128 warps=2 stages=4 indexing=block_ptr Ktile=64 ncol=2 layout=mnk", "category": "grid", "expected_gain": "unknown", "decision": "DISCARD", "tflops": 2.71, "timestamp": "2026-04-21T17:20:36Z"}
{"round": 806, "iter": "iter806", "bottleneck": "compute_bound", "idea": "iter806_autogrid: BM=256 BN=128 warps=2 stages=4 indexing=block_ptr Ktile=64 ncol=2 layout=lo1", "category": "grid", "expected_gain": "unknown", "decision": "DISCARD", "tflops": 2.72, "timestamp": "2026-04-21T17:20:47Z"}
{"round": 807, "iter": "iter807", "bottleneck": "compute_bound", "idea": "iter807_autogrid: BM=256 BN=128 warps=2 stages=4 indexing=block_ptr Ktile=128 ncol=4 layout=mnk", "category": "grid", "expected_gain": "unknown", "decision": "DISCARD", "tflops": 1.58, "timestamp": "2026-04-21T17:21:02Z"}
{"round": 808, "iter": "iter808", "bottleneck": "compute_bound", "idea": "iter808_autogrid: BM=256 BN=128 warps=2 stages=4 indexing=block_ptr Ktile=128 ncol=4 layout=lo1", "category": "grid", "expected_gain": "unknown", "decision": "DISCARD", "tflops": 1.62, "timestamp": "2026-04-21T17:21:17Z"}
{"round": 809, "iter": "iter809", "bottleneck": "compute_bound", "idea": "iter809_autogrid: BM=256 BN=128 warps=2 stages=5 indexing=pointer Ktile=32 ncol=1 layout=mnk", "category": "grid", "expected_gain": "unknown", "decision": "DISCARD", "tflops": 2.68, "timestamp": "2026-04-21T17:21:28Z"}
{"round": 810, "iter": "iter810", "bottleneck": "compute_bound", "idea": "iter810_autogrid: BM=256 BN=128 warps=2 stages=5 indexing=pointer Ktile=32 ncol=1 layout=lo1", "category": "grid", "expected_gain": "unknown", "decision": "DISCARD", "tflops": 2.74, "timestamp": "2026-04-21T17:21:39Z"}
{"round": 811, "iter": "iter811", "bottleneck": "compute_bound", "idea": "iter811_autogrid: BM=256 BN=128 warps=2 stages=5 indexing=pointer Ktile=64 ncol=2 layout=mnk", "category": "grid", "expected_gain": "unknown", "decision": "DISCARD", "tflops": 2.64, "timestamp": "2026-04-21T17:21:50Z"}
{"round": 812, "iter": "iter812", "bottleneck": "compute_bound", "idea": "iter812_autogrid: BM=256 BN=128 warps=2 stages=5 indexing=pointer Ktile=64 ncol=2 layout=lo1", "category": "grid", "expected_gain": "unknown", "decision": "DISCARD", "tflops": 2.63, "timestamp": "2026-04-21T17:22:02Z"}
{"round": 813, "iter": "iter813", "bottleneck": "compute_bound", "idea": "iter813_autogrid: BM=256 BN=128 warps=2 stages=5 indexing=pointer Ktile=128 ncol=4 layout=mnk", "category": "grid", "expected_gain": "unknown", "decision": "DISCARD", "tflops": 1.58, "timestamp": "2026-04-21T17:22:17Z"}
{"round": 814, "iter": "iter814", "bottleneck": "compute_bound", "idea": "iter814_autogrid: BM=256 BN=128 warps=2 stages=5 indexing=pointer Ktile=128 ncol=4 layout=lo1", "category": "grid", "expected_gain": "unknown", "decision": "DISCARD", "tflops": 1.63, "timestamp": "2026-04-21T17:22:32Z"}
{"round": 815, "iter": "iter815", "bottleneck": "compute_bound", "idea": "iter815_autogrid: BM=256 BN=128 warps=2 stages=5 indexing=block_ptr Ktile=32 ncol=1 layout=mnk", "category": "grid", "expected_gain": "unknown", "decision": "DISCARD", "tflops": 2.87, "timestamp": "2026-04-21T17:22:42Z"}
{"round": 816, "iter": "iter816", "bottleneck": "compute_bound", "idea": "iter816_autogrid: BM=256 BN=128 warps=2 stages=5 indexing=block_ptr Ktile=32 ncol=1 layout=lo1", "category": "grid", "expected_gain": "unknown", "decision": "DISCARD", "tflops": 2.97, "timestamp": "2026-04-21T17:22:53Z"}
{"round": 817, "iter": "iter817", "bottleneck": "compute_bound", "idea": "iter817_autogrid: BM=256 BN=128 warps=2 stages=5 indexing=block_ptr Ktile=64 ncol=2 layout=mnk", "category": "grid", "expected_gain": "unknown", "decision": "DISCARD", "tflops": 2.56, "timestamp": "2026-04-21T17:23:04Z"}
{"round": 818, "iter": "iter818", "bottleneck": "compute_bound", "idea": "iter818_autogrid: BM=256 BN=128 warps=2 stages=5 indexing=block_ptr Ktile=64 ncol=2 layout=lo1", "category": "grid", "expected_gain": "unknown", "decision": "DISCARD", "tflops": 2.54, "timestamp": "2026-04-21T17:23:16Z"}
{"round": 819, "iter": "iter819", "bottleneck": "compute_bound", "idea": "iter819_autogrid: BM=256 BN=128 warps=2 stages=5 indexing=block_ptr Ktile=128 ncol=4 layout=mnk", "category": "grid", "expected_gain": "unknown", "decision": "DISCARD", "tflops": 1.58, "timestamp": "2026-04-21T17:23:31Z"}
{"round": 820, "iter": "iter820", "bottleneck": "compute_bound", "idea": "iter820_autogrid: BM=256 BN=128 warps=2 stages=5 indexing=block_ptr Ktile=128 ncol=4 layout=lo1", "category": "grid", "expected_gain": "unknown", "decision": "DISCARD", "tflops": 1.62, "timestamp": "2026-04-21T17:23:47Z"}
{"round": 821, "iter": "iter821", "bottleneck": "compute_bound", "idea": "iter821_autogrid: BM=256 BN=128 warps=2 stages=6 indexing=pointer Ktile=32 ncol=1 layout=mnk", "category": "grid", "expected_gain": "unknown", "decision": "DISCARD", "tflops": 2.56, "timestamp": "2026-04-21T17:23:58Z"}
{"round": 822, "iter": "iter822", "bottleneck": "compute_bound", "idea": "iter822_autogrid: BM=256 BN=128 warps=2 stages=6 indexing=pointer Ktile=32 ncol=1 layout=lo1", "category": "grid", "expected_gain": "unknown", "decision": "DISCARD", "tflops": 2.64, "timestamp": "2026-04-21T17:24:10Z"}
{"round": 823, "iter": "iter823", "bottleneck": "compute_bound", "idea": "iter823_autogrid: BM=256 BN=128 warps=2 stages=6 indexing=pointer Ktile=64 ncol=2 layout=mnk", "category": "grid", "expected_gain": "unknown", "decision": "DISCARD", "tflops": 1.83, "timestamp": "2026-04-21T17:24:24Z"}
{"round": 824, "iter": "iter824", "bottleneck": "compute_bound", "idea": "iter824_autogrid: BM=256 BN=128 warps=2 stages=6 indexing=pointer Ktile=64 ncol=2 layout=lo1", "category": "grid", "expected_gain": "unknown", "decision": "DISCARD", "tflops": 1.86, "timestamp": "2026-04-21T17:24:38Z"}
{"round": 825, "iter": "iter825", "bottleneck": "compile", "idea": "iter825_autogrid: BM=256 BN=128 warps=2 stages=6 indexing=pointer Ktile=128 ncol=4 layout=mnk", "category": "grid", "expected_gain": "unknown", "decision": "COMPILE_FAIL", "tflops": 0.0, "timestamp": "2026-04-21T17:24:43Z"}
{"round": 826, "iter": "iter826", "bottleneck": "compile", "idea": "iter826_autogrid: BM=256 BN=128 warps=2 stages=6 indexing=pointer Ktile=128 ncol=4 layout=lo1", "category": "grid", "expected_gain": "unknown", "decision": "COMPILE_FAIL", "tflops": 0.0, "timestamp": "2026-04-21T17:24:48Z"}
{"round": 827, "iter": "iter827", "bottleneck": "compute_bound", "idea": "iter827_autogrid: BM=256 BN=128 warps=2 stages=6 indexing=block_ptr Ktile=32 ncol=1 layout=mnk", "category": "grid", "expected_gain": "unknown", "decision": "DISCARD", "tflops": 2.76, "timestamp": "2026-04-21T17:25:00Z"}
{"round": 828, "iter": "iter828", "bottleneck": "compute_bound", "idea": "iter828_autogrid: BM=256 BN=128 warps=2 stages=6 indexing=block_ptr Ktile=32 ncol=1 layout=lo1", "category": "grid", "expected_gain": "unknown", "decision": "DISCARD", "tflops": 2.86, "timestamp": "2026-04-21T17:25:11Z"}
{"round": 829, "iter": "iter829", "bottleneck": "compute_bound", "idea": "iter829_autogrid: BM=256 BN=128 warps=2 stages=6 indexing=block_ptr Ktile=64 ncol=2 layout=mnk", "category": "grid", "expected_gain": "unknown", "decision": "DISCARD", "tflops": 1.79, "timestamp": "2026-04-21T17:25:25Z"}
