{"round": 738, "iter": "iter738", "bottleneck": "compute_bound", "idea": "iter738_autogrid: BM=128 BN=64 warps=8 stages=3 indexing=pointer Ktile=32 ncol=1 layout=lo1", "category": "grid", "expected_gain": "unknown", "decision": "DISCARD", "tflops": 33.18, "timestamp": "2026-04-21T14:01:28Z"}
{"round": 739, "iter": "iter739", "bottleneck": "compute_bound", "idea": "iter739_autogrid: BM=128 BN=64 warps=8 stages=3 indexing=pointer Ktile=64 ncol=2 layout=mnk", "category": "grid", "expected_gain": "unknown", "decision": "DISCARD", "tflops": 45.21, "timestamp": "2026-04-21T14:01:34Z"}
{"round": 740, "iter": "iter740", "bottleneck": "compute_bound", "idea": "iter740_autogrid: BM=128 BN=64 warps=8 stages=3 indexing=pointer Ktile=64 ncol=2 layout=lo1", "category": "grid", "expected_gain": "unknown", "decision": "DISCARD", "tflops": 45.71, "timestamp": "2026-04-21T14:01:40Z"}
{"round": 741, "iter": "iter741", "bottleneck": "compute_bound", "idea": "iter741_autogrid: BM=128 BN=64 warps=8 stages=3 indexing=pointer Ktile=128 ncol=4 layout=mnk", "category": "grid", "expected_gain": "unknown", "decision": "DISCARD", "tflops": 37.49, "timestamp": "2026-04-21T14:01:47Z"}
{"round": 742, "iter": "iter742", "bottleneck": "compute_bound", "idea": "iter742_autogrid: BM=128 BN=64 warps=8 stages=3 indexing=pointer Ktile=128 ncol=4 layout=lo1", "category": "grid", "expected_gain": "unknown", "decision": "DISCARD", "tflops": 37.93, "timestamp": "2026-04-21T14:01:53Z"}
{"round": 743, "iter": "iter743", "bottleneck": "compute_bound", "idea": "iter743_autogrid: BM=128 BN=64 warps=8 stages=3 indexing=block_ptr Ktile=32 ncol=1 layout=mnk", "category": "grid", "expected_gain": "unknown", "decision": "DISCARD", "tflops": 33.13, "timestamp": "2026-04-21T14:01:59Z"}
{"round": 744, "iter": "iter744", "bottleneck": "compute_bound", "idea": "iter744_autogrid: BM=128 BN=64 warps=8 stages=3 indexing=block_ptr Ktile=32 ncol=1 layout=lo1", "category": "grid", "expected_gain": "unknown", "decision": "DISCARD", "tflops": 33.97, "timestamp": "2026-04-21T14:02:05Z"}
{"round": 745, "iter": "iter745", "bottleneck": "compute_bound", "idea": "iter745_autogrid: BM=128 BN=64 warps=8 stages=3 indexing=block_ptr Ktile=64 ncol=2 layout=mnk", "category": "grid", "expected_gain": "unknown", "decision": "DISCARD", "tflops": 45.17, "timestamp": "2026-04-21T14:02:11Z"}
{"round": 746, "iter": "iter746", "bottleneck": "compute_bound", "idea": "iter746_autogrid: BM=128 BN=64 warps=8 stages=3 indexing=block_ptr Ktile=64 ncol=2 layout=lo1", "category": "grid", "expected_gain": "unknown", "decision": "DISCARD", "tflops": 43.07, "timestamp": "2026-04-21T14:02:17Z"}
{"round": 747, "iter": "iter747", "bottleneck": "compute_bound", "idea": "iter747_autogrid: BM=128 BN=64 warps=8 stages=3 indexing=block_ptr Ktile=128 ncol=4 layout=mnk", "category": "grid", "expected_gain": "unknown", "decision": "DISCARD", "tflops": 37.93, "timestamp": "2026-04-21T14:02:23Z"}
{"round": 748, "iter": "iter748", "bottleneck": "compute_bound", "idea": "iter748_autogrid: BM=128 BN=64 warps=8 stages=3 indexing=block_ptr Ktile=128 ncol=4 layout=lo1", "category": "grid", "expected_gain": "unknown", "decision": "DISCARD", "tflops": 40.06, "timestamp": "2026-04-21T14:02:29Z"}
{"round": 749, "iter": "iter749", "bottleneck": "compute_bound", "idea": "iter749_autogrid: BM=128 BN=64 warps=8 stages=4 indexing=pointer Ktile=32 ncol=1 layout=mnk", "category": "grid", "expected_gain": "unknown", "decision": "DISCARD", "tflops": 33.51, "timestamp": "2026-04-21T14:02:35Z"}
{"round": 750, "iter": "iter750", "bottleneck": "compute_bound", "idea": "iter750_autogrid: BM=128 BN=64 warps=8 stages=4 indexing=pointer Ktile=32 ncol=1 layout=lo1", "category": "grid", "expected_gain": "unknown", "decision": "DISCARD", "tflops": 33.15, "timestamp": "2026-04-21T14:02:41Z"}
{"round": 751, "iter": "iter751", "bottleneck": "compute_bound", "idea": "iter751_autogrid: BM=128 BN=64 warps=8 stages=4 indexing=pointer Ktile=64 ncol=2 layout=mnk", "category": "grid", "expected_gain": "unknown", "decision": "DISCARD", "tflops": 45.17, "timestamp": "2026-04-21T14:02:47Z"}
{"round": 752, "iter": "iter752", "bottleneck": "compute_bound", "idea": "iter752_autogrid: BM=128 BN=64 warps=8 stages=4 indexing=pointer Ktile=64 ncol=2 layout=lo1", "category": "grid", "expected_gain": "unknown", "decision": "DISCARD", "tflops": 45.2, "timestamp": "2026-04-21T14:02:53Z"}
{"round": 753, "iter": "iter753", "bottleneck": "compute_bound", "idea": "iter753_autogrid: BM=128 BN=64 warps=8 stages=4 indexing=pointer Ktile=128 ncol=4 layout=mnk", "category": "grid", "expected_gain": "unknown", "decision": "DISCARD", "tflops": 37.09, "timestamp": "2026-04-21T14:03:00Z"}
{"round": 754, "iter": "iter754", "bottleneck": "compute_bound", "idea": "iter754_autogrid: BM=128 BN=64 warps=8 stages=4 indexing=pointer Ktile=128 ncol=4 layout=lo1", "category": "grid", "expected_gain": "unknown", "decision": "DISCARD", "tflops": 37.45, "timestamp": "2026-04-21T14:03:06Z"}
{"round": 755, "iter": "iter755", "bottleneck": "compute_bound", "idea": "iter755_autogrid: BM=128 BN=64 warps=8 stages=4 indexing=block_ptr Ktile=32 ncol=1 layout=mnk", "category": "grid", "expected_gain": "unknown", "decision": "DISCARD", "tflops": 33.07, "timestamp": "2026-04-21T14:03:12Z"}
{"round": 756, "iter": "iter756", "bottleneck": "compute_bound", "idea": "iter756_autogrid: BM=128 BN=64 warps=8 stages=4 indexing=block_ptr Ktile=32 ncol=1 layout=lo1", "category": "grid", "expected_gain": "unknown", "decision": "DISCARD", "tflops": 34.24, "timestamp": "2026-04-21T14:03:18Z"}
{"round": 757, "iter": "iter757", "bottleneck": "compute_bound", "idea": "iter757_autogrid: BM=128 BN=64 warps=8 stages=4 indexing=block_ptr Ktile=64 ncol=2 layout=mnk", "category": "grid", "expected_gain": "unknown", "decision": "DISCARD", "tflops": 45.12, "timestamp": "2026-04-21T14:03:24Z"}
{"round": 758, "iter": "iter758", "bottleneck": "compute_bound", "idea": "iter758_autogrid: BM=128 BN=64 warps=8 stages=4 indexing=block_ptr Ktile=64 ncol=2 layout=lo1", "category": "grid", "expected_gain": "unknown", "decision": "DISCARD", "tflops": 42.9, "timestamp": "2026-04-21T14:03:29Z"}
{"round": 759, "iter": "iter759", "bottleneck": "compute_bound", "idea": "iter759_autogrid: BM=128 BN=64 warps=8 stages=4 indexing=block_ptr Ktile=128 ncol=4 layout=mnk", "category": "grid", "expected_gain": "unknown", "decision": "DISCARD", "tflops": 37.94, "timestamp": "2026-04-21T14:03:35Z"}
{"round": 760, "iter": "iter760", "bottleneck": "compute_bound", "idea": "iter760_autogrid: BM=128 BN=64 warps=8 stages=4 indexing=block_ptr Ktile=128 ncol=4 layout=lo1", "category": "grid", "expected_gain": "unknown", "decision": "DISCARD", "tflops": 40.06, "timestamp": "2026-04-21T14:03:41Z"}
{"round": 761, "iter": "iter761", "bottleneck": "compute_bound", "idea": "iter761_autogrid: BM=128 BN=64 warps=8 stages=5 indexing=pointer Ktile=32 ncol=1 layout=mnk", "category": "grid", "expected_gain": "unknown", "decision": "DISCARD", "tflops": 33.54, "timestamp": "2026-04-21T14:03:47Z"}
{"round": 762, "iter": "iter762", "bottleneck": "compute_bound", "idea": "iter762_autogrid: BM=128 BN=64 warps=8 stages=5 indexing=pointer Ktile=32 ncol=1 layout=lo1", "category": "grid", "expected_gain": "unknown", "decision": "DISCARD", "tflops": 33.17, "timestamp": "2026-04-21T14:03:53Z"}
{"round": 763, "iter": "iter763", "bottleneck": "compute_bound", "idea": "iter763_autogrid: BM=128 BN=64 warps=8 stages=5 indexing=pointer Ktile=64 ncol=2 layout=mnk", "category": "grid", "expected_gain": "unknown", "decision": "DISCARD", "tflops": 45.01, "timestamp": "2026-04-21T14:03:59Z"}
{"round": 764, "iter": "iter764", "bottleneck": "compute_bound", "idea": "iter764_autogrid: BM=128 BN=64 warps=8 stages=5 indexing=pointer Ktile=64 ncol=2 layout=lo1", "category": "grid", "expected_gain": "unknown", "decision": "DISCARD", "tflops": 47.2, "timestamp": "2026-04-21T14:04:04Z"}
{"round": 765, "iter": "iter765", "bottleneck": "compute_bound", "idea": "iter765_autogrid: BM=128 BN=64 warps=8 stages=5 indexing=pointer Ktile=128 ncol=4 layout=mnk", "category": "grid", "expected_gain": "unknown", "decision": "DISCARD", "tflops": 37.03, "timestamp": "2026-04-21T14:04:11Z"}
{"round": 766, "iter": "iter766", "bottleneck": "compute_bound", "idea": "iter766_autogrid: BM=128 BN=64 warps=8 stages=5 indexing=pointer Ktile=128 ncol=4 layout=lo1", "category": "grid", "expected_gain": "unknown", "decision": "DISCARD", "tflops": 37.41, "timestamp": "2026-04-21T14:04:17Z"}
{"round": 767, "iter": "iter767", "bottleneck": "compute_bound", "idea": "iter767_autogrid: BM=128 BN=64 warps=8 stages=5 indexing=block_ptr Ktile=32 ncol=1 layout=mnk", "category": "grid", "expected_gain": "unknown", "decision": "DISCARD", "tflops": 33.12, "timestamp": "2026-04-21T14:04:23Z"}
{"round": 768, "iter": "iter768", "bottleneck": "compute_bound", "idea": "iter768_autogrid: BM=128 BN=64 warps=8 stages=5 indexing=block_ptr Ktile=32 ncol=1 layout=lo1", "category": "grid", "expected_gain": "unknown", "decision": "DISCARD", "tflops": 33.88, "timestamp": "2026-04-21T14:04:29Z"}
{"round": 769, "iter": "iter769", "bottleneck": "compute_bound", "idea": "iter769_autogrid: BM=128 BN=64 warps=8 stages=5 indexing=block_ptr Ktile=64 ncol=2 layout=mnk", "category": "grid", "expected_gain": "unknown", "decision": "DISCARD", "tflops": 45.08, "timestamp": "2026-04-21T14:04:35Z"}
{"round": 770, "iter": "iter770", "bottleneck": "compute_bound", "idea": "iter770_autogrid: BM=128 BN=64 warps=8 stages=5 indexing=block_ptr Ktile=64 ncol=2 layout=lo1", "category": "grid", "expected_gain": "unknown", "decision": "DISCARD", "tflops": 41.22, "timestamp": "2026-04-21T14:04:41Z"}
{"round": 771, "iter": "iter771", "bottleneck": "compute_bound", "idea": "iter771_autogrid: BM=128 BN=64 warps=8 stages=5 indexing=block_ptr Ktile=128 ncol=4 layout=mnk", "category": "grid", "expected_gain": "unknown", "decision": "DISCARD", "tflops": 37.89, "timestamp": "2026-04-21T14:04:47Z"}
{"round": 772, "iter": "iter772", "bottleneck": "compute_bound", "idea": "iter772_autogrid: BM=128 BN=64 warps=8 stages=5 indexing=block_ptr Ktile=128 ncol=4 layout=lo1", "category": "grid", "expected_gain": "unknown", "decision": "DISCARD", "tflops": 40.05, "timestamp": "2026-04-21T14:04:53Z"}
{"round": 773, "iter": "iter773", "bottleneck": "compute_bound", "idea": "iter773_autogrid: BM=128 BN=64 warps=8 stages=6 indexing=pointer Ktile=32 ncol=1 layout=mnk", "category": "grid", "expected_gain": "unknown", "decision": "DISCARD", "tflops": 33.43, "timestamp": "2026-04-21T14:04:59Z"}
{"round": 774, "iter": "iter774", "bottleneck": "compute_bound", "idea": "iter774_autogrid: BM=128 BN=64 warps=8 stages=6 indexing=pointer Ktile=32 ncol=1 layout=lo1", "category": "grid", "expected_gain": "unknown", "decision": "DISCARD", "tflops": 33.12, "timestamp": "2026-04-21T14:05:05Z"}
{"round": 775, "iter": "iter775", "bottleneck": "compute_bound", "idea": "iter775_autogrid: BM=128 BN=64 warps=8 stages=6 indexing=pointer Ktile=64 ncol=2 layout=mnk", "category": "grid", "expected_gain": "unknown", "decision": "DISCARD", "tflops": 44.93, "timestamp": "2026-04-21T14:05:10Z"}
{"round": 776, "iter": "iter776", "bottleneck": "compute_bound", "idea": "iter776_autogrid: BM=128 BN=64 warps=8 stages=6 indexing=pointer Ktile=64 ncol=2 layout=lo1", "category": "grid", "expected_gain": "unknown", "decision": "DISCARD", "tflops": 47.23, "timestamp": "2026-04-21T14:05:16Z"}
{"round": 777, "iter": "iter777", "bottleneck": "compute_bound", "idea": "iter777_autogrid: BM=128 BN=64 warps=8 stages=6 indexing=pointer Ktile=128 ncol=4 layout=mnk", "category": "grid", "expected_gain": "unknown", "decision": "DISCARD", "tflops": 36.96, "timestamp": "2026-04-21T14:05:22Z"}
{"round": 778, "iter": "iter778", "bottleneck": "compute_bound", "idea": "iter778_autogrid: BM=128 BN=64 warps=8 stages=6 indexing=pointer Ktile=128 ncol=4 layout=lo1", "category": "grid", "expected_gain": "unknown", "decision": "DISCARD", "tflops": 37.41, "timestamp": "2026-04-21T14:05:28Z"}
{"round": 779, "iter": "iter779", "bottleneck": "compute_bound", "idea": "iter779_autogrid: BM=128 BN=64 warps=8 stages=6 indexing=block_ptr Ktile=32 ncol=1 layout=mnk", "category": "grid", "expected_gain": "unknown", "decision": "DISCARD", "tflops": 32.78, "timestamp": "2026-04-21T14:05:35Z"}
{"round": 780, "iter": "iter780", "bottleneck": "compute_bound", "idea": "iter780_autogrid: BM=128 BN=64 warps=8 stages=6 indexing=block_ptr Ktile=32 ncol=1 layout=lo1", "category": "grid", "expected_gain": "unknown", "decision": "DISCARD", "tflops": 33.86, "timestamp": "2026-04-21T14:05:41Z"}
{"round": 781, "iter": "iter781", "bottleneck": "compute_bound", "idea": "iter781_autogrid: BM=128 BN=64 warps=8 stages=6 indexing=block_ptr Ktile=64 ncol=2 layout=mnk", "category": "grid", "expected_gain": "unknown", "decision": "DISCARD", "tflops": 45.86, "timestamp": "2026-04-21T14:05:47Z"}
{"round": 782, "iter": "iter782", "bottleneck": "compute_bound", "idea": "iter782_autogrid: BM=128 BN=64 warps=8 stages=6 indexing=block_ptr Ktile=64 ncol=2 layout=lo1", "category": "grid", "expected_gain": "unknown", "decision": "DISCARD", "tflops": 41.15, "timestamp": "2026-04-21T14:05:53Z"}
{"round": 783, "iter": "iter783", "bottleneck": "compute_bound", "idea": "iter783_autogrid: BM=128 BN=64 warps=8 stages=6 indexing=block_ptr Ktile=128 ncol=4 layout=mnk", "category": "grid", "expected_gain": "unknown", "decision": "DISCARD", "tflops": 37.48, "timestamp": "2026-04-21T14:05:59Z"}
{"round": 784, "iter": "iter784", "bottleneck": "compute_bound", "idea": "iter784_autogrid: BM=128 BN=64 warps=8 stages=6 indexing=block_ptr Ktile=128 ncol=4 layout=lo1", "category": "grid", "expected_gain": "unknown", "decision": "DISCARD", "tflops": 40.02, "timestamp": "2026-04-21T14:06:05Z"}
{"round": 785, "iter": "iter785", "bottleneck": "compute_bound", "idea": "iter785_autogrid: BM=256 BN=128 warps=2 stages=3 indexing=pointer Ktile=32 ncol=1 layout=mnk", "category": "grid", "expected_gain": "unknown", "decision": "DISCARD", "tflops": 1.35, "timestamp": "2026-04-21T14:06:26Z"}
{"round": 786, "iter": "iter786", "bottleneck": "compute_bound", "idea": "iter786_autogrid: BM=256 BN=128 warps=2 stages=3 indexing=pointer Ktile=32 ncol=1 layout=lo1", "category": "grid", "expected_gain": "unknown", "decision": "DISCARD", "tflops": 1.35, "timestamp": "2026-04-21T14:06:46Z"}
{"round": 787, "iter": "iter787", "bottleneck": "compute_bound", "idea": "iter787_autogrid: BM=256 BN=128 warps=2 stages=3 indexing=pointer Ktile=64 ncol=2 layout=mnk", "category": "grid", "expected_gain": "unknown", "decision": "DISCARD", "tflops": 1.27, "timestamp": "2026-04-21T14:07:09Z"}
{"round": 788, "iter": "iter788", "bottleneck": "compute_bound", "idea": "iter788_autogrid: BM=256 BN=128 warps=2 stages=3 indexing=pointer Ktile=64 ncol=2 layout=lo1", "category": "grid", "expected_gain": "unknown", "decision": "DISCARD", "tflops": 1.27, "timestamp": "2026-04-21T14:07:33Z"}
{"round": 789, "iter": "iter789", "bottleneck": "compute_bound", "idea": "iter789_autogrid: BM=256 BN=128 warps=2 stages=3 indexing=pointer Ktile=128 ncol=4 layout=mnk", "category": "grid", "expected_gain": "unknown", "decision": "DISCARD", "tflops": 1.0, "timestamp": "2026-04-21T14:08:06Z"}
{"round": 790, "iter": "iter790", "bottleneck": "compute_bound", "idea": "iter790_autogrid: BM=256 BN=128 warps=2 stages=3 indexing=pointer Ktile=128 ncol=4 layout=lo1", "category": "grid", "expected_gain": "unknown", "decision": "DISCARD", "tflops": 1.03, "timestamp": "2026-04-21T14:08:39Z"}
{"round": 791, "iter": "iter791", "bottleneck": "compute_bound", "idea": "iter791_autogrid: BM=256 BN=128 warps=2 stages=3 indexing=block_ptr Ktile=32 ncol=1 layout=mnk", "category": "grid", "expected_gain": "unknown", "decision": "DISCARD", "tflops": 1.42, "timestamp": "2026-04-21T14:08:59Z"}
{"round": 792, "iter": "iter792", "bottleneck": "compute_bound", "idea": "iter792_autogrid: BM=256 BN=128 warps=2 stages=3 indexing=block_ptr Ktile=32 ncol=1 layout=lo1", "category": "grid", "expected_gain": "unknown", "decision": "DISCARD", "tflops": 1.45, "timestamp": "2026-04-21T14:09:19Z"}
{"round": 793, "iter": "iter793", "bottleneck": "compute_bound", "idea": "iter793_autogrid: BM=256 BN=128 warps=2 stages=3 indexing=block_ptr Ktile=64 ncol=2 layout=mnk", "category": "grid", "expected_gain": "unknown", "decision": "DISCARD", "tflops": 1.23, "timestamp": "2026-04-21T14:09:43Z"}
{"round": 794, "iter": "iter794", "bottleneck": "compute_bound", "idea": "iter794_autogrid: BM=256 BN=128 warps=2 stages=3 indexing=block_ptr Ktile=64 ncol=2 layout=lo1", "category": "grid", "expected_gain": "unknown", "decision": "DISCARD", "tflops": 1.23, "timestamp": "2026-04-21T14:10:07Z"}
{"round": 795, "iter": "iter795", "bottleneck": "compute_bound", "idea": "iter795_autogrid: BM=256 BN=128 warps=2 stages=3 indexing=block_ptr Ktile=128 ncol=4 layout=mnk", "category": "grid", "expected_gain": "unknown", "decision": "DISCARD", "tflops": 1.01, "timestamp": "2026-04-21T14:10:40Z"}
{"round": 796, "iter": "iter796", "bottleneck": "compute_bound", "idea": "iter796_autogrid: BM=256 BN=128 warps=2 stages=3 indexing=block_ptr Ktile=128 ncol=4 layout=lo1", "category": "grid", "expected_gain": "unknown", "decision": "DISCARD", "tflops": 1.02, "timestamp": "2026-04-21T14:11:14Z"}
{"round": 797, "iter": "iter797", "bottleneck": "compute_bound", "idea": "iter797_autogrid: BM=256 BN=128 warps=2 stages=4 indexing=pointer Ktile=32 ncol=1 layout=mnk", "category": "grid", "expected_gain": "unknown", "decision": "DISCARD", "tflops": 1.33, "timestamp": "2026-04-21T14:11:34Z"}
{"round": 798, "iter": "iter798", "bottleneck": "compute_bound", "idea": "iter798_autogrid: BM=256 BN=128 warps=2 stages=4 indexing=pointer Ktile=32 ncol=1 layout=lo1", "category": "grid", "expected_gain": "unknown", "decision": "DISCARD", "tflops": 1.32, "timestamp": "2026-04-21T14:11:55Z"}
{"round": 799, "iter": "iter799", "bottleneck": "compute_bound", "idea": "iter799_autogrid: BM=256 BN=128 warps=2 stages=4 indexing=pointer Ktile=64 ncol=2 layout=mnk", "category": "grid", "expected_gain": "unknown", "decision": "DISCARD", "tflops": 1.25, "timestamp": "2026-04-21T14:12:19Z"}
{"round": 800, "iter": "iter800", "bottleneck": "compute_bound", "idea": "iter800_autogrid: BM=256 BN=128 warps=2 stages=4 indexing=pointer Ktile=64 ncol=2 layout=lo1", "category": "grid", "expected_gain": "unknown", "decision": "DISCARD", "tflops": 1.25, "timestamp": "2026-04-21T14:12:43Z"}
{"round": 801, "iter": "iter801", "bottleneck": "compute_bound", "idea": "iter801_autogrid: BM=256 BN=128 warps=2 stages=4 indexing=pointer Ktile=128 ncol=4 layout=mnk", "category": "grid", "expected_gain": "unknown", "decision": "DISCARD", "tflops": 0.69, "timestamp": "2026-04-21T14:13:24Z"}
{"round": 802, "iter": "iter802", "bottleneck": "compute_bound", "idea": "iter802_autogrid: BM=256 BN=128 warps=2 stages=4 indexing=pointer Ktile=128 ncol=4 layout=lo1", "category": "grid", "expected_gain": "unknown", "decision": "DISCARD", "tflops": 0.71, "timestamp": "2026-04-21T14:14:04Z"}
{"round": 803, "iter": "iter803", "bottleneck": "compute_bound", "idea": "iter803_autogrid: BM=256 BN=128 warps=2 stages=4 indexing=block_ptr Ktile=32 ncol=1 layout=mnk", "category": "grid", "expected_gain": "unknown", "decision": "DISCARD", "tflops": 1.42, "timestamp": "2026-04-21T14:14:24Z"}
{"round": 804, "iter": "iter804", "bottleneck": "compute_bound", "idea": "iter804_autogrid: BM=256 BN=128 warps=2 stages=4 indexing=block_ptr Ktile=32 ncol=1 layout=lo1", "category": "grid", "expected_gain": "unknown", "decision": "DISCARD", "tflops": 1.46, "timestamp": "2026-04-21T14:14:43Z"}
{"round": 805, "iter": "iter805", "bottleneck": "compute_bound", "idea": "iter805_autogrid: BM=256 BN=128 warps=2 stages=4 indexing=block_ptr Ktile=64 ncol=2 layout=mnk", "category": "grid", "expected_gain": "unknown", "decision": "DISCARD", "tflops": 1.21, "timestamp": "2026-04-21T14:15:07Z"}
{"round": 806, "iter": "iter806", "bottleneck": "compute_bound", "idea": "iter806_autogrid: BM=256 BN=128 warps=2 stages=4 indexing=block_ptr Ktile=64 ncol=2 layout=lo1", "category": "grid", "expected_gain": "unknown", "decision": "DISCARD", "tflops": 1.21, "timestamp": "2026-04-21T14:15:32Z"}
{"round": 807, "iter": "iter807", "bottleneck": "compute_bound", "idea": "iter807_autogrid: BM=256 BN=128 warps=2 stages=4 indexing=block_ptr Ktile=128 ncol=4 layout=mnk", "category": "grid", "expected_gain": "unknown", "decision": "DISCARD", "tflops": 0.69, "timestamp": "2026-04-21T14:16:13Z"}
{"round": 808, "iter": "iter808", "bottleneck": "compute_bound", "idea": "iter808_autogrid: BM=256 BN=128 warps=2 stages=4 indexing=block_ptr Ktile=128 ncol=4 layout=lo1", "category": "grid", "expected_gain": "unknown", "decision": "DISCARD", "tflops": 0.71, "timestamp": "2026-04-21T14:16:55Z"}
{"round": 809, "iter": "iter809", "bottleneck": "compute_bound", "idea": "iter809_autogrid: BM=256 BN=128 warps=2 stages=5 indexing=pointer Ktile=32 ncol=1 layout=mnk", "category": "grid", "expected_gain": "unknown", "decision": "DISCARD", "tflops": 1.21, "timestamp": "2026-04-21T14:17:16Z"}
{"round": 810, "iter": "iter810", "bottleneck": "compute_bound", "idea": "iter810_autogrid: BM=256 BN=128 warps=2 stages=5 indexing=pointer Ktile=32 ncol=1 layout=lo1", "category": "grid", "expected_gain": "unknown", "decision": "DISCARD", "tflops": 1.23, "timestamp": "2026-04-21T14:17:38Z"}
{"round": 811, "iter": "iter811", "bottleneck": "compute_bound", "idea": "iter811_autogrid: BM=256 BN=128 warps=2 stages=5 indexing=pointer Ktile=64 ncol=2 layout=mnk", "category": "grid", "expected_gain": "unknown", "decision": "DISCARD", "tflops": 1.15, "timestamp": "2026-04-21T14:18:03Z"}
