{"round": 663, "iter": "iter663", "bottleneck": "compile", "idea": "iter663_autogrid: BM=96 BN=96 warps=4 stages=4 indexing=pointer Ktile=64 ncol=2 layout=lo1", "category": "grid", "expected_gain": "unknown", "decision": "COMPILE_FAIL", "tflops": 0.0, "timestamp": "2026-04-21T13:53:12Z"}
{"round": 664, "iter": "iter664", "bottleneck": "compile", "idea": "iter664_autogrid: BM=96 BN=96 warps=4 stages=4 indexing=pointer Ktile=64 ncol=2 layout=kmn", "category": "grid", "expected_gain": "unknown", "decision": "COMPILE_FAIL", "tflops": 0.0, "timestamp": "2026-04-21T13:53:16Z"}
{"round": 665, "iter": "iter665", "bottleneck": "compile", "idea": "iter665_autogrid: BM=96 BN=96 warps=4 stages=4 indexing=pointer Ktile=128 ncol=4 layout=mnk", "category": "grid", "expected_gain": "unknown", "decision": "COMPILE_FAIL", "tflops": 0.0, "timestamp": "2026-04-21T13:53:21Z"}
{"round": 666, "iter": "iter666", "bottleneck": "compile", "idea": "iter666_autogrid: BM=96 BN=96 warps=4 stages=4 indexing=pointer Ktile=128 ncol=4 layout=lo1", "category": "grid", "expected_gain": "unknown", "decision": "COMPILE_FAIL", "tflops": 0.0, "timestamp": "2026-04-21T13:53:25Z"}
{"round": 667, "iter": "iter667", "bottleneck": "compile", "idea": "iter667_autogrid: BM=96 BN=96 warps=4 stages=4 indexing=pointer Ktile=128 ncol=4 layout=kmn", "category": "grid", "expected_gain": "unknown", "decision": "COMPILE_FAIL", "tflops": 0.0, "timestamp": "2026-04-21T13:53:29Z"}
{"round": 668, "iter": "iter668", "bottleneck": "compile", "idea": "iter668_autogrid: BM=96 BN=96 warps=4 stages=4 indexing=block_ptr Ktile=32 ncol=1 layout=mnk", "category": "grid", "expected_gain": "unknown", "decision": "COMPILE_FAIL", "tflops": 0.0, "timestamp": "2026-04-21T13:53:34Z"}
{"round": 669, "iter": "iter669", "bottleneck": "compile", "idea": "iter669_autogrid: BM=96 BN=96 warps=4 stages=4 indexing=block_ptr Ktile=32 ncol=1 layout=lo1", "category": "grid", "expected_gain": "unknown", "decision": "COMPILE_FAIL", "tflops": 0.0, "timestamp": "2026-04-21T13:53:39Z"}
{"round": 670, "iter": "iter670", "bottleneck": "compile", "idea": "iter670_autogrid: BM=96 BN=96 warps=4 stages=4 indexing=block_ptr Ktile=32 ncol=1 layout=kmn", "category": "grid", "expected_gain": "unknown", "decision": "COMPILE_FAIL", "tflops": 0.0, "timestamp": "2026-04-21T13:53:43Z"}
{"round": 671, "iter": "iter671", "bottleneck": "compile", "idea": "iter671_autogrid: BM=96 BN=96 warps=4 stages=4 indexing=block_ptr Ktile=64 ncol=2 layout=mnk", "category": "grid", "expected_gain": "unknown", "decision": "COMPILE_FAIL", "tflops": 0.0, "timestamp": "2026-04-21T13:53:48Z"}
{"round": 672, "iter": "iter672", "bottleneck": "compile", "idea": "iter672_autogrid: BM=96 BN=96 warps=4 stages=4 indexing=block_ptr Ktile=64 ncol=2 layout=lo1", "category": "grid", "expected_gain": "unknown", "decision": "COMPILE_FAIL", "tflops": 0.0, "timestamp": "2026-04-21T13:53:52Z"}
{"round": 673, "iter": "iter673", "bottleneck": "compile", "idea": "iter673_autogrid: BM=96 BN=96 warps=4 stages=4 indexing=block_ptr Ktile=64 ncol=2 layout=kmn", "category": "grid", "expected_gain": "unknown", "decision": "COMPILE_FAIL", "tflops": 0.0, "timestamp": "2026-04-21T13:53:56Z"}
{"round": 674, "iter": "iter674", "bottleneck": "compile", "idea": "iter674_autogrid: BM=96 BN=96 warps=4 stages=4 indexing=block_ptr Ktile=128 ncol=4 layout=mnk", "category": "grid", "expected_gain": "unknown", "decision": "COMPILE_FAIL", "tflops": 0.0, "timestamp": "2026-04-21T13:54:01Z"}
{"round": 675, "iter": "iter675", "bottleneck": "compile", "idea": "iter675_autogrid: BM=96 BN=96 warps=4 stages=4 indexing=block_ptr Ktile=128 ncol=4 layout=lo1", "category": "grid", "expected_gain": "unknown", "decision": "COMPILE_FAIL", "tflops": 0.0, "timestamp": "2026-04-21T13:54:05Z"}
{"round": 676, "iter": "iter676", "bottleneck": "compile", "idea": "iter676_autogrid: BM=96 BN=96 warps=4 stages=4 indexing=block_ptr Ktile=128 ncol=4 layout=kmn", "category": "grid", "expected_gain": "unknown", "decision": "COMPILE_FAIL", "tflops": 0.0, "timestamp": "2026-04-21T13:54:09Z"}
{"round": 677, "iter": "iter677", "bottleneck": "compile", "idea": "iter677_autogrid: BM=96 BN=96 warps=4 stages=5 indexing=pointer Ktile=32 ncol=1 layout=mnk", "category": "grid", "expected_gain": "unknown", "decision": "COMPILE_FAIL", "tflops": 0.0, "timestamp": "2026-04-21T13:54:14Z"}
{"round": 678, "iter": "iter678", "bottleneck": "compile", "idea": "iter678_autogrid: BM=96 BN=96 warps=4 stages=5 indexing=pointer Ktile=32 ncol=1 layout=lo1", "category": "grid", "expected_gain": "unknown", "decision": "COMPILE_FAIL", "tflops": 0.0, "timestamp": "2026-04-21T13:54:19Z"}
{"round": 679, "iter": "iter679", "bottleneck": "compile", "idea": "iter679_autogrid: BM=96 BN=96 warps=4 stages=5 indexing=pointer Ktile=32 ncol=1 layout=kmn", "category": "grid", "expected_gain": "unknown", "decision": "COMPILE_FAIL", "tflops": 0.0, "timestamp": "2026-04-21T13:54:23Z"}
{"round": 680, "iter": "iter680", "bottleneck": "compile", "idea": "iter680_autogrid: BM=96 BN=96 warps=4 stages=5 indexing=pointer Ktile=64 ncol=2 layout=mnk", "category": "grid", "expected_gain": "unknown", "decision": "COMPILE_FAIL", "tflops": 0.0, "timestamp": "2026-04-21T13:54:28Z"}
{"round": 681, "iter": "iter681", "bottleneck": "compile", "idea": "iter681_autogrid: BM=96 BN=96 warps=4 stages=5 indexing=pointer Ktile=64 ncol=2 layout=lo1", "category": "grid", "expected_gain": "unknown", "decision": "COMPILE_FAIL", "tflops": 0.0, "timestamp": "2026-04-21T13:54:32Z"}
{"round": 682, "iter": "iter682", "bottleneck": "compile", "idea": "iter682_autogrid: BM=96 BN=96 warps=4 stages=5 indexing=pointer Ktile=64 ncol=2 layout=kmn", "category": "grid", "expected_gain": "unknown", "decision": "COMPILE_FAIL", "tflops": 0.0, "timestamp": "2026-04-21T13:54:37Z"}
{"round": 683, "iter": "iter683", "bottleneck": "compile", "idea": "iter683_autogrid: BM=96 BN=96 warps=4 stages=5 indexing=pointer Ktile=128 ncol=4 layout=mnk", "category": "grid", "expected_gain": "unknown", "decision": "COMPILE_FAIL", "tflops": 0.0, "timestamp": "2026-04-21T13:54:41Z"}
{"round": 684, "iter": "iter684", "bottleneck": "compile", "idea": "iter684_autogrid: BM=96 BN=96 warps=4 stages=5 indexing=pointer Ktile=128 ncol=4 layout=lo1", "category": "grid", "expected_gain": "unknown", "decision": "COMPILE_FAIL", "tflops": 0.0, "timestamp": "2026-04-21T13:54:45Z"}
{"round": 685, "iter": "iter685", "bottleneck": "compile", "idea": "iter685_autogrid: BM=96 BN=96 warps=4 stages=5 indexing=pointer Ktile=128 ncol=4 layout=kmn", "category": "grid", "expected_gain": "unknown", "decision": "COMPILE_FAIL", "tflops": 0.0, "timestamp": "2026-04-21T13:54:50Z"}
{"round": 686, "iter": "iter686", "bottleneck": "compile", "idea": "iter686_autogrid: BM=96 BN=96 warps=4 stages=5 indexing=block_ptr Ktile=32 ncol=1 layout=mnk", "category": "grid", "expected_gain": "unknown", "decision": "COMPILE_FAIL", "tflops": 0.0, "timestamp": "2026-04-21T13:54:54Z"}
{"round": 687, "iter": "iter687", "bottleneck": "compile", "idea": "iter687_autogrid: BM=96 BN=96 warps=4 stages=5 indexing=block_ptr Ktile=32 ncol=1 layout=lo1", "category": "grid", "expected_gain": "unknown", "decision": "COMPILE_FAIL", "tflops": 0.0, "timestamp": "2026-04-21T13:54:58Z"}
{"round": 688, "iter": "iter688", "bottleneck": "compile", "idea": "iter688_autogrid: BM=96 BN=96 warps=4 stages=5 indexing=block_ptr Ktile=32 ncol=1 layout=kmn", "category": "grid", "expected_gain": "unknown", "decision": "COMPILE_FAIL", "tflops": 0.0, "timestamp": "2026-04-21T13:55:02Z"}
{"round": 689, "iter": "iter689", "bottleneck": "compile", "idea": "iter689_autogrid: BM=96 BN=96 warps=4 stages=5 indexing=block_ptr Ktile=64 ncol=2 layout=mnk", "category": "grid", "expected_gain": "unknown", "decision": "COMPILE_FAIL", "tflops": 0.0, "timestamp": "2026-04-21T13:55:07Z"}
{"round": 690, "iter": "iter690", "bottleneck": "compile", "idea": "iter690_autogrid: BM=96 BN=96 warps=4 stages=5 indexing=block_ptr Ktile=64 ncol=2 layout=lo1", "category": "grid", "expected_gain": "unknown", "decision": "COMPILE_FAIL", "tflops": 0.0, "timestamp": "2026-04-21T13:55:11Z"}
{"round": 691, "iter": "iter691", "bottleneck": "compile", "idea": "iter691_autogrid: BM=96 BN=96 warps=4 stages=5 indexing=block_ptr Ktile=64 ncol=2 layout=kmn", "category": "grid", "expected_gain": "unknown", "decision": "COMPILE_FAIL", "tflops": 0.0, "timestamp": "2026-04-21T13:55:16Z"}
{"round": 692, "iter": "iter692", "bottleneck": "compile", "idea": "iter692_autogrid: BM=96 BN=96 warps=4 stages=5 indexing=block_ptr Ktile=128 ncol=4 layout=mnk", "category": "grid", "expected_gain": "unknown", "decision": "COMPILE_FAIL", "tflops": 0.0, "timestamp": "2026-04-21T13:55:21Z"}
{"round": 693, "iter": "iter693", "bottleneck": "compile", "idea": "iter693_autogrid: BM=96 BN=96 warps=4 stages=5 indexing=block_ptr Ktile=128 ncol=4 layout=lo1", "category": "grid", "expected_gain": "unknown", "decision": "COMPILE_FAIL", "tflops": 0.0, "timestamp": "2026-04-21T13:55:25Z"}
{"round": 694, "iter": "iter694", "bottleneck": "compile", "idea": "iter694_autogrid: BM=96 BN=96 warps=4 stages=5 indexing=block_ptr Ktile=128 ncol=4 layout=kmn", "category": "grid", "expected_gain": "unknown", "decision": "COMPILE_FAIL", "tflops": 0.0, "timestamp": "2026-04-21T13:55:29Z"}
{"round": 695, "iter": "iter695", "bottleneck": "compile", "idea": "iter695_autogrid: BM=96 BN=96 warps=4 stages=6 indexing=pointer Ktile=32 ncol=1 layout=mnk", "category": "grid", "expected_gain": "unknown", "decision": "COMPILE_FAIL", "tflops": 0.0, "timestamp": "2026-04-21T13:55:34Z"}
{"round": 696, "iter": "iter696", "bottleneck": "compile", "idea": "iter696_autogrid: BM=96 BN=96 warps=4 stages=6 indexing=pointer Ktile=32 ncol=1 layout=lo1", "category": "grid", "expected_gain": "unknown", "decision": "COMPILE_FAIL", "tflops": 0.0, "timestamp": "2026-04-21T13:55:38Z"}
{"round": 697, "iter": "iter697", "bottleneck": "compile", "idea": "iter697_autogrid: BM=96 BN=96 warps=4 stages=6 indexing=pointer Ktile=32 ncol=1 layout=kmn", "category": "grid", "expected_gain": "unknown", "decision": "COMPILE_FAIL", "tflops": 0.0, "timestamp": "2026-04-21T13:55:42Z"}
{"round": 698, "iter": "iter698", "bottleneck": "compile", "idea": "iter698_autogrid: BM=96 BN=96 warps=4 stages=6 indexing=pointer Ktile=64 ncol=2 layout=mnk", "category": "grid", "expected_gain": "unknown", "decision": "COMPILE_FAIL", "tflops": 0.0, "timestamp": "2026-04-21T13:55:46Z"}
{"round": 699, "iter": "iter699", "bottleneck": "compile", "idea": "iter699_autogrid: BM=96 BN=96 warps=4 stages=6 indexing=pointer Ktile=64 ncol=2 layout=lo1", "category": "grid", "expected_gain": "unknown", "decision": "COMPILE_FAIL", "tflops": 0.0, "timestamp": "2026-04-21T13:55:51Z"}
{"round": 700, "iter": "iter700", "bottleneck": "compile", "idea": "iter700_autogrid: BM=96 BN=96 warps=4 stages=6 indexing=pointer Ktile=64 ncol=2 layout=kmn", "category": "grid", "expected_gain": "unknown", "decision": "COMPILE_FAIL", "tflops": 0.0, "timestamp": "2026-04-21T13:55:55Z"}
{"round": 701, "iter": "iter701", "bottleneck": "compute_bound", "idea": "iter701_autogrid: BM=128 BN=64 warps=4 stages=4 indexing=pointer Ktile=32 ncol=1 layout=mnk", "category": "grid", "expected_gain": "unknown", "decision": "DISCARD", "tflops": 46.46, "timestamp": "2026-04-21T13:57:38Z"}
{"round": 702, "iter": "iter702", "bottleneck": "compute_bound", "idea": "iter702_autogrid: BM=128 BN=64 warps=4 stages=4 indexing=pointer Ktile=32 ncol=1 layout=lo1", "category": "grid", "expected_gain": "unknown", "decision": "DISCARD", "tflops": 45.72, "timestamp": "2026-04-21T13:57:44Z"}
{"round": 703, "iter": "iter703", "bottleneck": "compute_bound", "idea": "iter703_autogrid: BM=128 BN=64 warps=4 stages=4 indexing=pointer Ktile=64 ncol=2 layout=mnk", "category": "grid", "expected_gain": "unknown", "decision": "DISCARD", "tflops": 55.28, "timestamp": "2026-04-21T13:57:50Z"}
{"round": 704, "iter": "iter704", "bottleneck": "compute_bound", "idea": "iter704_autogrid: BM=128 BN=64 warps=4 stages=4 indexing=pointer Ktile=64 ncol=2 layout=lo1", "category": "grid", "expected_gain": "unknown", "decision": "DISCARD", "tflops": 54.51, "timestamp": "2026-04-21T13:57:56Z"}
{"round": 705, "iter": "iter705", "bottleneck": "compute_bound", "idea": "iter705_autogrid: BM=128 BN=64 warps=4 stages=4 indexing=pointer Ktile=128 ncol=4 layout=mnk", "category": "grid", "expected_gain": "unknown", "decision": "DISCARD", "tflops": 48.9, "timestamp": "2026-04-21T13:58:03Z"}
{"round": 706, "iter": "iter706", "bottleneck": "compute_bound", "idea": "iter706_autogrid: BM=128 BN=64 warps=4 stages=4 indexing=pointer Ktile=128 ncol=4 layout=lo1", "category": "grid", "expected_gain": "unknown", "decision": "DISCARD", "tflops": 51.46, "timestamp": "2026-04-21T13:58:09Z"}
{"round": 707, "iter": "iter707", "bottleneck": "compute_bound", "idea": "iter707_autogrid: BM=128 BN=64 warps=4 stages=4 indexing=block_ptr Ktile=32 ncol=1 layout=mnk", "category": "grid", "expected_gain": "unknown", "decision": "DISCARD", "tflops": 46.59, "timestamp": "2026-04-21T13:58:15Z"}
{"round": 708, "iter": "iter708", "bottleneck": "compute_bound", "idea": "iter708_autogrid: BM=128 BN=64 warps=4 stages=4 indexing=block_ptr Ktile=32 ncol=1 layout=lo1", "category": "grid", "expected_gain": "unknown", "decision": "DISCARD", "tflops": 45.08, "timestamp": "2026-04-21T13:58:21Z"}
{"round": 709, "iter": "iter709", "bottleneck": "compute_bound", "idea": "iter709_autogrid: BM=128 BN=64 warps=4 stages=4 indexing=block_ptr Ktile=64 ncol=2 layout=mnk", "category": "grid", "expected_gain": "unknown", "decision": "DISCARD", "tflops": 57.55, "timestamp": "2026-04-21T13:58:27Z"}
{"round": 710, "iter": "iter710", "bottleneck": "compute_bound", "idea": "iter710_autogrid: BM=128 BN=64 warps=4 stages=4 indexing=block_ptr Ktile=64 ncol=2 layout=lo1", "category": "grid", "expected_gain": "unknown", "decision": "DISCARD", "tflops": 49.59, "timestamp": "2026-04-21T13:58:33Z"}
{"round": 711, "iter": "iter711", "bottleneck": "compute_bound", "idea": "iter711_autogrid: BM=128 BN=64 warps=4 stages=4 indexing=block_ptr Ktile=128 ncol=4 layout=mnk", "category": "grid", "expected_gain": "unknown", "decision": "DISCARD", "tflops": 48.04, "timestamp": "2026-04-21T13:58:40Z"}
{"round": 712, "iter": "iter712", "bottleneck": "compute_bound", "idea": "iter712_autogrid: BM=128 BN=64 warps=4 stages=4 indexing=block_ptr Ktile=128 ncol=4 layout=lo1", "category": "grid", "expected_gain": "unknown", "decision": "DISCARD", "tflops": 53.19, "timestamp": "2026-04-21T13:58:46Z"}
{"round": 713, "iter": "iter713", "bottleneck": "compute_bound", "idea": "iter713_autogrid: BM=128 BN=64 warps=4 stages=5 indexing=pointer Ktile=32 ncol=1 layout=mnk", "category": "grid", "expected_gain": "unknown", "decision": "DISCARD", "tflops": 46.4, "timestamp": "2026-04-21T13:58:52Z"}
{"round": 714, "iter": "iter714", "bottleneck": "compute_bound", "idea": "iter714_autogrid: BM=128 BN=64 warps=4 stages=5 indexing=pointer Ktile=32 ncol=1 layout=lo1", "category": "grid", "expected_gain": "unknown", "decision": "DISCARD", "tflops": 45.59, "timestamp": "2026-04-21T13:58:57Z"}
{"round": 715, "iter": "iter715", "bottleneck": "compute_bound", "idea": "iter715_autogrid: BM=128 BN=64 warps=4 stages=5 indexing=pointer Ktile=64 ncol=2 layout=mnk", "category": "grid", "expected_gain": "unknown", "decision": "DISCARD", "tflops": 51.23, "timestamp": "2026-04-21T13:59:04Z"}
{"round": 716, "iter": "iter716", "bottleneck": "compute_bound", "idea": "iter716_autogrid: BM=128 BN=64 warps=4 stages=5 indexing=pointer Ktile=64 ncol=2 layout=lo1", "category": "grid", "expected_gain": "unknown", "decision": "DISCARD", "tflops": 53.21, "timestamp": "2026-04-21T13:59:10Z"}
{"round": 717, "iter": "iter717", "bottleneck": "compute_bound", "idea": "iter717_autogrid: BM=128 BN=64 warps=4 stages=5 indexing=pointer Ktile=128 ncol=4 layout=mnk", "category": "grid", "expected_gain": "unknown", "decision": "DISCARD", "tflops": 48.7, "timestamp": "2026-04-21T13:59:16Z"}
{"round": 718, "iter": "iter718", "bottleneck": "compute_bound", "idea": "iter718_autogrid: BM=128 BN=64 warps=4 stages=5 indexing=pointer Ktile=128 ncol=4 layout=lo1", "category": "grid", "expected_gain": "unknown", "decision": "DISCARD", "tflops": 51.5, "timestamp": "2026-04-21T13:59:22Z"}
{"round": 719, "iter": "iter719", "bottleneck": "compute_bound", "idea": "iter719_autogrid: BM=128 BN=64 warps=4 stages=5 indexing=block_ptr Ktile=32 ncol=1 layout=mnk", "category": "grid", "expected_gain": "unknown", "decision": "DISCARD", "tflops": 46.62, "timestamp": "2026-04-21T13:59:28Z"}
{"round": 720, "iter": "iter720", "bottleneck": "compute_bound", "idea": "iter720_autogrid: BM=128 BN=64 warps=4 stages=5 indexing=block_ptr Ktile=32 ncol=1 layout=lo1", "category": "grid", "expected_gain": "unknown", "decision": "DISCARD", "tflops": 45.03, "timestamp": "2026-04-21T13:59:35Z"}
{"round": 721, "iter": "iter721", "bottleneck": "compute_bound", "idea": "iter721_autogrid: BM=128 BN=64 warps=4 stages=5 indexing=block_ptr Ktile=64 ncol=2 layout=mnk", "category": "grid", "expected_gain": "unknown", "decision": "DISCARD", "tflops": 52.29, "timestamp": "2026-04-21T13:59:41Z"}
{"round": 722, "iter": "iter722", "bottleneck": "compute_bound", "idea": "iter722_autogrid: BM=128 BN=64 warps=4 stages=5 indexing=block_ptr Ktile=64 ncol=2 layout=lo1", "category": "grid", "expected_gain": "unknown", "decision": "DISCARD", "tflops": 46.44, "timestamp": "2026-04-21T13:59:47Z"}
{"round": 723, "iter": "iter723", "bottleneck": "compute_bound", "idea": "iter723_autogrid: BM=128 BN=64 warps=4 stages=5 indexing=block_ptr Ktile=128 ncol=4 layout=mnk", "category": "grid", "expected_gain": "unknown", "decision": "DISCARD", "tflops": 47.87, "timestamp": "2026-04-21T13:59:54Z"}
{"round": 724, "iter": "iter724", "bottleneck": "compute_bound", "idea": "iter724_autogrid: BM=128 BN=64 warps=4 stages=5 indexing=block_ptr Ktile=128 ncol=4 layout=lo1", "category": "grid", "expected_gain": "unknown", "decision": "DISCARD", "tflops": 53.04, "timestamp": "2026-04-21T14:00:01Z"}
{"round": 725, "iter": "iter725", "bottleneck": "compute_bound", "idea": "iter725_autogrid: BM=128 BN=64 warps=4 stages=6 indexing=pointer Ktile=32 ncol=1 layout=mnk", "category": "grid", "expected_gain": "unknown", "decision": "DISCARD", "tflops": 45.65, "timestamp": "2026-04-21T14:00:07Z"}
{"round": 726, "iter": "iter726", "bottleneck": "compute_bound", "idea": "iter726_autogrid: BM=128 BN=64 warps=4 stages=6 indexing=pointer Ktile=32 ncol=1 layout=lo1", "category": "grid", "expected_gain": "unknown", "decision": "DISCARD", "tflops": 44.41, "timestamp": "2026-04-21T14:00:12Z"}
{"round": 727, "iter": "iter727", "bottleneck": "compute_bound", "idea": "iter727_autogrid: BM=128 BN=64 warps=4 stages=6 indexing=pointer Ktile=64 ncol=2 layout=mnk", "category": "grid", "expected_gain": "unknown", "decision": "DISCARD", "tflops": 51.2, "timestamp": "2026-04-21T14:00:19Z"}
{"round": 728, "iter": "iter728", "bottleneck": "compute_bound", "idea": "iter728_autogrid: BM=128 BN=64 warps=4 stages=6 indexing=pointer Ktile=64 ncol=2 layout=lo1", "category": "grid", "expected_gain": "unknown", "decision": "DISCARD", "tflops": 53.1, "timestamp": "2026-04-21T14:00:25Z"}
{"round": 729, "iter": "iter729", "bottleneck": "compute_bound", "idea": "iter729_autogrid: BM=128 BN=64 warps=4 stages=6 indexing=pointer Ktile=128 ncol=4 layout=mnk", "category": "grid", "expected_gain": "unknown", "decision": "DISCARD", "tflops": 31.68, "timestamp": "2026-04-21T14:00:32Z"}
{"round": 730, "iter": "iter730", "bottleneck": "compute_bound", "idea": "iter730_autogrid: BM=128 BN=64 warps=4 stages=6 indexing=pointer Ktile=128 ncol=4 layout=lo1", "category": "grid", "expected_gain": "unknown", "decision": "DISCARD", "tflops": 31.78, "timestamp": "2026-04-21T14:00:39Z"}
{"round": 731, "iter": "iter731", "bottleneck": "compute_bound", "idea": "iter731_autogrid: BM=128 BN=64 warps=4 stages=6 indexing=block_ptr Ktile=32 ncol=1 layout=mnk", "category": "grid", "expected_gain": "unknown", "decision": "DISCARD", "tflops": 45.78, "timestamp": "2026-04-21T14:00:45Z"}
{"round": 732, "iter": "iter732", "bottleneck": "compute_bound", "idea": "iter732_autogrid: BM=128 BN=64 warps=4 stages=6 indexing=block_ptr Ktile=32 ncol=1 layout=lo1", "category": "grid", "expected_gain": "unknown", "decision": "DISCARD", "tflops": 44.42, "timestamp": "2026-04-21T14:00:51Z"}
{"round": 733, "iter": "iter733", "bottleneck": "compute_bound", "idea": "iter733_autogrid: BM=128 BN=64 warps=4 stages=6 indexing=block_ptr Ktile=64 ncol=2 layout=mnk", "category": "grid", "expected_gain": "unknown", "decision": "DISCARD", "tflops": 52.27, "timestamp": "2026-04-21T14:00:57Z"}
{"round": 734, "iter": "iter734", "bottleneck": "compute_bound", "idea": "iter734_autogrid: BM=128 BN=64 warps=4 stages=6 indexing=block_ptr Ktile=64 ncol=2 layout=lo1", "category": "grid", "expected_gain": "unknown", "decision": "DISCARD", "tflops": 46.48, "timestamp": "2026-04-21T14:01:03Z"}
{"round": 735, "iter": "iter735", "bottleneck": "compute_bound", "idea": "iter735_autogrid: BM=128 BN=64 warps=4 stages=6 indexing=block_ptr Ktile=128 ncol=4 layout=mnk", "category": "grid", "expected_gain": "unknown", "decision": "DISCARD", "tflops": 30.14, "timestamp": "2026-04-21T14:01:10Z"}
{"round": 736, "iter": "iter736", "bottleneck": "compute_bound", "idea": "iter736_autogrid: BM=128 BN=64 warps=4 stages=6 indexing=block_ptr Ktile=128 ncol=4 layout=lo1", "category": "grid", "expected_gain": "unknown", "decision": "DISCARD", "tflops": 33.97, "timestamp": "2026-04-21T14:01:17Z"}
{"round": 737, "iter": "iter737", "bottleneck": "compute_bound", "idea": "iter737_autogrid: BM=128 BN=64 warps=8 stages=3 indexing=pointer Ktile=32 ncol=1 layout=mnk", "category": "grid", "expected_gain": "unknown", "decision": "DISCARD", "tflops": 33.56, "timestamp": "2026-04-21T14:01:23Z"}
