{"round": 586, "iter": "iter586", "bottleneck": "compute_bound", "idea": "iter586_autogrid: BM=64 BN=128 warps=4 stages=6 indexing=pointer Ktile=128 ncol=4 layout=lo1", "category": "grid", "expected_gain": "unknown", "decision": "DISCARD", "tflops": 39.75, "timestamp": "2026-04-21T15:06:07Z"}
{"round": 587, "iter": "iter587", "bottleneck": "compute_bound", "idea": "iter587_autogrid: BM=64 BN=128 warps=4 stages=6 indexing=block_ptr Ktile=32 ncol=1 layout=mnk", "category": "grid", "expected_gain": "unknown", "decision": "DISCARD", "tflops": 49.19, "timestamp": "2026-04-21T15:06:13Z"}
{"round": 588, "iter": "iter588", "bottleneck": "compute_bound", "idea": "iter588_autogrid: BM=64 BN=128 warps=4 stages=6 indexing=block_ptr Ktile=32 ncol=1 layout=lo1", "category": "grid", "expected_gain": "unknown", "decision": "DISCARD", "tflops": 111.81, "timestamp": "2026-04-21T15:06:19Z"}
{"round": 589, "iter": "iter589", "bottleneck": "compute_bound", "idea": "iter589_autogrid: BM=64 BN=128 warps=4 stages=6 indexing=block_ptr Ktile=64 ncol=2 layout=mnk", "category": "grid", "expected_gain": "unknown", "decision": "DISCARD", "tflops": 103.08, "timestamp": "2026-04-21T15:06:25Z"}
{"round": 590, "iter": "iter590", "bottleneck": "compute_bound", "idea": "iter590_autogrid: BM=64 BN=128 warps=4 stages=6 indexing=block_ptr Ktile=64 ncol=2 layout=lo1", "category": "grid", "expected_gain": "unknown", "decision": "DISCARD", "tflops": 104.14, "timestamp": "2026-04-21T15:06:31Z"}
{"round": 591, "iter": "iter591", "bottleneck": "compute_bound", "idea": "iter591_autogrid: BM=64 BN=128 warps=4 stages=6 indexing=block_ptr Ktile=128 ncol=4 layout=mnk", "category": "grid", "expected_gain": "unknown", "decision": "DISCARD", "tflops": 85.18, "timestamp": "2026-04-21T15:06:38Z"}
{"round": 592, "iter": "iter592", "bottleneck": "compute_bound", "idea": "iter592_autogrid: BM=64 BN=128 warps=4 stages=6 indexing=block_ptr Ktile=128 ncol=4 layout=lo1", "category": "grid", "expected_gain": "unknown", "decision": "DISCARD", "tflops": 80.15, "timestamp": "2026-04-21T15:06:44Z"}
{"round": 593, "iter": "iter593", "bottleneck": "compute_bound", "idea": "iter593_autogrid: BM=64 BN=128 warps=8 stages=3 indexing=pointer Ktile=32 ncol=1 layout=mnk", "category": "grid", "expected_gain": "unknown", "decision": "DISCARD", "tflops": 50.64, "timestamp": "2026-04-21T15:06:50Z"}
{"round": 594, "iter": "iter594", "bottleneck": "compute_bound", "idea": "iter594_autogrid: BM=64 BN=128 warps=8 stages=3 indexing=pointer Ktile=32 ncol=1 layout=lo1", "category": "grid", "expected_gain": "unknown", "decision": "DISCARD", "tflops": 53.56, "timestamp": "2026-04-21T15:06:57Z"}
{"round": 595, "iter": "iter595", "bottleneck": "compute_bound", "idea": "iter595_autogrid: BM=64 BN=128 warps=8 stages=3 indexing=pointer Ktile=64 ncol=2 layout=mnk", "category": "grid", "expected_gain": "unknown", "decision": "DISCARD", "tflops": 93.82, "timestamp": "2026-04-21T15:07:02Z"}
{"round": 596, "iter": "iter596", "bottleneck": "compute_bound", "idea": "iter596_autogrid: BM=64 BN=128 warps=8 stages=3 indexing=pointer Ktile=64 ncol=2 layout=lo1", "category": "grid", "expected_gain": "unknown", "decision": "DISCARD", "tflops": 94.35, "timestamp": "2026-04-21T15:07:08Z"}
{"round": 597, "iter": "iter597", "bottleneck": "compute_bound", "idea": "iter597_autogrid: BM=64 BN=128 warps=8 stages=3 indexing=pointer Ktile=128 ncol=4 layout=mnk", "category": "grid", "expected_gain": "unknown", "decision": "DISCARD", "tflops": 75.1, "timestamp": "2026-04-21T15:07:14Z"}
{"round": 598, "iter": "iter598", "bottleneck": "compute_bound", "idea": "iter598_autogrid: BM=64 BN=128 warps=8 stages=3 indexing=pointer Ktile=128 ncol=4 layout=lo1", "category": "grid", "expected_gain": "unknown", "decision": "DISCARD", "tflops": 74.13, "timestamp": "2026-04-21T15:07:21Z"}
{"round": 599, "iter": "iter599", "bottleneck": "compute_bound", "idea": "iter599_autogrid: BM=64 BN=128 warps=8 stages=3 indexing=block_ptr Ktile=32 ncol=1 layout=mnk", "category": "grid", "expected_gain": "unknown", "decision": "DISCARD", "tflops": 54.9, "timestamp": "2026-04-21T15:07:27Z"}
{"round": 600, "iter": "iter600", "bottleneck": "compute_bound", "idea": "iter600_autogrid: BM=64 BN=128 warps=8 stages=3 indexing=block_ptr Ktile=32 ncol=1 layout=lo1", "category": "grid", "expected_gain": "unknown", "decision": "DISCARD", "tflops": 36.02, "timestamp": "2026-04-21T15:07:33Z"}
{"round": 601, "iter": "iter601", "bottleneck": "compute_bound", "idea": "iter601_autogrid: BM=64 BN=128 warps=8 stages=3 indexing=block_ptr Ktile=64 ncol=2 layout=mnk", "category": "grid", "expected_gain": "unknown", "decision": "DISCARD", "tflops": 82.88, "timestamp": "2026-04-21T15:07:39Z"}
{"round": 602, "iter": "iter602", "bottleneck": "compute_bound", "idea": "iter602_autogrid: BM=64 BN=128 warps=8 stages=3 indexing=block_ptr Ktile=64 ncol=2 layout=lo1", "category": "grid", "expected_gain": "unknown", "decision": "DISCARD", "tflops": 93.41, "timestamp": "2026-04-21T15:07:45Z"}
{"round": 603, "iter": "iter603", "bottleneck": "compute_bound", "idea": "iter603_autogrid: BM=64 BN=128 warps=8 stages=3 indexing=block_ptr Ktile=128 ncol=4 layout=mnk", "category": "grid", "expected_gain": "unknown", "decision": "DISCARD", "tflops": 75.29, "timestamp": "2026-04-21T15:07:51Z"}
{"round": 604, "iter": "iter604", "bottleneck": "compute_bound", "idea": "iter604_autogrid: BM=64 BN=128 warps=8 stages=3 indexing=block_ptr Ktile=128 ncol=4 layout=lo1", "category": "grid", "expected_gain": "unknown", "decision": "DISCARD", "tflops": 69.87, "timestamp": "2026-04-21T15:07:57Z"}
{"round": 605, "iter": "iter605", "bottleneck": "compute_bound", "idea": "iter605_autogrid: BM=64 BN=128 warps=8 stages=4 indexing=pointer Ktile=32 ncol=1 layout=mnk", "category": "grid", "expected_gain": "unknown", "decision": "DISCARD", "tflops": 23.21, "timestamp": "2026-04-21T15:08:04Z"}
{"round": 606, "iter": "iter606", "bottleneck": "compute_bound", "idea": "iter606_autogrid: BM=64 BN=128 warps=8 stages=4 indexing=pointer Ktile=32 ncol=1 layout=lo1", "category": "grid", "expected_gain": "unknown", "decision": "DISCARD", "tflops": 46.2, "timestamp": "2026-04-21T15:08:10Z"}
{"round": 607, "iter": "iter607", "bottleneck": "compute_bound", "idea": "iter607_autogrid: BM=64 BN=128 warps=8 stages=4 indexing=pointer Ktile=64 ncol=2 layout=mnk", "category": "grid", "expected_gain": "unknown", "decision": "DISCARD", "tflops": 37.8, "timestamp": "2026-04-21T15:08:17Z"}
{"round": 608, "iter": "iter608", "bottleneck": "compute_bound", "idea": "iter608_autogrid: BM=64 BN=128 warps=8 stages=4 indexing=pointer Ktile=64 ncol=2 layout=lo1", "category": "grid", "expected_gain": "unknown", "decision": "DISCARD", "tflops": 36.07, "timestamp": "2026-04-21T15:08:23Z"}
{"round": 609, "iter": "iter609", "bottleneck": "compute_bound", "idea": "iter609_autogrid: BM=64 BN=128 warps=8 stages=4 indexing=pointer Ktile=128 ncol=4 layout=mnk", "category": "grid", "expected_gain": "unknown", "decision": "DISCARD", "tflops": 75.09, "timestamp": "2026-04-21T15:08:29Z"}
{"round": 610, "iter": "iter610", "bottleneck": "compute_bound", "idea": "iter610_autogrid: BM=64 BN=128 warps=8 stages=4 indexing=pointer Ktile=128 ncol=4 layout=lo1", "category": "grid", "expected_gain": "unknown", "decision": "DISCARD", "tflops": 74.26, "timestamp": "2026-04-21T15:08:35Z"}
{"round": 611, "iter": "iter611", "bottleneck": "compute_bound", "idea": "iter611_autogrid: BM=64 BN=128 warps=8 stages=4 indexing=block_ptr Ktile=32 ncol=1 layout=mnk", "category": "grid", "expected_gain": "unknown", "decision": "DISCARD", "tflops": 54.53, "timestamp": "2026-04-21T15:08:41Z"}
{"round": 612, "iter": "iter612", "bottleneck": "compute_bound", "idea": "iter612_autogrid: BM=64 BN=128 warps=8 stages=4 indexing=block_ptr Ktile=32 ncol=1 layout=lo1", "category": "grid", "expected_gain": "unknown", "decision": "DISCARD", "tflops": 23.45, "timestamp": "2026-04-21T15:08:48Z"}
{"round": 613, "iter": "iter613", "bottleneck": "compute_bound", "idea": "iter613_autogrid: BM=64 BN=128 warps=8 stages=4 indexing=block_ptr Ktile=64 ncol=2 layout=mnk", "category": "grid", "expected_gain": "unknown", "decision": "DISCARD", "tflops": 36.29, "timestamp": "2026-04-21T15:08:54Z"}
{"round": 614, "iter": "iter614", "bottleneck": "compute_bound", "idea": "iter614_autogrid: BM=64 BN=128 warps=8 stages=4 indexing=block_ptr Ktile=64 ncol=2 layout=lo1", "category": "grid", "expected_gain": "unknown", "decision": "DISCARD", "tflops": 37.34, "timestamp": "2026-04-21T15:09:00Z"}
{"round": 615, "iter": "iter615", "bottleneck": "compute_bound", "idea": "iter615_autogrid: BM=64 BN=128 warps=8 stages=4 indexing=block_ptr Ktile=128 ncol=4 layout=mnk", "category": "grid", "expected_gain": "unknown", "decision": "DISCARD", "tflops": 75.15, "timestamp": "2026-04-21T15:09:06Z"}
{"round": 616, "iter": "iter616", "bottleneck": "compute_bound", "idea": "iter616_autogrid: BM=64 BN=128 warps=8 stages=4 indexing=block_ptr Ktile=128 ncol=4 layout=lo1", "category": "grid", "expected_gain": "unknown", "decision": "DISCARD", "tflops": 68.73, "timestamp": "2026-04-21T15:09:12Z"}
{"round": 617, "iter": "iter617", "bottleneck": "compute_bound", "idea": "iter617_autogrid: BM=64 BN=128 warps=8 stages=5 indexing=pointer Ktile=32 ncol=1 layout=mnk", "category": "grid", "expected_gain": "unknown", "decision": "DISCARD", "tflops": 53.52, "timestamp": "2026-04-21T15:09:18Z"}
{"round": 618, "iter": "iter618", "bottleneck": "compute_bound", "idea": "iter618_autogrid: BM=64 BN=128 warps=8 stages=5 indexing=pointer Ktile=32 ncol=1 layout=lo1", "category": "grid", "expected_gain": "unknown", "decision": "DISCARD", "tflops": 49.95, "timestamp": "2026-04-21T15:09:24Z"}
{"round": 619, "iter": "iter619", "bottleneck": "compute_bound", "idea": "iter619_autogrid: BM=64 BN=128 warps=8 stages=5 indexing=pointer Ktile=64 ncol=2 layout=mnk", "category": "grid", "expected_gain": "unknown", "decision": "DISCARD", "tflops": 36.79, "timestamp": "2026-04-21T15:09:30Z"}
{"round": 620, "iter": "iter620", "bottleneck": "compute_bound", "idea": "iter620_autogrid: BM=64 BN=128 warps=8 stages=5 indexing=pointer Ktile=64 ncol=2 layout=lo1", "category": "grid", "expected_gain": "unknown", "decision": "DISCARD", "tflops": 33.96, "timestamp": "2026-04-21T15:09:36Z"}
{"round": 621, "iter": "iter621", "bottleneck": "compute_bound", "idea": "iter621_autogrid: BM=64 BN=128 warps=8 stages=5 indexing=pointer Ktile=128 ncol=4 layout=mnk", "category": "grid", "expected_gain": "unknown", "decision": "DISCARD", "tflops": 27.08, "timestamp": "2026-04-21T15:09:43Z"}
{"round": 622, "iter": "iter622", "bottleneck": "compute_bound", "idea": "iter622_autogrid: BM=64 BN=128 warps=8 stages=5 indexing=pointer Ktile=128 ncol=4 layout=lo1", "category": "grid", "expected_gain": "unknown", "decision": "DISCARD", "tflops": 27.36, "timestamp": "2026-04-21T15:09:49Z"}
{"round": 623, "iter": "iter623", "bottleneck": "compute_bound", "idea": "iter623_autogrid: BM=64 BN=128 warps=8 stages=5 indexing=block_ptr Ktile=32 ncol=1 layout=mnk", "category": "grid", "expected_gain": "unknown", "decision": "DISCARD", "tflops": 53.82, "timestamp": "2026-04-21T15:09:55Z"}
{"round": 624, "iter": "iter624", "bottleneck": "compute_bound", "idea": "iter624_autogrid: BM=64 BN=128 warps=8 stages=5 indexing=block_ptr Ktile=32 ncol=1 layout=lo1", "category": "grid", "expected_gain": "unknown", "decision": "DISCARD", "tflops": 54.35, "timestamp": "2026-04-21T15:10:01Z"}
{"round": 625, "iter": "iter625", "bottleneck": "compute_bound", "idea": "iter625_autogrid: BM=64 BN=128 warps=8 stages=5 indexing=block_ptr Ktile=64 ncol=2 layout=mnk", "category": "grid", "expected_gain": "unknown", "decision": "DISCARD", "tflops": 85.12, "timestamp": "2026-04-21T15:10:07Z"}
{"round": 626, "iter": "iter626", "bottleneck": "compute_bound", "idea": "iter626_autogrid: BM=64 BN=128 warps=8 stages=5 indexing=block_ptr Ktile=64 ncol=2 layout=lo1", "category": "grid", "expected_gain": "unknown", "decision": "DISCARD", "tflops": 87.15, "timestamp": "2026-04-21T15:10:13Z"}
{"round": 627, "iter": "iter627", "bottleneck": "compute_bound", "idea": "iter627_autogrid: BM=64 BN=128 warps=8 stages=5 indexing=block_ptr Ktile=128 ncol=4 layout=mnk", "category": "grid", "expected_gain": "unknown", "decision": "DISCARD", "tflops": 75.05, "timestamp": "2026-04-21T15:10:19Z"}
{"round": 628, "iter": "iter628", "bottleneck": "compute_bound", "idea": "iter628_autogrid: BM=64 BN=128 warps=8 stages=5 indexing=block_ptr Ktile=128 ncol=4 layout=lo1", "category": "grid", "expected_gain": "unknown", "decision": "DISCARD", "tflops": 69.56, "timestamp": "2026-04-21T15:10:26Z"}
{"round": 629, "iter": "iter629", "bottleneck": "compute_bound", "idea": "iter629_autogrid: BM=64 BN=128 warps=8 stages=6 indexing=pointer Ktile=32 ncol=1 layout=mnk", "category": "grid", "expected_gain": "unknown", "decision": "DISCARD", "tflops": 53.35, "timestamp": "2026-04-21T15:10:32Z"}
{"round": 630, "iter": "iter630", "bottleneck": "compute_bound", "idea": "iter630_autogrid: BM=64 BN=128 warps=8 stages=6 indexing=pointer Ktile=32 ncol=1 layout=lo1", "category": "grid", "expected_gain": "unknown", "decision": "DISCARD", "tflops": 53.34, "timestamp": "2026-04-21T15:10:38Z"}
{"round": 631, "iter": "iter631", "bottleneck": "compute_bound", "idea": "iter631_autogrid: BM=64 BN=128 warps=8 stages=6 indexing=pointer Ktile=64 ncol=2 layout=mnk", "category": "grid", "expected_gain": "unknown", "decision": "DISCARD", "tflops": 86.74, "timestamp": "2026-04-21T15:10:44Z"}
{"round": 632, "iter": "iter632", "bottleneck": "compute_bound", "idea": "iter632_autogrid: BM=64 BN=128 warps=8 stages=6 indexing=pointer Ktile=64 ncol=2 layout=lo1", "category": "grid", "expected_gain": "unknown", "decision": "DISCARD", "tflops": 88.9, "timestamp": "2026-04-21T15:10:50Z"}
{"round": 633, "iter": "iter633", "bottleneck": "compute_bound", "idea": "iter633_autogrid: BM=64 BN=128 warps=8 stages=6 indexing=pointer Ktile=128 ncol=4 layout=mnk", "category": "grid", "expected_gain": "unknown", "decision": "DISCARD", "tflops": 74.9, "timestamp": "2026-04-21T15:10:56Z"}
{"round": 634, "iter": "iter634", "bottleneck": "compute_bound", "idea": "iter634_autogrid: BM=64 BN=128 warps=8 stages=6 indexing=pointer Ktile=128 ncol=4 layout=lo1", "category": "grid", "expected_gain": "unknown", "decision": "DISCARD", "tflops": 74.08, "timestamp": "2026-04-21T15:11:02Z"}
{"round": 635, "iter": "iter635", "bottleneck": "compute_bound", "idea": "iter635_autogrid: BM=64 BN=128 warps=8 stages=6 indexing=block_ptr Ktile=32 ncol=1 layout=mnk", "category": "grid", "expected_gain": "unknown", "decision": "DISCARD", "tflops": 54.2, "timestamp": "2026-04-21T15:11:08Z"}
{"round": 636, "iter": "iter636", "bottleneck": "compute_bound", "idea": "iter636_autogrid: BM=64 BN=128 warps=8 stages=6 indexing=block_ptr Ktile=32 ncol=1 layout=lo1", "category": "grid", "expected_gain": "unknown", "decision": "DISCARD", "tflops": 54.1, "timestamp": "2026-04-21T15:11:14Z"}
{"round": 637, "iter": "iter637", "bottleneck": "compute_bound", "idea": "iter637_autogrid: BM=64 BN=128 warps=8 stages=6 indexing=block_ptr Ktile=64 ncol=2 layout=mnk", "category": "grid", "expected_gain": "unknown", "decision": "DISCARD", "tflops": 86.88, "timestamp": "2026-04-21T15:11:19Z"}
{"round": 638, "iter": "iter638", "bottleneck": "compute_bound", "idea": "iter638_autogrid: BM=64 BN=128 warps=8 stages=6 indexing=block_ptr Ktile=64 ncol=2 layout=lo1", "category": "grid", "expected_gain": "unknown", "decision": "DISCARD", "tflops": 87.6, "timestamp": "2026-04-21T15:11:25Z"}
{"round": 639, "iter": "iter639", "bottleneck": "compute_bound", "idea": "iter639_autogrid: BM=64 BN=128 warps=8 stages=6 indexing=block_ptr Ktile=128 ncol=4 layout=mnk", "category": "grid", "expected_gain": "unknown", "decision": "DISCARD", "tflops": 75.16, "timestamp": "2026-04-21T15:11:31Z"}
{"round": 640, "iter": "iter640", "bottleneck": "compute_bound", "idea": "iter640_autogrid: BM=64 BN=128 warps=8 stages=6 indexing=block_ptr Ktile=128 ncol=4 layout=lo1", "category": "grid", "expected_gain": "unknown", "decision": "DISCARD", "tflops": 69.75, "timestamp": "2026-04-21T15:11:37Z"}
{"round": 641, "iter": "iter641", "bottleneck": "compute_bound", "idea": "iter641_autogrid: BM=128 BN=64 warps=2 stages=3 indexing=pointer Ktile=32 ncol=1 layout=mnk", "category": "grid", "expected_gain": "unknown", "decision": "DISCARD", "tflops": 100.57, "timestamp": "2026-04-21T15:11:43Z"}
{"round": 642, "iter": "iter642", "bottleneck": "compute_bound", "idea": "iter642_autogrid: BM=128 BN=64 warps=2 stages=3 indexing=pointer Ktile=32 ncol=1 layout=lo1", "category": "grid", "expected_gain": "unknown", "decision": "DISCARD", "tflops": 41.73, "timestamp": "2026-04-21T15:11:49Z"}
{"round": 643, "iter": "iter643", "bottleneck": "compute_bound", "idea": "iter643_autogrid: BM=128 BN=64 warps=2 stages=3 indexing=pointer Ktile=64 ncol=2 layout=mnk", "category": "grid", "expected_gain": "unknown", "decision": "DISCARD", "tflops": 36.67, "timestamp": "2026-04-21T15:11:56Z"}
{"round": 644, "iter": "iter644", "bottleneck": "compute_bound", "idea": "iter644_autogrid: BM=128 BN=64 warps=2 stages=3 indexing=pointer Ktile=64 ncol=2 layout=lo1", "category": "grid", "expected_gain": "unknown", "decision": "DISCARD", "tflops": 34.4, "timestamp": "2026-04-21T15:12:03Z"}
{"round": 645, "iter": "iter645", "bottleneck": "compute_bound", "idea": "iter645_autogrid: BM=128 BN=64 warps=2 stages=3 indexing=pointer Ktile=128 ncol=4 layout=mnk", "category": "grid", "expected_gain": "unknown", "decision": "DISCARD", "tflops": 30.5, "timestamp": "2026-04-21T15:12:12Z"}
{"round": 646, "iter": "iter646", "bottleneck": "compute_bound", "idea": "iter646_autogrid: BM=128 BN=64 warps=2 stages=3 indexing=pointer Ktile=128 ncol=4 layout=lo1", "category": "grid", "expected_gain": "unknown", "decision": "DISCARD", "tflops": 32.13, "timestamp": "2026-04-21T15:12:20Z"}
{"round": 647, "iter": "iter647", "bottleneck": "compute_bound", "idea": "iter647_autogrid: BM=128 BN=64 warps=2 stages=3 indexing=block_ptr Ktile=32 ncol=1 layout=mnk", "category": "grid", "expected_gain": "unknown", "decision": "DISCARD", "tflops": 32.27, "timestamp": "2026-04-21T15:12:28Z"}
{"round": 648, "iter": "iter648", "bottleneck": "compute_bound", "idea": "iter648_autogrid: BM=128 BN=64 warps=2 stages=3 indexing=block_ptr Ktile=32 ncol=1 layout=lo1", "category": "grid", "expected_gain": "unknown", "decision": "DISCARD", "tflops": 85.2, "timestamp": "2026-04-21T15:12:34Z"}
{"round": 649, "iter": "iter649", "bottleneck": "compute_bound", "idea": "iter649_autogrid: BM=128 BN=64 warps=2 stages=3 indexing=block_ptr Ktile=64 ncol=2 layout=mnk", "category": "grid", "expected_gain": "unknown", "decision": "DISCARD", "tflops": 82.41, "timestamp": "2026-04-21T15:12:41Z"}
{"round": 650, "iter": "iter650", "bottleneck": "compute_bound", "idea": "iter650_autogrid: BM=128 BN=64 warps=2 stages=3 indexing=block_ptr Ktile=64 ncol=2 layout=lo1", "category": "grid", "expected_gain": "unknown", "decision": "DISCARD", "tflops": 85.29, "timestamp": "2026-04-21T15:12:48Z"}
{"round": 651, "iter": "iter651", "bottleneck": "compute_bound", "idea": "iter651_autogrid: BM=128 BN=64 warps=2 stages=3 indexing=block_ptr Ktile=128 ncol=4 layout=mnk", "category": "grid", "expected_gain": "unknown", "decision": "DISCARD", "tflops": 35.5, "timestamp": "2026-04-21T15:12:56Z"}
{"round": 652, "iter": "iter652", "bottleneck": "compute_bound", "idea": "iter652_autogrid: BM=128 BN=64 warps=2 stages=3 indexing=block_ptr Ktile=128 ncol=4 layout=lo1", "category": "grid", "expected_gain": "unknown", "decision": "DISCARD", "tflops": 37.61, "timestamp": "2026-04-21T15:13:04Z"}
{"round": 653, "iter": "iter653", "bottleneck": "compute_bound", "idea": "iter653_autogrid: BM=128 BN=64 warps=2 stages=4 indexing=pointer Ktile=32 ncol=1 layout=mnk", "category": "grid", "expected_gain": "unknown", "decision": "DISCARD", "tflops": 38.48, "timestamp": "2026-04-21T15:13:11Z"}
{"round": 654, "iter": "iter654", "bottleneck": "compute_bound", "idea": "iter654_autogrid: BM=128 BN=64 warps=2 stages=4 indexing=pointer Ktile=32 ncol=1 layout=lo1", "category": "grid", "expected_gain": "unknown", "decision": "DISCARD", "tflops": 35.12, "timestamp": "2026-04-21T15:13:18Z"}
{"round": 655, "iter": "iter655", "bottleneck": "compute_bound", "idea": "iter655_autogrid: BM=128 BN=64 warps=2 stages=4 indexing=pointer Ktile=64 ncol=2 layout=mnk", "category": "grid", "expected_gain": "unknown", "decision": "DISCARD", "tflops": 47.13, "timestamp": "2026-04-21T15:13:25Z"}
{"round": 656, "iter": "iter656", "bottleneck": "compute_bound", "idea": "iter656_autogrid: BM=128 BN=64 warps=2 stages=4 indexing=pointer Ktile=64 ncol=2 layout=lo1", "category": "grid", "expected_gain": "unknown", "decision": "DISCARD", "tflops": 30.29, "timestamp": "2026-04-21T15:13:32Z"}
{"round": 657, "iter": "iter657", "bottleneck": "compute_bound", "idea": "iter657_autogrid: BM=128 BN=64 warps=2 stages=4 indexing=pointer Ktile=128 ncol=4 layout=mnk", "category": "grid", "expected_gain": "unknown", "decision": "DISCARD", "tflops": 18.33, "timestamp": "2026-04-21T15:13:41Z"}
{"round": 658, "iter": "iter658", "bottleneck": "compute_bound", "idea": "iter658_autogrid: BM=128 BN=64 warps=2 stages=4 indexing=pointer Ktile=128 ncol=4 layout=lo1", "category": "grid", "expected_gain": "unknown", "decision": "DISCARD", "tflops": 12.63, "timestamp": "2026-04-21T15:13:50Z"}
{"round": 659, "iter": "iter659", "bottleneck": "compute_bound", "idea": "iter659_autogrid: BM=128 BN=64 warps=2 stages=4 indexing=block_ptr Ktile=32 ncol=1 layout=mnk", "category": "grid", "expected_gain": "unknown", "decision": "DISCARD", "tflops": 32.99, "timestamp": "2026-04-21T15:13:57Z"}
