{"round": 608, "iter": "iter608", "bottleneck": "compute_bound", "idea": "iter608_autogrid: BM=64 BN=128 warps=8 stages=4 indexing=pointer Ktile=64 ncol=2 layout=lo1", "category": "grid", "expected_gain": "unknown", "decision": "DISCARD", "tflops": 89.94, "timestamp": "2026-04-21T17:01:13Z"}
{"round": 609, "iter": "iter609", "bottleneck": "compute_bound", "idea": "iter609_autogrid: BM=64 BN=128 warps=8 stages=4 indexing=pointer Ktile=128 ncol=4 layout=mnk", "category": "grid", "expected_gain": "unknown", "decision": "DISCARD", "tflops": 74.77, "timestamp": "2026-04-21T17:01:18Z"}
{"round": 610, "iter": "iter610", "bottleneck": "compute_bound", "idea": "iter610_autogrid: BM=64 BN=128 warps=8 stages=4 indexing=pointer Ktile=128 ncol=4 layout=lo1", "category": "grid", "expected_gain": "unknown", "decision": "DISCARD", "tflops": 74.33, "timestamp": "2026-04-21T17:01:23Z"}
{"round": 611, "iter": "iter611", "bottleneck": "compute_bound", "idea": "iter611_autogrid: BM=64 BN=128 warps=8 stages=4 indexing=block_ptr Ktile=32 ncol=1 layout=mnk", "category": "grid", "expected_gain": "unknown", "decision": "DISCARD", "tflops": 53.65, "timestamp": "2026-04-21T17:01:28Z"}
{"round": 612, "iter": "iter612", "bottleneck": "compute_bound", "idea": "iter612_autogrid: BM=64 BN=128 warps=8 stages=4 indexing=block_ptr Ktile=32 ncol=1 layout=lo1", "category": "grid", "expected_gain": "unknown", "decision": "DISCARD", "tflops": 54.45, "timestamp": "2026-04-21T17:01:33Z"}
{"round": 613, "iter": "iter613", "bottleneck": "compute_bound", "idea": "iter613_autogrid: BM=64 BN=128 warps=8 stages=4 indexing=block_ptr Ktile=64 ncol=2 layout=mnk", "category": "grid", "expected_gain": "unknown", "decision": "DISCARD", "tflops": 86.23, "timestamp": "2026-04-21T17:01:38Z"}
{"round": 614, "iter": "iter614", "bottleneck": "compute_bound", "idea": "iter614_autogrid: BM=64 BN=128 warps=8 stages=4 indexing=block_ptr Ktile=64 ncol=2 layout=lo1", "category": "grid", "expected_gain": "unknown", "decision": "DISCARD", "tflops": 89.0, "timestamp": "2026-04-21T17:01:43Z"}
{"round": 615, "iter": "iter615", "bottleneck": "compute_bound", "idea": "iter615_autogrid: BM=64 BN=128 warps=8 stages=4 indexing=block_ptr Ktile=128 ncol=4 layout=mnk", "category": "grid", "expected_gain": "unknown", "decision": "DISCARD", "tflops": 75.21, "timestamp": "2026-04-21T17:01:48Z"}
{"round": 616, "iter": "iter616", "bottleneck": "compute_bound", "idea": "iter616_autogrid: BM=64 BN=128 warps=8 stages=4 indexing=block_ptr Ktile=128 ncol=4 layout=lo1", "category": "grid", "expected_gain": "unknown", "decision": "DISCARD", "tflops": 69.47, "timestamp": "2026-04-21T17:01:54Z"}
{"round": 617, "iter": "iter617", "bottleneck": "compute_bound", "idea": "iter617_autogrid: BM=64 BN=128 warps=8 stages=5 indexing=pointer Ktile=32 ncol=1 layout=mnk", "category": "grid", "expected_gain": "unknown", "decision": "DISCARD", "tflops": 53.62, "timestamp": "2026-04-21T17:01:59Z"}
{"round": 618, "iter": "iter618", "bottleneck": "compute_bound", "idea": "iter618_autogrid: BM=64 BN=128 warps=8 stages=5 indexing=pointer Ktile=32 ncol=1 layout=lo1", "category": "grid", "expected_gain": "unknown", "decision": "DISCARD", "tflops": 53.22, "timestamp": "2026-04-21T17:02:04Z"}
{"round": 619, "iter": "iter619", "bottleneck": "compute_bound", "idea": "iter619_autogrid: BM=64 BN=128 warps=8 stages=5 indexing=pointer Ktile=64 ncol=2 layout=mnk", "category": "grid", "expected_gain": "unknown", "decision": "DISCARD", "tflops": 88.56, "timestamp": "2026-04-21T17:02:10Z"}
{"round": 620, "iter": "iter620", "bottleneck": "compute_bound", "idea": "iter620_autogrid: BM=64 BN=128 warps=8 stages=5 indexing=pointer Ktile=64 ncol=2 layout=lo1", "category": "grid", "expected_gain": "unknown", "decision": "DISCARD", "tflops": 90.24, "timestamp": "2026-04-21T17:02:15Z"}
{"round": 621, "iter": "iter621", "bottleneck": "compute_bound", "idea": "iter621_autogrid: BM=64 BN=128 warps=8 stages=5 indexing=pointer Ktile=128 ncol=4 layout=mnk", "category": "grid", "expected_gain": "unknown", "decision": "DISCARD", "tflops": 74.74, "timestamp": "2026-04-21T17:02:20Z"}
{"round": 622, "iter": "iter622", "bottleneck": "compute_bound", "idea": "iter622_autogrid: BM=64 BN=128 warps=8 stages=5 indexing=pointer Ktile=128 ncol=4 layout=lo1", "category": "grid", "expected_gain": "unknown", "decision": "DISCARD", "tflops": 74.15, "timestamp": "2026-04-21T17:02:25Z"}
{"round": 623, "iter": "iter623", "bottleneck": "compute_bound", "idea": "iter623_autogrid: BM=64 BN=128 warps=8 stages=5 indexing=block_ptr Ktile=32 ncol=1 layout=mnk", "category": "grid", "expected_gain": "unknown", "decision": "DISCARD", "tflops": 54.74, "timestamp": "2026-04-21T17:02:30Z"}
{"round": 624, "iter": "iter624", "bottleneck": "compute_bound", "idea": "iter624_autogrid: BM=64 BN=128 warps=8 stages=5 indexing=block_ptr Ktile=32 ncol=1 layout=lo1", "category": "grid", "expected_gain": "unknown", "decision": "DISCARD", "tflops": 54.24, "timestamp": "2026-04-21T17:02:35Z"}
{"round": 625, "iter": "iter625", "bottleneck": "compute_bound", "idea": "iter625_autogrid: BM=64 BN=128 warps=8 stages=5 indexing=block_ptr Ktile=64 ncol=2 layout=mnk", "category": "grid", "expected_gain": "unknown", "decision": "DISCARD", "tflops": 88.08, "timestamp": "2026-04-21T17:02:40Z"}
{"round": 626, "iter": "iter626", "bottleneck": "compute_bound", "idea": "iter626_autogrid: BM=64 BN=128 warps=8 stages=5 indexing=block_ptr Ktile=64 ncol=2 layout=lo1", "category": "grid", "expected_gain": "unknown", "decision": "DISCARD", "tflops": 88.59, "timestamp": "2026-04-21T17:02:45Z"}
{"round": 627, "iter": "iter627", "bottleneck": "compute_bound", "idea": "iter627_autogrid: BM=64 BN=128 warps=8 stages=5 indexing=block_ptr Ktile=128 ncol=4 layout=mnk", "category": "grid", "expected_gain": "unknown", "decision": "DISCARD", "tflops": 75.07, "timestamp": "2026-04-21T17:02:50Z"}
{"round": 628, "iter": "iter628", "bottleneck": "compute_bound", "idea": "iter628_autogrid: BM=64 BN=128 warps=8 stages=5 indexing=block_ptr Ktile=128 ncol=4 layout=lo1", "category": "grid", "expected_gain": "unknown", "decision": "DISCARD", "tflops": 69.55, "timestamp": "2026-04-21T17:02:55Z"}
{"round": 629, "iter": "iter629", "bottleneck": "compute_bound", "idea": "iter629_autogrid: BM=64 BN=128 warps=8 stages=6 indexing=pointer Ktile=32 ncol=1 layout=mnk", "category": "grid", "expected_gain": "unknown", "decision": "DISCARD", "tflops": 53.56, "timestamp": "2026-04-21T17:03:01Z"}
{"round": 630, "iter": "iter630", "bottleneck": "compute_bound", "idea": "iter630_autogrid: BM=64 BN=128 warps=8 stages=6 indexing=pointer Ktile=32 ncol=1 layout=lo1", "category": "grid", "expected_gain": "unknown", "decision": "DISCARD", "tflops": 53.3, "timestamp": "2026-04-21T17:03:06Z"}
{"round": 631, "iter": "iter631", "bottleneck": "compute_bound", "idea": "iter631_autogrid: BM=64 BN=128 warps=8 stages=6 indexing=pointer Ktile=64 ncol=2 layout=mnk", "category": "grid", "expected_gain": "unknown", "decision": "DISCARD", "tflops": 88.26, "timestamp": "2026-04-21T17:03:11Z"}
{"round": 632, "iter": "iter632", "bottleneck": "compute_bound", "idea": "iter632_autogrid: BM=64 BN=128 warps=8 stages=6 indexing=pointer Ktile=64 ncol=2 layout=lo1", "category": "grid", "expected_gain": "unknown", "decision": "DISCARD", "tflops": 90.27, "timestamp": "2026-04-21T17:03:17Z"}
{"round": 633, "iter": "iter633", "bottleneck": "compute_bound", "idea": "iter633_autogrid: BM=64 BN=128 warps=8 stages=6 indexing=pointer Ktile=128 ncol=4 layout=mnk", "category": "grid", "expected_gain": "unknown", "decision": "DISCARD", "tflops": 74.71, "timestamp": "2026-04-21T17:03:22Z"}
{"round": 634, "iter": "iter634", "bottleneck": "compute_bound", "idea": "iter634_autogrid: BM=64 BN=128 warps=8 stages=6 indexing=pointer Ktile=128 ncol=4 layout=lo1", "category": "grid", "expected_gain": "unknown", "decision": "DISCARD", "tflops": 73.75, "timestamp": "2026-04-21T17:03:27Z"}
{"round": 635, "iter": "iter635", "bottleneck": "compute_bound", "idea": "iter635_autogrid: BM=64 BN=128 warps=8 stages=6 indexing=block_ptr Ktile=32 ncol=1 layout=mnk", "category": "grid", "expected_gain": "unknown", "decision": "DISCARD", "tflops": 54.49, "timestamp": "2026-04-21T17:03:32Z"}
{"round": 636, "iter": "iter636", "bottleneck": "compute_bound", "idea": "iter636_autogrid: BM=64 BN=128 warps=8 stages=6 indexing=block_ptr Ktile=32 ncol=1 layout=lo1", "category": "grid", "expected_gain": "unknown", "decision": "DISCARD", "tflops": 54.28, "timestamp": "2026-04-21T17:03:38Z"}
{"round": 637, "iter": "iter637", "bottleneck": "compute_bound", "idea": "iter637_autogrid: BM=64 BN=128 warps=8 stages=6 indexing=block_ptr Ktile=64 ncol=2 layout=mnk", "category": "grid", "expected_gain": "unknown", "decision": "DISCARD", "tflops": 87.45, "timestamp": "2026-04-21T17:03:43Z"}
{"round": 638, "iter": "iter638", "bottleneck": "compute_bound", "idea": "iter638_autogrid: BM=64 BN=128 warps=8 stages=6 indexing=block_ptr Ktile=64 ncol=2 layout=lo1", "category": "grid", "expected_gain": "unknown", "decision": "DISCARD", "tflops": 89.42, "timestamp": "2026-04-21T17:03:48Z"}
{"round": 639, "iter": "iter639", "bottleneck": "compute_bound", "idea": "iter639_autogrid: BM=64 BN=128 warps=8 stages=6 indexing=block_ptr Ktile=128 ncol=4 layout=mnk", "category": "grid", "expected_gain": "unknown", "decision": "DISCARD", "tflops": 74.71, "timestamp": "2026-04-21T17:03:54Z"}
{"round": 640, "iter": "iter640", "bottleneck": "compute_bound", "idea": "iter640_autogrid: BM=64 BN=128 warps=8 stages=6 indexing=block_ptr Ktile=128 ncol=4 layout=lo1", "category": "grid", "expected_gain": "unknown", "decision": "DISCARD", "tflops": 69.6, "timestamp": "2026-04-21T17:03:59Z"}
{"round": 641, "iter": "iter641", "bottleneck": "compute_bound", "idea": "iter641_autogrid: BM=128 BN=64 warps=2 stages=3 indexing=pointer Ktile=32 ncol=1 layout=mnk", "category": "grid", "expected_gain": "unknown", "decision": "DISCARD", "tflops": 102.12, "timestamp": "2026-04-21T17:04:03Z"}
{"round": 642, "iter": "iter642", "bottleneck": "compute_bound", "idea": "iter642_autogrid: BM=128 BN=64 warps=2 stages=3 indexing=pointer Ktile=32 ncol=1 layout=lo1", "category": "grid", "expected_gain": "unknown", "decision": "DISCARD", "tflops": 95.82, "timestamp": "2026-04-21T17:04:08Z"}
{"round": 643, "iter": "iter643", "bottleneck": "compute_bound", "idea": "iter643_autogrid: BM=128 BN=64 warps=2 stages=3 indexing=pointer Ktile=64 ncol=2 layout=mnk", "category": "grid", "expected_gain": "unknown", "decision": "DISCARD", "tflops": 87.17, "timestamp": "2026-04-21T17:04:14Z"}
{"round": 644, "iter": "iter644", "bottleneck": "compute_bound", "idea": "iter644_autogrid: BM=128 BN=64 warps=2 stages=3 indexing=pointer Ktile=64 ncol=2 layout=lo1", "category": "grid", "expected_gain": "unknown", "decision": "DISCARD", "tflops": 86.1, "timestamp": "2026-04-21T17:04:19Z"}
{"round": 645, "iter": "iter645", "bottleneck": "compute_bound", "idea": "iter645_autogrid: BM=128 BN=64 warps=2 stages=3 indexing=pointer Ktile=128 ncol=4 layout=mnk", "category": "grid", "expected_gain": "unknown", "decision": "DISCARD", "tflops": 30.78, "timestamp": "2026-04-21T17:04:24Z"}
{"round": 646, "iter": "iter646", "bottleneck": "compute_bound", "idea": "iter646_autogrid: BM=128 BN=64 warps=2 stages=3 indexing=pointer Ktile=128 ncol=4 layout=lo1", "category": "grid", "expected_gain": "unknown", "decision": "DISCARD", "tflops": 32.52, "timestamp": "2026-04-21T17:04:30Z"}
{"round": 647, "iter": "iter647", "bottleneck": "compute_bound", "idea": "iter647_autogrid: BM=128 BN=64 warps=2 stages=3 indexing=block_ptr Ktile=32 ncol=1 layout=mnk", "category": "grid", "expected_gain": "unknown", "decision": "DISCARD", "tflops": 102.43, "timestamp": "2026-04-21T17:04:35Z"}
{"round": 648, "iter": "iter648", "bottleneck": "compute_bound", "idea": "iter648_autogrid: BM=128 BN=64 warps=2 stages=3 indexing=block_ptr Ktile=32 ncol=1 layout=lo1", "category": "grid", "expected_gain": "unknown", "decision": "DISCARD", "tflops": 99.78, "timestamp": "2026-04-21T17:04:40Z"}
{"round": 649, "iter": "iter649", "bottleneck": "compute_bound", "idea": "iter649_autogrid: BM=128 BN=64 warps=2 stages=3 indexing=block_ptr Ktile=64 ncol=2 layout=mnk", "category": "grid", "expected_gain": "unknown", "decision": "DISCARD", "tflops": 85.69, "timestamp": "2026-04-21T17:04:45Z"}
{"round": 650, "iter": "iter650", "bottleneck": "compute_bound", "idea": "iter650_autogrid: BM=128 BN=64 warps=2 stages=3 indexing=block_ptr Ktile=64 ncol=2 layout=lo1", "category": "grid", "expected_gain": "unknown", "decision": "DISCARD", "tflops": 87.79, "timestamp": "2026-04-21T17:04:51Z"}
{"round": 651, "iter": "iter651", "bottleneck": "compute_bound", "idea": "iter651_autogrid: BM=128 BN=64 warps=2 stages=3 indexing=block_ptr Ktile=128 ncol=4 layout=mnk", "category": "grid", "expected_gain": "unknown", "decision": "DISCARD", "tflops": 36.69, "timestamp": "2026-04-21T17:04:56Z"}
{"round": 652, "iter": "iter652", "bottleneck": "compute_bound", "idea": "iter652_autogrid: BM=128 BN=64 warps=2 stages=3 indexing=block_ptr Ktile=128 ncol=4 layout=lo1", "category": "grid", "expected_gain": "unknown", "decision": "DISCARD", "tflops": 37.94, "timestamp": "2026-04-21T17:05:01Z"}
{"round": 653, "iter": "iter653", "bottleneck": "compute_bound", "idea": "iter653_autogrid: BM=128 BN=64 warps=2 stages=4 indexing=pointer Ktile=32 ncol=1 layout=mnk", "category": "grid", "expected_gain": "unknown", "decision": "DISCARD", "tflops": 101.47, "timestamp": "2026-04-21T17:05:06Z"}
{"round": 654, "iter": "iter654", "bottleneck": "compute_bound", "idea": "iter654_autogrid: BM=128 BN=64 warps=2 stages=4 indexing=pointer Ktile=32 ncol=1 layout=lo1", "category": "grid", "expected_gain": "unknown", "decision": "DISCARD", "tflops": 95.58, "timestamp": "2026-04-21T17:05:11Z"}
{"round": 655, "iter": "iter655", "bottleneck": "compute_bound", "idea": "iter655_autogrid: BM=128 BN=64 warps=2 stages=4 indexing=pointer Ktile=64 ncol=2 layout=mnk", "category": "grid", "expected_gain": "unknown", "decision": "DISCARD", "tflops": 85.01, "timestamp": "2026-04-21T17:05:17Z"}
{"round": 656, "iter": "iter656", "bottleneck": "compute_bound", "idea": "iter656_autogrid: BM=128 BN=64 warps=2 stages=4 indexing=pointer Ktile=64 ncol=2 layout=lo1", "category": "grid", "expected_gain": "unknown", "decision": "DISCARD", "tflops": 83.77, "timestamp": "2026-04-21T17:05:22Z"}
{"round": 657, "iter": "iter657", "bottleneck": "compute_bound", "idea": "iter657_autogrid: BM=128 BN=64 warps=2 stages=4 indexing=pointer Ktile=128 ncol=4 layout=mnk", "category": "grid", "expected_gain": "unknown", "decision": "DISCARD", "tflops": 34.45, "timestamp": "2026-04-21T17:05:27Z"}
{"round": 658, "iter": "iter658", "bottleneck": "compute_bound", "idea": "iter658_autogrid: BM=128 BN=64 warps=2 stages=4 indexing=pointer Ktile=128 ncol=4 layout=lo1", "category": "grid", "expected_gain": "unknown", "decision": "DISCARD", "tflops": 37.53, "timestamp": "2026-04-21T17:05:32Z"}
{"round": 659, "iter": "iter659", "bottleneck": "compute_bound", "idea": "iter659_autogrid: BM=128 BN=64 warps=2 stages=4 indexing=block_ptr Ktile=32 ncol=1 layout=mnk", "category": "grid", "expected_gain": "unknown", "decision": "DISCARD", "tflops": 102.45, "timestamp": "2026-04-21T17:05:38Z"}
{"round": 660, "iter": "iter660", "bottleneck": "compute_bound", "idea": "iter660_autogrid: BM=128 BN=64 warps=2 stages=4 indexing=block_ptr Ktile=32 ncol=1 layout=lo1", "category": "grid", "expected_gain": "unknown", "decision": "DISCARD", "tflops": 100.79, "timestamp": "2026-04-21T17:05:43Z"}
{"round": 661, "iter": "iter661", "bottleneck": "compute_bound", "idea": "iter661_autogrid: BM=128 BN=64 warps=2 stages=4 indexing=block_ptr Ktile=64 ncol=2 layout=mnk", "category": "grid", "expected_gain": "unknown", "decision": "DISCARD", "tflops": 81.85, "timestamp": "2026-04-21T17:05:48Z"}
{"round": 662, "iter": "iter662", "bottleneck": "compute_bound", "idea": "iter662_autogrid: BM=128 BN=64 warps=2 stages=4 indexing=block_ptr Ktile=64 ncol=2 layout=lo1", "category": "grid", "expected_gain": "unknown", "decision": "DISCARD", "tflops": 86.36, "timestamp": "2026-04-21T17:05:53Z"}
{"round": 663, "iter": "iter663", "bottleneck": "compute_bound", "idea": "iter663_autogrid: BM=128 BN=64 warps=2 stages=4 indexing=block_ptr Ktile=128 ncol=4 layout=mnk", "category": "grid", "expected_gain": "unknown", "decision": "DISCARD", "tflops": 40.71, "timestamp": "2026-04-21T17:05:59Z"}
{"round": 664, "iter": "iter664", "bottleneck": "compute_bound", "idea": "iter664_autogrid: BM=128 BN=64 warps=2 stages=4 indexing=block_ptr Ktile=128 ncol=4 layout=lo1", "category": "grid", "expected_gain": "unknown", "decision": "DISCARD", "tflops": 41.56, "timestamp": "2026-04-21T17:06:04Z"}
{"round": 665, "iter": "iter665", "bottleneck": "compute_bound", "idea": "iter665_autogrid: BM=128 BN=64 warps=2 stages=5 indexing=pointer Ktile=32 ncol=1 layout=mnk", "category": "grid", "expected_gain": "unknown", "decision": "DISCARD", "tflops": 101.58, "timestamp": "2026-04-21T17:06:09Z"}
{"round": 666, "iter": "iter666", "bottleneck": "compute_bound", "idea": "iter666_autogrid: BM=128 BN=64 warps=2 stages=5 indexing=pointer Ktile=32 ncol=1 layout=lo1", "category": "grid", "expected_gain": "unknown", "decision": "DISCARD", "tflops": 95.29, "timestamp": "2026-04-21T17:06:15Z"}
{"round": 667, "iter": "iter667", "bottleneck": "compute_bound", "idea": "iter667_autogrid: BM=128 BN=64 warps=2 stages=5 indexing=pointer Ktile=64 ncol=2 layout=mnk", "category": "grid", "expected_gain": "unknown", "decision": "DISCARD", "tflops": 80.38, "timestamp": "2026-04-21T17:06:20Z"}
{"round": 668, "iter": "iter668", "bottleneck": "compute_bound", "idea": "iter668_autogrid: BM=128 BN=64 warps=2 stages=5 indexing=pointer Ktile=64 ncol=2 layout=lo1", "category": "grid", "expected_gain": "unknown", "decision": "DISCARD", "tflops": 78.92, "timestamp": "2026-04-21T17:06:25Z"}
{"round": 669, "iter": "iter669", "bottleneck": "compute_bound", "idea": "iter669_autogrid: BM=128 BN=64 warps=2 stages=5 indexing=pointer Ktile=128 ncol=4 layout=mnk", "category": "grid", "expected_gain": "unknown", "decision": "DISCARD", "tflops": 35.03, "timestamp": "2026-04-21T17:06:31Z"}
{"round": 670, "iter": "iter670", "bottleneck": "compute_bound", "idea": "iter670_autogrid: BM=128 BN=64 warps=2 stages=5 indexing=pointer Ktile=128 ncol=4 layout=lo1", "category": "grid", "expected_gain": "unknown", "decision": "DISCARD", "tflops": 34.49, "timestamp": "2026-04-21T17:06:36Z"}
{"round": 671, "iter": "iter671", "bottleneck": "compute_bound", "idea": "iter671_autogrid: BM=128 BN=64 warps=2 stages=5 indexing=block_ptr Ktile=32 ncol=1 layout=mnk", "category": "grid", "expected_gain": "unknown", "decision": "DISCARD", "tflops": 102.34, "timestamp": "2026-04-21T17:06:41Z"}
{"round": 672, "iter": "iter672", "bottleneck": "compute_bound", "idea": "iter672_autogrid: BM=128 BN=64 warps=2 stages=5 indexing=block_ptr Ktile=32 ncol=1 layout=lo1", "category": "grid", "expected_gain": "unknown", "decision": "DISCARD", "tflops": 100.27, "timestamp": "2026-04-21T17:06:46Z"}
{"round": 673, "iter": "iter673", "bottleneck": "compute_bound", "idea": "iter673_autogrid: BM=128 BN=64 warps=2 stages=5 indexing=block_ptr Ktile=64 ncol=2 layout=mnk", "category": "grid", "expected_gain": "unknown", "decision": "DISCARD", "tflops": 79.45, "timestamp": "2026-04-21T17:06:51Z"}
{"round": 674, "iter": "iter674", "bottleneck": "compute_bound", "idea": "iter674_autogrid: BM=128 BN=64 warps=2 stages=5 indexing=block_ptr Ktile=64 ncol=2 layout=lo1", "category": "grid", "expected_gain": "unknown", "decision": "DISCARD", "tflops": 82.43, "timestamp": "2026-04-21T17:06:57Z"}
{"round": 675, "iter": "iter675", "bottleneck": "compute_bound", "idea": "iter675_autogrid: BM=128 BN=64 warps=2 stages=5 indexing=block_ptr Ktile=128 ncol=4 layout=mnk", "category": "grid", "expected_gain": "unknown", "decision": "DISCARD", "tflops": 38.03, "timestamp": "2026-04-21T17:07:02Z"}
{"round": 676, "iter": "iter676", "bottleneck": "compute_bound", "idea": "iter676_autogrid: BM=128 BN=64 warps=2 stages=5 indexing=block_ptr Ktile=128 ncol=4 layout=lo1", "category": "grid", "expected_gain": "unknown", "decision": "DISCARD", "tflops": 38.49, "timestamp": "2026-04-21T17:07:07Z"}
{"round": 677, "iter": "iter677", "bottleneck": "compute_bound", "idea": "iter677_autogrid: BM=128 BN=64 warps=2 stages=6 indexing=pointer Ktile=32 ncol=1 layout=mnk", "category": "grid", "expected_gain": "unknown", "decision": "DISCARD", "tflops": 101.29, "timestamp": "2026-04-21T17:07:12Z"}
{"round": 678, "iter": "iter678", "bottleneck": "compute_bound", "idea": "iter678_autogrid: BM=128 BN=64 warps=2 stages=6 indexing=pointer Ktile=32 ncol=1 layout=lo1", "category": "grid", "expected_gain": "unknown", "decision": "DISCARD", "tflops": 95.45, "timestamp": "2026-04-21T17:07:18Z"}
{"round": 679, "iter": "iter679", "bottleneck": "compute_bound", "idea": "iter679_autogrid: BM=128 BN=64 warps=2 stages=6 indexing=pointer Ktile=64 ncol=2 layout=mnk", "category": "grid", "expected_gain": "unknown", "decision": "DISCARD", "tflops": 68.42, "timestamp": "2026-04-21T17:07:23Z"}
{"round": 680, "iter": "iter680", "bottleneck": "compute_bound", "idea": "iter680_autogrid: BM=128 BN=64 warps=2 stages=6 indexing=pointer Ktile=64 ncol=2 layout=lo1", "category": "grid", "expected_gain": "unknown", "decision": "DISCARD", "tflops": 67.57, "timestamp": "2026-04-21T17:07:28Z"}
{"round": 681, "iter": "iter681", "bottleneck": "compute_bound", "idea": "iter681_autogrid: BM=128 BN=64 warps=2 stages=6 indexing=pointer Ktile=128 ncol=4 layout=mnk", "category": "grid", "expected_gain": "unknown", "decision": "DISCARD", "tflops": 19.53, "timestamp": "2026-04-21T17:07:34Z"}
