{"round": 887, "iter": "iter887", "bottleneck": "compile", "idea": "iter887_autogrid: BM=256 BN=128 warps=8 stages=3 indexing=block_ptr Ktile=32 ncol=1 layout=mnk", "category": "grid", "expected_gain": "unknown", "decision": "COMPILE_FAIL", "tflops": 0.0, "timestamp": "2026-04-21T14:39:24Z"}
{"round": 888, "iter": "iter888", "bottleneck": "compile", "idea": "iter888_autogrid: BM=256 BN=128 warps=8 stages=3 indexing=block_ptr Ktile=32 ncol=1 layout=lo1", "category": "grid", "expected_gain": "unknown", "decision": "COMPILE_FAIL", "tflops": 0.0, "timestamp": "2026-04-21T14:39:28Z"}
{"round": 889, "iter": "iter889", "bottleneck": "compile", "idea": "iter889_autogrid: BM=256 BN=128 warps=8 stages=3 indexing=block_ptr Ktile=64 ncol=2 layout=mnk", "category": "grid", "expected_gain": "unknown", "decision": "COMPILE_FAIL", "tflops": 0.0, "timestamp": "2026-04-21T14:39:32Z"}
{"round": 890, "iter": "iter890", "bottleneck": "compile", "idea": "iter890_autogrid: BM=256 BN=128 warps=8 stages=3 indexing=block_ptr Ktile=64 ncol=2 layout=lo1", "category": "grid", "expected_gain": "unknown", "decision": "COMPILE_FAIL", "tflops": 0.0, "timestamp": "2026-04-21T14:39:36Z"}
{"round": 891, "iter": "iter891", "bottleneck": "compile", "idea": "iter891_autogrid: BM=256 BN=128 warps=8 stages=3 indexing=block_ptr Ktile=128 ncol=4 layout=mnk", "category": "grid", "expected_gain": "unknown", "decision": "COMPILE_FAIL", "tflops": 0.0, "timestamp": "2026-04-21T14:39:40Z"}
{"round": 892, "iter": "iter892", "bottleneck": "compile", "idea": "iter892_autogrid: BM=256 BN=128 warps=8 stages=3 indexing=block_ptr Ktile=128 ncol=4 layout=lo1", "category": "grid", "expected_gain": "unknown", "decision": "COMPILE_FAIL", "tflops": 0.0, "timestamp": "2026-04-21T14:39:44Z"}
{"round": 893, "iter": "iter893", "bottleneck": "compile", "idea": "iter893_autogrid: BM=256 BN=128 warps=8 stages=4 indexing=pointer Ktile=32 ncol=1 layout=mnk", "category": "grid", "expected_gain": "unknown", "decision": "COMPILE_FAIL", "tflops": 0.0, "timestamp": "2026-04-21T14:39:48Z"}
{"round": 894, "iter": "iter894", "bottleneck": "compile", "idea": "iter894_autogrid: BM=256 BN=128 warps=8 stages=4 indexing=pointer Ktile=32 ncol=1 layout=lo1", "category": "grid", "expected_gain": "unknown", "decision": "COMPILE_FAIL", "tflops": 0.0, "timestamp": "2026-04-21T14:39:52Z"}
{"round": 895, "iter": "iter895", "bottleneck": "compile", "idea": "iter895_autogrid: BM=256 BN=128 warps=8 stages=4 indexing=pointer Ktile=64 ncol=2 layout=mnk", "category": "grid", "expected_gain": "unknown", "decision": "COMPILE_FAIL", "tflops": 0.0, "timestamp": "2026-04-21T14:39:56Z"}
{"round": 896, "iter": "iter896", "bottleneck": "compile", "idea": "iter896_autogrid: BM=256 BN=128 warps=8 stages=4 indexing=pointer Ktile=64 ncol=2 layout=lo1", "category": "grid", "expected_gain": "unknown", "decision": "COMPILE_FAIL", "tflops": 0.0, "timestamp": "2026-04-21T14:40:00Z"}
{"round": 897, "iter": "iter897", "bottleneck": "compile", "idea": "iter897_autogrid: BM=256 BN=128 warps=8 stages=4 indexing=pointer Ktile=128 ncol=4 layout=mnk", "category": "grid", "expected_gain": "unknown", "decision": "COMPILE_FAIL", "tflops": 0.0, "timestamp": "2026-04-21T14:40:04Z"}
{"round": 898, "iter": "iter898", "bottleneck": "compile", "idea": "iter898_autogrid: BM=256 BN=128 warps=8 stages=4 indexing=pointer Ktile=128 ncol=4 layout=lo1", "category": "grid", "expected_gain": "unknown", "decision": "COMPILE_FAIL", "tflops": 0.0, "timestamp": "2026-04-21T14:40:08Z"}
{"round": 899, "iter": "iter899", "bottleneck": "compile", "idea": "iter899_autogrid: BM=256 BN=128 warps=8 stages=4 indexing=block_ptr Ktile=32 ncol=1 layout=mnk", "category": "grid", "expected_gain": "unknown", "decision": "COMPILE_FAIL", "tflops": 0.0, "timestamp": "2026-04-21T14:40:12Z"}
{"round": 900, "iter": "iter900", "bottleneck": "compile", "idea": "iter900_autogrid: BM=256 BN=128 warps=8 stages=4 indexing=block_ptr Ktile=32 ncol=1 layout=lo1", "category": "grid", "expected_gain": "unknown", "decision": "COMPILE_FAIL", "tflops": 0.0, "timestamp": "2026-04-21T14:40:16Z"}
{"round": 501, "iter": "iter501", "bottleneck": "compile", "idea": "iter501_autogrid: BM=64 BN=128 warps=2 stages=3 indexing=pointer Ktile=128 ncol=4 layout=mnk", "category": "grid", "expected_gain": "unknown", "decision": "COMPILE_FAIL", "tflops": 0.0, "timestamp": "2026-04-21T14:41:08Z"}
{"round": 502, "iter": "iter502", "bottleneck": "compile", "idea": "iter502_autogrid: BM=64 BN=128 warps=2 stages=3 indexing=pointer Ktile=128 ncol=4 layout=lo1", "category": "grid", "expected_gain": "unknown", "decision": "COMPILE_FAIL", "tflops": 0.0, "timestamp": "2026-04-21T14:41:12Z"}
{"round": 503, "iter": "iter503", "bottleneck": "compile", "idea": "iter503_autogrid: BM=64 BN=128 warps=2 stages=3 indexing=block_ptr Ktile=32 ncol=1 layout=mnk", "category": "grid", "expected_gain": "unknown", "decision": "COMPILE_FAIL", "tflops": 0.0, "timestamp": "2026-04-21T14:41:16Z"}
{"round": 504, "iter": "iter504", "bottleneck": "compile", "idea": "iter504_autogrid: BM=64 BN=128 warps=2 stages=3 indexing=block_ptr Ktile=32 ncol=1 layout=lo1", "category": "grid", "expected_gain": "unknown", "decision": "COMPILE_FAIL", "tflops": 0.0, "timestamp": "2026-04-21T14:41:20Z"}
{"round": 505, "iter": "iter505", "bottleneck": "compile", "idea": "iter505_autogrid: BM=64 BN=128 warps=2 stages=3 indexing=block_ptr Ktile=64 ncol=2 layout=mnk", "category": "grid", "expected_gain": "unknown", "decision": "COMPILE_FAIL", "tflops": 0.0, "timestamp": "2026-04-21T14:41:24Z"}
{"round": 506, "iter": "iter506", "bottleneck": "compile", "idea": "iter506_autogrid: BM=64 BN=128 warps=2 stages=3 indexing=block_ptr Ktile=64 ncol=2 layout=lo1", "category": "grid", "expected_gain": "unknown", "decision": "COMPILE_FAIL", "tflops": 0.0, "timestamp": "2026-04-21T14:41:28Z"}
{"round": 507, "iter": "iter507", "bottleneck": "compile", "idea": "iter507_autogrid: BM=64 BN=128 warps=2 stages=3 indexing=block_ptr Ktile=128 ncol=4 layout=mnk", "category": "grid", "expected_gain": "unknown", "decision": "COMPILE_FAIL", "tflops": 0.0, "timestamp": "2026-04-21T14:41:32Z"}
{"round": 508, "iter": "iter508", "bottleneck": "compile", "idea": "iter508_autogrid: BM=64 BN=128 warps=2 stages=3 indexing=block_ptr Ktile=128 ncol=4 layout=lo1", "category": "grid", "expected_gain": "unknown", "decision": "COMPILE_FAIL", "tflops": 0.0, "timestamp": "2026-04-21T14:41:37Z"}
{"round": 509, "iter": "iter509", "bottleneck": "compile", "idea": "iter509_autogrid: BM=64 BN=128 warps=2 stages=4 indexing=pointer Ktile=32 ncol=1 layout=mnk", "category": "grid", "expected_gain": "unknown", "decision": "COMPILE_FAIL", "tflops": 0.0, "timestamp": "2026-04-21T14:41:41Z"}
{"round": 510, "iter": "iter510", "bottleneck": "compile", "idea": "iter510_autogrid: BM=64 BN=128 warps=2 stages=4 indexing=pointer Ktile=32 ncol=1 layout=lo1", "category": "grid", "expected_gain": "unknown", "decision": "COMPILE_FAIL", "tflops": 0.0, "timestamp": "2026-04-21T14:41:45Z"}
{"round": 511, "iter": "iter511", "bottleneck": "compile", "idea": "iter511_autogrid: BM=64 BN=128 warps=2 stages=4 indexing=pointer Ktile=64 ncol=2 layout=mnk", "category": "grid", "expected_gain": "unknown", "decision": "COMPILE_FAIL", "tflops": 0.0, "timestamp": "2026-04-21T14:41:49Z"}
{"round": 512, "iter": "iter512", "bottleneck": "compile", "idea": "iter512_autogrid: BM=64 BN=128 warps=2 stages=4 indexing=pointer Ktile=64 ncol=2 layout=lo1", "category": "grid", "expected_gain": "unknown", "decision": "COMPILE_FAIL", "tflops": 0.0, "timestamp": "2026-04-21T14:41:53Z"}
{"round": 513, "iter": "iter513", "bottleneck": "compile", "idea": "iter513_autogrid: BM=64 BN=128 warps=2 stages=4 indexing=pointer Ktile=128 ncol=4 layout=mnk", "category": "grid", "expected_gain": "unknown", "decision": "COMPILE_FAIL", "tflops": 0.0, "timestamp": "2026-04-21T14:41:57Z"}
{"round": 514, "iter": "iter514", "bottleneck": "compile", "idea": "iter514_autogrid: BM=64 BN=128 warps=2 stages=4 indexing=pointer Ktile=128 ncol=4 layout=lo1", "category": "grid", "expected_gain": "unknown", "decision": "COMPILE_FAIL", "tflops": 0.0, "timestamp": "2026-04-21T14:42:01Z"}
{"round": 515, "iter": "iter515", "bottleneck": "compile", "idea": "iter515_autogrid: BM=64 BN=128 warps=2 stages=4 indexing=block_ptr Ktile=32 ncol=1 layout=mnk", "category": "grid", "expected_gain": "unknown", "decision": "COMPILE_FAIL", "tflops": 0.0, "timestamp": "2026-04-21T14:42:06Z"}
{"round": 516, "iter": "iter516", "bottleneck": "compile", "idea": "iter516_autogrid: BM=64 BN=128 warps=2 stages=4 indexing=block_ptr Ktile=32 ncol=1 layout=lo1", "category": "grid", "expected_gain": "unknown", "decision": "COMPILE_FAIL", "tflops": 0.0, "timestamp": "2026-04-21T14:42:10Z"}
{"round": 517, "iter": "iter517", "bottleneck": "compile", "idea": "iter517_autogrid: BM=64 BN=128 warps=2 stages=4 indexing=block_ptr Ktile=64 ncol=2 layout=mnk", "category": "grid", "expected_gain": "unknown", "decision": "COMPILE_FAIL", "tflops": 0.0, "timestamp": "2026-04-21T14:42:14Z"}
{"round": 518, "iter": "iter518", "bottleneck": "compile", "idea": "iter518_autogrid: BM=64 BN=128 warps=2 stages=4 indexing=block_ptr Ktile=64 ncol=2 layout=lo1", "category": "grid", "expected_gain": "unknown", "decision": "COMPILE_FAIL", "tflops": 0.0, "timestamp": "2026-04-21T14:42:18Z"}
{"round": 519, "iter": "iter519", "bottleneck": "compile", "idea": "iter519_autogrid: BM=64 BN=128 warps=2 stages=4 indexing=block_ptr Ktile=128 ncol=4 layout=mnk", "category": "grid", "expected_gain": "unknown", "decision": "COMPILE_FAIL", "tflops": 0.0, "timestamp": "2026-04-21T14:42:23Z"}
{"round": 520, "iter": "iter520", "bottleneck": "compile", "idea": "iter520_autogrid: BM=64 BN=128 warps=2 stages=4 indexing=block_ptr Ktile=128 ncol=4 layout=lo1", "category": "grid", "expected_gain": "unknown", "decision": "COMPILE_FAIL", "tflops": 0.0, "timestamp": "2026-04-21T14:42:27Z"}
{"round": 521, "iter": "iter521", "bottleneck": "compile", "idea": "iter521_autogrid: BM=64 BN=128 warps=2 stages=5 indexing=pointer Ktile=32 ncol=1 layout=mnk", "category": "grid", "expected_gain": "unknown", "decision": "COMPILE_FAIL", "tflops": 0.0, "timestamp": "2026-04-21T14:42:31Z"}
{"round": 522, "iter": "iter522", "bottleneck": "compile", "idea": "iter522_autogrid: BM=64 BN=128 warps=2 stages=5 indexing=pointer Ktile=32 ncol=1 layout=lo1", "category": "grid", "expected_gain": "unknown", "decision": "COMPILE_FAIL", "tflops": 0.0, "timestamp": "2026-04-21T14:42:35Z"}
{"round": 523, "iter": "iter523", "bottleneck": "compile", "idea": "iter523_autogrid: BM=64 BN=128 warps=2 stages=5 indexing=pointer Ktile=64 ncol=2 layout=mnk", "category": "grid", "expected_gain": "unknown", "decision": "COMPILE_FAIL", "tflops": 0.0, "timestamp": "2026-04-21T14:42:39Z"}
{"round": 524, "iter": "iter524", "bottleneck": "compile", "idea": "iter524_autogrid: BM=64 BN=128 warps=2 stages=5 indexing=pointer Ktile=64 ncol=2 layout=lo1", "category": "grid", "expected_gain": "unknown", "decision": "COMPILE_FAIL", "tflops": 0.0, "timestamp": "2026-04-21T14:42:43Z"}
{"round": 525, "iter": "iter525", "bottleneck": "compile", "idea": "iter525_autogrid: BM=64 BN=128 warps=2 stages=5 indexing=pointer Ktile=128 ncol=4 layout=mnk", "category": "grid", "expected_gain": "unknown", "decision": "COMPILE_FAIL", "tflops": 0.0, "timestamp": "2026-04-21T14:42:47Z"}
{"round": 526, "iter": "iter526", "bottleneck": "compile", "idea": "iter526_autogrid: BM=64 BN=128 warps=2 stages=5 indexing=pointer Ktile=128 ncol=4 layout=lo1", "category": "grid", "expected_gain": "unknown", "decision": "COMPILE_FAIL", "tflops": 0.0, "timestamp": "2026-04-21T14:42:51Z"}
{"round": 527, "iter": "iter527", "bottleneck": "compile", "idea": "iter527_autogrid: BM=64 BN=128 warps=2 stages=5 indexing=block_ptr Ktile=32 ncol=1 layout=mnk", "category": "grid", "expected_gain": "unknown", "decision": "COMPILE_FAIL", "tflops": 0.0, "timestamp": "2026-04-21T14:42:56Z"}
{"round": 528, "iter": "iter528", "bottleneck": "compile", "idea": "iter528_autogrid: BM=64 BN=128 warps=2 stages=5 indexing=block_ptr Ktile=32 ncol=1 layout=lo1", "category": "grid", "expected_gain": "unknown", "decision": "COMPILE_FAIL", "tflops": 0.0, "timestamp": "2026-04-21T14:43:00Z"}
{"round": 529, "iter": "iter529", "bottleneck": "compile", "idea": "iter529_autogrid: BM=64 BN=128 warps=2 stages=5 indexing=block_ptr Ktile=64 ncol=2 layout=mnk", "category": "grid", "expected_gain": "unknown", "decision": "COMPILE_FAIL", "tflops": 0.0, "timestamp": "2026-04-21T14:43:04Z"}
{"round": 530, "iter": "iter530", "bottleneck": "compile", "idea": "iter530_autogrid: BM=64 BN=128 warps=2 stages=5 indexing=block_ptr Ktile=64 ncol=2 layout=lo1", "category": "grid", "expected_gain": "unknown", "decision": "COMPILE_FAIL", "tflops": 0.0, "timestamp": "2026-04-21T14:43:08Z"}
{"round": 531, "iter": "iter531", "bottleneck": "compile", "idea": "iter531_autogrid: BM=64 BN=128 warps=2 stages=5 indexing=block_ptr Ktile=128 ncol=4 layout=mnk", "category": "grid", "expected_gain": "unknown", "decision": "COMPILE_FAIL", "tflops": 0.0, "timestamp": "2026-04-21T14:43:13Z"}
{"round": 532, "iter": "iter532", "bottleneck": "compile", "idea": "iter532_autogrid: BM=64 BN=128 warps=2 stages=5 indexing=block_ptr Ktile=128 ncol=4 layout=lo1", "category": "grid", "expected_gain": "unknown", "decision": "COMPILE_FAIL", "tflops": 0.0, "timestamp": "2026-04-21T14:43:17Z"}
{"round": 533, "iter": "iter533", "bottleneck": "compile", "idea": "iter533_autogrid: BM=64 BN=128 warps=2 stages=6 indexing=pointer Ktile=32 ncol=1 layout=mnk", "category": "grid", "expected_gain": "unknown", "decision": "COMPILE_FAIL", "tflops": 0.0, "timestamp": "2026-04-21T14:43:21Z"}
{"round": 534, "iter": "iter534", "bottleneck": "compile", "idea": "iter534_autogrid: BM=64 BN=128 warps=2 stages=6 indexing=pointer Ktile=32 ncol=1 layout=lo1", "category": "grid", "expected_gain": "unknown", "decision": "COMPILE_FAIL", "tflops": 0.0, "timestamp": "2026-04-21T14:43:25Z"}
{"round": 535, "iter": "iter535", "bottleneck": "compile", "idea": "iter535_autogrid: BM=64 BN=128 warps=2 stages=6 indexing=pointer Ktile=64 ncol=2 layout=mnk", "category": "grid", "expected_gain": "unknown", "decision": "COMPILE_FAIL", "tflops": 0.0, "timestamp": "2026-04-21T14:43:29Z"}
{"round": 536, "iter": "iter536", "bottleneck": "compile", "idea": "iter536_autogrid: BM=64 BN=128 warps=2 stages=6 indexing=pointer Ktile=64 ncol=2 layout=lo1", "category": "grid", "expected_gain": "unknown", "decision": "COMPILE_FAIL", "tflops": 0.0, "timestamp": "2026-04-21T14:43:33Z"}
{"round": 537, "iter": "iter537", "bottleneck": "compile", "idea": "iter537_autogrid: BM=64 BN=128 warps=2 stages=6 indexing=pointer Ktile=128 ncol=4 layout=mnk", "category": "grid", "expected_gain": "unknown", "decision": "COMPILE_FAIL", "tflops": 0.0, "timestamp": "2026-04-21T14:43:37Z"}
{"round": 538, "iter": "iter538", "bottleneck": "compile", "idea": "iter538_autogrid: BM=64 BN=128 warps=2 stages=6 indexing=pointer Ktile=128 ncol=4 layout=lo1", "category": "grid", "expected_gain": "unknown", "decision": "COMPILE_FAIL", "tflops": 0.0, "timestamp": "2026-04-21T14:43:42Z"}
{"round": 539, "iter": "iter539", "bottleneck": "compile", "idea": "iter539_autogrid: BM=64 BN=128 warps=2 stages=6 indexing=block_ptr Ktile=32 ncol=1 layout=mnk", "category": "grid", "expected_gain": "unknown", "decision": "COMPILE_FAIL", "tflops": 0.0, "timestamp": "2026-04-21T14:43:46Z"}
{"round": 540, "iter": "iter540", "bottleneck": "compile", "idea": "iter540_autogrid: BM=64 BN=128 warps=2 stages=6 indexing=block_ptr Ktile=32 ncol=1 layout=lo1", "category": "grid", "expected_gain": "unknown", "decision": "COMPILE_FAIL", "tflops": 0.0, "timestamp": "2026-04-21T14:43:50Z"}
{"round": 541, "iter": "iter541", "bottleneck": "compile", "idea": "iter541_autogrid: BM=64 BN=128 warps=2 stages=6 indexing=block_ptr Ktile=64 ncol=2 layout=mnk", "category": "grid", "expected_gain": "unknown", "decision": "COMPILE_FAIL", "tflops": 0.0, "timestamp": "2026-04-21T14:43:55Z"}
{"round": 542, "iter": "iter542", "bottleneck": "compile", "idea": "iter542_autogrid: BM=64 BN=128 warps=2 stages=6 indexing=block_ptr Ktile=64 ncol=2 layout=lo1", "category": "grid", "expected_gain": "unknown", "decision": "COMPILE_FAIL", "tflops": 0.0, "timestamp": "2026-04-21T14:43:59Z"}
{"round": 543, "iter": "iter543", "bottleneck": "compile", "idea": "iter543_autogrid: BM=64 BN=128 warps=2 stages=6 indexing=block_ptr Ktile=128 ncol=4 layout=mnk", "category": "grid", "expected_gain": "unknown", "decision": "COMPILE_FAIL", "tflops": 0.0, "timestamp": "2026-04-21T14:44:03Z"}
{"round": 544, "iter": "iter544", "bottleneck": "compile", "idea": "iter544_autogrid: BM=64 BN=128 warps=2 stages=6 indexing=block_ptr Ktile=128 ncol=4 layout=lo1", "category": "grid", "expected_gain": "unknown", "decision": "COMPILE_FAIL", "tflops": 0.0, "timestamp": "2026-04-21T14:44:07Z"}
{"round": 545, "iter": "iter545", "bottleneck": "compile", "idea": "iter545_autogrid: BM=64 BN=128 warps=4 stages=3 indexing=pointer Ktile=32 ncol=1 layout=mnk", "category": "grid", "expected_gain": "unknown", "decision": "COMPILE_FAIL", "tflops": 0.0, "timestamp": "2026-04-21T14:44:11Z"}
{"round": 546, "iter": "iter546", "bottleneck": "compile", "idea": "iter546_autogrid: BM=64 BN=128 warps=4 stages=3 indexing=pointer Ktile=32 ncol=1 layout=lo1", "category": "grid", "expected_gain": "unknown", "decision": "COMPILE_FAIL", "tflops": 0.0, "timestamp": "2026-04-21T14:44:16Z"}
{"round": 547, "iter": "iter547", "bottleneck": "compile", "idea": "iter547_autogrid: BM=64 BN=128 warps=4 stages=3 indexing=pointer Ktile=64 ncol=2 layout=mnk", "category": "grid", "expected_gain": "unknown", "decision": "COMPILE_FAIL", "tflops": 0.0, "timestamp": "2026-04-21T14:44:20Z"}
{"round": 548, "iter": "iter548", "bottleneck": "compile", "idea": "iter548_autogrid: BM=64 BN=128 warps=4 stages=3 indexing=pointer Ktile=64 ncol=2 layout=lo1", "category": "grid", "expected_gain": "unknown", "decision": "COMPILE_FAIL", "tflops": 0.0, "timestamp": "2026-04-21T14:44:24Z"}
{"round": 549, "iter": "iter549", "bottleneck": "compile", "idea": "iter549_autogrid: BM=64 BN=128 warps=4 stages=3 indexing=pointer Ktile=128 ncol=4 layout=mnk", "category": "grid", "expected_gain": "unknown", "decision": "COMPILE_FAIL", "tflops": 0.0, "timestamp": "2026-04-21T14:44:28Z"}
{"round": 550, "iter": "iter550", "bottleneck": "compile", "idea": "iter550_autogrid: BM=64 BN=128 warps=4 stages=3 indexing=pointer Ktile=128 ncol=4 layout=lo1", "category": "grid", "expected_gain": "unknown", "decision": "COMPILE_FAIL", "tflops": 0.0, "timestamp": "2026-04-21T14:44:33Z"}
{"round": 551, "iter": "iter551", "bottleneck": "compile", "idea": "iter551_autogrid: BM=64 BN=128 warps=4 stages=3 indexing=block_ptr Ktile=32 ncol=1 layout=mnk", "category": "grid", "expected_gain": "unknown", "decision": "COMPILE_FAIL", "tflops": 0.0, "timestamp": "2026-04-21T14:44:37Z"}
{"round": 552, "iter": "iter552", "bottleneck": "compile", "idea": "iter552_autogrid: BM=64 BN=128 warps=4 stages=3 indexing=block_ptr Ktile=32 ncol=1 layout=lo1", "category": "grid", "expected_gain": "unknown", "decision": "COMPILE_FAIL", "tflops": 0.0, "timestamp": "2026-04-21T14:44:41Z"}
{"round": 553, "iter": "iter553", "bottleneck": "compile", "idea": "iter553_autogrid: BM=64 BN=128 warps=4 stages=3 indexing=block_ptr Ktile=64 ncol=2 layout=mnk", "category": "grid", "expected_gain": "unknown", "decision": "COMPILE_FAIL", "tflops": 0.0, "timestamp": "2026-04-21T14:44:45Z"}
{"round": 554, "iter": "iter554", "bottleneck": "compile", "idea": "iter554_autogrid: BM=64 BN=128 warps=4 stages=3 indexing=block_ptr Ktile=64 ncol=2 layout=lo1", "category": "grid", "expected_gain": "unknown", "decision": "COMPILE_FAIL", "tflops": 0.0, "timestamp": "2026-04-21T14:44:50Z"}
{"round": 555, "iter": "iter555", "bottleneck": "compile", "idea": "iter555_autogrid: BM=64 BN=128 warps=4 stages=3 indexing=block_ptr Ktile=128 ncol=4 layout=mnk", "category": "grid", "expected_gain": "unknown", "decision": "COMPILE_FAIL", "tflops": 0.0, "timestamp": "2026-04-21T14:44:54Z"}
{"round": 556, "iter": "iter556", "bottleneck": "compile", "idea": "iter556_autogrid: BM=64 BN=128 warps=4 stages=3 indexing=block_ptr Ktile=128 ncol=4 layout=lo1", "category": "grid", "expected_gain": "unknown", "decision": "COMPILE_FAIL", "tflops": 0.0, "timestamp": "2026-04-21T14:44:58Z"}
{"round": 557, "iter": "iter557", "bottleneck": "compile", "idea": "iter557_autogrid: BM=64 BN=128 warps=4 stages=4 indexing=pointer Ktile=32 ncol=1 layout=mnk", "category": "grid", "expected_gain": "unknown", "decision": "COMPILE_FAIL", "tflops": 0.0, "timestamp": "2026-04-21T14:45:02Z"}
{"round": 558, "iter": "iter558", "bottleneck": "compile", "idea": "iter558_autogrid: BM=64 BN=128 warps=4 stages=4 indexing=pointer Ktile=32 ncol=1 layout=lo1", "category": "grid", "expected_gain": "unknown", "decision": "COMPILE_FAIL", "tflops": 0.0, "timestamp": "2026-04-21T14:45:07Z"}
{"round": 559, "iter": "iter559", "bottleneck": "compile", "idea": "iter559_autogrid: BM=64 BN=128 warps=4 stages=4 indexing=pointer Ktile=64 ncol=2 layout=mnk", "category": "grid", "expected_gain": "unknown", "decision": "COMPILE_FAIL", "tflops": 0.0, "timestamp": "2026-04-21T14:45:11Z"}
{"round": 560, "iter": "iter560", "bottleneck": "compile", "idea": "iter560_autogrid: BM=64 BN=128 warps=4 stages=4 indexing=pointer Ktile=64 ncol=2 layout=lo1", "category": "grid", "expected_gain": "unknown", "decision": "COMPILE_FAIL", "tflops": 0.0, "timestamp": "2026-04-21T14:45:15Z"}
{"round": 561, "iter": "iter561", "bottleneck": "compile", "idea": "iter561_autogrid: BM=64 BN=128 warps=4 stages=4 indexing=pointer Ktile=128 ncol=4 layout=mnk", "category": "grid", "expected_gain": "unknown", "decision": "COMPILE_FAIL", "tflops": 0.0, "timestamp": "2026-04-21T14:45:19Z"}
