{"round": 637, "iter": "iter637", "bottleneck": "compile", "idea": "iter637_autogrid: BM=64 BN=128 warps=8 stages=6 indexing=block_ptr Ktile=64 ncol=2 layout=mnk", "category": "grid", "expected_gain": "unknown", "decision": "COMPILE_FAIL", "tflops": 0.0, "timestamp": "2026-04-21T14:50:34Z"}
{"round": 638, "iter": "iter638", "bottleneck": "compile", "idea": "iter638_autogrid: BM=64 BN=128 warps=8 stages=6 indexing=block_ptr Ktile=64 ncol=2 layout=lo1", "category": "grid", "expected_gain": "unknown", "decision": "COMPILE_FAIL", "tflops": 0.0, "timestamp": "2026-04-21T14:50:38Z"}
{"round": 639, "iter": "iter639", "bottleneck": "compile", "idea": "iter639_autogrid: BM=64 BN=128 warps=8 stages=6 indexing=block_ptr Ktile=128 ncol=4 layout=mnk", "category": "grid", "expected_gain": "unknown", "decision": "COMPILE_FAIL", "tflops": 0.0, "timestamp": "2026-04-21T14:50:42Z"}
{"round": 640, "iter": "iter640", "bottleneck": "compile", "idea": "iter640_autogrid: BM=64 BN=128 warps=8 stages=6 indexing=block_ptr Ktile=128 ncol=4 layout=lo1", "category": "grid", "expected_gain": "unknown", "decision": "COMPILE_FAIL", "tflops": 0.0, "timestamp": "2026-04-21T14:50:45Z"}
{"round": 641, "iter": "iter641", "bottleneck": "compile", "idea": "iter641_autogrid: BM=128 BN=64 warps=2 stages=3 indexing=pointer Ktile=32 ncol=1 layout=mnk", "category": "grid", "expected_gain": "unknown", "decision": "COMPILE_FAIL", "tflops": 0.0, "timestamp": "2026-04-21T14:50:50Z"}
{"round": 642, "iter": "iter642", "bottleneck": "compile", "idea": "iter642_autogrid: BM=128 BN=64 warps=2 stages=3 indexing=pointer Ktile=32 ncol=1 layout=lo1", "category": "grid", "expected_gain": "unknown", "decision": "COMPILE_FAIL", "tflops": 0.0, "timestamp": "2026-04-21T14:50:54Z"}
{"round": 643, "iter": "iter643", "bottleneck": "compile", "idea": "iter643_autogrid: BM=128 BN=64 warps=2 stages=3 indexing=pointer Ktile=64 ncol=2 layout=mnk", "category": "grid", "expected_gain": "unknown", "decision": "COMPILE_FAIL", "tflops": 0.0, "timestamp": "2026-04-21T14:50:57Z"}
{"round": 644, "iter": "iter644", "bottleneck": "compile", "idea": "iter644_autogrid: BM=128 BN=64 warps=2 stages=3 indexing=pointer Ktile=64 ncol=2 layout=lo1", "category": "grid", "expected_gain": "unknown", "decision": "COMPILE_FAIL", "tflops": 0.0, "timestamp": "2026-04-21T14:51:02Z"}
{"round": 645, "iter": "iter645", "bottleneck": "compile", "idea": "iter645_autogrid: BM=128 BN=64 warps=2 stages=3 indexing=pointer Ktile=128 ncol=4 layout=mnk", "category": "grid", "expected_gain": "unknown", "decision": "COMPILE_FAIL", "tflops": 0.0, "timestamp": "2026-04-21T14:51:06Z"}
{"round": 646, "iter": "iter646", "bottleneck": "compile", "idea": "iter646_autogrid: BM=128 BN=64 warps=2 stages=3 indexing=pointer Ktile=128 ncol=4 layout=lo1", "category": "grid", "expected_gain": "unknown", "decision": "COMPILE_FAIL", "tflops": 0.0, "timestamp": "2026-04-21T14:51:10Z"}
{"round": 647, "iter": "iter647", "bottleneck": "compile", "idea": "iter647_autogrid: BM=128 BN=64 warps=2 stages=3 indexing=block_ptr Ktile=32 ncol=1 layout=mnk", "category": "grid", "expected_gain": "unknown", "decision": "COMPILE_FAIL", "tflops": 0.0, "timestamp": "2026-04-21T14:51:14Z"}
{"round": 648, "iter": "iter648", "bottleneck": "compile", "idea": "iter648_autogrid: BM=128 BN=64 warps=2 stages=3 indexing=block_ptr Ktile=32 ncol=1 layout=lo1", "category": "grid", "expected_gain": "unknown", "decision": "COMPILE_FAIL", "tflops": 0.0, "timestamp": "2026-04-21T14:51:19Z"}
{"round": 649, "iter": "iter649", "bottleneck": "compile", "idea": "iter649_autogrid: BM=128 BN=64 warps=2 stages=3 indexing=block_ptr Ktile=64 ncol=2 layout=mnk", "category": "grid", "expected_gain": "unknown", "decision": "COMPILE_FAIL", "tflops": 0.0, "timestamp": "2026-04-21T14:51:22Z"}
{"round": 650, "iter": "iter650", "bottleneck": "compile", "idea": "iter650_autogrid: BM=128 BN=64 warps=2 stages=3 indexing=block_ptr Ktile=64 ncol=2 layout=lo1", "category": "grid", "expected_gain": "unknown", "decision": "COMPILE_FAIL", "tflops": 0.0, "timestamp": "2026-04-21T14:51:27Z"}
{"round": 651, "iter": "iter651", "bottleneck": "compile", "idea": "iter651_autogrid: BM=128 BN=64 warps=2 stages=3 indexing=block_ptr Ktile=128 ncol=4 layout=mnk", "category": "grid", "expected_gain": "unknown", "decision": "COMPILE_FAIL", "tflops": 0.0, "timestamp": "2026-04-21T14:51:31Z"}
{"round": 652, "iter": "iter652", "bottleneck": "compile", "idea": "iter652_autogrid: BM=128 BN=64 warps=2 stages=3 indexing=block_ptr Ktile=128 ncol=4 layout=lo1", "category": "grid", "expected_gain": "unknown", "decision": "COMPILE_FAIL", "tflops": 0.0, "timestamp": "2026-04-21T14:51:35Z"}
{"round": 653, "iter": "iter653", "bottleneck": "compile", "idea": "iter653_autogrid: BM=128 BN=64 warps=2 stages=4 indexing=pointer Ktile=32 ncol=1 layout=mnk", "category": "grid", "expected_gain": "unknown", "decision": "COMPILE_FAIL", "tflops": 0.0, "timestamp": "2026-04-21T14:51:39Z"}
{"round": 654, "iter": "iter654", "bottleneck": "compile", "idea": "iter654_autogrid: BM=128 BN=64 warps=2 stages=4 indexing=pointer Ktile=32 ncol=1 layout=lo1", "category": "grid", "expected_gain": "unknown", "decision": "COMPILE_FAIL", "tflops": 0.0, "timestamp": "2026-04-21T14:51:43Z"}
{"round": 655, "iter": "iter655", "bottleneck": "compile", "idea": "iter655_autogrid: BM=128 BN=64 warps=2 stages=4 indexing=pointer Ktile=64 ncol=2 layout=mnk", "category": "grid", "expected_gain": "unknown", "decision": "COMPILE_FAIL", "tflops": 0.0, "timestamp": "2026-04-21T14:51:47Z"}
{"round": 656, "iter": "iter656", "bottleneck": "compile", "idea": "iter656_autogrid: BM=128 BN=64 warps=2 stages=4 indexing=pointer Ktile=64 ncol=2 layout=lo1", "category": "grid", "expected_gain": "unknown", "decision": "COMPILE_FAIL", "tflops": 0.0, "timestamp": "2026-04-21T14:51:51Z"}
{"round": 657, "iter": "iter657", "bottleneck": "compile", "idea": "iter657_autogrid: BM=128 BN=64 warps=2 stages=4 indexing=pointer Ktile=128 ncol=4 layout=mnk", "category": "grid", "expected_gain": "unknown", "decision": "COMPILE_FAIL", "tflops": 0.0, "timestamp": "2026-04-21T14:51:55Z"}
{"round": 658, "iter": "iter658", "bottleneck": "compile", "idea": "iter658_autogrid: BM=128 BN=64 warps=2 stages=4 indexing=pointer Ktile=128 ncol=4 layout=lo1", "category": "grid", "expected_gain": "unknown", "decision": "COMPILE_FAIL", "tflops": 0.0, "timestamp": "2026-04-21T14:52:00Z"}
{"round": 659, "iter": "iter659", "bottleneck": "compile", "idea": "iter659_autogrid: BM=128 BN=64 warps=2 stages=4 indexing=block_ptr Ktile=32 ncol=1 layout=mnk", "category": "grid", "expected_gain": "unknown", "decision": "COMPILE_FAIL", "tflops": 0.0, "timestamp": "2026-04-21T14:52:03Z"}
{"round": 660, "iter": "iter660", "bottleneck": "compile", "idea": "iter660_autogrid: BM=128 BN=64 warps=2 stages=4 indexing=block_ptr Ktile=32 ncol=1 layout=lo1", "category": "grid", "expected_gain": "unknown", "decision": "COMPILE_FAIL", "tflops": 0.0, "timestamp": "2026-04-21T14:52:07Z"}
{"round": 661, "iter": "iter661", "bottleneck": "compile", "idea": "iter661_autogrid: BM=128 BN=64 warps=2 stages=4 indexing=block_ptr Ktile=64 ncol=2 layout=mnk", "category": "grid", "expected_gain": "unknown", "decision": "COMPILE_FAIL", "tflops": 0.0, "timestamp": "2026-04-21T14:52:12Z"}
{"round": 662, "iter": "iter662", "bottleneck": "compile", "idea": "iter662_autogrid: BM=128 BN=64 warps=2 stages=4 indexing=block_ptr Ktile=64 ncol=2 layout=lo1", "category": "grid", "expected_gain": "unknown", "decision": "COMPILE_FAIL", "tflops": 0.0, "timestamp": "2026-04-21T14:52:16Z"}
{"round": 663, "iter": "iter663", "bottleneck": "compile", "idea": "iter663_autogrid: BM=128 BN=64 warps=2 stages=4 indexing=block_ptr Ktile=128 ncol=4 layout=mnk", "category": "grid", "expected_gain": "unknown", "decision": "COMPILE_FAIL", "tflops": 0.0, "timestamp": "2026-04-21T14:52:21Z"}
{"round": 664, "iter": "iter664", "bottleneck": "compile", "idea": "iter664_autogrid: BM=128 BN=64 warps=2 stages=4 indexing=block_ptr Ktile=128 ncol=4 layout=lo1", "category": "grid", "expected_gain": "unknown", "decision": "COMPILE_FAIL", "tflops": 0.0, "timestamp": "2026-04-21T14:52:25Z"}
{"round": 665, "iter": "iter665", "bottleneck": "compile", "idea": "iter665_autogrid: BM=128 BN=64 warps=2 stages=5 indexing=pointer Ktile=32 ncol=1 layout=mnk", "category": "grid", "expected_gain": "unknown", "decision": "COMPILE_FAIL", "tflops": 0.0, "timestamp": "2026-04-21T14:52:29Z"}
{"round": 666, "iter": "iter666", "bottleneck": "compile", "idea": "iter666_autogrid: BM=128 BN=64 warps=2 stages=5 indexing=pointer Ktile=32 ncol=1 layout=lo1", "category": "grid", "expected_gain": "unknown", "decision": "COMPILE_FAIL", "tflops": 0.0, "timestamp": "2026-04-21T14:52:33Z"}
{"round": 667, "iter": "iter667", "bottleneck": "compile", "idea": "iter667_autogrid: BM=128 BN=64 warps=2 stages=5 indexing=pointer Ktile=64 ncol=2 layout=mnk", "category": "grid", "expected_gain": "unknown", "decision": "COMPILE_FAIL", "tflops": 0.0, "timestamp": "2026-04-21T14:52:37Z"}
{"round": 668, "iter": "iter668", "bottleneck": "compile", "idea": "iter668_autogrid: BM=128 BN=64 warps=2 stages=5 indexing=pointer Ktile=64 ncol=2 layout=lo1", "category": "grid", "expected_gain": "unknown", "decision": "COMPILE_FAIL", "tflops": 0.0, "timestamp": "2026-04-21T14:52:42Z"}
{"round": 669, "iter": "iter669", "bottleneck": "compile", "idea": "iter669_autogrid: BM=128 BN=64 warps=2 stages=5 indexing=pointer Ktile=128 ncol=4 layout=mnk", "category": "grid", "expected_gain": "unknown", "decision": "COMPILE_FAIL", "tflops": 0.0, "timestamp": "2026-04-21T14:52:46Z"}
{"round": 670, "iter": "iter670", "bottleneck": "compile", "idea": "iter670_autogrid: BM=128 BN=64 warps=2 stages=5 indexing=pointer Ktile=128 ncol=4 layout=lo1", "category": "grid", "expected_gain": "unknown", "decision": "COMPILE_FAIL", "tflops": 0.0, "timestamp": "2026-04-21T14:52:50Z"}
{"round": 671, "iter": "iter671", "bottleneck": "compile", "idea": "iter671_autogrid: BM=128 BN=64 warps=2 stages=5 indexing=block_ptr Ktile=32 ncol=1 layout=mnk", "category": "grid", "expected_gain": "unknown", "decision": "COMPILE_FAIL", "tflops": 0.0, "timestamp": "2026-04-21T14:52:54Z"}
{"round": 672, "iter": "iter672", "bottleneck": "compile", "idea": "iter672_autogrid: BM=128 BN=64 warps=2 stages=5 indexing=block_ptr Ktile=32 ncol=1 layout=lo1", "category": "grid", "expected_gain": "unknown", "decision": "COMPILE_FAIL", "tflops": 0.0, "timestamp": "2026-04-21T14:52:58Z"}
{"round": 673, "iter": "iter673", "bottleneck": "compile", "idea": "iter673_autogrid: BM=128 BN=64 warps=2 stages=5 indexing=block_ptr Ktile=64 ncol=2 layout=mnk", "category": "grid", "expected_gain": "unknown", "decision": "COMPILE_FAIL", "tflops": 0.0, "timestamp": "2026-04-21T14:53:02Z"}
{"round": 674, "iter": "iter674", "bottleneck": "compile", "idea": "iter674_autogrid: BM=128 BN=64 warps=2 stages=5 indexing=block_ptr Ktile=64 ncol=2 layout=lo1", "category": "grid", "expected_gain": "unknown", "decision": "COMPILE_FAIL", "tflops": 0.0, "timestamp": "2026-04-21T14:53:06Z"}
{"round": 675, "iter": "iter675", "bottleneck": "compile", "idea": "iter675_autogrid: BM=128 BN=64 warps=2 stages=5 indexing=block_ptr Ktile=128 ncol=4 layout=mnk", "category": "grid", "expected_gain": "unknown", "decision": "COMPILE_FAIL", "tflops": 0.0, "timestamp": "2026-04-21T14:53:10Z"}
{"round": 676, "iter": "iter676", "bottleneck": "compile", "idea": "iter676_autogrid: BM=128 BN=64 warps=2 stages=5 indexing=block_ptr Ktile=128 ncol=4 layout=lo1", "category": "grid", "expected_gain": "unknown", "decision": "COMPILE_FAIL", "tflops": 0.0, "timestamp": "2026-04-21T14:53:15Z"}
{"round": 677, "iter": "iter677", "bottleneck": "compile", "idea": "iter677_autogrid: BM=128 BN=64 warps=2 stages=6 indexing=pointer Ktile=32 ncol=1 layout=mnk", "category": "grid", "expected_gain": "unknown", "decision": "COMPILE_FAIL", "tflops": 0.0, "timestamp": "2026-04-21T14:53:19Z"}
{"round": 678, "iter": "iter678", "bottleneck": "compile", "idea": "iter678_autogrid: BM=128 BN=64 warps=2 stages=6 indexing=pointer Ktile=32 ncol=1 layout=lo1", "category": "grid", "expected_gain": "unknown", "decision": "COMPILE_FAIL", "tflops": 0.0, "timestamp": "2026-04-21T14:53:23Z"}
{"round": 679, "iter": "iter679", "bottleneck": "compile", "idea": "iter679_autogrid: BM=128 BN=64 warps=2 stages=6 indexing=pointer Ktile=64 ncol=2 layout=mnk", "category": "grid", "expected_gain": "unknown", "decision": "COMPILE_FAIL", "tflops": 0.0, "timestamp": "2026-04-21T14:53:28Z"}
{"round": 680, "iter": "iter680", "bottleneck": "compile", "idea": "iter680_autogrid: BM=128 BN=64 warps=2 stages=6 indexing=pointer Ktile=64 ncol=2 layout=lo1", "category": "grid", "expected_gain": "unknown", "decision": "COMPILE_FAIL", "tflops": 0.0, "timestamp": "2026-04-21T14:53:32Z"}
{"round": 681, "iter": "iter681", "bottleneck": "compile", "idea": "iter681_autogrid: BM=128 BN=64 warps=2 stages=6 indexing=pointer Ktile=128 ncol=4 layout=mnk", "category": "grid", "expected_gain": "unknown", "decision": "COMPILE_FAIL", "tflops": 0.0, "timestamp": "2026-04-21T14:53:36Z"}
{"round": 682, "iter": "iter682", "bottleneck": "compile", "idea": "iter682_autogrid: BM=128 BN=64 warps=2 stages=6 indexing=pointer Ktile=128 ncol=4 layout=lo1", "category": "grid", "expected_gain": "unknown", "decision": "COMPILE_FAIL", "tflops": 0.0, "timestamp": "2026-04-21T14:53:41Z"}
{"round": 683, "iter": "iter683", "bottleneck": "compile", "idea": "iter683_autogrid: BM=128 BN=64 warps=2 stages=6 indexing=block_ptr Ktile=32 ncol=1 layout=mnk", "category": "grid", "expected_gain": "unknown", "decision": "COMPILE_FAIL", "tflops": 0.0, "timestamp": "2026-04-21T14:53:45Z"}
{"round": 684, "iter": "iter684", "bottleneck": "compile", "idea": "iter684_autogrid: BM=128 BN=64 warps=2 stages=6 indexing=block_ptr Ktile=32 ncol=1 layout=lo1", "category": "grid", "expected_gain": "unknown", "decision": "COMPILE_FAIL", "tflops": 0.0, "timestamp": "2026-04-21T14:53:49Z"}
{"round": 685, "iter": "iter685", "bottleneck": "compile", "idea": "iter685_autogrid: BM=128 BN=64 warps=2 stages=6 indexing=block_ptr Ktile=64 ncol=2 layout=mnk", "category": "grid", "expected_gain": "unknown", "decision": "COMPILE_FAIL", "tflops": 0.0, "timestamp": "2026-04-21T14:53:53Z"}
{"round": 686, "iter": "iter686", "bottleneck": "compile", "idea": "iter686_autogrid: BM=128 BN=64 warps=2 stages=6 indexing=block_ptr Ktile=64 ncol=2 layout=lo1", "category": "grid", "expected_gain": "unknown", "decision": "COMPILE_FAIL", "tflops": 0.0, "timestamp": "2026-04-21T14:53:57Z"}
{"round": 687, "iter": "iter687", "bottleneck": "compile", "idea": "iter687_autogrid: BM=128 BN=64 warps=2 stages=6 indexing=block_ptr Ktile=128 ncol=4 layout=mnk", "category": "grid", "expected_gain": "unknown", "decision": "COMPILE_FAIL", "tflops": 0.0, "timestamp": "2026-04-21T14:54:01Z"}
{"round": 688, "iter": "iter688", "bottleneck": "compile", "idea": "iter688_autogrid: BM=128 BN=64 warps=2 stages=6 indexing=block_ptr Ktile=128 ncol=4 layout=lo1", "category": "grid", "expected_gain": "unknown", "decision": "COMPILE_FAIL", "tflops": 0.0, "timestamp": "2026-04-21T14:54:06Z"}
{"round": 689, "iter": "iter689", "bottleneck": "compile", "idea": "iter689_autogrid: BM=128 BN=64 warps=4 stages=3 indexing=pointer Ktile=32 ncol=1 layout=mnk", "category": "grid", "expected_gain": "unknown", "decision": "COMPILE_FAIL", "tflops": 0.0, "timestamp": "2026-04-21T14:54:09Z"}
{"round": 690, "iter": "iter690", "bottleneck": "compile", "idea": "iter690_autogrid: BM=128 BN=64 warps=4 stages=3 indexing=pointer Ktile=32 ncol=1 layout=lo1", "category": "grid", "expected_gain": "unknown", "decision": "COMPILE_FAIL", "tflops": 0.0, "timestamp": "2026-04-21T14:54:14Z"}
{"round": 691, "iter": "iter691", "bottleneck": "compile", "idea": "iter691_autogrid: BM=128 BN=64 warps=4 stages=3 indexing=pointer Ktile=64 ncol=2 layout=mnk", "category": "grid", "expected_gain": "unknown", "decision": "COMPILE_FAIL", "tflops": 0.0, "timestamp": "2026-04-21T14:54:18Z"}
{"round": 692, "iter": "iter692", "bottleneck": "compile", "idea": "iter692_autogrid: BM=128 BN=64 warps=4 stages=3 indexing=pointer Ktile=64 ncol=2 layout=lo1", "category": "grid", "expected_gain": "unknown", "decision": "COMPILE_FAIL", "tflops": 0.0, "timestamp": "2026-04-21T14:54:22Z"}
{"round": 693, "iter": "iter693", "bottleneck": "compile", "idea": "iter693_autogrid: BM=128 BN=64 warps=4 stages=3 indexing=pointer Ktile=128 ncol=4 layout=mnk", "category": "grid", "expected_gain": "unknown", "decision": "COMPILE_FAIL", "tflops": 0.0, "timestamp": "2026-04-21T14:54:26Z"}
{"round": 694, "iter": "iter694", "bottleneck": "compile", "idea": "iter694_autogrid: BM=128 BN=64 warps=4 stages=3 indexing=pointer Ktile=128 ncol=4 layout=lo1", "category": "grid", "expected_gain": "unknown", "decision": "COMPILE_FAIL", "tflops": 0.0, "timestamp": "2026-04-21T14:54:30Z"}
{"round": 695, "iter": "iter695", "bottleneck": "compile", "idea": "iter695_autogrid: BM=128 BN=64 warps=4 stages=3 indexing=block_ptr Ktile=32 ncol=1 layout=mnk", "category": "grid", "expected_gain": "unknown", "decision": "COMPILE_FAIL", "tflops": 0.0, "timestamp": "2026-04-21T14:54:34Z"}
{"round": 696, "iter": "iter696", "bottleneck": "compile", "idea": "iter696_autogrid: BM=128 BN=64 warps=4 stages=3 indexing=block_ptr Ktile=32 ncol=1 layout=lo1", "category": "grid", "expected_gain": "unknown", "decision": "COMPILE_FAIL", "tflops": 0.0, "timestamp": "2026-04-21T14:54:39Z"}
{"round": 697, "iter": "iter697", "bottleneck": "compile", "idea": "iter697_autogrid: BM=128 BN=64 warps=4 stages=3 indexing=block_ptr Ktile=64 ncol=2 layout=mnk", "category": "grid", "expected_gain": "unknown", "decision": "COMPILE_FAIL", "tflops": 0.0, "timestamp": "2026-04-21T14:54:43Z"}
{"round": 698, "iter": "iter698", "bottleneck": "compile", "idea": "iter698_autogrid: BM=128 BN=64 warps=4 stages=3 indexing=block_ptr Ktile=64 ncol=2 layout=lo1", "category": "grid", "expected_gain": "unknown", "decision": "COMPILE_FAIL", "tflops": 0.0, "timestamp": "2026-04-21T14:54:47Z"}
{"round": 699, "iter": "iter699", "bottleneck": "compile", "idea": "iter699_autogrid: BM=128 BN=64 warps=4 stages=3 indexing=block_ptr Ktile=128 ncol=4 layout=mnk", "category": "grid", "expected_gain": "unknown", "decision": "COMPILE_FAIL", "tflops": 0.0, "timestamp": "2026-04-21T14:54:52Z"}
{"round": 700, "iter": "iter700", "bottleneck": "compile", "idea": "iter700_autogrid: BM=128 BN=64 warps=4 stages=3 indexing=block_ptr Ktile=128 ncol=4 layout=lo1", "category": "grid", "expected_gain": "unknown", "decision": "COMPILE_FAIL", "tflops": 0.0, "timestamp": "2026-04-21T14:54:56Z"}
{"round": 501, "iter": "iter501", "bottleneck": "compute_bound", "idea": "iter501_autogrid: BM=64 BN=128 warps=2 stages=3 indexing=pointer Ktile=128 ncol=4 layout=mnk", "category": "grid", "expected_gain": "unknown", "decision": "DISCARD", "tflops": 40.78, "timestamp": "2026-04-21T14:56:32Z"}
{"round": 502, "iter": "iter502", "bottleneck": "compute_bound", "idea": "iter502_autogrid: BM=64 BN=128 warps=2 stages=3 indexing=pointer Ktile=128 ncol=4 layout=lo1", "category": "grid", "expected_gain": "unknown", "decision": "DISCARD", "tflops": 36.58, "timestamp": "2026-04-21T14:56:41Z"}
{"round": 503, "iter": "iter503", "bottleneck": "compute_bound", "idea": "iter503_autogrid: BM=64 BN=128 warps=2 stages=3 indexing=block_ptr Ktile=32 ncol=1 layout=mnk", "category": "grid", "expected_gain": "unknown", "decision": "DISCARD", "tflops": 104.62, "timestamp": "2026-04-21T14:56:47Z"}
{"round": 504, "iter": "iter504", "bottleneck": "compute_bound", "idea": "iter504_autogrid: BM=64 BN=128 warps=2 stages=3 indexing=block_ptr Ktile=32 ncol=1 layout=lo1", "category": "grid", "expected_gain": "unknown", "decision": "DISCARD", "tflops": 104.46, "timestamp": "2026-04-21T14:56:53Z"}
{"round": 505, "iter": "iter505", "bottleneck": "compute_bound", "idea": "iter505_autogrid: BM=64 BN=128 warps=2 stages=3 indexing=block_ptr Ktile=64 ncol=2 layout=mnk", "category": "grid", "expected_gain": "unknown", "decision": "DISCARD", "tflops": 87.19, "timestamp": "2026-04-21T14:57:00Z"}
{"round": 506, "iter": "iter506", "bottleneck": "compute_bound", "idea": "iter506_autogrid: BM=64 BN=128 warps=2 stages=3 indexing=block_ptr Ktile=64 ncol=2 layout=lo1", "category": "grid", "expected_gain": "unknown", "decision": "DISCARD", "tflops": 87.68, "timestamp": "2026-04-21T14:57:06Z"}
{"round": 507, "iter": "iter507", "bottleneck": "compute_bound", "idea": "iter507_autogrid: BM=64 BN=128 warps=2 stages=3 indexing=block_ptr Ktile=128 ncol=4 layout=mnk", "category": "grid", "expected_gain": "unknown", "decision": "DISCARD", "tflops": 40.49, "timestamp": "2026-04-21T14:57:15Z"}
{"round": 508, "iter": "iter508", "bottleneck": "compute_bound", "idea": "iter508_autogrid: BM=64 BN=128 warps=2 stages=3 indexing=block_ptr Ktile=128 ncol=4 layout=lo1", "category": "grid", "expected_gain": "unknown", "decision": "DISCARD", "tflops": 35.49, "timestamp": "2026-04-21T14:57:23Z"}
{"round": 509, "iter": "iter509", "bottleneck": "compute_bound", "idea": "iter509_autogrid: BM=64 BN=128 warps=2 stages=4 indexing=pointer Ktile=32 ncol=1 layout=mnk", "category": "grid", "expected_gain": "unknown", "decision": "DISCARD", "tflops": 104.47, "timestamp": "2026-04-21T14:57:29Z"}
{"round": 510, "iter": "iter510", "bottleneck": "compute_bound", "idea": "iter510_autogrid: BM=64 BN=128 warps=2 stages=4 indexing=pointer Ktile=32 ncol=1 layout=lo1", "category": "grid", "expected_gain": "unknown", "decision": "DISCARD", "tflops": 105.22, "timestamp": "2026-04-21T14:57:35Z"}
{"round": 511, "iter": "iter511", "bottleneck": "compute_bound", "idea": "iter511_autogrid: BM=64 BN=128 warps=2 stages=4 indexing=pointer Ktile=64 ncol=2 layout=mnk", "category": "grid", "expected_gain": "unknown", "decision": "DISCARD", "tflops": 87.68, "timestamp": "2026-04-21T14:57:42Z"}
