{"round": 0, "iter": "iter000", "bottleneck": "baseline", "idea": "cuBLAS reference baseline", "category": "baseline", "expected_gain": "baseline reference", "decision": "KEEP", "tflops": 453.5948, "timestamp": "2026-04-21T10:52:13Z"}
{"round": 1, "iter": "iter001", "bottleneck": "compute_bound", "idea": "Fused hl.tile([m,n]) with inner hl.tile(k,block_size=32); K-block dot_scaled accumulate fp32; 64x64 blocks pointer 4 warps 1 stage", "category": "tiling", "expected_gain": "unknown", "decision": "KEEP", "tflops": 74.83, "timestamp": "2026-04-21T12:13:25Z"}
{"round": 2, "iter": "iter002", "bottleneck": "compute_bound", "idea": "Widen fused MN tile to 128x128 while keeping K micro-tile 32 in inner hl.tile(k); improves tensor-core tile utilization", "category": "tiling", "expected_gain": "unknown", "decision": "KEEP", "tflops": 113.37, "timestamp": "2026-04-21T12:15:21Z"}
{"round": 3, "iter": "iter003", "bottleneck": "compute_bound", "idea": "num_warps=8 vs iter002 4 \u2014 reg/spill regression on 128-tile dot_scaled", "category": "warps", "expected_gain": "unknown", "decision": "DISCARD", "tflops": 50.9, "timestamp": "2026-04-21T12:15:56Z"}
{"round": 4, "iter": "iter004", "bottleneck": "compute_bound", "idea": "block_ptr indexing on iter002 layout; improves async/global path vs plain pointer", "category": "indexing", "expected_gain": "unknown", "decision": "KEEP", "tflops": 115.78, "timestamp": "2026-04-21T12:17:13Z"}
{"round": 5, "iter": "iter005", "bottleneck": "compute_bound", "idea": "iter005_autogrid: BM=64 BN=64 warps=4 stages=1 indexing=pointer", "category": "grid", "expected_gain": "unknown", "decision": "DISCARD", "tflops": 73.99, "timestamp": "2026-04-21T12:18:28Z"}
{"round": 6, "iter": "iter006", "bottleneck": "compute_bound", "idea": "iter006_autogrid: BM=64 BN=128 warps=4 stages=1 indexing=pointer", "category": "grid", "expected_gain": "unknown", "decision": "DISCARD", "tflops": 120.31, "timestamp": "2026-04-21T12:18:33Z"}
{"round": 7, "iter": "iter007", "bottleneck": "compute_bound", "idea": "iter007_autogrid: BM=128 BN=64 warps=4 stages=1 indexing=pointer", "category": "grid", "expected_gain": "unknown", "decision": "DISCARD", "tflops": 101.22, "timestamp": "2026-04-21T12:18:38Z"}
{"round": 8, "iter": "iter008", "bottleneck": "compute_bound", "idea": "iter008_autogrid: BM=128 BN=128 warps=4 stages=1 indexing=pointer", "category": "grid", "expected_gain": "unknown", "decision": "DISCARD", "tflops": 112.47, "timestamp": "2026-04-21T12:18:44Z"}
{"round": 9, "iter": "iter009", "bottleneck": "compute_bound", "idea": "iter009_autogrid: BM=128 BN=256 warps=4 stages=1 indexing=pointer", "category": "grid", "expected_gain": "unknown", "decision": "DISCARD", "tflops": 29.75, "timestamp": "2026-04-21T12:18:51Z"}
{"round": 10, "iter": "iter010", "bottleneck": "compute_bound", "idea": "iter010_autogrid: BM=256 BN=128 warps=4 stages=1 indexing=pointer", "category": "grid", "expected_gain": "unknown", "decision": "DISCARD", "tflops": 62.62, "timestamp": "2026-04-21T12:18:57Z"}
{"round": 11, "iter": "iter011", "bottleneck": "compute_bound", "idea": "iter011_autogrid: BM=256 BN=256 warps=4 stages=1 indexing=pointer", "category": "grid", "expected_gain": "unknown", "decision": "DISCARD", "tflops": 13.88, "timestamp": "2026-04-21T12:19:07Z"}
{"round": 12, "iter": "iter012", "bottleneck": "compute_bound", "idea": "iter012_autogrid: BM=64 BN=256 warps=4 stages=1 indexing=pointer", "category": "grid", "expected_gain": "unknown", "decision": "DISCARD", "tflops": 109.84, "timestamp": "2026-04-21T12:19:12Z"}
{"round": 11, "iter": "iter011", "bottleneck": "compute_bound", "idea": "iter011_autogrid: BM=256 BN=256 warps=4 stages=1 indexing=pointer", "category": "grid", "expected_gain": "unknown", "decision": "DISCARD", "tflops": 13.85, "timestamp": "2026-04-21T12:19:25Z"}
{"round": 12, "iter": "iter012", "bottleneck": "compute_bound", "idea": "iter012_autogrid: BM=64 BN=256 warps=4 stages=1 indexing=pointer", "category": "grid", "expected_gain": "unknown", "decision": "DISCARD", "tflops": 109.86, "timestamp": "2026-04-21T12:19:31Z"}
{"round": 13, "iter": "iter013", "bottleneck": "compute_bound", "idea": "iter013_autogrid: BM=256 BN=64 warps=4 stages=1 indexing=pointer", "category": "grid", "expected_gain": "unknown", "decision": "DISCARD", "tflops": 91.06, "timestamp": "2026-04-21T12:19:36Z"}
{"round": 14, "iter": "iter014", "bottleneck": "compute_bound", "idea": "iter014_autogrid: BM=64 BN=64 warps=8 stages=1 indexing=pointer", "category": "grid", "expected_gain": "unknown", "decision": "DISCARD", "tflops": 47.23, "timestamp": "2026-04-21T12:19:42Z"}
{"round": 15, "iter": "iter015", "bottleneck": "compute_bound", "idea": "iter015_autogrid: BM=64 BN=128 warps=8 stages=1 indexing=pointer", "category": "grid", "expected_gain": "unknown", "decision": "DISCARD", "tflops": 56.0, "timestamp": "2026-04-21T12:19:48Z"}
{"round": 16, "iter": "iter016", "bottleneck": "compute_bound", "idea": "iter016_autogrid: BM=128 BN=64 warps=8 stages=1 indexing=pointer", "category": "grid", "expected_gain": "unknown", "decision": "DISCARD", "tflops": 70.54, "timestamp": "2026-04-21T12:19:53Z"}
{"round": 17, "iter": "iter017", "bottleneck": "compute_bound", "idea": "iter017_autogrid: BM=128 BN=128 warps=8 stages=1 indexing=pointer", "category": "grid", "expected_gain": "unknown", "decision": "DISCARD", "tflops": 88.22, "timestamp": "2026-04-21T12:19:59Z"}
{"round": 18, "iter": "iter018", "bottleneck": "compute_bound", "idea": "iter018_autogrid: BM=128 BN=256 warps=8 stages=1 indexing=pointer", "category": "grid", "expected_gain": "unknown", "decision": "DISCARD", "tflops": 108.58, "timestamp": "2026-04-21T12:20:04Z"}
{"round": 19, "iter": "iter019", "bottleneck": "compute_bound", "idea": "iter019_autogrid: BM=256 BN=128 warps=8 stages=1 indexing=pointer", "category": "grid", "expected_gain": "unknown", "decision": "DISCARD", "tflops": 94.36, "timestamp": "2026-04-21T12:20:10Z"}
{"round": 20, "iter": "iter020", "bottleneck": "compute_bound", "idea": "iter020_autogrid: BM=256 BN=256 warps=8 stages=1 indexing=pointer", "category": "grid", "expected_gain": "unknown", "decision": "DISCARD", "tflops": 28.37, "timestamp": "2026-04-21T12:20:17Z"}
{"round": 21, "iter": "iter021", "bottleneck": "compute_bound", "idea": "iter021_autogrid: BM=64 BN=64 warps=4 stages=1 indexing=block_ptr", "category": "grid", "expected_gain": "unknown", "decision": "DISCARD", "tflops": 73.11, "timestamp": "2026-04-21T12:20:22Z"}
{"round": 22, "iter": "iter022", "bottleneck": "compute_bound", "idea": "iter022_autogrid: BM=64 BN=128 warps=4 stages=1 indexing=block_ptr", "category": "grid", "expected_gain": "unknown", "decision": "DISCARD", "tflops": 114.57, "timestamp": "2026-04-21T12:20:28Z"}
{"round": 23, "iter": "iter023", "bottleneck": "compute_bound", "idea": "iter023_autogrid: BM=128 BN=64 warps=4 stages=1 indexing=block_ptr", "category": "grid", "expected_gain": "unknown", "decision": "DISCARD", "tflops": 100.98, "timestamp": "2026-04-21T12:20:33Z"}
{"round": 24, "iter": "iter024", "bottleneck": "compute_bound", "idea": "iter024_autogrid: BM=128 BN=128 warps=4 stages=1 indexing=block_ptr", "category": "grid", "expected_gain": "unknown", "decision": "DISCARD", "tflops": 32.97, "timestamp": "2026-04-21T12:20:41Z"}
{"round": 25, "iter": "iter025", "bottleneck": "compute_bound", "idea": "iter025_autogrid: BM=128 BN=256 warps=4 stages=1 indexing=block_ptr", "category": "grid", "expected_gain": "unknown", "decision": "DISCARD", "tflops": 29.8, "timestamp": "2026-04-21T12:20:48Z"}
{"round": 26, "iter": "iter026", "bottleneck": "compute_bound", "idea": "iter026_autogrid: BM=256 BN=128 warps=4 stages=1 indexing=block_ptr", "category": "grid", "expected_gain": "unknown", "decision": "DISCARD", "tflops": 64.4, "timestamp": "2026-04-21T12:20:54Z"}
{"round": 27, "iter": "iter027", "bottleneck": "compute_bound", "idea": "iter027_autogrid: BM=256 BN=256 warps=4 stages=1 indexing=block_ptr", "category": "grid", "expected_gain": "unknown", "decision": "DISCARD", "tflops": 13.94, "timestamp": "2026-04-21T12:21:03Z"}
{"round": 28, "iter": "iter028", "bottleneck": "compute_bound", "idea": "iter028_autogrid: BM=64 BN=64 warps=8 stages=1 indexing=block_ptr", "category": "grid", "expected_gain": "unknown", "decision": "DISCARD", "tflops": 48.68, "timestamp": "2026-04-21T12:21:08Z"}
{"round": 29, "iter": "iter029", "bottleneck": "compute_bound", "idea": "iter029_autogrid: BM=128 BN=128 warps=8 stages=1 indexing=block_ptr", "category": "grid", "expected_gain": "unknown", "decision": "DISCARD", "tflops": 88.19, "timestamp": "2026-04-21T12:21:14Z"}
{"round": 30, "iter": "iter030", "bottleneck": "compute_bound", "idea": "iter030_autogrid: BM=256 BN=256 warps=8 stages=1 indexing=block_ptr", "category": "grid", "expected_gain": "unknown", "decision": "DISCARD", "tflops": 21.95, "timestamp": "2026-04-21T12:21:21Z"}
{"round": 31, "iter": "iter031", "bottleneck": "compute_bound", "idea": "iter031_autogrid: BM=64 BN=64 warps=4 stages=2 indexing=block_ptr", "category": "grid", "expected_gain": "unknown", "decision": "DISCARD", "tflops": 72.93, "timestamp": "2026-04-21T12:21:26Z"}
{"round": 32, "iter": "iter032", "bottleneck": "compute_bound", "idea": "iter032_autogrid: BM=128 BN=128 warps=4 stages=2 indexing=block_ptr", "category": "grid", "expected_gain": "unknown", "decision": "KEEP", "tflops": 122.76, "timestamp": "2026-04-21T12:21:32Z"}
{"round": 33, "iter": "iter033", "bottleneck": "compute_bound", "idea": "iter033_autogrid: BM=256 BN=256 warps=4 stages=2 indexing=block_ptr", "category": "grid", "expected_gain": "unknown", "decision": "DISCARD", "tflops": 14.01, "timestamp": "2026-04-21T12:21:41Z"}
{"round": 34, "iter": "iter034", "bottleneck": "compute_bound", "idea": "iter034_autogrid: BM=64 BN=128 warps=4 stages=2 indexing=pointer", "category": "grid", "expected_gain": "unknown", "decision": "DISCARD", "tflops": 113.67, "timestamp": "2026-04-21T12:21:47Z"}
{"round": 35, "iter": "iter035", "bottleneck": "compute_bound", "idea": "iter035_autogrid: BM=128 BN=64 warps=4 stages=2 indexing=pointer", "category": "grid", "expected_gain": "unknown", "decision": "DISCARD", "tflops": 98.07, "timestamp": "2026-04-21T12:21:52Z"}
{"round": 36, "iter": "iter036", "bottleneck": "compute_bound", "idea": "iter036_autogrid: BM=128 BN=256 warps=4 stages=2 indexing=pointer", "category": "grid", "expected_gain": "unknown", "decision": "DISCARD", "tflops": 29.92, "timestamp": "2026-04-21T12:21:59Z"}
{"round": 37, "iter": "iter037", "bottleneck": "compute_bound", "idea": "iter037_autogrid: BM=256 BN=128 warps=4 stages=2 indexing=pointer", "category": "grid", "expected_gain": "unknown", "decision": "DISCARD", "tflops": 61.48, "timestamp": "2026-04-21T12:22:05Z"}
{"round": 38, "iter": "iter038", "bottleneck": "compute_bound", "idea": "iter038_autogrid: BM=64 BN=64 warps=4 stages=1 indexing=pointer", "category": "grid", "expected_gain": "unknown", "decision": "DISCARD", "tflops": 73.58, "timestamp": "2026-04-21T12:22:11Z"}
{"round": 39, "iter": "iter039", "bottleneck": "compute_bound", "idea": "iter039_autogrid: BM=64 BN=128 warps=4 stages=1 indexing=pointer", "category": "grid", "expected_gain": "unknown", "decision": "DISCARD", "tflops": 119.47, "timestamp": "2026-04-21T12:22:16Z"}
{"round": 40, "iter": "iter040", "bottleneck": "compute_bound", "idea": "iter040_autogrid: BM=128 BN=64 warps=4 stages=1 indexing=pointer", "category": "grid", "expected_gain": "unknown", "decision": "DISCARD", "tflops": 44.26, "timestamp": "2026-04-21T12:22:22Z"}
{"round": 41, "iter": "iter041", "bottleneck": "compute_bound", "idea": "iter041_autogrid: BM=128 BN=128 warps=4 stages=1 indexing=pointer", "category": "grid", "expected_gain": "unknown", "decision": "DISCARD", "tflops": 112.15, "timestamp": "2026-04-21T12:22:27Z"}
{"round": 42, "iter": "iter042", "bottleneck": "compute_bound", "idea": "iter042_autogrid: BM=128 BN=256 warps=4 stages=1 indexing=pointer", "category": "grid", "expected_gain": "unknown", "decision": "DISCARD", "tflops": 29.65, "timestamp": "2026-04-21T12:22:34Z"}
{"round": 43, "iter": "iter043", "bottleneck": "compute_bound", "idea": "iter043_autogrid: BM=256 BN=128 warps=4 stages=1 indexing=pointer", "category": "grid", "expected_gain": "unknown", "decision": "DISCARD", "tflops": 62.33, "timestamp": "2026-04-21T12:22:40Z"}
{"round": 44, "iter": "iter044", "bottleneck": "compute_bound", "idea": "iter044_autogrid: BM=256 BN=256 warps=4 stages=1 indexing=pointer", "category": "grid", "expected_gain": "unknown", "decision": "DISCARD", "tflops": 13.72, "timestamp": "2026-04-21T12:22:49Z"}
{"round": 45, "iter": "iter045", "bottleneck": "compute_bound", "idea": "iter045_autogrid: BM=64 BN=256 warps=4 stages=1 indexing=pointer", "category": "grid", "expected_gain": "unknown", "decision": "DISCARD", "tflops": 109.46, "timestamp": "2026-04-21T12:22:55Z"}
{"round": 46, "iter": "iter046", "bottleneck": "compute_bound", "idea": "iter046_autogrid: BM=256 BN=64 warps=4 stages=1 indexing=pointer", "category": "grid", "expected_gain": "unknown", "decision": "DISCARD", "tflops": 91.33, "timestamp": "2026-04-21T12:23:01Z"}
{"round": 47, "iter": "iter047", "bottleneck": "compute_bound", "idea": "iter047_autogrid: BM=64 BN=64 warps=8 stages=1 indexing=pointer", "category": "grid", "expected_gain": "unknown", "decision": "DISCARD", "tflops": 46.77, "timestamp": "2026-04-21T12:23:06Z"}
{"round": 48, "iter": "iter048", "bottleneck": "compute_bound", "idea": "iter048_autogrid: BM=64 BN=128 warps=8 stages=1 indexing=pointer", "category": "grid", "expected_gain": "unknown", "decision": "DISCARD", "tflops": 56.8, "timestamp": "2026-04-21T12:23:12Z"}
{"round": 49, "iter": "iter049", "bottleneck": "compute_bound", "idea": "iter049_autogrid: BM=128 BN=64 warps=8 stages=1 indexing=pointer", "category": "grid", "expected_gain": "unknown", "decision": "DISCARD", "tflops": 77.21, "timestamp": "2026-04-21T12:23:17Z"}
{"round": 50, "iter": "iter050", "bottleneck": "compute_bound", "idea": "iter050_autogrid: BM=128 BN=128 warps=8 stages=1 indexing=pointer", "category": "grid", "expected_gain": "unknown", "decision": "DISCARD", "tflops": 88.18, "timestamp": "2026-04-21T12:23:23Z"}
{"round": 51, "iter": "iter051", "bottleneck": "compute_bound", "idea": "iter051_autogrid: BM=128 BN=256 warps=8 stages=1 indexing=pointer", "category": "grid", "expected_gain": "unknown", "decision": "DISCARD", "tflops": 108.84, "timestamp": "2026-04-21T12:23:28Z"}
{"round": 52, "iter": "iter052", "bottleneck": "compute_bound", "idea": "iter052_autogrid: BM=256 BN=128 warps=8 stages=1 indexing=pointer", "category": "grid", "expected_gain": "unknown", "decision": "DISCARD", "tflops": 94.26, "timestamp": "2026-04-21T12:23:34Z"}
{"round": 53, "iter": "iter053", "bottleneck": "compute_bound", "idea": "iter053_autogrid: BM=256 BN=256 warps=8 stages=1 indexing=pointer", "category": "grid", "expected_gain": "unknown", "decision": "DISCARD", "tflops": 7.65, "timestamp": "2026-04-21T12:23:42Z"}
{"round": 54, "iter": "iter054", "bottleneck": "compute_bound", "idea": "iter054_autogrid: BM=64 BN=64 warps=4 stages=1 indexing=block_ptr", "category": "grid", "expected_gain": "unknown", "decision": "DISCARD", "tflops": 72.93, "timestamp": "2026-04-21T12:23:48Z"}
{"round": 55, "iter": "iter055", "bottleneck": "compute_bound", "idea": "iter055_autogrid: BM=64 BN=128 warps=4 stages=1 indexing=block_ptr", "category": "grid", "expected_gain": "unknown", "decision": "DISCARD", "tflops": 115.08, "timestamp": "2026-04-21T12:23:53Z"}
{"round": 56, "iter": "iter056", "bottleneck": "compute_bound", "idea": "iter056_autogrid: BM=128 BN=64 warps=4 stages=1 indexing=block_ptr", "category": "grid", "expected_gain": "unknown", "decision": "DISCARD", "tflops": 101.43, "timestamp": "2026-04-21T12:23:59Z"}
{"round": 57, "iter": "iter057", "bottleneck": "compute_bound", "idea": "iter057_autogrid: BM=128 BN=128 warps=4 stages=1 indexing=block_ptr", "category": "grid", "expected_gain": "unknown", "decision": "DISCARD", "tflops": 114.55, "timestamp": "2026-04-21T12:24:05Z"}
{"round": 58, "iter": "iter058", "bottleneck": "compute_bound", "idea": "iter058_autogrid: BM=128 BN=256 warps=4 stages=1 indexing=block_ptr", "category": "grid", "expected_gain": "unknown", "decision": "DISCARD", "tflops": 29.72, "timestamp": "2026-04-21T12:24:11Z"}
{"round": 59, "iter": "iter059", "bottleneck": "compute_bound", "idea": "iter059_autogrid: BM=256 BN=128 warps=4 stages=1 indexing=block_ptr", "category": "grid", "expected_gain": "unknown", "decision": "DISCARD", "tflops": 64.63, "timestamp": "2026-04-21T12:24:17Z"}
{"round": 60, "iter": "iter060", "bottleneck": "compute_bound", "idea": "iter060_autogrid: BM=256 BN=256 warps=4 stages=1 indexing=block_ptr", "category": "grid", "expected_gain": "unknown", "decision": "DISCARD", "tflops": 13.87, "timestamp": "2026-04-21T12:24:26Z"}
{"round": 61, "iter": "iter061", "bottleneck": "compute_bound", "idea": "iter061_autogrid: BM=64 BN=64 warps=8 stages=1 indexing=block_ptr", "category": "grid", "expected_gain": "unknown", "decision": "DISCARD", "tflops": 48.83, "timestamp": "2026-04-21T12:24:32Z"}
{"round": 62, "iter": "iter062", "bottleneck": "compute_bound", "idea": "iter062_autogrid: BM=128 BN=128 warps=8 stages=1 indexing=block_ptr", "category": "grid", "expected_gain": "unknown", "decision": "DISCARD", "tflops": 88.79, "timestamp": "2026-04-21T12:24:37Z"}
{"round": 63, "iter": "iter063", "bottleneck": "compute_bound", "idea": "iter063_autogrid: BM=256 BN=256 warps=8 stages=1 indexing=block_ptr", "category": "grid", "expected_gain": "unknown", "decision": "DISCARD", "tflops": 28.46, "timestamp": "2026-04-21T12:24:44Z"}
{"round": 64, "iter": "iter064", "bottleneck": "compute_bound", "idea": "iter064_autogrid: BM=64 BN=64 warps=4 stages=2 indexing=block_ptr", "category": "grid", "expected_gain": "unknown", "decision": "DISCARD", "tflops": 73.45, "timestamp": "2026-04-21T12:24:50Z"}
{"round": 65, "iter": "iter065", "bottleneck": "compute_bound", "idea": "iter065_autogrid: BM=128 BN=128 warps=4 stages=2 indexing=block_ptr", "category": "grid", "expected_gain": "unknown", "decision": "KEEP", "tflops": 123.48, "timestamp": "2026-04-21T12:24:55Z"}
{"round": 66, "iter": "iter066", "bottleneck": "compute_bound", "idea": "iter066_autogrid: BM=256 BN=256 warps=4 stages=2 indexing=block_ptr", "category": "grid", "expected_gain": "unknown", "decision": "DISCARD", "tflops": 14.02, "timestamp": "2026-04-21T12:25:04Z"}
{"round": 67, "iter": "iter067", "bottleneck": "compute_bound", "idea": "iter067_autogrid: BM=64 BN=128 warps=4 stages=2 indexing=pointer", "category": "grid", "expected_gain": "unknown", "decision": "DISCARD", "tflops": 114.35, "timestamp": "2026-04-21T12:25:09Z"}
{"round": 68, "iter": "iter068", "bottleneck": "compute_bound", "idea": "iter068_autogrid: BM=128 BN=64 warps=4 stages=2 indexing=pointer", "category": "grid", "expected_gain": "unknown", "decision": "DISCARD", "tflops": 98.09, "timestamp": "2026-04-21T12:25:15Z"}
{"round": 69, "iter": "iter069", "bottleneck": "compute_bound", "idea": "iter069_autogrid: BM=128 BN=256 warps=4 stages=2 indexing=pointer", "category": "grid", "expected_gain": "unknown", "decision": "DISCARD", "tflops": 12.33, "timestamp": "2026-04-21T12:25:22Z"}
{"round": 70, "iter": "iter070", "bottleneck": "compute_bound", "idea": "iter070_autogrid: BM=256 BN=128 warps=4 stages=2 indexing=pointer", "category": "grid", "expected_gain": "unknown", "decision": "DISCARD", "tflops": 33.05, "timestamp": "2026-04-21T12:25:29Z"}
{"round": 71, "iter": "iter071", "bottleneck": "compute_bound", "idea": "iter071_autogrid: BM=64 BN=64 warps=4 stages=1 indexing=pointer", "category": "grid", "expected_gain": "unknown", "decision": "DISCARD", "tflops": 73.89, "timestamp": "2026-04-21T12:25:34Z"}
{"round": 72, "iter": "iter072", "bottleneck": "compute_bound", "idea": "iter072_autogrid: BM=64 BN=128 warps=4 stages=1 indexing=pointer", "category": "grid", "expected_gain": "unknown", "decision": "DISCARD", "tflops": 119.68, "timestamp": "2026-04-21T12:25:40Z"}
{"round": 73, "iter": "iter073", "bottleneck": "compute_bound", "idea": "iter073_autogrid: BM=128 BN=64 warps=4 stages=1 indexing=pointer", "category": "grid", "expected_gain": "unknown", "decision": "DISCARD", "tflops": 101.14, "timestamp": "2026-04-21T12:25:45Z"}
{"round": 74, "iter": "iter074", "bottleneck": "compute_bound", "idea": "iter074_autogrid: BM=128 BN=128 warps=4 stages=1 indexing=pointer", "category": "grid", "expected_gain": "unknown", "decision": "DISCARD", "tflops": 112.53, "timestamp": "2026-04-21T12:25:51Z"}
{"round": 75, "iter": "iter075", "bottleneck": "compute_bound", "idea": "iter075_autogrid: BM=128 BN=256 warps=4 stages=1 indexing=pointer", "category": "grid", "expected_gain": "unknown", "decision": "DISCARD", "tflops": 29.71, "timestamp": "2026-04-21T12:25:58Z"}
{"round": 76, "iter": "iter076", "bottleneck": "compute_bound", "idea": "iter076_autogrid: BM=256 BN=128 warps=4 stages=1 indexing=pointer", "category": "grid", "expected_gain": "unknown", "decision": "DISCARD", "tflops": 33.88, "timestamp": "2026-04-21T12:26:04Z"}
{"round": 77, "iter": "iter077", "bottleneck": "compute_bound", "idea": "iter077_autogrid: BM=256 BN=256 warps=4 stages=1 indexing=pointer", "category": "grid", "expected_gain": "unknown", "decision": "DISCARD", "tflops": 13.87, "timestamp": "2026-04-21T12:26:13Z"}
{"round": 78, "iter": "iter078", "bottleneck": "compute_bound", "idea": "iter078_autogrid: BM=64 BN=256 warps=4 stages=1 indexing=pointer", "category": "grid", "expected_gain": "unknown", "decision": "DISCARD", "tflops": 42.48, "timestamp": "2026-04-21T12:26:19Z"}
{"round": 79, "iter": "iter079", "bottleneck": "compute_bound", "idea": "iter079_autogrid: BM=256 BN=64 warps=4 stages=1 indexing=pointer", "category": "grid", "expected_gain": "unknown", "decision": "DISCARD", "tflops": 91.07, "timestamp": "2026-04-21T12:26:25Z"}
