{"round": 440, "iter": "iter440", "bottleneck": "compile", "idea": "iter440_autogrid: BM=128 BN=128 warps=4 stages=3 indexing=pointer Ktile=128 ncol=4 layout=kmn", "category": "grid", "expected_gain": "unknown", "decision": "COMPILE_FAIL", "tflops": 0.0, "timestamp": "2026-04-21T13:33:10Z"}
{"round": 441, "iter": "iter441", "bottleneck": "compute_bound", "idea": "iter441_autogrid: BM=128 BN=128 warps=4 stages=3 indexing=block_ptr Ktile=32 ncol=1 layout=mnk", "category": "grid", "expected_gain": "unknown", "decision": "DISCARD", "tflops": 59.93, "timestamp": "2026-04-21T13:33:15Z"}
{"round": 442, "iter": "iter442", "bottleneck": "compute_bound", "idea": "iter442_autogrid: BM=128 BN=128 warps=4 stages=3 indexing=block_ptr Ktile=32 ncol=1 layout=lo1", "category": "grid", "expected_gain": "unknown", "decision": "DISCARD", "tflops": 58.62, "timestamp": "2026-04-21T13:33:21Z"}
{"round": 443, "iter": "iter443", "bottleneck": "compile", "idea": "iter443_autogrid: BM=128 BN=128 warps=4 stages=3 indexing=block_ptr Ktile=32 ncol=1 layout=kmn", "category": "grid", "expected_gain": "unknown", "decision": "COMPILE_FAIL", "tflops": 0.0, "timestamp": "2026-04-21T13:33:26Z"}
{"round": 444, "iter": "iter444", "bottleneck": "compute_bound", "idea": "iter444_autogrid: BM=128 BN=128 warps=4 stages=3 indexing=block_ptr Ktile=64 ncol=2 layout=mnk", "category": "grid", "expected_gain": "unknown", "decision": "DISCARD", "tflops": 72.05, "timestamp": "2026-04-21T13:33:32Z"}
{"round": 445, "iter": "iter445", "bottleneck": "compute_bound", "idea": "iter445_autogrid: BM=128 BN=128 warps=4 stages=3 indexing=block_ptr Ktile=64 ncol=2 layout=lo1", "category": "grid", "expected_gain": "unknown", "decision": "DISCARD", "tflops": 73.78, "timestamp": "2026-04-21T13:33:39Z"}
{"round": 446, "iter": "iter446", "bottleneck": "compile", "idea": "iter446_autogrid: BM=128 BN=128 warps=4 stages=3 indexing=block_ptr Ktile=64 ncol=2 layout=kmn", "category": "grid", "expected_gain": "unknown", "decision": "COMPILE_FAIL", "tflops": 0.0, "timestamp": "2026-04-21T13:33:43Z"}
{"round": 447, "iter": "iter447", "bottleneck": "compute_bound", "idea": "iter447_autogrid: BM=128 BN=128 warps=4 stages=3 indexing=block_ptr Ktile=128 ncol=4 layout=mnk", "category": "grid", "expected_gain": "unknown", "decision": "DISCARD", "tflops": 57.47, "timestamp": "2026-04-21T13:33:50Z"}
{"round": 448, "iter": "iter448", "bottleneck": "compute_bound", "idea": "iter448_autogrid: BM=128 BN=128 warps=4 stages=3 indexing=block_ptr Ktile=128 ncol=4 layout=lo1", "category": "grid", "expected_gain": "unknown", "decision": "DISCARD", "tflops": 55.4, "timestamp": "2026-04-21T13:33:57Z"}
{"round": 449, "iter": "iter449", "bottleneck": "compile", "idea": "iter449_autogrid: BM=128 BN=128 warps=4 stages=3 indexing=block_ptr Ktile=128 ncol=4 layout=kmn", "category": "grid", "expected_gain": "unknown", "decision": "COMPILE_FAIL", "tflops": 0.0, "timestamp": "2026-04-21T13:34:02Z"}
{"round": 450, "iter": "iter450", "bottleneck": "compute_bound", "idea": "iter450_autogrid: BM=128 BN=128 warps=4 stages=4 indexing=pointer Ktile=32 ncol=1 layout=mnk", "category": "grid", "expected_gain": "unknown", "decision": "DISCARD", "tflops": 58.73, "timestamp": "2026-04-21T13:34:08Z"}
{"round": 451, "iter": "iter451", "bottleneck": "compute_bound", "idea": "iter451_autogrid: BM=128 BN=128 warps=4 stages=4 indexing=pointer Ktile=32 ncol=1 layout=lo1", "category": "grid", "expected_gain": "unknown", "decision": "DISCARD", "tflops": 57.61, "timestamp": "2026-04-21T13:34:13Z"}
{"round": 452, "iter": "iter452", "bottleneck": "compile", "idea": "iter452_autogrid: BM=128 BN=128 warps=4 stages=4 indexing=pointer Ktile=32 ncol=1 layout=kmn", "category": "grid", "expected_gain": "unknown", "decision": "COMPILE_FAIL", "tflops": 0.0, "timestamp": "2026-04-21T13:34:18Z"}
{"round": 453, "iter": "iter453", "bottleneck": "compute_bound", "idea": "iter453_autogrid: BM=128 BN=128 warps=4 stages=4 indexing=pointer Ktile=128 ncol=4 layout=mnk", "category": "grid", "expected_gain": "unknown", "decision": "DISCARD", "tflops": 37.92, "timestamp": "2026-04-21T13:34:25Z"}
{"round": 454, "iter": "iter454", "bottleneck": "compute_bound", "idea": "iter454_autogrid: BM=128 BN=128 warps=4 stages=4 indexing=pointer Ktile=128 ncol=4 layout=lo1", "category": "grid", "expected_gain": "unknown", "decision": "DISCARD", "tflops": 37.04, "timestamp": "2026-04-21T13:34:32Z"}
{"round": 455, "iter": "iter455", "bottleneck": "compile", "idea": "iter455_autogrid: BM=128 BN=128 warps=4 stages=4 indexing=pointer Ktile=128 ncol=4 layout=kmn", "category": "grid", "expected_gain": "unknown", "decision": "COMPILE_FAIL", "tflops": 0.0, "timestamp": "2026-04-21T13:34:36Z"}
{"round": 456, "iter": "iter456", "bottleneck": "compute_bound", "idea": "iter456_autogrid: BM=128 BN=128 warps=4 stages=4 indexing=block_ptr Ktile=32 ncol=1 layout=mnk", "category": "grid", "expected_gain": "unknown", "decision": "DISCARD", "tflops": 58.78, "timestamp": "2026-04-21T13:34:42Z"}
{"round": 457, "iter": "iter457", "bottleneck": "compute_bound", "idea": "iter457_autogrid: BM=128 BN=128 warps=4 stages=4 indexing=block_ptr Ktile=32 ncol=1 layout=lo1", "category": "grid", "expected_gain": "unknown", "decision": "DISCARD", "tflops": 57.75, "timestamp": "2026-04-21T13:34:48Z"}
{"round": 458, "iter": "iter458", "bottleneck": "compile", "idea": "iter458_autogrid: BM=128 BN=128 warps=4 stages=4 indexing=block_ptr Ktile=32 ncol=1 layout=kmn", "category": "grid", "expected_gain": "unknown", "decision": "COMPILE_FAIL", "tflops": 0.0, "timestamp": "2026-04-21T13:34:53Z"}
{"round": 459, "iter": "iter459", "bottleneck": "compute_bound", "idea": "iter459_autogrid: BM=128 BN=128 warps=4 stages=4 indexing=block_ptr Ktile=64 ncol=2 layout=mnk", "category": "grid", "expected_gain": "unknown", "decision": "DISCARD", "tflops": 68.78, "timestamp": "2026-04-21T13:34:59Z"}
{"round": 460, "iter": "iter460", "bottleneck": "compute_bound", "idea": "iter460_autogrid: BM=128 BN=128 warps=4 stages=4 indexing=block_ptr Ktile=64 ncol=2 layout=lo1", "category": "grid", "expected_gain": "unknown", "decision": "DISCARD", "tflops": 69.93, "timestamp": "2026-04-21T13:35:05Z"}
{"round": 461, "iter": "iter461", "bottleneck": "compile", "idea": "iter461_autogrid: BM=128 BN=128 warps=4 stages=4 indexing=block_ptr Ktile=64 ncol=2 layout=kmn", "category": "grid", "expected_gain": "unknown", "decision": "COMPILE_FAIL", "tflops": 0.0, "timestamp": "2026-04-21T13:35:09Z"}
{"round": 462, "iter": "iter462", "bottleneck": "compute_bound", "idea": "iter462_autogrid: BM=128 BN=128 warps=4 stages=4 indexing=block_ptr Ktile=128 ncol=4 layout=mnk", "category": "grid", "expected_gain": "unknown", "decision": "DISCARD", "tflops": 33.94, "timestamp": "2026-04-21T13:35:16Z"}
{"round": 463, "iter": "iter463", "bottleneck": "compute_bound", "idea": "iter463_autogrid: BM=128 BN=128 warps=4 stages=4 indexing=block_ptr Ktile=128 ncol=4 layout=lo1", "category": "grid", "expected_gain": "unknown", "decision": "DISCARD", "tflops": 33.92, "timestamp": "2026-04-21T13:35:23Z"}
{"round": 464, "iter": "iter464", "bottleneck": "compile", "idea": "iter464_autogrid: BM=128 BN=128 warps=4 stages=4 indexing=block_ptr Ktile=128 ncol=4 layout=kmn", "category": "grid", "expected_gain": "unknown", "decision": "COMPILE_FAIL", "tflops": 0.0, "timestamp": "2026-04-21T13:35:28Z"}
{"round": 465, "iter": "iter465", "bottleneck": "compute_bound", "idea": "iter465_autogrid: BM=128 BN=128 warps=4 stages=5 indexing=pointer Ktile=32 ncol=1 layout=mnk", "category": "grid", "expected_gain": "unknown", "decision": "DISCARD", "tflops": 58.85, "timestamp": "2026-04-21T13:35:34Z"}
{"round": 466, "iter": "iter466", "bottleneck": "compute_bound", "idea": "iter466_autogrid: BM=128 BN=128 warps=4 stages=5 indexing=pointer Ktile=32 ncol=1 layout=lo1", "category": "grid", "expected_gain": "unknown", "decision": "DISCARD", "tflops": 57.42, "timestamp": "2026-04-21T13:35:40Z"}
{"round": 467, "iter": "iter467", "bottleneck": "compile", "idea": "iter467_autogrid: BM=128 BN=128 warps=4 stages=5 indexing=pointer Ktile=32 ncol=1 layout=kmn", "category": "grid", "expected_gain": "unknown", "decision": "COMPILE_FAIL", "tflops": 0.0, "timestamp": "2026-04-21T13:35:44Z"}
{"round": 468, "iter": "iter468", "bottleneck": "compute_bound", "idea": "iter468_autogrid: BM=128 BN=128 warps=4 stages=5 indexing=pointer Ktile=64 ncol=2 layout=lo1", "category": "grid", "expected_gain": "unknown", "decision": "DISCARD", "tflops": 69.98, "timestamp": "2026-04-21T13:35:50Z"}
{"round": 469, "iter": "iter469", "bottleneck": "compile", "idea": "iter469_autogrid: BM=128 BN=128 warps=4 stages=5 indexing=pointer Ktile=64 ncol=2 layout=kmn", "category": "grid", "expected_gain": "unknown", "decision": "COMPILE_FAIL", "tflops": 0.0, "timestamp": "2026-04-21T13:35:55Z"}
{"round": 470, "iter": "iter470", "bottleneck": "compute_bound", "idea": "iter470_autogrid: BM=128 BN=128 warps=4 stages=5 indexing=pointer Ktile=128 ncol=4 layout=mnk", "category": "grid", "expected_gain": "unknown", "decision": "DISCARD", "tflops": 37.58, "timestamp": "2026-04-21T13:36:02Z"}
{"round": 471, "iter": "iter471", "bottleneck": "compute_bound", "idea": "iter471_autogrid: BM=128 BN=128 warps=4 stages=5 indexing=pointer Ktile=128 ncol=4 layout=lo1", "category": "grid", "expected_gain": "unknown", "decision": "DISCARD", "tflops": 36.94, "timestamp": "2026-04-21T13:36:09Z"}
{"round": 472, "iter": "iter472", "bottleneck": "compile", "idea": "iter472_autogrid: BM=128 BN=128 warps=4 stages=5 indexing=pointer Ktile=128 ncol=4 layout=kmn", "category": "grid", "expected_gain": "unknown", "decision": "COMPILE_FAIL", "tflops": 0.0, "timestamp": "2026-04-21T13:36:14Z"}
{"round": 473, "iter": "iter473", "bottleneck": "compute_bound", "idea": "iter473_autogrid: BM=128 BN=128 warps=4 stages=5 indexing=block_ptr Ktile=32 ncol=1 layout=mnk", "category": "grid", "expected_gain": "unknown", "decision": "DISCARD", "tflops": 58.74, "timestamp": "2026-04-21T13:36:19Z"}
{"round": 474, "iter": "iter474", "bottleneck": "compute_bound", "idea": "iter474_autogrid: BM=128 BN=128 warps=4 stages=5 indexing=block_ptr Ktile=32 ncol=1 layout=lo1", "category": "grid", "expected_gain": "unknown", "decision": "DISCARD", "tflops": 57.76, "timestamp": "2026-04-21T13:36:25Z"}
{"round": 475, "iter": "iter475", "bottleneck": "compile", "idea": "iter475_autogrid: BM=128 BN=128 warps=4 stages=5 indexing=block_ptr Ktile=32 ncol=1 layout=kmn", "category": "grid", "expected_gain": "unknown", "decision": "COMPILE_FAIL", "tflops": 0.0, "timestamp": "2026-04-21T13:36:30Z"}
{"round": 476, "iter": "iter476", "bottleneck": "compute_bound", "idea": "iter476_autogrid: BM=128 BN=128 warps=4 stages=5 indexing=block_ptr Ktile=64 ncol=2 layout=mnk", "category": "grid", "expected_gain": "unknown", "decision": "DISCARD", "tflops": 68.63, "timestamp": "2026-04-21T13:36:36Z"}
{"round": 477, "iter": "iter477", "bottleneck": "compute_bound", "idea": "iter477_autogrid: BM=128 BN=128 warps=4 stages=5 indexing=block_ptr Ktile=64 ncol=2 layout=lo1", "category": "grid", "expected_gain": "unknown", "decision": "DISCARD", "tflops": 69.86, "timestamp": "2026-04-21T13:36:43Z"}
{"round": 478, "iter": "iter478", "bottleneck": "compile", "idea": "iter478_autogrid: BM=128 BN=128 warps=4 stages=5 indexing=block_ptr Ktile=64 ncol=2 layout=kmn", "category": "grid", "expected_gain": "unknown", "decision": "COMPILE_FAIL", "tflops": 0.0, "timestamp": "2026-04-21T13:36:48Z"}
{"round": 479, "iter": "iter479", "bottleneck": "compute_bound", "idea": "iter479_autogrid: BM=128 BN=128 warps=4 stages=5 indexing=block_ptr Ktile=128 ncol=4 layout=mnk", "category": "grid", "expected_gain": "unknown", "decision": "DISCARD", "tflops": 33.64, "timestamp": "2026-04-21T13:36:55Z"}
{"round": 480, "iter": "iter480", "bottleneck": "compute_bound", "idea": "iter480_autogrid: BM=128 BN=128 warps=4 stages=5 indexing=block_ptr Ktile=128 ncol=4 layout=lo1", "category": "grid", "expected_gain": "unknown", "decision": "DISCARD", "tflops": 33.91, "timestamp": "2026-04-21T13:37:02Z"}
{"round": 481, "iter": "iter481", "bottleneck": "compile", "idea": "iter481_autogrid: BM=128 BN=128 warps=4 stages=5 indexing=block_ptr Ktile=128 ncol=4 layout=kmn", "category": "grid", "expected_gain": "unknown", "decision": "COMPILE_FAIL", "tflops": 0.0, "timestamp": "2026-04-21T13:37:07Z"}
{"round": 482, "iter": "iter482", "bottleneck": "compute_bound", "idea": "iter482_autogrid: BM=128 BN=128 warps=4 stages=6 indexing=pointer Ktile=32 ncol=1 layout=mnk", "category": "grid", "expected_gain": "unknown", "decision": "DISCARD", "tflops": 58.82, "timestamp": "2026-04-21T13:37:13Z"}
{"round": 483, "iter": "iter483", "bottleneck": "compute_bound", "idea": "iter483_autogrid: BM=128 BN=128 warps=4 stages=6 indexing=pointer Ktile=32 ncol=1 layout=lo1", "category": "grid", "expected_gain": "unknown", "decision": "DISCARD", "tflops": 57.6, "timestamp": "2026-04-21T13:37:19Z"}
{"round": 484, "iter": "iter484", "bottleneck": "compile", "idea": "iter484_autogrid: BM=128 BN=128 warps=4 stages=6 indexing=pointer Ktile=32 ncol=1 layout=kmn", "category": "grid", "expected_gain": "unknown", "decision": "COMPILE_FAIL", "tflops": 0.0, "timestamp": "2026-04-21T13:37:24Z"}
{"round": 485, "iter": "iter485", "bottleneck": "compute_bound", "idea": "iter485_autogrid: BM=128 BN=128 warps=4 stages=6 indexing=pointer Ktile=64 ncol=2 layout=lo1", "category": "grid", "expected_gain": "unknown", "decision": "DISCARD", "tflops": 69.79, "timestamp": "2026-04-21T13:37:30Z"}
{"round": 486, "iter": "iter486", "bottleneck": "compile", "idea": "iter486_autogrid: BM=128 BN=128 warps=4 stages=6 indexing=pointer Ktile=64 ncol=2 layout=kmn", "category": "grid", "expected_gain": "unknown", "decision": "COMPILE_FAIL", "tflops": 0.0, "timestamp": "2026-04-21T13:37:35Z"}
{"round": 487, "iter": "iter487", "bottleneck": "compute_bound", "idea": "iter487_autogrid: BM=128 BN=128 warps=4 stages=6 indexing=pointer Ktile=128 ncol=4 layout=mnk", "category": "grid", "expected_gain": "unknown", "decision": "DISCARD", "tflops": 37.49, "timestamp": "2026-04-21T13:37:42Z"}
{"round": 488, "iter": "iter488", "bottleneck": "compute_bound", "idea": "iter488_autogrid: BM=128 BN=128 warps=4 stages=6 indexing=pointer Ktile=128 ncol=4 layout=lo1", "category": "grid", "expected_gain": "unknown", "decision": "DISCARD", "tflops": 36.58, "timestamp": "2026-04-21T13:37:49Z"}
{"round": 489, "iter": "iter489", "bottleneck": "compile", "idea": "iter489_autogrid: BM=128 BN=128 warps=4 stages=6 indexing=pointer Ktile=128 ncol=4 layout=kmn", "category": "grid", "expected_gain": "unknown", "decision": "COMPILE_FAIL", "tflops": 0.0, "timestamp": "2026-04-21T13:37:53Z"}
{"round": 490, "iter": "iter490", "bottleneck": "compute_bound", "idea": "iter490_autogrid: BM=128 BN=128 warps=4 stages=6 indexing=block_ptr Ktile=32 ncol=1 layout=mnk", "category": "grid", "expected_gain": "unknown", "decision": "DISCARD", "tflops": 58.84, "timestamp": "2026-04-21T13:37:59Z"}
{"round": 491, "iter": "iter491", "bottleneck": "compute_bound", "idea": "iter491_autogrid: BM=128 BN=128 warps=4 stages=6 indexing=block_ptr Ktile=32 ncol=1 layout=lo1", "category": "grid", "expected_gain": "unknown", "decision": "DISCARD", "tflops": 57.78, "timestamp": "2026-04-21T13:38:06Z"}
{"round": 492, "iter": "iter492", "bottleneck": "compile", "idea": "iter492_autogrid: BM=128 BN=128 warps=4 stages=6 indexing=block_ptr Ktile=32 ncol=1 layout=kmn", "category": "grid", "expected_gain": "unknown", "decision": "COMPILE_FAIL", "tflops": 0.0, "timestamp": "2026-04-21T13:38:10Z"}
{"round": 493, "iter": "iter493", "bottleneck": "compute_bound", "idea": "iter493_autogrid: BM=128 BN=128 warps=4 stages=6 indexing=block_ptr Ktile=64 ncol=2 layout=mnk", "category": "grid", "expected_gain": "unknown", "decision": "DISCARD", "tflops": 68.73, "timestamp": "2026-04-21T13:38:17Z"}
{"round": 494, "iter": "iter494", "bottleneck": "compute_bound", "idea": "iter494_autogrid: BM=128 BN=128 warps=4 stages=6 indexing=block_ptr Ktile=64 ncol=2 layout=lo1", "category": "grid", "expected_gain": "unknown", "decision": "DISCARD", "tflops": 69.7, "timestamp": "2026-04-21T13:38:23Z"}
{"round": 495, "iter": "iter495", "bottleneck": "compile", "idea": "iter495_autogrid: BM=128 BN=128 warps=4 stages=6 indexing=block_ptr Ktile=64 ncol=2 layout=kmn", "category": "grid", "expected_gain": "unknown", "decision": "COMPILE_FAIL", "tflops": 0.0, "timestamp": "2026-04-21T13:38:28Z"}
{"round": 496, "iter": "iter496", "bottleneck": "compute_bound", "idea": "iter496_autogrid: BM=128 BN=128 warps=4 stages=6 indexing=block_ptr Ktile=128 ncol=4 layout=mnk", "category": "grid", "expected_gain": "unknown", "decision": "DISCARD", "tflops": 33.54, "timestamp": "2026-04-21T13:38:35Z"}
{"round": 497, "iter": "iter497", "bottleneck": "compute_bound", "idea": "iter497_autogrid: BM=128 BN=128 warps=4 stages=6 indexing=block_ptr Ktile=128 ncol=4 layout=lo1", "category": "grid", "expected_gain": "unknown", "decision": "DISCARD", "tflops": 33.58, "timestamp": "2026-04-21T13:38:42Z"}
{"round": 498, "iter": "iter498", "bottleneck": "compile", "idea": "iter498_autogrid: BM=128 BN=128 warps=4 stages=6 indexing=block_ptr Ktile=128 ncol=4 layout=kmn", "category": "grid", "expected_gain": "unknown", "decision": "COMPILE_FAIL", "tflops": 0.0, "timestamp": "2026-04-21T13:38:47Z"}
{"round": 499, "iter": "iter499", "bottleneck": "compute_bound", "idea": "iter499_autogrid: BM=128 BN=128 warps=8 stages=3 indexing=pointer Ktile=32 ncol=1 layout=mnk", "category": "grid", "expected_gain": "unknown", "decision": "DISCARD", "tflops": 38.53, "timestamp": "2026-04-21T13:38:53Z"}
{"round": 500, "iter": "iter500", "bottleneck": "compute_bound", "idea": "iter500_autogrid: BM=128 BN=128 warps=8 stages=3 indexing=pointer Ktile=32 ncol=1 layout=lo1", "category": "grid", "expected_gain": "unknown", "decision": "DISCARD", "tflops": 39.55, "timestamp": "2026-04-21T13:38:58Z"}
{"round": 501, "iter": "iter501", "bottleneck": "compile", "idea": "iter501_autogrid: BM=128 BN=128 warps=8 stages=3 indexing=pointer Ktile=32 ncol=1 layout=kmn", "category": "grid", "expected_gain": "unknown", "decision": "COMPILE_FAIL", "tflops": 0.0, "timestamp": "2026-04-21T13:39:57Z"}
{"round": 502, "iter": "iter502", "bottleneck": "compute_bound", "idea": "iter502_autogrid: BM=128 BN=128 warps=8 stages=3 indexing=pointer Ktile=64 ncol=2 layout=mnk", "category": "grid", "expected_gain": "unknown", "decision": "DISCARD", "tflops": 58.85, "timestamp": "2026-04-21T13:40:03Z"}
{"round": 503, "iter": "iter503", "bottleneck": "compute_bound", "idea": "iter503_autogrid: BM=128 BN=128 warps=8 stages=3 indexing=pointer Ktile=64 ncol=2 layout=lo1", "category": "grid", "expected_gain": "unknown", "decision": "DISCARD", "tflops": 57.59, "timestamp": "2026-04-21T13:40:08Z"}
{"round": 504, "iter": "iter504", "bottleneck": "compile", "idea": "iter504_autogrid: BM=128 BN=128 warps=8 stages=3 indexing=pointer Ktile=64 ncol=2 layout=kmn", "category": "grid", "expected_gain": "unknown", "decision": "COMPILE_FAIL", "tflops": 0.0, "timestamp": "2026-04-21T13:40:13Z"}
{"round": 505, "iter": "iter505", "bottleneck": "compute_bound", "idea": "iter505_autogrid: BM=128 BN=128 warps=8 stages=3 indexing=pointer Ktile=128 ncol=4 layout=mnk", "category": "grid", "expected_gain": "unknown", "decision": "DISCARD", "tflops": 59.87, "timestamp": "2026-04-21T13:40:19Z"}
{"round": 506, "iter": "iter506", "bottleneck": "compute_bound", "idea": "iter506_autogrid: BM=128 BN=128 warps=8 stages=3 indexing=pointer Ktile=128 ncol=4 layout=lo1", "category": "grid", "expected_gain": "unknown", "decision": "DISCARD", "tflops": 55.53, "timestamp": "2026-04-21T13:40:25Z"}
{"round": 507, "iter": "iter507", "bottleneck": "compile", "idea": "iter507_autogrid: BM=128 BN=128 warps=8 stages=3 indexing=pointer Ktile=128 ncol=4 layout=kmn", "category": "grid", "expected_gain": "unknown", "decision": "COMPILE_FAIL", "tflops": 0.0, "timestamp": "2026-04-21T13:40:30Z"}
{"round": 508, "iter": "iter508", "bottleneck": "compute_bound", "idea": "iter508_autogrid: BM=128 BN=128 warps=8 stages=3 indexing=block_ptr Ktile=32 ncol=1 layout=mnk", "category": "grid", "expected_gain": "unknown", "decision": "DISCARD", "tflops": 38.96, "timestamp": "2026-04-21T13:40:35Z"}
{"round": 509, "iter": "iter509", "bottleneck": "compute_bound", "idea": "iter509_autogrid: BM=128 BN=128 warps=8 stages=3 indexing=block_ptr Ktile=32 ncol=1 layout=lo1", "category": "grid", "expected_gain": "unknown", "decision": "DISCARD", "tflops": 38.51, "timestamp": "2026-04-21T13:40:41Z"}
{"round": 510, "iter": "iter510", "bottleneck": "compile", "idea": "iter510_autogrid: BM=128 BN=128 warps=8 stages=3 indexing=block_ptr Ktile=32 ncol=1 layout=kmn", "category": "grid", "expected_gain": "unknown", "decision": "COMPILE_FAIL", "tflops": 0.0, "timestamp": "2026-04-21T13:40:45Z"}
{"round": 511, "iter": "iter511", "bottleneck": "compute_bound", "idea": "iter511_autogrid: BM=128 BN=128 warps=8 stages=3 indexing=block_ptr Ktile=64 ncol=2 layout=mnk", "category": "grid", "expected_gain": "unknown", "decision": "DISCARD", "tflops": 57.9, "timestamp": "2026-04-21T13:40:51Z"}
{"round": 512, "iter": "iter512", "bottleneck": "compute_bound", "idea": "iter512_autogrid: BM=128 BN=128 warps=8 stages=3 indexing=block_ptr Ktile=64 ncol=2 layout=lo1", "category": "grid", "expected_gain": "unknown", "decision": "DISCARD", "tflops": 55.51, "timestamp": "2026-04-21T13:40:57Z"}
{"round": 513, "iter": "iter513", "bottleneck": "compile", "idea": "iter513_autogrid: BM=128 BN=128 warps=8 stages=3 indexing=block_ptr Ktile=64 ncol=2 layout=kmn", "category": "grid", "expected_gain": "unknown", "decision": "COMPILE_FAIL", "tflops": 0.0, "timestamp": "2026-04-21T13:41:02Z"}
