{"round": 682, "iter": "iter682", "bottleneck": "compute_bound", "idea": "iter682_autogrid: BM=128 BN=64 warps=2 stages=6 indexing=pointer Ktile=128 ncol=4 layout=lo1", "category": "grid", "expected_gain": "unknown", "decision": "DISCARD", "tflops": 19.16, "timestamp": "2026-04-21T17:07:39Z"}
{"round": 683, "iter": "iter683", "bottleneck": "compute_bound", "idea": "iter683_autogrid: BM=128 BN=64 warps=2 stages=6 indexing=block_ptr Ktile=32 ncol=1 layout=mnk", "category": "grid", "expected_gain": "unknown", "decision": "DISCARD", "tflops": 103.25, "timestamp": "2026-04-21T17:07:44Z"}
{"round": 684, "iter": "iter684", "bottleneck": "compute_bound", "idea": "iter684_autogrid: BM=128 BN=64 warps=2 stages=6 indexing=block_ptr Ktile=32 ncol=1 layout=lo1", "category": "grid", "expected_gain": "unknown", "decision": "DISCARD", "tflops": 99.97, "timestamp": "2026-04-21T17:07:49Z"}
{"round": 685, "iter": "iter685", "bottleneck": "compute_bound", "idea": "iter685_autogrid: BM=128 BN=64 warps=2 stages=6 indexing=block_ptr Ktile=64 ncol=2 layout=mnk", "category": "grid", "expected_gain": "unknown", "decision": "DISCARD", "tflops": 68.51, "timestamp": "2026-04-21T17:07:54Z"}
{"round": 686, "iter": "iter686", "bottleneck": "compute_bound", "idea": "iter686_autogrid: BM=128 BN=64 warps=2 stages=6 indexing=block_ptr Ktile=64 ncol=2 layout=lo1", "category": "grid", "expected_gain": "unknown", "decision": "DISCARD", "tflops": 69.05, "timestamp": "2026-04-21T17:07:59Z"}
{"round": 687, "iter": "iter687", "bottleneck": "compute_bound", "idea": "iter687_autogrid: BM=128 BN=64 warps=2 stages=6 indexing=block_ptr Ktile=128 ncol=4 layout=mnk", "category": "grid", "expected_gain": "unknown", "decision": "DISCARD", "tflops": 20.62, "timestamp": "2026-04-21T17:08:05Z"}
{"round": 688, "iter": "iter688", "bottleneck": "compute_bound", "idea": "iter688_autogrid: BM=128 BN=64 warps=2 stages=6 indexing=block_ptr Ktile=128 ncol=4 layout=lo1", "category": "grid", "expected_gain": "unknown", "decision": "DISCARD", "tflops": 20.86, "timestamp": "2026-04-21T17:08:10Z"}
{"round": 689, "iter": "iter689", "bottleneck": "compute_bound", "idea": "iter689_autogrid: BM=128 BN=64 warps=4 stages=3 indexing=pointer Ktile=32 ncol=1 layout=mnk", "category": "grid", "expected_gain": "unknown", "decision": "DISCARD", "tflops": 97.98, "timestamp": "2026-04-21T17:08:15Z"}
{"round": 690, "iter": "iter690", "bottleneck": "compute_bound", "idea": "iter690_autogrid: BM=128 BN=64 warps=4 stages=3 indexing=pointer Ktile=32 ncol=1 layout=lo1", "category": "grid", "expected_gain": "unknown", "decision": "DISCARD", "tflops": 99.94, "timestamp": "2026-04-21T17:08:20Z"}
{"round": 691, "iter": "iter691", "bottleneck": "compute_bound", "idea": "iter691_autogrid: BM=128 BN=64 warps=4 stages=3 indexing=pointer Ktile=64 ncol=2 layout=mnk", "category": "grid", "expected_gain": "unknown", "decision": "DISCARD", "tflops": 118.02, "timestamp": "2026-04-21T17:08:25Z"}
{"round": 692, "iter": "iter692", "bottleneck": "compute_bound", "idea": "iter692_autogrid: BM=128 BN=64 warps=4 stages=3 indexing=pointer Ktile=64 ncol=2 layout=lo1", "category": "grid", "expected_gain": "unknown", "decision": "DISCARD", "tflops": 119.19, "timestamp": "2026-04-21T17:08:30Z"}
{"round": 693, "iter": "iter693", "bottleneck": "compute_bound", "idea": "iter693_autogrid: BM=128 BN=64 warps=4 stages=3 indexing=pointer Ktile=128 ncol=4 layout=mnk", "category": "grid", "expected_gain": "unknown", "decision": "DISCARD", "tflops": 110.15, "timestamp": "2026-04-21T17:08:35Z"}
{"round": 694, "iter": "iter694", "bottleneck": "compute_bound", "idea": "iter694_autogrid: BM=128 BN=64 warps=4 stages=3 indexing=pointer Ktile=128 ncol=4 layout=lo1", "category": "grid", "expected_gain": "unknown", "decision": "DISCARD", "tflops": 114.12, "timestamp": "2026-04-21T17:08:41Z"}
{"round": 695, "iter": "iter695", "bottleneck": "compute_bound", "idea": "iter695_autogrid: BM=128 BN=64 warps=4 stages=3 indexing=block_ptr Ktile=32 ncol=1 layout=mnk", "category": "grid", "expected_gain": "unknown", "decision": "DISCARD", "tflops": 100.6, "timestamp": "2026-04-21T17:08:46Z"}
{"round": 696, "iter": "iter696", "bottleneck": "compute_bound", "idea": "iter696_autogrid: BM=128 BN=64 warps=4 stages=3 indexing=block_ptr Ktile=32 ncol=1 layout=lo1", "category": "grid", "expected_gain": "unknown", "decision": "DISCARD", "tflops": 98.47, "timestamp": "2026-04-21T17:08:51Z"}
{"round": 697, "iter": "iter697", "bottleneck": "compute_bound", "idea": "iter697_autogrid: BM=128 BN=64 warps=4 stages=3 indexing=block_ptr Ktile=64 ncol=2 layout=mnk", "category": "grid", "expected_gain": "unknown", "decision": "DISCARD", "tflops": 122.38, "timestamp": "2026-04-21T17:08:56Z"}
{"round": 698, "iter": "iter698", "bottleneck": "compute_bound", "idea": "iter698_autogrid: BM=128 BN=64 warps=4 stages=3 indexing=block_ptr Ktile=64 ncol=2 layout=lo1", "category": "grid", "expected_gain": "unknown", "decision": "DISCARD", "tflops": 109.42, "timestamp": "2026-04-21T17:09:01Z"}
{"round": 699, "iter": "iter699", "bottleneck": "compute_bound", "idea": "iter699_autogrid: BM=128 BN=64 warps=4 stages=3 indexing=block_ptr Ktile=128 ncol=4 layout=mnk", "category": "grid", "expected_gain": "unknown", "decision": "DISCARD", "tflops": 108.58, "timestamp": "2026-04-21T17:09:06Z"}
{"round": 700, "iter": "iter700", "bottleneck": "compute_bound", "idea": "iter700_autogrid: BM=128 BN=64 warps=4 stages=3 indexing=block_ptr Ktile=128 ncol=4 layout=lo1", "category": "grid", "expected_gain": "unknown", "decision": "DISCARD", "tflops": 115.18, "timestamp": "2026-04-21T17:09:11Z"}
{"round": 701, "iter": "iter701", "bottleneck": "compute_bound", "idea": "iter701_autogrid: BM=128 BN=64 warps=4 stages=4 indexing=pointer Ktile=32 ncol=1 layout=mnk", "category": "grid", "expected_gain": "unknown", "decision": "DISCARD", "tflops": 99.69, "timestamp": "2026-04-21T17:09:32Z"}
{"round": 702, "iter": "iter702", "bottleneck": "compute_bound", "idea": "iter702_autogrid: BM=128 BN=64 warps=4 stages=4 indexing=pointer Ktile=32 ncol=1 layout=lo1", "category": "grid", "expected_gain": "unknown", "decision": "DISCARD", "tflops": 99.99, "timestamp": "2026-04-21T17:09:37Z"}
{"round": 703, "iter": "iter703", "bottleneck": "compute_bound", "idea": "iter703_autogrid: BM=128 BN=64 warps=4 stages=4 indexing=pointer Ktile=64 ncol=2 layout=mnk", "category": "grid", "expected_gain": "unknown", "decision": "DISCARD", "tflops": 116.09, "timestamp": "2026-04-21T17:09:42Z"}
{"round": 704, "iter": "iter704", "bottleneck": "compute_bound", "idea": "iter704_autogrid: BM=128 BN=64 warps=4 stages=4 indexing=pointer Ktile=64 ncol=2 layout=lo1", "category": "grid", "expected_gain": "unknown", "decision": "DISCARD", "tflops": 119.4, "timestamp": "2026-04-21T17:09:48Z"}
{"round": 705, "iter": "iter705", "bottleneck": "compute_bound", "idea": "iter705_autogrid: BM=128 BN=64 warps=4 stages=4 indexing=pointer Ktile=128 ncol=4 layout=mnk", "category": "grid", "expected_gain": "unknown", "decision": "DISCARD", "tflops": 110.33, "timestamp": "2026-04-21T17:09:53Z"}
{"round": 706, "iter": "iter706", "bottleneck": "compute_bound", "idea": "iter706_autogrid: BM=128 BN=64 warps=4 stages=4 indexing=pointer Ktile=128 ncol=4 layout=lo1", "category": "grid", "expected_gain": "unknown", "decision": "DISCARD", "tflops": 114.51, "timestamp": "2026-04-21T17:09:58Z"}
{"round": 707, "iter": "iter707", "bottleneck": "compute_bound", "idea": "iter707_autogrid: BM=128 BN=64 warps=4 stages=4 indexing=block_ptr Ktile=32 ncol=1 layout=mnk", "category": "grid", "expected_gain": "unknown", "decision": "DISCARD", "tflops": 100.27, "timestamp": "2026-04-21T17:10:03Z"}
{"round": 708, "iter": "iter708", "bottleneck": "compute_bound", "idea": "iter708_autogrid: BM=128 BN=64 warps=4 stages=4 indexing=block_ptr Ktile=32 ncol=1 layout=lo1", "category": "grid", "expected_gain": "unknown", "decision": "DISCARD", "tflops": 98.53, "timestamp": "2026-04-21T17:10:08Z"}
{"round": 709, "iter": "iter709", "bottleneck": "compute_bound", "idea": "iter709_autogrid: BM=128 BN=64 warps=4 stages=4 indexing=block_ptr Ktile=64 ncol=2 layout=mnk", "category": "grid", "expected_gain": "unknown", "decision": "DISCARD", "tflops": 121.1, "timestamp": "2026-04-21T17:10:13Z"}
{"round": 710, "iter": "iter710", "bottleneck": "compute_bound", "idea": "iter710_autogrid: BM=128 BN=64 warps=4 stages=4 indexing=block_ptr Ktile=64 ncol=2 layout=lo1", "category": "grid", "expected_gain": "unknown", "decision": "DISCARD", "tflops": 109.72, "timestamp": "2026-04-21T17:10:18Z"}
{"round": 711, "iter": "iter711", "bottleneck": "compute_bound", "idea": "iter711_autogrid: BM=128 BN=64 warps=4 stages=4 indexing=block_ptr Ktile=128 ncol=4 layout=mnk", "category": "grid", "expected_gain": "unknown", "decision": "DISCARD", "tflops": 109.08, "timestamp": "2026-04-21T17:10:24Z"}
{"round": 712, "iter": "iter712", "bottleneck": "compute_bound", "idea": "iter712_autogrid: BM=128 BN=64 warps=4 stages=4 indexing=block_ptr Ktile=128 ncol=4 layout=lo1", "category": "grid", "expected_gain": "unknown", "decision": "DISCARD", "tflops": 114.34, "timestamp": "2026-04-21T17:10:29Z"}
{"round": 713, "iter": "iter713", "bottleneck": "compute_bound", "idea": "iter713_autogrid: BM=128 BN=64 warps=4 stages=5 indexing=pointer Ktile=32 ncol=1 layout=mnk", "category": "grid", "expected_gain": "unknown", "decision": "DISCARD", "tflops": 100.02, "timestamp": "2026-04-21T17:10:34Z"}
{"round": 714, "iter": "iter714", "bottleneck": "compute_bound", "idea": "iter714_autogrid: BM=128 BN=64 warps=4 stages=5 indexing=pointer Ktile=32 ncol=1 layout=lo1", "category": "grid", "expected_gain": "unknown", "decision": "DISCARD", "tflops": 99.51, "timestamp": "2026-04-21T17:10:39Z"}
{"round": 715, "iter": "iter715", "bottleneck": "compute_bound", "idea": "iter715_autogrid: BM=128 BN=64 warps=4 stages=5 indexing=pointer Ktile=64 ncol=2 layout=mnk", "category": "grid", "expected_gain": "unknown", "decision": "DISCARD", "tflops": 110.61, "timestamp": "2026-04-21T17:10:44Z"}
{"round": 716, "iter": "iter716", "bottleneck": "compute_bound", "idea": "iter716_autogrid: BM=128 BN=64 warps=4 stages=5 indexing=pointer Ktile=64 ncol=2 layout=lo1", "category": "grid", "expected_gain": "unknown", "decision": "DISCARD", "tflops": 114.94, "timestamp": "2026-04-21T17:10:49Z"}
{"round": 717, "iter": "iter717", "bottleneck": "compute_bound", "idea": "iter717_autogrid: BM=128 BN=64 warps=4 stages=5 indexing=pointer Ktile=128 ncol=4 layout=mnk", "category": "grid", "expected_gain": "unknown", "decision": "DISCARD", "tflops": 110.35, "timestamp": "2026-04-21T17:10:54Z"}
{"round": 718, "iter": "iter718", "bottleneck": "compute_bound", "idea": "iter718_autogrid: BM=128 BN=64 warps=4 stages=5 indexing=pointer Ktile=128 ncol=4 layout=lo1", "category": "grid", "expected_gain": "unknown", "decision": "DISCARD", "tflops": 114.84, "timestamp": "2026-04-21T17:10:59Z"}
{"round": 719, "iter": "iter719", "bottleneck": "compute_bound", "idea": "iter719_autogrid: BM=128 BN=64 warps=4 stages=5 indexing=block_ptr Ktile=32 ncol=1 layout=mnk", "category": "grid", "expected_gain": "unknown", "decision": "DISCARD", "tflops": 100.64, "timestamp": "2026-04-21T17:11:04Z"}
{"round": 720, "iter": "iter720", "bottleneck": "compute_bound", "idea": "iter720_autogrid: BM=128 BN=64 warps=4 stages=5 indexing=block_ptr Ktile=32 ncol=1 layout=lo1", "category": "grid", "expected_gain": "unknown", "decision": "DISCARD", "tflops": 98.63, "timestamp": "2026-04-21T17:11:09Z"}
{"round": 721, "iter": "iter721", "bottleneck": "compute_bound", "idea": "iter721_autogrid: BM=128 BN=64 warps=4 stages=5 indexing=block_ptr Ktile=64 ncol=2 layout=mnk", "category": "grid", "expected_gain": "unknown", "decision": "DISCARD", "tflops": 112.78, "timestamp": "2026-04-21T17:11:15Z"}
{"round": 722, "iter": "iter722", "bottleneck": "compute_bound", "idea": "iter722_autogrid: BM=128 BN=64 warps=4 stages=5 indexing=block_ptr Ktile=64 ncol=2 layout=lo1", "category": "grid", "expected_gain": "unknown", "decision": "DISCARD", "tflops": 105.02, "timestamp": "2026-04-21T17:11:19Z"}
{"round": 723, "iter": "iter723", "bottleneck": "compute_bound", "idea": "iter723_autogrid: BM=128 BN=64 warps=4 stages=5 indexing=block_ptr Ktile=128 ncol=4 layout=mnk", "category": "grid", "expected_gain": "unknown", "decision": "DISCARD", "tflops": 108.52, "timestamp": "2026-04-21T17:11:25Z"}
{"round": 724, "iter": "iter724", "bottleneck": "compute_bound", "idea": "iter724_autogrid: BM=128 BN=64 warps=4 stages=5 indexing=block_ptr Ktile=128 ncol=4 layout=lo1", "category": "grid", "expected_gain": "unknown", "decision": "DISCARD", "tflops": 116.76, "timestamp": "2026-04-21T17:11:30Z"}
{"round": 725, "iter": "iter725", "bottleneck": "compute_bound", "idea": "iter725_autogrid: BM=128 BN=64 warps=4 stages=6 indexing=pointer Ktile=32 ncol=1 layout=mnk", "category": "grid", "expected_gain": "unknown", "decision": "DISCARD", "tflops": 97.91, "timestamp": "2026-04-21T17:11:35Z"}
{"round": 726, "iter": "iter726", "bottleneck": "compute_bound", "idea": "iter726_autogrid: BM=128 BN=64 warps=4 stages=6 indexing=pointer Ktile=32 ncol=1 layout=lo1", "category": "grid", "expected_gain": "unknown", "decision": "DISCARD", "tflops": 95.15, "timestamp": "2026-04-21T17:11:40Z"}
{"round": 727, "iter": "iter727", "bottleneck": "compute_bound", "idea": "iter727_autogrid: BM=128 BN=64 warps=4 stages=6 indexing=pointer Ktile=64 ncol=2 layout=mnk", "category": "grid", "expected_gain": "unknown", "decision": "DISCARD", "tflops": 110.18, "timestamp": "2026-04-21T17:11:45Z"}
{"round": 728, "iter": "iter728", "bottleneck": "compute_bound", "idea": "iter728_autogrid: BM=128 BN=64 warps=4 stages=6 indexing=pointer Ktile=64 ncol=2 layout=lo1", "category": "grid", "expected_gain": "unknown", "decision": "DISCARD", "tflops": 114.44, "timestamp": "2026-04-21T17:11:51Z"}
{"round": 729, "iter": "iter729", "bottleneck": "compute_bound", "idea": "iter729_autogrid: BM=128 BN=64 warps=4 stages=6 indexing=pointer Ktile=128 ncol=4 layout=mnk", "category": "grid", "expected_gain": "unknown", "decision": "DISCARD", "tflops": 72.1, "timestamp": "2026-04-21T17:11:56Z"}
{"round": 730, "iter": "iter730", "bottleneck": "compute_bound", "idea": "iter730_autogrid: BM=128 BN=64 warps=4 stages=6 indexing=pointer Ktile=128 ncol=4 layout=lo1", "category": "grid", "expected_gain": "unknown", "decision": "DISCARD", "tflops": 73.29, "timestamp": "2026-04-21T17:12:01Z"}
{"round": 731, "iter": "iter731", "bottleneck": "compute_bound", "idea": "iter731_autogrid: BM=128 BN=64 warps=4 stages=6 indexing=block_ptr Ktile=32 ncol=1 layout=mnk", "category": "grid", "expected_gain": "unknown", "decision": "DISCARD", "tflops": 96.33, "timestamp": "2026-04-21T17:12:06Z"}
{"round": 732, "iter": "iter732", "bottleneck": "compute_bound", "idea": "iter732_autogrid: BM=128 BN=64 warps=4 stages=6 indexing=block_ptr Ktile=32 ncol=1 layout=lo1", "category": "grid", "expected_gain": "unknown", "decision": "DISCARD", "tflops": 96.4, "timestamp": "2026-04-21T17:12:12Z"}
{"round": 733, "iter": "iter733", "bottleneck": "compute_bound", "idea": "iter733_autogrid: BM=128 BN=64 warps=4 stages=6 indexing=block_ptr Ktile=64 ncol=2 layout=mnk", "category": "grid", "expected_gain": "unknown", "decision": "DISCARD", "tflops": 112.51, "timestamp": "2026-04-21T17:12:17Z"}
{"round": 734, "iter": "iter734", "bottleneck": "compute_bound", "idea": "iter734_autogrid: BM=128 BN=64 warps=4 stages=6 indexing=block_ptr Ktile=64 ncol=2 layout=lo1", "category": "grid", "expected_gain": "unknown", "decision": "DISCARD", "tflops": 103.98, "timestamp": "2026-04-21T17:12:22Z"}
{"round": 735, "iter": "iter735", "bottleneck": "compute_bound", "idea": "iter735_autogrid: BM=128 BN=64 warps=4 stages=6 indexing=block_ptr Ktile=128 ncol=4 layout=mnk", "category": "grid", "expected_gain": "unknown", "decision": "DISCARD", "tflops": 68.52, "timestamp": "2026-04-21T17:12:27Z"}
{"round": 736, "iter": "iter736", "bottleneck": "compute_bound", "idea": "iter736_autogrid: BM=128 BN=64 warps=4 stages=6 indexing=block_ptr Ktile=128 ncol=4 layout=lo1", "category": "grid", "expected_gain": "unknown", "decision": "DISCARD", "tflops": 77.97, "timestamp": "2026-04-21T17:12:33Z"}
{"round": 737, "iter": "iter737", "bottleneck": "compute_bound", "idea": "iter737_autogrid: BM=128 BN=64 warps=8 stages=3 indexing=pointer Ktile=32 ncol=1 layout=mnk", "category": "grid", "expected_gain": "unknown", "decision": "DISCARD", "tflops": 75.95, "timestamp": "2026-04-21T17:12:38Z"}
{"round": 738, "iter": "iter738", "bottleneck": "compute_bound", "idea": "iter738_autogrid: BM=128 BN=64 warps=8 stages=3 indexing=pointer Ktile=32 ncol=1 layout=lo1", "category": "grid", "expected_gain": "unknown", "decision": "DISCARD", "tflops": 75.16, "timestamp": "2026-04-21T17:12:43Z"}
{"round": 739, "iter": "iter739", "bottleneck": "compute_bound", "idea": "iter739_autogrid: BM=128 BN=64 warps=8 stages=3 indexing=pointer Ktile=64 ncol=2 layout=mnk", "category": "grid", "expected_gain": "unknown", "decision": "DISCARD", "tflops": 98.95, "timestamp": "2026-04-21T17:12:48Z"}
{"round": 740, "iter": "iter740", "bottleneck": "compute_bound", "idea": "iter740_autogrid: BM=128 BN=64 warps=8 stages=3 indexing=pointer Ktile=64 ncol=2 layout=lo1", "category": "grid", "expected_gain": "unknown", "decision": "DISCARD", "tflops": 100.82, "timestamp": "2026-04-21T17:12:53Z"}
{"round": 741, "iter": "iter741", "bottleneck": "compute_bound", "idea": "iter741_autogrid: BM=128 BN=64 warps=8 stages=3 indexing=pointer Ktile=128 ncol=4 layout=mnk", "category": "grid", "expected_gain": "unknown", "decision": "DISCARD", "tflops": 84.11, "timestamp": "2026-04-21T17:12:59Z"}
{"round": 742, "iter": "iter742", "bottleneck": "compute_bound", "idea": "iter742_autogrid: BM=128 BN=64 warps=8 stages=3 indexing=pointer Ktile=128 ncol=4 layout=lo1", "category": "grid", "expected_gain": "unknown", "decision": "DISCARD", "tflops": 84.31, "timestamp": "2026-04-21T17:13:04Z"}
{"round": 743, "iter": "iter743", "bottleneck": "compute_bound", "idea": "iter743_autogrid: BM=128 BN=64 warps=8 stages=3 indexing=block_ptr Ktile=32 ncol=1 layout=mnk", "category": "grid", "expected_gain": "unknown", "decision": "DISCARD", "tflops": 75.05, "timestamp": "2026-04-21T17:13:09Z"}
{"round": 744, "iter": "iter744", "bottleneck": "compute_bound", "idea": "iter744_autogrid: BM=128 BN=64 warps=8 stages=3 indexing=block_ptr Ktile=32 ncol=1 layout=lo1", "category": "grid", "expected_gain": "unknown", "decision": "DISCARD", "tflops": 74.8, "timestamp": "2026-04-21T17:13:14Z"}
{"round": 745, "iter": "iter745", "bottleneck": "compute_bound", "idea": "iter745_autogrid: BM=128 BN=64 warps=8 stages=3 indexing=block_ptr Ktile=64 ncol=2 layout=mnk", "category": "grid", "expected_gain": "unknown", "decision": "DISCARD", "tflops": 100.27, "timestamp": "2026-04-21T17:13:19Z"}
{"round": 746, "iter": "iter746", "bottleneck": "compute_bound", "idea": "iter746_autogrid: BM=128 BN=64 warps=8 stages=3 indexing=block_ptr Ktile=64 ncol=2 layout=lo1", "category": "grid", "expected_gain": "unknown", "decision": "DISCARD", "tflops": 95.34, "timestamp": "2026-04-21T17:13:24Z"}
{"round": 747, "iter": "iter747", "bottleneck": "compute_bound", "idea": "iter747_autogrid: BM=128 BN=64 warps=8 stages=3 indexing=block_ptr Ktile=128 ncol=4 layout=mnk", "category": "grid", "expected_gain": "unknown", "decision": "DISCARD", "tflops": 85.13, "timestamp": "2026-04-21T17:13:29Z"}
{"round": 748, "iter": "iter748", "bottleneck": "compute_bound", "idea": "iter748_autogrid: BM=128 BN=64 warps=8 stages=3 indexing=block_ptr Ktile=128 ncol=4 layout=lo1", "category": "grid", "expected_gain": "unknown", "decision": "DISCARD", "tflops": 89.88, "timestamp": "2026-04-21T17:13:34Z"}
{"round": 749, "iter": "iter749", "bottleneck": "compute_bound", "idea": "iter749_autogrid: BM=128 BN=64 warps=8 stages=4 indexing=pointer Ktile=32 ncol=1 layout=mnk", "category": "grid", "expected_gain": "unknown", "decision": "DISCARD", "tflops": 74.86, "timestamp": "2026-04-21T17:13:39Z"}
{"round": 750, "iter": "iter750", "bottleneck": "compute_bound", "idea": "iter750_autogrid: BM=128 BN=64 warps=8 stages=4 indexing=pointer Ktile=32 ncol=1 layout=lo1", "category": "grid", "expected_gain": "unknown", "decision": "DISCARD", "tflops": 75.16, "timestamp": "2026-04-21T17:13:44Z"}
{"round": 751, "iter": "iter751", "bottleneck": "compute_bound", "idea": "iter751_autogrid: BM=128 BN=64 warps=8 stages=4 indexing=pointer Ktile=64 ncol=2 layout=mnk", "category": "grid", "expected_gain": "unknown", "decision": "DISCARD", "tflops": 99.91, "timestamp": "2026-04-21T17:13:49Z"}
{"round": 752, "iter": "iter752", "bottleneck": "compute_bound", "idea": "iter752_autogrid: BM=128 BN=64 warps=8 stages=4 indexing=pointer Ktile=64 ncol=2 layout=lo1", "category": "grid", "expected_gain": "unknown", "decision": "DISCARD", "tflops": 100.91, "timestamp": "2026-04-21T17:13:54Z"}
{"round": 753, "iter": "iter753", "bottleneck": "compute_bound", "idea": "iter753_autogrid: BM=128 BN=64 warps=8 stages=4 indexing=pointer Ktile=128 ncol=4 layout=mnk", "category": "grid", "expected_gain": "unknown", "decision": "DISCARD", "tflops": 84.05, "timestamp": "2026-04-21T17:13:59Z"}
{"round": 754, "iter": "iter754", "bottleneck": "compute_bound", "idea": "iter754_autogrid: BM=128 BN=64 warps=8 stages=4 indexing=pointer Ktile=128 ncol=4 layout=lo1", "category": "grid", "expected_gain": "unknown", "decision": "DISCARD", "tflops": 84.08, "timestamp": "2026-04-21T17:14:04Z"}
{"round": 755, "iter": "iter755", "bottleneck": "compute_bound", "idea": "iter755_autogrid: BM=128 BN=64 warps=8 stages=4 indexing=block_ptr Ktile=32 ncol=1 layout=mnk", "category": "grid", "expected_gain": "unknown", "decision": "DISCARD", "tflops": 74.88, "timestamp": "2026-04-21T17:14:10Z"}
