{"round": 562, "iter": "iter562", "bottleneck": "compile", "idea": "iter562_autogrid: BM=64 BN=128 warps=4 stages=4 indexing=pointer Ktile=128 ncol=4 layout=lo1", "category": "grid", "expected_gain": "unknown", "decision": "COMPILE_FAIL", "tflops": 0.0, "timestamp": "2026-04-21T14:45:23Z"}
{"round": 563, "iter": "iter563", "bottleneck": "compile", "idea": "iter563_autogrid: BM=64 BN=128 warps=4 stages=4 indexing=block_ptr Ktile=32 ncol=1 layout=mnk", "category": "grid", "expected_gain": "unknown", "decision": "COMPILE_FAIL", "tflops": 0.0, "timestamp": "2026-04-21T14:45:27Z"}
{"round": 564, "iter": "iter564", "bottleneck": "compile", "idea": "iter564_autogrid: BM=64 BN=128 warps=4 stages=4 indexing=block_ptr Ktile=32 ncol=1 layout=lo1", "category": "grid", "expected_gain": "unknown", "decision": "COMPILE_FAIL", "tflops": 0.0, "timestamp": "2026-04-21T14:45:31Z"}
{"round": 565, "iter": "iter565", "bottleneck": "compile", "idea": "iter565_autogrid: BM=64 BN=128 warps=4 stages=4 indexing=block_ptr Ktile=64 ncol=2 layout=mnk", "category": "grid", "expected_gain": "unknown", "decision": "COMPILE_FAIL", "tflops": 0.0, "timestamp": "2026-04-21T14:45:35Z"}
{"round": 566, "iter": "iter566", "bottleneck": "compile", "idea": "iter566_autogrid: BM=64 BN=128 warps=4 stages=4 indexing=block_ptr Ktile=64 ncol=2 layout=lo1", "category": "grid", "expected_gain": "unknown", "decision": "COMPILE_FAIL", "tflops": 0.0, "timestamp": "2026-04-21T14:45:40Z"}
{"round": 567, "iter": "iter567", "bottleneck": "compile", "idea": "iter567_autogrid: BM=64 BN=128 warps=4 stages=4 indexing=block_ptr Ktile=128 ncol=4 layout=mnk", "category": "grid", "expected_gain": "unknown", "decision": "COMPILE_FAIL", "tflops": 0.0, "timestamp": "2026-04-21T14:45:44Z"}
{"round": 568, "iter": "iter568", "bottleneck": "compile", "idea": "iter568_autogrid: BM=64 BN=128 warps=4 stages=4 indexing=block_ptr Ktile=128 ncol=4 layout=lo1", "category": "grid", "expected_gain": "unknown", "decision": "COMPILE_FAIL", "tflops": 0.0, "timestamp": "2026-04-21T14:45:48Z"}
{"round": 569, "iter": "iter569", "bottleneck": "compile", "idea": "iter569_autogrid: BM=64 BN=128 warps=4 stages=5 indexing=pointer Ktile=32 ncol=1 layout=mnk", "category": "grid", "expected_gain": "unknown", "decision": "COMPILE_FAIL", "tflops": 0.0, "timestamp": "2026-04-21T14:45:52Z"}
{"round": 570, "iter": "iter570", "bottleneck": "compile", "idea": "iter570_autogrid: BM=64 BN=128 warps=4 stages=5 indexing=pointer Ktile=32 ncol=1 layout=lo1", "category": "grid", "expected_gain": "unknown", "decision": "COMPILE_FAIL", "tflops": 0.0, "timestamp": "2026-04-21T14:45:56Z"}
{"round": 571, "iter": "iter571", "bottleneck": "compile", "idea": "iter571_autogrid: BM=64 BN=128 warps=4 stages=5 indexing=pointer Ktile=64 ncol=2 layout=mnk", "category": "grid", "expected_gain": "unknown", "decision": "COMPILE_FAIL", "tflops": 0.0, "timestamp": "2026-04-21T14:46:00Z"}
{"round": 572, "iter": "iter572", "bottleneck": "compile", "idea": "iter572_autogrid: BM=64 BN=128 warps=4 stages=5 indexing=pointer Ktile=64 ncol=2 layout=lo1", "category": "grid", "expected_gain": "unknown", "decision": "COMPILE_FAIL", "tflops": 0.0, "timestamp": "2026-04-21T14:46:04Z"}
{"round": 573, "iter": "iter573", "bottleneck": "compile", "idea": "iter573_autogrid: BM=64 BN=128 warps=4 stages=5 indexing=pointer Ktile=128 ncol=4 layout=mnk", "category": "grid", "expected_gain": "unknown", "decision": "COMPILE_FAIL", "tflops": 0.0, "timestamp": "2026-04-21T14:46:09Z"}
{"round": 574, "iter": "iter574", "bottleneck": "compile", "idea": "iter574_autogrid: BM=64 BN=128 warps=4 stages=5 indexing=pointer Ktile=128 ncol=4 layout=lo1", "category": "grid", "expected_gain": "unknown", "decision": "COMPILE_FAIL", "tflops": 0.0, "timestamp": "2026-04-21T14:46:13Z"}
{"round": 575, "iter": "iter575", "bottleneck": "compile", "idea": "iter575_autogrid: BM=64 BN=128 warps=4 stages=5 indexing=block_ptr Ktile=32 ncol=1 layout=mnk", "category": "grid", "expected_gain": "unknown", "decision": "COMPILE_FAIL", "tflops": 0.0, "timestamp": "2026-04-21T14:46:17Z"}
{"round": 576, "iter": "iter576", "bottleneck": "compile", "idea": "iter576_autogrid: BM=64 BN=128 warps=4 stages=5 indexing=block_ptr Ktile=32 ncol=1 layout=lo1", "category": "grid", "expected_gain": "unknown", "decision": "COMPILE_FAIL", "tflops": 0.0, "timestamp": "2026-04-21T14:46:21Z"}
{"round": 577, "iter": "iter577", "bottleneck": "compile", "idea": "iter577_autogrid: BM=64 BN=128 warps=4 stages=5 indexing=block_ptr Ktile=64 ncol=2 layout=mnk", "category": "grid", "expected_gain": "unknown", "decision": "COMPILE_FAIL", "tflops": 0.0, "timestamp": "2026-04-21T14:46:26Z"}
{"round": 578, "iter": "iter578", "bottleneck": "compile", "idea": "iter578_autogrid: BM=64 BN=128 warps=4 stages=5 indexing=block_ptr Ktile=64 ncol=2 layout=lo1", "category": "grid", "expected_gain": "unknown", "decision": "COMPILE_FAIL", "tflops": 0.0, "timestamp": "2026-04-21T14:46:30Z"}
{"round": 579, "iter": "iter579", "bottleneck": "compile", "idea": "iter579_autogrid: BM=64 BN=128 warps=4 stages=5 indexing=block_ptr Ktile=128 ncol=4 layout=mnk", "category": "grid", "expected_gain": "unknown", "decision": "COMPILE_FAIL", "tflops": 0.0, "timestamp": "2026-04-21T14:46:35Z"}
{"round": 580, "iter": "iter580", "bottleneck": "compile", "idea": "iter580_autogrid: BM=64 BN=128 warps=4 stages=5 indexing=block_ptr Ktile=128 ncol=4 layout=lo1", "category": "grid", "expected_gain": "unknown", "decision": "COMPILE_FAIL", "tflops": 0.0, "timestamp": "2026-04-21T14:46:39Z"}
{"round": 581, "iter": "iter581", "bottleneck": "compile", "idea": "iter581_autogrid: BM=64 BN=128 warps=4 stages=6 indexing=pointer Ktile=32 ncol=1 layout=mnk", "category": "grid", "expected_gain": "unknown", "decision": "COMPILE_FAIL", "tflops": 0.0, "timestamp": "2026-04-21T14:46:43Z"}
{"round": 582, "iter": "iter582", "bottleneck": "compile", "idea": "iter582_autogrid: BM=64 BN=128 warps=4 stages=6 indexing=pointer Ktile=32 ncol=1 layout=lo1", "category": "grid", "expected_gain": "unknown", "decision": "COMPILE_FAIL", "tflops": 0.0, "timestamp": "2026-04-21T14:46:47Z"}
{"round": 583, "iter": "iter583", "bottleneck": "compile", "idea": "iter583_autogrid: BM=64 BN=128 warps=4 stages=6 indexing=pointer Ktile=64 ncol=2 layout=mnk", "category": "grid", "expected_gain": "unknown", "decision": "COMPILE_FAIL", "tflops": 0.0, "timestamp": "2026-04-21T14:46:51Z"}
{"round": 584, "iter": "iter584", "bottleneck": "compile", "idea": "iter584_autogrid: BM=64 BN=128 warps=4 stages=6 indexing=pointer Ktile=64 ncol=2 layout=lo1", "category": "grid", "expected_gain": "unknown", "decision": "COMPILE_FAIL", "tflops": 0.0, "timestamp": "2026-04-21T14:46:55Z"}
{"round": 585, "iter": "iter585", "bottleneck": "compile", "idea": "iter585_autogrid: BM=64 BN=128 warps=4 stages=6 indexing=pointer Ktile=128 ncol=4 layout=mnk", "category": "grid", "expected_gain": "unknown", "decision": "COMPILE_FAIL", "tflops": 0.0, "timestamp": "2026-04-21T14:46:59Z"}
{"round": 586, "iter": "iter586", "bottleneck": "compile", "idea": "iter586_autogrid: BM=64 BN=128 warps=4 stages=6 indexing=pointer Ktile=128 ncol=4 layout=lo1", "category": "grid", "expected_gain": "unknown", "decision": "COMPILE_FAIL", "tflops": 0.0, "timestamp": "2026-04-21T14:47:04Z"}
{"round": 587, "iter": "iter587", "bottleneck": "compile", "idea": "iter587_autogrid: BM=64 BN=128 warps=4 stages=6 indexing=block_ptr Ktile=32 ncol=1 layout=mnk", "category": "grid", "expected_gain": "unknown", "decision": "COMPILE_FAIL", "tflops": 0.0, "timestamp": "2026-04-21T14:47:08Z"}
{"round": 588, "iter": "iter588", "bottleneck": "compile", "idea": "iter588_autogrid: BM=64 BN=128 warps=4 stages=6 indexing=block_ptr Ktile=32 ncol=1 layout=lo1", "category": "grid", "expected_gain": "unknown", "decision": "COMPILE_FAIL", "tflops": 0.0, "timestamp": "2026-04-21T14:47:12Z"}
{"round": 589, "iter": "iter589", "bottleneck": "compile", "idea": "iter589_autogrid: BM=64 BN=128 warps=4 stages=6 indexing=block_ptr Ktile=64 ncol=2 layout=mnk", "category": "grid", "expected_gain": "unknown", "decision": "COMPILE_FAIL", "tflops": 0.0, "timestamp": "2026-04-21T14:47:15Z"}
{"round": 590, "iter": "iter590", "bottleneck": "compile", "idea": "iter590_autogrid: BM=64 BN=128 warps=4 stages=6 indexing=block_ptr Ktile=64 ncol=2 layout=lo1", "category": "grid", "expected_gain": "unknown", "decision": "COMPILE_FAIL", "tflops": 0.0, "timestamp": "2026-04-21T14:47:20Z"}
{"round": 591, "iter": "iter591", "bottleneck": "compile", "idea": "iter591_autogrid: BM=64 BN=128 warps=4 stages=6 indexing=block_ptr Ktile=128 ncol=4 layout=mnk", "category": "grid", "expected_gain": "unknown", "decision": "COMPILE_FAIL", "tflops": 0.0, "timestamp": "2026-04-21T14:47:24Z"}
{"round": 592, "iter": "iter592", "bottleneck": "compile", "idea": "iter592_autogrid: BM=64 BN=128 warps=4 stages=6 indexing=block_ptr Ktile=128 ncol=4 layout=lo1", "category": "grid", "expected_gain": "unknown", "decision": "COMPILE_FAIL", "tflops": 0.0, "timestamp": "2026-04-21T14:47:28Z"}
{"round": 593, "iter": "iter593", "bottleneck": "compile", "idea": "iter593_autogrid: BM=64 BN=128 warps=8 stages=3 indexing=pointer Ktile=32 ncol=1 layout=mnk", "category": "grid", "expected_gain": "unknown", "decision": "COMPILE_FAIL", "tflops": 0.0, "timestamp": "2026-04-21T14:47:32Z"}
{"round": 594, "iter": "iter594", "bottleneck": "compile", "idea": "iter594_autogrid: BM=64 BN=128 warps=8 stages=3 indexing=pointer Ktile=32 ncol=1 layout=lo1", "category": "grid", "expected_gain": "unknown", "decision": "COMPILE_FAIL", "tflops": 0.0, "timestamp": "2026-04-21T14:47:37Z"}
{"round": 595, "iter": "iter595", "bottleneck": "compile", "idea": "iter595_autogrid: BM=64 BN=128 warps=8 stages=3 indexing=pointer Ktile=64 ncol=2 layout=mnk", "category": "grid", "expected_gain": "unknown", "decision": "COMPILE_FAIL", "tflops": 0.0, "timestamp": "2026-04-21T14:47:41Z"}
{"round": 596, "iter": "iter596", "bottleneck": "compile", "idea": "iter596_autogrid: BM=64 BN=128 warps=8 stages=3 indexing=pointer Ktile=64 ncol=2 layout=lo1", "category": "grid", "expected_gain": "unknown", "decision": "COMPILE_FAIL", "tflops": 0.0, "timestamp": "2026-04-21T14:47:45Z"}
{"round": 597, "iter": "iter597", "bottleneck": "compile", "idea": "iter597_autogrid: BM=64 BN=128 warps=8 stages=3 indexing=pointer Ktile=128 ncol=4 layout=mnk", "category": "grid", "expected_gain": "unknown", "decision": "COMPILE_FAIL", "tflops": 0.0, "timestamp": "2026-04-21T14:47:49Z"}
{"round": 598, "iter": "iter598", "bottleneck": "compile", "idea": "iter598_autogrid: BM=64 BN=128 warps=8 stages=3 indexing=pointer Ktile=128 ncol=4 layout=lo1", "category": "grid", "expected_gain": "unknown", "decision": "COMPILE_FAIL", "tflops": 0.0, "timestamp": "2026-04-21T14:47:53Z"}
{"round": 599, "iter": "iter599", "bottleneck": "compile", "idea": "iter599_autogrid: BM=64 BN=128 warps=8 stages=3 indexing=block_ptr Ktile=32 ncol=1 layout=mnk", "category": "grid", "expected_gain": "unknown", "decision": "COMPILE_FAIL", "tflops": 0.0, "timestamp": "2026-04-21T14:47:57Z"}
{"round": 600, "iter": "iter600", "bottleneck": "compile", "idea": "iter600_autogrid: BM=64 BN=128 warps=8 stages=3 indexing=block_ptr Ktile=32 ncol=1 layout=lo1", "category": "grid", "expected_gain": "unknown", "decision": "COMPILE_FAIL", "tflops": 0.0, "timestamp": "2026-04-21T14:48:01Z"}
{"round": 601, "iter": "iter601", "bottleneck": "compile", "idea": "iter601_autogrid: BM=64 BN=128 warps=8 stages=3 indexing=block_ptr Ktile=64 ncol=2 layout=mnk", "category": "grid", "expected_gain": "unknown", "decision": "COMPILE_FAIL", "tflops": 0.0, "timestamp": "2026-04-21T14:48:05Z"}
{"round": 602, "iter": "iter602", "bottleneck": "compile", "idea": "iter602_autogrid: BM=64 BN=128 warps=8 stages=3 indexing=block_ptr Ktile=64 ncol=2 layout=lo1", "category": "grid", "expected_gain": "unknown", "decision": "COMPILE_FAIL", "tflops": 0.0, "timestamp": "2026-04-21T14:48:09Z"}
{"round": 603, "iter": "iter603", "bottleneck": "compile", "idea": "iter603_autogrid: BM=64 BN=128 warps=8 stages=3 indexing=block_ptr Ktile=128 ncol=4 layout=mnk", "category": "grid", "expected_gain": "unknown", "decision": "COMPILE_FAIL", "tflops": 0.0, "timestamp": "2026-04-21T14:48:14Z"}
{"round": 604, "iter": "iter604", "bottleneck": "compile", "idea": "iter604_autogrid: BM=64 BN=128 warps=8 stages=3 indexing=block_ptr Ktile=128 ncol=4 layout=lo1", "category": "grid", "expected_gain": "unknown", "decision": "COMPILE_FAIL", "tflops": 0.0, "timestamp": "2026-04-21T14:48:18Z"}
{"round": 605, "iter": "iter605", "bottleneck": "compile", "idea": "iter605_autogrid: BM=64 BN=128 warps=8 stages=4 indexing=pointer Ktile=32 ncol=1 layout=mnk", "category": "grid", "expected_gain": "unknown", "decision": "COMPILE_FAIL", "tflops": 0.0, "timestamp": "2026-04-21T14:48:23Z"}
{"round": 606, "iter": "iter606", "bottleneck": "compile", "idea": "iter606_autogrid: BM=64 BN=128 warps=8 stages=4 indexing=pointer Ktile=32 ncol=1 layout=lo1", "category": "grid", "expected_gain": "unknown", "decision": "COMPILE_FAIL", "tflops": 0.0, "timestamp": "2026-04-21T14:48:27Z"}
{"round": 607, "iter": "iter607", "bottleneck": "compile", "idea": "iter607_autogrid: BM=64 BN=128 warps=8 stages=4 indexing=pointer Ktile=64 ncol=2 layout=mnk", "category": "grid", "expected_gain": "unknown", "decision": "COMPILE_FAIL", "tflops": 0.0, "timestamp": "2026-04-21T14:48:31Z"}
{"round": 608, "iter": "iter608", "bottleneck": "compile", "idea": "iter608_autogrid: BM=64 BN=128 warps=8 stages=4 indexing=pointer Ktile=64 ncol=2 layout=lo1", "category": "grid", "expected_gain": "unknown", "decision": "COMPILE_FAIL", "tflops": 0.0, "timestamp": "2026-04-21T14:48:35Z"}
{"round": 609, "iter": "iter609", "bottleneck": "compile", "idea": "iter609_autogrid: BM=64 BN=128 warps=8 stages=4 indexing=pointer Ktile=128 ncol=4 layout=mnk", "category": "grid", "expected_gain": "unknown", "decision": "COMPILE_FAIL", "tflops": 0.0, "timestamp": "2026-04-21T14:48:39Z"}
{"round": 610, "iter": "iter610", "bottleneck": "compile", "idea": "iter610_autogrid: BM=64 BN=128 warps=8 stages=4 indexing=pointer Ktile=128 ncol=4 layout=lo1", "category": "grid", "expected_gain": "unknown", "decision": "COMPILE_FAIL", "tflops": 0.0, "timestamp": "2026-04-21T14:48:43Z"}
{"round": 611, "iter": "iter611", "bottleneck": "compile", "idea": "iter611_autogrid: BM=64 BN=128 warps=8 stages=4 indexing=block_ptr Ktile=32 ncol=1 layout=mnk", "category": "grid", "expected_gain": "unknown", "decision": "COMPILE_FAIL", "tflops": 0.0, "timestamp": "2026-04-21T14:48:47Z"}
{"round": 612, "iter": "iter612", "bottleneck": "compile", "idea": "iter612_autogrid: BM=64 BN=128 warps=8 stages=4 indexing=block_ptr Ktile=32 ncol=1 layout=lo1", "category": "grid", "expected_gain": "unknown", "decision": "COMPILE_FAIL", "tflops": 0.0, "timestamp": "2026-04-21T14:48:51Z"}
{"round": 613, "iter": "iter613", "bottleneck": "compile", "idea": "iter613_autogrid: BM=64 BN=128 warps=8 stages=4 indexing=block_ptr Ktile=64 ncol=2 layout=mnk", "category": "grid", "expected_gain": "unknown", "decision": "COMPILE_FAIL", "tflops": 0.0, "timestamp": "2026-04-21T14:48:55Z"}
{"round": 614, "iter": "iter614", "bottleneck": "compile", "idea": "iter614_autogrid: BM=64 BN=128 warps=8 stages=4 indexing=block_ptr Ktile=64 ncol=2 layout=lo1", "category": "grid", "expected_gain": "unknown", "decision": "COMPILE_FAIL", "tflops": 0.0, "timestamp": "2026-04-21T14:48:59Z"}
{"round": 615, "iter": "iter615", "bottleneck": "compile", "idea": "iter615_autogrid: BM=64 BN=128 warps=8 stages=4 indexing=block_ptr Ktile=128 ncol=4 layout=mnk", "category": "grid", "expected_gain": "unknown", "decision": "COMPILE_FAIL", "tflops": 0.0, "timestamp": "2026-04-21T14:49:03Z"}
{"round": 616, "iter": "iter616", "bottleneck": "compile", "idea": "iter616_autogrid: BM=64 BN=128 warps=8 stages=4 indexing=block_ptr Ktile=128 ncol=4 layout=lo1", "category": "grid", "expected_gain": "unknown", "decision": "COMPILE_FAIL", "tflops": 0.0, "timestamp": "2026-04-21T14:49:07Z"}
{"round": 617, "iter": "iter617", "bottleneck": "compile", "idea": "iter617_autogrid: BM=64 BN=128 warps=8 stages=5 indexing=pointer Ktile=32 ncol=1 layout=mnk", "category": "grid", "expected_gain": "unknown", "decision": "COMPILE_FAIL", "tflops": 0.0, "timestamp": "2026-04-21T14:49:11Z"}
{"round": 618, "iter": "iter618", "bottleneck": "compile", "idea": "iter618_autogrid: BM=64 BN=128 warps=8 stages=5 indexing=pointer Ktile=32 ncol=1 layout=lo1", "category": "grid", "expected_gain": "unknown", "decision": "COMPILE_FAIL", "tflops": 0.0, "timestamp": "2026-04-21T14:49:15Z"}
{"round": 619, "iter": "iter619", "bottleneck": "compile", "idea": "iter619_autogrid: BM=64 BN=128 warps=8 stages=5 indexing=pointer Ktile=64 ncol=2 layout=mnk", "category": "grid", "expected_gain": "unknown", "decision": "COMPILE_FAIL", "tflops": 0.0, "timestamp": "2026-04-21T14:49:19Z"}
{"round": 620, "iter": "iter620", "bottleneck": "compile", "idea": "iter620_autogrid: BM=64 BN=128 warps=8 stages=5 indexing=pointer Ktile=64 ncol=2 layout=lo1", "category": "grid", "expected_gain": "unknown", "decision": "COMPILE_FAIL", "tflops": 0.0, "timestamp": "2026-04-21T14:49:22Z"}
{"round": 621, "iter": "iter621", "bottleneck": "compile", "idea": "iter621_autogrid: BM=64 BN=128 warps=8 stages=5 indexing=pointer Ktile=128 ncol=4 layout=mnk", "category": "grid", "expected_gain": "unknown", "decision": "COMPILE_FAIL", "tflops": 0.0, "timestamp": "2026-04-21T14:49:27Z"}
{"round": 622, "iter": "iter622", "bottleneck": "compile", "idea": "iter622_autogrid: BM=64 BN=128 warps=8 stages=5 indexing=pointer Ktile=128 ncol=4 layout=lo1", "category": "grid", "expected_gain": "unknown", "decision": "COMPILE_FAIL", "tflops": 0.0, "timestamp": "2026-04-21T14:49:31Z"}
{"round": 623, "iter": "iter623", "bottleneck": "compile", "idea": "iter623_autogrid: BM=64 BN=128 warps=8 stages=5 indexing=block_ptr Ktile=32 ncol=1 layout=mnk", "category": "grid", "expected_gain": "unknown", "decision": "COMPILE_FAIL", "tflops": 0.0, "timestamp": "2026-04-21T14:49:34Z"}
{"round": 624, "iter": "iter624", "bottleneck": "compile", "idea": "iter624_autogrid: BM=64 BN=128 warps=8 stages=5 indexing=block_ptr Ktile=32 ncol=1 layout=lo1", "category": "grid", "expected_gain": "unknown", "decision": "COMPILE_FAIL", "tflops": 0.0, "timestamp": "2026-04-21T14:49:39Z"}
{"round": 625, "iter": "iter625", "bottleneck": "compile", "idea": "iter625_autogrid: BM=64 BN=128 warps=8 stages=5 indexing=block_ptr Ktile=64 ncol=2 layout=mnk", "category": "grid", "expected_gain": "unknown", "decision": "COMPILE_FAIL", "tflops": 0.0, "timestamp": "2026-04-21T14:49:43Z"}
{"round": 626, "iter": "iter626", "bottleneck": "compile", "idea": "iter626_autogrid: BM=64 BN=128 warps=8 stages=5 indexing=block_ptr Ktile=64 ncol=2 layout=lo1", "category": "grid", "expected_gain": "unknown", "decision": "COMPILE_FAIL", "tflops": 0.0, "timestamp": "2026-04-21T14:49:46Z"}
{"round": 627, "iter": "iter627", "bottleneck": "compile", "idea": "iter627_autogrid: BM=64 BN=128 warps=8 stages=5 indexing=block_ptr Ktile=128 ncol=4 layout=mnk", "category": "grid", "expected_gain": "unknown", "decision": "COMPILE_FAIL", "tflops": 0.0, "timestamp": "2026-04-21T14:49:51Z"}
{"round": 628, "iter": "iter628", "bottleneck": "compile", "idea": "iter628_autogrid: BM=64 BN=128 warps=8 stages=5 indexing=block_ptr Ktile=128 ncol=4 layout=lo1", "category": "grid", "expected_gain": "unknown", "decision": "COMPILE_FAIL", "tflops": 0.0, "timestamp": "2026-04-21T14:49:55Z"}
{"round": 629, "iter": "iter629", "bottleneck": "compile", "idea": "iter629_autogrid: BM=64 BN=128 warps=8 stages=6 indexing=pointer Ktile=32 ncol=1 layout=mnk", "category": "grid", "expected_gain": "unknown", "decision": "COMPILE_FAIL", "tflops": 0.0, "timestamp": "2026-04-21T14:49:59Z"}
{"round": 630, "iter": "iter630", "bottleneck": "compile", "idea": "iter630_autogrid: BM=64 BN=128 warps=8 stages=6 indexing=pointer Ktile=32 ncol=1 layout=lo1", "category": "grid", "expected_gain": "unknown", "decision": "COMPILE_FAIL", "tflops": 0.0, "timestamp": "2026-04-21T14:50:04Z"}
{"round": 631, "iter": "iter631", "bottleneck": "compile", "idea": "iter631_autogrid: BM=64 BN=128 warps=8 stages=6 indexing=pointer Ktile=64 ncol=2 layout=mnk", "category": "grid", "expected_gain": "unknown", "decision": "COMPILE_FAIL", "tflops": 0.0, "timestamp": "2026-04-21T14:50:08Z"}
{"round": 632, "iter": "iter632", "bottleneck": "compile", "idea": "iter632_autogrid: BM=64 BN=128 warps=8 stages=6 indexing=pointer Ktile=64 ncol=2 layout=lo1", "category": "grid", "expected_gain": "unknown", "decision": "COMPILE_FAIL", "tflops": 0.0, "timestamp": "2026-04-21T14:50:12Z"}
{"round": 633, "iter": "iter633", "bottleneck": "compile", "idea": "iter633_autogrid: BM=64 BN=128 warps=8 stages=6 indexing=pointer Ktile=128 ncol=4 layout=mnk", "category": "grid", "expected_gain": "unknown", "decision": "COMPILE_FAIL", "tflops": 0.0, "timestamp": "2026-04-21T14:50:16Z"}
{"round": 634, "iter": "iter634", "bottleneck": "compile", "idea": "iter634_autogrid: BM=64 BN=128 warps=8 stages=6 indexing=pointer Ktile=128 ncol=4 layout=lo1", "category": "grid", "expected_gain": "unknown", "decision": "COMPILE_FAIL", "tflops": 0.0, "timestamp": "2026-04-21T14:50:21Z"}
{"round": 635, "iter": "iter635", "bottleneck": "compile", "idea": "iter635_autogrid: BM=64 BN=128 warps=8 stages=6 indexing=block_ptr Ktile=32 ncol=1 layout=mnk", "category": "grid", "expected_gain": "unknown", "decision": "COMPILE_FAIL", "tflops": 0.0, "timestamp": "2026-04-21T14:50:25Z"}
{"round": 636, "iter": "iter636", "bottleneck": "compile", "idea": "iter636_autogrid: BM=64 BN=128 warps=8 stages=6 indexing=block_ptr Ktile=32 ncol=1 layout=lo1", "category": "grid", "expected_gain": "unknown", "decision": "COMPILE_FAIL", "tflops": 0.0, "timestamp": "2026-04-21T14:50:29Z"}
