{"round": 830, "iter": "iter830", "bottleneck": "compute_bound", "idea": "iter830_autogrid: BM=256 BN=128 warps=2 stages=6 indexing=block_ptr Ktile=64 ncol=2 layout=lo1", "category": "grid", "expected_gain": "unknown", "decision": "DISCARD", "tflops": 1.78, "timestamp": "2026-04-21T17:25:39Z"}
{"round": 831, "iter": "iter831", "bottleneck": "compile", "idea": "iter831_autogrid: BM=256 BN=128 warps=2 stages=6 indexing=block_ptr Ktile=128 ncol=4 layout=mnk", "category": "grid", "expected_gain": "unknown", "decision": "COMPILE_FAIL", "tflops": 0.0, "timestamp": "2026-04-21T17:25:44Z"}
{"round": 832, "iter": "iter832", "bottleneck": "compile", "idea": "iter832_autogrid: BM=256 BN=128 warps=2 stages=6 indexing=block_ptr Ktile=128 ncol=4 layout=lo1", "category": "grid", "expected_gain": "unknown", "decision": "COMPILE_FAIL", "tflops": 0.0, "timestamp": "2026-04-21T17:25:49Z"}
{"round": 833, "iter": "iter833", "bottleneck": "compute_bound", "idea": "iter833_autogrid: BM=256 BN=128 warps=4 stages=3 indexing=pointer Ktile=32 ncol=1 layout=mnk", "category": "grid", "expected_gain": "unknown", "decision": "DISCARD", "tflops": 66.08, "timestamp": "2026-04-21T17:25:55Z"}
{"round": 834, "iter": "iter834", "bottleneck": "compute_bound", "idea": "iter834_autogrid: BM=256 BN=128 warps=4 stages=3 indexing=pointer Ktile=32 ncol=1 layout=lo1", "category": "grid", "expected_gain": "unknown", "decision": "DISCARD", "tflops": 67.58, "timestamp": "2026-04-21T17:26:00Z"}
{"round": 835, "iter": "iter835", "bottleneck": "compute_bound", "idea": "iter835_autogrid: BM=256 BN=128 warps=4 stages=3 indexing=pointer Ktile=64 ncol=2 layout=mnk", "category": "grid", "expected_gain": "unknown", "decision": "DISCARD", "tflops": 67.27, "timestamp": "2026-04-21T17:26:05Z"}
{"round": 836, "iter": "iter836", "bottleneck": "compute_bound", "idea": "iter836_autogrid: BM=256 BN=128 warps=4 stages=3 indexing=pointer Ktile=64 ncol=2 layout=lo1", "category": "grid", "expected_gain": "unknown", "decision": "DISCARD", "tflops": 80.5, "timestamp": "2026-04-21T17:26:10Z"}
{"round": 837, "iter": "iter837", "bottleneck": "compute_bound", "idea": "iter837_autogrid: BM=256 BN=128 warps=4 stages=3 indexing=pointer Ktile=128 ncol=4 layout=mnk", "category": "grid", "expected_gain": "unknown", "decision": "DISCARD", "tflops": 86.96, "timestamp": "2026-04-21T17:26:16Z"}
{"round": 838, "iter": "iter838", "bottleneck": "compute_bound", "idea": "iter838_autogrid: BM=256 BN=128 warps=4 stages=3 indexing=pointer Ktile=128 ncol=4 layout=lo1", "category": "grid", "expected_gain": "unknown", "decision": "DISCARD", "tflops": 79.02, "timestamp": "2026-04-21T17:26:21Z"}
{"round": 839, "iter": "iter839", "bottleneck": "compute_bound", "idea": "iter839_autogrid: BM=256 BN=128 warps=4 stages=3 indexing=block_ptr Ktile=32 ncol=1 layout=mnk", "category": "grid", "expected_gain": "unknown", "decision": "DISCARD", "tflops": 63.59, "timestamp": "2026-04-21T17:26:27Z"}
{"round": 840, "iter": "iter840", "bottleneck": "compute_bound", "idea": "iter840_autogrid: BM=256 BN=128 warps=4 stages=3 indexing=block_ptr Ktile=32 ncol=1 layout=lo1", "category": "grid", "expected_gain": "unknown", "decision": "DISCARD", "tflops": 67.1, "timestamp": "2026-04-21T17:26:32Z"}
{"round": 841, "iter": "iter841", "bottleneck": "compute_bound", "idea": "iter841_autogrid: BM=256 BN=128 warps=4 stages=3 indexing=block_ptr Ktile=64 ncol=2 layout=mnk", "category": "grid", "expected_gain": "unknown", "decision": "DISCARD", "tflops": 68.34, "timestamp": "2026-04-21T17:26:37Z"}
{"round": 842, "iter": "iter842", "bottleneck": "compute_bound", "idea": "iter842_autogrid: BM=256 BN=128 warps=4 stages=3 indexing=block_ptr Ktile=64 ncol=2 layout=lo1", "category": "grid", "expected_gain": "unknown", "decision": "DISCARD", "tflops": 81.72, "timestamp": "2026-04-21T17:26:42Z"}
{"round": 843, "iter": "iter843", "bottleneck": "compute_bound", "idea": "iter843_autogrid: BM=256 BN=128 warps=4 stages=3 indexing=block_ptr Ktile=128 ncol=4 layout=mnk", "category": "grid", "expected_gain": "unknown", "decision": "DISCARD", "tflops": 77.4, "timestamp": "2026-04-21T17:26:48Z"}
{"round": 844, "iter": "iter844", "bottleneck": "compute_bound", "idea": "iter844_autogrid: BM=256 BN=128 warps=4 stages=3 indexing=block_ptr Ktile=128 ncol=4 layout=lo1", "category": "grid", "expected_gain": "unknown", "decision": "DISCARD", "tflops": 84.88, "timestamp": "2026-04-21T17:26:53Z"}
{"round": 845, "iter": "iter845", "bottleneck": "compute_bound", "idea": "iter845_autogrid: BM=256 BN=128 warps=4 stages=4 indexing=pointer Ktile=32 ncol=1 layout=mnk", "category": "grid", "expected_gain": "unknown", "decision": "DISCARD", "tflops": 67.13, "timestamp": "2026-04-21T17:26:58Z"}
{"round": 846, "iter": "iter846", "bottleneck": "compute_bound", "idea": "iter846_autogrid: BM=256 BN=128 warps=4 stages=4 indexing=pointer Ktile=32 ncol=1 layout=lo1", "category": "grid", "expected_gain": "unknown", "decision": "DISCARD", "tflops": 68.68, "timestamp": "2026-04-21T17:27:03Z"}
{"round": 847, "iter": "iter847", "bottleneck": "compute_bound", "idea": "iter847_autogrid: BM=256 BN=128 warps=4 stages=4 indexing=pointer Ktile=64 ncol=2 layout=mnk", "category": "grid", "expected_gain": "unknown", "decision": "DISCARD", "tflops": 68.09, "timestamp": "2026-04-21T17:27:09Z"}
{"round": 848, "iter": "iter848", "bottleneck": "compute_bound", "idea": "iter848_autogrid: BM=256 BN=128 warps=4 stages=4 indexing=pointer Ktile=64 ncol=2 layout=lo1", "category": "grid", "expected_gain": "unknown", "decision": "DISCARD", "tflops": 81.33, "timestamp": "2026-04-21T17:27:14Z"}
{"round": 849, "iter": "iter849", "bottleneck": "compute_bound", "idea": "iter849_autogrid: BM=256 BN=128 warps=4 stages=4 indexing=pointer Ktile=128 ncol=4 layout=mnk", "category": "grid", "expected_gain": "unknown", "decision": "DISCARD", "tflops": 85.25, "timestamp": "2026-04-21T17:27:19Z"}
{"round": 850, "iter": "iter850", "bottleneck": "compute_bound", "idea": "iter850_autogrid: BM=256 BN=128 warps=4 stages=4 indexing=pointer Ktile=128 ncol=4 layout=lo1", "category": "grid", "expected_gain": "unknown", "decision": "DISCARD", "tflops": 78.6, "timestamp": "2026-04-21T17:27:24Z"}
{"round": 851, "iter": "iter851", "bottleneck": "compute_bound", "idea": "iter851_autogrid: BM=256 BN=128 warps=4 stages=4 indexing=block_ptr Ktile=32 ncol=1 layout=mnk", "category": "grid", "expected_gain": "unknown", "decision": "DISCARD", "tflops": 64.74, "timestamp": "2026-04-21T17:27:29Z"}
{"round": 852, "iter": "iter852", "bottleneck": "compute_bound", "idea": "iter852_autogrid: BM=256 BN=128 warps=4 stages=4 indexing=block_ptr Ktile=32 ncol=1 layout=lo1", "category": "grid", "expected_gain": "unknown", "decision": "DISCARD", "tflops": 65.88, "timestamp": "2026-04-21T17:27:35Z"}
{"round": 853, "iter": "iter853", "bottleneck": "compute_bound", "idea": "iter853_autogrid: BM=256 BN=128 warps=4 stages=4 indexing=block_ptr Ktile=64 ncol=2 layout=mnk", "category": "grid", "expected_gain": "unknown", "decision": "DISCARD", "tflops": 68.99, "timestamp": "2026-04-21T17:27:40Z"}
{"round": 854, "iter": "iter854", "bottleneck": "compute_bound", "idea": "iter854_autogrid: BM=256 BN=128 warps=4 stages=4 indexing=block_ptr Ktile=64 ncol=2 layout=lo1", "category": "grid", "expected_gain": "unknown", "decision": "DISCARD", "tflops": 82.73, "timestamp": "2026-04-21T17:27:45Z"}
{"round": 855, "iter": "iter855", "bottleneck": "compute_bound", "idea": "iter855_autogrid: BM=256 BN=128 warps=4 stages=4 indexing=block_ptr Ktile=128 ncol=4 layout=mnk", "category": "grid", "expected_gain": "unknown", "decision": "DISCARD", "tflops": 77.18, "timestamp": "2026-04-21T17:27:51Z"}
{"round": 856, "iter": "iter856", "bottleneck": "compute_bound", "idea": "iter856_autogrid: BM=256 BN=128 warps=4 stages=4 indexing=block_ptr Ktile=128 ncol=4 layout=lo1", "category": "grid", "expected_gain": "unknown", "decision": "DISCARD", "tflops": 84.61, "timestamp": "2026-04-21T17:27:56Z"}
{"round": 857, "iter": "iter857", "bottleneck": "compute_bound", "idea": "iter857_autogrid: BM=256 BN=128 warps=4 stages=5 indexing=pointer Ktile=32 ncol=1 layout=mnk", "category": "grid", "expected_gain": "unknown", "decision": "DISCARD", "tflops": 61.4, "timestamp": "2026-04-21T17:28:01Z"}
{"round": 858, "iter": "iter858", "bottleneck": "compute_bound", "idea": "iter858_autogrid: BM=256 BN=128 warps=4 stages=5 indexing=pointer Ktile=32 ncol=1 layout=lo1", "category": "grid", "expected_gain": "unknown", "decision": "DISCARD", "tflops": 66.07, "timestamp": "2026-04-21T17:28:07Z"}
{"round": 859, "iter": "iter859", "bottleneck": "compute_bound", "idea": "iter859_autogrid: BM=256 BN=128 warps=4 stages=5 indexing=pointer Ktile=64 ncol=2 layout=mnk", "category": "grid", "expected_gain": "unknown", "decision": "DISCARD", "tflops": 68.49, "timestamp": "2026-04-21T17:28:12Z"}
{"round": 860, "iter": "iter860", "bottleneck": "compute_bound", "idea": "iter860_autogrid: BM=256 BN=128 warps=4 stages=5 indexing=pointer Ktile=64 ncol=2 layout=lo1", "category": "grid", "expected_gain": "unknown", "decision": "DISCARD", "tflops": 81.08, "timestamp": "2026-04-21T17:28:18Z"}
{"round": 861, "iter": "iter861", "bottleneck": "compute_bound", "idea": "iter861_autogrid: BM=256 BN=128 warps=4 stages=5 indexing=pointer Ktile=128 ncol=4 layout=mnk", "category": "grid", "expected_gain": "unknown", "decision": "DISCARD", "tflops": 86.0, "timestamp": "2026-04-21T17:28:23Z"}
{"round": 862, "iter": "iter862", "bottleneck": "compute_bound", "idea": "iter862_autogrid: BM=256 BN=128 warps=4 stages=5 indexing=pointer Ktile=128 ncol=4 layout=lo1", "category": "grid", "expected_gain": "unknown", "decision": "DISCARD", "tflops": 78.9, "timestamp": "2026-04-21T17:28:28Z"}
{"round": 863, "iter": "iter863", "bottleneck": "compute_bound", "idea": "iter863_autogrid: BM=256 BN=128 warps=4 stages=5 indexing=block_ptr Ktile=32 ncol=1 layout=mnk", "category": "grid", "expected_gain": "unknown", "decision": "DISCARD", "tflops": 59.45, "timestamp": "2026-04-21T17:28:33Z"}
{"round": 864, "iter": "iter864", "bottleneck": "compute_bound", "idea": "iter864_autogrid: BM=256 BN=128 warps=4 stages=5 indexing=block_ptr Ktile=32 ncol=1 layout=lo1", "category": "grid", "expected_gain": "unknown", "decision": "DISCARD", "tflops": 64.29, "timestamp": "2026-04-21T17:28:38Z"}
{"round": 865, "iter": "iter865", "bottleneck": "compute_bound", "idea": "iter865_autogrid: BM=256 BN=128 warps=4 stages=5 indexing=block_ptr Ktile=64 ncol=2 layout=mnk", "category": "grid", "expected_gain": "unknown", "decision": "DISCARD", "tflops": 69.13, "timestamp": "2026-04-21T17:28:44Z"}
{"round": 866, "iter": "iter866", "bottleneck": "compute_bound", "idea": "iter866_autogrid: BM=256 BN=128 warps=4 stages=5 indexing=block_ptr Ktile=64 ncol=2 layout=lo1", "category": "grid", "expected_gain": "unknown", "decision": "DISCARD", "tflops": 83.24, "timestamp": "2026-04-21T17:28:49Z"}
{"round": 867, "iter": "iter867", "bottleneck": "compute_bound", "idea": "iter867_autogrid: BM=256 BN=128 warps=4 stages=5 indexing=block_ptr Ktile=128 ncol=4 layout=mnk", "category": "grid", "expected_gain": "unknown", "decision": "DISCARD", "tflops": 76.67, "timestamp": "2026-04-21T17:28:55Z"}
{"round": 868, "iter": "iter868", "bottleneck": "compute_bound", "idea": "iter868_autogrid: BM=256 BN=128 warps=4 stages=5 indexing=block_ptr Ktile=128 ncol=4 layout=lo1", "category": "grid", "expected_gain": "unknown", "decision": "DISCARD", "tflops": 84.25, "timestamp": "2026-04-21T17:29:00Z"}
{"round": 869, "iter": "iter869", "bottleneck": "compute_bound", "idea": "iter869_autogrid: BM=256 BN=128 warps=4 stages=6 indexing=pointer Ktile=32 ncol=1 layout=mnk", "category": "grid", "expected_gain": "unknown", "decision": "DISCARD", "tflops": 61.57, "timestamp": "2026-04-21T17:29:05Z"}
{"round": 870, "iter": "iter870", "bottleneck": "compute_bound", "idea": "iter870_autogrid: BM=256 BN=128 warps=4 stages=6 indexing=pointer Ktile=32 ncol=1 layout=lo1", "category": "grid", "expected_gain": "unknown", "decision": "DISCARD", "tflops": 65.48, "timestamp": "2026-04-21T17:29:10Z"}
{"round": 871, "iter": "iter871", "bottleneck": "compute_bound", "idea": "iter871_autogrid: BM=256 BN=128 warps=4 stages=6 indexing=pointer Ktile=64 ncol=2 layout=mnk", "category": "grid", "expected_gain": "unknown", "decision": "DISCARD", "tflops": 65.73, "timestamp": "2026-04-21T17:29:16Z"}
{"round": 872, "iter": "iter872", "bottleneck": "compute_bound", "idea": "iter872_autogrid: BM=256 BN=128 warps=4 stages=6 indexing=pointer Ktile=64 ncol=2 layout=lo1", "category": "grid", "expected_gain": "unknown", "decision": "DISCARD", "tflops": 64.79, "timestamp": "2026-04-21T17:29:21Z"}
{"round": 873, "iter": "iter873", "bottleneck": "compile", "idea": "iter873_autogrid: BM=256 BN=128 warps=4 stages=6 indexing=pointer Ktile=128 ncol=4 layout=mnk", "category": "grid", "expected_gain": "unknown", "decision": "COMPILE_FAIL", "tflops": 0.0, "timestamp": "2026-04-21T17:29:26Z"}
{"round": 874, "iter": "iter874", "bottleneck": "compile", "idea": "iter874_autogrid: BM=256 BN=128 warps=4 stages=6 indexing=pointer Ktile=128 ncol=4 layout=lo1", "category": "grid", "expected_gain": "unknown", "decision": "COMPILE_FAIL", "tflops": 0.0, "timestamp": "2026-04-21T17:29:31Z"}
{"round": 875, "iter": "iter875", "bottleneck": "compute_bound", "idea": "iter875_autogrid: BM=256 BN=128 warps=4 stages=6 indexing=block_ptr Ktile=32 ncol=1 layout=mnk", "category": "grid", "expected_gain": "unknown", "decision": "DISCARD", "tflops": 59.4, "timestamp": "2026-04-21T17:29:37Z"}
{"round": 876, "iter": "iter876", "bottleneck": "compute_bound", "idea": "iter876_autogrid: BM=256 BN=128 warps=4 stages=6 indexing=block_ptr Ktile=32 ncol=1 layout=lo1", "category": "grid", "expected_gain": "unknown", "decision": "DISCARD", "tflops": 64.53, "timestamp": "2026-04-21T17:29:42Z"}
{"round": 877, "iter": "iter877", "bottleneck": "compute_bound", "idea": "iter877_autogrid: BM=256 BN=128 warps=4 stages=6 indexing=block_ptr Ktile=64 ncol=2 layout=mnk", "category": "grid", "expected_gain": "unknown", "decision": "DISCARD", "tflops": 66.52, "timestamp": "2026-04-21T17:29:47Z"}
{"round": 878, "iter": "iter878", "bottleneck": "compute_bound", "idea": "iter878_autogrid: BM=256 BN=128 warps=4 stages=6 indexing=block_ptr Ktile=64 ncol=2 layout=lo1", "category": "grid", "expected_gain": "unknown", "decision": "DISCARD", "tflops": 66.77, "timestamp": "2026-04-21T17:29:52Z"}
{"round": 879, "iter": "iter879", "bottleneck": "compile", "idea": "iter879_autogrid: BM=256 BN=128 warps=4 stages=6 indexing=block_ptr Ktile=128 ncol=4 layout=mnk", "category": "grid", "expected_gain": "unknown", "decision": "COMPILE_FAIL", "tflops": 0.0, "timestamp": "2026-04-21T17:29:57Z"}
{"round": 880, "iter": "iter880", "bottleneck": "compile", "idea": "iter880_autogrid: BM=256 BN=128 warps=4 stages=6 indexing=block_ptr Ktile=128 ncol=4 layout=lo1", "category": "grid", "expected_gain": "unknown", "decision": "COMPILE_FAIL", "tflops": 0.0, "timestamp": "2026-04-21T17:30:02Z"}
{"round": 881, "iter": "iter881", "bottleneck": "compute_bound", "idea": "iter881_autogrid: BM=256 BN=128 warps=8 stages=3 indexing=pointer Ktile=32 ncol=1 layout=mnk", "category": "grid", "expected_gain": "unknown", "decision": "DISCARD", "tflops": 106.63, "timestamp": "2026-04-21T17:30:07Z"}
{"round": 882, "iter": "iter882", "bottleneck": "compute_bound", "idea": "iter882_autogrid: BM=256 BN=128 warps=8 stages=3 indexing=pointer Ktile=32 ncol=1 layout=lo1", "category": "grid", "expected_gain": "unknown", "decision": "DISCARD", "tflops": 102.95, "timestamp": "2026-04-21T17:30:12Z"}
{"round": 883, "iter": "iter883", "bottleneck": "compute_bound", "idea": "iter883_autogrid: BM=256 BN=128 warps=8 stages=3 indexing=pointer Ktile=64 ncol=2 layout=mnk", "category": "grid", "expected_gain": "unknown", "decision": "DISCARD", "tflops": 141.42, "timestamp": "2026-04-21T17:30:18Z"}
{"round": 884, "iter": "iter884", "bottleneck": "compute_bound", "idea": "iter884_autogrid: BM=256 BN=128 warps=8 stages=3 indexing=pointer Ktile=64 ncol=2 layout=lo1", "category": "grid", "expected_gain": "unknown", "decision": "DISCARD", "tflops": 148.12, "timestamp": "2026-04-21T17:30:24Z"}
{"round": 885, "iter": "iter885", "bottleneck": "compute_bound", "idea": "iter885_autogrid: BM=256 BN=128 warps=8 stages=3 indexing=pointer Ktile=128 ncol=4 layout=mnk", "category": "grid", "expected_gain": "unknown", "decision": "KEEP", "tflops": 162.99, "timestamp": "2026-04-21T17:30:31Z"}
{"round": 886, "iter": "iter886", "bottleneck": "compute_bound", "idea": "iter886_autogrid: BM=256 BN=128 warps=8 stages=3 indexing=pointer Ktile=128 ncol=4 layout=lo1", "category": "grid", "expected_gain": "unknown", "decision": "DISCARD", "tflops": 160.9, "timestamp": "2026-04-21T17:30:37Z"}
{"round": 887, "iter": "iter887", "bottleneck": "compute_bound", "idea": "iter887_autogrid: BM=256 BN=128 warps=8 stages=3 indexing=block_ptr Ktile=32 ncol=1 layout=mnk", "category": "grid", "expected_gain": "unknown", "decision": "DISCARD", "tflops": 106.88, "timestamp": "2026-04-21T17:30:43Z"}
{"round": 888, "iter": "iter888", "bottleneck": "compute_bound", "idea": "iter888_autogrid: BM=256 BN=128 warps=8 stages=3 indexing=block_ptr Ktile=32 ncol=1 layout=lo1", "category": "grid", "expected_gain": "unknown", "decision": "DISCARD", "tflops": 108.97, "timestamp": "2026-04-21T17:30:49Z"}
{"round": 889, "iter": "iter889", "bottleneck": "compute_bound", "idea": "iter889_autogrid: BM=256 BN=128 warps=8 stages=3 indexing=block_ptr Ktile=64 ncol=2 layout=mnk", "category": "grid", "expected_gain": "unknown", "decision": "DISCARD", "tflops": 142.52, "timestamp": "2026-04-21T17:30:54Z"}
{"round": 890, "iter": "iter890", "bottleneck": "compute_bound", "idea": "iter890_autogrid: BM=256 BN=128 warps=8 stages=3 indexing=block_ptr Ktile=64 ncol=2 layout=lo1", "category": "grid", "expected_gain": "unknown", "decision": "DISCARD", "tflops": 145.88, "timestamp": "2026-04-21T17:31:00Z"}
{"round": 891, "iter": "iter891", "bottleneck": "compute_bound", "idea": "iter891_autogrid: BM=256 BN=128 warps=8 stages=3 indexing=block_ptr Ktile=128 ncol=4 layout=mnk", "category": "grid", "expected_gain": "unknown", "decision": "KEEP", "tflops": 167.04, "timestamp": "2026-04-21T17:31:07Z"}
{"round": 892, "iter": "iter892", "bottleneck": "compute_bound", "idea": "iter892_autogrid: BM=256 BN=128 warps=8 stages=3 indexing=block_ptr Ktile=128 ncol=4 layout=lo1", "category": "grid", "expected_gain": "unknown", "decision": "DISCARD", "tflops": 165.98, "timestamp": "2026-04-21T17:31:13Z"}
{"round": 893, "iter": "iter893", "bottleneck": "compute_bound", "idea": "iter893_autogrid: BM=256 BN=128 warps=8 stages=4 indexing=pointer Ktile=32 ncol=1 layout=mnk", "category": "grid", "expected_gain": "unknown", "decision": "DISCARD", "tflops": 108.39, "timestamp": "2026-04-21T17:31:19Z"}
{"round": 894, "iter": "iter894", "bottleneck": "compute_bound", "idea": "iter894_autogrid: BM=256 BN=128 warps=8 stages=4 indexing=pointer Ktile=32 ncol=1 layout=lo1", "category": "grid", "expected_gain": "unknown", "decision": "DISCARD", "tflops": 103.78, "timestamp": "2026-04-21T17:31:24Z"}
{"round": 895, "iter": "iter895", "bottleneck": "compute_bound", "idea": "iter895_autogrid: BM=256 BN=128 warps=8 stages=4 indexing=pointer Ktile=64 ncol=2 layout=mnk", "category": "grid", "expected_gain": "unknown", "decision": "DISCARD", "tflops": 140.99, "timestamp": "2026-04-21T17:31:30Z"}
{"round": 896, "iter": "iter896", "bottleneck": "compute_bound", "idea": "iter896_autogrid: BM=256 BN=128 warps=8 stages=4 indexing=pointer Ktile=64 ncol=2 layout=lo1", "category": "grid", "expected_gain": "unknown", "decision": "DISCARD", "tflops": 147.24, "timestamp": "2026-04-21T17:31:36Z"}
{"round": 897, "iter": "iter897", "bottleneck": "compute_bound", "idea": "iter897_autogrid: BM=256 BN=128 warps=8 stages=4 indexing=pointer Ktile=128 ncol=4 layout=mnk", "category": "grid", "expected_gain": "unknown", "decision": "DISCARD", "tflops": 165.13, "timestamp": "2026-04-21T17:31:43Z"}
{"round": 898, "iter": "iter898", "bottleneck": "compute_bound", "idea": "iter898_autogrid: BM=256 BN=128 warps=8 stages=4 indexing=pointer Ktile=128 ncol=4 layout=lo1", "category": "grid", "expected_gain": "unknown", "decision": "DISCARD", "tflops": 159.52, "timestamp": "2026-04-21T17:31:49Z"}
{"round": 899, "iter": "iter899", "bottleneck": "compute_bound", "idea": "iter899_autogrid: BM=256 BN=128 warps=8 stages=4 indexing=block_ptr Ktile=32 ncol=1 layout=mnk", "category": "grid", "expected_gain": "unknown", "decision": "DISCARD", "tflops": 106.21, "timestamp": "2026-04-21T17:31:55Z"}
{"round": 900, "iter": "iter900", "bottleneck": "compute_bound", "idea": "iter900_autogrid: BM=256 BN=128 warps=8 stages=4 indexing=block_ptr Ktile=32 ncol=1 layout=lo1", "category": "grid", "expected_gain": "unknown", "decision": "DISCARD", "tflops": 108.83, "timestamp": "2026-04-21T17:32:00Z"}
