{"round": 80, "iter": "iter080", "bottleneck": "compute_bound", "idea": "iter080_autogrid: BM=64 BN=64 warps=8 stages=1 indexing=pointer", "category": "grid", "expected_gain": "unknown", "decision": "DISCARD", "tflops": 48.16, "timestamp": "2026-04-21T12:26:30Z"}
{"round": 81, "iter": "iter081", "bottleneck": "compute_bound", "idea": "iter081_autogrid: BM=64 BN=128 warps=8 stages=1 indexing=pointer", "category": "grid", "expected_gain": "unknown", "decision": "DISCARD", "tflops": 56.78, "timestamp": "2026-04-21T12:26:36Z"}
{"round": 82, "iter": "iter082", "bottleneck": "compute_bound", "idea": "iter082_autogrid: BM=128 BN=64 warps=8 stages=1 indexing=pointer", "category": "grid", "expected_gain": "unknown", "decision": "DISCARD", "tflops": 77.7, "timestamp": "2026-04-21T12:26:41Z"}
{"round": 83, "iter": "iter083", "bottleneck": "compute_bound", "idea": "iter083_autogrid: BM=128 BN=128 warps=8 stages=1 indexing=pointer", "category": "grid", "expected_gain": "unknown", "decision": "DISCARD", "tflops": 88.45, "timestamp": "2026-04-21T12:26:47Z"}
{"round": 84, "iter": "iter084", "bottleneck": "compute_bound", "idea": "iter084_autogrid: BM=128 BN=256 warps=8 stages=1 indexing=pointer", "category": "grid", "expected_gain": "unknown", "decision": "DISCARD", "tflops": 107.93, "timestamp": "2026-04-21T12:26:53Z"}
{"round": 85, "iter": "iter085", "bottleneck": "compute_bound", "idea": "iter085_autogrid: BM=256 BN=128 warps=8 stages=1 indexing=pointer", "category": "grid", "expected_gain": "unknown", "decision": "DISCARD", "tflops": 94.37, "timestamp": "2026-04-21T12:26:59Z"}
{"round": 86, "iter": "iter086", "bottleneck": "compute_bound", "idea": "iter086_autogrid: BM=256 BN=256 warps=8 stages=1 indexing=pointer", "category": "grid", "expected_gain": "unknown", "decision": "DISCARD", "tflops": 28.44, "timestamp": "2026-04-21T12:27:05Z"}
{"round": 87, "iter": "iter087", "bottleneck": "compute_bound", "idea": "iter087_autogrid: BM=64 BN=64 warps=4 stages=1 indexing=block_ptr", "category": "grid", "expected_gain": "unknown", "decision": "DISCARD", "tflops": 72.76, "timestamp": "2026-04-21T12:27:11Z"}
{"round": 88, "iter": "iter088", "bottleneck": "compute_bound", "idea": "iter088_autogrid: BM=64 BN=128 warps=4 stages=1 indexing=block_ptr", "category": "grid", "expected_gain": "unknown", "decision": "DISCARD", "tflops": 114.7, "timestamp": "2026-04-21T12:27:16Z"}
{"round": 89, "iter": "iter089", "bottleneck": "compute_bound", "idea": "iter089_autogrid: BM=128 BN=64 warps=4 stages=1 indexing=block_ptr", "category": "grid", "expected_gain": "unknown", "decision": "DISCARD", "tflops": 101.07, "timestamp": "2026-04-21T12:27:22Z"}
{"round": 90, "iter": "iter090", "bottleneck": "compute_bound", "idea": "iter090_autogrid: BM=128 BN=128 warps=4 stages=1 indexing=block_ptr", "category": "grid", "expected_gain": "unknown", "decision": "DISCARD", "tflops": 112.98, "timestamp": "2026-04-21T12:27:28Z"}
{"round": 91, "iter": "iter091", "bottleneck": "compute_bound", "idea": "iter091_autogrid: BM=128 BN=256 warps=4 stages=1 indexing=block_ptr", "category": "grid", "expected_gain": "unknown", "decision": "DISCARD", "tflops": 29.87, "timestamp": "2026-04-21T12:27:34Z"}
{"round": 92, "iter": "iter092", "bottleneck": "compute_bound", "idea": "iter092_autogrid: BM=256 BN=128 warps=4 stages=1 indexing=block_ptr", "category": "grid", "expected_gain": "unknown", "decision": "DISCARD", "tflops": 64.49, "timestamp": "2026-04-21T12:27:40Z"}
{"round": 93, "iter": "iter093", "bottleneck": "compute_bound", "idea": "iter093_autogrid: BM=256 BN=256 warps=4 stages=1 indexing=block_ptr", "category": "grid", "expected_gain": "unknown", "decision": "DISCARD", "tflops": 14.03, "timestamp": "2026-04-21T12:27:49Z"}
{"round": 94, "iter": "iter094", "bottleneck": "compute_bound", "idea": "iter094_autogrid: BM=64 BN=64 warps=8 stages=1 indexing=block_ptr", "category": "grid", "expected_gain": "unknown", "decision": "DISCARD", "tflops": 48.75, "timestamp": "2026-04-21T12:27:54Z"}
{"round": 95, "iter": "iter095", "bottleneck": "compute_bound", "idea": "iter095_autogrid: BM=128 BN=128 warps=8 stages=1 indexing=block_ptr", "category": "grid", "expected_gain": "unknown", "decision": "DISCARD", "tflops": 88.95, "timestamp": "2026-04-21T12:28:00Z"}
{"round": 96, "iter": "iter096", "bottleneck": "compute_bound", "idea": "iter096_autogrid: BM=256 BN=256 warps=8 stages=1 indexing=block_ptr", "category": "grid", "expected_gain": "unknown", "decision": "DISCARD", "tflops": 28.44, "timestamp": "2026-04-21T12:28:06Z"}
{"round": 97, "iter": "iter097", "bottleneck": "compute_bound", "idea": "iter097_autogrid: BM=64 BN=64 warps=4 stages=2 indexing=block_ptr", "category": "grid", "expected_gain": "unknown", "decision": "DISCARD", "tflops": 73.47, "timestamp": "2026-04-21T12:28:12Z"}
{"round": 98, "iter": "iter098", "bottleneck": "compute_bound", "idea": "iter098_autogrid: BM=128 BN=128 warps=4 stages=2 indexing=block_ptr", "category": "grid", "expected_gain": "unknown", "decision": "DISCARD", "tflops": 122.62, "timestamp": "2026-04-21T12:28:17Z"}
{"round": 99, "iter": "iter099", "bottleneck": "compute_bound", "idea": "iter099_autogrid: BM=256 BN=256 warps=4 stages=2 indexing=block_ptr", "category": "grid", "expected_gain": "unknown", "decision": "DISCARD", "tflops": 14.03, "timestamp": "2026-04-21T12:28:26Z"}
{"round": 100, "iter": "iter100", "bottleneck": "compute_bound", "idea": "iter100_autogrid: BM=64 BN=128 warps=4 stages=2 indexing=pointer", "category": "grid", "expected_gain": "unknown", "decision": "DISCARD", "tflops": 29.07, "timestamp": "2026-04-21T12:28:32Z"}
{"round": 101, "iter": "iter101", "bottleneck": "compute_bound", "idea": "iter101_autogrid: BM=128 BN=128 warps=4 stages=1 indexing=block_ptr Ktile=32 ncol=1", "category": "grid", "expected_gain": "unknown", "decision": "DISCARD", "tflops": 114.93, "timestamp": "2026-04-21T12:30:43Z"}
{"round": 102, "iter": "iter102", "bottleneck": "compute_bound", "idea": "iter102_autogrid: BM=128 BN=128 warps=4 stages=1 indexing=block_ptr Ktile=64 ncol=2", "category": "grid", "expected_gain": "unknown", "decision": "KEEP", "tflops": 144.58, "timestamp": "2026-04-21T12:30:55Z"}
{"round": 103, "iter": "iter103", "bottleneck": "compute_bound", "idea": "iter103_autogrid: BM=128 BN=128 warps=4 stages=1 indexing=block_ptr Ktile=128 ncol=4", "category": "grid", "expected_gain": "unknown", "decision": "DISCARD", "tflops": 118.29, "timestamp": "2026-04-21T12:31:01Z"}
{"round": 104, "iter": "iter104", "bottleneck": "compute_bound", "idea": "iter104_autogrid: BM=128 BN=128 warps=4 stages=1 indexing=pointer Ktile=32 ncol=1", "category": "grid", "expected_gain": "unknown", "decision": "DISCARD", "tflops": 41.84, "timestamp": "2026-04-21T12:31:08Z"}
{"round": 105, "iter": "iter105", "bottleneck": "compute_bound", "idea": "iter105_autogrid: BM=128 BN=128 warps=4 stages=1 indexing=pointer Ktile=64 ncol=2", "category": "grid", "expected_gain": "unknown", "decision": "KEEP", "tflops": 146.5, "timestamp": "2026-04-21T12:31:14Z"}
{"round": 106, "iter": "iter106", "bottleneck": "compute_bound", "idea": "iter106_autogrid: BM=128 BN=128 warps=4 stages=1 indexing=pointer Ktile=128 ncol=4", "category": "grid", "expected_gain": "unknown", "decision": "DISCARD", "tflops": 106.0, "timestamp": "2026-04-21T12:31:20Z"}
{"round": 107, "iter": "iter107", "bottleneck": "compute_bound", "idea": "iter107_autogrid: BM=128 BN=128 warps=4 stages=2 indexing=block_ptr Ktile=32 ncol=1", "category": "grid", "expected_gain": "unknown", "decision": "DISCARD", "tflops": 123.38, "timestamp": "2026-04-21T12:31:26Z"}
{"round": 108, "iter": "iter108", "bottleneck": "compute_bound", "idea": "iter108_autogrid: BM=128 BN=128 warps=4 stages=2 indexing=block_ptr Ktile=64 ncol=2", "category": "grid", "expected_gain": "unknown", "decision": "KEEP", "tflops": 158.22, "timestamp": "2026-04-21T12:31:32Z"}
{"round": 109, "iter": "iter109", "bottleneck": "compute_bound", "idea": "iter109_autogrid: BM=128 BN=128 warps=4 stages=2 indexing=block_ptr Ktile=128 ncol=4", "category": "grid", "expected_gain": "unknown", "decision": "DISCARD", "tflops": 119.4, "timestamp": "2026-04-21T12:31:38Z"}
{"round": 110, "iter": "iter110", "bottleneck": "compute_bound", "idea": "iter110_autogrid: BM=128 BN=128 warps=4 stages=2 indexing=pointer Ktile=32 ncol=1", "category": "grid", "expected_gain": "unknown", "decision": "DISCARD", "tflops": 125.88, "timestamp": "2026-04-21T12:31:44Z"}
{"round": 111, "iter": "iter111", "bottleneck": "compute_bound", "idea": "iter111_autogrid: BM=128 BN=128 warps=4 stages=2 indexing=pointer Ktile=64 ncol=2", "category": "grid", "expected_gain": "unknown", "decision": "DISCARD", "tflops": 157.14, "timestamp": "2026-04-21T12:31:50Z"}
{"round": 112, "iter": "iter112", "bottleneck": "compute_bound", "idea": "iter112_autogrid: BM=128 BN=128 warps=4 stages=2 indexing=pointer Ktile=128 ncol=4", "category": "grid", "expected_gain": "unknown", "decision": "DISCARD", "tflops": 122.82, "timestamp": "2026-04-21T12:31:56Z"}
{"round": 113, "iter": "iter113", "bottleneck": "compute_bound", "idea": "iter113_autogrid: BM=128 BN=128 warps=4 stages=3 indexing=block_ptr Ktile=32 ncol=1", "category": "grid", "expected_gain": "unknown", "decision": "DISCARD", "tflops": 132.76, "timestamp": "2026-04-21T12:32:02Z"}
{"round": 114, "iter": "iter114", "bottleneck": "compute_bound", "idea": "iter114_autogrid: BM=128 BN=128 warps=4 stages=3 indexing=block_ptr Ktile=64 ncol=2", "category": "grid", "expected_gain": "unknown", "decision": "DISCARD", "tflops": 68.51, "timestamp": "2026-04-21T12:32:08Z"}
{"round": 115, "iter": "iter115", "bottleneck": "compute_bound", "idea": "iter115_autogrid: BM=128 BN=128 warps=4 stages=3 indexing=block_ptr Ktile=128 ncol=4", "category": "grid", "expected_gain": "unknown", "decision": "DISCARD", "tflops": 127.16, "timestamp": "2026-04-21T12:32:15Z"}
{"round": 116, "iter": "iter116", "bottleneck": "compute_bound", "idea": "iter116_autogrid: BM=128 BN=128 warps=4 stages=3 indexing=pointer Ktile=32 ncol=1", "category": "grid", "expected_gain": "unknown", "decision": "DISCARD", "tflops": 133.05, "timestamp": "2026-04-21T12:32:20Z"}
{"round": 117, "iter": "iter117", "bottleneck": "compute_bound", "idea": "iter117_autogrid: BM=128 BN=128 warps=4 stages=3 indexing=pointer Ktile=64 ncol=2", "category": "grid", "expected_gain": "unknown", "decision": "KEEP", "tflops": 162.12, "timestamp": "2026-04-21T12:32:26Z"}
{"round": 118, "iter": "iter118", "bottleneck": "compute_bound", "idea": "iter118_autogrid: BM=128 BN=128 warps=4 stages=3 indexing=pointer Ktile=128 ncol=4", "category": "grid", "expected_gain": "unknown", "decision": "DISCARD", "tflops": 128.57, "timestamp": "2026-04-21T12:32:33Z"}
{"round": 119, "iter": "iter119", "bottleneck": "compute_bound", "idea": "iter119_autogrid: BM=128 BN=128 warps=4 stages=4 indexing=block_ptr Ktile=32 ncol=1", "category": "grid", "expected_gain": "unknown", "decision": "DISCARD", "tflops": 130.19, "timestamp": "2026-04-21T12:32:39Z"}
{"round": 120, "iter": "iter120", "bottleneck": "compute_bound", "idea": "iter120_autogrid: BM=128 BN=128 warps=4 stages=4 indexing=block_ptr Ktile=64 ncol=2", "category": "grid", "expected_gain": "unknown", "decision": "DISCARD", "tflops": 153.7, "timestamp": "2026-04-21T12:32:45Z"}
{"round": 121, "iter": "iter121", "bottleneck": "compute_bound", "idea": "iter121_autogrid: BM=128 BN=128 warps=4 stages=4 indexing=block_ptr Ktile=128 ncol=4", "category": "grid", "expected_gain": "unknown", "decision": "DISCARD", "tflops": 76.97, "timestamp": "2026-04-21T12:32:52Z"}
{"round": 122, "iter": "iter122", "bottleneck": "compute_bound", "idea": "iter122_autogrid: BM=128 BN=128 warps=4 stages=4 indexing=pointer Ktile=32 ncol=1", "category": "grid", "expected_gain": "unknown", "decision": "DISCARD", "tflops": 130.13, "timestamp": "2026-04-21T12:32:57Z"}
{"round": 123, "iter": "iter123", "bottleneck": "compute_bound", "idea": "iter123_autogrid: BM=128 BN=128 warps=4 stages=4 indexing=pointer Ktile=64 ncol=2", "category": "grid", "expected_gain": "unknown", "decision": "DISCARD", "tflops": 157.05, "timestamp": "2026-04-21T12:33:03Z"}
{"round": 124, "iter": "iter124", "bottleneck": "compute_bound", "idea": "iter124_autogrid: BM=128 BN=128 warps=4 stages=4 indexing=pointer Ktile=128 ncol=4", "category": "grid", "expected_gain": "unknown", "decision": "DISCARD", "tflops": 87.01, "timestamp": "2026-04-21T12:33:10Z"}
{"round": 125, "iter": "iter125", "bottleneck": "compute_bound", "idea": "iter125_autogrid: BM=128 BN=128 warps=8 stages=1 indexing=block_ptr Ktile=32 ncol=1", "category": "grid", "expected_gain": "unknown", "decision": "DISCARD", "tflops": 88.51, "timestamp": "2026-04-21T12:33:15Z"}
{"round": 126, "iter": "iter126", "bottleneck": "compute_bound", "idea": "iter126_autogrid: BM=128 BN=128 warps=8 stages=1 indexing=block_ptr Ktile=64 ncol=2", "category": "grid", "expected_gain": "unknown", "decision": "DISCARD", "tflops": 89.51, "timestamp": "2026-04-21T12:33:21Z"}
{"round": 127, "iter": "iter127", "bottleneck": "compute_bound", "idea": "iter127_autogrid: BM=128 BN=128 warps=8 stages=1 indexing=block_ptr Ktile=128 ncol=4", "category": "grid", "expected_gain": "unknown", "decision": "DISCARD", "tflops": 106.15, "timestamp": "2026-04-21T12:33:27Z"}
{"round": 128, "iter": "iter128", "bottleneck": "compute_bound", "idea": "iter128_autogrid: BM=128 BN=128 warps=8 stages=1 indexing=pointer Ktile=32 ncol=1", "category": "grid", "expected_gain": "unknown", "decision": "DISCARD", "tflops": 87.85, "timestamp": "2026-04-21T12:33:33Z"}
{"round": 129, "iter": "iter129", "bottleneck": "compute_bound", "idea": "iter129_autogrid: BM=128 BN=128 warps=8 stages=1 indexing=pointer Ktile=64 ncol=2", "category": "grid", "expected_gain": "unknown", "decision": "DISCARD", "tflops": 34.32, "timestamp": "2026-04-21T12:33:39Z"}
{"round": 130, "iter": "iter130", "bottleneck": "compute_bound", "idea": "iter130_autogrid: BM=128 BN=128 warps=8 stages=1 indexing=pointer Ktile=128 ncol=4", "category": "grid", "expected_gain": "unknown", "decision": "DISCARD", "tflops": 109.82, "timestamp": "2026-04-21T12:33:45Z"}
{"round": 131, "iter": "iter131", "bottleneck": "compute_bound", "idea": "iter131_autogrid: BM=128 BN=128 warps=8 stages=2 indexing=block_ptr Ktile=32 ncol=1", "category": "grid", "expected_gain": "unknown", "decision": "DISCARD", "tflops": 89.42, "timestamp": "2026-04-21T12:33:50Z"}
{"round": 132, "iter": "iter132", "bottleneck": "compute_bound", "idea": "iter132_autogrid: BM=128 BN=128 warps=8 stages=2 indexing=block_ptr Ktile=64 ncol=2", "category": "grid", "expected_gain": "unknown", "decision": "DISCARD", "tflops": 40.85, "timestamp": "2026-04-21T12:33:56Z"}
{"round": 133, "iter": "iter133", "bottleneck": "compute_bound", "idea": "iter133_autogrid: BM=128 BN=128 warps=8 stages=2 indexing=block_ptr Ktile=128 ncol=4", "category": "grid", "expected_gain": "unknown", "decision": "DISCARD", "tflops": 116.52, "timestamp": "2026-04-21T12:34:02Z"}
{"round": 134, "iter": "iter134", "bottleneck": "compute_bound", "idea": "iter134_autogrid: BM=128 BN=128 warps=8 stages=2 indexing=pointer Ktile=32 ncol=1", "category": "grid", "expected_gain": "unknown", "decision": "DISCARD", "tflops": 86.13, "timestamp": "2026-04-21T12:34:07Z"}
{"round": 135, "iter": "iter135", "bottleneck": "compute_bound", "idea": "iter135_autogrid: BM=128 BN=128 warps=8 stages=2 indexing=pointer Ktile=64 ncol=2", "category": "grid", "expected_gain": "unknown", "decision": "DISCARD", "tflops": 100.02, "timestamp": "2026-04-21T12:34:13Z"}
{"round": 136, "iter": "iter136", "bottleneck": "compute_bound", "idea": "iter136_autogrid: BM=128 BN=128 warps=8 stages=2 indexing=pointer Ktile=128 ncol=4", "category": "grid", "expected_gain": "unknown", "decision": "DISCARD", "tflops": 119.44, "timestamp": "2026-04-21T12:34:19Z"}
{"round": 137, "iter": "iter137", "bottleneck": "compute_bound", "idea": "iter137_autogrid: BM=128 BN=128 warps=8 stages=3 indexing=block_ptr Ktile=32 ncol=1", "category": "grid", "expected_gain": "unknown", "decision": "DISCARD", "tflops": 88.03, "timestamp": "2026-04-21T12:34:24Z"}
{"round": 138, "iter": "iter138", "bottleneck": "compute_bound", "idea": "iter138_autogrid: BM=128 BN=128 warps=8 stages=3 indexing=block_ptr Ktile=64 ncol=2", "category": "grid", "expected_gain": "unknown", "decision": "DISCARD", "tflops": 128.34, "timestamp": "2026-04-21T12:34:30Z"}
{"round": 139, "iter": "iter139", "bottleneck": "compute_bound", "idea": "iter139_autogrid: BM=128 BN=128 warps=8 stages=3 indexing=block_ptr Ktile=128 ncol=4", "category": "grid", "expected_gain": "unknown", "decision": "DISCARD", "tflops": 128.91, "timestamp": "2026-04-21T12:34:36Z"}
{"round": 140, "iter": "iter140", "bottleneck": "compute_bound", "idea": "iter140_autogrid: BM=128 BN=128 warps=8 stages=3 indexing=pointer Ktile=32 ncol=1", "category": "grid", "expected_gain": "unknown", "decision": "DISCARD", "tflops": 86.88, "timestamp": "2026-04-21T12:34:41Z"}
{"round": 141, "iter": "iter141", "bottleneck": "compute_bound", "idea": "iter141_autogrid: BM=128 BN=128 warps=8 stages=3 indexing=pointer Ktile=64 ncol=2", "category": "grid", "expected_gain": "unknown", "decision": "DISCARD", "tflops": 130.9, "timestamp": "2026-04-21T12:34:47Z"}
{"round": 142, "iter": "iter142", "bottleneck": "compute_bound", "idea": "iter142_autogrid: BM=128 BN=128 warps=8 stages=3 indexing=pointer Ktile=128 ncol=4", "category": "grid", "expected_gain": "unknown", "decision": "DISCARD", "tflops": 133.63, "timestamp": "2026-04-21T12:34:53Z"}
{"round": 143, "iter": "iter143", "bottleneck": "compute_bound", "idea": "iter143_autogrid: BM=128 BN=128 warps=8 stages=4 indexing=block_ptr Ktile=32 ncol=1", "category": "grid", "expected_gain": "unknown", "decision": "DISCARD", "tflops": 60.54, "timestamp": "2026-04-21T12:34:58Z"}
{"round": 144, "iter": "iter144", "bottleneck": "compute_bound", "idea": "iter144_autogrid: BM=128 BN=128 warps=8 stages=4 indexing=block_ptr Ktile=64 ncol=2", "category": "grid", "expected_gain": "unknown", "decision": "DISCARD", "tflops": 104.53, "timestamp": "2026-04-21T12:35:04Z"}
{"round": 145, "iter": "iter145", "bottleneck": "compute_bound", "idea": "iter145_autogrid: BM=128 BN=128 warps=8 stages=4 indexing=block_ptr Ktile=128 ncol=4", "category": "grid", "expected_gain": "unknown", "decision": "DISCARD", "tflops": 128.33, "timestamp": "2026-04-21T12:35:10Z"}
{"round": 146, "iter": "iter146", "bottleneck": "compute_bound", "idea": "iter146_autogrid: BM=128 BN=128 warps=8 stages=4 indexing=pointer Ktile=32 ncol=1", "category": "grid", "expected_gain": "unknown", "decision": "DISCARD", "tflops": 87.07, "timestamp": "2026-04-21T12:35:15Z"}
{"round": 147, "iter": "iter147", "bottleneck": "compute_bound", "idea": "iter147_autogrid: BM=128 BN=128 warps=8 stages=4 indexing=pointer Ktile=64 ncol=2", "category": "grid", "expected_gain": "unknown", "decision": "DISCARD", "tflops": 36.21, "timestamp": "2026-04-21T12:35:21Z"}
{"round": 148, "iter": "iter148", "bottleneck": "compute_bound", "idea": "iter148_autogrid: BM=128 BN=128 warps=8 stages=4 indexing=pointer Ktile=128 ncol=4", "category": "grid", "expected_gain": "unknown", "decision": "DISCARD", "tflops": 132.76, "timestamp": "2026-04-21T12:35:27Z"}
{"round": 149, "iter": "iter149", "bottleneck": "compute_bound", "idea": "iter149_autogrid: BM=128 BN=128 warps=16 stages=1 indexing=block_ptr Ktile=32 ncol=1", "category": "grid", "expected_gain": "unknown", "decision": "DISCARD", "tflops": 48.41, "timestamp": "2026-04-21T12:35:33Z"}
{"round": 150, "iter": "iter150", "bottleneck": "compute_bound", "idea": "iter150_autogrid: BM=128 BN=128 warps=16 stages=1 indexing=block_ptr Ktile=64 ncol=2", "category": "grid", "expected_gain": "unknown", "decision": "DISCARD", "tflops": 60.05, "timestamp": "2026-04-21T12:35:39Z"}
{"round": 151, "iter": "iter151", "bottleneck": "compute_bound", "idea": "iter151_autogrid: BM=128 BN=128 warps=16 stages=1 indexing=block_ptr Ktile=128 ncol=4", "category": "grid", "expected_gain": "unknown", "decision": "DISCARD", "tflops": 90.07, "timestamp": "2026-04-21T12:35:44Z"}
{"round": 152, "iter": "iter152", "bottleneck": "compute_bound", "idea": "iter152_autogrid: BM=128 BN=128 warps=16 stages=1 indexing=pointer Ktile=32 ncol=1", "category": "grid", "expected_gain": "unknown", "decision": "DISCARD", "tflops": 45.13, "timestamp": "2026-04-21T12:35:50Z"}
{"round": 153, "iter": "iter153", "bottleneck": "compute_bound", "idea": "iter153_autogrid: BM=128 BN=128 warps=16 stages=1 indexing=pointer Ktile=64 ncol=2", "category": "grid", "expected_gain": "unknown", "decision": "DISCARD", "tflops": 63.09, "timestamp": "2026-04-21T12:35:56Z"}
{"round": 154, "iter": "iter154", "bottleneck": "compute_bound", "idea": "iter154_autogrid: BM=128 BN=128 warps=16 stages=1 indexing=pointer Ktile=128 ncol=4", "category": "grid", "expected_gain": "unknown", "decision": "DISCARD", "tflops": 92.46, "timestamp": "2026-04-21T12:36:01Z"}
{"round": 155, "iter": "iter155", "bottleneck": "compute_bound", "idea": "iter155_autogrid: BM=128 BN=128 warps=16 stages=2 indexing=block_ptr Ktile=32 ncol=1", "category": "grid", "expected_gain": "unknown", "decision": "DISCARD", "tflops": 47.05, "timestamp": "2026-04-21T12:36:07Z"}
{"round": 156, "iter": "iter156", "bottleneck": "compute_bound", "idea": "iter156_autogrid: BM=128 BN=128 warps=16 stages=2 indexing=block_ptr Ktile=64 ncol=2", "category": "grid", "expected_gain": "unknown", "decision": "DISCARD", "tflops": 67.67, "timestamp": "2026-04-21T12:36:13Z"}
{"round": 157, "iter": "iter157", "bottleneck": "compute_bound", "idea": "iter157_autogrid: BM=128 BN=128 warps=16 stages=2 indexing=block_ptr Ktile=128 ncol=4", "category": "grid", "expected_gain": "unknown", "decision": "DISCARD", "tflops": 94.28, "timestamp": "2026-04-21T12:36:18Z"}
