{"round": 0, "iter": "iter000", "bottleneck": "baseline", "idea": "cuBLAS reference baseline", "category": "baseline", "expected_gain": "baseline reference", "decision": "KEEP", "tflops": 432.0588, "timestamp": "2026-04-18T15:51:56Z"}
{"round": 1, "iter": "iter001", "bottleneck": "mixed", "idea": "Discovery seed: selected tm128 wn128 s4 over persistent 1p1c after direct benchmark at target shape", "category": "tiling", "expected_gain": "bootstrap seed", "decision": "KEEP", "tflops": 211.393, "timestamp": "2026-04-18T15:56:34Z"}
{"round": 2, "iter": "iter002", "bottleneck": "memory_bound", "idea": "Reduced WARP_N to 64 and STAGES to 3 to try for 2 CTAs/SM; occupancy target improved but memory throughput collapsed and TFLOPS regressed", "category": "tiling", "expected_gain": "+20-40 TFLOPS via higher occupancy and better memory hiding", "decision": "DISCARD", "tflops": 109.267, "timestamp": "2026-04-18T16:00:45Z"}
{"round": 3, "iter": "iter003", "bottleneck": "memory_bound", "idea": "Switched iter001 tile traversal from N-major to M-major so each lhs row tile is reused across the small-N sweep; this reduced memory pressure and raised throughput materially", "category": "memory", "expected_gain": "+10-25 TFLOPS via better lhs reuse and lower DRAM pressure", "decision": "KEEP", "tflops": 267.028, "timestamp": "2026-04-18T16:03:42Z"}
{"round": 4, "iter": "iter004", "bottleneck": "compute_bound", "idea": "Reduced MATMUL_STAGES from 4 to 3 on the M-major base to lower barrier density, but the shallower pipeline underfed compute and throughput regressed", "category": "pipeline", "expected_gain": "+5-15 TFLOPS via lower barrier density and slightly lighter pipeline", "decision": "DISCARD", "tflops": 248.477, "timestamp": "2026-04-18T16:06:49Z"}
{"round": 5, "iter": "iter005", "bottleneck": "compute_bound", "idea": "Enabled Choreo hoist-offset and hoist-scale on the M-major base so generated code hoists address math out of the hot path; this produced a small but real TFLOPS gain", "category": "compute", "expected_gain": "+5-12 TFLOPS via lower IMAD/LOP3 pressure and cleaner generated address code", "decision": "KEEP", "tflops": 267.539, "timestamp": "2026-04-18T16:09:19Z"}
{"round": 6, "iter": "iter006", "bottleneck": "compute_bound", "idea": "Added Choreo ptx-barrier on top of the M-major hoist base so synchronization uses a lighter PTX barrier path; this cut sync overhead and improved TFLOPS materially", "category": "compute", "expected_gain": "+3-10 TFLOPS via lower CTA barrier cost on the compute-bound kernel", "decision": "KEEP", "tflops": 272.651, "timestamp": "2026-04-18T16:11:21Z"}
{"round": 7, "iter": "iter007", "bottleneck": "compute_bound", "idea": "Raised MATMUL_WARP_N to 152 on the iter006 base, but the extended-shape kernel failed numerical verification, so this wider tile is not a valid path for the fp16->fp32 shape", "category": "tiling", "expected_gain": "+5-15 TFLOPS via higher WGMMA work per tile at similar occupancy", "decision": "COMPILE_FAIL", "tflops": 0.0, "timestamp": "2026-04-18T16:15:50Z"}
{"round": 9, "iter": "iter008", "bottleneck": "compute_bound", "idea": "Phase-2 split epilogue: split each consumer 64x128 shared epilogue store into two 64x64 store_fragment_d writes to mimic a denser STS/LDS pattern, but the kernel measured 271.18 TFLOPS and slightly regressed versus iter006, so DISCARD.", "category": "memory", "expected_gain": "+3-8 TFLOPS", "decision": "DISCARD", "tflops": 271.18, "timestamp": "2026-04-18T23:00:25Z"}
{"round": 10, "iter": "iter009", "bottleneck": "compute_bound", "idea": "Phase-2 arrive_once: hoisted warpgroup_arrive out of the 4-step WGMMA micro-loop so each consumer arrives once per K stage instead of four, reducing warpgroup bookkeeping and raising throughput to 278.041 TFLOPS, so KEEP.", "category": "compute", "expected_gain": "+2-6 TFLOPS", "decision": "KEEP", "tflops": 278.041, "timestamp": "2026-04-18T23:02:24Z"}
{"round": 11, "iter": "iter010", "bottleneck": "compute_bound", "idea": "Phase-2 wait1: changed the in-loop warpgroup wait from wait<0> to wait<1> and drained with a final wait<0> before the epilogue, allowing one WGMMA batch to overlap the producer-consumer handoff and lifting throughput to 309.428 TFLOPS, so KEEP.", "category": "compute", "expected_gain": "+1-5 TFLOPS", "decision": "KEEP", "tflops": 309.428, "timestamp": "2026-04-18T23:04:14Z"}
{"round": 12, "iter": "iter011", "bottleneck": "compute_bound", "idea": "Phase-2 split epilogue on top of the arrive_once plus wait1 base: split each consumer 64x128 epilogue store into two 64x64 store_fragment_d writes, but it measured 306.52 TFLOPS and regressed versus iter010, so DISCARD.", "category": "memory", "expected_gain": "+0.5-4 TFLOPS", "decision": "DISCARD", "tflops": 306.52, "timestamp": "2026-04-18T23:05:49Z"}
{"round": 13, "iter": "iter012", "bottleneck": "compute_bound", "idea": "Changed warpgroup_wait from <1> to <2> allowing 2 WGMMA batches in-flight; regressed to 302 TFLOPS vs 309 baseline due to increased register pressure or scheduling overhead", "category": "compute", "expected_gain": "+5-15 TFLOPS", "decision": "DISCARD", "tflops": 302.0, "timestamp": "2026-04-19T04:55:34Z"}
{"round": 14, "iter": "iter013", "bottleneck": "compute_bound", "idea": "Increased pipeline stages from 4 to 5 with arrive_once and wait<1>; matched but did not beat iter010 baseline of 309.4 TFLOPS", "category": "pipeline", "expected_gain": "+5-20 TFLOPS", "decision": "DISCARD", "tflops": 309.2, "timestamp": "2026-04-19T04:58:08Z"}
{"round": 15, "iter": "iter014", "bottleneck": "compute_bound", "idea": "1p3c warp specialization with TILE_M=192 and STAGES=3; verification failed due to M=16384 not divisible by TILE_M=192", "category": "tiling", "expected_gain": "+5-25 TFLOPS", "decision": "SEGFAULT", "tflops": 0.0, "timestamp": "2026-04-19T05:01:27Z"}
{"round": 16, "iter": "iter015", "bottleneck": "compute_bound", "idea": "WARP_N=192 with STAGES=3 for wider MMA tiles; regressed to 302 TFLOPS due to shallower pipeline and higher register pressure", "category": "tiling", "expected_gain": "+5-15 TFLOPS", "decision": "DISCARD", "tflops": 302.0, "timestamp": "2026-04-19T05:04:21Z"}
{"round": 17, "iter": "iter016", "bottleneck": "compute_bound", "idea": "Reduce TILE_M to 64 with 1p1c warp specialization for higher occupancy; hypothesis: smaller tiles may improve wave balance for this non-square shape", "category": "tiling", "expected_gain": "+5 TFLOPS (occupancy)", "decision": "DISCARD", "tflops": 194.544, "timestamp": "2026-04-19T05:06:47Z"}
{"round": 18, "iter": "iter017", "bottleneck": "compute_bound", "idea": "Add 4-element row padding to output shared memory to reduce bank conflicts; SEGFAULT because TMA requires contiguous layout that padding breaks", "category": "memory", "expected_gain": "+15% TFLOPS (bank conflict)", "decision": "SEGFAULT", "tflops": 0.0, "timestamp": "2026-04-19T05:10:27Z"}
{"round": 19, "iter": "iter018", "bottleneck": "compute_bound", "idea": "Reduce WARP_N from 128 to 64 to halve output tile for higher occupancy; regression to 198 TFLOPS - smaller tile does less compute per memory access", "category": "tiling", "expected_gain": "+20 TFLOPS (occupancy)", "decision": "DISCARD", "tflops": 198.075, "timestamp": "2026-04-19T05:12:26Z"}
{"round": 20, "iter": "iter019", "bottleneck": "compute_bound", "idea": "Increase WARP_N to 256 with STAGES=2; assertion failure likely due to insufficient pipeline depth or tile count mismatch", "category": "tiling", "expected_gain": "+30 TFLOPS (N-tile)", "decision": "SEGFAULT", "tflops": 0.0, "timestamp": "2026-04-19T05:14:48Z"}
{"round": 21, "iter": "iter020", "bottleneck": "compute_bound", "idea": "Add __launch_bounds__(384, 1) to constrain registers; minBlocks=2 caused register spill, minBlocks=1 has no effect on register allocation", "category": "misc", "expected_gain": "+15 TFLOPS (occupancy)", "decision": "DISCARD", "tflops": 304.287, "timestamp": "2026-04-19T05:17:49Z"}
{"round": 22, "iter": "iter021", "bottleneck": "compute_bound", "idea": "N-major tile ordering; regression to 219 TFLOPS because larger M dimension should be swept last for LHS row reuse", "category": "misc", "expected_gain": "+10 TFLOPS (cache)", "decision": "DISCARD", "tflops": 219.446, "timestamp": "2026-04-19T05:20:21Z"}
{"round": 23, "iter": "iter022", "bottleneck": "compute_bound", "idea": "WARP_N=256 with STAGES=3 exceeds shared memory limit (278KB > 233KB)", "category": "tiling", "expected_gain": "+30 TFLOPS", "decision": "COMPILE_FAIL", "tflops": 0.0, "timestamp": "2026-04-19T05:21:11Z"}
{"round": 24, "iter": "iter023", "bottleneck": "compute_bound", "idea": "STAGES=3 to reduce SMEM; regression to 284 TFLOPS - shallower pipeline hurts more than SMEM savings help", "category": "pipeline", "expected_gain": "+5 TFLOPS (occupancy)", "decision": "DISCARD", "tflops": 284.172, "timestamp": "2026-04-19T05:22:56Z"}
{"round": 25, "iter": "iter024", "bottleneck": "compute_bound", "idea": "nvcc --use_fast_math; no improvement since WGMMA is already optimized", "category": "misc", "expected_gain": "+10 TFLOPS", "decision": "DISCARD", "tflops": 302.073, "timestamp": "2026-04-19T05:24:01Z"}
{"round": 26, "iter": "iter025", "bottleneck": "compute_bound", "idea": "nvcc -maxrregcount=128 to limit registers and enable higher occupancy", "category": "misc", "expected_gain": "+10 TFLOPS (occupancy)", "decision": "KEEP", "tflops": 311.962, "timestamp": "2026-04-19T05:25:03Z"}
{"round": 27, "iter": "iter026", "bottleneck": "compute_bound", "idea": "maxrregcount=112 too aggressive; register spilling hurts more than occupancy gain", "category": "misc", "expected_gain": "+5 TFLOPS", "decision": "DISCARD", "tflops": 299.22, "timestamp": "2026-04-19T05:26:03Z"}
{"round": 28, "iter": "iter027", "bottleneck": "compute_bound", "idea": "maxrregcount=144 is worse than 128; 128 is close to optimal", "category": "misc", "expected_gain": "+3 TFLOPS", "decision": "DISCARD", "tflops": 293.067, "timestamp": "2026-04-19T05:26:52Z"}
{"round": 29, "iter": "iter028", "bottleneck": "compute_bound", "idea": "STAGES=3 + maxreg=128 combo worse than STAGES=4 + maxreg=128; 4 stages is optimal", "category": "pipeline", "expected_gain": "+5 TFLOPS", "decision": "DISCARD", "tflops": 294.365, "timestamp": "2026-04-19T05:27:44Z"}
{"round": 30, "iter": "iter029", "bottleneck": "compute_bound", "idea": "-dlcm=ca cache flag; no significant improvement over noise", "category": "nvcc_flags", "expected_gain": "+5 TFLOPS", "decision": "DISCARD", "tflops": 311.7, "timestamp": "2026-04-19T05:28:55Z"}
{"round": 31, "iter": "iter030", "bottleneck": "compute_bound", "idea": "-Xptxas -O3 flag; no improvement", "category": "nvcc_flags", "expected_gain": "+3 TFLOPS", "decision": "DISCARD", "tflops": 309.254, "timestamp": "2026-04-19T05:29:32Z"}
{"round": 32, "iter": "iter031", "bottleneck": "compute_bound", "idea": "TILE_M=192 (larger tiles), more compute per thread block", "category": "tile_dimensions", "expected_gain": "+5 TFLOPS", "decision": "KEEP", "tflops": 333.4, "timestamp": "2026-04-19T05:30:40Z"}
{"round": 33, "iter": "iter032", "bottleneck": "compute_bound", "idea": "TILE_M=256; SMEM overflow 262KB > 233KB limit", "category": "tile_dimensions", "expected_gain": "+10 TFLOPS", "decision": "COMPILE_FAIL", "tflops": 0.0, "timestamp": "2026-04-19T05:31:13Z"}
{"round": 34, "iter": "iter033", "bottleneck": "compute_bound", "idea": "TILE_M=192 STAGES=3; worse than STAGES=4", "category": "pipeline", "expected_gain": "+5 TFLOPS", "decision": "DISCARD", "tflops": 326.025, "timestamp": "2026-04-19T05:31:55Z"}
{"round": 35, "iter": "iter034", "bottleneck": "compute_bound", "idea": "WARP_N=192; SMEM overflow 295KB > 233KB", "category": "tile_dimensions", "expected_gain": "+5 TFLOPS", "decision": "COMPILE_FAIL", "tflops": 0.0, "timestamp": "2026-04-19T05:32:15Z"}
{"round": 36, "iter": "iter035", "bottleneck": "compute_bound", "idea": "WARP_N=64 too narrow; significant regression", "category": "tile_dimensions", "expected_gain": "+5 TFLOPS", "decision": "DISCARD", "tflops": 270.748, "timestamp": "2026-04-19T05:32:58Z"}
{"round": 37, "iter": "iter036", "bottleneck": "compute_bound", "idea": "STAGES=5; SMEM overflow 270KB > 233KB", "category": "pipeline", "expected_gain": "+5 TFLOPS", "decision": "COMPILE_FAIL", "tflops": 0.0, "timestamp": "2026-04-19T05:33:19Z"}
{"round": 38, "iter": "iter037", "bottleneck": "compute_bound", "idea": "TILE_K=128 violates SWIZ constraint (max 128)", "category": "tile_dimensions", "expected_gain": "+5 TFLOPS", "decision": "COMPILE_FAIL", "tflops": 0.0, "timestamp": "2026-04-19T05:33:37Z"}
{"round": 39, "iter": "iter038", "bottleneck": "compute_bound", "idea": "1p1c with TILE_M=192 requires code restructure; skipped", "category": "warp_specialization", "expected_gain": "+5 TFLOPS", "decision": "COMPILE_FAIL", "tflops": 0.0, "timestamp": "2026-04-19T05:34:55Z"}
{"round": 40, "iter": "iter039", "bottleneck": "compute_bound", "idea": "TILE_M=192 with 3 consumers (correct); 512 threads + 3 stages hurts perf", "category": "tile_dimensions", "expected_gain": "+20 TFLOPS", "decision": "DISCARD", "tflops": 244.3, "timestamp": "2026-04-19T05:37:03Z"}
{"round": 41, "iter": "iter040", "bottleneck": "compute_bound", "idea": "WARP_N=96 does not align with N=2048; poor tile coverage", "category": "tile_dimensions", "expected_gain": "+5 TFLOPS", "decision": "DISCARD", "tflops": 224.081, "timestamp": "2026-04-19T05:38:07Z"}
{"round": 42, "iter": "iter041", "bottleneck": "compute_bound", "idea": "WARP_N=256 requires 154+ regs; incompatible with maxreg=128", "category": "tile_dimensions", "expected_gain": "+5 TFLOPS", "decision": "COMPILE_FAIL", "tflops": 0.0, "timestamp": "2026-04-19T05:39:03Z"}
{"round": 43, "iter": "iter042", "bottleneck": "compute_bound", "idea": "WARP_N=256 without maxreg; lower occupancy hurts", "category": "tile_dimensions", "expected_gain": "+5 TFLOPS", "decision": "DISCARD", "tflops": 292.201, "timestamp": "2026-04-19T05:39:41Z"}
{"round": 44, "iter": "iter043", "bottleneck": "compute_bound", "idea": "TILE_K=32; more K iterations hurts", "category": "tile_dimensions", "expected_gain": "+5 TFLOPS", "decision": "DISCARD", "tflops": 196.892, "timestamp": "2026-04-19T05:41:03Z"}
{"round": 45, "iter": "iter044", "bottleneck": "compute_bound", "idea": "--ftz=true flag; within noise of baseline", "category": "nvcc_flags", "expected_gain": "+5 TFLOPS", "decision": "DISCARD", "tflops": 311.0, "timestamp": "2026-04-19T05:42:03Z"}
{"round": 46, "iter": "iter045", "bottleneck": "compute_bound", "idea": "maxreg=160; slightly worse than 128", "category": "nvcc_flags", "expected_gain": "+2 TFLOPS", "decision": "DISCARD", "tflops": 308.892, "timestamp": "2026-04-19T05:42:41Z"}
{"round": 47, "iter": "iter046", "bottleneck": "compute_bound", "idea": "maxreg=96; too constrained, register spills", "category": "nvcc_flags", "expected_gain": "+2 TFLOPS", "decision": "DISCARD", "tflops": 304.515, "timestamp": "2026-04-19T05:43:22Z"}
{"round": 48, "iter": "iter047", "bottleneck": "compute_bound", "idea": "NUM_SMS=64; underutilizes GPU", "category": "block_config", "expected_gain": "+2 TFLOPS", "decision": "DISCARD", "tflops": 143.272, "timestamp": "2026-04-19T05:44:01Z"}
{"round": 49, "iter": "iter048", "bottleneck": "compute_bound", "idea": "NUM_SMS=228; oversubscription hurts", "category": "block_config", "expected_gain": "+2 TFLOPS", "decision": "DISCARD", "tflops": 248.746, "timestamp": "2026-04-19T05:44:42Z"}
{"round": 50, "iter": "iter049", "bottleneck": "compute_bound", "idea": "WARP_K=32 violates WGMMA f16 constraint (must be 16)", "category": "tile_dimensions", "expected_gain": "+2 TFLOPS", "decision": "COMPILE_FAIL", "tflops": 0.0, "timestamp": "2026-04-19T05:45:00Z"}
{"round": 51, "iter": "iter050", "bottleneck": "compute_bound", "idea": "Cluster + persistent grid incompatible; kernel not scaling with size", "category": "cluster_launch", "expected_gain": "+30 TFLOPS", "decision": "DISCARD", "tflops": 164.5, "timestamp": "2026-04-19T06:14:26Z"}
{"round": 52, "iter": "iter051", "bottleneck": "compute_bound", "idea": "Cluster non-persistent; cluster overhead without multicast TMA benefit", "category": "cluster_launch", "expected_gain": "+30 TFLOPS", "decision": "DISCARD", "tflops": 149.2, "timestamp": "2026-04-19T06:17:24Z"}
{"round": 53, "iter": "iter052", "bottleneck": "compute_bound", "idea": "tbc-style with TILE_M=64 and multicast; WGMMA serialized, does not scale", "category": "cluster_launch", "expected_gain": "+30 TFLOPS", "decision": "DISCARD", "tflops": 117.7, "timestamp": "2026-04-19T06:28:07Z"}
{"round": 54, "iter": "iter053", "bottleneck": "compute_bound", "idea": "No maxreg cap; compiler uses 148 regs; worse than 128-limited", "category": "register_tuning", "expected_gain": "+20 TFLOPS", "decision": "DISCARD", "tflops": 305.2, "timestamp": "2026-04-19T06:32:24Z"}
{"round": 55, "iter": "iter054", "bottleneck": "unknown", "idea": "WARP_N=256 with 168 regs; timing not scaling with problem size", "category": "tile_size", "expected_gain": "+40 TFLOPS", "decision": "DISCARD", "tflops": 150.6, "timestamp": "2026-04-19T06:38:03Z"}
{"round": 56, "iter": "iter055", "bottleneck": "unknown", "idea": "cuBLAS imitation with cluster, multicast; STAGES=2 due to SMEM; anomalous timing", "category": "cluster_launch", "expected_gain": "+100 TFLOPS", "decision": "DISCARD", "tflops": 147.3, "timestamp": "2026-04-19T06:42:42Z"}
{"round": 56, "idea": "Investigation: WARP_N=256 requires STAGES=2 (SMEM limit), achieves only 214 TFLOPS vs 383 TFLOPS baseline", "decision": "DISCARD", "tflops": 214.0, "bottleneck": "STAGES=2 limits pipelining", "next_ideas": ["Try WARP_N=192 with STAGES=3", "Use CUTLASS pipeline for cluster"]}
{"round": 57, "idea": "Investigation: Manual cluster implementation with multicast TMA", "decision": "DISCARD", "tflops": null, "bottleneck": "GPU hung - barrier init incompatible with cluster mode", "next_ideas": ["Study CUTLASS sm90_pipeline.hpp", "Implement CUTLASS-style barrier init"]}
