{"round": 0, "iter": "iter000", "bottleneck": "baseline", "idea": "cuBLAS reference baseline", "category": "baseline", "expected_gain": "baseline reference", "decision": "KEEP", "tflops": 117.5774, "timestamp": "2026-04-21T14:26:31Z"}
{"round": 1, "iter": "iter001", "bottleneck": "memory_bound", "idea": "Initial adapted kernel from 16384x16384x16384 shape, using 128x128 tiles with K=64", "category": "baseline", "expected_gain": "N/A - first custom kernel", "decision": "KEEP", "tflops": 79.15, "timestamp": "2026-04-21T14:27:34Z"}
{"round": 2, "iter": "iter002", "bottleneck": "compute_bound", "idea": "Larger tiles 256x128 with BLOCK_K=32 - actually worse due to register pressure", "category": "tiling", "expected_gain": "+10-15 TFLOPS", "decision": "DISCARD", "tflops": 35.02, "timestamp": "2026-04-21T14:29:58Z"}
{"round": 3, "iter": "iter003", "bottleneck": "compute_bound", "idea": "Smaller tiles 64x64 with BLOCK_K=32, num_stages=2 - even worse", "category": "tiling", "expected_gain": "+5-10 TFLOPS", "decision": "DISCARD", "tflops": 31.27, "timestamp": "2026-04-21T14:31:01Z"}
{"round": 4, "iter": "iter004", "bottleneck": "compute_bound", "idea": "Wider tiles 128x256 with K=64, stages=3 - worse", "category": "tiling", "expected_gain": "+5-10 TFLOPS", "decision": "DISCARD", "tflops": 30.03, "timestamp": "2026-04-21T14:31:45Z"}
{"round": 5, "iter": "iter005", "bottleneck": "compute_bound", "idea": "128x128 tiles with K=64, stages=2, threads=256 - more threads helps small K", "category": "threading", "expected_gain": "+15-20 TFLOPS", "decision": "KEEP", "tflops": 96.52, "timestamp": "2026-04-21T14:32:32Z"}
{"round": 6, "iter": "iter006", "bottleneck": "compute_bound", "idea": "128x128 tiles with K=64, stages=2, threads=128 - lower thread count better", "category": "threading", "expected_gain": "+3 TFLOPS", "decision": "KEEP", "tflops": 99.59, "timestamp": "2026-04-21T14:33:14Z"}
{"round": 7, "iter": "iter007", "bottleneck": "compute_bound", "idea": "128x128 tiles with K=64, stages=1, threads=128 - kernel hangs with single stage", "category": "pipeline", "expected_gain": "+2 TFLOPS", "decision": "HANG", "tflops": 0.0, "timestamp": "2026-04-21T14:39:15Z"}
{"round": 7, "iter": "iter007", "bottleneck": "compute_bound", "idea": "stages=1 hangs", "category": "pipeline", "expected_gain": "+2 TFLOPS", "decision": "HANG", "tflops": 0.0, "timestamp": "2026-04-21T14:39:19Z"}
{"round": 8, "iter": "iter008", "bottleneck": "compute_bound", "idea": "128x128 tiles with K=64, stages=3, threads=128 - massive improvement", "category": "pipeline", "expected_gain": "+120 TFLOPS", "decision": "KEEP", "tflops": 226.58, "timestamp": "2026-04-21T14:41:19Z"}
{"round": 9, "iter": "iter009", "bottleneck": "compute_bound", "idea": "stages=4 same as stages=3", "category": "pipeline", "expected_gain": "+5 TFLOPS", "decision": "DISCARD", "tflops": 226.98, "timestamp": "2026-04-21T14:42:13Z"}
{"round": 10, "iter": "iter010", "bottleneck": "compute_bound", "idea": "Wider tiles 128x192 with K=64, stages=3 - excellent performance", "category": "tiling", "expected_gain": "+20 TFLOPS", "decision": "KEEP", "tflops": 249.3, "timestamp": "2026-04-21T14:43:11Z"}
{"round": 11, "iter": "iter011", "bottleneck": "compute_bound", "idea": "Taller tiles 192x128 with K=64, stages=3 - slightly better than 128x192", "category": "tiling", "expected_gain": "+5 TFLOPS", "decision": "KEEP", "tflops": 252.52, "timestamp": "2026-04-21T14:44:10Z"}
{"round": 12, "iter": "iter012", "bottleneck": "compute_bound", "idea": "192x192 tiles too large - worse than baseline", "category": "tiling", "expected_gain": "+10 TFLOPS", "decision": "DISCARD", "tflops": 116.16, "timestamp": "2026-04-21T14:45:02Z"}
{"round": 13, "iter": "iter013", "bottleneck": "compute_bound", "idea": "256x128 tiles too large in M dimension", "category": "tiling", "expected_gain": "+10 TFLOPS", "decision": "DISCARD", "tflops": 121.68, "timestamp": "2026-04-21T14:45:47Z"}
{"round": 14, "iter": "iter014", "bottleneck": "compute_bound", "idea": "BLOCK_K=32 worse than K=64", "category": "tiling", "expected_gain": "+10 TFLOPS", "decision": "DISCARD", "tflops": 222.01, "timestamp": "2026-04-21T14:46:37Z"}
{"round": 15, "iter": "iter015", "bottleneck": "compute_bound", "idea": "panel_size=4 slightly worse than 8", "category": "memory", "expected_gain": "+5 TFLOPS", "decision": "DISCARD", "tflops": 247.1, "timestamp": "2026-04-21T14:47:20Z"}
{"round": 16, "iter": "iter016", "bottleneck": "compute_bound", "idea": "panel_size=16 similar to 8", "category": "memory", "expected_gain": "+5 TFLOPS", "decision": "DISCARD", "tflops": 250.12, "timestamp": "2026-04-21T14:48:07Z"}
{"round": 17, "iter": "iter017", "bottleneck": "compute_bound", "idea": "stages=2 worse than stages=3 for 192x128", "category": "pipeline", "expected_gain": "+5 TFLOPS", "decision": "DISCARD", "tflops": 236.5, "timestamp": "2026-04-21T14:49:16Z"}
{"round": 18, "iter": "iter018", "bottleneck": "compute_bound", "idea": "stages=4 also worse than stages=3 for 192x128", "category": "pipeline", "expected_gain": "+5 TFLOPS", "decision": "DISCARD", "tflops": 248.98, "timestamp": "2026-04-21T14:50:03Z"}
{"round": 19, "iter": "iter019", "bottleneck": "compute_bound", "idea": "BLOCK_M=160 incompatible with WGMMA tile constraints", "category": "tiling", "expected_gain": "+5 TFLOPS", "decision": "COMPILE_FAIL", "tflops": 0.0, "timestamp": "2026-04-21T14:50:44Z"}
{"round": 20, "iter": "iter020", "bottleneck": "compute_bound", "idea": "BLOCK_M=224 incompatible with WGMMA constraints", "category": "tiling", "expected_gain": "+5 TFLOPS", "decision": "COMPILE_FAIL", "tflops": 0.0, "timestamp": "2026-04-21T14:51:37Z"}
{"round": 21, "iter": "iter021", "bottleneck": "compute_bound", "idea": "Narrower tiles 192x64 worse", "category": "tiling", "expected_gain": "+10 TFLOPS", "decision": "DISCARD", "tflops": 198.12, "timestamp": "2026-04-21T14:52:28Z"}
{"round": 22, "iter": "iter022", "bottleneck": "compute_bound", "idea": "256x64 tiles still worse than 192x128", "category": "tiling", "expected_gain": "+10 TFLOPS", "decision": "DISCARD", "tflops": 220.46, "timestamp": "2026-04-21T14:53:38Z"}
{"round": 23, "iter": "iter023", "bottleneck": "latency_bound", "idea": "64 threads too few for 192x128 tiles", "category": "threading", "expected_gain": "+10 TFLOPS", "decision": "DISCARD", "tflops": 41.07, "timestamp": "2026-04-21T14:54:30Z"}
{"round": 24, "iter": "iter024", "bottleneck": "compute_bound", "idea": "256 threads similar to 128 threads for 192x128", "category": "threading", "expected_gain": "+5 TFLOPS", "decision": "DISCARD", "tflops": 252.44, "timestamp": "2026-04-21T14:55:29Z"}
{"round": 25, "iter": "iter025", "bottleneck": "compute_bound", "idea": "BLOCK_K=128 with only 4 K-loop iterations and stages=2 - best yet", "category": "tiling", "expected_gain": "+5 TFLOPS", "decision": "KEEP", "tflops": 254.79, "timestamp": "2026-04-21T14:56:29Z"}
{"round": 26, "iter": "iter026", "bottleneck": "memory_bound", "idea": "stages=3 with BLOCK_K=128 exceeds shared memory", "category": "pipeline", "expected_gain": "+5 TFLOPS", "decision": "COMPILE_FAIL", "tflops": 0.0, "timestamp": "2026-04-21T14:57:13Z"}
{"round": 27, "iter": "iter027", "bottleneck": "memory_bound", "idea": "BLOCK_K=256 exceeds shared memory even with stages=2", "category": "tiling", "expected_gain": "+10 TFLOPS", "decision": "COMPILE_FAIL", "tflops": 0.0, "timestamp": "2026-04-21T14:57:55Z"}
{"round": 28, "iter": "iter028", "bottleneck": "compute_bound", "idea": "128x128 with K=128 worse than 192x128", "category": "tiling", "expected_gain": "+10 TFLOPS", "decision": "DISCARD", "tflops": 213.7, "timestamp": "2026-04-21T14:58:38Z"}
{"round": 29, "iter": "iter029", "bottleneck": "compute_bound", "idea": "128x192 with K=128 slightly worse than 192x128", "category": "tiling", "expected_gain": "+5 TFLOPS", "decision": "DISCARD", "tflops": 247.4, "timestamp": "2026-04-21T14:59:21Z"}
{"round": 30, "iter": "iter030", "bottleneck": "compute_bound", "idea": "256 threads with K=128 causes issues", "category": "threading", "expected_gain": "+5 TFLOPS", "decision": "DISCARD", "tflops": 87.55, "timestamp": "2026-04-21T15:00:21Z"}
{"round": 31, "iter": "iter031", "bottleneck": "compute_bound", "idea": "panel_size=4 worse than 8", "category": "memory", "expected_gain": "+5 TFLOPS", "decision": "DISCARD", "tflops": 248.18, "timestamp": "2026-04-21T15:01:03Z"}
{"round": 32, "iter": "iter032", "bottleneck": "compute_bound", "idea": "panel_size=16 similar variance to panel_size=8", "category": "memory", "expected_gain": "+3 TFLOPS", "decision": "DISCARD", "tflops": 254.85, "timestamp": "2026-04-21T15:02:25Z"}
{"round": 33, "iter": "iter033", "bottleneck": "memory_bound", "idea": "No swizzle has high variance - swizzle is needed", "category": "memory", "expected_gain": "+5 TFLOPS", "decision": "DISCARD", "tflops": 193.12, "timestamp": "2026-04-21T15:03:35Z"}
{"round": 34, "iter": "iter034", "bottleneck": "memory_bound", "idea": "256x128 with K=128 too much shared memory pressure", "category": "tiling", "expected_gain": "+10 TFLOPS", "decision": "DISCARD", "tflops": 59.35, "timestamp": "2026-04-21T15:04:20Z"}
{"round": 35, "iter": "iter035", "bottleneck": "compute_bound", "idea": "192x96 with K=128 worse than 192x128", "category": "tiling", "expected_gain": "+5 TFLOPS", "decision": "DISCARD", "tflops": 201.69, "timestamp": "2026-04-21T15:05:07Z"}
{"round": 36, "iter": "iter036", "bottleneck": "compute_bound", "idea": "128x128 with K=128 stages=3 worse than 192x128", "category": "tiling", "expected_gain": "+5 TFLOPS", "decision": "DISCARD", "tflops": 234.78, "timestamp": "2026-04-21T15:06:05Z"}
{"round": 37, "iter": "iter037", "bottleneck": "compute_bound", "idea": "stages=5 with K=64 not better than K=128s2", "category": "pipeline", "expected_gain": "+5 TFLOPS", "decision": "DISCARD", "tflops": 238.58, "timestamp": "2026-04-21T15:07:10Z"}
{"round": 38, "iter": "iter038", "bottleneck": "latency_bound", "idea": "stages=1 with K=128 not enough pipelining", "category": "pipeline", "expected_gain": "+10 TFLOPS", "decision": "DISCARD", "tflops": 205.53, "timestamp": "2026-04-21T15:07:53Z"}
{"round": 39, "iter": "iter039", "bottleneck": "memory_bound", "idea": "stages=6 exceeds shared memory", "category": "pipeline", "expected_gain": "+10 TFLOPS", "decision": "COMPILE_FAIL", "tflops": 0.0, "timestamp": "2026-04-21T15:08:44Z"}
{"round": 40, "iter": "iter040", "bottleneck": "memory_bound", "idea": "160 N tile misaligned", "category": "tiling", "expected_gain": "+5 TFLOPS", "decision": "DISCARD", "tflops": 48.41, "timestamp": "2026-04-21T15:09:36Z"}
{"round": 41, "iter": "iter041", "bottleneck": "compute_bound", "idea": "64x128 tiles too small", "category": "tiling", "expected_gain": "+10 TFLOPS", "decision": "DISCARD", "tflops": 178.56, "timestamp": "2026-04-21T15:10:31Z"}
{"round": 42, "iter": "iter042", "bottleneck": "compute_bound", "idea": "K=64 s3 p4 worse than K=128", "category": "memory", "expected_gain": "+5 TFLOPS", "decision": "DISCARD", "tflops": 236.33, "timestamp": "2026-04-21T15:11:17Z"}
{"round": 43, "iter": "iter043", "bottleneck": "memory_bound", "idea": "K=64 s4 much worse", "category": "pipeline", "expected_gain": "+10 TFLOPS", "decision": "DISCARD", "tflops": 104.99, "timestamp": "2026-04-21T15:11:48Z"}
{"round": 44, "iter": "iter044", "bottleneck": "compute_bound", "idea": "grid search iteration", "category": "tiling", "expected_gain": "+5 TFLOPS", "decision": "DISCARD", "tflops": 117.74, "timestamp": "2026-04-21T15:13:01Z"}
{"round": 45, "iter": "iter045", "bottleneck": "compute_bound", "idea": "grid search iteration", "category": "tiling", "expected_gain": "+5 TFLOPS", "decision": "DISCARD", "tflops": 231.69, "timestamp": "2026-04-21T15:13:01Z"}
{"round": 46, "iter": "iter046", "bottleneck": "compute_bound", "idea": "grid search iteration", "category": "tiling", "expected_gain": "+5 TFLOPS", "decision": "DISCARD", "tflops": 241.22, "timestamp": "2026-04-21T15:13:02Z"}
{"round": 47, "iter": "iter047", "bottleneck": "compute_bound", "idea": "grid search iteration", "category": "tiling", "expected_gain": "+5 TFLOPS", "decision": "DISCARD", "tflops": 245.11, "timestamp": "2026-04-21T15:13:02Z"}
{"round": 48, "iter": "iter048", "bottleneck": "compute_bound", "idea": "grid search iteration", "category": "tiling", "expected_gain": "+5 TFLOPS", "decision": "DISCARD", "tflops": 225.25, "timestamp": "2026-04-21T15:13:03Z"}
{"round": 49, "iter": "iter049", "bottleneck": "compute_bound", "idea": "grid search iteration", "category": "tiling", "expected_gain": "+5 TFLOPS", "decision": "DISCARD", "tflops": 224.73, "timestamp": "2026-04-21T15:13:03Z"}
{"round": 50, "iter": "iter050", "bottleneck": "compute_bound", "idea": "grid search iteration", "category": "tiling", "expected_gain": "+5 TFLOPS", "decision": "DISCARD", "tflops": 231.5, "timestamp": "2026-04-21T15:13:03Z"}
{"round": 51, "iter": "iter051", "bottleneck": "memory_bound", "idea": "Test BM=64 BN=64 BK=64 s=3", "category": "tiling", "expected_gain": "explore", "decision": "DISCARD", "tflops": 44.93, "timestamp": "2026-04-21T15:14:45Z"}
{"round": 52, "iter": "iter052", "bottleneck": "memory_bound", "idea": "Test BM=64 BN=128 BK=64 s=3", "category": "tiling", "expected_gain": "explore", "decision": "DISCARD", "tflops": 64.23, "timestamp": "2026-04-21T15:14:46Z"}
{"round": 53, "iter": "iter053", "bottleneck": "memory_bound", "idea": "Test BM=128 BN=64 BK=64 s=3", "category": "tiling", "expected_gain": "explore", "decision": "DISCARD", "tflops": 65.33, "timestamp": "2026-04-21T15:14:46Z"}
{"round": 54, "iter": "iter054", "bottleneck": "memory_bound", "idea": "Test BM=192 BN=64 BK=64 s=3", "category": "tiling", "expected_gain": "explore", "decision": "DISCARD", "tflops": 67.88, "timestamp": "2026-04-21T15:14:47Z"}
{"round": 55, "iter": "iter055", "bottleneck": "memory_bound", "idea": "Test BM=256 BN=64 BK=64 s=2", "category": "tiling", "expected_gain": "explore", "decision": "DISCARD", "tflops": 62.83, "timestamp": "2026-04-21T15:14:47Z"}
{"round": 56, "iter": "iter056", "bottleneck": "memory_bound", "idea": "Test BM=128 BN=256 BK=64 s=2", "category": "tiling", "expected_gain": "explore", "decision": "DISCARD", "tflops": 24.66, "timestamp": "2026-04-21T15:14:48Z"}
{"round": 57, "iter": "iter057", "bottleneck": "memory_bound", "idea": "Test BM=64 BN=256 BK=64 s=2", "category": "tiling", "expected_gain": "explore", "decision": "DISCARD", "tflops": 59.55, "timestamp": "2026-04-21T15:14:48Z"}
{"round": 58, "iter": "iter058", "bottleneck": "memory_bound", "idea": "Test BM=64 BN=192 BK=64 s=2", "category": "tiling", "expected_gain": "explore", "decision": "DISCARD", "tflops": 55.14, "timestamp": "2026-04-21T15:14:49Z"}
{"round": 59, "iter": "iter059", "bottleneck": "memory_bound", "idea": "Test BM=192 BN=192 BK=64 s=2", "category": "tiling", "expected_gain": "explore", "decision": "DISCARD", "tflops": 37.31, "timestamp": "2026-04-21T15:14:50Z"}
{"round": 60, "iter": "iter060", "bottleneck": "memory_bound", "idea": "Test BM=256 BN=128 BK=64 s=2", "category": "tiling", "expected_gain": "explore", "decision": "DISCARD", "tflops": 37.66, "timestamp": "2026-04-21T15:14:50Z"}
{"round": 61, "iter": "iter061", "bottleneck": "memory_bound", "idea": "Test config b192x128k96s2_t128", "category": "tiling", "expected_gain": "explore", "decision": "DISCARD", "tflops": 13.27, "timestamp": "2026-04-21T15:16:51Z"}
{"round": 62, "iter": "iter062", "bottleneck": "memory_bound", "idea": "Test config b192x128k128s2_t256", "category": "tiling", "expected_gain": "explore", "decision": "DISCARD", "tflops": 35.38, "timestamp": "2026-04-21T15:16:51Z"}
{"round": 63, "iter": "iter063", "bottleneck": "memory_bound", "idea": "Test config b192x128k64s2_t128", "category": "tiling", "expected_gain": "explore", "decision": "DISCARD", "tflops": 80.53, "timestamp": "2026-04-21T15:16:52Z"}
{"round": 64, "iter": "iter064", "bottleneck": "memory_bound", "idea": "Test config b192x128k64s4_t128", "category": "tiling", "expected_gain": "explore", "decision": "DISCARD", "tflops": 19.94, "timestamp": "2026-04-21T15:16:53Z"}
{"round": 65, "iter": "iter065", "bottleneck": "memory_bound", "idea": "Test config b192x128k128s2_t64", "category": "tiling", "expected_gain": "explore", "decision": "DISCARD", "tflops": 7.26, "timestamp": "2026-04-21T15:16:54Z"}
{"round": 66, "iter": "iter066", "bottleneck": "memory_bound", "idea": "Test config b160x128k128s2_t128", "category": "tiling", "expected_gain": "explore", "decision": "COMPILE_FAIL", "tflops": 0.0, "timestamp": "2026-04-21T15:16:55Z"}
{"round": 67, "iter": "iter067", "bottleneck": "memory_bound", "idea": "Test config b224x128k128s2_t128", "category": "tiling", "expected_gain": "explore", "decision": "COMPILE_FAIL", "tflops": 0.0, "timestamp": "2026-04-21T15:16:55Z"}
{"round": 68, "iter": "iter068", "bottleneck": "memory_bound", "idea": "Test config b192x96k128s2_t128", "category": "tiling", "expected_gain": "explore", "decision": "DISCARD", "tflops": 31.82, "timestamp": "2026-04-21T15:16:56Z"}
{"round": 69, "iter": "iter069", "bottleneck": "memory_bound", "idea": "Test config b192x160k128s2_t128", "category": "tiling", "expected_gain": "explore", "decision": "DISCARD", "tflops": 33.12, "timestamp": "2026-04-21T15:16:56Z"}
{"round": 70, "iter": "iter070", "bottleneck": "memory_bound", "idea": "Test config b128x192k128s2_t128", "category": "tiling", "expected_gain": "explore", "decision": "DISCARD", "tflops": 156.17, "timestamp": "2026-04-21T15:16:57Z"}
{"round": 71, "iter": "iter071", "bottleneck": "memory_bound", "idea": "Test config b192x192k128s2_t128", "category": "tiling", "expected_gain": "explore", "decision": "DISCARD", "tflops": 67.5, "timestamp": "2026-04-21T15:16:57Z"}
{"round": 72, "iter": "iter072", "bottleneck": "memory_bound", "idea": "Test config b128x128k128s2_t256", "category": "tiling", "expected_gain": "explore", "decision": "DISCARD", "tflops": 40.02, "timestamp": "2026-04-21T15:16:59Z"}
{"round": 73, "iter": "iter073", "bottleneck": "memory_bound", "idea": "Test config b128x128k128s3_t128", "category": "tiling", "expected_gain": "explore", "decision": "DISCARD", "tflops": 19.38, "timestamp": "2026-04-21T15:17:00Z"}
{"round": 74, "iter": "iter074", "bottleneck": "memory_bound", "idea": "Test config b256x64k128s2_t128", "category": "tiling", "expected_gain": "explore", "decision": "DISCARD", "tflops": 39.7, "timestamp": "2026-04-21T15:17:00Z"}
{"round": 75, "iter": "iter075", "bottleneck": "memory_bound", "idea": "Test config b64x256k128s2_t128", "category": "tiling", "expected_gain": "explore", "decision": "DISCARD", "tflops": 20.43, "timestamp": "2026-04-21T15:17:01Z"}
{"round": 76, "iter": "iter076", "bottleneck": "memory_bound", "idea": "Test config b192x128k128s2_p4", "category": "tiling", "expected_gain": "explore", "decision": "DISCARD", "tflops": 235.49, "timestamp": "2026-04-21T15:18:57Z"}
{"round": 77, "iter": "iter077", "bottleneck": "memory_bound", "idea": "Test config b192x128k128s2_p16", "category": "tiling", "expected_gain": "explore", "decision": "DISCARD", "tflops": 241.8, "timestamp": "2026-04-21T15:18:58Z"}
{"round": 78, "iter": "iter078", "bottleneck": "memory_bound", "idea": "Test config b192x128k128s1_p8", "category": "tiling", "expected_gain": "explore", "decision": "DISCARD", "tflops": 195.24, "timestamp": "2026-04-21T15:18:58Z"}
{"round": 79, "iter": "iter079", "bottleneck": "memory_bound", "idea": "Test config b192x128k64s3_p8", "category": "tiling", "expected_gain": "explore", "decision": "DISCARD", "tflops": 228.93, "timestamp": "2026-04-21T15:18:58Z"}
{"round": 80, "iter": "iter080", "bottleneck": "memory_bound", "idea": "Test config b128x128k64s4_p8", "category": "tiling", "expected_gain": "explore", "decision": "DISCARD", "tflops": 211.07, "timestamp": "2026-04-21T15:18:59Z"}
{"round": 81, "iter": "iter081", "bottleneck": "memory_bound", "idea": "Test config b128x128k128s1_p8", "category": "tiling", "expected_gain": "explore", "decision": "DISCARD", "tflops": 178.87, "timestamp": "2026-04-21T15:18:59Z"}
{"round": 82, "iter": "iter082", "bottleneck": "memory_bound", "idea": "Test config b192x64k128s2_p8", "category": "tiling", "expected_gain": "explore", "decision": "DISCARD", "tflops": 187.41, "timestamp": "2026-04-21T15:19:00Z"}
{"round": 83, "iter": "iter083", "bottleneck": "memory_bound", "idea": "Test config b128x64k128s2_p8", "category": "tiling", "expected_gain": "explore", "decision": "DISCARD", "tflops": 164.32, "timestamp": "2026-04-21T15:19:00Z"}
{"round": 84, "iter": "iter084", "bottleneck": "memory_bound", "idea": "Test config b96x128k128s2_p8", "category": "tiling", "expected_gain": "explore", "decision": "COMPILE_FAIL", "tflops": 0.0, "timestamp": "2026-04-21T15:19:01Z"}
{"round": 85, "iter": "iter085", "bottleneck": "memory_bound", "idea": "Test config b192x128k32s4_p8", "category": "tiling", "expected_gain": "explore", "decision": "DISCARD", "tflops": 213.77, "timestamp": "2026-04-21T15:19:01Z"}
{"round": 86, "iter": "iter086", "bottleneck": "memory_bound", "idea": "Test config b192x128k48s3_p8", "category": "tiling", "expected_gain": "explore", "decision": "DISCARD", "tflops": 148.2, "timestamp": "2026-04-21T15:19:02Z"}
{"round": 87, "iter": "iter087", "bottleneck": "memory_bound", "idea": "Test config b128x128k96s2_p8", "category": "tiling", "expected_gain": "explore", "decision": "DISCARD", "tflops": 196.26, "timestamp": "2026-04-21T15:19:02Z"}
{"round": 88, "iter": "iter088", "bottleneck": "memory_bound", "idea": "Test config b192x256k64s2_p8", "category": "tiling", "expected_gain": "explore", "decision": "DISCARD", "tflops": 60.78, "timestamp": "2026-04-21T15:19:03Z"}
{"round": 89, "iter": "iter089", "bottleneck": "memory_bound", "idea": "Test config b256x192k64s2_p8", "category": "tiling", "expected_gain": "explore", "decision": "DISCARD", "tflops": 83.83, "timestamp": "2026-04-21T15:19:03Z"}
