{"round": 183, "iter": "iter183", "bottleneck": "memory_bound", "idea": "Test config b192x128k128s2_t128p50", "category": "tiling", "expected_gain": "explore", "decision": "DISCARD", "tflops": 259.47, "timestamp": "2026-04-21T15:36:39Z"}
{"round": 184, "iter": "iter184", "bottleneck": "memory_bound", "idea": "Test config b192x128k128s2_t128p52", "category": "tiling", "expected_gain": "explore", "decision": "DISCARD", "tflops": 250.28, "timestamp": "2026-04-21T15:36:39Z"}
{"round": 185, "iter": "iter185", "bottleneck": "memory_bound", "idea": "Test config b192x128k128s2_t128p54", "category": "tiling", "expected_gain": "explore", "decision": "DISCARD", "tflops": 252.32, "timestamp": "2026-04-21T15:36:40Z"}
{"round": 186, "iter": "iter186", "bottleneck": "memory_bound", "idea": "Test config b192x128k128s2_t128p56", "category": "tiling", "expected_gain": "explore", "decision": "DISCARD", "tflops": 257.05, "timestamp": "2026-04-21T15:36:40Z"}
{"round": 187, "iter": "iter187", "bottleneck": "memory_bound", "idea": "Test config b192x128k128s2_t128p40", "category": "tiling", "expected_gain": "explore", "decision": "DISCARD", "tflops": 254.11, "timestamp": "2026-04-21T15:36:41Z"}
{"round": 188, "iter": "iter188", "bottleneck": "memory_bound", "idea": "Test config b192x128k128s2_t128p42", "category": "tiling", "expected_gain": "explore", "decision": "DISCARD", "tflops": 256.08, "timestamp": "2026-04-21T15:36:41Z"}
{"round": 189, "iter": "iter189", "bottleneck": "memory_bound", "idea": "Test config b192x128k128s2_t128p47", "category": "tiling", "expected_gain": "explore", "decision": "DISCARD", "tflops": 253.67, "timestamp": "2026-04-21T15:36:41Z"}
{"round": 190, "iter": "iter190", "bottleneck": "memory_bound", "idea": "Test config b192x128k128s2_t128p49", "category": "tiling", "expected_gain": "explore", "decision": "KEEP", "tflops": 260.48, "timestamp": "2026-04-21T15:36:42Z"}
{"round": 191, "iter": "iter191", "bottleneck": "memory_bound", "idea": "Test config b192x128k64s3_t128p48", "category": "tiling", "expected_gain": "explore", "decision": "DISCARD", "tflops": 249.24, "timestamp": "2026-04-21T15:36:42Z"}
{"round": 192, "iter": "iter192", "bottleneck": "memory_bound", "idea": "Test config b192x128k64s2_t128p48", "category": "tiling", "expected_gain": "explore", "decision": "DISCARD", "tflops": 245.66, "timestamp": "2026-04-21T15:36:43Z"}
{"round": 193, "iter": "iter193", "bottleneck": "memory_bound", "idea": "Test config b128x128k128s2_t128p48", "category": "tiling", "expected_gain": "explore", "decision": "DISCARD", "tflops": 238.17, "timestamp": "2026-04-21T15:36:43Z"}
{"round": 194, "iter": "iter194", "bottleneck": "memory_bound", "idea": "Test config b128x192k128s2_t128p48", "category": "tiling", "expected_gain": "explore", "decision": "DISCARD", "tflops": 257.25, "timestamp": "2026-04-21T15:36:43Z"}
{"round": 195, "iter": "iter195", "bottleneck": "memory_bound", "idea": "Test config b256x128k64s2_t128p48", "category": "tiling", "expected_gain": "explore", "decision": "DISCARD", "tflops": 120.46, "timestamp": "2026-04-21T15:36:44Z"}
{"round": 196, "iter": "iter196", "bottleneck": "memory_bound", "idea": "Test config b192x128k128s2_t128p45", "category": "tiling", "expected_gain": "explore", "decision": "DISCARD", "tflops": 253.56, "timestamp": "2026-04-21T15:39:15Z"}
{"round": 197, "iter": "iter197", "bottleneck": "memory_bound", "idea": "Test config b192x128k128s2_t128p43", "category": "tiling", "expected_gain": "explore", "decision": "DISCARD", "tflops": 257.33, "timestamp": "2026-04-21T15:39:15Z"}
{"round": 198, "iter": "iter198", "bottleneck": "memory_bound", "idea": "Test config b192x128k128s2_t128p41", "category": "tiling", "expected_gain": "explore", "decision": "DISCARD", "tflops": 253.06, "timestamp": "2026-04-21T15:39:16Z"}
{"round": 199, "iter": "iter199", "bottleneck": "memory_bound", "idea": "Test config b192x128k128s2_t128p51", "category": "tiling", "expected_gain": "explore", "decision": "DISCARD", "tflops": 259.02, "timestamp": "2026-04-21T15:39:16Z"}
{"round": 200, "iter": "iter200", "bottleneck": "memory_bound", "idea": "Test config b192x128k128s2_t128p53", "category": "tiling", "expected_gain": "explore", "decision": "DISCARD", "tflops": 256.07, "timestamp": "2026-04-21T15:39:17Z"}
{"round": 201, "iter": "iter201", "bottleneck": "memory_bound", "idea": "Test config b192x128k128s2_t128p55", "category": "tiling", "expected_gain": "explore", "decision": "DISCARD", "tflops": 256.97, "timestamp": "2026-04-21T15:39:17Z"}
{"round": 202, "iter": "iter202", "bottleneck": "memory_bound", "idea": "Test config b192x128k128s2_t128p57", "category": "tiling", "expected_gain": "explore", "decision": "DISCARD", "tflops": 251.08, "timestamp": "2026-04-21T15:39:18Z"}
{"round": 203, "iter": "iter203", "bottleneck": "memory_bound", "idea": "Test config b192x128k128s2_t128p59", "category": "tiling", "expected_gain": "explore", "decision": "DISCARD", "tflops": 250.49, "timestamp": "2026-04-21T15:39:18Z"}
{"round": 204, "iter": "iter204", "bottleneck": "memory_bound", "idea": "Test config b192x128k128s2_t128p60", "category": "tiling", "expected_gain": "explore", "decision": "DISCARD", "tflops": 258.71, "timestamp": "2026-04-21T15:39:18Z"}
{"round": 205, "iter": "iter205", "bottleneck": "memory_bound", "idea": "Test config b192x128k128s2_t128p62", "category": "tiling", "expected_gain": "explore", "decision": "DISCARD", "tflops": 256.41, "timestamp": "2026-04-21T15:39:19Z"}
{"round": 206, "iter": "iter206", "bottleneck": "memory_bound", "idea": "Test config b192x128k128s2_t128p58", "category": "tiling", "expected_gain": "explore", "decision": "DISCARD", "tflops": 249.26, "timestamp": "2026-04-21T15:39:19Z"}
{"round": 207, "iter": "iter207", "bottleneck": "memory_bound", "idea": "Test config b192x128k96s2_t128p49", "category": "tiling", "expected_gain": "explore", "decision": "DISCARD", "tflops": 235.04, "timestamp": "2026-04-21T15:39:20Z"}
{"round": 208, "iter": "iter208", "bottleneck": "memory_bound", "idea": "Test config b192x128k64s3_t128p49", "category": "tiling", "expected_gain": "explore", "decision": "DISCARD", "tflops": 247.27, "timestamp": "2026-04-21T15:39:20Z"}
{"round": 209, "iter": "iter209", "bottleneck": "memory_bound", "idea": "Test config b128x128k128s2_t128p49", "category": "tiling", "expected_gain": "explore", "decision": "DISCARD", "tflops": 236.96, "timestamp": "2026-04-21T15:39:20Z"}
{"round": 210, "iter": "iter210", "bottleneck": "memory_bound", "idea": "Test config b128x192k128s2_t128p49", "category": "tiling", "expected_gain": "explore", "decision": "DISCARD", "tflops": 251.0, "timestamp": "2026-04-21T15:39:21Z"}
