{"round": 90, "iter": "iter090", "bottleneck": "memory_bound", "idea": "Test config b128x128k64s2_p8", "category": "tiling", "expected_gain": "explore", "decision": "DISCARD", "tflops": 176.44, "timestamp": "2026-04-21T15:19:04Z"}
{"round": 91, "iter": "iter091", "bottleneck": "memory_bound", "idea": "Test config b192x128k128s2_t128p12", "category": "tiling", "expected_gain": "explore", "decision": "DISCARD", "tflops": 243.92, "timestamp": "2026-04-21T15:21:02Z"}
{"round": 92, "iter": "iter092", "bottleneck": "memory_bound", "idea": "Test config b192x128k128s2_t192p8", "category": "tiling", "expected_gain": "explore", "decision": "COMPILE_FAIL", "tflops": 0.0, "timestamp": "2026-04-21T15:21:02Z"}
{"round": 93, "iter": "iter093", "bottleneck": "memory_bound", "idea": "Test config b192x128k80s2_t128p8", "category": "tiling", "expected_gain": "explore", "decision": "DISCARD", "tflops": 150.54, "timestamp": "2026-04-21T15:21:03Z"}
{"round": 94, "iter": "iter094", "bottleneck": "memory_bound", "idea": "Test config b256x128k64s3_t128p8", "category": "tiling", "expected_gain": "explore", "decision": "DISCARD", "tflops": 117.95, "timestamp": "2026-04-21T15:21:03Z"}
{"round": 95, "iter": "iter095", "bottleneck": "memory_bound", "idea": "Test config b128x192k64s3_t128p8", "category": "tiling", "expected_gain": "explore", "decision": "DISCARD", "tflops": 229.73, "timestamp": "2026-04-21T15:21:04Z"}
{"round": 96, "iter": "iter096", "bottleneck": "memory_bound", "idea": "Test config b192x128k128s2_t96p8", "category": "tiling", "expected_gain": "explore", "decision": "COMPILE_FAIL", "tflops": 0.0, "timestamp": "2026-04-21T15:21:04Z"}
{"round": 97, "iter": "iter097", "bottleneck": "memory_bound", "idea": "Test config b192x128k64s5_t128p8", "category": "tiling", "expected_gain": "explore", "decision": "DISCARD", "tflops": 154.62, "timestamp": "2026-04-21T15:21:05Z"}
{"round": 98, "iter": "iter098", "bottleneck": "memory_bound", "idea": "Test config b192x128k64s6_t128p8", "category": "tiling", "expected_gain": "explore", "decision": "COMPILE_FAIL", "tflops": 0.0, "timestamp": "2026-04-21T15:21:05Z"}
{"round": 99, "iter": "iter099", "bottleneck": "memory_bound", "idea": "Test config b192x128k128s2_t160p8", "category": "tiling", "expected_gain": "explore", "decision": "COMPILE_FAIL", "tflops": 0.0, "timestamp": "2026-04-21T15:21:05Z"}
{"round": 100, "iter": "iter100", "bottleneck": "memory_bound", "idea": "Test config b128x256k64s2_t128p8", "category": "tiling", "expected_gain": "explore", "decision": "DISCARD", "tflops": 76.17, "timestamp": "2026-04-21T15:21:06Z"}
{"round": 101, "iter": "iter101", "bottleneck": "memory_bound", "idea": "Test config b256x128k128s1_t128p8", "category": "tiling", "expected_gain": "explore", "decision": "DISCARD", "tflops": 139.15, "timestamp": "2026-04-21T15:21:06Z"}
{"round": 102, "iter": "iter102", "bottleneck": "memory_bound", "idea": "Test config b128x128k64s3_t256p8", "category": "tiling", "expected_gain": "explore", "decision": "DISCARD", "tflops": 217.37, "timestamp": "2026-04-21T15:21:07Z"}
{"round": 103, "iter": "iter103", "bottleneck": "memory_bound", "idea": "Test config b192x128k128s2_t128p2", "category": "tiling", "expected_gain": "explore", "decision": "DISCARD", "tflops": 239.98, "timestamp": "2026-04-21T15:21:07Z"}
{"round": 104, "iter": "iter104", "bottleneck": "memory_bound", "idea": "Test config b192x128k128s2_t128p32", "category": "tiling", "expected_gain": "explore", "decision": "DISCARD", "tflops": 249.37, "timestamp": "2026-04-21T15:21:07Z"}
{"round": 105, "iter": "iter105", "bottleneck": "memory_bound", "idea": "Test config b128x128k128s2_t192p8", "category": "tiling", "expected_gain": "explore", "decision": "COMPILE_FAIL", "tflops": 0.0, "timestamp": "2026-04-21T15:21:08Z"}
{"round": 106, "iter": "iter106", "bottleneck": "memory_bound", "idea": "Test config b192x128k128s2_p24", "category": "tiling", "expected_gain": "explore", "decision": "KEEP", "tflops": 256.35, "timestamp": "2026-04-21T15:23:39Z"}
{"round": 107, "iter": "iter107", "bottleneck": "memory_bound", "idea": "Test config b192x128k128s2_p6", "category": "tiling", "expected_gain": "explore", "decision": "DISCARD", "tflops": 250.5, "timestamp": "2026-04-21T15:23:39Z"}
{"round": 108, "iter": "iter108", "bottleneck": "memory_bound", "idea": "Test config b192x128k128s2_p10", "category": "tiling", "expected_gain": "explore", "decision": "DISCARD", "tflops": 250.95, "timestamp": "2026-04-21T15:23:40Z"}
{"round": 109, "iter": "iter109", "bottleneck": "memory_bound", "idea": "Test config b256x64k64s3_p8", "category": "tiling", "expected_gain": "explore", "decision": "DISCARD", "tflops": 214.78, "timestamp": "2026-04-21T15:23:40Z"}
{"round": 110, "iter": "iter110", "bottleneck": "memory_bound", "idea": "Test config b64x256k64s3_p8", "category": "tiling", "expected_gain": "explore", "decision": "DISCARD", "tflops": 214.38, "timestamp": "2026-04-21T15:23:41Z"}
{"round": 111, "iter": "iter111", "bottleneck": "memory_bound", "idea": "Test config b192x128k112s2_p8", "category": "tiling", "expected_gain": "explore", "decision": "DISCARD", "tflops": 159.93, "timestamp": "2026-04-21T15:23:41Z"}
{"round": 112, "iter": "iter112", "bottleneck": "memory_bound", "idea": "Test config b128x128k112s2_p8", "category": "tiling", "expected_gain": "explore", "decision": "DISCARD", "tflops": 144.75, "timestamp": "2026-04-21T15:23:42Z"}
{"round": 113, "iter": "iter113", "bottleneck": "memory_bound", "idea": "Test config b192x128k64s7_p8", "category": "tiling", "expected_gain": "explore", "decision": "COMPILE_FAIL", "tflops": 0.0, "timestamp": "2026-04-21T15:23:42Z"}
{"round": 114, "iter": "iter114", "bottleneck": "memory_bound", "idea": "Test config b192x128k64s8_p8", "category": "tiling", "expected_gain": "explore", "decision": "COMPILE_FAIL", "tflops": 0.0, "timestamp": "2026-04-21T15:23:42Z"}
{"round": 115, "iter": "iter115", "bottleneck": "memory_bound", "idea": "Test config b256x256k64s2_p8", "category": "tiling", "expected_gain": "explore", "decision": "DISCARD", "tflops": 16.17, "timestamp": "2026-04-21T15:23:43Z"}
{"round": 116, "iter": "iter116", "bottleneck": "memory_bound", "idea": "Test config b256x128k64s2_p8", "category": "tiling", "expected_gain": "explore", "decision": "DISCARD", "tflops": 113.12, "timestamp": "2026-04-21T15:23:43Z"}
{"round": 117, "iter": "iter117", "bottleneck": "memory_bound", "idea": "Test config b128x128k64s5_p8", "category": "tiling", "expected_gain": "explore", "decision": "DISCARD", "tflops": 86.38, "timestamp": "2026-04-21T15:23:44Z"}
{"round": 118, "iter": "iter118", "bottleneck": "memory_bound", "idea": "Test config b128x128k64s6_p8", "category": "tiling", "expected_gain": "explore", "decision": "DISCARD", "tflops": 80.78, "timestamp": "2026-04-21T15:23:44Z"}
{"round": 119, "iter": "iter119", "bottleneck": "memory_bound", "idea": "Test config b192x128k128s2_p20", "category": "tiling", "expected_gain": "explore", "decision": "DISCARD", "tflops": 95.28, "timestamp": "2026-04-21T15:23:45Z"}
{"round": 120, "iter": "iter120", "bottleneck": "memory_bound", "idea": "Test config b192x128k128s2_p28", "category": "tiling", "expected_gain": "explore", "decision": "DISCARD", "tflops": 102.36, "timestamp": "2026-04-21T15:23:45Z"}
{"round": 121, "iter": "iter121", "bottleneck": "memory_bound", "idea": "Test config b192x128k128s2_p22", "category": "tiling", "expected_gain": "explore", "decision": "DISCARD", "tflops": 75.81, "timestamp": "2026-04-21T15:26:29Z"}
{"round": 122, "iter": "iter122", "bottleneck": "memory_bound", "idea": "Test config b192x128k128s2_p26", "category": "tiling", "expected_gain": "explore", "decision": "DISCARD", "tflops": 46.01, "timestamp": "2026-04-21T15:26:29Z"}
{"round": 123, "iter": "iter123", "bottleneck": "memory_bound", "idea": "Test config b192x128k128s2_p18", "category": "tiling", "expected_gain": "explore", "decision": "DISCARD", "tflops": 67.8, "timestamp": "2026-04-21T15:26:29Z"}
{"round": 124, "iter": "iter124", "bottleneck": "memory_bound", "idea": "Test config b192x128k128s2_p14", "category": "tiling", "expected_gain": "explore", "decision": "DISCARD", "tflops": 53.07, "timestamp": "2026-04-21T15:26:30Z"}
{"round": 125, "iter": "iter125", "bottleneck": "memory_bound", "idea": "Test config b192x128k64s3_p24", "category": "tiling", "expected_gain": "explore", "decision": "DISCARD", "tflops": 54.38, "timestamp": "2026-04-21T15:26:30Z"}
{"round": 126, "iter": "iter126", "bottleneck": "memory_bound", "idea": "Test config b192x128k64s4_p24", "category": "tiling", "expected_gain": "explore", "decision": "DISCARD", "tflops": 58.38, "timestamp": "2026-04-21T15:26:31Z"}
{"round": 127, "iter": "iter127", "bottleneck": "memory_bound", "idea": "Test config b128x192k128s2_p24", "category": "tiling", "expected_gain": "explore", "decision": "DISCARD", "tflops": 73.79, "timestamp": "2026-04-21T15:26:31Z"}
{"round": 128, "iter": "iter128", "bottleneck": "memory_bound", "idea": "Test config b128x128k128s2_p24", "category": "tiling", "expected_gain": "explore", "decision": "DISCARD", "tflops": 73.93, "timestamp": "2026-04-21T15:26:31Z"}
{"round": 129, "iter": "iter129", "bottleneck": "memory_bound", "idea": "Test config b256x128k64s2_p24", "category": "tiling", "expected_gain": "explore", "decision": "DISCARD", "tflops": 82.74, "timestamp": "2026-04-21T15:26:32Z"}
{"round": 130, "iter": "iter130", "bottleneck": "memory_bound", "idea": "Test config b192x256k64s2_p24", "category": "tiling", "expected_gain": "explore", "decision": "DISCARD", "tflops": 57.17, "timestamp": "2026-04-21T15:26:32Z"}
{"round": 131, "iter": "iter131", "bottleneck": "memory_bound", "idea": "Test config b192x128k96s2_p24", "category": "tiling", "expected_gain": "explore", "decision": "DISCARD", "tflops": 215.85, "timestamp": "2026-04-21T15:26:33Z"}
{"round": 132, "iter": "iter132", "bottleneck": "memory_bound", "idea": "Test config b192x128k128s1_p24", "category": "tiling", "expected_gain": "explore", "decision": "DISCARD", "tflops": 200.08, "timestamp": "2026-04-21T15:26:33Z"}
{"round": 133, "iter": "iter133", "bottleneck": "memory_bound", "idea": "Test config b192x128k128s3_p24", "category": "tiling", "expected_gain": "explore", "decision": "COMPILE_FAIL", "tflops": 0.0, "timestamp": "2026-04-21T15:26:33Z"}
{"round": 134, "iter": "iter134", "bottleneck": "memory_bound", "idea": "Test config b192x96k128s2_p24", "category": "tiling", "expected_gain": "explore", "decision": "DISCARD", "tflops": 196.38, "timestamp": "2026-04-21T15:26:34Z"}
{"round": 135, "iter": "iter135", "bottleneck": "memory_bound", "idea": "Test config b256x64k128s2_p24", "category": "tiling", "expected_gain": "explore", "decision": "DISCARD", "tflops": 210.41, "timestamp": "2026-04-21T15:26:34Z"}
{"round": 136, "iter": "iter136", "bottleneck": "memory_bound", "idea": "Test config b192x128k128s2_t128p8", "category": "tiling", "expected_gain": "explore", "decision": "DISCARD", "tflops": 77.77, "timestamp": "2026-04-21T15:28:58Z"}
{"round": 137, "iter": "iter137", "bottleneck": "memory_bound", "idea": "Test config b128x128k256s1_t128p8", "category": "tiling", "expected_gain": "explore", "decision": "DISCARD", "tflops": 203.19, "timestamp": "2026-04-21T15:28:58Z"}
{"round": 138, "iter": "iter138", "bottleneck": "memory_bound", "idea": "Test config b192x128k256s1_t128p8", "category": "tiling", "expected_gain": "explore", "decision": "DISCARD", "tflops": 226.96, "timestamp": "2026-04-21T15:28:59Z"}
{"round": 139, "iter": "iter139", "bottleneck": "memory_bound", "idea": "Test config b64x64k128s2_t128p8", "category": "tiling", "expected_gain": "explore", "decision": "DISCARD", "tflops": 130.01, "timestamp": "2026-04-21T15:28:59Z"}
{"round": 140, "iter": "iter140", "bottleneck": "memory_bound", "idea": "Test config b64x128k128s2_t128p8", "category": "tiling", "expected_gain": "explore", "decision": "DISCARD", "tflops": 179.54, "timestamp": "2026-04-21T15:29:00Z"}
{"round": 141, "iter": "iter141", "bottleneck": "memory_bound", "idea": "Test config b128x64k128s2_t64p8", "category": "tiling", "expected_gain": "explore", "decision": "DISCARD", "tflops": 132.19, "timestamp": "2026-04-21T15:29:00Z"}
{"round": 142, "iter": "iter142", "bottleneck": "memory_bound", "idea": "Test config b192x128k128s2_t128p7", "category": "tiling", "expected_gain": "explore", "decision": "DISCARD", "tflops": 248.0, "timestamp": "2026-04-21T15:29:01Z"}
{"round": 143, "iter": "iter143", "bottleneck": "memory_bound", "idea": "Test config b192x128k128s2_t128p9", "category": "tiling", "expected_gain": "explore", "decision": "DISCARD", "tflops": 243.59, "timestamp": "2026-04-21T15:29:01Z"}
{"round": 144, "iter": "iter144", "bottleneck": "memory_bound", "idea": "Test config b192x128k128s2_t128p11", "category": "tiling", "expected_gain": "explore", "decision": "DISCARD", "tflops": 252.28, "timestamp": "2026-04-21T15:29:01Z"}
{"round": 145, "iter": "iter145", "bottleneck": "memory_bound", "idea": "Test config b192x128k128s2_t128p13", "category": "tiling", "expected_gain": "explore", "decision": "DISCARD", "tflops": 252.43, "timestamp": "2026-04-21T15:29:02Z"}
{"round": 146, "iter": "iter146", "bottleneck": "memory_bound", "idea": "Test config b192x128k128s2_t128p15", "category": "tiling", "expected_gain": "explore", "decision": "DISCARD", "tflops": 248.44, "timestamp": "2026-04-21T15:29:02Z"}
{"round": 147, "iter": "iter147", "bottleneck": "memory_bound", "idea": "Test config b192x128k128s2_t128p17", "category": "tiling", "expected_gain": "explore", "decision": "KEEP", "tflops": 257.16, "timestamp": "2026-04-21T15:29:03Z"}
{"round": 148, "iter": "iter148", "bottleneck": "memory_bound", "idea": "Test config b192x128k128s2_t128p19", "category": "tiling", "expected_gain": "explore", "decision": "DISCARD", "tflops": 246.72, "timestamp": "2026-04-21T15:29:03Z"}
{"round": 149, "iter": "iter149", "bottleneck": "memory_bound", "idea": "Test config b192x128k128s2_t128p21", "category": "tiling", "expected_gain": "explore", "decision": "DISCARD", "tflops": 254.68, "timestamp": "2026-04-21T15:29:03Z"}
{"round": 150, "iter": "iter150", "bottleneck": "memory_bound", "idea": "Test config b192x128k128s2_t128p23", "category": "tiling", "expected_gain": "explore", "decision": "DISCARD", "tflops": 250.57, "timestamp": "2026-04-21T15:29:04Z"}
{"round": 151, "iter": "iter151", "bottleneck": "memory_bound", "idea": "Test config b192x128k128s2_t128p16", "category": "tiling", "expected_gain": "explore", "decision": "DISCARD", "tflops": 252.52, "timestamp": "2026-04-21T15:31:33Z"}
{"round": 152, "iter": "iter152", "bottleneck": "memory_bound", "idea": "Test config b192x128k128s2_t128p18", "category": "tiling", "expected_gain": "explore", "decision": "DISCARD", "tflops": 250.86, "timestamp": "2026-04-21T15:31:34Z"}
{"round": 153, "iter": "iter153", "bottleneck": "memory_bound", "idea": "Test config b192x128k64s3_t128p17", "category": "tiling", "expected_gain": "explore", "decision": "DISCARD", "tflops": 250.57, "timestamp": "2026-04-21T15:31:34Z"}
{"round": 154, "iter": "iter154", "bottleneck": "memory_bound", "idea": "Test config b192x128k64s2_t128p17", "category": "tiling", "expected_gain": "explore", "decision": "DISCARD", "tflops": 233.93, "timestamp": "2026-04-21T15:31:35Z"}
{"round": 155, "iter": "iter155", "bottleneck": "memory_bound", "idea": "Test config b192x128k256s1_t128p17", "category": "tiling", "expected_gain": "explore", "decision": "DISCARD", "tflops": 225.45, "timestamp": "2026-04-21T15:31:35Z"}
{"round": 156, "iter": "iter156", "bottleneck": "memory_bound", "idea": "Test config b128x128k128s2_t128p17", "category": "tiling", "expected_gain": "explore", "decision": "DISCARD", "tflops": 232.44, "timestamp": "2026-04-21T15:31:35Z"}
{"round": 157, "iter": "iter157", "bottleneck": "memory_bound", "idea": "Test config b256x128k128s1_t128p17", "category": "tiling", "expected_gain": "explore", "decision": "DISCARD", "tflops": 145.04, "timestamp": "2026-04-21T15:31:36Z"}
{"round": 158, "iter": "iter158", "bottleneck": "memory_bound", "idea": "Test config b192x192k64s2_t128p17", "category": "tiling", "expected_gain": "explore", "decision": "DISCARD", "tflops": 118.22, "timestamp": "2026-04-21T15:31:36Z"}
{"round": 159, "iter": "iter159", "bottleneck": "memory_bound", "idea": "Test config b128x192k128s2_t128p17", "category": "tiling", "expected_gain": "explore", "decision": "DISCARD", "tflops": 254.93, "timestamp": "2026-04-21T15:31:37Z"}
{"round": 160, "iter": "iter160", "bottleneck": "memory_bound", "idea": "Test config b192x128k96s2_t128p17", "category": "tiling", "expected_gain": "explore", "decision": "DISCARD", "tflops": 224.58, "timestamp": "2026-04-21T15:31:37Z"}
{"round": 161, "iter": "iter161", "bottleneck": "memory_bound", "idea": "Test config b192x128k128s2_t64p17", "category": "tiling", "expected_gain": "explore", "decision": "DISCARD", "tflops": 40.38, "timestamp": "2026-04-21T15:31:37Z"}
{"round": 162, "iter": "iter162", "bottleneck": "memory_bound", "idea": "Test config b192x128k128s2_t256p17", "category": "tiling", "expected_gain": "explore", "decision": "DISCARD", "tflops": 252.76, "timestamp": "2026-04-21T15:31:38Z"}
{"round": 163, "iter": "iter163", "bottleneck": "memory_bound", "idea": "Test config b192x128k128s1_t128p17", "category": "tiling", "expected_gain": "explore", "decision": "DISCARD", "tflops": 204.71, "timestamp": "2026-04-21T15:31:38Z"}
{"round": 164, "iter": "iter164", "bottleneck": "memory_bound", "idea": "Test config b192x64k128s2_t128p17", "category": "tiling", "expected_gain": "explore", "decision": "DISCARD", "tflops": 200.48, "timestamp": "2026-04-21T15:31:39Z"}
{"round": 165, "iter": "iter165", "bottleneck": "memory_bound", "idea": "Test config b256x64k128s2_t128p17", "category": "tiling", "expected_gain": "explore", "decision": "DISCARD", "tflops": 214.95, "timestamp": "2026-04-21T15:31:39Z"}
{"round": 166, "iter": "iter166", "bottleneck": "memory_bound", "idea": "Test config b192x128k128s2_t128p25", "category": "tiling", "expected_gain": "explore", "decision": "DISCARD", "tflops": 259.93, "timestamp": "2026-04-21T15:33:59Z"}
{"round": 167, "iter": "iter167", "bottleneck": "memory_bound", "idea": "Test config b192x128k128s2_t128p27", "category": "tiling", "expected_gain": "explore", "decision": "DISCARD", "tflops": 255.49, "timestamp": "2026-04-21T15:34:00Z"}
{"round": 168, "iter": "iter168", "bottleneck": "memory_bound", "idea": "Test config b192x128k128s2_t128p29", "category": "tiling", "expected_gain": "explore", "decision": "DISCARD", "tflops": 255.39, "timestamp": "2026-04-21T15:34:00Z"}
{"round": 169, "iter": "iter169", "bottleneck": "memory_bound", "idea": "Test config b192x128k128s2_t128p31", "category": "tiling", "expected_gain": "explore", "decision": "DISCARD", "tflops": 256.63, "timestamp": "2026-04-21T15:34:01Z"}
{"round": 170, "iter": "iter170", "bottleneck": "memory_bound", "idea": "Test config b192x128k128s2_t128p33", "category": "tiling", "expected_gain": "explore", "decision": "DISCARD", "tflops": 250.41, "timestamp": "2026-04-21T15:34:01Z"}
{"round": 171, "iter": "iter171", "bottleneck": "memory_bound", "idea": "Test config b192x128k128s2_t192p17", "category": "tiling", "expected_gain": "explore", "decision": "COMPILE_FAIL", "tflops": 0.0, "timestamp": "2026-04-21T15:34:02Z"}
{"round": 172, "iter": "iter172", "bottleneck": "memory_bound", "idea": "Test config b192x128k128s2_t96p17", "category": "tiling", "expected_gain": "explore", "decision": "COMPILE_FAIL", "tflops": 0.0, "timestamp": "2026-04-21T15:34:02Z"}
{"round": 173, "iter": "iter173", "bottleneck": "memory_bound", "idea": "Test config b192x128k128s2_t160p17", "category": "tiling", "expected_gain": "explore", "decision": "COMPILE_FAIL", "tflops": 0.0, "timestamp": "2026-04-21T15:34:02Z"}
{"round": 174, "iter": "iter174", "bottleneck": "memory_bound", "idea": "Test config b128x256k128s1_t128p17", "category": "tiling", "expected_gain": "explore", "decision": "DISCARD", "tflops": 109.28, "timestamp": "2026-04-21T15:34:03Z"}
{"round": 175, "iter": "iter175", "bottleneck": "memory_bound", "idea": "Test config b256x128k64s3_t128p17", "category": "tiling", "expected_gain": "explore", "decision": "DISCARD", "tflops": 119.92, "timestamp": "2026-04-21T15:34:03Z"}
{"round": 176, "iter": "iter176", "bottleneck": "memory_bound", "idea": "Test config b192x128k128s2_t128p35", "category": "tiling", "expected_gain": "explore", "decision": "DISCARD", "tflops": 256.91, "timestamp": "2026-04-21T15:34:04Z"}
{"round": 177, "iter": "iter177", "bottleneck": "memory_bound", "idea": "Test config b192x128k128s2_t128p37", "category": "tiling", "expected_gain": "explore", "decision": "DISCARD", "tflops": 247.39, "timestamp": "2026-04-21T15:34:04Z"}
{"round": 178, "iter": "iter178", "bottleneck": "memory_bound", "idea": "Test config b192x128k128s2_t128p39", "category": "tiling", "expected_gain": "explore", "decision": "DISCARD", "tflops": 249.19, "timestamp": "2026-04-21T15:34:04Z"}
{"round": 179, "iter": "iter179", "bottleneck": "memory_bound", "idea": "Test config b192x128k128s2_t128p64", "category": "tiling", "expected_gain": "explore", "decision": "DISCARD", "tflops": 251.68, "timestamp": "2026-04-21T15:34:05Z"}
{"round": 180, "iter": "iter180", "bottleneck": "memory_bound", "idea": "Test config b192x128k128s2_t128p48", "category": "tiling", "expected_gain": "explore", "decision": "KEEP", "tflops": 260.36, "timestamp": "2026-04-21T15:34:05Z"}
{"round": 181, "iter": "iter181", "bottleneck": "memory_bound", "idea": "Test config b192x128k128s2_t128p44", "category": "tiling", "expected_gain": "explore", "decision": "DISCARD", "tflops": 256.36, "timestamp": "2026-04-21T15:36:38Z"}
{"round": 182, "iter": "iter182", "bottleneck": "memory_bound", "idea": "Test config b192x128k128s2_t128p46", "category": "tiling", "expected_gain": "explore", "decision": "DISCARD", "tflops": 250.68, "timestamp": "2026-04-21T15:36:39Z"}
