{"round": 0, "iter": "iter000", "bottleneck": "baseline", "idea": "cuBLAS FP8 scaled_mm reference baseline", "category": "baseline", "expected_gain": "baseline reference", "decision": "KEEP", "tflops": 899.0069, "timestamp": "2026-04-20T04:09:03Z"}
{"round": 1, "iter": "iter001", "bottleneck": "memory_bound", "idea": "Baseline persistent 1p1c with 4 stages, WARP_N=128. 90% shared bank conflicts causing WGMMA serialization.", "category": "baseline", "expected_gain": "first custom kernel baseline", "decision": "KEEP", "tflops": 357.177, "timestamp": "2026-04-20T04:15:43Z"}
{"round": 2, "iter": "iter002", "bottleneck": "memory_bound", "idea": "WARP_N=256 with static CTA launch. +28% over iter001 from better compute/memory ratio.", "category": "tiling", "expected_gain": "+100-150 TFLOPS", "decision": "KEEP", "tflops": 456.438, "timestamp": "2026-04-20T04:18:07Z"}
{"round": 3, "iter": "iter003", "bottleneck": "launch_bound", "idea": "Persistent kernel WARP_N=256 with 4 stages. +8% from better SM utilization.", "category": "pipeline", "expected_gain": "+50-100 TFLOPS", "decision": "KEEP", "tflops": 492.713, "timestamp": "2026-04-20T04:20:26Z"}
{"round": 4, "iter": "iter004", "bottleneck": "latency_bound", "idea": "1p3c warp spec with TILE_M=192, 3 stages. +17.7% from better WGMMA latency hiding.", "category": "tiling", "expected_gain": "+50-100 TFLOPS", "decision": "KEEP", "tflops": 579.868, "timestamp": "2026-04-20T04:22:55Z"}
{"round": 5, "iter": "iter005", "bottleneck": "latency_bound", "idea": "WARP_N=192 with 4 stages exceeds shared memory limit.", "category": "tiling", "expected_gain": "+20-50 TFLOPS", "decision": "COMPILE_FAIL", "tflops": 0.0, "timestamp": "2026-04-20T04:24:45Z"}
{"round": 6, "iter": "iter006", "bottleneck": "latency_bound", "idea": "4 stages with 1p3c worse than 3 stages (565.7 vs 579.9). Extra stage overhead.", "category": "pipeline", "expected_gain": "+10-30 TFLOPS", "decision": "DISCARD", "tflops": 565.718, "timestamp": "2026-04-20T04:26:41Z"}
{"round": 7, "iter": "iter007", "bottleneck": "latency_bound", "idea": "Persistent 1p3c failed verification - step() pattern incompatible with TILE_M=192.", "category": "pipeline", "expected_gain": "+20-50 TFLOPS", "decision": "COMPILE_FAIL", "tflops": 0.0, "timestamp": "2026-04-20T04:29:02Z"}
{"round": 8, "iter": "iter008", "bottleneck": "latency_bound", "idea": "1p4c (5 warpgroups) much slower at 262T. Too many warpgroups hurts.", "category": "tiling", "expected_gain": "+30-80 TFLOPS", "decision": "DISCARD", "tflops": 262.145, "timestamp": "2026-04-20T04:30:48Z"}
{"round": 9, "iter": "iter009", "bottleneck": "memory_bound", "idea": "1p3c with WARP_N=256 fails verification - output store pattern wrong.", "category": "tiling", "expected_gain": "+30-60 TFLOPS", "decision": "COMPILE_FAIL", "tflops": 0.0, "timestamp": "2026-04-20T04:33:36Z"}
{"round": 10, "iter": "iter010", "bottleneck": "memory_bound", "idea": "1p2c with TILE_M=128 slower than 1p3c. Fewer consumers means less compute per tile.", "category": "tiling", "expected_gain": "+10-40 TFLOPS", "decision": "DISCARD", "tflops": 505.154, "timestamp": "2026-04-20T04:35:27Z"}
{"round": 11, "iter": "iter011", "bottleneck": "memory_bound", "idea": "WARP_N=192 fails - 8192 not divisible by 192. Scale index out of bounds.", "category": "tiling", "expected_gain": "+20-60 TFLOPS", "decision": "COMPILE_FAIL", "tflops": 0.0, "timestamp": "2026-04-20T04:37:58Z"}
{"round": 12, "iter": "iter012", "bottleneck": "memory_bound", "idea": "2 stages slightly worse than 3 stages (568 vs 579.9). 3 stages is optimal.", "category": "pipeline", "expected_gain": "+10-30 TFLOPS", "decision": "DISCARD", "tflops": 568.051, "timestamp": "2026-04-20T04:39:33Z"}
{"round": 13, "iter": "iter013", "bottleneck": "memory_bound", "idea": "WARP_N=64 with 1p3c failed TMA indexing - dimensions incompatible", "category": "tiling", "expected_gain": "+10-50 TFLOPS", "decision": "COMPILE_FAIL", "tflops": 0.0, "timestamp": "2026-04-20T04:43:01Z"}
{"round": 14, "iter": "iter014", "bottleneck": "memory_bound", "idea": "1p2c with 4 stages failed - CUDA invalid argument at TMA/indexing", "category": "pipeline", "expected_gain": "+10-50 TFLOPS", "decision": "COMPILE_FAIL", "tflops": 0.0, "timestamp": "2026-04-20T04:43:01Z"}
{"round": 15, "iter": "iter015", "bottleneck": "memory_bound", "idea": "TILE_K=64 failed - changes scale factor indexing, causing CUDA invalid argument", "category": "tiling", "expected_gain": "+10-50 TFLOPS", "decision": "COMPILE_FAIL", "tflops": 0.0, "timestamp": "2026-04-20T04:44:44Z"}
{"round": 16, "iter": "iter016", "bottleneck": "memory_bound", "idea": "Load RHS before LHS - reordering TMA loads improved memory access pattern", "category": "memory", "expected_gain": "+5-10 TFLOPS", "decision": "KEEP", "tflops": 585.491, "timestamp": "2026-04-20T05:03:15Z"}
{"round": 17, "iter": "iter017", "bottleneck": "memory_bound", "idea": "4 stages with RHS-first worse than 3 stages. More stages add smem pressure.", "category": "pipeline", "expected_gain": "+10-30 TFLOPS", "decision": "DISCARD", "tflops": 564.744, "timestamp": "2026-04-20T05:04:51Z"}
{"round": 18, "iter": "iter018", "bottleneck": "memory_bound", "idea": "WARP_N=256 with 1p3c exceeds shared memory limit (270KB > 233KB)", "category": "tiling", "expected_gain": "+10-40 TFLOPS", "decision": "COMPILE_FAIL", "tflops": 0.0, "timestamp": "2026-04-20T05:06:06Z"}
{"round": 19, "iter": "iter019", "bottleneck": "memory_bound", "idea": "TILE_M=128 with 1p2c worse. 1p3c with TILE_M=192 is better utilization.", "category": "tiling", "expected_gain": "+10-30 TFLOPS", "decision": "DISCARD", "tflops": 514.625, "timestamp": "2026-04-20T05:07:34Z"}
{"round": 20, "iter": "iter020", "bottleneck": "memory_bound", "idea": "2 stages with RHS-first worse than 3 stages. 3 stages remains optimal.", "category": "pipeline", "expected_gain": "+5-20 TFLOPS", "decision": "DISCARD", "tflops": 567.919, "timestamp": "2026-04-20T05:08:58Z"}
{"round": 21, "iter": "iter021", "bottleneck": "memory_bound", "idea": "Transposed store syntax not supported in Choreo DSL", "category": "memory", "expected_gain": "+10-30 TFLOPS", "decision": "COMPILE_FAIL", "tflops": 0.0, "timestamp": "2026-04-20T05:11:00Z"}
{"round": 22, "iter": "iter022", "bottleneck": "memory_bound", "idea": "5 stages exceeds shared memory limit (254KB > 233KB)", "category": "pipeline", "expected_gain": "+5-30 TFLOPS", "decision": "COMPILE_FAIL", "tflops": 0.0, "timestamp": "2026-04-20T05:12:17Z"}
{"round": 23, "iter": "iter023", "bottleneck": "memory_bound", "idea": "TILE_M=256 with 1p4c and 2 stages. Larger M tile improves data reuse significantly.", "category": "tiling", "expected_gain": "+10-40 TFLOPS", "decision": "KEEP", "tflops": 656.442, "timestamp": "2026-04-20T05:13:47Z"}
{"round": 24, "iter": "iter024", "bottleneck": "memory_bound", "idea": "3 stages with TILE_M=256 worse than 2 stages. 2 stages is optimal for this config.", "category": "pipeline", "expected_gain": "+10-40 TFLOPS", "decision": "DISCARD", "tflops": 622.933, "timestamp": "2026-04-20T05:15:29Z"}
{"round": 25, "iter": "iter025", "bottleneck": "memory_bound", "idea": "WARP_N=256 with 1 stage fails verification. Index math incompatible.", "category": "tiling", "expected_gain": "+10-50 TFLOPS", "decision": "COMPILE_FAIL", "tflops": 0.0, "timestamp": "2026-04-20T05:17:08Z"}
{"round": 26, "iter": "iter026", "bottleneck": "memory_bound", "idea": "WARP_N=64 with TILE_M=256 is too small. WARP_N=128 is optimal.", "category": "tiling", "expected_gain": "+10-40 TFLOPS", "decision": "DISCARD", "tflops": 415.22, "timestamp": "2026-04-20T05:19:01Z"}
{"round": 27, "iter": "iter027", "bottleneck": "memory_bound", "idea": "TILE_M=320 fails - 8192 not divisible by 320. Need divisible tile size.", "category": "tiling", "expected_gain": "+10-40 TFLOPS", "decision": "COMPILE_FAIL", "tflops": 0.0, "timestamp": "2026-04-20T05:20:32Z"}
{"round": 28, "iter": "iter028", "bottleneck": "memory_bound", "idea": "TILE_M=512 with 1p8c fails - too many warpgroups or output buffer too large", "category": "tiling", "expected_gain": "+10-50 TFLOPS", "decision": "COMPILE_FAIL", "tflops": 0.0, "timestamp": "2026-04-20T05:22:04Z"}
