{"round": 92, "iter": "iter092", "bottleneck": "latency_bound", "idea": "WARP_N=64 STAGES=8", "category": "tiling", "expected_gain": "-140 TFLOPS", "decision": "DISCARD", "tflops": 121.22, "timestamp": "2026-04-18T05:55:29Z"}
{"round": 93, "iter": "iter093", "bottleneck": "memory_bound", "idea": "STAGES=3 with stp + prepack-v2 + warpspec", "category": "pipeline", "expected_gain": "-10 TFLOPS", "decision": "DISCARD", "tflops": 253.64, "timestamp": "2026-04-18T05:55:53Z"}
{"round": 94, "iter": "iter094", "bottleneck": "memory_bound", "idea": "TILE_K=32 WARP_N=256 STAGES=5", "category": "tiling", "expected_gain": "-75 TFLOPS", "decision": "DISCARD", "tflops": 187.12, "timestamp": "2026-04-18T05:56:34Z"}
{"round": 95, "iter": "iter095", "bottleneck": "memory_bound", "idea": "single-thread-producer only", "category": "compiler", "expected_gain": "+2 TFLOPS", "decision": "KEEP", "tflops": 264.34, "timestamp": "2026-04-18T05:57:27Z"}
{"round": 97, "iter": "iter097", "bottleneck": "memory_bound", "idea": "TILE_K=32 with STAGES=4", "category": "tiling", "expected_gain": "-70 TFLOPS", "decision": "DISCARD", "tflops": 192.33, "timestamp": "2026-04-18T05:58:49Z"}
{"round": 98, "iter": "iter098", "bottleneck": "memory_bound", "idea": "O3 use_fast_math nvcc optimization", "category": "compiler", "expected_gain": "+0 TFLOPS", "decision": "DISCARD", "tflops": 261.98, "timestamp": "2026-04-18T05:59:43Z"}
{"round": 99, "iter": "iter099", "bottleneck": "memory_bound", "idea": "baseline without choreo flags", "category": "baseline", "expected_gain": "+0 TFLOPS", "decision": "DISCARD", "tflops": 263.54, "timestamp": "2026-04-18T06:00:40Z"}
{"round": 100, "iter": "iter100", "bottleneck": "memory_bound", "idea": "all flags + tma-cluster-aware", "category": "compiler", "expected_gain": "+0 TFLOPS", "decision": "DISCARD", "tflops": 262.21, "timestamp": "2026-04-18T06:01:44Z"}
{"round": 101, "iter": "iter101", "bottleneck": "memory_bound", "idea": "native-f16 only", "category": "compiler", "expected_gain": "+0 TFLOPS", "decision": "DISCARD", "tflops": 263.7, "timestamp": "2026-04-18T06:02:27Z"}
{"round": 102, "iter": "iter102", "bottleneck": "memory_bound", "idea": "hoist-scale only", "category": "compiler", "expected_gain": "+0 TFLOPS", "decision": "DISCARD", "tflops": 262.19, "timestamp": "2026-04-18T06:02:50Z"}
{"round": 103, "iter": "iter103", "bottleneck": "memory_bound", "idea": "ptx-barrier + hoist-offset", "category": "compiler", "expected_gain": "+0 TFLOPS", "decision": "DISCARD", "tflops": 262.21, "timestamp": "2026-04-18T06:03:29Z"}
{"round": 104, "iter": "iter104", "bottleneck": "memory_bound", "idea": "use-prepack-v2 only", "category": "compiler", "expected_gain": "+3 TFLOPS", "decision": "KEEP", "tflops": 265.02, "timestamp": "2026-04-18T06:03:53Z"}
{"round": 105, "iter": "iter105", "bottleneck": "memory_bound", "idea": "use-prepack-v2 + native-f16", "category": "compiler", "expected_gain": "+2 TFLOPS", "decision": "DISCARD", "tflops": 264.32, "timestamp": "2026-04-18T06:04:52Z"}
{"round": 106, "iter": "iter106", "bottleneck": "compute_bound", "idea": "Phase 2 .cu fine-tune: __launch_bounds__(256,1) + maxrregcount=154 to reduce register pressure. Kernel still uses 254 regs.", "category": "compute", "expected_gain": "+30 TFLOPS", "decision": "DISCARD", "tflops": 261.22, "timestamp": "2026-04-18T06:23:48Z"}
{"round": 107, "iter": "iter107", "bottleneck": "compute_bound", "idea": "STRUCTURAL: Persistent 1p1c warp-specialized kernel (NUM_SMS=114, WARP_N=256, STAGES=4, f32 accum). Persistent scheduling + warp specialization.", "category": "compute", "expected_gain": "+20 TFLOPS", "decision": "DISCARD", "tflops": 121.35, "timestamp": "2026-04-18T06:27:08Z"}
{"round": 108, "iter": "iter108", "bottleneck": "compute_bound", "idea": "STRUCTURAL: 1p3c warp-specialized MWG kernel TILE_M=192 WARP_N=128 STAGES=2 f32 accum. 3 consumer warp groups.", "category": "compute", "expected_gain": "+40 TFLOPS", "decision": "DISCARD", "tflops": 210.68, "timestamp": "2026-04-18T06:31:06Z"}
{"round": 109, "iter": "iter109", "bottleneck": "compute_bound", "idea": "STRUCTURAL: 1p2c MWG TILE_M=128 WARP_N=256 STAGES=2 f32. Only 256 blocks (4 M-tiles x 64 N-tiles), fewer waves than base.", "category": "compute", "expected_gain": "+30 TFLOPS", "decision": "DISCARD", "tflops": 251.08, "timestamp": "2026-04-18T06:34:03Z"}
{"round": 110, "iter": "iter110", "bottleneck": "compute_bound", "idea": "Phase 2: --ptx-barrier --hoist-offset --hoist-scale --native-f16 --tma-cluster-aware --use-warpspec choreo flags + nvcc --use_fast_math + pragma unroll on inner warp loop", "category": "compute", "expected_gain": "+10 TFLOPS", "decision": "DISCARD", "tflops": 262.07, "timestamp": "2026-04-18T06:35:41Z"}
{"round": 111, "iter": "iter111", "bottleneck": "compute_bound", "idea": "Pipeline deepening: TILE_K=32 STAGES=8 SWIZ=64. 2x deeper pipeline, same SMEM. Slower due to more loop iterations and reduced compute per iteration.", "category": "pipeline", "expected_gain": "+15 TFLOPS", "decision": "DISCARD", "tflops": 192.74, "timestamp": "2026-04-18T06:38:03Z"}
{"round": 112, "iter": "iter112", "bottleneck": "compute_bound", "idea": "STRUCTURAL: 1p2c MWG TILE_M=128 WARP_N=128 STAGES=4 f32. 192KB SMEM, 96 regs/thread. Same output size as base but warp-spec overhead hurts.", "category": "compute", "expected_gain": "+20 TFLOPS", "decision": "DISCARD", "tflops": 245.92, "timestamp": "2026-04-18T06:41:01Z"}
{"round": 113, "iter": "iter113", "bottleneck": "compute_bound", "idea": "SASS-guided: WARP_N=64 STAGES=3 to match cuBLAS HGMMA.64x64x16 shape. Only 58 regs, 64KB SMEM but too little compute per CTA.", "category": "compute", "expected_gain": "+30 TFLOPS", "decision": "DISCARD", "tflops": 180.85, "timestamp": "2026-04-18T06:42:51Z"}
{"round": 114, "iter": "iter114", "bottleneck": "compute_bound", "idea": "All choreo+nvcc flags: stp+warpspec+native-f16+hoist-offset+hoist-scale+ptx-barrier+prepack-v2+fast_math+dlcm=ca. stmatrix fails for f32 accum.", "category": "compute", "expected_gain": "+15 TFLOPS", "decision": "DISCARD", "tflops": 262.59, "timestamp": "2026-04-18T06:46:03Z"}
{"round": 115, "iter": "iter115", "bottleneck": "compute_bound", "idea": "STRUCTURAL: 1p4c MWG TILE_M=256 WARP_N=64 STAGES=3 f32. 4 consumers matching cuBLAS 64x64 MMA. 58 regs, 188KB SMEM. Producer overhead and small WARP_N hurt.", "category": "compute", "expected_gain": "+30 TFLOPS", "decision": "DISCARD", "tflops": 202.09, "timestamp": "2026-04-18T06:48:56Z"}
{"round": 116, "iter": "iter116", "bottleneck": "compute_bound", "idea": "STRUCTURAL: 1p2c MWG TILE_M=128 WARP_N=128 STAGES=4 f32 cuBLAS-mimic. 192KB SMEM, 384 threads/CTA, 512 blocks. Too much sync overhead vs 1p1c.", "category": "general", "expected_gain": "unknown", "decision": "DISCARD", "tflops": 245.914, "timestamp": "2026-04-18T06:59:52Z"}
{"round": 117, "iter": "iter117", "bottleneck": "compute_bound", "idea": "1p1c WARP_N=256 STAGES=4 with tma.copy output outside consumer block + use_fast_math. Same structure as iter017. 258 TFLOPS.", "category": "general", "expected_gain": "unknown", "decision": "DISCARD", "tflops": 257.792, "timestamp": "2026-04-18T07:03:51Z"}
{"round": 118, "iter": "iter118", "bottleneck": "compute_bound", "idea": "Phase 2: hoisted warpgroup_arrive() outside inner loop + #pragma unroll on iv_warp loop + precomputed stage offsets. Marginal improvement. 262 vs 258 TFLOPS.", "category": "general", "expected_gain": "unknown", "decision": "DISCARD", "tflops": 261.725, "timestamp": "2026-04-18T07:05:52Z"}
{"round": 119, "iter": "iter119", "bottleneck": "compute_bound", "idea": "Phase 2: batched warpgroup_commit with hoisted arrive + pragma unroll + precomputed stage offsets. Same 262 TFLOPS - compiler already optimizes these patterns.", "category": "general", "expected_gain": "unknown", "decision": "DISCARD", "tflops": 262.009, "timestamp": "2026-04-18T07:08:38Z"}
{"round": 120, "iter": "iter120", "bottleneck": "compute_bound", "idea": "STRUCTURAL: Phase 2 cluster launch 2x1x1 + TMA multicast for RHS. cudaLaunchKernelEx. Multicast mask 0x3. 258 TFLOPS. Compute-bound not memory-bound so multicast doesnt help.", "category": "general", "expected_gain": "unknown", "decision": "DISCARD", "tflops": 257.686, "timestamp": "2026-04-18T07:12:49Z"}
{"round": 121, "iter": "iter121", "bottleneck": "compute_bound", "idea": "STRUCTURAL: 1p2c TILE_M=128 WARP_N=256 STAGES=2 f32. 229KB SMEM 384 threads. 2 consumers each doing HGMMA.64x256x16. Same as iter109. 250 vs 265 TFLOPS. 1p2c overhead cancels tile benefit.", "category": "general", "expected_gain": "unknown", "decision": "DISCARD", "tflops": 250.402, "timestamp": "2026-04-18T07:16:55Z"}
{"round": 122, "iter": "iter122", "bottleneck": "compute_bound", "idea": "STRUCTURAL: 1p3c TILE_M=192 WARP_N=128 STAGES=3 f32. 216KB SMEM, 512 threads. 3 consumers. 226 TFLOPS. Partial M-tile waste and high thread count hurt.", "category": "general", "expected_gain": "unknown", "decision": "DISCARD", "tflops": 225.87, "timestamp": "2026-04-18T07:20:04Z"}
{"round": 123, "iter": "iter123", "bottleneck": "compute_bound", "idea": "STRUCTURAL: 1p1c WARP_N=128 STAGES=2 maxrregcount=128 launch_bounds(256,2) to fit 2 CTAs/SM. 80KB SMEM. 232 TFLOPS. Register spilling and smaller tile killed perf.", "category": "compute", "expected_gain": "+30 TFLOPS", "decision": "DISCARD", "tflops": 232.1, "timestamp": "2026-04-18T07:25:45Z"}
{"round": 124, "iter": "iter124", "bottleneck": "compute_bound", "idea": "STRUCTURAL: setmaxnreg register trading in 1p1c. Producer dec 40, consumer inc 216. Plus launch_bounds(256,1). 266 TFLOPS, marginal improvement over iter104.", "category": "compute", "expected_gain": "+20 TFLOPS", "decision": "KEEP", "tflops": 265.87, "timestamp": "2026-04-18T07:30:45Z"}
{"round": 125, "iter": "iter125", "bottleneck": "compute_bound", "idea": "STRUCTURAL: 1p1c WARP_N=128 STAGES=3 launch_bounds(256,2) + setmaxnreg register trading. HANG: setmaxnreg.inc deadlocks with 2 CTAs/SM - register file contention.", "category": "compute", "expected_gain": "+20 TFLOPS", "decision": "HANG", "tflops": 0.0, "timestamp": "2026-04-18T07:36:36Z"}
{"round": 126, "iter": "iter126", "bottleneck": "compute_bound", "idea": "STRUCTURAL: 1p1c WARP_N=128 STAGES=3 launch_bounds(256,2) no setmaxnreg. 104KB SMEM fits 2 CTAs/SM. Doubles occupancy from 7.7% to ~15%. 1024 grid blocks. BREAKTHROUGH: 283 TFLOPS up from 266.", "category": "tiling", "expected_gain": "+20 TFLOPS", "decision": "KEEP", "tflops": 282.61, "timestamp": "2026-04-18T07:38:44Z"}
{"round": 127, "iter": "iter127", "bottleneck": "compute_bound", "idea": "MACRO: 1p1c WARP_N=192 STAGES=2 launch_bounds(256,2). HANG: 112KB SMEM per CTA. Two CTAs = 224KB borderline. SMEM+alignment may exceed 228KB limit causing kernel hang.", "category": "tiling", "expected_gain": "+10 TFLOPS", "decision": "HANG", "tflops": 0.0, "timestamp": "2026-04-18T07:43:18Z"}
{"round": 128, "iter": "iter128", "bottleneck": "compute_bound", "idea": "MACRO: 1p1c WARP_N=128 STAGES=2 launch_bounds(256,2). 80KB SMEM. STAGES=2 too shallow for this K=16384 problem. Insufficient pipeline depth to hide memory latency.", "category": "pipeline", "expected_gain": "+5 TFLOPS", "decision": "DISCARD", "tflops": 232.6, "timestamp": "2026-04-18T07:45:05Z"}
{"round": 129, "iter": "iter129", "bottleneck": "compute_bound", "idea": "Phase 2: hoisted warpgroup_arrive + pragma unroll + precomputed stage offsets on iter126 base. 283.76 TFLOPS, marginal +1.15 over iter126.", "category": "compute", "expected_gain": "+5 TFLOPS", "decision": "KEEP", "tflops": 283.76, "timestamp": "2026-04-18T07:47:33Z"}
{"round": 130, "iter": "iter130", "bottleneck": "compute_bound", "idea": "STRUCTURAL: TILE_K=32 SWIZ=64 STAGES=4 WARP_N=128 launch_bounds(256,2). 80KB SMEM. TILE_K=32 halves compute density per K-iteration. 2x more loop iterations. 195 TFLOPS.", "category": "tiling", "expected_gain": "+10 TFLOPS", "decision": "DISCARD", "tflops": 194.83, "timestamp": "2026-04-18T07:49:45Z"}
{"round": 131, "iter": "iter131", "bottleneck": "compute_bound", "idea": "Add --use_fast_math nvcc flag + choreo --native-f16 on iter129 base", "category": "macro", "expected_gain": "unknown", "decision": "KEEP", "tflops": 284.54, "timestamp": "2026-04-18T07:52:18Z"}
{"round": 132, "iter": "iter132", "bottleneck": "compute_bound", "idea": "STRUCTURAL: Persistent kernel with atomic work-stealing loop. Barrier re-init between tiles too expensive.", "category": "structural", "expected_gain": "unknown", "decision": "DISCARD", "tflops": 119.56, "timestamp": "2026-04-18T08:00:23Z"}
{"round": 133, "iter": "iter133", "bottleneck": "compute_bound", "idea": "STRUCTURAL: WARP_N=64 STAGES=4 launch_bounds(256,2). Smaller tile, 2x more grid tiles, same occupancy. Insufficient compute per tile.", "category": "structural", "expected_gain": "unknown", "decision": "DISCARD", "tflops": 178.5, "timestamp": "2026-04-18T08:04:05Z"}
{"round": 134, "iter": "iter134", "bottleneck": "compute_bound", "idea": "MACRO: L2 promotion (L2_128B) for input TMA loads on iter131 base. No improvement on large problem size.", "category": "macro", "expected_gain": "unknown", "decision": "DISCARD", "tflops": 284.06, "timestamp": "2026-04-18T08:06:14Z"}
{"round": 135, "iter": "iter135", "bottleneck": "compute_bound", "idea": "MACRO: setmaxnreg.dec 40 for producer on iter131 base. Ignored by ptxas with launch_bounds(256,2).", "category": "macro", "expected_gain": "unknown", "decision": "DISCARD", "tflops": 283.83, "timestamp": "2026-04-18T08:09:02Z"}
{"round": 136, "iter": "iter136", "bottleneck": "compute_bound", "idea": "STRUCTURAL: WARP_N=128 TILE_K=32 STAGES=2 launch_bounds(256,3). BUILD FAIL: 64x128 WGMMA needs >80 regs, 3 CTAs limited to 80.", "category": "structural", "expected_gain": "unknown", "decision": "DISCARD", "tflops": 0.0, "timestamp": "2026-04-18T08:12:40Z"}
{"round": 137, "iter": "iter137", "bottleneck": "compute_bound", "idea": "MACRO: Relaxed warpgroup_wait<1> with deferred empty signal. Potential SMEM race condition degraded perf.", "category": "macro", "expected_gain": "unknown", "decision": "DISCARD", "tflops": 259.06, "timestamp": "2026-04-18T08:14:58Z"}
{"round": 138, "iter": "iter138", "bottleneck": "compute_bound", "idea": "STRUCTURAL: WARP_N=128 TILE_K=32 STAGES=3 launch_bounds(256,2). Halved K-tile doubles loop iters with less compute per iter. 68KB SMEM.", "category": "structural", "expected_gain": "unknown", "decision": "DISCARD", "tflops": 186.93, "timestamp": "2026-04-18T08:17:59Z"}
{"round": 139, "iter": "iter139", "bottleneck": "compute_bound", "idea": "MACRO: 1D grid with swizzled tile mapping (group=8) for L2 reuse. Worsened locality for this problem shape.", "category": "macro", "expected_gain": "unknown", "decision": "DISCARD", "tflops": 223.71, "timestamp": "2026-04-18T08:21:34Z"}
{"round": 140, "iter": "iter140", "bottleneck": "compute_bound", "idea": "STRUCTURAL: True 1p2c with 3 warp groups (384 threads). 2 consumers each with WARP_N=64. Numerical issues + lower perf.", "category": "structural", "expected_gain": "unknown", "decision": "DISCARD", "tflops": 195.7, "timestamp": "2026-04-18T08:57:06Z"}
