{"round": 0, "iter": "iter000", "bottleneck": "baseline", "idea": "cuBLAS reference baseline", "category": "baseline", "expected_gain": "baseline reference", "decision": "KEEP", "tflops": 422.7534, "timestamp": "2026-04-17T17:50:47Z"}
{"round": 1, "iter": "iter001", "bottleneck": "compute_bound", "idea": "Initial 1p1c kernel with WARP_M=64, WARP_N=128, 4 pipeline stages", "category": "tiling", "expected_gain": "Baseline custom kernel", "decision": "KEEP", "tflops": 111.96, "timestamp": "2026-04-17T17:56:25Z"}
{"round": 2, "iter": "iter002", "bottleneck": "memory_bound", "idea": "Increased WARP_N from 128 to 256 to double compute per warpgroup", "category": "tiling", "expected_gain": "+50 TFLOPS", "decision": "KEEP", "tflops": 121.91, "timestamp": "2026-04-17T17:58:19Z"}
{"round": 3, "iter": "iter003", "bottleneck": "memory_bound", "idea": "1p3c and 1p4c warp-spec kernels fail verification - incorrect output indexing for M=512", "category": "tiling", "expected_gain": "+80 TFLOPS", "decision": "DISCARD", "tflops": 0.0, "timestamp": "2026-04-17T18:02:52Z"}
{"round": 4, "iter": "iter004", "bottleneck": "memory_bound", "idea": "Non-persistent CTA launch with 512 blocks vs 114 persistent SMs", "category": "tiling", "expected_gain": "+100 TFLOPS", "decision": "KEEP", "tflops": 260.12, "timestamp": "2026-04-17T18:04:34Z"}
{"round": 5, "iter": "iter005", "bottleneck": "compute_bound", "idea": "Reduced stages 4->2 and WARP_N 256->128 hurt performance", "category": "tiling", "expected_gain": "+30 TFLOPS", "decision": "DISCARD", "tflops": 226.24, "timestamp": "2026-04-17T18:10:40Z"}
{"round": 6, "iter": "iter006", "bottleneck": "compute_bound", "idea": "SWIZ=64 caused CUDA invalid argument error", "category": "memory", "expected_gain": "+40 TFLOPS", "decision": "COMPILE_FAIL", "tflops": 0.0, "timestamp": "2026-04-17T18:12:01Z"}
{"round": 7, "iter": "iter007", "bottleneck": "compute_bound", "idea": "WARP_N=128 with step TMA worse than WARP_N=256", "category": "tiling", "expected_gain": "+20 TFLOPS", "decision": "DISCARD", "tflops": 194.31, "timestamp": "2026-04-17T18:13:21Z"}
{"round": 8, "iter": "iter008", "bottleneck": "compute_bound", "idea": "Persistent N-major iteration for better RHS cache reuse", "category": "general", "expected_gain": "+30 TFLOPS", "decision": "DISCARD", "tflops": 121.52, "timestamp": "2026-04-17T18:18:41Z"}
{"round": 9, "iter": "iter009", "bottleneck": "unknown", "idea": "Reduce WARP_N to 128 to lower shared memory usage and improve occupancy", "category": "general", "expected_gain": "+30 TFLOPS", "decision": "DISCARD", "tflops": 0.0, "timestamp": "2026-04-17T18:24:49Z"}
{"round": 10, "iter": "iter010", "bottleneck": "unknown", "idea": "Add --hoist-offset and --hoist-scale compiler flags", "category": "general", "expected_gain": "+20 TFLOPS", "decision": "DISCARD", "tflops": 37.45, "timestamp": "2026-04-17T18:26:15Z"}
{"round": 11, "iter": "iter011", "bottleneck": "unknown", "idea": "Use --stmatrix compiler flag (incompatible with f32 accumulators)", "category": "general", "expected_gain": "+20 TFLOPS", "decision": "DISCARD", "tflops": 0.0, "timestamp": "2026-04-17T18:27:10Z"}
{"round": 12, "iter": "iter012", "bottleneck": "unknown", "idea": "Use --ptx-barrier flag for PTX mbarrier synchronization", "category": "general", "expected_gain": "+20 TFLOPS", "decision": "DISCARD", "tflops": 37.45, "timestamp": "2026-04-17T18:28:32Z"}
{"round": 13, "iter": "iter013", "bottleneck": "unknown", "idea": "Reduce pipeline stages from 4 to 3", "category": "general", "expected_gain": "+20 TFLOPS", "decision": "DISCARD", "tflops": 37.42, "timestamp": "2026-04-17T18:29:52Z"}
{"round": 14, "iter": "iter014", "bottleneck": "unknown", "idea": "Reduce TILE_K from 64 to 32", "category": "general", "expected_gain": "+10 TFLOPS", "decision": "DISCARD", "tflops": 84.6, "timestamp": "2026-04-17T18:33:21Z"}
{"round": 15, "iter": "iter015", "bottleneck": "compute_bound", "idea": "WARP_N=128 with 6 stages", "category": "general", "expected_gain": "+20 TFLOPS", "decision": "DISCARD", "tflops": 259.83, "timestamp": "2026-04-17T18:34:39Z"}
{"round": 16, "iter": "iter016", "bottleneck": "unknown", "idea": "1p2c warp specialization (failed verification)", "category": "general", "expected_gain": "+50 TFLOPS", "decision": "DISCARD", "tflops": 0.0, "timestamp": "2026-04-17T18:36:36Z"}
{"round": 17, "iter": "iter017", "bottleneck": "compute_bound", "idea": "Same kernel with --single-thread-producer flag (no significant change)", "category": "general", "expected_gain": "+20 TFLOPS", "decision": "DISCARD", "tflops": 349.73, "timestamp": "2026-04-17T18:37:43Z"}
{"round": 18, "iter": "iter018", "bottleneck": "compute_bound", "idea": "--use-warpspec + --single-thread-producer flags", "category": "general", "expected_gain": "+20 TFLOPS", "decision": "DISCARD", "tflops": 312.07, "timestamp": "2026-04-17T18:38:37Z"}
{"round": 19, "iter": "iter019", "bottleneck": "compute_bound", "idea": "--tma-cluster-aware flag (263 vs 351 TFLOPS)", "category": "general", "expected_gain": "+20 TFLOPS", "decision": "DISCARD", "tflops": 263.43, "timestamp": "2026-04-17T18:39:37Z"}
{"round": 20, "iter": "iter020", "bottleneck": "compute_bound", "idea": "SWIZ=64 with TILE_K=32", "category": "general", "expected_gain": "+10 TFLOPS", "decision": "DISCARD", "tflops": 261.43, "timestamp": "2026-04-17T18:40:38Z"}
{"round": 21, "iter": "iter021", "bottleneck": "compute_bound", "idea": "native-f16 flag", "category": "general", "expected_gain": "+5 TFLOPS", "decision": "DISCARD", "tflops": 347.451, "timestamp": "2026-04-17T18:41:45Z"}
{"round": 22, "iter": "iter022", "bottleneck": "compute_bound", "idea": "WARP_N=128 with 8 stages", "category": "general", "expected_gain": "+20 TFLOPS", "decision": "DISCARD", "tflops": 262.732, "timestamp": "2026-04-17T18:43:01Z"}
{"round": 23, "iter": "iter023", "bottleneck": "latency_bound", "idea": "2 stages for better occupancy", "category": "general", "expected_gain": "+20 TFLOPS", "decision": "DISCARD", "tflops": 79.863, "timestamp": "2026-04-17T18:44:04Z"}
{"round": 24, "iter": "iter024", "bottleneck": "latency_bound", "idea": "Persistent 3-stage kernel", "category": "general", "expected_gain": "+30 TFLOPS", "decision": "DISCARD", "tflops": 175.744, "timestamp": "2026-04-17T18:47:05Z"}
{"round": 25, "iter": "iter025", "bottleneck": "compute_bound", "idea": "WARP_N=64 for more blocks", "category": "general", "expected_gain": "+30 TFLOPS", "decision": "DISCARD", "tflops": 235.476, "timestamp": "2026-04-17T18:48:59Z"}
{"round": 26, "iter": "iter026", "bottleneck": "memory_bound", "idea": "prepack-v2 for coalesced loads", "category": "general", "expected_gain": "+10 TFLOPS", "decision": "DISCARD", "tflops": 326.333, "timestamp": "2026-04-17T18:50:35Z"}
{"round": 27, "iter": "iter027", "bottleneck": "latency_bound", "idea": "TILE_K=16 SWIZ=32", "category": "general", "expected_gain": "+20 TFLOPS", "decision": "DISCARD", "tflops": 147.886, "timestamp": "2026-04-17T18:51:40Z"}
{"round": 28, "iter": "iter028", "bottleneck": "latency_bound", "idea": "WARP_N=128 8 stages", "category": "general", "expected_gain": "+30 TFLOPS", "decision": "DISCARD", "tflops": 80.99, "timestamp": "2026-04-17T18:52:40Z"}
{"round": 29, "iter": "iter029", "bottleneck": "compute_bound", "idea": "prepack-v2 + single-thread-producer", "category": "general", "expected_gain": "+15 TFLOPS", "decision": "DISCARD", "tflops": 340.266, "timestamp": "2026-04-17T18:53:28Z"}
{"round": 30, "iter": "iter030", "bottleneck": "compute_bound", "idea": "native-f16 + single-thread-producer", "category": "general", "expected_gain": "+10 TFLOPS", "decision": "DISCARD", "tflops": 341.692, "timestamp": "2026-04-17T18:54:20Z"}
{"round": 31, "iter": "iter031", "bottleneck": "compute_bound", "idea": "TILE_M=128 (2x warpgroup rows) - kernel hung", "category": "tiling", "expected_gain": "+30 TFLOPS", "decision": "HANG", "tflops": 0.0, "timestamp": "2026-04-18T05:07:58Z"}
{"round": 34, "iter": "iter034", "bottleneck": "memory_bound", "idea": "WARP_N=128 with 3 stages (106KB SMEM)", "category": "tiling", "expected_gain": "+50 TFLOPS", "decision": "DISCARD", "tflops": 251.8, "timestamp": "2026-04-18T05:10:50Z"}
{"round": 35, "iter": "iter035", "bottleneck": "memory_bound", "idea": "WARP_N=192 with 5 stages - nvcc error", "category": "tiling", "expected_gain": "+30 TFLOPS", "decision": "COMPILE_FAIL", "tflops": 0.0, "timestamp": "2026-04-18T05:12:11Z"}
{"round": 36, "iter": "iter036", "bottleneck": "memory_bound", "idea": "TILE_K=32 with 6 stages (188KB SMEM) - worse than TILE_K=64", "category": "tiling", "expected_gain": "+20 TFLOPS", "decision": "DISCARD", "tflops": 184.53, "timestamp": "2026-04-18T05:13:54Z"}
{"round": 37, "iter": "iter037", "bottleneck": "memory_bound", "idea": "WARP_N=256 with 2 stages (147KB SMEM)", "category": "pipeline", "expected_gain": "+20 TFLOPS", "decision": "DISCARD", "tflops": 209.5, "timestamp": "2026-04-18T05:14:38Z"}
{"round": 38, "iter": "iter038", "bottleneck": "memory_bound", "idea": "WARP_N=256 with 3 stages (188KB SMEM)", "category": "pipeline", "expected_gain": "+20 TFLOPS", "decision": "DISCARD", "tflops": 253.67, "timestamp": "2026-04-18T05:15:07Z"}
{"round": 39, "iter": "iter039", "bottleneck": "memory_bound", "idea": "5 stages exceeded SMEM limit", "category": "pipeline", "expected_gain": "+10 TFLOPS", "decision": "COMPILE_FAIL", "tflops": 0.0, "timestamp": "2026-04-18T05:15:18Z"}
{"round": 40, "iter": "iter040", "bottleneck": "memory_bound", "idea": "4 stages with --hoist-offset --hoist-scale flags", "category": "compiler", "expected_gain": "+10 TFLOPS", "decision": "DISCARD", "tflops": 262.21, "timestamp": "2026-04-18T05:15:44Z"}
{"round": 41, "iter": "iter041", "bottleneck": "memory_bound", "idea": "--ptx-barrier flag", "category": "compiler", "expected_gain": "+10 TFLOPS", "decision": "DISCARD", "tflops": 262.05, "timestamp": "2026-04-18T05:16:24Z"}
{"round": 42, "iter": "iter042", "bottleneck": "memory_bound", "idea": "--tma-cluster-aware flag", "category": "compiler", "expected_gain": "+10 TFLOPS", "decision": "DISCARD", "tflops": 264.94, "timestamp": "2026-04-18T05:16:49Z"}
{"round": 43, "iter": "iter043", "bottleneck": "memory_bound", "idea": "N-major iteration - kernel hung", "category": "iteration", "expected_gain": "+20 TFLOPS", "decision": "HANG", "tflops": 0.0, "timestamp": "2026-04-18T05:18:24Z"}
{"round": 44, "iter": "iter044", "bottleneck": "memory_bound", "idea": "prepack-v2 without native-f16", "category": "compiler", "expected_gain": "+10 TFLOPS", "decision": "DISCARD", "tflops": 263.82, "timestamp": "2026-04-18T05:19:09Z"}
{"round": 45, "iter": "iter045", "bottleneck": "memory_bound", "idea": "WARP_N=160 - kernel hung or very slow", "category": "tiling", "expected_gain": "+15 TFLOPS", "decision": "HANG", "tflops": 0.0, "timestamp": "2026-04-18T05:20:01Z"}
{"round": 46, "iter": "iter046", "bottleneck": "memory_bound", "idea": "WARP_N=64 with 4 stages (81KB SMEM) - too little compute per CTA", "category": "tiling", "expected_gain": "+30 TFLOPS", "decision": "DISCARD", "tflops": 179.66, "timestamp": "2026-04-18T05:20:45Z"}
{"round": 47, "iter": "iter047", "bottleneck": "memory_bound", "idea": "WARP_N=224 - kernel hung (N=16384 not evenly divisible)", "category": "tiling", "expected_gain": "+10 TFLOPS", "decision": "HANG", "tflops": 0.0, "timestamp": "2026-04-18T05:22:21Z"}
{"round": 48, "iter": "iter048", "bottleneck": "memory_bound", "idea": "WARP_N=128 with 5 stages (155KB SMEM)", "category": "pipeline", "expected_gain": "+20 TFLOPS", "decision": "DISCARD", "tflops": 184.46, "timestamp": "2026-04-18T05:23:02Z"}
{"round": 49, "iter": "iter049", "bottleneck": "memory_bound", "idea": "6 stages with WARP_N=256 exceeds SMEM", "category": "pipeline", "expected_gain": "+10 TFLOPS", "decision": "COMPILE_FAIL", "tflops": 0.0, "timestamp": "2026-04-18T05:23:29Z"}
{"round": 50, "iter": "iter050", "bottleneck": "memory_bound", "idea": "TILE_K=32 SWIZ=64 with 8 stages (229KB SMEM)", "category": "pipeline", "expected_gain": "+10 TFLOPS", "decision": "DISCARD", "tflops": 193.39, "timestamp": "2026-04-18T05:24:01Z"}
{"round": 51, "iter": "iter051", "bottleneck": "memory_bound", "idea": "--use-warpspec flag", "category": "compiler", "expected_gain": "+5 TFLOPS", "decision": "DISCARD", "tflops": 262.16, "timestamp": "2026-04-18T05:24:42Z"}
{"round": 52, "iter": "iter052", "bottleneck": "memory_bound", "idea": "single-thread-producer + tma-cluster-aware + hoist flags", "category": "compiler", "expected_gain": "+5 TFLOPS", "decision": "DISCARD", "tflops": 262.16, "timestamp": "2026-04-18T05:25:20Z"}
{"round": 53, "iter": "iter053", "bottleneck": "memory_bound", "idea": "WARP_N=128 with 4 stages (131KB SMEM)", "category": "tiling", "expected_gain": "+20 TFLOPS", "decision": "DISCARD", "tflops": 191.93, "timestamp": "2026-04-18T05:26:06Z"}
{"round": 54, "iter": "iter054", "bottleneck": "memory_bound", "idea": "all optimization flags combined", "category": "compiler", "expected_gain": "+5 TFLOPS", "decision": "DISCARD", "tflops": 262.58, "timestamp": "2026-04-18T05:26:46Z"}
{"round": 55, "iter": "iter055", "bottleneck": "memory_bound", "idea": "SWIZ=64 with TILE_K=64 - CUDA invalid argument", "category": "memory", "expected_gain": "+10 TFLOPS", "decision": "SEGFAULT", "tflops": 0.0, "timestamp": "2026-04-18T05:27:44Z"}
{"round": 56, "iter": "iter056", "bottleneck": "memory_bound", "idea": "TILE_K=128 needs SWIZ=256 which is unsupported", "category": "memory", "expected_gain": "+10 TFLOPS", "decision": "COMPILE_FAIL", "tflops": 0.0, "timestamp": "2026-04-18T05:28:06Z"}
{"round": 57, "iter": "iter057", "bottleneck": "latency_bound", "idea": "WARP_N=32 with 8 stages - too little compute per CTA", "category": "tiling", "expected_gain": "+30 TFLOPS", "decision": "DISCARD", "tflops": 103.35, "timestamp": "2026-04-18T05:28:50Z"}
{"round": 58, "iter": "iter058", "bottleneck": "memory_bound", "idea": "TILE_K=32 with WARP_N=256 (147KB SMEM)", "category": "tiling", "expected_gain": "+20 TFLOPS", "decision": "DISCARD", "tflops": 193.07, "timestamp": "2026-04-18T05:29:35Z"}
{"round": 59, "iter": "iter059", "bottleneck": "memory_bound", "idea": "3 stages with hoist-offset and hoist-scale flags (188KB SMEM)", "category": "pipeline", "expected_gain": "+10 TFLOPS", "decision": "DISCARD", "tflops": 254.25, "timestamp": "2026-04-18T05:30:35Z"}
{"round": 60, "iter": "iter060", "bottleneck": "compute_bound", "idea": "WARP_K=8 - preprocessor error when removing constraint", "category": "tiling", "expected_gain": "+10 TFLOPS", "decision": "COMPILE_FAIL", "tflops": 0.0, "timestamp": "2026-04-18T05:30:55Z"}
{"round": 61, "iter": "iter061", "bottleneck": "memory_bound", "idea": "--use-warpspec without --single-thread-producer", "category": "compiler", "expected_gain": "+5 TFLOPS", "decision": "DISCARD", "tflops": 261.22, "timestamp": "2026-04-18T05:31:41Z"}
{"round": 62, "iter": "iter062", "bottleneck": "memory_bound", "idea": "STAGES=2 with WARP_N=256", "category": "pipeline", "expected_gain": "+5 TFLOPS", "decision": "DISCARD", "tflops": 211.36, "timestamp": "2026-04-18T05:32:20Z"}
{"round": 63, "iter": "iter063", "bottleneck": "memory_bound", "idea": "TILE_K=32 STAGES=7", "category": "pipeline", "expected_gain": "+5 TFLOPS", "decision": "DISCARD", "tflops": 185.37, "timestamp": "2026-04-18T05:33:31Z"}
{"round": 64, "iter": "iter064", "bottleneck": "memory_bound", "idea": "WARP_N=128 STAGES=4", "category": "tiling", "expected_gain": "+5 TFLOPS", "decision": "DISCARD", "tflops": 193.8, "timestamp": "2026-04-18T05:33:55Z"}
{"round": 65, "iter": "iter065", "bottleneck": "memory_bound", "idea": "--single-thread-producer + --use-prepack-v2", "category": "compiler", "expected_gain": "+5 TFLOPS", "decision": "DISCARD", "tflops": 262.19, "timestamp": "2026-04-18T05:34:36Z"}
{"round": 66, "iter": "iter066", "bottleneck": "memory_bound", "idea": "Full optimization flags combo", "category": "compiler", "expected_gain": "+5 TFLOPS", "decision": "DISCARD", "tflops": 262.72, "timestamp": "2026-04-18T05:35:54Z"}
{"round": 67, "iter": "iter067", "bottleneck": "memory_bound", "idea": "STAGES=3 with full opt flags", "category": "pipeline", "expected_gain": "+5 TFLOPS", "decision": "DISCARD", "tflops": 253.6, "timestamp": "2026-04-18T05:36:23Z"}
{"round": 68, "iter": "iter068", "bottleneck": "memory_bound", "idea": "WARP_N=128 STAGES=5 with full opt", "category": "pipeline", "expected_gain": "+5 TFLOPS", "decision": "DISCARD", "tflops": 186.74, "timestamp": "2026-04-18T05:36:56Z"}
{"round": 69, "iter": "iter069", "bottleneck": "memory_bound", "idea": "TILE_K=32 STAGES=8 for deeper pipeline", "category": "pipeline", "expected_gain": "+10 TFLOPS", "decision": "DISCARD", "tflops": 191.85, "timestamp": "2026-04-18T05:37:41Z"}
{"round": 70, "iter": "iter070", "bottleneck": "memory_bound", "idea": "WARP_N=64 for more blocks", "category": "tiling", "expected_gain": "+5 TFLOPS", "decision": "DISCARD", "tflops": 179.8, "timestamp": "2026-04-18T05:38:19Z"}
{"round": 71, "iter": "iter071", "bottleneck": "memory_bound", "idea": "Same config with single-thread-producer + native-f16", "category": "compiler", "expected_gain": "+5 TFLOPS", "decision": "DISCARD", "tflops": 262.13, "timestamp": "2026-04-18T05:38:54Z"}
{"round": 72, "iter": "iter072", "bottleneck": "unknown", "idea": "WARP_N=192 does not divide 16384 evenly", "category": "tiling", "expected_gain": "+5 TFLOPS", "decision": "HANG", "tflops": 0.0, "timestamp": "2026-04-18T05:40:17Z"}
{"round": 73, "iter": "iter073", "bottleneck": "memory_bound", "idea": "native-f16 only without single-thread-producer", "category": "compiler", "expected_gain": "+5 TFLOPS", "decision": "DISCARD", "tflops": 262.19, "timestamp": "2026-04-18T05:40:52Z"}
{"round": 74, "iter": "iter074", "bottleneck": "latency_bound", "idea": "TILE_K=16 STAGES=12 - too small tiles", "category": "tiling", "expected_gain": "+5 TFLOPS", "decision": "DISCARD", "tflops": 113.11, "timestamp": "2026-04-18T05:41:14Z"}
{"round": 75, "iter": "iter075", "bottleneck": "memory_bound", "idea": "ptx-barrier flag only", "category": "compiler", "expected_gain": "+5 TFLOPS", "decision": "DISCARD", "tflops": 262.1, "timestamp": "2026-04-18T05:41:49Z"}
{"round": 76, "iter": "iter076", "bottleneck": "memory_bound", "idea": "Baseline config without compiler flags", "category": "baseline", "expected_gain": "+0 TFLOPS", "decision": "DISCARD", "tflops": 262.13, "timestamp": "2026-04-18T05:45:51Z"}
{"round": 78, "iter": "iter078", "bottleneck": "memory_bound", "idea": "stp + native-f16 + hoist-offset/scale + ptx-barrier", "category": "compiler", "expected_gain": "+5 TFLOPS", "decision": "DISCARD", "tflops": 262.84, "timestamp": "2026-04-18T05:47:47Z"}
{"round": 79, "iter": "iter079", "bottleneck": "memory_bound", "idea": "all flags + tma-cluster-aware", "category": "compiler", "expected_gain": "+5 TFLOPS", "decision": "DISCARD", "tflops": 262.13, "timestamp": "2026-04-18T05:48:14Z"}
{"round": 80, "iter": "iter080", "bottleneck": "memory_bound", "idea": "stp + native-f16 + hoist flags + ptx-barrier + use-warpspec", "category": "compiler", "expected_gain": "+5 TFLOPS", "decision": "DISCARD", "tflops": 264.41, "timestamp": "2026-04-18T05:48:42Z"}
{"round": 81, "iter": "iter081", "bottleneck": "memory_bound", "idea": "all flags + use-prepack-v2", "category": "compiler", "expected_gain": "+5 TFLOPS", "decision": "DISCARD", "tflops": 262.13, "timestamp": "2026-04-18T05:49:09Z"}
{"round": 82, "iter": "iter082", "bottleneck": "memory_bound", "idea": "stp + native-f16 + hoist + warpspec (no ptx-barrier)", "category": "compiler", "expected_gain": "+5 TFLOPS", "decision": "DISCARD", "tflops": 262.17, "timestamp": "2026-04-18T05:49:36Z"}
{"round": 83, "iter": "iter083", "bottleneck": "memory_bound", "idea": "best combo flags re-test", "category": "compiler", "expected_gain": "+0 TFLOPS", "decision": "DISCARD", "tflops": 262.17, "timestamp": "2026-04-18T05:50:13Z"}
{"round": 84, "iter": "iter084", "bottleneck": "memory_bound", "idea": "stp + native-f16 + hoist + ptx-barrier + use-warpspec", "category": "compiler", "expected_gain": "+3 TFLOPS", "decision": "KEEP", "tflops": 265.1, "timestamp": "2026-04-18T05:50:57Z"}
{"round": 85, "iter": "iter085", "bottleneck": "memory_bound", "idea": "WARP_N=128 STAGES=6 with best flags", "category": "tiling", "expected_gain": "-80 TFLOPS", "decision": "DISCARD", "tflops": 182.3, "timestamp": "2026-04-18T05:51:41Z"}
{"round": 86, "iter": "iter086", "bottleneck": "unknown", "idea": "STAGES=5 with WARP_N=256 - SMEM exceeded", "category": "pipeline", "expected_gain": "+0 TFLOPS", "decision": "COMPILE_FAIL", "tflops": 0.0, "timestamp": "2026-04-18T05:51:54Z"}
{"round": 87, "iter": "iter087", "bottleneck": "memory_bound", "idea": "TILE_K=32 STAGES=6 with best flags", "category": "tiling", "expected_gain": "-80 TFLOPS", "decision": "DISCARD", "tflops": 184.81, "timestamp": "2026-04-18T05:52:21Z"}
{"round": 88, "iter": "iter088", "bottleneck": "memory_bound", "idea": "use-warpspec alone", "category": "compiler", "expected_gain": "+0 TFLOPS", "decision": "DISCARD", "tflops": 263.28, "timestamp": "2026-04-18T05:53:22Z"}
{"round": 89, "iter": "iter089", "bottleneck": "memory_bound", "idea": "stp + use-warpspec", "category": "compiler", "expected_gain": "+0 TFLOPS", "decision": "DISCARD", "tflops": 262.09, "timestamp": "2026-04-18T05:53:48Z"}
{"round": 90, "iter": "iter090", "bottleneck": "memory_bound", "idea": "stp + ptx-barrier + use-warpspec", "category": "compiler", "expected_gain": "+2 TFLOPS", "decision": "DISCARD", "tflops": 264.42, "timestamp": "2026-04-18T05:54:36Z"}
{"round": 91, "iter": "iter091", "bottleneck": "unknown", "idea": "TILE_K=48 with SWIZ=96 - invalid swizzle", "category": "tiling", "expected_gain": "+0 TFLOPS", "decision": "COMPILE_FAIL", "tflops": 0.0, "timestamp": "2026-04-18T05:55:01Z"}
