{"round": 0, "iter": "iter000", "bottleneck": "baseline", "idea": "cuBLAS reference baseline", "category": "baseline", "expected_gain": "baseline reference", "decision": "KEEP", "tflops": 225.3185, "timestamp": "2026-04-19T15:30:11Z"}
{"round": 1, "iter": "iter001", "bottleneck": "mixed", "idea": "Baseline 7-kernel fused MoE pipeline from tutorial (00_baseline.co)", "category": "misc", "expected_gain": "N/A baseline", "decision": "KEEP", "tflops": 0.262, "timestamp": "2026-04-19T15:50:58Z"}
{"round": 2, "iter": "iter002", "bottleneck": "launch_bound", "idea": "Fuse scatter into WGMMA, count+build, quant+sort+gather to reduce 7 kernels to 4", "category": "misc", "expected_gain": "+30x TFLOPS", "decision": "KEEP", "tflops": 0.431, "timestamp": "2026-04-19T15:55:33Z"}
{"round": 3, "iter": "iter003", "bottleneck": "launch_bound", "idea": "Apply all tutorial optimizations: parallel.async, grid swap, L2 persistence, QSG pipelining, Hillis-Steele scan, CUDA Graphs. DMA falls back to scalar copies (alignment issue).", "category": "pipeline", "expected_gain": "+30x from 0.43 to ~13 TFLOPS", "decision": "KEEP", "tflops": 0.47, "timestamp": "2026-04-19T16:04:11Z"}
{"round": 4, "iter": "iter004", "bottleneck": "latency_bound", "idea": "Replace opt_copy (scalar 32-bit loads) with cp.async tiled_copy using SM80_CP_ASYNC_CACHEALWAYS<uint128_t> for LHS DMA. 128-bit coalesced loads via cp.async pipeline eliminate 60% L1TEX stalls.", "category": "memory", "expected_gain": "+25x from 0.47 to ~12 TFLOPS", "decision": "KEEP", "tflops": 12.07, "timestamp": "2026-04-19T16:16:30Z"}
{"round": 5, "iter": "iter005", "bottleneck": "memory_bound", "idea": "Add __restrict__ to all kernel pointer params and --use_fast_math. +1.3% vs iter004.", "category": "compute", "expected_gain": "+1-2%", "decision": "KEEP", "tflops": 12.23, "timestamp": "2026-04-19T16:21:05Z"}
{"round": 6, "iter": "iter006", "bottleneck": "memory_bound", "idea": "Remove --maxrregcount=224 to allow more registers. Slightly worse, register cap helps occupancy.", "category": "compute", "expected_gain": "+0-1%", "decision": "DISCARD", "tflops": 12.1, "timestamp": "2026-04-19T16:22:03Z"}
{"round": 7, "iter": "iter007", "bottleneck": "memory_bound", "idea": "Double-buffer K-loop pipelining (sA+sB x2). Regressed 7.2% due to doubled shared memory (49KB) reducing occupancy.", "category": "memory", "expected_gain": "+5-10%", "decision": "DISCARD", "tflops": 11.35, "timestamp": "2026-04-19T16:29:56Z"}
{"round": 8, "iter": "iter008", "bottleneck": "memory_bound", "idea": "Added #pragma unroll to warp loops, fragment init, and scatter loops. No effect \u2014 compiler already unrolling at -O3.", "category": "compute", "expected_gain": "+0-2%", "decision": "DISCARD", "tflops": 12.23, "timestamp": "2026-04-19T16:35:27Z"}
{"round": 9, "iter": "iter009", "bottleneck": "memory_bound", "idea": "Reduced maxrregcount from 224 to 128 for higher occupancy. Severe regression (-14%) from register spilling outweighing occupancy gains.", "category": "compute", "expected_gain": "+2-5%", "decision": "DISCARD", "tflops": 10.5, "timestamp": "2026-04-19T16:36:28Z"}
{"round": 10, "iter": "iter010", "bottleneck": "memory_bound", "idea": "Changed cp.async from CACHEALWAYS to CACHEGLOBAL for LHS loads \u2014 bypass L1 for streaming data, frees L1 for scatter atomicAdd. +0.4% gain.", "category": "memory", "expected_gain": "+0-2%", "decision": "KEEP", "tflops": 12.27, "timestamp": "2026-04-19T16:37:48Z"}
{"round": 11, "iter": "iter011", "bottleneck": "memory_bound", "idea": "Changed L2 persistence from LHS to scatter output. Regressed 10% \u2014 LHS benefits more from L2 pinning due to cross-expert reuse.", "category": "memory", "expected_gain": "+1-3%", "decision": "DISCARD", "tflops": 11.0, "timestamp": "2026-04-19T16:39:12Z"}
{"round": 12, "iter": "iter012", "bottleneck": "memory_bound", "idea": "Preloaded scale_b into registers + CACHEGLOBAL. Severe regression (-24%) from register spilling due to 16 extra floats per thread.", "category": "memory", "expected_gain": "+0-2%", "decision": "DISCARD", "tflops": 9.3, "timestamp": "2026-04-19T16:42:25Z"}
{"round": 13, "iter": "iter013", "bottleneck": "memory_bound", "idea": "Added -Xptxas -dlcm=cg for all loads. No change \u2014 CACHEGLOBAL already explicit on LHS.", "category": "memory", "expected_gain": "+0-1%", "decision": "DISCARD", "tflops": 12.25, "timestamp": "2026-04-19T16:44:56Z"}
{"round": 14, "iter": "iter014", "bottleneck": "memory_bound", "idea": "Double-buffer only RHS TMA sB 16KB keeping LHS single-buffered. Total shared 40KB. TMA prefetch next K-tile before WGMMA. Regressed 3.4% due to C7520 WGMMA serialization from divergent TMA barriers and increased shared memory reducing occupancy.", "category": "pipeline", "expected_gain": "+5-10% TFLOPS", "decision": "DISCARD", "tflops": 11.85, "timestamp": "2026-04-19T22:10:31Z"}
{"round": 15, "iter": "iter015", "bottleneck": "memory_bound", "idea": "Added __launch_bounds__(128, 2) to all 3 WGMMA kernels. No measurable improvement - compiler already optimizing register usage well at 168 regs.", "category": "compute", "expected_gain": "+1-3% TFLOPS", "decision": "DISCARD", "tflops": 12.26, "timestamp": "2026-04-19T22:13:58Z"}
{"round": 16, "iter": "iter016", "bottleneck": "memory_bound", "idea": "Moved warpgroup_commit_batch+wait inside K-loop before scale_accumulator. Eliminates compiler-injected C7517 warpgroup.wait/arrive. Same perf as iter010 - compiler was already handling this correctly.", "category": "compute", "expected_gain": "+2-5% TFLOPS", "decision": "DISCARD", "tflops": 12.27, "timestamp": "2026-04-19T22:17:12Z"}
{"round": 17, "iter": "iter017", "bottleneck": "memory_bound", "idea": "STRUCTURAL: Replace cp.async LHS loads with TMA bulk tensor copy, freeing all 128 threads from memory load work. Only thread 0 issues TMA for both LHS and RHS via single barrier. Eliminates cp.async fence+wait pattern.", "category": "memory", "expected_gain": "+5% TFLOPS", "decision": "KEEP", "tflops": 12.88, "timestamp": "2026-04-19T22:21:41Z"}
{"round": 18, "iter": "iter018", "bottleneck": "memory_bound", "idea": "Reduce register pressure from 168 to 128 via maxrregcount=128 to increase occupancy from 18.75% to ~31%. Register spilling hurt more than occupancy gain helped.", "category": "compute", "expected_gain": "+5-10% TFLOPS", "decision": "DISCARD", "tflops": 11.84, "timestamp": "2026-04-19T22:24:50Z"}
{"round": 19, "iter": "iter019", "bottleneck": "memory_bound", "idea": "STRUCTURAL: Double-buffer both LHS and RHS TMA loads with 2 barriers. Prologue+prefetch overlap. C7520 WGMMA serialization warning persisted due to conditional TMA issue. Doubled shared memory to 49KB. Regression from 12.88 to 12.07 TFLOPS.", "category": "pipeline", "expected_gain": "+5-15% TFLOPS", "decision": "DISCARD", "tflops": 12.07, "timestamp": "2026-04-19T22:31:34Z"}
{"round": 20, "iter": "iter020", "bottleneck": "memory_bound", "idea": "Change global load cache policy to cache-global (-Xptxas -dlcm=cg) bypassing L1 for streaming loads. No measurable change vs iter017 baseline (12.88 vs 12.89).", "category": "memory", "expected_gain": "+2-5% TFLOPS", "decision": "DISCARD", "tflops": 12.89, "timestamp": "2026-04-19T22:34:02Z"}
{"round": 21, "iter": "iter021", "bottleneck": "memory_bound", "idea": "STRUCTURAL: Overlap TMA prefetch with scale_accumulator. Prologue issues TMA for k=0, loop body: wait TMA, WGMMA, commit+wait, issue TMA for k+1, then scale_accumulator runs while TMA is in flight. Single-buffer approach avoids C7520.", "category": "pipeline", "expected_gain": "+3-8% TFLOPS", "decision": "KEEP", "tflops": 12.96, "timestamp": "2026-04-19T22:39:25Z"}
{"round": 22, "iter": "iter022", "bottleneck": "memory_bound", "idea": "Prefetch scale_a and scale_b into registers before TMA wait and WGMMA. Inline scale+accumulate loop replaces scale_accumulator function call, using prefetched values. Eliminates global memory loads from critical path.", "category": "memory", "expected_gain": "+2-5% TFLOPS", "decision": "KEEP", "tflops": 13.0, "timestamp": "2026-04-19T22:43:02Z"}
{"round": 23, "iter": "iter023", "bottleneck": "memory_bound", "idea": "Prefetch scatter metadata (sorted_route_ids, topk_weights) into registers and unroll scatter loops. No measurable improvement - scatter epilogue is not on critical path (runs once per M-tile vs 16x K-loop).", "category": "memory", "expected_gain": "+1-3% TFLOPS", "decision": "DISCARD", "tflops": 13.0, "timestamp": "2026-04-19T22:45:50Z"}
{"round": 24, "iter": "iter024", "bottleneck": "memory_bound", "idea": "STRUCTURAL: Swap K/M loop order so RHS loaded once per K-tile, shared across M-tiles. Massive regression to 7.67 TFLOPS due to doubled barrier synchronization count (48 vs 32) and reduced TMA batch efficiency (separate 16KB+8KB vs combined 24KB).", "category": "loop_structure", "expected_gain": "+10-20% TFLOPS", "decision": "DISCARD", "tflops": 7.67, "timestamp": "2026-04-19T22:58:43Z"}
{"round": 25, "iter": "iter025", "bottleneck": "memory_bound", "idea": "Preload all 16 scale_a and scale_b values into registers before K-loop. Regression to 12.02T due to register pressure (48 extra registers causing spilling to local memory).", "category": "memory", "expected_gain": "+2-5% TFLOPS", "decision": "DISCARD", "tflops": 12.02, "timestamp": "2026-04-19T23:01:51Z"}
{"round": 26, "iter": "iter026", "bottleneck": "memory_bound", "idea": "Add pragma unroll to K-loop, WGMMA inner loop, scatter column loop. No improvement - nvcc -O3 already unrolls these small constant-bound loops.", "category": "compiler_hints", "expected_gain": "+0.5-2% TFLOPS", "decision": "DISCARD", "tflops": 13.0, "timestamp": "2026-04-19T23:04:18Z"}
{"round": 27, "iter": "iter027", "bottleneck": "memory_bound", "idea": "Move TMA issue before warpgroup_wait. INCORRECT: causes shared memory hazard - TMA overwrites sA/sB while WGMMA still reading. Verification failed.", "category": "pipeline", "expected_gain": "+1-3% TFLOPS", "decision": "DISCARD", "tflops": 0.0, "timestamp": "2026-04-19T23:06:52Z"}
{"round": 28, "iter": "iter028", "bottleneck": "memory_bound", "idea": "Reduce maxrregcount from 224 to 160. Spilling offsets occupancy gain. No net improvement (12.99 vs 13.00 TFLOPS).", "category": "occupancy", "expected_gain": "+3-8% TFLOPS", "decision": "DISCARD", "tflops": 12.99, "timestamp": "2026-04-19T23:08:14Z"}
{"round": 29, "iter": "iter029", "bottleneck": "memory_bound", "idea": "Changed L2 persistence from LHS to output buffer. Regression to 12.97T - LHS persistence is more valuable than output persistence.", "category": "memory", "expected_gain": "+0.5-2% TFLOPS", "decision": "DISCARD", "tflops": 12.97, "timestamp": "2026-04-19T23:10:36Z"}
